"question_flag","answer_flag","interjection_flag","speech_flag","petition_flag","quote_flag","motionnospeech_flag","chamber_flag","non_speech_flag","speaker_no","name","name.id","electorate","party","role","page.no","content","subdebateinfo","debateinfo","path","Speaker","Time","Other"
"0","0","1","0","0","0","0","1","0","36","GIBSON, William","KAY","N/A","N/A","N/A","332","What is the estimated cost of administration of this scheme?","N/A","UNEMPLOYMENT AND SICKNESS BENEFITS BILL 1944","/hansard/chamber.xscript/debate[4]/speech[6]/interjection[5]/talk.start/para","N/A","N/A","N/A"
"0","0","0","1","0","0","0","1","0","37","FRASER, James","KKR","N/A","ALP","N/A","332","The total cost is estimated at £300,000 annually, which is much less than the cost of administering the New Zealand scheme. Clause agreed to. Clause 8 agreed to. Clause 9 (Determination of claims).","N/A","UNEMPLOYMENT AND SICKNESS BENEFITS BILL 1944","/hansard/chamber.xscript/debate[4]/speech[6]/continue[3]/talk.start/para","N/A","N/A","N/A"
"0","0","0","1","0","0","0","1","0","38","GIBSON, William","KAY","Victoria","N/A","N/A","332","No mention is made in the bill of a right of appeal. Is no provision made for appeal from the decision of the Director-General? Apparently, an applicant will not have the right of appeal.","N/A","UNEMPLOYMENT AND SICKNESS BENEFITS BILL 1944","/hansard/chamber.xscript/debate[4]/speech[7]/talk.start/para","N/A","N/A","N/A"
"0","0","0","1","0","0","0","1","0","39","MCLACHLAN, Alexander","KTR","SOUTH AUSTRALIA","NAT","N/A","332","Clause 10 provides for an appeal from the Director-General to the Director-General - from Tweedledum to Tweedledee. So far as I can see, there can be no appeal by an applicant under the dictatorial set-up of the scheme. Clause 9 simply states that the Director-General may determine claims for benefit. Apparently, it rests with the Director-General to re-open matters which he himself has determined. That does not place an unsuccessful applicant in a very happy position, because once the Director-General has determined a case he is not likely to alter his decision. Therefore, many cases of hardship may arise.","N/A","UNEMPLOYMENT AND SICKNESS BENEFITS BILL 1944","/hansard/chamber.xscript/debate[4]/speech[8]/talk.start/para","N/A","N/A","N/A"
"0","0","1","0","0","0","0","1","0","40","FRASER, James","KKR","N/A","ALP","N/A","332","The appeal provisions under the Invalid and Old-age Pensions Act will apply under this legislation.","N/A","UNEMPLOYMENT AND SICKNESS BENEFITS BILL 1944","/hansard/chamber.xscript/debate[4]/speech[8]/interjection/talk.start/para","N/A","N/A","N/A"
"0","0","0","1","0","0","0","1","0","41","N/A","N/A","N/A","N/A","N/A","N/A","Clause agreed to. Clauses 10 to 14 agreed to. Clause 15 -","N/A","UNEMPLOYMENT AND SICKNESS BENEFITS BILL 1944","/hansard/chamber.xscript/debate[4]/speech[8]/para[2]","N/A","N/A","N/A"
"0","0","0","0","0","1","0","1","0","42","MCLACHLAN, Alexander","KTR","N/A","N/A","N/A","N/A","Subject to this act, every person (not being a person in receipt of, or qualified to receive, a pension) who-","N/A","UNEMPLOYMENT AND SICKNESS BENEFITS BILL 1944","/hansard/chamber.xscript/debate[4]/speech[8]/quote/para","N/A","N/A","N/A"
"0","0","0","1","0","0","0","1","0","42","MCLACHLAN, Alexander","KTR","N/A","N/A","N/A","N/A","is residing in Australia and has been continuously so resident for a period of not less than one year immediately prior to the date of the claim; and shall be qualified to receiveunemployment benefit.","N/A","UNEMPLOYMENT AND SICKNESS BENEFITS BILL 1944","/hansard/chamber.xscript/debate[4]/speech[8]/list/item/para","N/A","N/A","N/A"
"0","0","0","1","0","0","0","1","0","43","GIBSON, William","KAY","Victoria","N/A","N/A","332","The qualification of one year's residence in Australia is absurd, particularly when we remember that a person must reside for at least twenty years in this country before he can qualify for the old-age pension. It is important to bear in mind that we now have in Australia thousands of people who cannot speak the English language, and, already, many of them are applying for permission to remain here. Should they have resided in Australia for twelve months before this measure comes into operation they will be entitled to sickness and unemployment benefits immediately the scheme is implemented. The residential benefit should be limited to naturalized subjects. The people to whom I refer are not British subjects. I also point out that a person coming to this country at the age of 50 years cannot qualify for the old-age pension until he reaches the age of 70 years. After twelve months' residence in Australia, he can qualify for benefits under this measure until he reaches the age of 65 years. That leaves a period of five years during which he will not be able to draw benefits either from this measure or the old-age pension. We should rectify that anomaly. Unless the Minister can give a good reason for a residential qualification period of twelve months, I propose to move an amendment that the period be three years.","N/A","UNEMPLOYMENT AND SICKNESS BENEFITS BILL 1944","/hansard/chamber.xscript/debate[4]/speech[9]/talk.start/para","N/A","N/A","N/A"
"0","0","0","1","0","0","0","1","0","44","FRASER, James","KKR","WESTERN AUSTRALIA","ALP","Minister for Health and Minister for Social Services","333","I cannot follow the logic of the honorable senator. The benefits to be provided under this measure are in respect of temporary incapacity, whereas the old-age pension is in an entirely different category. It is obvious that we shall not be able to rely solely upon the inflow of people of British stock in our efforts to populate this country. We shall be sadly disappointed if we do so, although every honorable senator would prefer solely British migrants. However, we shall be obliged to look for migrants from other countries. The foreigners to whom the honorable senator refers, if they are employed in this country, will pay income tax like every other citizen, and, in that case should they become temporarily incapacitated no one will deny them the right to sickness and unemployment benefits under this measure, provided they have resided in Australia for a period of at least twelve months.","N/A","UNEMPLOYMENT AND SICKNESS BENEFITS BILL 1944","/hansard/chamber.xscript/debate[4]/speech[10]/talk.start/para","N/A","N/A","N/A"
"0","0","0","1","0","0","0","1","0","45","GIBSON, William","KAY","Victoria","N/A","N/A","333","I am not satisfied with the Minister's explanation. The people to whom I refer are prisoners of war, of whom from 6,000 to 8,000 are now in this country. To-day, they are working on farms, and many of them hope to remain in Australia. What will be their position under this legislation? Should they be held here as prisoners of war for a period of twelve months before this scheme is implemented they will qualify for benefits immediately this legislation is put into operation, even though they have not paid any income tax. They are not paying tax now. The Government should either increase the residential qualification period to three years, or confine the qualification period of twelve months now proposed to British subjects.","N/A","UNEMPLOYMENT AND SICKNESS BENEFITS BILL 1944","/hansard/chamber.xscript/debate[4]/speech[11]/talk.start/para","N/A","N/A","N/A"
"0","0","0","1","0","0","0","1","0","46","FRASER, James","KKR","WESTERN AUSTRALIA","ALP","Minister for Health and Minister for Social Services","333","It is the responsibility of the Government to look after prisoners of war so long as they remain in the country. Should they decide, after the cessation of hostilities, to remain here they should be entitled to benefits subject to the provisions of this bill. Amendment (by 'Senator Gibson) proposed -","N/A","UNEMPLOYMENT AND SICKNESS BENEFITS BILL 1944","/hansard/chamber.xscript/debate[4]/speech[12]/talk.start/para","N/A","N/A","N/A"
"0","0","0","0","0","1","0","1","0","46","FRASER, James","KKR","N/A","N/A","N/A","N/A","That the word ' person ', first occurring, be left out with a view to insert in lieu thereof the words ' British subject '.","N/A","UNEMPLOYMENT AND SICKNESS BENEFITS BILL 1944","/hansard/chamber.xscript/debate[4]/speech[12]/quote/para","N/A","N/A","N/A"
"0","0","0","1","0","0","0","1","0","47","WILSON, Keith Cameron","KBH","South Australia","N/A","N/A","333","I support the amendment. We know that there are numbers of prisoners of war now in this country who have been fighting against us. Already, they have been resident in Australia, perhaps much against their own will, for periods exceeding twelve months. They have not contributed anything to the revenue of this country in taxes or in any other way.","N/A","UNEMPLOYMENT AND SICKNESS BENEFITS BILL 1944","/hansard/chamber.xscript/debate[4]/speech[13]/talk.start/para","N/A","N/A","N/A"
"0","0","1","0","0","0","0","1","0","48","FRASER, James","KKR","N/A","ALP","N/A","333","They are not residents.","N/A","UNEMPLOYMENT AND SICKNESS BENEFITS BILL 1944","/hansard/chamber.xscript/debate[4]/speech[13]/interjection[1]/talk.start/para","N/A","N/A","N/A"
"0","0","0","1","0","0","0","1","0","49","WILSON, Keith Cameron","KBH","N/A","N/A","N/A","333","Then what are they?","N/A","UNEMPLOYMENT AND SICKNESS BENEFITS BILL 1944","/hansard/chamber.xscript/debate[4]/speech[13]/continue[1]/talk.start/para","N/A","N/A","N/A"
"0","0","1","0","0","0","0","1","0","50","FRASER, James","KKR","N/A","ALP","N/A","333","They are prisoners of war.","N/A","UNEMPLOYMENT AND SICKNESS BENEFITS BILL 1944","/hansard/chamber.xscript/debate[4]/speech[13]/interjection[2]/talk.start/para","N/A","N/A","N/A"
"0","0","0","1","0","0","0","1","0","51","WILSON, Keith Cameron","KBH","N/A","N/A","N/A","333","Are they members of the Labour party?","N/A","UNEMPLOYMENT AND SICKNESS BENEFITS BILL 1944","/hansard/chamber.xscript/debate[4]/speech[13]/continue[2]/talk.start/para","N/A","N/A","N/A"
"0","0","1","0","0","0","0","1","0","52","FRASER, James","KKR","N/A","ALP","N/A","333","It would be no reflection on them if they were.","N/A","UNEMPLOYMENT AND SICKNESS BENEFITS BILL 1944","/hansard/chamber.xscript/debate[4]/speech[13]/interjection[3]/talk.start/para","N/A","N/A","N/A"
"0","0","0","1","0","0","0","1","0","53","WILSON, Keith Cameron","KBH","N/A","N/A","N/A","333","The basis on which the Government suggests that the bill is contributory is that claimants under it will already have contributed by means of taxes. There are in this country many people who have been residing here temporarily and have not contributed anything and never will contribute anything, yet this clause entitles them in certain conditions, as Senator Gibson points out, to receive £5, £6 or more every week while unemployed.","N/A","UNEMPLOYMENT AND SICKNESS BENEFITS BILL 1944","/hansard/chamber.xscript/debate[4]/speech[13]/continue[3]/talk.start/para","N/A","N/A","N/A"
"0","0","0","1","0","0","0","1","0","54","FOLL, Hattil","JZD","Queensland","N/A","N/A","333","The amendment has a good deal to commend it in relation to people who are at present enemy aliens, but it should be much more limited in its operation than it will be as at present worded, because it will cut out a number of very friendly people who have come into Australia from adjoining countries. They include a number of Dutch and others, who we hope will stay here. We have also admitted a quota of refugees from Europe under the agreement made at a European conference, in which we participated. It would be unwise to exclude from the benefits under the bill everybody who is not of British origin. If the amendment were aimed only at enemy aliens, it would be in a different category, but I cannot support it as it is now framed, because it may bit as many friends as foes.","N/A","UNEMPLOYMENT AND SICKNESS BENEFITS BILL 1944","/hansard/chamber.xscript/debate[4]/speech[14]/talk.start/para","N/A","N/A","N/A"
"0","0","0","1","0","0","0","1","0","55","ARMSTRONG, John Ignatius","K0C","New South Wales","N/A","N/A","334","I am certain that if this clause were inserted for only one purpose, namely, to encourage immigration, it should not be interfered with. We have all recognized, especially in the last two or three year3, that the future of this country will depend on the number of men and women we can induce to live in it. It has always been admitted that the best immigrant is the Australianborn baby. Babies have been arriving in satisfactory numbers in the last twelve months, but the stream may slacken off in the years immediately after the war, and we must recognize that the only way to build up our population rapidly is to encourage immigration. That can best be done by making others think this country better than the ones in which they live. If we cannot guarantee everybody permanent employment, we should at least offer economic security, and that is what this bill helps to do. Does the fact that people have fought against us on the battlefield and are now prisoners of war in this country make them degraded, inhuman or bad in themselves? Will they necessarily, be bad citizens if we allow them to stay here after the war? Whether they remain here will have to be decided by the higher authorities. If their record shows that they will not be *in acquisition to Australia, they will have to leave the country. If they are allowed to stay, every benefit that this country can confer must be made available to them. Only in such ways can we secure an influx of population without which our people must ultimately perish. I definitely oppose any legislation that will discourage desirable people from coming to this country. If the encouragement of immigration is the only purpose of the clause, at is a good one and should be endorsed.","N/A","UNEMPLOYMENT AND SICKNESS BENEFITS BILL 1944","/hansard/chamber.xscript/debate[4]/speech[15]/talk.start/para","N/A","N/A","N/A"
"0","0","0","1","0","0","0","1","0","56","MCLEAY, George","KUA","South Australia","N/A","leader of the Opposition","334","I should have no objection to the clause if the whole scheme were put on a contributory basis, and I do not think that Senator Gibson would have any objection to it either. I suggest that the means test depends on the method of financing the scheme. If the Minister will agree, I suggest that the consideration of clauses 15 to 41 inclusive he postponed until after the consideration of clause 42.","N/A","UNEMPLOYMENT AND SICKNESS BENEFITS BILL 1944","/hansard/chamber.xscript/debate[4]/speech[16]/talk.start/para","N/A","N/A","N/A"
"0","0","0","1","0","0","0","1","0","57","FRASER, James","KKR","N/A","ALP","N/A","334","I am agreeable. Motion (by Senator McLeay) agreed to-","N/A","UNEMPLOYMENT AND SICKNESS BENEFITS BILL 1944","/hansard/chamber.xscript/debate[4]/speech[16]/continue[1]/talk.start/para","N/A","N/A","N/A"
"0","0","0","0","0","1","0","1","0","57","FRASER, James","KKR","N/A","N/A","N/A","N/A","That further consideration of clause 15, and consideration of clauses 10 to 41 be postponed until after consideration of clause 42.","N/A","UNEMPLOYMENT AND SICKNESS BENEFITS BILL 1944","/hansard/chamber.xscript/debate[4]/speech[16]/quote[1]/para","N/A","N/A","N/A"
"0","0","0","1","0","0","0","1","0","57","FRASER, James","KKR","N/A","N/A","N/A","N/A","Clause 42-","N/A","UNEMPLOYMENT AND SICKNESS BENEFITS BILL 1944","/hansard/chamber.xscript/debate[4]/speech[16]/para[2]","N/A","N/A","N/A"
"0","0","0","0","0","1","0","1","0","57","FRASER, James","KKR","N/A","N/A","N/A","N/A","Payments of benefit shall be made out of the Trust Account established under the National Welfare Fund Act 1943 and known as the National Welfare Fund.","N/A","UNEMPLOYMENT AND SICKNESS BENEFITS BILL 1944","/hansard/chamber.xscript/debate[4]/speech[16]/quote[2]/para","N/A","N/A","N/A"
"0","0","0","1","0","0","0","1","0","58","MCLEAY, George","KUA","N/A","N/A","N/A","334","During the second-reading debate extensive references were made to the method of raising funds to provide the proposed benefits. In my- opinion, the fund should be established on a contributory basis. It is not necessary to repeat the arguments which have been advanced during the last two days. There is no need for me to move an amendment, and, if I did move one, it might be ruled out of order, on the ground that this chamber had no power to increase the burden on the taxpayer. All that is necessary, in order to indicate our attitude, is for those who favour the contributory system to vote against the clause.","N/A","UNEMPLOYMENT AND SICKNESS BENEFITS BILL 1944","/hansard/chamber.xscript/debate[4]/speech[16]/continue[2]/talk.start/para","N/A","N/A","N/A"
"0","0","0","1","0","0","0","1","0","59","ARNOLD, James","K0N","New South Wales","N/A","N/A","334","Will the Leader of the Opposition (Senator McLeay) explain what he means by a contributory scheme? Anybody who .pays money may be said to contribute. There are so many contributory schemes in existence that I should like to know what the honorable senator has in mind. Does he favour contributions being made by three parties or only by the employees and employers?","N/A","UNEMPLOYMENT AND SICKNESS BENEFITS BILL 1944","/hansard/chamber.xscript/debate[4]/speech[17]/talk.start/para","N/A","N/A","N/A"
"0","0","0","1","0","0","0","1","0","60","COOPER, Walter","JQP","Queensland","N/A","N/A","334","I also desire further information as to the purpose of the Leader of the Opposition (Senator McLeay). Contributions can be made by different methods. I am in favour of the collection of contributions, but I am ako in favour of the contributions being made by a graduated scale of tax on incomes. If the Leader of the Opposition means contributions under a tri-partite scheme, by the employee, the employer and the Government, I am not in favour of it. If, -however, he will definitely indicate that he means a scheme whereby contribution's are collected for a specific purpose, the individual who makes the payment knowing that he is paying a certain amount in order to obtain a specific benefit, and that what he pays is to go to a fund set aside for the purpose-, then I shall support him. Is that what he means?","N/A","UNEMPLOYMENT AND SICKNESS BENEFITS BILL 1944","/hansard/chamber.xscript/debate[4]/speech[18]/talk.start/para","N/A","N/A","N/A"
"0","0","0","1","0","0","0","1","0","61","LARGE, William","KQH","New South Wales","N/A","N/A","335","The assertion which honorable senators opposite have so frequently made, 'that they will not agree to the scheme unless it is on a contributory basis, seems to me to be altogether wide of 'the mark. The clause shows that the benefit is to be paid out of 'a trust fund established under the National Welfare Fund Act passed last year. That fund was created by means of a special tax, 'and the Labour party incurred 'a great deal of odium by agreeing to tax the lower range of incomes. The -criticism was particularly virulent against us, because we had always claimed that 'we did not stand for such taxation, but we found that, in Order to establish the fund, we had apparently to depart from our age-old policy. We made that departure because there 'had been so much talk of establishing a new order that we desired to implement it as a guarantee of good faith before the war ended. We felt that we were justified in asking the low wage-earners to 'contribute something towards that fund. We had in mind the fact that tinder the 'Government's scheme of soci'al services many workers would be -saved the 'contributions which 'they were making to certain institutions in return for benefits such as hospital expenses and 'free medicine. Honorable senators opposite have argued that this 'scheme 'should he on a contributory basis, but I -point out that 'as the measure stands, it will be the low wage-eaThers and the workers generally who will he largely responsible for building up the fund out 'of which these benefits will -be paid. Opposition Senators.*- No! At least the fund will be provided by all -taxpayers. It is 'to be 'financed entirely by 'taxes imposed for that specific purpose, and it is begging the question to talk about a contributory system. The National Welfare Fund has already been established to finance mea-, sures such as this.","N/A","UNEMPLOYMENT AND SICKNESS BENEFITS BILL 1944","/hansard/chamber.xscript/debate[4]/speech[19]/talk.start/para","N/A","N/A","N/A"
"0","0","0","1","0","0","0","1","0","62","LAMP, Charles","KQF","Tasmania","N/A","N/A","335","I believe that this scheme is on the right financial basis, namely, a graduated tax upon incomes. Honorable senators will recall that I was one of those who protested most vigorously against the reduction of the income tax exemption from £156 to £104. The only justification which was offered for that reduction was the establishment of a National Welfare Fund. Apparently honorable senators opposite would prefer a contributory scheme under which a flat rate of tax would be imposed, but I am afraid that any legislation on those lines would meet the same fate as the National Health and Pensions Insurance Act, and 'would never be put into operation.","N/A","UNEMPLOYMENT AND SICKNESS BENEFITS BILL 1944","/hansard/chamber.xscript/debate[4]/speech[20]/talk.start/para","N/A","N/A","N/A"
"0","0","0","1","0","0","0","1","0","63","ARNOLD, James","K0N","New South Wales","N/A","N/A","335","I am anxious to understand clearly the attitude of the Opposition in regard to this matter, because I am afraid that there is some confusion in the minds of honorable senators opposite as to what they really want. I was under the impression that members of the Opposition had told the .Senate that they desired a graduated, tax on incomes .to finance this measure. Opposition Senators. - No. Apparently I am wrong .in that assumption. My impression w>as that Senator Cooper had made clear to the Opposition tike recommendations of the Social Security Committee, and that the Opposition had agreed almost unanimously that those recommendations were just what was required. But now it appears that the Opposition does not -agree with those proposals. The Leader Of the Opposition ' (Senator McLeay) says that he favours a contributory -ada erne. Does lie mean a three-party insurance scheme of 'some 'kind, 'or is he satisfied with the graduated tax that ls already in operation, with the proviso that the tax shall bo so dissected that the 'contribution .in respect 'o'f Social security may be placed 'on one -side, a*nd the -contribution in respecof consolidated revenue upon the other? Is that what the honorable senator wishes or is his argument about a contributory scheme purely a catch phrase?","N/A","UNEMPLOYMENT AND SICKNESS BENEFITS BILL 1944","/hansard/chamber.xscript/debate[4]/speech[21]/talk.start/para","N/A","N/A","N/A"
"0","0","0","1","0","0","0","1","0","64","MCBRIDE, Philip","KOL","South Australia","N/A","N/A","336","I thought that I had made my attitude upon this matter quite clear during my second-reading speech. I contend that the first essential of a measure such as this is that it should offer some real security to the prospective beneficiaries; secondly, it should be on a contributory basis. We all know that when the Government introduced legislation providing for the setting up of a National Welfare Fund. it did so for a specific purpose. The Government was not willing to invade the lower incomes for taxation purposes solely to finance the war. It had to put a sugar coating on the pill, in the form of promises that if the low wage-earners submitted to these taxes, they would be recompensed in the future by means of social services. The proposal was that £30,000,000 should be put into a special fund every year to finance social service schemes which were to be brought into operation from time to time; but last night the Minister for Trade and Customs (Senator Keane) made the most astonishing admission that the Treasurer (Mr. Chifley) had already raided this fund. Of course we all knew that the money would not be put into that fund and allowed to remain there untouched, but that it would be used for the real purpose for which it was collected, namely the prosecution of the war - and a very proper purpose too. However, we find now that before any of the schemes for which the fund was constituted have been brought into operation, the fund has already been tapped. I suggest that we cannot hold very much hope for security in the future, if in time of war, when money is obtainable from the public and from other sources in amounts which would be regarded as fantastic in time of peace, the Treasurer finds his financial difficulties such that he has to raid this fund. I do not propose to mislead the people of this country by supporting a measure of this kind, based as it is upon unsound financial principles. I believe that social services should be financed by direct contributions, and, personally, I favour the New Zealand or the British scheme, but in any case, I appose this clause because it . is mere sham and humbug for the .Minister for Social Services (Senator Fraser) to say that the prospective beneficiaries are already contributing to this scheme. If the Government is sincere in this matter, let it dissect income-tax payments so that every taxpayer will know the amount which he is contributing to social services. Then the obligation would .be upon the Treasurer to ensure that the money which he has collected foi social services has been used for that purpose. For the Minister to' say that this is a contributory scheme because all taxpayers are already contributing to it is misleading. This measure does not bring the taxpayer into direct relation with the -benefits which he hopes to receive. On those grounds I shall oppose the clause.","N/A","UNEMPLOYMENT AND SICKNESS BENEFITS BILL 1944","/hansard/chamber.xscript/debate[4]/speech[22]/talk.start/para","N/A","N/A","N/A"
