"question_flag","answer_flag","interjection_flag","speech_flag","petition_flag","quote_flag","motionnospeech_flag","chamber_flag","non_speech_flag","speaker_no","name","name.id","electorate","party","role","page.no","content","subdebateinfo","debateinfo","path","Speaker","Time","Other"
"0","0","0","0","0","0","0","1","1","1","N/A","N/A","N/A","N/A","N/A","N/A","The President (Senator the Hon.. Gordon Brown) took the chair at 3 p.m. and read prayers.","N/A","N/A","/hansard/chamber.xscript/business.start/para","N/A","N/A","N/A"
"1","0","0","0","0","0","0","1","0","2","GIBSON, William","KAY","N/A","N/A","N/A","2274","Can the Minister for Supply and Shipping saywhen primary producers may expect supplies of galvanized wire, wire netting and iron? Are supplies of these materials available at New South Wales ports, and if so, can arrangements he made to ship some.urgently to Victoria?","GALVANIZED WIRE, WIRE NETTING AND IRON","QUESTIONS","/hansard/chamber.xscript/debate[1]/subdebate.1[1]/question/talk.start/para","N/A","N/A","N/A"
"0","1","0","0","0","0","0","1","0","3","ASHLEY, William","K0W","N/A","ALP","N/A","2274","The honorable senator suggests that there are stocks of these materials available at New South Wales ports and that they cannot beshipped to other States because of transport difficulties. This matter was raised in the Senate repeatedly by the Opposition prior to the last elections. Immediately after the last period of the present session of Parliament, I had 150 waterside workers brought from Brisbane, where things were slack, to Newcastle, and within three weeks the back-lag of cargo at that port had been cleared. There is a small back-lag at Newcastle at present, but that is a general condition in the absence of sufficient ships to provide an adequate service. The shippingtonnage available has to be used as economically as possible, and the endeavour of the Australian Shipping Board has always been to distribute cargo equitably. I assure the honorable senator that the Government is endeavouring tohavewhatever materials that are available especially those referred to by the honorable senator, . and building materialstransported as speedily as possible.","GALVANIZED WIRE, WIRE NETTING AND IRON","QUESTIONS","/hansard/chamber.xscript/debate[1]/subdebate.1[1]/answer/talk.start/para","N/A","N/A","N/A"
"0","0","0","0","0","0","0","1","1","4","N/A","N/A","N/A","N/A","N/A","N/A","Frequency Modulation","BROADCASTING","QUESTIONS","/hansard/chamber.xscript/debate[1]/subdebate.1[2]/para","N/A","N/A","N/A"
"1","0","0","0","0","0","0","1","0","5","N/A","N/A","N/A","N/A","N/A","N/A","On the 7th May, 1947, Senator Finlay asked the following question: -","BROADCASTING","QUESTIONS","/hansard/chamber.xscript/debate[1]/subdebate.1[2]/question/para[1]","N/A","N/A","N/A"
"0","0","0","0","0","1","0","1","0","6","ASHLEY, William","K0W","N/A","N/A","N/A","N/A","In the absence of the Postmaster-General,I ask the Leader of the Senate what progress- has been made by the Government with respect t>> the report presented by the Broadcasting Committee in relation to frequency modulation?","BROADCASTING","QUESTIONS","/hansard/chamber.xscript/debate[1]/subdebate.1[2]/question/quote/para","N/A","N/A","N/A"
"1","0","0","0","0","0","0","1","0","6","ASHLEY, William","K0W","N/A","N/A","N/A","N/A","I have to inform the honorable senator that the report of the Broadcasting Com.mittee concerning frequency modulation has been the subject of a submission to Cabinet by me. Consideration is being r von by a sub-committee of Cabinet to all the questions raised in the submission concerning, riot only Frequency modulation, but also other matters. In due course, the policy of the Government on r 1, (,se matters will be announced by me.","BROADCASTING","QUESTIONS","/hansard/chamber.xscript/debate[1]/subdebate.1[2]/question/para[2]","N/A","N/A","N/A"
"0","0","0","0","0","0","0","1","1","7","N/A","N/A","N/A","N/A","N/A","N/A","Dispute in Sydney","SHIPPING","QUESTIONS","/hansard/chamber.xscript/debate[1]/subdebate.1[3]/para","N/A","N/A","N/A"
"1","0","0","0","0","0","0","1","0","8","SAMPSON, Burford","K3L","N/A","N/A","N/A","2275","Has a ship loaded with valuable cargo been held up in Sydney for more than two months because of a dispute on board the vessel? If so, what steps, if any, are toeing taken to get this ship to sea?","SHIPPING","QUESTIONS","/hansard/chamber.xscript/debate[1]/subdebate.1[3]/question/talk.start/para","N/A","N/A","N/A"
"0","1","0","0","0","0","0","1","0","9","ASHLEY, William","K0W","N/A","ALP","N/A","2275","I understand that a ship has been held up in Sydney owing to some dispute. Steps have been taken, and are still being taken, to have the vessel cleared.","SHIPPING","QUESTIONS","/hansard/chamber.xscript/debate[1]/subdebate.1[3]/answer/talk.start/para","N/A","N/A","N/A"
"1","0","0","0","0","0","0","1","0","10","LAMP, Charles","KQF","N/A","N/A","N/A","2275","Owing to the great shortage of linen and cotton- goods in hospitals, will the Minister for Trade and. Customs explain what is being done to import some of these goods for this essential use?","LINEN AND COTTON GOODS","QUESTIONS","/hansard/chamber.xscript/debate[1]/subdebate.1[4]/question[1]/talk.start/para","N/A","N/A","N/A"
"0","1","0","0","0","0","0","1","0","11","COURTICE, Benjamin","JQY","N/A","ALP","N/A","2275","The Government is making every endeavour to secure linen, cotton and rayon goods for the ^people of Australia. These commodities are in short supply all over the world. A mission has been sent to Japan with a view to purchasing these materials, but I' understand that so far it. has not -obtain any substantial quantities. I assure the honorable senator that the Government appreciates fully the serious shortage of cotton goods in this country, mid is doing every tiling possible to meet the situation.","LINEN AND COTTON GOODS","QUESTIONS","/hansard/chamber.xscript/debate[1]/subdebate.1[4]/answer[1]/talk.start/para","N/A","N/A","N/A"
"1","0","0","0","0","0","0","1","0","12","LAMP, Charles","KQF","N/A","N/A","N/A","2275","With further reference to the shortage of linen and cotton goods in hospitals, I have been assured that adequate supplies are obtainable in India. Will the Minister for Trade andCustoms investigate the position and ascertain whether that is a fact?","LINEN AND COTTON GOODS","QUESTIONS","/hansard/chamber.xscript/debate[1]/subdebate.1[4]/question[2]/talk.start/para","N/A","N/A","N/A"
"0","1","0","0","0","0","0","1","0","13","COURTICE, Benjamin","JQY","N/A","N/A","N/A","2275","I shall be very pleased if the honorable senator can supply me with the names and addresses of people in India who can supply these badly needed goods to Australia. I assure him that the Government is fully alive to the necessity for- obtaining these goods. Every effort will be made, to obtain them from India or from any other country in which supplies are. available.","LINEN AND COTTON GOODS","QUESTIONS","/hansard/chamber.xscript/debate[1]/subdebate.1[4]/answer[2]/talk.start/para","N/A","N/A","N/A"
"0","0","1","0","0","0","0","1","0","14","LAMP, Charles","KQF","N/A","ALP","N/A","2275","I shall have much pleasure in supplying the information for which the Minister has asked.","LINEN AND COTTON GOODS","QUESTIONS","/hansard/chamber.xscript/debate[1]/subdebate.1[4]/answer[2]/interjection/talk.start/para","N/A","N/A","N/A"
"1","0","0","0","0","0","0","1","0","15","COLLETT, Herbert","K7M","N/A","N/A","N/A","2275","Is the Minister for Trade and Customs aware of any unusual shortage of sugar in the Australian Capital Territory? Has the Minister received from the hotelkeepers of Canberra representations to the effect that, with the present ration, they are unable to meet the bare needs of the many persons who. for various reasons, visit the Australian Capital Territory?","SUGAR","QUESTIONS","/hansard/chamber.xscript/debate[1]/subdebate.1[5]/question/talk.start/para","N/A","N/A","N/A"
"0","1","0","0","0","0","0","1","0","16","COURTICE, Benjamin","JQY","N/A","ALP","N/A","2275","I have observed ar meal times that the sugar basins are not so full as they generally are. I do not know whether the shortage applies particularly to the Australian Capital Territory, because, due to various causes, including industrial dislocation and transport difficulties, sugar shortages have occurred in various parts of the Commonwealth. I am sure, however, that in ordinary circumstances, and in the absence of any further undue dislocation, supplies of sugar will be sufficient to meet the needs of the people.","SUGAR","QUESTIONS","/hansard/chamber.xscript/debate[1]/subdebate.1[5]/answer/talk.start/para","N/A","N/A","N/A"
"1","0","0","0","0","0","0","1","0","17","COURTICE, Benjamin","JQY","N/A","ALP","N/A","2275","On the 1st May Senator Aylett asked whether any experiments have been undertaken in Australia to grow the type of linseed from which linseed oil is obtained. The Minister for Commerce and Agriculture has advised that, in view of the insecure position of our linseed supplies from overseas, every encouragement is being given hy Commonwealth and State departments, to projects involving the local production of this oil crop. Experimental plantings on a commercial scale were inaugurated in collaboration with the New South Wale.? Government in 1045, with a promising variety of linseed developed by the New South Wales Department of Agriculture. Further efforts are being made in several States to . develop varieties suited to local conditions and all problems associated with the establishment of this new production are receiving close attention.","LINSEED OIL","QUESTIONS","/hansard/chamber.xscript/debate[1]/subdebate.1[6]/question/talk.start/para","N/A","N/A","N/A"
"1","0","0","0","0","0","0","1","0","18","FOLL, Hattil","JZD","N/A","N/A","N/A","2276","In view of the great difficulties confronting Great Britain in connexion with its huge war debts, its serious shortage of foodstuffs, and its defence problems, will the Government give consideration to suggesting to the British Government the holding, at an early date, of an Imperial Conference in London, at which these problems could be discussed by representatives of all members of the Empire?","IMPERIAL CONFERENCE","QUESTIONS","/hansard/chamber.xscript/debate[1]/subdebate.1[7]/question/talk.start/para","N/A","N/A","N/A"
"0","1","0","0","0","0","0","1","0","19","ASHLEY, William","K0W","N/A","ALP","N/A","2276","I am not prepared to make any representations to the United Kingdom Government as suggested by the honorable senator. I am sure that the Government is capable of handling the problems of Great Britain, and I consider that it would be impertinent to make the suggestion indicated by the honorable senator.","IMPERIAL CONFERENCE","QUESTIONS","/hansard/chamber.xscript/debate[1]/subdebate.1[7]/answer/talk.start/para","N/A","N/A","N/A"
"1","0","0","0","0","0","0","1","0","20","FRASER, James","KKR","N/A","N/A","N/A","2276","In view of the statement that the Postal Department has received applications for 80,000 telephone installations and that telephone equipment is in short supply, will the Postmaster-General assure me that Western Australia will receive a share of available equipment proportionate to that allocated to other States?","TELEPHONE SERVICES","QUESTIONS","/hansard/chamber.xscript/debate[1]/subdebate.1[8]/question[1]/talk.start/para","N/A","N/A","N/A"
"0","1","0","0","0","0","0","1","0","21","CAMERON, Donald","L8E","N/A","ALP","N/A","2276","I am able to give the assurance asked for by the honorable senator. I am also able to inform him that recently a conference of Deputy Directors of Posts and Telegraphs and other senior postal officials from each State made a thorough survey of the telephone situation. As a result, committees representing various tranches of the department have been set up in each State. They will thoroughly investigate the requirements of each State and, consistent with the availability of materials, will do everything possible to satisfy the demand for telephone installations. The department is now negotiating with the object of establishing additional factories and workshops in Australia so that it will not be dependent upon overseas sources for the supply of equipment. It hopes to be in a position soon to supply all 'telephone requirements, including the equipment needed for automatic exchanges in country areas.","TELEPHONE SERVICES","QUESTIONS","/hansard/chamber.xscript/debate[1]/subdebate.1[8]/answer[1]/talk.start/para","N/A","N/A","N/A"
"1","0","0","0","0","0","0","1","0","22","COOPER, Walter","JQP","N/A","N/A","N/A","2276","asked the Postmaster-General, upon notice - Is it a fact that during the day-time it sometimes takes up to two hours to obtain telephonic connexion between Canberra and Sydney? What steps, if any, have been taken during the past six months to improve the telephone service between these two capitals? In view of the recently announced telephone expansion programme and in view also of the importance of having speedy telephonic communication between the National capital and Sydney, especially when Parliament is sitting, will the Postmaster-General consider immediate improvements so as to reduce the delays and will he inform the Senate what steps he proposes to take?","TELEPHONE SERVICES","QUESTIONS","/hansard/chamber.xscript/debate[1]/subdebate.1[8]/question[2]/talk.start/para","N/A","N/A","N/A"
"0","1","0","0","0","0","0","1","0","23","CAMERON, Donald","L8E","N/A","N/A","N/A","2276","The answers to the honorable senator's questions are as follows : - The existing twelve trunk-line circuits between Canberra and Sydney are congested and the maximum delay to calls during very busy periods is about two hours. The importance of providing a prompt telephone service between those centr.es is fully recognized by the Postal Department and extensive line work has been proceeding for sonic months in order to prepare the trunk line route for the installation of a modern twelve-channel carrier wave system. The equipment for the twelve-channel system has been delivered and it is expected that the additional circuits will be available for use in September, 1947, when a substantial improvement in the service will be effected.","TELEPHONE SERVICES","QUESTIONS","/hansard/chamber.xscript/debate[1]/subdebate.1[8]/answer[2]/talk.start/para","N/A","N/A","N/A"
"1","0","0","0","0","0","0","1","0","24","COURTICE, Benjamin","JQY","N/A","ALP","N/A","2276","On the 8th May, Senator McLeay asked the following questions : -","WHEAT","QUESTIONS","/hansard/chamber.xscript/debate[1]/subdebate.1[9]/question/talk.start/para","N/A","N/A","N/A"
"0","0","0","0","0","1","0","1","0","24","COURTICE, Benjamin","JQY","N/A","N/A","N/A","N/A","I ask the Minister representing the Minister for Commerce and Agriculture what amount is still owing to the wheat-growers for 1045-46 season wheat that has been retained by the Australian Wheat Board on the Government's instructions? What doe3 the Government propose to do in relation to. the 1940-47 crop? Does the Government propose to establish a long-range plan in view of the adverse vote in some States against the Government's last wheat plan?","WHEAT","QUESTIONS","/hansard/chamber.xscript/debate[1]/subdebate.1[9]/question/quote/para","N/A","N/A","N/A"
"1","0","0","0","0","0","0","1","0","24","COURTICE, Benjamin","JQY","N/A","N/A","N/A","N/A","The Minister for Commerce and Agriculture has now supplied the following information : - The 1945-40 pool is not yet complete. A fourth ac vance of (id. a bushel is being made this .month. >The 1946-47 crop was acquired and sales through the pool are being made in the usual way It is not the practice to deal with policy matters in reply to questions.","WHEAT","QUESTIONS","/hansard/chamber.xscript/debate[1]/subdebate.1[9]/question/para","N/A","N/A","N/A"
"1","0","0","0","0","0","0","1","0","25","ARNOLD, James","K0N","N/A","N/A","N/A","2277","During the war many Australian manufacturers engaged, in the production of hand tools in order lo supply a need that could not be supplied from, overseas. 'Will the Minister for. Trade and Customs give protection to those manufacturers by withholding licences for the- importation of hand tools that are being made in adequate quantities in Australia?","HAND TOOLS","QUESTIONS","/hansard/chamber.xscript/debate[1]/subdebate.1[10]/question/talk.start/para","N/A","N/A","N/A"
"0","1","0","0","0","0","0","1","0","26","COURTICE, Benjamin","JQY","N/A","ALP","N/A","2277","The Government has a full appreciation of the work that was : done by- manufacturers in producing hand tools in Australia during thewar, when such equipment could not be obtained from abroad. As far as I can ascertain, the quality of Australian-made tools used in carpentering and othertrades is good. The policy of the Government is to give every encouragement to Australian industries in this regard.. Even if Australian-made tools were not up to the standard of those made overseas, I believe that, .with the improved technique which is being developed . in Australia, the quality could be. made as high as that of imported tools without difficulty.","HAND TOOLS","QUESTIONS","/hansard/chamber.xscript/debate[1]/subdebate.1[10]/answer/talk.start/para","N/A","N/A","N/A"
"1","0","0","0","0","0","0","1","0","27","COURTICE, Benjamin","JQY","N/A","ALP","N/A","2277","On the 19th March and on. the 7th May, Senator Gibson asked questions relating to British contract prices for. Australian meat. The Minister for Commerce and Agriculture has now supplied the following information:-","MEAT","QUESTIONS","/hansard/chamber.xscript/debate[1]/subdebate.1[11]/question/talk.start/para","N/A","N/A","N/A"
"1","0","0","0","0","0","0","1","0","28","LARGE, William","KQH","N/A","N/A","N/A","2283","As a pipe smoker, I ask the Minister for Trade and Customs whether, in view of the difficulty of obtaining satisfactory smoking pipes, in Australia, he willconsider granting licences for the importation of such pipes from Great Britain and France in order that we may obtain pipes of a good kind? I am in sympathywith the idea of encouraging local production, but, until local manufacturers are put on their mettle by competition from overseas, I believe that we shall find that a rubbishy type of article will continue to be foisted upon us.","TOBACCO PIPES","QUESTIONS","/hansard/chamber.xscript/debate[1]/subdebate.1[12]/question/talk.start/para","N/A","N/A","N/A"
"0","1","0","0","0","0","0","1","0","29","COURTICE, Benjamin","JQY","N/A","ALP","N/A","2283","It is difficult for. me to decide between the respective merits of local and imported pipes, be cause I am not a. pipe smoker nor do I indulge in pipe dreams. However, I am surprised to hear that Australian-made pipes are not acceptable to pipe smokers in this country. I shall make inquiries in the matter and furnish the honorable senator withan answer to his question.","TOBACCO PIPES","QUESTIONS","/hansard/chamber.xscript/debate[1]/subdebate.1[12]/answer/talk.start/para","N/A","N/A","N/A"
"1","0","0","0","0","0","0","1","0","30","COOPER, Walter","JQP","N/A","N/A","N/A","2283","Has Senator Ashley's attention been drawn to an article appearing in to-day's issue of Smith's Weekly in which it is stated that sworn testimony in the possession of that newspaper contains grave allegations against Commonwealth General Assurance Corporation Limited? In view of the serious nature of the allegations, will the Minister confer with the Prime Minister with a view to instituting an inquiry under the provisions of the Life Assurance Companies Act? Will the Minister arrange for a report on the result of the inquiry to be made available to the Senate?","COMMONWEALTH GENERAL A SSUR ANCE CORPORA TION LIMITED","QUESTIONS","/hansard/chamber.xscript/debate[1]/subdebate.1[13]/question/talk.start/para","N/A","N/A","N/A"
"0","1","0","0","0","0","0","1","0","31","ASHLEY, William","K0W","N/A","ALP","N/A","2283","The assistance given by newspapers to. honorable senators opposite is very evident from this question. The newspaper was published only to-day, and I have not had an opportunity of seeing it nor have most honorable senators. If a perusal of the article indicates that the matter requires inquiry the Government will investigate it.","COMMONWEALTH GENERAL A SSUR ANCE CORPORA TION LIMITED","QUESTIONS","/hansard/chamber.xscript/debate[1]/subdebate.1[13]/answer/talk.start/para","N/A","N/A","N/A"
"1","0","0","0","0","0","0","1","0","32","BEERWORTH, Frederick","K1Q","N/A","N/A","N/A","2283","Is the Postmaster-General aware that housing shortages are causing inconvenience and delay in his department, particularly to country maintenance gangs and to employees paid on a daily basis? Is he aware thatmany suchemployees travel many miles to and from the department's country depots each day because of the shortage of accommodation, and that in one instance men are required to travel from Adelaide to Gawler, a distance of 25 miles? In view of this position, will the Government give consideration to building houses for the accommodation of postal officials, employees paid on a daily basis and linesmen?","HOUSING","QUESTIONS","/hansard/chamber.xscript/debate[1]/subdebate.1[14]/question/talk.start/para","N/A","N/A","N/A"
"0","1","0","0","0","0","0","1","0","33","CAMERON, Donald","L8E","N/A","ALP","N/A","2283","I am aware that there is a shortage of accommodation generally, butnot particularly for postal employees. However, the responsibility is not that of the Commonwealth Government; it rests with State governments. I am not aware of the circumstances mentioned by the honorable senator, but I shall have inquiries made and if it is possible for my department to do anything to improve conditions it will do so.","HOUSING","QUESTIONS","/hansard/chamber.xscript/debate[1]/subdebate.1[14]/answer/talk.start/para","N/A","N/A","N/A"
"1","0","0","0","0","0","0","1","0","34","MCLACHLAN, James","KTX","N/A","N/A","N/A","2283","Residents of the Northern Territory are exempt from income tax, if they are engaged in primary production, fisheries or mining operations. 'Will the Government consider extending the same concession to residents of South Australia, particularly pastoralists and their employees who are occupying land immediately south of the border? At present they enjoy a slight concession but in common fairness they think that the rates should be brought into conformity.","TAXATION","QUESTIONS","/hansard/chamber.xscript/debate[1]/subdebate.1[15]/question/talk.start/para","N/A","N/A","N/A"
"0","1","0","0","0","0","0","1","0","35","ASHLEY, William","K0W","N/A","ALP","N/A","2283","I shall bring the matter to the notice of the Treasurer for consideration.","TAXATION","QUESTIONS","/hansard/chamber.xscript/debate[1]/subdebate.1[15]/answer/talk.start/para","N/A","N/A","N/A"
"1","0","0","0","0","0","0","1","0","36","TANGNEY, Dorothy","K7Y","N/A","N/A","N/A","2283","Following on a question I asked last Thursday, and the answer given by the Minister for Health and Social Services, I now ask the Minister whether in view of the fact that the Opposition is still on strike in connexion with its representation, on the Social Security, Committee, will the Minister consider appointing a conciliation commissioner t'o arrange for the reconstitution of that committee, so that some of the many social problems awaiting solution may be investigated during the next parliamentary recess?","SOCIAL SECURITY COMMITTEE","QUESTIONS","/hansard/chamber.xscript/debate[1]/subdebate.1[16]/question/talk.start/para","N/A","N/A","N/A"
"0","1","0","0","0","0","0","1","0","37","MCKENNA, Nicholas","KTN","N/A","ALP","N/A","2284","I acknowledge the. great value of the work that has hitherto been done by all members of the Social Security Committee, and I am not aware that the present, position is anything in the nature of a ' strike '; it may bp merely a boycott. In/any event I suggest that the intervention of a conciliation commissioner might have fruitful results, not only for the Parliament, hut also for myself and the country. Perhaps lids matter might be better pursued when the Senate reaches an item which appears later on the notice-paper.","SOCIAL SECURITY COMMITTEE","QUESTIONS","/hansard/chamber.xscript/debate[1]/subdebate.1[16]/answer/talk.start/para","N/A","N/A","N/A"
"1","0","0","0","0","0","0","1","0","38","FOLL, Hattil","JZD","N/A","NAT; UAP from 1931","N/A","2284","In view of the very great, shortage of timber in Australia and the fact that every effort is being made-to import timber, will the Minister for Trade, and- Customs, consider, lifting all duties on timber? The present duties impose a tax on building, and as such they should be discontinued until local timber becomes available.","TIMBER","QUESTIONS","/hansard/chamber.xscript/debate[1]/subdebate.1[17]/question/talk.start/para","N/A","N/A","N/A"
"0","1","0","0","0","0","0","1","0","39","COURTICE, Benjamin","JQY","N/A","ALP","N/A","2284","The importation, of, timber is. proceeding normally and Iiic timber, is being taken into. immediate use. in. the. building. trade. This matter has, previously been- considered, by, the Government, and it Ls believed, that the removal of the duty would not, result in the importation of any greater, quantity of timber.","TIMBER","QUESTIONS","/hansard/chamber.xscript/debate[1]/subdebate.1[17]/answer/talk.start/para","N/A","N/A","N/A"
"0","0","1","0","0","0","0","1","0","40","FOLL, Hattil","JZD","N/A","NAT; UAP from 1931","N/A","2284","But ifr would save £30 to the builder of a cottage.","TIMBER","QUESTIONS","/hansard/chamber.xscript/debate[1]/subdebate.1[17]/answer/interjection/talk.start/para","N/A","N/A","N/A"
