"question_flag","answer_flag","interjection_flag","speech_flag","petition_flag","quote_flag","motionnospeech_flag","chamber_flag","non_speech_flag","speaker_no","name","name.id","electorate","party","role","page.no","content","subdebateinfo","debateinfo","path","Speaker","Time","Other"
"0","0","0","1","0","0","0","1","0","108","MCKENNA, Nicholas","KTN","Tasmania","ALP","Minister for Health and Minister for Social Services","2298","Dealing first with the formal matters relating to the bill raised by the Leader of the Opposition (Senator McLeay), I' wish to say two things. Thereafter, I shall take the honorable gentleman to task for several of his later comments which were unquestionably on the political level. Down the years the Chief Judge of the Arbitration Court has been in the same responsible position as he is in to-day, and has had matters going to him, not only from Commonwealth and State tribunals, but also from every industrial authority in this land. The Chief Judge is not without assistance. 'He has his brother judges who are specialists in particular industries, and I have no doubt that he co-opts them for their assistance and advice. At all events, the Chief Judge has not been sending out any distress signals. I repeat that apart from the provision inserted by the April amendment, the honorable gentleman will find in section 18 of the National Security (Economic Organization) Regulations, many matters relating to remuneration that can- be dealt with by an industrial authority, including a conciliation commissioner, without reference to the Chief Judge of the Arbitration Court. There is, for instance, the much discussed formula relating to the increase of marginal rates by approximately 25 per cent. I take strong exception to the comments made by the Leader of the Opposition in regard to what he described as the appeasing and retreating policy of the Government in relation to industrial un rest. His utterances were. unquestionably propaganda, and I regret that they should have been imported into a debate which I hoped would be confined to the bare merits of the legislation with which we are now concerned. Of course, the honorable gentleman has a perfect right to raise any matter he wishes, but I say to him at once that his statement that the Government has appeased and retreated is quite at issue with the truth. Apparently, the honorable senator has forgotten what happened a year ago last Christmas when there was an ironworkers' strike at Port Kembla. With Sydney, and most of* New South Wales lacking electric light, power, transport and so on, it would have been very easy for the Government to have intervened against constituted authority, but anybody who has studied industrial relations in the last year or two will realize that the Government made a stand against those who were seeking to destroy the .arbitration system - a stand that has been reinforced and has had a potent influence on the cleansing of destructive elements from the industrial sphere in New South Wales. In that regard, the Government has also given a lead to the moderates, if I may perhaps improperly refer to them as such - the ordinary trade unionists - to take similar action throughout the rest of the Commonwealth. There was no appeasement in relation to the recent Victorian metal trades strike that dragged on from October of last year until quite recently. Time and time again this Government has said, and has insisted that whoever is on strike must sooner or later come back to the processes of law, and of arbitration and conciliation. The Government has upheld those processes most strongly throughout its history. If that can be called retreating and appeasing, then the Government is guilty. Does the Leader of the . Opposition suggest that the Government should intervene in matters that are before the courts? If it were to do that, I have no doubt that the honorable gentleman would say immediately and with justification that it was interfering improperly. If the Leader of the Opposition ponders for a moment on the settlement of the metal trades strike in Victoria, he will realize that there was a triumph for the processes of conciliation because it was the conciliative processes of the court that settled that strike after the court had intervened by calling a compulsory conference. It showed too that the court had in its hands all the coercive powers that it required.","N/A","COMMONWEALTH CONCILIATION AND ARBITRATION BILL 1.947","/hansard/chamber.xscript/debate[4]/speech[20]/talk.start/para","N/A","N/A","N/A"
"0","0","1","0","0","0","0","1","0","109","MCLEAY, George","KUA","N/A","N/A","N/A","2299","Why did it fail to lake action?","N/A","COMMONWEALTH CONCILIATION AND ARBITRATION BILL 1.947","/hansard/chamber.xscript/debate[4]/speech[20]/interjection/talk.start/para","N/A","N/A","N/A"
"0","0","0","1","0","0","0","1","0","110","MCKENNA, Nicholas","KTN","N/A","N/A","N/A","2299","I am not prepared to debate in this chamber why the Arbitration Court did or did not take action.No doubt it had very good reason for the course that it adopted. It is an expert tribunal with a very wide understanding. It also has complete tolerance. Down theyears, it has accumulated a great deal of wisdom and its judges, more than any one else in the community, realize how easy it is to throw a flame into a petrol tin and start a conflagration spreading from one end of the Commonwealth to the other. I do not propose to go into what might have influenced the judges in not acting sooner or more drastically, but I am prepared to pay them the tribute of saying that rhey acted wisely. I repeat that the initiative in industrial matters in this country has lain with this Government. On its own motion, it has modified the wage-pegging regulations. From the beginning, its object has been to get rid of emergency regulations as soon as possible. The Government has moved under its own power. It has listened to representations from all sections of the community, and it has made its own decisions. I thought for a. moment from the way that the Leader of the Opposition was developing his argument that he was about to suggest that the wage-pegging regulations should be re-imposed. I do not know whether or not that was his intention, but apparently he is prepared now to concede the need for conciliation commissioners. He said. ' Letus appoint our conciliation commissioners'. That is the third voice with which he has spoken on that subject. Last Thursday he said that he wanted nothing to do with conciliation commissioners. He favoured the appointment of more Arbitration Court judges and the strengthening of the court. I invite the honorable senator to decide what he really does recommend to the Government. The Government has made up its mind, and is pursuing two courses to, an end that it believes will give a reasonable chance of industrial peace in this country. As one instance of Government initiative and activity, I point to the war-time referendum. In the war period and during the most disturbed industrial era that this country has ever known, the Government was prepared to take the full responsibility for industrial conditions. Would it have done that had it lacked courage? However, the people of the Commonwealth, acting on the advice of members of the Opposition amongst others, did not concede the powers that the Government sought. I ask the Leader of the Opposition, in view of what I have said, to let us hear no more of charges of appeasement and retreat, but. more credit for the results that have been achieved. .","N/A","COMMONWEALTH CONCILIATION AND ARBITRATION BILL 1.947","/hansard/chamber.xscript/debate[4]/speech[20]/continue/talk.start/para","N/A","N/A","N/A"
"0","0","0","1","0","0","0","1","0","111","Senator McLEAY","KUA","South Australia","N/A","Leader of the Opposition","2299","I move -","N/A","COMMONWEALTH CONCILIATION AND ARBITRATION BILL 1.947","/hansard/chamber.xscript/debate[4]/speech[21]/talk.start/para","N/A","N/A","N/A"
"0","0","0","0","0","1","0","1","0","111","Senator McLEAY","KUA","N/A","N/A","N/A","N/A","Hint, in proposed new section 20, sub-section (1.)be left out with a view to insert in lieu thereof the following sub-sections: - (1.) An appeal shall by leave of the Court lie to the Court constituted by the Chief Judge and not less than two other Judges against any provision in any award or order of a Conciliation Commissioner affecting - a ) wages; hours; any condition of employment which in the opinion of the Court is likely to affect the public interest. ' (1a.) Any such appeal shall be made in the manner and within the time prescribed by the rules made in accordance with section forty-three of this Act. ' (1b.) On the hearing of an appeal under this section the Court may - take fresh evidence: confirm, quash or vary the award or order or part thereof which is under appeal : refer the award or order, or any part thereof, back to the Conciliation Commissioner for reconsideration, and with or without such directions or suggestions as the Court thinks fit; or make an award or order dealing with the matters under appeal.'.","N/A","COMMONWEALTH CONCILIATION AND ARBITRATION BILL 1.947","/hansard/chamber.xscript/debate[4]/speech[21]/quote/para","N/A","N/A","N/A"
"0","0","0","1","0","0","0","1","0","111","Senator McLEAY","KUA","N/A","N/A","N/A","N/A","This amendment, varies from a similar amendment moved in the House of Representatives by the Leader of the Opposition (Mr. Menzies) in regard to leave to appeal by either party from a decision of a conciliation commissioner to' the High Court. The amendment moved in the House of Representatives provided for the : right of appeal - on any grounds whatsoever. However, as the Government was adamant or pigheaded about the matter, I thought perhaps it would consider the proposal if the provision for the granting of leave by the court itself were inserted with the object of 'preventing the 'cluttering up of the court unneces'sarily. .The Minister for Health (Senator McKenna) accused me of having shifted my ground in regard to conciliation 'commissioners. That -is not true. The conciliationcommissioners that this measure provides for will not in my opinion be properly constituted 'authorities. They will be dictators, -or ' sheep, in wolves' clothing '. The Opposition puts .forward these .proposals ^sincerely. We know that the numbers are against us and. 'that the amendment will' be defeated,, but if that 'happens, 'the' Government 'will have to accept the consequences and at least the Opposition will have done everything .possible to induce the Government to see the light. One decision by a conciliation commissioner who is out of -step with the nest could ica-use untold harm to the economy -of this country, -and -provision for an appeal to the Arbitration Court would be as much a safeguard for the employees as for the employers. There is a stupid impression abroad that if one section o£ the community is given an increase of wages that 'is out of all proportion -of the economy of the country, -that is' a great achievement. 'Those who believe that fail to appreciate the effect of. such, a decision on the rest of the community. The amendment is designed to give parties to a dispute the right of appeal against any decision made by a conciliation commissioner clothed with the powers of a dictator.","N/A","COMMONWEALTH CONCILIATION AND ARBITRATION BILL 1.947","/hansard/chamber.xscript/debate[4]/speech[21]/para[1]","N/A","N/A","N/A"
"0","0","0","1","0","0","0","1","0","112","COOPER, Walter","JQP","Queensland","N/A","N/A","2300","I support the amendment. As the Minister for Health (Senator McKenna) has explained, this bill is more or less of an experimental nature: Furthermore, we- have, been informed, by interjection, d at the conciliation commissioners will ha.ve virtually, the same status as. judges have at the present time. It- has been said that there will be no- appeal against the -decisions of. a. judge.- That is true.However., I maintain that, as the* bill is experimental and :as 'the 'commissioners will not have 'had 'the long ''experience of judges, it 'would be 'in ' the interests of conciliation and th'e -maintenance of .peace in industry 'if 'the amendment, \vere accepted. The need for a right of appeal was shown by the recent dispute 'in Victoria, which was. -largely due to the fact that the parties had no right .of appeal against the decision made by Mr. -Mooney, the commissioner who dealt with that ease. In the end, -the parties had to be called, together -so that Mr. 'Mo'oney's decision could *be reconsidered.' The amendment is not designed to assist employers only. History has shown -that, -in many cases, -it is to the advantage of employees to -have the right -of appeal against the decisions of arbitrators. I ask the Minister to consider the -amendment 'carefully on the 'grounds that I have stated. He -has admitted that the bill is more or less exprerimental, '-and I ask ham to 'have regard- for the lesson of the recent 'dispute in- Melbourne-.","N/A","COMMONWEALTH CONCILIATION AND ARBITRATION BILL 1.947","/hansard/chamber.xscript/debate[4]/speech[22]/talk.start/para","N/A","N/A","N/A"
"0","0","0","1","0","0","0","1","0","113","MCKENNA, Nicholas","KTN","Tasmania","ALP","Minister for Health and' Social Service's","2300","''I 'draw the attention. 'of Senator 'Cooper to the 'fact that the decisions given by the conciliation commissioner in the metal trades dispute in -Victoria, Mr. Mooney, was s'u'bject 'to appeal 'The Industrial Peace Regulation's merely interpolated during the period of war certain new provisions and' sections in th'e existing 'Commonwealth 'Conciliation an'd Arbitration Act. I refer the honorable senator to* section- '31 a of 'the- act, which states plainly- (.'L.) Aft appeal' shall -lie to 'the court constituted by the: Chief Judge and not' less than two other, judges' against any provision' in any a ward or order of a conciliation commissioner or a. conciliation 'committee. . . . The trouble in Victoria did not arise because there was no appeal from Mr. Mooney's decision,. Provision for such an appeal is contained in the section to whian I have just referred. Senator Sheehan Will that provision, be eliminated' by the bill? A.-Yes. It? was inserted by the Senate against the will of the Scullin Government1 in 1930: It will he eliminated.- The Government recognizes that there- are two strong viewpoints' in relation to appeals and that only time will tell which of the two is right. Past experience has indicated the wisdom of trying out this new provision. I repeat that the appellate jurisdiction of the Arbitration Court will be strengthened very considerably by the bill and that the High Court will retain a certain over-riding jurisdiction. It is necessary for the High Court to retain such power in order to ensure that the Arbitration Court and other bodies remain within the bounds of the Commonwealth Constitution. That requirement is not abrogated. Question put -","N/A","COMMONWEALTH CONCILIATION AND ARBITRATION BILL 1.947","/hansard/chamber.xscript/debate[4]/speech[23]/talk.start/para","N/A","N/A","N/A"
"0","0","0","0","0","1","0","1","0","113","MCKENNA, Nicholas","KTN","N/A","N/A","N/A","N/A","That the words proposed to be left out (Senator McLeay's amendment ) be left out.","N/A","COMMONWEALTH CONCILIATION AND ARBITRATION BILL 1.947","/hansard/chamber.xscript/debate[4]/speech[23]/quote/para","N/A","N/A","N/A"
"0","0","0","1","0","0","0","1","0","114","Senator McLEAY","KUA","N/A","N/A","Leader of the Opposition","2301","I move - That, in proposed new section 43g, subsection (1.), paragraph (6), after the word ' employee the following words be inserted: - ' (including a person who is iregularly employed as an industrial officer)'. Paragraphb of sub-section 1 of the proposed new section states - A party (not being an organization) may be represented by - an employee of that party; or a member or officer of an organization of which that party isa member. The Opposition is anxious to insert in sub-paragraph i. the words ' (including a person who is regularly employed as an industrial officer)'. Many organizations in secondary industries and in rural industries are not registered as organizations under the Commonwealth Conciliation and Arbitration Act. I have not been able to discover the reason why they are not registered. I know that there must be hundreds of such bodies throughout Australia. In this connexion, section 59 of the existing act, which was mentioned by the Minister for Health, is interesting. As I interpret that section, it is not very easy to secure registration. The section states -","N/A","COMMONWEALTH CONCILIATION AND ARBITRATION BILL 1.947","/hansard/chamber.xscript/debate[4]/speech[24]/talk.start/para","N/A","N/A","N/A"
"0","0","0","0","0","1","0","1","0","114","Senator McLEAY","KUA","N/A","N/A","N/A","N/A","The Registrar shall, unless in all the circumstanceshe thinks it undesirable so to do refuse to register any association as an organization if an organization, to which the members of the association might conveniently belong; has already been registered.","N/A","COMMONWEALTH CONCILIATION AND ARBITRATION BILL 1.947","/hansard/chamber.xscript/debate[4]/speech[24]/quote[1]/para","N/A","N/A","N/A"
"0","0","0","1","0","0","0","1","0","114","Senator McLEAY","KUA","N/A","N/A","N/A","N/A","I refer to the various Chambers of Manufactures which exist throughout. Australia.. It is well known that, in spite of the fact that these organizations have a federal body; the State organizations have industrial officers regularly employed to deal with industrial matters. This is due to the large area of Australia. I am informed that so far as the chambers of manufactures in Australia are concerned, the only chamber that is registered is the Victorian chamber. I have been requested: by the Victorian Chamber of Manufactures and the various State chambers, the Chamber of Commerce and its various State chambers, the South Australian Builders and Contractors Association and other organizations to make a plea to the Government to alter this clause so that the industrial officer regularly employed by them will have the right to appear before a conciliation commissioner. I know that solicitors and barristers are barred, but where an organization has an industrial officer who is neither a solicitor nor a barrister he will -according to my interpretation of the clause - be disqualified from appearing before a conciliation commissioner. Furthermore, conciliation commissioners are to be appointed for all States of Australia and it is quite possible that cases will be heard simultaneously in more than one State. I understand that it is a sheer impossibility to get men with experience of industrial arbitration to appear, and F desire , to place on record the request of the South Australian Builders and Contractors Association. Their letter states -","N/A","COMMONWEALTH CONCILIATION AND ARBITRATION BILL 1.947","/hansard/chamber.xscript/debate[4]/speech[24]/para[5]","N/A","N/A","N/A"
"0","0","0","0","0","1","0","1","0","114","Senator McLEAY","KUA","N/A","N/A","N/A","N/A","This matter is of very great concern to my association and to al] other associations of the master builders in the Commonwealth with the exception of the Master- Builders Association of New South Wales which is a registered association. The amendment will preclude the industrial officer of this association from appearing before the conciliation commissioner on behalf of members of this association unless this association becomes registered in the court. 1","N/A","COMMONWEALTH CONCILIATION AND ARBITRATION BILL 1.947","/hansard/chamber.xscript/debate[4]/speech[24]/quote[2]/para[1]","N/A","N/A","N/A"
"0","0","0","1","0","0","0","1","0","114","Senator McLEAY","KUA","N/A","N/A","N/A","N/A","That is a statement of the facts so far as the various master builders associations in Australia, are concerned. I understand that these bodies have made direct representations to the Minister for Health (Senator McKenna) and the Attorney-General (Dr. Evatt), pleading for an alteration of the bill so that some concession will be extended to them to overcome their difficulty, and T. urge that he give sympathetic consideration to their request. The Associated Chamber of Manufactures of Australia in a letter to the Attorney-General, dated the 28th April, 1947, summarized their case as follows: -","N/A","COMMONWEALTH CONCILIATION AND ARBITRATION BILL 1.947","/hansard/chamber.xscript/debate[4]/speech[24]/para[6]","N/A","N/A","N/A"
"0","0","0","0","0","1","0","1","0","114","Senator McLEAY","KUA","N/A","N/A","N/A","N/A","In regard to paragraph (4) relating to the exclusion of the appearance of solicitors, counsel and paid- agents before conciliation commissioners, we would point out that most manufacturers these days are members of an association or organized body such as the Chamber of Manufactures, the Metal Trades Employers Association, &c. So far as the Chambers of Manufactures are concerned, only one chamber - the Victorian Chamber of Manufactures - is registered as an 'organization' under the Arbitration Act. This means that so far as manufacturers who are members of the various Chambers of Manufactures are concerned, only those in Victoria could be represented by ' a member or officer of an organization ' within the meaning of section 43r (1) (6) (ii) of the amendments to the Arbitration Bill. In other words, the bill contains no provision for representation of members of Chambers of Manufactures in all other States apart from by an employee of that manufacturer concerned. The general practice in the past has been to allow the representation of manufacturers in court and before conciliation commissioners by officers of State chambers, which are not registered organizations under the act, and we consider that it would cause great inconvenience and hardship to such manufacturers if the existing practice in this regard were discontinued.","N/A","COMMONWEALTH CONCILIATION AND ARBITRATION BILL 1.947","/hansard/chamber.xscript/debate[4]/speech[24]/quote[3]/para[1]","N/A","N/A","N/A"
"0","0","0","1","0","0","0","1","0","114","Senator McLEAY","KUA","N/A","N/A","N/A","N/A","I understand that the same position applies so far as the federal council of the Graziers Association is concerned, and that there are scores of organizations representing rural groups which have their own employees who appear as industrial officers. Because these officers are not. registered to appear before the Commonwealth Conciliation and Arbitration Court they will not be able to appear before any of the commissioners proposed to be appointed. I trust that the Government will do something to overcome the difficulties 1 have outlined. T. have not stated the case so- far as the trades unions are concerned, but presumably they will be similarly affected.","N/A","COMMONWEALTH CONCILIATION AND ARBITRATION BILL 1.947","/hansard/chamber.xscript/debate[4]/speech[24]/para[8]","N/A","N/A","N/A"
