"question_flag","answer_flag","interjection_flag","speech_flag","petition_flag","quote_flag","motionnospeech_flag","chamber_flag","non_speech_flag","speaker_no","name","name.id","electorate","party","role","page.no","content","subdebateinfo","debateinfo","path","Speaker","Time","Other"
"0","0","0","0","0","1","0","1","0","76","COURTICE, Benjamin","JQY","N/A","N/A","N/A","N/A","That, in proposed new section two, paragraph /, the words 'exclusive appellate jurisdiction in matters of law arising under this Act and limited ' be left out.","N/A","COMMONWEALTH CONCILIATION AND ARBITRATION BILL 1.947","/hansard/chamber.xscript/debate[4]/quote[2]/para","N/A","N/A","N/A"
"0","0","0","1","0","0","0","1","0","77","MCLEAY, George","KUA","South Australia","N/A","Leader of the Opposition","2288","Under this proposed new section as it now stands, appeals from the Arbitration Court or from decisions of conciliation commissioners to the High Court will be barred. The effect of the amendment I have moved will be to retain this right,of appeal. I hope tha* in the interests of the normal processes of law, the Government will not insist upon this shortcut. The Minister for Health (.Senator McKenna) referred to the number of cases that had been taken from the Arbitration Court to the High Court on appeal, but an examination of records reveals that in the ten-year period from , 1930 to 1940 appeals to the High Court from the Arbitration Court totalled only 22. It is reasonable to assume that as time goes on, and various matters of interpretation are determined, by the High Court, appeals to this superior jurisdiction will become fewer.","N/A","COMMONWEALTH CONCILIATION AND ARBITRATION BILL 1.947","/hansard/chamber.xscript/debate[4]/speech[1]/talk.start/para","N/A","N/A","N/A"
"0","0","0","1","0","0","0","1","0","78","MCKENNA, Nicholas","KTN","Tasmania","ALP","Minister for Health and Minister for Social Services","2289","There is nothing extraordinary about the provision that decisions of the Arbitration Court shall have final and conclusive effect. Referring to the original Commonwealth Conciliation and Arbitration Act of 1904, we find that section 31 (1) provides -","N/A","COMMONWEALTH CONCILIATION AND ARBITRATION BILL 1.947","/hansard/chamber.xscript/debate[4]/speech[2]/talk.start/para","N/A","N/A","N/A"
"0","0","0","0","0","1","0","1","0","78","MCKENNA, Nicholas","KTN","N/A","N/A","N/A","N/A","No award of the Court shall be challenged, appealed against, reviewed, quashed, or called in question in any other Court onany account whatever.","N/A","COMMONWEALTH CONCILIATION AND ARBITRATION BILL 1.947","/hansard/chamber.xscript/debate[4]/speech[2]/quote[1]/para","N/A","N/A","N/A"
"0","0","0","1","0","0","0","1","0","78","MCKENNA, Nicholas","KTN","N/A","N/A","N/A","N/A","Sundry amendments were made to that section down the years, until in 1930 the Senate, against the wish of the Scullin Government, imported certain amendments into that section, and in particular, to the sub-section that I have quoted. It was then that the appeal to the High Court was instituted. I dealt with this matter fully last Friday. TheGovernment wants speedy decisions in relation to matters affecting industrial disputes. It has strengthened the appellate jurisdiction of the Arbitration Court, until now, for the first time, it is the final court of appeal from all judicial decisions of inferior tribunals in proceedings for breaches of awards, offences against the act, matters of interpretation, and so on. So, rather than the status of the Commonwealth Arbitration Courtbeing undermined by this measure, that court is having vested in it an appellate jurisdiction which hitherto has been lacking. The Leader of the Opposition (Senator McLeay) referred to the number of appeals to the High Court over a period of ten years. On Friday, I said that I was not aware of the exact number of appeals involved, but that I considered that they would not have been numerous. I also indicated that I was more particularly interested in what had transpired during the war years, when certain appeals were made from the Arbitration Court to the High Court in circumstances that negated justice. I invited the Leader of the Opposition to have regard to these developments down the years from 1940 to the present. With great respect to the Leader of the Opposition and to other honorable senators opposite, I inform them that the Government has made up its mind to limit appeals from the Arbitration Court. Question put -","N/A","COMMONWEALTH CONCILIATION AND ARBITRATION BILL 1.947","/hansard/chamber.xscript/debate[4]/speech[2]/para[1]","N/A","N/A","N/A"
"0","0","0","0","0","1","0","1","0","78","MCKENNA, Nicholas","KTN","N/A","N/A","N/A","N/A","That the words proposed to be left out (Senator McLeay's amendment) be left out.","N/A","COMMONWEALTH CONCILIATION AND ARBITRATION BILL 1.947","/hansard/chamber.xscript/debate[4]/speech[2]/quote[2]/para","N/A","N/A","N/A"
"0","0","0","0","0","0","0","1","1","79","N/A","N/A","N/A","N/A","N/A","N/A","Clause agreed to.","N/A","COMMONWEALTH CONCILIATION AND ARBITRATION BILL 1.947","/hansard/chamber.xscript/debate[4]/para[4]","N/A","N/A","N/A"
"0","0","0","0","0","0","0","1","1","80","N/A","N/A","N/A","N/A","N/A","N/A","Clause 6 (Definitions).","N/A","COMMONWEALTH CONCILIATION AND ARBITRATION BILL 1.947","/hansard/chamber.xscript/debate[4]/para[5]","N/A","N/A","N/A"
"0","0","0","1","0","0","0","1","0","81","MCLEAY, George","KUA","South Australia","N/A","Leader of the Opposition","2289","I ask the Minister whether the words 'industrial authority ' are defined in this bill or in the principal act. If not, I presume that the term, ' industrial authority will cover a conciliation commissioner.","N/A","COMMONWEALTH CONCILIATION AND ARBITRATION BILL 1.947","/hansard/chamber.xscript/debate[4]/speech[3]/talk.start/para","N/A","N/A","N/A"
"0","0","0","1","0","0","0","1","0","82","MCKENNA, Nicholas","KTN","Tasmania","ALP","Minister for Health and Minister for Social Services","2289","On the brief notice given to me by the honorable senator, I can only say that I do not think that the term 'industrial authority' is defined at all in the Commonwealth Conciliation and Arbitration Act. I believe that the honorable senator is concerned with the definition of 'industrial authority ' in the Wage Pegging Regulations, and, therefore, I refer him to section 14 of those regulations. The full definition is as follows : - 'Industrial Authority ' means the Court and includes any other tribunal or person constituted by or under any law of the Commonwealth for the purpose of hearing and determining industrial disputes and making awards or orders in settlement thereof, and any tribunal which is a State Industrial Authority within the meaning of the Commonwealth Conciliation and Arbitration Act 1904- 1934, and also includes the Public Service Arbitrator and any tribunal, body or persons having power, by virtue of any law, to determine rates of remuneration for apprentices. That definition covers not only Commonwealth authorities aud State authorities, but also every other conceivable form of tribunal that might deal with relations of employers and employees.","N/A","COMMONWEALTH CONCILIATION AND ARBITRATION BILL 1.947","/hansard/chamber.xscript/debate[4]/speech[4]/talk.start/para","N/A","N/A","N/A"
"0","0","0","1","0","0","0","1","0","83","COOPER, Walter","JQP","Queensland","N/A","N/A","2290","The clause states that 'industrial matters ' means all matters pertaining to the relations of employers and employees and, without limiting the generality of the foregoing, includes - (/) the question whether monetary allowances shall bc made by employers in respect of any time when an employee is not actually working. Does that paragraph refer to sick pay, annual leave, or attendance money? If not, what is its application?","N/A","COMMONWEALTH CONCILIATION AND ARBITRATION BILL 1.947","/hansard/chamber.xscript/debate[4]/speech[5]/talk.start/para","N/A","N/A","N/A"
"0","0","0","1","0","0","0","1","0","84","MCKENNA, Nicholas","KTN","Tasmania","ALP","Minister for Health and Minister for Social Services","2290","That portion of the definition of ' industrial matters ' is not intended to refer to the matters mentioned by the honorable senator. It,assumes immediately that the relation of employer and employee has been established. It relates to matters which the Arbitration Court, or a conciliation commissioner, might consider in relation to travelling from home to work, 'or, particularly, to periods of rain or intense heat, when conditions of the elements might interrupt work' for a considerable period. It will bring within the scope of the definition matters to which the court and the conciliation commissioners may direct their attention and, ultimately, their awards.","N/A","COMMONWEALTH CONCILIATION AND ARBITRATION BILL 1.947","/hansard/chamber.xscript/debate[4]/speech[6]/talk.start/para","N/A","N/A","N/A"
"0","0","0","1","0","0","0","1","0","85","GIBSON, William","KAY","Victoria","N/A","N/A","2290","I have a question relating to the definition of an ' organization '. It seems to me that an anomalous position will he created in Victoria, where over 1,200 members of the Graziers Association have been, cited before the Arbitration. Court. The association is an unregistered body. Does this mean that every member who has been cited will have to attend in person before the court and appear for himself, because individuals may not appoint paid agents? Will the Minister clarify this position?","N/A","COMMONWEALTH CONCILIATION AND ARBITRATION BILL 1.947","/hansard/chamber.xscript/debate[4]/speech[7]/talk.start/para","N/A","N/A","N/A"
"0","0","0","1","0","0","0","1","0","86","MCKENNA, Nicholas","KTN","Tasmania","ALP","Minister for Health and Minister for Social Services","2290","The definition of ' organization ' is not dealt with in this clause. The point with which the honorable senator is concerned might well be raised when the. committee is considering proposed new section 43o in clause S of the bill. That proposed new section deals with the representation of parties before the court or a conciliation commissioner. However, I see no reason why an organization existent in Victoria that is affiliated with other bodies, should not be registered with the Commonwealth Arbitration Court. I consider that it would be desirable for a body having interstate affiliations, thus demonstrating the possibility of an interstate industrial dispute, to be registered with the court. Honorable senators will agree that the ambit of the court is constantly expanding, and it is highly desirable that bodies engaged in an industry that spreads throughout Australia should be registered with the court. I believe that the difficulty envisaged by Senator Gibson would disappear if the body which he has in mind would become registered as an organization under the act.","N/A","COMMONWEALTH CONCILIATION AND ARBITRATION BILL 1.947","/hansard/chamber.xscript/debate[4]/speech[8]/talk.start/para","N/A","N/A","N/A"
"0","0","0","1","0","0","0","1","0","87","GIBSON, William","KAY","Victoria","N/A","N/A","2290","The Victorian Graziers Association may have some difficulty in obtaining registration. Already three graziers' organizations in New South Wales, including one in the southern Riverina area, are registered with the court. I understand that there is great difficulty in securing registration for a body if another body bearing the same name is already registered.","N/A","COMMONWEALTH CONCILIATION AND ARBITRATION BILL 1.947","/hansard/chamber.xscript/debate[4]/speech[9]/talk.start/para","N/A","N/A","N/A"
"0","0","0","1","0","0","0","1","0","88","MCKENNA, Nicholas","KTN","Tasmania","ALP","Minister for Health and Minister for Social Services","2290","Section 59 of the existing Commonwealth Conciliation and Arbitration Act is as follows: - The Registrar shall, unless in all the circumstances he thinks it undesirable so to do. refuse, to register any association as an organization if on organization, to which the members of the association might conveniently belong, lias already been registered. The various graziers' bodies have a Graziers' Federal Council of Australia, which embraces the associations in New South Wales nml other associations under various names i' the different States. I notice that the list of associations federated with the council includes the Victorian Graziers Association. yen;) tor Gibson - No. The Victorian Graziers Association is not registered. No, but the bodies are federated with the Graziers Federal Council of Australia, and I notice that at .least the Graziers Association of New South Wales is registered as an organization.","N/A","COMMONWEALTH CONCILIATION AND ARBITRATION BILL 1.947","/hansard/chamber.xscript/debate[4]/speech[10]/talk.start/para","N/A","N/A","N/A"
"0","0","1","0","0","0","0","1","0","89","GIBSON, William","KAY","N/A","N/A","N/A","2291","And the Pastoralists Association and .the Graziers Association of the .Riverina.","N/A","COMMONWEALTH CONCILIATION AND ARBITRATION BILL 1.947","/hansard/chamber.xscript/debate[4]/speech[10]/interjection[1]/talk.start/para","N/A","N/A","N/A"
"0","0","1","0","0","0","0","1","0","90","MCKENNA, Nicholas","KTN","N/A","ALP","N/A","2291","That is so. I do not know whether the Graziers Association of Victoria has made application for registration with the court and encountered difficulties. However, it occurs to me that, as a first approach, it might make such an application., and, that, if no objections were raised by the kindred bodies already registered, the Registrar might have no hesitation in. according registration. If the honorable senator assures me that an application has been made and rejected by the Registrar-","N/A","COMMONWEALTH CONCILIATION AND ARBITRATION BILL 1.947","/hansard/chamber.xscript/debate[4]/speech[10]/interjection[2]/talk.start/para","N/A","N/A","N/A"
"0","0","1","0","0","0","0","1","0","91","GIBSON, William","KAY","N/A","N/A","N/A","2291","I do not think so.","N/A","COMMONWEALTH CONCILIATION AND ARBITRATION BILL 1.947","/hansard/chamber.xscript/debate[4]/speech[10]/interjection[3]/talk.start/para","N/A","N/A","N/A"
"0","0","0","1","0","0","0","1","0","92","MCKENNA, Nicholas","KTN","N/A","N/A","N/A","2291","The association might well explore that avenue. It may encounter no difficulty if objections are not raised by the somewhat similar 'bodies already registered. That would give it the status in the court which it seeks. Clause agreed to. Clause 7 agreed to. Clause S -","N/A","COMMONWEALTH CONCILIATION AND ARBITRATION BILL 1.947","/hansard/chamber.xscript/debate[4]/speech[10]/continue[2]/talk.start/para","N/A","N/A","N/A"
"0","0","0","0","0","1","0","1","0","92","MCKENNA, Nicholas","KTN","N/A","N/A","N/A","N/A","Part III. of the Principal Act is repealed and the following Parts are inserted in its stead :- ''20. - (1.) An award or order of a Conciliation Commissioner shall not be challenged, appealed against, reviewed, quashed, or called in question, or he subject to prohibition, mandamus or injunction, in any Court on any ieconnt whatever. '43c:. - (1.) In any proceedings before the Court or a Conciliation Commissioner - a party (not being an organization) may he represented by - an employee of that party; or ' 43s. (3.) Where the Court or a Conciliation Commissioner, by an order or award, prescribes a. minimum rate of wages, the Court or Conciliation Commissioner may provide for the. payment of a lower rate for an employee who is unable to earn the minimum wage s<« prescribed, in which case the Court or Conciliation Commissioner shall provide that the lower rate shall not, be paid unless; a person or authority specified by the Court or Conciliation Commissioner has certified that the employee is unable i.o earn the minimum wage '.","N/A","COMMONWEALTH CONCILIATION AND ARBITRATION BILL 1.947","/hansard/chamber.xscript/debate[4]/speech[10]/quote/para","N/A","N/A","N/A"
"0","0","0","1","0","0","0","1","0","93","MCLEAY, George","KUA","South Australia","N/A","Leader of the Opposition","2291","Proposed new section 15 provides that the Chief Judge may assign a conciliation commissioner to a particular industry or group of industries, and proposed new section 16 provides - (1.) Subject to the last preceding section, it shall be the duty nf the Chief Conciliation Commissioner to organize and allocate the work of all 'the Conciliation Commissioners. It appears to nic that there is a likelihood of misunderstanding as the result of giving authority both to the Chief Judge and to the chief conciliation commissioner to delegate various commissioners to different groups of industries. If there is conflict I presume the Chief Judge will decide the matter, but is there any possibility of conflict between the proposed commissioners themselves? Is there anything in the bill which makes it compulsory for a commissioner to accept an assignment from, the chief conciliation commissioner 1","N/A","COMMONWEALTH CONCILIATION AND ARBITRATION BILL 1.947","/hansard/chamber.xscript/debate[4]/speech[11]/talk.start/para","N/A","N/A","N/A"
"0","0","0","1","0","0","0","1","0","94","MCKENNA, Nicholas","KTN","Tasmania","ALP","N/A","2291","I 'do not think there is any possibility of conflict because proposed new section 15 (1.) empowers the Chief Judge to assign, a conciliation commissioner to a particular industry or group of industries, while section 16 (1.) provides that - ' Subject to. the last preceding section, it snail be the duty of the chief conciliation commissioner to organize and allocate the work of all the conciliation commissioners '. The Senate will notice that in -option 15 (1.) the word ' may ' is used, so that the sub-section does not impose the duty upon the Chief Judge,, but provides merely that he ' may assign a conciliation commissioner to a particular industry or group of industries '. The question has been asked : 'What will happen if the Chief Judge decides not to assign particular commissioners to particular industries? To overcome what might have been a hiatus, provision is made in the bill to meet this contingency by section 16 (1.), which, as I have already said, reads -","N/A","COMMONWEALTH CONCILIATION AND ARBITRATION BILL 1.947","/hansard/chamber.xscript/debate[4]/speech[12]/talk.start/para","N/A","N/A","N/A"
"0","0","0","0","0","1","0","1","0","94","MCKENNA, Nicholas","KTN","N/A","N/A","N/A","N/A","Subject to the last preceding section, it shall be the duty of the Chief Conciliation Commissioner to organize and allocate work of all the Conciliation Commissioners. All that the chief conciliation commissioner can do is to organize the work of a conciliation commissioner within a group of industries. He might, for instance, direct a particular commissioner to investigate and adjudicate upon a dispute in the metal trades industry to-day and to go to another industry to-morrow. I assure the honorable senator, that there is no possibility of conflict between the provisions of sections 15 (1.) and 16 (1.). The honorable senator also inquired whether the hill confers power to compel conciliation commissioners to obey all behests of the chief conciliation commissioner. Section 16 (2.) provides - Each Conciliation Commissioner shall' comply with' any direction given for the purpose of the.- last, preceding sub-section which is applicable, to him. Therefore, it is clear, that the Chief Judge has permissive- power, to. allocate commissioners to different industries. If he fails to act the chief conciliation' commissioner must do so. Furthermore, the chief conciliation commissioner can organize the work of the commissioner and they are obliged to obey his direction, both, in regard to the allocation of their work and its organization.","N/A","COMMONWEALTH CONCILIATION AND ARBITRATION BILL 1.947","/hansard/chamber.xscript/debate[4]/speech[12]/quote/para[1]","N/A","N/A","N/A"
"0","0","0","1","0","0","0","1","0","95","COOPER, Walter","JQP","Queensland","N/A","N/A","2292","I regard this clause as the most important part of the bill, because it provides for the- selection and appointment of conciliation commissioners. The selection of the proposed appointees will be the determining factor in the success or otherwise of these people in their' application. I should like- the Minister to give some indication of what arrangements are to be made with regard to the- allocation of work in the several States. The Minister indicated, in reply to the Leader of the Opposition (Senator McLeay), that the conciliation commissioners may be alio'cated to different industries. Doe3 thai mean that they will be selected because of their special knowledge of particular industries? Will the proposed commissioners be stationed permanently in particular States- of the Commonwealth, or will they be sent from one State to another as disputes arise? I am still unconvinced that the Government- will be able to withstand the pressure that will undoubtedly be brought to bear by big industrial unions to have men appointed who' have had previous affiliation with the trade union movement. I feel that such appointees will not be able to adjudicate impartially on the questions thai come before them for decision.","N/A","COMMONWEALTH CONCILIATION AND ARBITRATION BILL 1.947","/hansard/chamber.xscript/debate[4]/speech[13]/talk.start/para","N/A","N/A","N/A"
"0","0","0","1","0","0","0","1","0","96","GIBSON, William","KAY","Victoria","N/A","N/A","2292","'.- I think that there is bound to he conflict under this clause, because power to allocate the duties of the commissioners is conferred, on both the Chief Judge and the chief -conciliation commissioner. I do not see how the appointees can be expected to function.1 under two authorities. Apparently, in. the first place, the Chief Judge will allocate industries to particular commissioners, leaving- the entire residue of industry to be the province oil' any commissioner.","N/A","COMMONWEALTH CONCILIATION AND ARBITRATION BILL 1.947","/hansard/chamber.xscript/debate[4]/speech[14]/talk.start/para","N/A","N/A","N/A"
"0","0","0","1","0","0","0","1","0","97","MCLEAY, George","KUA","South Australia","N/A","Loader of the Opposition","2292",";Is any penalty provided in the bill, other than the power to remove him on an address of both Houses of Parliament, in the event of a commissioner refusing to accept a direction?' Adverting to the words, 'The Chief Judge may assign', I suggest that the Chief Judge, who is a person of considerable experience and prestige may be tempted to assign the entire regulation of industry to conciliation commissioners. Is that a possibility?","N/A","COMMONWEALTH CONCILIATION AND ARBITRATION BILL 1.947","/hansard/chamber.xscript/debate[4]/speech[15]/talk.start/para","N/A","N/A","N/A"
"0","0","0","1","0","0","0","1","0","98","MCKENNA, Nicholas","KTN","Tasmania","ALP","Minister for Health and Minister for Social Services","2292","The matters raised by Senator Cooper are important. He asked whether the persons to be appointed, conciliation commissioners will be. selected by reason of their affiliation with trade unions. For his benefit I repeat the assurance given by the Attorney-General (Dr. Evatt) in the House of Representatives, that the Governm'ent, recognizing that the success of this new approach to industrial disputes rests entirely upon the calibre of the men .tb be Selected for these appointments, will -nave regard to the qualities of integrity, ability and under- standing of the industry. 'When I say, ' understanding of the industry ', I do not mean that a 'detailed knowledge of a particular industry 'will he required of a commissioner at the time he is appointed, but that he should possess the caf) a city 'to assimilate 'that knowledge. The conciliation commissioners must possess -a Wen sense of justice and must be of -such status an'd character that they Will 'convey a -sense Of impartiality to both sides in industrial disputes in which they will be called upon to 'adjudicate. If a conciliation commissioner lacks the confidence o'f either side it is inevitable that he will 'fail, arid 'that 'consequently this experiment on which the Government is embarking will come. to nought The Government has a very full realization of that. At the same time, previous affiliation with the trade union movement or the Australian Labour party will not debar' a man from appointment any more than the possession of legal training will disqualify him. There is a clear recognition by the unions themselves of the value of, and 'the necessity for people with legal qualifications Reference to the bill shows that provision is made for legally qualified -persons to appear before the court. Of c'Ours'e, before such persons can appear they must obtain the leave of the court and the consent of both parties. The Commonwealth Court of Conciliation and Arbitration has had a most extraordinary array of legal talent appearing before it since last May, and in all major industrial determinations legal representation is the order of the day.","N/A","COMMONWEALTH CONCILIATION AND ARBITRATION BILL 1.947","/hansard/chamber.xscript/debate[4]/speech[16]/talk.start/para","N/A","N/A","N/A"
