"question_flag","answer_flag","interjection_flag","speech_flag","petition_flag","quote_flag","motionnospeech_flag","chamber_flag","non_speech_flag","speaker_no","nonspeech","name","name.id","electorate","party","role","page.no","content","subdebateinfo","debateinfo","path","Speaker","Time","Other"
"0","0","0","1","0","0","0","1","0","578","0","N/A","N/A","N/A","N/A","N/A","N/A","Who said that? None other than the former Prime Minister, Paul Keating, in April 1993. Paul Keating knew then what had to be done, but he could not deliver it. Why couldn't he deliver it? We need to look at what happened at that particular time. Paul Keating directed former Minister Brereton to mount his trusty steed—spurs glistening, six&hyphen;shooters loaded, hat fluttering in the breeze—and sent him off down to the ACTU conference. Remember all that? Minister Brereton was booed and hissed out of that particular conference. He was met when he got there by Martin, Jenny and Bill. What happened? As I said, he was booed and hissed out of the conference, his horse was shot, his six-shooters were taken away from him, and he was sent back to Paul with his tail between his legs. That was what happened in 1993, and that was one of the major contributing factors to the demise of this ex-government opposite. The people who had supported the Labor Party in the past abandoned them in droves. This particular aspect and what came out of it was the introduction of Brereton's IR reform act—and it would be the worst legacy of your legislation record while you were in government. Let us look at some of these particular aspects. The appalling unfair dismissal provisions: we will fix them. Our unfair dismissal arrangements will be `a fair go to all'. We will reintroduce back into the Trade Practices Act sections 45D and 45E. We will return protection for innocent third parties—and didn't we need that just before Christmas when waterfronts were closed down, coalmines were closed down and various actions were taken. You introduced enterprise flexibility agreements instead of workplace agreements. You could not allow the parties, even where there were no union members in the workplace, to make their own agreement without union interference. We will fix that. Employees will have the choice of whether they wish to belong to a union or not. They will be able to choose which union they can join. They will even be able to make a choice to form their own union. I emphasise again: we will be keeping certified agreements. Our wages policy is based on choice and freedom in the workplace. It will deliver higher productivity and, hence, higher wages and higher profitability. The accord failed by almost every measure, so let us try a few of them. During the period of the accord, we had the highest sustained interest rates on record in this country; we had the worst recession in 60 years; you could not deliver on the waterfront. In fact, we have gone backwards in recent times on the waterfront. As has already been stated, there was a productivity loss of 20 per cent. There are other measures we can look at. Real wages fell by over one per cent. One can go on highlighting particular aspects of that Industrial Relations Reform Act which did so much damage to the Australian economy. We have heard speakers over here talk about relativities, comparing the conditions of 20 years ago with those of today. The only effective measure you can put in place, as far as those opposite are concerned, is the measure of how we are comparing with our international competitors. When we look at particular aspects with our international competitors, while we have improved marginally in some areas, we have fallen further behind the position we were in when the Labor government came into power. I want to quote some aspects out of the monthly economic and social indicators. These would make very good reading and be very instructive for those on the other side of the chamber. Looking down the figures, we find that we still have 8.9 per cent unemployment in this country. We see the figures from 1991 through to 1995-96 ranging from 11 per cent to virtually nine per cent. If we go over the page, we find that during that same period of time the long-term unemployed figures have ranged from 282,500 to 224,500. That is the disgrace which has occurred with the application of the policies of the previous government—and I have outlined how we intend to address that. As we go on, we see the figures for youth unemployment. We look at bankruptcies and see that, between 1991-92 and 1995-96, bankruptcies ranged from 3,305 per annum to 4,137. The figures go on and on. Then we come to the current account deficit and the impact that has had. (Time expired)","N/A","MATTERS OF PUBLIC IMPORTANCE","/html/body/hansard/chamber.xscript/debate[10]/debate.sub1/speech[7]/para[10]","N/A","N/A","N/A"
"0","0","0","0","0","0","0","1","1","579","0","Senator SPINDLER","0X4","N/A","N/A","N/A","N/A","I seek leave to make a personal explanation.","N/A","PERSONAL EXPLANATIONS","/html/body/hansard/chamber.xscript/debate[11]/speech/talk.start[1]/para","N/A","N/A","N/A"
"0","0","0","1","0","0","0","1","0","580","0","N/A","N/A","N/A","N/A","N/A","N/A","Leave granted.","N/A","PERSONAL EXPLANATIONS","/html/body/hansard/chamber.xscript/debate[11]/speech/para[1]","N/A","N/A","N/A"
"0","0","0","0","0","0","0","1","1","581","0","Senator SPINDLER","0X4","N/A","N/A","N/A","N/A","Following the Senate's passing of the motion to establish a casino inquiry, Premier Kennett is reported to have said this afternoon at a function at the Ringwood Chamber of Commerce:","N/A","PERSONAL EXPLANATIONS","/html/body/hansard/chamber.xscript/debate[11]/speech/talk.start[2]/para","N/A","N/A","N/A"
"0","0","0","1","0","1","0","1","0","582","0","N/A","N/A","N/A","N/A","N/A","N/A","I would suggest that Senator Spindler, who started his young life as a member of the Hitler Youth, is now going to complete his public performance in very much the same way.","N/A","PERSONAL EXPLANATIONS","/html/body/hansard/chamber.xscript/debate[11]/speech/para[2]","N/A","N/A","N/A"
"0","0","0","1","0","0","0","1","0","583","0","N/A","N/A","N/A","N/A","N/A","N/A","Mr Kennett's case cannot be very good if he has to resort to name calling and character assassination in an attempt to avoid accountability. The facts are that I was seven years old when the war started and 12 years old when the war ended, that my parents were Germans and that all German girls and boys were automatically enrolled in the youth division of the Hitler Youth at the age of 10. We had no choice. My experience during those years has made me a lifelong peace activist and anti&hyphen;racist and a strong opponent of totalitarian regimes. My record on these issues is on public view. Similar attacks were made in 1990 when I stood as a candidate for the Senate. I believe they actually got me votes because the community saw how sleazy those attacks were. I believe Mr Kennett's words will backfire on him in a similar way. I believe that Australians who suffered similar experiences as children in the European war zone will be deeply distressed by Mr Kennett's insensitive attack.","N/A","PERSONAL EXPLANATIONS","/html/body/hansard/chamber.xscript/debate[11]/speech/para[3]","N/A","N/A","N/A"
"0","0","0","0","0","0","0","1","1","584","0","Senator HARRADINE","6H4","N/A","N/A","N/A","N/A","I move:","N/A","ORDER OF BUSINESS","/html/body/hansard/chamber.xscript/debate[12]/debate.sub1/speech/talk.start[1]/para","N/A","N/A","N/A"
"0","0","0","1","0","1","0","1","0","585","0","N/A","N/A","N/A","N/A","N/A","N/A","That general business notice of motion No. 28 standing in the name of Senator Harradine for today, proposing an order for the production of documents by the Minister representing the Attorney&hyphen;General (Senator Vanstone), be postponed till the next day of sitting.","N/A","ORDER OF BUSINESS","/html/body/hansard/chamber.xscript/debate[12]/debate.sub1/speech/para[1]","N/A","N/A","N/A"
"0","0","0","1","0","0","0","1","0","586","0","N/A","N/A","N/A","N/A","N/A","N/A","I seek leave to make a very, very short statement about this matter. Leave granted.","N/A","ORDER OF BUSINESS","/html/body/hansard/chamber.xscript/debate[12]/debate.sub1/speech/para[2]","N/A","N/A","N/A"
"0","0","0","0","0","0","0","1","1","587","0","Senator HARRADINE","6H4","N/A","N/A","N/A","N/A","I apologise for once again moving to defer this notice of motion. The notice of motion is to require the tabling of certain documents, and included in the documents is the final draft of classification guidelines for films and videos which are currently under consideration by the state and Commonwealth censorship ministers. I am moving a motion to defer this notice of motion until tomorrow because I understand that there is some reluctance. I would hope that by tomorrow that reluctance will be overcome. I hope that those responsible will see that it is important in the public interest that the final draft guidelines be tabled in this parliament, if not in the state parliaments.","N/A","ORDER OF BUSINESS","/html/body/hansard/chamber.xscript/debate[12]/debate.sub1/speech/talk.start[2]/para","N/A","N/A","N/A"
"0","0","0","0","0","0","0","1","1","588","0","N/A","N/A","N/A","N/A","N/A","N/A","Question resolved in the affirmative.","N/A","ORDER OF BUSINESS","/html/body/hansard/chamber.xscript/debate[12]/debate.sub1/speech/para[4]","N/A","N/A","N/A"
"0","0","0","0","0","0","0","1","1","589","0","N/A","N/A","N/A","N/A","N/A","N/A","Consideration resumed from 7 May.","N/A","HAZARDOUS WASTE (REGULATION OF EXPORTS AND IMPORTS) AMENDMENT BILL 1996","/html/body/hansard/chamber.xscript/debate[13]/debate.sub1[1]/proctext/para[1]","N/A","N/A","N/A"
"0","0","0","0","0","0","0","1","1","590","0","N/A","N/A","N/A","N/A","N/A","N/A","The bill.","N/A","HAZARDOUS WASTE (REGULATION OF EXPORTS AND IMPORTS) AMENDMENT BILL 1996","/html/body/hansard/chamber.xscript/debate[13]/debate.sub1[1]/proctext/para[2]","N/A","N/A","N/A"
"0","0","0","0","0","0","0","1","1","591","0","The CHAIRMAN","10000","N/A","N/A","N/A","N/A","The committee is considering the Hazardous Waste (Regulation of Exports and Imports) Amendment Bill 1996. When the committee was last considering the bill it was dealing with amendments circulated by Senator Chamarette and Senator Bell and we had dealt with the first four items of Senator Chamarette's amendments.","N/A","HAZARDOUS WASTE (REGULATION OF EXPORTS AND IMPORTS) AMENDMENT BILL 1996","/html/body/hansard/chamber.xscript/debate[13]/debate.sub1[1]/proctext/interject[1]/talk.start/para","N/A","N/A","N/A"
"0","0","0","0","0","0","0","1","1","591","0","The CHAIRMAN","10000","N/A","N/A","N/A","N/A","The question is that item 2 stand as printed. Senator Chamarette is to move an amendment to insert a subsection.","N/A","HAZARDOUS WASTE (REGULATION OF EXPORTS AND IMPORTS) AMENDMENT BILL 1996","/html/body/hansard/chamber.xscript/debate[13]/debate.sub1[1]/proctext/interject[2]/talk.start/para","N/A","N/A","N/A"
"0","0","0","0","0","0","0","1","1","592","0","Senator CHAMARETTE","SN5","N/A","N/A","N/A","N/A","I move:","N/A","HAZARDOUS WASTE (REGULATION OF EXPORTS AND IMPORTS) AMENDMENT BILL 1996","/html/body/hansard/chamber.xscript/debate[13]/debate.sub1[1]/speech[1]/talk.start/para","N/A","N/A","N/A"
"0","0","0","1","0","1","0","1","0","593","0","N/A","N/A","N/A","N/A","N/A","N/A","5. Schedule 1, item 2, page 3, after subsection 3 (1), (after line 15), insert the following subsection: The principle of industry responsibility In relation to the exercise of any obligation, function or discretion of the Minister arising under this Act, the Minister must have regard to the following principle, namely, that where an industry, including a particular member of that industry, produces hazardous waste that industry and member have primary responsibility to ensure that the hazardous waste is managed in an environmentally sound manner and is disposed of safely. (The heading to section 3 should be omitted and the following heading substituted: ' Object, principle and aims '.)","N/A","HAZARDOUS WASTE (REGULATION OF EXPORTS AND IMPORTS) AMENDMENT BILL 1996","/html/body/hansard/chamber.xscript/debate[13]/debate.sub1[1]/speech[1]/para[1]","N/A","N/A","N/A"
"0","0","0","1","0","0","0","1","0","594","0","N/A","N/A","N/A","N/A","N/A","N/A","I want to express my gratitude for the running sheet. That ought to make the committee consideration of this bill a lot simpler than it has been to date. This amendment is proposed by the Greens (WA) , and I believe it is supported by the Australian Democrats. We believe this insert is a way of leaving the phrase `dispose of safely' in the bill. We have already expressed grave concern about it being removed. We think that it is important that in at least one place in the bill, and the place we believe to be most appropriate, there should be the principle that the bill should have something to do with the safe disposal of hazardous waste and that people should not simply be able to move hazardous waste around from place to place, whether in an environmentally sound manner or not. It is not acceptable for the community to do industry's dirty work for it—often at a cost to standard of living, health, livelihood and survival, and at the cost of infant mortality. For that reason, the responsibility is being placed exactly where it belongs—with industry. One of the key solutions to the hazardous waste crisis we have facing the world at present is to make industry responsible for its own waste. An overriding principle of this bill should, therefore, be industry responsibility. It has never been acceptable that industry should cut its costs and increase its profits by using the natural environment, and the people that live within it, as cheap dumping grounds. Yet without legislating to make industry unquestionably responsible for the ethical disposal of its own wastes, this will continue to happen. There is much to be gained in making industry responsible. As industry finds it is required to deal with its wastes, it will produce less of them. It will recycle more, it will save resources and, eventually, increase its profits and those of the community in the form of both direct revenue and quality of life. Safer chemicals will be used, products will be reformulated, production processes will be modified, operations and maintenance will be improved and closed&hyphen;loop recycling and re&hyphen;use will become more prevalent. Waste is expensive. Ensuring that it is fed back into the system will increase efficiency many fold and solve several problems at once. That is why we believe this clause would be an addition to the bill. It would also address the concern that at no other point in this bill will the term `dispose of safely' occur. Following some amendments which we opposed but which were agreed to earlier in this debate, the removal of the term `dispose of safely' occurred. I commend Greens amendment No. 5 to my colleagues.","N/A","HAZARDOUS WASTE (REGULATION OF EXPORTS AND IMPORTS) AMENDMENT BILL 1996","/html/body/hansard/chamber.xscript/debate[13]/debate.sub1[1]/speech[1]/para[6]","N/A","N/A","N/A"
"0","0","0","0","0","0","0","1","1","595","0","Senator HILL","BH4","N/A","N/A","Minister for the Environment)","N/A","I understand where the Greens are coming from. I do not have any great problem with that. The difficulty—","N/A","HAZARDOUS WASTE (REGULATION OF EXPORTS AND IMPORTS) AMENDMENT BILL 1996","/html/body/hansard/chamber.xscript/debate[13]/debate.sub1[1]/speech[2]/talk.start[1]/para","N/A","N/A","N/A"
"0","0","0","0","0","0","0","1","1","596","0","Senator Forshaw","656","N/A","N/A","N/A","N/A","Do you know where you are going?","N/A","HAZARDOUS WASTE (REGULATION OF EXPORTS AND IMPORTS) AMENDMENT BILL 1996","/html/body/hansard/chamber.xscript/debate[13]/debate.sub1[1]/speech[2]/interject/talk.start/para","N/A","N/A","N/A"
"0","0","0","0","0","0","0","1","1","597","0","Senator HILL","BH4","N/A","N/A","N/A","N/A","Yes, I am going to object to this amendment. If you give me the opportunity, I will explain why. What I was saying was that I have some sympathy with the sentiment of what Senator Chamarette is saying, but I do not really see that what she is planning to insert in the bill adds a great deal.","N/A","HAZARDOUS WASTE (REGULATION OF EXPORTS AND IMPORTS) AMENDMENT BILL 1996","/html/body/hansard/chamber.xscript/debate[13]/debate.sub1[1]/speech[2]/talk.start[2]/para","N/A","N/A","N/A"
"0","0","0","1","0","0","0","1","0","598","0","N/A","N/A","N/A","N/A","N/A","N/A","If it is not inconsistent with that, my other concern is that, each time we depart from the convention in an effort to add another consideration which might be part of an environmental agenda, we increase the potential for inconsistencies and other consequences that flow from that. What I am saying is that we have approached this bill from a different conceptual basis from that of Senator Chamarette in that we have sought to enact domestic law to implement the convention's requirements, whereas Senator Chamarette is seeking to go further and state general principles of environmental responsibility and other matters. We think that it is unwise to do so in this piece of legislation because, as I said, inconsistencies only lead to uncertainty in interpretation which can be counterproductive to the objective that we are seeking. Therefore, on balance, I think it would be better not to include the amendment sought by Senator Chamarette, notwithstanding that I obviously have sympathy with the principle of industry responsibility. In concluding, it could be argued that the principles implicit in the bill—that each applicant for a permit to import or export must demonstrate the need for the proposed movement and must demonstrate the environmental soundness of it—are sufficient. Nothing needs to be added to the bill to make that more explicit. Amendment negatived.","N/A","HAZARDOUS WASTE (REGULATION OF EXPORTS AND IMPORTS) AMENDMENT BILL 1996","/html/body/hansard/chamber.xscript/debate[13]/debate.sub1[1]/speech[2]/para[1]","N/A","N/A","N/A"
"0","0","0","0","0","0","0","1","1","599","0","Senator CHAMARETTE","SN5","N/A","N/A","N/A","N/A","I move:","N/A","HAZARDOUS WASTE (REGULATION OF EXPORTS AND IMPORTS) AMENDMENT BILL 1996","/html/body/hansard/chamber.xscript/debate[13]/debate.sub1[1]/speech[3]/talk.start/para","N/A","N/A","N/A"
"0","0","0","1","0","1","0","1","0","600","0","N/A","N/A","N/A","N/A","N/A","N/A","6. Schedule 1, item 2, page 3 (lines 21 to 22), omit paragraph (b).","N/A","HAZARDOUS WASTE (REGULATION OF EXPORTS AND IMPORTS) AMENDMENT BILL 1996","/html/body/hansard/chamber.xscript/debate[13]/debate.sub1[1]/speech[3]/para[1]","N/A","N/A","N/A"
"0","0","0","1","0","0","0","1","0","601","0","N/A","N/A","N/A","N/A","N/A","N/A","This amendment relates to the aims of the convention and to the article 11 inclusion in the aims. We did speak about it when we were discussing my first amendment in relation to another matter. To reiterate, article 11 is a tiny section of the convention that allows the minister to enter into a bilateral agreement with another country to determine that a hazardous waste is not a hazardous waste. This is by no means the overall aim of the Basel convention and therefore should not be stated as one of the overall aims of the bill. For that reason we wish to see that deleted. I assume the Minister for the Envi ronment (Senator Hill) has not changed his mind since we last raised the matter.","N/A","HAZARDOUS WASTE (REGULATION OF EXPORTS AND IMPORTS) AMENDMENT BILL 1996","/html/body/hansard/chamber.xscript/debate[13]/debate.sub1[1]/speech[3]/para[2]","N/A","N/A","N/A"
"0","0","0","0","0","0","0","1","1","602","0","Senator HILL","BH4","N/A","N/A","Minister for the Environment)","N/A","This is one of the specific purposes of the bill. That is why we are here today. Therefore, we are not inclined to agree to the amendment and remove this aim or the consequent provisions that are otherwise contained in the bill.","N/A","HAZARDOUS WASTE (REGULATION OF EXPORTS AND IMPORTS) AMENDMENT BILL 1996","/html/body/hansard/chamber.xscript/debate[13]/debate.sub1[1]/speech[4]/talk.start/para","N/A","N/A","N/A"
"0","0","0","1","0","0","0","1","0","603","0","N/A","N/A","N/A","N/A","N/A","N/A","Amendment negatived. Item 2 agreed to.","N/A","HAZARDOUS WASTE (REGULATION OF EXPORTS AND IMPORTS) AMENDMENT BILL 1996","/html/body/hansard/chamber.xscript/debate[13]/debate.sub1[1]/speech[4]/para[1]","N/A","N/A","N/A"
"0","0","0","0","0","0","0","1","1","604","0","The CHAIRMAN","10000","N/A","N/A","N/A","N/A","The question is that item 55 stand as printed.","N/A","HAZARDOUS WASTE (REGULATION OF EXPORTS AND IMPORTS) AMENDMENT BILL 1996","/html/body/hansard/chamber.xscript/debate[13]/debate.sub1[1]/speech[4]/interject/talk.start/para","N/A","N/A","N/A"
"0","0","0","0","0","0","0","1","1","605","0","Senator BELL","7U4","N/A","N/A","N/A","N/A","Notwithstanding the fine words of the Minister for the Environment (Senator Hill) about seeking to comply with the convention, the proposition from the government is to substitute the word `safely' with the word `efficiently'. Of course, even somebody with little experience would be able to see that `efficiently' is a word which brings with it a different set of parameters and a different set of decision making opportunities than the word `safely'. If you really mean to comply with the spirit and the purpose of the convention, I see no reason why things should be changed in this way. Surely, it should be safety that we are concerned about with hazardous waste rather than efficiency.","N/A","HAZARDOUS WASTE (REGULATION OF EXPORTS AND IMPORTS) AMENDMENT BILL 1996","/html/body/hansard/chamber.xscript/debate[13]/debate.sub1[1]/speech[5]/talk.start/para","N/A","N/A","N/A"
"0","0","0","1","0","0","0","1","0","606","0","N/A","N/A","N/A","N/A","N/A","N/A","The word `efficiently' can be refined and redefined in a number of ways—according to time, according to economics, according to the convenience of the perpetrators and according to any number of other judgments that can be made. But the word `safely' is one which is fairly absolute. It is either safe or it is not. If that is our aim, why change it? The fear that we have is that the word `efficiently' will be used to cover up all sorts of unsafe practices and all sorts of cost cutting measures which would allow us to escape the general thrust of the convention and allow us to continue to avoid meeting costs here in Australia and to take what might seem to be the cheapest option at the time, but which may cost the earth, literally. We are very determined to see that the spirit of the convention is complied with, without the inclusion of such changes which are innocent looking at first glance but insidious in their effect. The Democrats oppose item 55, which is easily identifiable by us as another one of these escape hatches that the government is trying to sneak in.","N/A","HAZARDOUS WASTE (REGULATION OF EXPORTS AND IMPORTS) AMENDMENT BILL 1996","/html/body/hansard/chamber.xscript/debate[13]/debate.sub1[1]/speech[5]/para[1]","N/A","N/A","N/A"
"0","0","0","0","0","0","0","1","1","607","0","Senator HILL","BH4","N/A","N/A","Minister for the Environment)","N/A","I think there is something of a misunderstanding. The attempt to omit `safely' and substitute `efficiently' has got to be read in conjunction with the intention also to include a new requirement—that is, that such a disposal would be consistent with the environmentally sound management of the waste. So we will have the requirement `efficiently' and we will have the requirement of disposal in an `environmentally sound' way. We believe that that mix better accords with the terms of the convention.","N/A","HAZARDOUS WASTE (REGULATION OF EXPORTS AND IMPORTS) AMENDMENT BILL 1996","/html/body/hansard/chamber.xscript/debate[13]/debate.sub1[1]/speech[6]/talk.start/para","N/A","N/A","N/A"
"0","0","0","1","0","0","0","1","0","608","0","N/A","N/A","N/A","N/A","N/A","N/A","I refer the honourable senator to article 4.2 (d) of the convention. That article requires parties to `ensure that the trans&hyphen;boundary movement of hazardous wastes and other wastes is reduced to the minimum consistent with the environmentally sound and efficient management of such wastes.' Again, my concern, if we are to introduce our new requirement of `environmentally sound management' and if we then leave the provision of safety, is that we run the risk of some ambiguity and, therefore, problems down the track in interpretation. I would rather commend to the Senate the mix of requirements that we have suggested within the bill that we have put. I would hope that Senator Bell, when he reads both together, will regard that as not only a satisfactory prescription but also one that is in accordance with the provisions of the convention.","N/A","HAZARDOUS WASTE (REGULATION OF EXPORTS AND IMPORTS) AMENDMENT BILL 1996","/html/body/hansard/chamber.xscript/debate[13]/debate.sub1[1]/speech[6]/para","N/A","N/A","N/A"
"0","0","0","0","0","0","0","1","1","609","0","Senator FAULKNER","5K4","N/A","N/A","Leader of the Opposition in the Senate)","N/A","Do I take it from Senator Hill's comments that he is likely to support the subsequent amendment moved on behalf of the Australian Democrats? I understood that from your comment, Senator. Is my understanding correct?","N/A","HAZARDOUS WASTE (REGULATION OF EXPORTS AND IMPORTS) AMENDMENT BILL 1996","/html/body/hansard/chamber.xscript/debate[13]/debate.sub1[1]/speech[7]/talk.start/para","N/A","N/A","N/A"
