"question_flag","answer_flag","interjection_flag","speech_flag","petition_flag","quote_flag","motionnospeech_flag","chamber_flag","non_speech_flag","speaker_no","nonspeech","name","name.id","electorate","party","role","page.no","content","subdebateinfo","debateinfo","path","Speaker","Time","Other"
"0","0","0","0","0","0","0","1","1","1","0","N/A","N/A","N/A","N/A","N/A","N/A","The PRESIDENT (Senator the Hon. Michael Beahan) took the chair at 9.30 a.m., and read prayers.","N/A","N/A","/html/body/hansard/chamber.xscript/business.start/proctext/para[1]","N/A","N/A","N/A"
"0","0","0","0","0","0","0","1","1","2","0","The Clerk","10001","N/A","N/A","N/A","N/A","Petitions have been lodged for presentation as follows:","N/A","N/A","/html/body/hansard/chamber.xscript/petition.grp/proctext/interject/talk.start/para","N/A","N/A","N/A"
"0","0","0","0","1","1","0","1","0","3","0","N/A","N/A","N/A","N/A","N/A","N/A","To the Honourable the President and Members of the Senate in the Parliament assembled. The Petition of the undersigned draws to the attention of the Senate Indonesia's continued denial of human rights to the people of East Timor. Your Petitioners ask the Senate to call on the Australian Government to: 1. actively support all United Nations resolutions and initiatives on East Timor; 2. actively support the right to self&hyphen;determination of the people of East Timor; 3. work for the immediate release of all Timorese political prisoners; 4. repeal the Timor Gap Treaty; and 5. stop all military cooperation and commercial military activity with Indonesia. To the Honourable the President and Members of the Senate in Parliament assembled. The Petition of the undersigned shows: That the current practice of destroying the Census is denying future generations an invaluable and irreplaceable resource of data on medical, historical, social, scientific, and demographic factors. Your Petitioners request that the Senate should: Request the Government to review its current policy of destroying the Census; and support a proposal to retain the census forms for release for specific research purposes in either 70 or 100 years time.","N/A","N/A","/html/body/hansard/chamber.xscript/petition.grp/petition[1]/para[1]","N/A","N/A","N/A"
"0","0","0","0","1","0","0","1","0","4","0","N/A","N/A","N/A","N/A","N/A","N/A","Petitions received.","N/A","N/A","/html/body/hansard/chamber.xscript/petition.grp/para","N/A","N/A","N/A"
"0","0","0","0","0","0","0","1","1","5","0","Senator BELL","7U4","N/A","N/A","N/A","N/A","I give notice that, on the next day of sitting, I shall move:","N/A","NOTICES OF MOTION","/html/body/hansard/chamber.xscript/debate[1]/debate.sub1[1]/speech/talk.start/para","N/A","N/A","N/A"
"0","0","0","1","0","1","0","1","0","6","0","N/A","N/A","N/A","N/A","N/A","N/A","That the Senate— notes, with approval, that the Tasmanian Parliament has acted promptly and properly to introduce stronger and more effective gun control laws; and calls on all State Governments to recognise this achievement and to seize the opportunity of the forthcoming police ministers' conference to agree on strong, effective and uniform gun laws throughout Australia.","N/A","NOTICES OF MOTION","/html/body/hansard/chamber.xscript/debate[1]/debate.sub1[1]/speech/break/para[1]","N/A","N/A","N/A"
"0","0","0","0","0","0","0","1","1","7","0","Senator KEMP","WW4","N/A","N/A","Parliamentary Secretary to the Minister for Social Security)","N/A","On behalf of Senator Watson, I give notice that, on the next day of sitting, he will move:","N/A","NOTICES OF MOTION","/html/body/hansard/chamber.xscript/debate[1]/debate.sub1[2]/speech/talk.start/para","N/A","N/A","N/A"
"0","0","0","1","0","1","0","1","0","8","0","N/A","N/A","N/A","N/A","N/A","N/A"," The select committee known as the Select Committee on Superannuation, appointed by the resolution of the Senate of 5 June 1991 and reappointed on 13 May 1993, be reappointed, with the same functions and powers, except as otherwise provided in this resolution. The committee inquire into and report on the following matters referred to it in the previous Parliament: the role of superannuation funds in the governance of Australian corporations, as referred to the committee on 27 November 1995; the implications of the enormous growth in superannuation fund assets in Australia, as referred to the committee on 27 November 1995; the use of derivatives by superannuation funds in Australia, as referred to the committee on 27 November 1995; and the Investment Committee of the Reserve Bank's Officers' Superannuation Fund, as referred to the committee on 29 November 1995. The committee have power to consider and use for its purposes the minutes of evidence and records of the Select Committee on Superannuation appointed in the previous Parliament. The committee consist of 8 senators, 4 nominated by the Leader of the Government in the Senate, 3 nominated by the Leader of the Opposition in the Senate and 1 nominated by any minority groups or independent senators. The nomination of the minority groups or independent senators be determined by agreement between the minority groups and independent senators, and, in the absence of agreement duly notified to the President, the question of the representation on the committee of the minority groups or independent senators be determined by the Senate. The committee elect as its chair a member nominated by the Leader of the Government in the Senate. The committee report to the Senate on or before the last day of sitting in December 1996.","N/A","NOTICES OF MOTION","/html/body/hansard/chamber.xscript/debate[1]/debate.sub1[2]/speech/para[1]","N/A","N/A","N/A"
"0","0","0","0","0","0","0","1","1","9","0","Senator MARGETTS","DX5","N/A","N/A","N/A","N/A","I give notice that, on the next day of sitting, I shall move:","N/A","NOTICES OF MOTION","/html/body/hansard/chamber.xscript/debate[1]/debate.sub1[3]/speech/talk.start/para","N/A","N/A","N/A"
"0","0","0","1","0","1","0","1","0","10","0","N/A","N/A","N/A","N/A","N/A","N/A","That the Senate— notes: the inadequacy of the 1969 `Act of Free Choice' as a genuine expression of self&hyphen;determination on the part of the people of West Papua, the allegations of torture, killing, intimidation and cultural suppression in West Papua, and the strong position of the Indonesian military and multinational mining companies such as Freeport McMoran and Rio Tinto Zinc; and calls on the Government to: investigate allegations of military abuses and human rights abuses in West Papua, urge the World Bank to withdraw insurance cover to Freeport McMoran and Rio Tinto Zinc in West Papua, and cease arms exports to the Indonesian military in West Papua.","N/A","NOTICES OF MOTION","/html/body/hansard/chamber.xscript/debate[1]/debate.sub1[3]/speech/para[1]","N/A","N/A","N/A"
"0","0","0","0","0","0","0","1","1","11","0","Senator MICHAEL BAUME","LE4","N/A","N/A","N/A","N/A","I give notice that, on the next day of sitting, I shall move:","N/A","NOTICES OF MOTION","/html/body/hansard/chamber.xscript/debate[1]/debate.sub1[4]/speech/talk.start/para","N/A","N/A","N/A"
"0","0","0","1","0","1","0","1","0","12","0","N/A","N/A","N/A","N/A","N/A","N/A","That the Senate— notes: the totally incorrect claim, made by the Leader of the Australian Democrats (Senator Kernot) at question time on 2 May 1996, that the latest Treasury economic round&hyphen;up `has cast doubt' on the $8 billion deficit figure released by the Treasurer (Mr Costello), on Treasury advice on 12 March 1996, that, on the contrary, the round&hyphen;up clearly casts no doubts whatsoever on the Treasurer's revelation of the Leader of the Opposition's (Mr Beazley) $8 billion black hole in the Budget, but in fact confirms it, and the round&hyphen;up specifically states that the economic profile of resumption of stronger growth, incorporating a period of temporary weakness, outlined in the round&hyphen;up was implied in the economic Treasury forecast of 12 March 1996 and so was fully taken into account; and regrets Senator Kernot's incorrect statement on such a vital issue as part of her improper political campaign to deny the reality of the severe budgetary problems left by the discredited Keating Government and inherited by the first Howard Government. Notice amended by Mr President pursuant to standing order 76 .","N/A","NOTICES OF MOTION","/html/body/hansard/chamber.xscript/debate[1]/debate.sub1[4]/speech/para[1]","N/A","N/A","N/A"
"0","0","0","0","0","0","0","1","1","13","0","Senator McKIERNAN","1I4","N/A","N/A","N/A","N/A","I give notice that, on the next day of sitting, I shall move:","N/A","NOTICES OF MOTION","/html/body/hansard/chamber.xscript/debate[1]/debate.sub1[5]/speech/talk.start/para","N/A","N/A","N/A"
"0","0","0","1","0","1","0","1","0","14","0","N/A","N/A","N/A","N/A","N/A","N/A","That the Senate— recognises the immeasurable contribution made by electorate staff in the day&hyphen;to&hyphen;day running of electorate offices; acknowledges the fact that electorate staff frequently become the `surrogate member' when their senator or member is away from the electorate office; views, with concern, any proposal to reduce the complement of electorate staff in senators' or members' offices; calls on the Government to: continue to provide all senators and members with at least 3 full&hyphen;time equivalent electorate staff, and not support any proposition to reduce electorate staff levels; and commends electorate staff for their assistance, expertise and loyalty.","N/A","NOTICES OF MOTION","/html/body/hansard/chamber.xscript/debate[1]/debate.sub1[5]/speech/para[1]","N/A","N/A","N/A"
"0","0","0","0","0","0","0","1","1","15","0","N/A","N/A","N/A","N/A","N/A","N/A","Motion (by Senator Chamarette ) agreed to:","N/A","ORDER OF BUSINESS","/html/body/hansard/chamber.xscript/debate[2]/debate.sub1[1]/proctext/para[1]","N/A","N/A","N/A"
"0","0","0","0","0","1","0","1","0","16","0","N/A","N/A","N/A","N/A","N/A","N/A","That general business notice of motion No. 30 standing in the name of Senator Chamarette for this day, relating to the Minister for the Environment (Senator Hill) and the Hazardous Waste (Regulation of Exports and Imports) Amendment Bill 1996, be postponed till the next day of sitting.","N/A","ORDER OF BUSINESS","/html/body/hansard/chamber.xscript/debate[2]/debate.sub1[1]/proctext/para[2]","N/A","N/A","N/A"
"0","0","0","0","0","0","0","1","1","17","0","N/A","N/A","N/A","N/A","N/A","N/A","Motion (by Senator Chris Evans , at the request of Senator Carr ) agreed to:","N/A","ORDER OF BUSINESS","/html/body/hansard/chamber.xscript/debate[2]/debate.sub1[2]/proctext/para[1]","N/A","N/A","N/A"
"0","0","0","0","0","1","0","1","0","18","0","N/A","N/A","N/A","N/A","N/A","N/A","That general business notice of motion No. 34 standing in the name of Senator Carr for today, relating to the national professional development program for teachers, be postponed till Tuesday, 21 May 1996.","N/A","ORDER OF BUSINESS","/html/body/hansard/chamber.xscript/debate[2]/debate.sub1[2]/proctext/para[2]","N/A","N/A","N/A"
"0","0","0","0","0","0","0","1","1","19","0","N/A","N/A","N/A","N/A","N/A","N/A","Motion (by Senator Chris Evans , on behalf of Senator Carr ) agreed to:","N/A","ORDER OF BUSINESS","/html/body/hansard/chamber.xscript/debate[2]/debate.sub1[3]/proctext/para[1]","N/A","N/A","N/A"
"0","0","0","0","0","1","0","1","0","20","0","N/A","N/A","N/A","N/A","N/A","N/A","That general business notice of motion No. 36 standing in the name of Senator Carr for today, relating to education, be postponed till 21 May 1996.","N/A","ORDER OF BUSINESS","/html/body/hansard/chamber.xscript/debate[2]/debate.sub1[3]/proctext/para[2]","N/A","N/A","N/A"
"0","0","0","0","0","0","0","1","1","21","0","N/A","N/A","N/A","N/A","N/A","N/A","Motion (by Senator Chris Evans , at the request of Senator Carr ) agreed to:","N/A","ORDER OF BUSINESS","/html/body/hansard/chamber.xscript/debate[2]/debate.sub1[4]/proctext/para[1]","N/A","N/A","N/A"
"0","0","0","0","0","1","0","1","0","22","0","N/A","N/A","N/A","N/A","N/A","N/A","That general business notice of motion No. 39 standing in the name of Senator Carr for today, relating to unemployment, be postponed till 21 May 1996.","N/A","ORDER OF BUSINESS","/html/body/hansard/chamber.xscript/debate[2]/debate.sub1[4]/proctext/para[2]","N/A","N/A","N/A"
"0","0","0","0","0","0","0","1","1","23","0","N/A","N/A","N/A","N/A","N/A","N/A","Motion (by Senator Bell ) agreed to:","N/A","ORDER OF BUSINESS","/html/body/hansard/chamber.xscript/debate[2]/debate.sub1[5]/proctext/para[1]","N/A","N/A","N/A"
"0","0","0","0","0","1","0","1","0","24","0","N/A","N/A","N/A","N/A","N/A","N/A","That general business notice of motion No. 37 standing in the name of Senator Bell for today, relating to the introduction of the Restitution of Property to King Island Dairy Products Pty Ltd Bill 1996, be postponed till the next day of sitting.","N/A","ORDER OF BUSINESS","/html/body/hansard/chamber.xscript/debate[2]/debate.sub1[5]/proctext/para[2]","N/A","N/A","N/A"
"0","0","0","0","0","0","0","1","1","25","0","N/A","N/A","N/A","N/A","N/A","N/A","Motion (by Senator Reynolds ) agreed to:","N/A","ORDER OF BUSINESS","/html/body/hansard/chamber.xscript/debate[2]/debate.sub1[6]/proctext/para[1]","N/A","N/A","N/A"
"0","0","0","0","0","1","0","1","0","26","0","N/A","N/A","N/A","N/A","N/A","N/A","That general business notice of motion No. 10 standing in the name of Senator Reynolds for today, relating to a code of race ethics, be postponed till the next day of sitting.","N/A","ORDER OF BUSINESS","/html/body/hansard/chamber.xscript/debate[2]/debate.sub1[6]/proctext/para[2]","N/A","N/A","N/A"
"0","0","0","0","0","0","0","1","1","27","0","N/A","N/A","N/A","N/A","N/A","N/A","Motion (by Senator Kemp ) agreed to:","N/A","SYDNEY 2000 GAMES (INDICIA AND IMAGES) PROTECTION BILL 1996 AUSTRALIAN SPORTS DRUG AGENCY AMENDMENT BILL 1996 CRIMES AMENDMENT (CONTROLLED OPERATIONS) BILL 1996 HEALTH INSURANCE AMENDMENT BILL 1996","/html/body/hansard/chamber.xscript/debate[3]/debate.sub1[1]/proctext/para","N/A","N/A","N/A"
"0","0","0","0","0","1","0","1","0","28","0","N/A","N/A","N/A","N/A","N/A","N/A","That the following bills be introduced: A bill for an act to make provision for the regulation of the use of the use for commercial purposes of the indicia and images associated with the Sydney 2000 Olympic Games and the Sydney 2000 Paralympic Games, and for related purposes. A bill for an act to amend the Australian Sports Drug Agency Act 1990, and for related purposes. A bill for an act to amend the Crimes Act 1914 to exempt from criminal liability certain law enforcement officers who engage in unlawful conduct to obtain evidence of offences relating to narcotic goods, and for related purposes. A bill for an act to amend the Health Insurance Act 1973, and for related purposes.","N/A","SYDNEY 2000 GAMES (INDICIA AND IMAGES) PROTECTION BILL 1996 AUSTRALIAN SPORTS DRUG AGENCY AMENDMENT BILL 1996 CRIMES AMENDMENT (CONTROLLED OPERATIONS) BILL 1996 HEALTH INSURANCE AMENDMENT BILL 1996","/html/body/hansard/chamber.xscript/debate[3]/debate.sub1[1]/proctext/break/para[1]","N/A","N/A","N/A"
"0","0","0","0","0","0","0","1","1","29","0","N/A","N/A","N/A","N/A","N/A","N/A","Motion (by Senator Kemp ) agreed to:","N/A","SYDNEY 2000 GAMES (INDICIA AND IMAGES) PROTECTION BILL 1996 AUSTRALIAN SPORTS DRUG AGENCY AMENDMENT BILL 1996 CRIMES AMENDMENT (CONTROLLED OPERATIONS) BILL 1996 HEALTH INSURANCE AMENDMENT BILL 1996","/html/body/hansard/chamber.xscript/debate[3]/debate.sub1[1]/proctext/break/para[6]","N/A","N/A","N/A"
"0","0","0","0","0","1","0","1","0","30","0","N/A","N/A","N/A","N/A","N/A","N/A","That these bills may proceed without formalities, may be taken together and be now read a first time.","N/A","SYDNEY 2000 GAMES (INDICIA AND IMAGES) PROTECTION BILL 1996 AUSTRALIAN SPORTS DRUG AGENCY AMENDMENT BILL 1996 CRIMES AMENDMENT (CONTROLLED OPERATIONS) BILL 1996 HEALTH INSURANCE AMENDMENT BILL 1996","/html/body/hansard/chamber.xscript/debate[3]/debate.sub1[1]/proctext/break/para[7]","N/A","N/A","N/A"
"0","0","0","0","0","0","0","1","1","31","0","N/A","N/A","N/A","N/A","N/A","N/A","Bills read a first time.","N/A","SYDNEY 2000 GAMES (INDICIA AND IMAGES) PROTECTION BILL 1996 AUSTRALIAN SPORTS DRUG AGENCY AMENDMENT BILL 1996 CRIMES AMENDMENT (CONTROLLED OPERATIONS) BILL 1996 HEALTH INSURANCE AMENDMENT BILL 1996","/html/body/hansard/chamber.xscript/debate[3]/debate.sub1[1]/proctext/break/para[8]","N/A","N/A","N/A"
"0","0","0","0","0","0","0","1","1","32","0","Senator KEMP","WW4","N/A","N/A","Parliamentary Secretary to the Minister for Social Security)","N/A","I table the explanatory memoranda relating to the bills, and move:","N/A","SYDNEY 2000 GAMES (INDICIA AND IMAGES) PROTECTION BILL 1996 AUSTRALIAN SPORTS DRUG AGENCY AMENDMENT BILL 1996 CRIMES AMENDMENT (CONTROLLED OPERATIONS) BILL 1996 HEALTH INSURANCE AMENDMENT BILL 1996","/html/body/hansard/chamber.xscript/debate[3]/debate.sub1[2]/speech/talk.start/para","N/A","N/A","N/A"
"0","0","0","1","0","1","0","1","0","33","0","N/A","N/A","N/A","N/A","N/A","N/A","That these bills be now read a second time.","N/A","SYDNEY 2000 GAMES (INDICIA AND IMAGES) PROTECTION BILL 1996 AUSTRALIAN SPORTS DRUG AGENCY AMENDMENT BILL 1996 CRIMES AMENDMENT (CONTROLLED OPERATIONS) BILL 1996 HEALTH INSURANCE AMENDMENT BILL 1996","/html/body/hansard/chamber.xscript/debate[3]/debate.sub1[2]/speech/para[1]","N/A","N/A","N/A"
"0","0","0","1","0","0","0","1","0","34","0","N/A","N/A","N/A","N/A","N/A","N/A","I seek leave to have the second reading speeches incorporated in Hansard . Leave granted. The speeches read as follows — SYDNEY 2000 GAMES (INDICIA AND IMAGES) PROTECTION BILL 1996","N/A","SYDNEY 2000 GAMES (INDICIA AND IMAGES) PROTECTION BILL 1996 AUSTRALIAN SPORTS DRUG AGENCY AMENDMENT BILL 1996 CRIMES AMENDMENT (CONTROLLED OPERATIONS) BILL 1996 HEALTH INSURANCE AMENDMENT BILL 1996","/html/body/hansard/chamber.xscript/debate[3]/debate.sub1[2]/speech/para[2]","N/A","N/A","N/A"
