"question_flag","answer_flag","interjection_flag","speech_flag","petition_flag","quote_flag","motionnospeech_flag","chamber_flag","non_speech_flag","speaker_no","nonspeech","name","name.id","electorate","party","role","page.no","content","subdebateinfo","debateinfo","path","Speaker","Time","Other"
"0","0","0","1","0","0","0","1","0","122","0","N/A","N/A","N/A","N/A","N/A","N/A","There are heaps of authority for that proposition from the highest courts in the land—that the mere fact that you want to get out there and make scurrilous allegations is no basis for saying that there is a genuine public interest in an issue. The courts, I have no doubt, will continue to uphold that very vital distinction. You have tried time and again to dredge up documents that you think might help your case, and they simply have not got you anywhere. The fact is—and, again, this is on the public record—that there was a consultative bidding process in which the authority negotiated with the individual bidders. The bidding process did allow for bids to be adjusted in the last fortnight in order to accommodate last minute—","N/A","COMMITTEES","/html/body/hansard/chamber.xscript/debate[6]/debate.sub1/debate.sub2[3]/speech[3]/break/break/para[11]","N/A","N/A","N/A"
"0","0","0","0","0","0","0","1","1","123","0","Senator Robert Ray","UI4","N/A","N/A","N/A","N/A","It is quite proper.","N/A","COMMITTEES","/html/body/hansard/chamber.xscript/debate[6]/debate.sub1/debate.sub2[3]/speech[3]/break/break/interject[8]/talk.start/para","N/A","N/A","N/A"
"0","0","0","0","0","0","0","1","1","124","0","Senator ALSTON","LD4","N/A","N/A","N/A","N/A","Indeed, but with the way this bloke carries on, what he says is—and poor old Senator Spindler was saying the same thing—`Did you know that at the last minute Lloyd Williams went in there and he upped his bid by $80 million? He have must have known'—","N/A","COMMITTEES","/html/body/hansard/chamber.xscript/debate[6]/debate.sub1/debate.sub2[3]/speech[3]/break/break/talk.start[8]/para","N/A","N/A","N/A"
"0","0","0","0","0","0","0","1","1","125","0","Senator Robert Ray","UI4","N/A","N/A","N/A","N/A","On what basis though?","N/A","COMMITTEES","/html/body/hansard/chamber.xscript/debate[6]/debate.sub1/debate.sub2[3]/speech[3]/break/break/interject[9]/talk.start/para","N/A","N/A","N/A"
"0","0","0","0","0","0","0","1","1","126","0","Senator ALSTON","LD4","N/A","N/A","N/A","N/A","You do not have to be too smart around the traps to know that IT&T were boasting that they had very deep pockets, they could outspend any of the locals, they were heavy hitters from overseas, and that they had every bit of $200 million. Now, there is absolutely no requirement on any bidder to disclose what their hand is any more than you are required to play open poker; you do not have to put your cards on the table. You can get out there and tell people, as people often do, `Look, you know, we couldn't possibly afford to go beyond 150; the shareholders wouldn't think it was a great idea.' In other words, you could do your best to disguise the fact that you are prepared to bid high.","N/A","COMMITTEES","/html/body/hansard/chamber.xscript/debate[6]/debate.sub1/debate.sub2[3]/speech[3]/break/break/talk.start[9]/para","N/A","N/A","N/A"
"0","0","0","1","0","0","0","1","0","127","0","N/A","N/A","N/A","N/A","N/A","N/A","What happened on this occasion was that Crown Casino were clearly confident that the design of their bid was light years ahead of IT&T's. IT&T's bid or proposal has been described as—I forget what the term is—something like `a block design'. But the Crown bid was clearly, from the outset, a much more lavish proposal involving a high&hyphen;rise hotel, large entertainment precinct and open riverside plaza. Again, the terms of the inquiry by the casino authority were that, if the bids were comparable, you would win on the merits—and that is how it ought to be. So all that Crown had to do in revising their bid, as they were required to do, was get themselves into the ballpark. Then, as far as they were concerned, they would win it on the merits—and so it proved. IT&T had had no experience in casinos up to that point in time. They may well have been on a fast learning curve. No doubt, as with most disgruntled bidders, they now want to make suggestions that the process was not all that it might have been. But there is absolutely nothing on the public record to justify those concerns. That is why Senator Carr is sort of scrabbling around to suggest that, because someone ups their bid at the last minute, they must have had inside information; that that somehow must have involved Ron Walker, it must have involved Jeff Kennett. There is not a skerrick of evidence to suggest that. There is no evidence to suggest that the casino authority members were disclosing information they should not have been disclosing. There were requirements on the record for certain information to be provided to the government and—","N/A","COMMITTEES","/html/body/hansard/chamber.xscript/debate[6]/debate.sub1/debate.sub2[3]/speech[3]/break/break/para[13]","N/A","N/A","N/A"
"0","0","0","0","0","0","0","1","1","128","0","Senator Carr","AW5","N/A","N/A","N/A","N/A","Which identified the bids—A and B.","N/A","COMMITTEES","/html/body/hansard/chamber.xscript/debate[6]/debate.sub1/debate.sub2[3]/speech[3]/break/break/interject[10]/talk.start/para","N/A","N/A","N/A"
"0","0","0","0","0","0","0","1","1","129","0","Senator ALSTON","LD4","N/A","N/A","N/A","N/A","You say that. The media has alleged that the state Treasurer was given a minute from his department providing details of the three bids for the casino licence. The information did not identify the bidders—and, of course, Mr Stockdale says he does not recall receiving the minute. Neither the Victorian Casino Authority nor the government have denied that information was passed on to senior departmental officials as part of the licensing process. That was a necessary requirement to resolve questions of government policy on issues such as siting and possible taxation structures. It was important for them to be aware of the revenue implications. But they were not entitled to know which bid was which, nor were they told. You might say after the event, `Well, I'm a pretty smart fellow, I can work out which was A and which was B.' But the fact is—","N/A","COMMITTEES","/html/body/hansard/chamber.xscript/debate[6]/debate.sub1/debate.sub2[3]/speech[3]/break/break/talk.start[10]/para","N/A","N/A","N/A"
"0","0","0","0","0","0","0","1","1","130","0","Senator Robert Ray","UI4","N/A","N/A","N/A","N/A","Especially when you are talking to the others.","N/A","COMMITTEES","/html/body/hansard/chamber.xscript/debate[6]/debate.sub1/debate.sub2[3]/speech[3]/break/break/interject[11]/talk.start/para","N/A","N/A","N/A"
"0","0","0","0","0","0","0","1","1","131","0","Senator ALSTON","LD4","N/A","N/A","N/A","N/A","I am simply saying to you that this was open, aboveboard and known at all times. There was a requirement for information to be provided to the government. You will find that people—those people who Rob Holls has managed to make contact with and presumably persuaded to come along and give evidence to the inquiry—will say that things were perfectly in line with the requirements; in other words, that they saw documents, they saw letters with numbers on them which, presumably, they will say, they believed to have been passed on. I doubt that any of them will say they passed them on, let alone that they saw them passed to ministers or that they have any knowledge of what went on at that level.","N/A","COMMITTEES","/html/body/hansard/chamber.xscript/debate[6]/debate.sub1/debate.sub2[3]/speech[3]/break/break/talk.start[11]/para","N/A","N/A","N/A"
"0","0","0","1","0","0","0","1","0","132","0","N/A","N/A","N/A","N/A","N/A","N/A","As I understand it, all that they will say is what was allowed for by the processes. Let there be no misunderstanding of what this inquiry is all about. Some members of the Labor Party have very serious misgivings about this. The current weak Leader of the Opposition has been vacillating and equivocating from the outset. Senator Robert Ray, I believe, does have a sense of proprietary about these issues and understands the demarcation between federal and state. But both Mr Beazley and Senator Ray have been finally dragged on board because of the political ineptitude of someone whom they ultimately would not even allow to be on the inquiry itself. They now think that perhaps there might be a window of opportunity in which to discredit Mr Howard through Ron Walker. It is a very sad day for Australian politics because those opposite are saying that successful business people should not be involved in politics, should not even belong to political parties, and should not be prepared to serve in appointed positions. They are essentially saying that political parties ought to cut themselves off from the mainstream. The Labor Party gets help from the trade union movement in spades. Talk about an unrepresentative outfit! If you take out the number of trade union officials, if you take out the former party secretaries, and if you take out teachers—and I suspect Senator Carr probably fits into all three categories—you are left with virtually no&hyphen;one with experience of the real world. You do not have any compunction about expecting the trade union movement to hand over hundreds of thousands of dollars to the Labor Party at election time, yet you are prepared to vilify any individual whom you regard as wealthy. You hate the thought of people having earned money in the real world; I presume you would prefer that they were on the public purse—on the drip feed. You are prepared to go to any lengths to discredit serving politicians by getting at people who are out there in the community. This will be exposed for what it is. Senator Carr's speech was very interesting. He seems to have learnt something. I have been reading Senator Carr's public comments with interest to see whether he would prejudge the matter because he used to carry on about this sort of thing.","N/A","COMMITTEES","/html/body/hansard/chamber.xscript/debate[6]/debate.sub1/debate.sub2[3]/speech[3]/break/break/para[16]","N/A","N/A","N/A"
"0","0","0","0","0","0","0","1","1","133","0","Senator Carr","AW5","N/A","N/A","N/A","N/A","Absolutely. I learnt from you, didn't I?","N/A","COMMITTEES","/html/body/hansard/chamber.xscript/debate[6]/debate.sub1/debate.sub2[3]/speech[3]/break/break/break/interject/talk.start/para","N/A","N/A","N/A"
"0","0","0","0","0","0","0","1","1","134","0","Senator ALSTON","LD4","N/A","N/A","N/A","N/A","No, you learnt from your own experiences and excursions on that subject, and you failed absolutely. Nevertheless, you seem to be wanting to steer clear of that. The only possible reason for doing that was because you desperately wanted to be on board. Why are you not on board? Because they will not have you! Your own side will not wear you. They regard you as a total political liability. They know that there is no way in which you could be controlled. You would be in there, letting it all pour out. You would not be worrying about the facts. You would not be worrying about the evidence. You would be simply airing your political prejudices and beating witnesses over the head with them, as you did in other inquiries. You would be making absolutely sure that this would boomerang back on the Labor Party.","N/A","COMMITTEES","/html/body/hansard/chamber.xscript/debate[6]/debate.sub1/debate.sub2[3]/speech[3]/break/break/break/talk.start/para","N/A","N/A","N/A"
"0","0","0","1","0","0","0","1","0","135","0","N/A","N/A","N/A","N/A","N/A","N/A","I commend Senator Ray for his strength from his side of the perspective in standing up to that sort of intimidatory political approach. I hope that, when it is established, this committee will take all those terms of reference very seriously and will recognise that it has an obligation to not only pursue other casino inquiries, but not to stray into extraneous issues. If it does, I can assure those opposite that we will bringing the house down. Those extraneous matters are totally irrelevant and utterly unrelated. The fact that Senator Carr has let the cat out of the bag today in no uncertain terms will be no justification at all for the committee exceeding its brief. Senator Spindler knows the principles of ultra vires. I hope that he will be a moderating influence in that regard. I hope that he will not allow the committee to use this as an excuse to try and find out how the Liberal Party managed to stay afloat during the 1980s—and all the other hatreds that Senator Carr would like to have explored.","N/A","COMMITTEES","/html/body/hansard/chamber.xscript/debate[6]/debate.sub1/debate.sub2[3]/speech[3]/break/break/break/para[2]","N/A","N/A","N/A"
"0","0","0","0","0","0","0","1","1","136","0","Senator Carr","AW5","N/A","N/A","N/A","N/A","That is a good idea.","N/A","COMMITTEES","/html/body/hansard/chamber.xscript/debate[6]/debate.sub1/debate.sub2[3]/speech[3]/break/break/break/break/interject[1]/talk.start/para","N/A","N/A","N/A"
"0","0","0","0","0","0","0","1","1","137","0","Senator ALSTON","LD4","N/A","N/A","N/A","N/A","You think that is a good idea?","N/A","COMMITTEES","/html/body/hansard/chamber.xscript/debate[6]/debate.sub1/debate.sub2[3]/speech[3]/break/break/break/break/talk.start[1]/para","N/A","N/A","N/A"
"0","0","0","0","0","0","0","1","1","138","0","Senator Carr","AW5","N/A","N/A","N/A","N/A","You raised the issue.","N/A","COMMITTEES","/html/body/hansard/chamber.xscript/debate[6]/debate.sub1/debate.sub2[3]/speech[3]/break/break/break/break/interject[2]/talk.start/para","N/A","N/A","N/A"
"0","0","0","0","0","0","0","1","1","139","0","Senator ALSTON","LD4","N/A","N/A","N/A","N/A","You have made very clear today what you believe the committee's agenda ought to be. I am putting you on notice that Mr Beazley should come along and explain his role in the Christmas Island and Burswood inquiries. You should not be permitted to go down the path that you want to go down. This will be the ultimate waste of taxpayers' funds. There is nothing on the public record that provides any justification for what is essentially an abuse of the federal system. Senator Ray knows that in his heart of hearts. I am sure he will go through the motions shortly and tell us how he has now had a conversion and he has suddenly realised that there are significant federal issues involved. He has been around for a long time. He is simply making the best of a very bad hand that has been dealt to him by someone whom he was not prepared to have on the committee.","N/A","COMMITTEES","/html/body/hansard/chamber.xscript/debate[6]/debate.sub1/debate.sub2[3]/speech[3]/break/break/break/break/talk.start[2]/para","N/A","N/A","N/A"
"0","0","0","1","0","0","0","1","0","140","0","N/A","N/A","N/A","N/A","N/A","N/A","I think the politics of this action will become very clear as time goes by. I hope that the committee will be able to report back a lot earlier than December because I can assure those opposite that, well before then, they will find that this inquiry is much more of an embarrassment to the Labor Party than it is to those whom you think you are going to bring down as a result of it.","N/A","COMMITTEES","/html/body/hansard/chamber.xscript/debate[6]/debate.sub1/debate.sub2[3]/speech[3]/break/break/break/break/para","N/A","N/A","N/A"
"0","0","0","0","0","0","0","1","1","141","0","Senator ROBERT RAY","UI4","N/A","N/A","N/A","N/A","I am surprised that Senator Alston, if he thinks this inquiry is going to be a major embarrassment to us, would want to foreclose and not have the inquiry not got through until December. From listening to his rather pathetic defence on this particular matter, I can only reflect on his transition from the law to politics as the law's gain and the Senate's loss.","N/A","COMMITTEES","/html/body/hansard/chamber.xscript/debate[6]/debate.sub1/debate.sub2[3]/speech[4]/talk.start/para","N/A","N/A","N/A"
"0","0","0","1","0","0","0","1","0","142","0","N/A","N/A","N/A","N/A","N/A","N/A","There is one point that Senator Alston makes and that is this: there must be some federal connotation before there is a Senate inquiry. Of course, that is absolutely true. Casinos have a great potential to attract organised crime and to be used for money laundering. Therefore the regulatory approach must be beyond reproach, especially as the Melbourne casino is the biggest casino in Australia. The development of such a facility has implications for our international reputation as a place to do business. The plethora of unanswered questions surrounding the Melbourne casino has the potential to do us international damage and therefore should be of concern to this parliament. I know that the Premier of Victoria has labelled the proposal to have a select committee as a witch&hyphen;hunt, as a kangaroo court, and as McCarthyist. We have had a lot of Senate inquiries over the years on a lot of esoteric subjects, all of which Premier Kennett has greeted with a mute response. We have heard Mr Kennett say, `No way will any Victorian minister or public servant give evidence before a Senate committee.' It was just a couple of years ago where an unctuous and pompous Premier Kennett demanded in the press that ex&hyphen;Premier Kirner and ex&hyphen;Treasurer Sheehan front before a Senate committee. He boasted on that occasion that his Treasurer, Mr Stockdale, had appeared before a Senate committee. He went on to say, `If there is a properly constituted committee, then members of the Victorian parliament should be prepared to attend.' Oh, what a difference a year or two makes! Now, having a Senate inquiry that impinges on some Victorian matters is the end of the world. A year or two ago it was to be greeted with absolute delight. Of course, all this is avoidable. All the pitfalls that Senator Alston has pointed to, all his objections, are totally avoidable. This Senate committee can be rejected today or the inquiry can be aborted at any time through one simple act, and that simple act is for the Premier of Victoria to call an independent judicial inquiry or a royal commission into the circumstances which this inquiry before the Senate is about. That is the action we would prefer. Senator Alston has been able to get away, or hopes to get away, today with misquoting the leader of the Labor Party, Mr Beazley. That has been his central point from the opening of this debate right up till today. It is my contention that it would be preferable to have a Victorian initiated inquiry rather than a Senate inquiry. It is the philosophy of the Victorian government never to have an inquiry. There was no inquiry into the fracas between Bernard Bongiorno and Mrs Wade, the Attorney-General; no inquiry into KNF; no inquiry into Needham Advertising; no inquiry into police shootings. That is the philosophy of the Kennett government. It may be a good, pragmatic approach because, if you do not hold an inquiry, you cannot get any nasty results. But it is not one we in the federal parliament can endorse when our international reputation is at stake. Clearly, Mr Kennett has not even read the terms of inquiry because the actual inquiry is as to whether an inquiry is necessary. Read the terms of reference, those on the other side and Mr Kennett, because we do not seek to substitute ourselves for a royal commission or an independent judicial inquiry. We are simply investigating whether one is required and whether one is necessary. The great joke of all is the Premier of Victoria getting up and saying, `Look at the provisions. There can be in camera hearings.' Doesn't he realise that, 15 or 20 select committees you have moved to establish in the last five years have all had provision for in camera hearings? Doesn't he realise that? Doesn't he acknowledge that section 158 of his own casino act makes it a criminal offence for people to divulge material? Talk about a joke: objecting to in camera evidence! There has been a lot of speculation, so far, as to who would give evidence. There has been no decision made whatsoever on calling anyone. That is up to the committee to do. The Premier of Victoria and Senator Alston say, `There's nothing to investigate.' Let us have a look at the facts; let us have a look at the process. On 1 November 1991, the former Labor state government requested registration of expressions of interest for the licence to operate a casino in Melbourne. The Victorian Casino Control Authority received 23 expressions of interest. Twelve were invited to lodge supplementary submissions. On 27 November 1992, Crown, ITT Sheraton and Jupiters were short&hyphen;listed to bid for the casino. These bids were lodged on 30 April 1993. On 15 June, the Victorian Casino Control Authority decided that Crown and ITT Sheraton would be the final two bidders for the casino licence, and the government conducted an evaluative run&hyphen;off. That is a common practice in awarding tenders of this nature. I take no objection at all to that process. Final bids, following the preparation by the authority of a supplementary brief, were lodged on 30 August 1993. On 5 September 1993, the Victorian Casino Control Authority informed the government that Crown was a preferred applicant for the Melbourne casino licence. At some stage, between 30 April and 30 August, Crown increased its offer to the tune of approximately $92 million. The core question is : how did it know to increase its bid by $92 million to match the other one? How did it know the exact figure? Apparently, they did not even have the cheek to go $3 million or $4 million over. They were so mean, they matched it absolutely. Did they know that ITT Sheraton had reduced their bid somewhat? Of course, we have the assurances from the Premier that:","N/A","COMMITTEES","/html/body/hansard/chamber.xscript/debate[6]/debate.sub1/debate.sub2[3]/speech[4]/para[1]","N/A","N/A","N/A"
"0","0","0","1","0","1","0","1","0","143","0","N/A","N/A","N/A","N/A","N/A","N/A","The Victorian Casino Control Authority is doing an excellent job, independently and is not briefing members of the parliament or relevant ministers on anything other than the issues that have already been made public.","N/A","COMMITTEES","/html/body/hansard/chamber.xscript/debate[6]/debate.sub1/debate.sub2[3]/speech[4]/break/para[5]","N/A","N/A","N/A"
"0","0","0","1","0","0","0","1","0","144","0","N/A","N/A","N/A","N/A","N/A","N/A","And the Treasurer, Mr Stockdale, said:","N/A","COMMITTEES","/html/body/hansard/chamber.xscript/debate[6]/debate.sub1/debate.sub2[3]/speech[4]/break/para[6]","N/A","N/A","N/A"
"0","0","0","1","0","1","0","1","0","145","0","N/A","N/A","N/A","N/A","N/A","N/A","I am not aware of the proposals made by the tenderers, nor would it be appropriate for me to be aware of them.","N/A","COMMITTEES","/html/body/hansard/chamber.xscript/debate[6]/debate.sub1/debate.sub2[3]/speech[4]/break/para[7]","N/A","N/A","N/A"
"0","0","0","1","0","0","0","1","0","146","0","N/A","N/A","N/A","N/A","N/A","N/A","Two categorical statements: one from the Premier; one from the Treasurer. The Treasurer did not tell us that he had received a minute from Mr David Shand on this matter. The minute was directed to the attention of the Treasurer. It was headed `Casino Revenue' and began:","N/A","COMMITTEES","/html/body/hansard/chamber.xscript/debate[6]/debate.sub1/debate.sub2[3]/speech[4]/break/para[8]","N/A","N/A","N/A"
"0","0","0","1","0","1","0","1","0","147","0","N/A","N/A","N/A","N/A","N/A","N/A","This note responds to your request for information on the current projections of casino revenue.","N/A","COMMITTEES","/html/body/hansard/chamber.xscript/debate[6]/debate.sub1/debate.sub2[3]/speech[4]/break/para[10]","N/A","N/A","N/A"
"0","0","0","1","0","0","0","1","0","148","0","N/A","N/A","N/A","N/A","N/A","N/A","In other words, the Treasurer requested this information, having put on the public record they would have no knowledge of any of these issues. The minute noted at point four that:","N/A","COMMITTEES","/html/body/hansard/chamber.xscript/debate[6]/debate.sub1/debate.sub2[3]/speech[4]/break/para[11]","N/A","N/A","N/A"
"0","0","0","1","0","1","0","1","0","149","0","N/A","N/A","N/A","N/A","N/A","N/A","The attached sheet sets out the preliminary summary of cashflows from the three casino bidders, which contain a total of eight different options. (This information should of course be treated in the strictest confidence.)","N/A","COMMITTEES","/html/body/hansard/chamber.xscript/debate[6]/debate.sub1/debate.sub2[3]/speech[4]/break/para[12]","N/A","N/A","N/A"
