"question_flag","answer_flag","interjection_flag","speech_flag","petition_flag","quote_flag","motionnospeech_flag","chamber_flag","non_speech_flag","speaker_no","name","name.id","electorate","party","role","page.no","content","subdebateinfo","debateinfo","path","Speaker","Time","Other"
"0","0","0","1","0","0","0","1","0","202","Senator McEWEN","e5e","N/A","N/A","N/A","N/A","I seek leave to move to amend the motion moved by Senator Ludlam.","Myanmar","MOTIONS","/hansard/chamber.xscript/debate[15]/subdebate.1[1]/speech[2]/talk.text/body/p[1]","Senator McEWEN (South Australia—Government Whip in the Senate) ","(12:36):","N/A"
"0","0","0","0","0","0","0","1","1","203","N/A","N/A","N/A","N/A","N/A","N/A","Leave granted.","Myanmar","MOTIONS","/hansard/chamber.xscript/debate[15]/subdebate.1[1]/speech[2]/talk.text/body/p[2]","N/A","N/A","N/A"
"0","0","0","1","0","0","0","1","0","204","Senator McEWEN","e5e","N/A","N/A","N/A","N/A","I move: Omit paragraph (b), substitute: urges the Myanmar Government to: redouble its efforts to resolve ethnic and sectarian unrest in parts of Myanmar, resolve the underlying causes of unrest, bring to justice those responsible, ensure proper judicial procedures are applied, support the reconciliation of local communities; and provide appropriate humanitarian assistance, including adequate shelter, and access by humanitarian organisations, to those affected by the unrest.","Myanmar","MOTIONS","/hansard/chamber.xscript/debate[15]/subdebate.1[1]/speech[2]/talk.text/body/p[3]","N/A","N/A","N/A"
"0","0","1","0","0","0","0","1","0","205","The PRESIDENT","N/A","N/A","N/A","N/A","N/A","The question is that the amendment moved by Senator McEwen be agreed to.","Myanmar","MOTIONS","/hansard/chamber.xscript/debate[15]/subdebate.1[1]/speech[2]/talk.text/body/p[12]","N/A","N/A","N/A"
"0","0","0","0","0","0","0","1","1","206","N/A","N/A","N/A","N/A","N/A","N/A","Question agreed to.","Myanmar","MOTIONS","/hansard/chamber.xscript/debate[15]/subdebate.1[1]/speech[2]/talk.text/body/p[13]","N/A","N/A","N/A"
"0","0","1","0","0","0","0","1","0","207","The PRESIDENT","N/A","N/A","N/A","N/A","N/A","The question now is that the motion as amended be agreed to.","Myanmar","MOTIONS","/hansard/chamber.xscript/debate[15]/subdebate.1[1]/speech[2]/talk.text/body/p[14]","N/A","N/A","N/A"
"0","0","0","0","0","0","0","1","1","208","N/A","N/A","N/A","N/A","N/A","N/A","Question agreed to.","Myanmar","MOTIONS","/hansard/chamber.xscript/debate[15]/subdebate.1[1]/speech[2]/talk.text/body/p[15]","N/A","N/A","N/A"
"0","0","0","0","0","0","0","1","1","209","N/A","N/A","N/A","N/A","N/A","N/A","Shale Gas","Shale Gas","MOTIONS","/hansard/chamber.xscript/debate[15]/subdebate.1[2]/subdebate.text/body/p","N/A","N/A","N/A"
"0","0","0","1","0","0","0","1","0","210","Senator LUDLAM","I07","N/A","N/A","N/A","N/A","I move: That the Senate— notes: Western Australia has the fifth largest reserve of shale gas in the world, and the Western Australian Government is providing significant subsidies and royalty reductions to incentivise the gas fracking while failing to establish environmental assessment processes to assess its impact on groundwater, environmental integrity and agricultural productivity; and calls on the Government to: explain why the Commonwealth Government deems coal seam gas dangerous to ground water and agricultural productivity but not shale gas fracking, and amend the Environment Protection and Biodiversity Conservation Amendment Bill 2013 to apply equivalent Commonwealth regulatory oversight to shale gas as coal seam gas. Question negatived.","Shale Gas","MOTIONS","/hansard/chamber.xscript/debate[15]/subdebate.1[2]/speech/talk.text/body/p[1]","Senator LUDLAM (Western Australia) ","(12:37):","N/A"
"0","0","0","0","0","0","0","1","1","211","N/A","N/A","N/A","N/A","N/A","N/A","Hansard Services","Hansard Services","MOTIONS","/hansard/chamber.xscript/debate[15]/subdebate.1[3]/subdebate.text/body/p","N/A","N/A","N/A"
"0","0","0","1","0","0","0","1","0","212","Senator MILNE","ka5","N/A","N/A","N/A","N/A","I move: That the Senate— notes: the concern of Hansard editors about their trial changes which have reduced their presence in the Senate and House of Representatives chambers, and that this trial, if made permanent, has a number of serious implications for the social, legal and historical value of Hansard in the future; and calls on the Presiding Officers to: not make decisions which adversely affect or compromise the quality of Hansard services, and ensure that the integrity and quality of Hansard is their foremost consideration. Question negatived.","Hansard Services","MOTIONS","/hansard/chamber.xscript/debate[15]/subdebate.1[3]/speech/talk.text/body/p[1]","Senator MILNE (Tasmania—Leader of the Australian Greens) ","(12:38):","N/A"
"0","0","0","0","0","0","0","1","1","213","N/A","N/A","N/A","N/A","N/A","N/A","Dampier Archipelago","Dampier Archipelago","MOTIONS","/hansard/chamber.xscript/debate[15]/subdebate.1[4]/subdebate.text/body/p","N/A","N/A","N/A"
"0","0","0","1","0","0","0","1","0","214","Senator LUDLAM","I07","N/A","N/A","N/A","N/A","I move: That the Senate— notes that: over one year ago the Australian Heritage Council found that the 30 000 year old rock art complex on the Dampier Archipelago and Burrup Peninsula met two World Heritage criteria, and construction of the Yara Pilbara Nitrates ammonium nitrate plant began in November 2012, in breach of approval conditions under the Environment Protection and Biodiversity Conservation Act 1999, as a survey of rock art within a 2 km radius of the site has not been completed and no air quality monitoring instruments are in place; and calls on the Minister to: commit to taking all necessary steps to have the Dampier Archipelago, which includes the Dampier Archipelago Rock Art Province with its uninterrupted rock art collection spanning 30 000 years, placed on the World Heritage List by 2016, confirm That the Dampier Archipelago is on the Tentative List for World Heritage Nomination, and urgently suspend construction of the Yara Pilbara Burrup Nitrates ammonium nitrate production facility until approval conditions are met. Question negatived.","Dampier Archipelago","MOTIONS","/hansard/chamber.xscript/debate[15]/subdebate.1[4]/speech/talk.text/body/p[1]","Senator LUDLAM (Western Australia) ","(12:38):","N/A"
"0","0","0","0","0","0","0","1","1","215","N/A","N/A","N/A","N/A","N/A","N/A","Sleep Health Foundation","Sleep Health Foundation","MOTIONS","/hansard/chamber.xscript/debate[15]/subdebate.1[5]/subdebate.text/body/p","N/A","N/A","N/A"
"0","0","0","1","0","0","0","1","0","216","Senator MADIGAN","217571","N/A","N/A","N/A","N/A","I, and also on behalf of Senators Xenophon, Smith and Di Natale, move: That the Senate— notes that: the Sleep Health Foundation is one of Australia's foremost authorities on sleep disorders and their effects, the Foundation aims to raise public awareness of sleep health issues and to improve public health and safety through the treatment of sleep disorders and sleep deprivation, and the Foundation's report, Re-awakening Australia: The economic cost of sleep disorders in Australia, 2010 (dated October 2011) estimates the total cost of sleep disorders on the Australian health system in 2010 at $5.1 billion, with a broader economic cost to the community of $31.4 billion; recognises that reducing the incidence of sleep disorders and sleep deprivation would have a positive effect on the wellbeing of the Australian community as well as on the economy; and calls on the Government to review the findings of the Foundation's study and consider the inclusion of sleep health issues as part of a broader preventive health strategy.","Sleep Health Foundation","MOTIONS","/hansard/chamber.xscript/debate[15]/subdebate.1[5]/speech/talk.text/body/p[1]","Senator MADIGAN (Victoria) ","(12:39):","N/A"
"0","0","0","0","0","0","0","1","1","217","N/A","N/A","N/A","N/A","N/A","N/A","Question agreed to.","Sleep Health Foundation","MOTIONS","/hansard/chamber.xscript/debate[15]/subdebate.1[5]/speech/talk.text/body/p[9]","N/A","N/A","N/A"
"0","0","0","0","0","0","0","1","1","218","N/A","N/A","N/A","N/A","N/A","N/A","REGULATIONS AND DETERMINATIONS","N/A","REGULATIONS AND DETERMINATIONS","/hansard/chamber.xscript/debate[16]/debate.text/body/p","N/A","N/A","N/A"
"0","0","0","0","0","0","0","1","1","219","N/A","N/A","N/A","N/A","N/A","N/A","Social Security (Administration) (Vulnerable Welfare Payment Recipient) Principles 2013","Social Security (Administration) (Vulnerable Welfare Payment Recipient) Principles 2013","REGULATIONS AND DETERMINATIONS","/hansard/chamber.xscript/debate[16]/subdebate.1/subdebate.text/body/p","N/A","N/A","N/A"
"0","0","0","0","0","0","0","1","1","220","N/A","N/A","N/A","N/A","N/A","N/A","Disallowance","Social Security (Administration) (Vulnerable Welfare Payment Recipient) Principles 2013","REGULATIONS AND DETERMINATIONS","/hansard/chamber.xscript/debate[16]/subdebate.1/subdebate.2/subdebate.text/body/p","N/A","N/A","N/A"
"0","0","0","1","0","0","0","1","0","221","Senator SIEWERT","e5z","N/A","N/A","N/A","N/A","I move: That the Social Security (Administration) (Vulnerable Welfare Payment Recipient) Principles 2013, made under subsection 123UGA (2) of the Social Security (Administration) Act 1999, be disallowed.","Social Security (Administration) (Vulnerable Welfare Payment Recipient) Principles 2013","REGULATIONS AND DETERMINATIONS","/hansard/chamber.xscript/debate[16]/subdebate.1/subdebate.2/speech/talk.text/body/p[1]","Senator SIEWERT (Western Australia—Australian Greens Whip) ","(12:41):","N/A"
"0","0","1","0","0","0","0","1","0","222","The PRESIDENT","N/A","N/A","N/A","N/A","N/A","The question is that the motion moved by Senator Siewert be agreed to.","Social Security (Administration) (Vulnerable Welfare Payment Recipient) Principles 2013","REGULATIONS AND DETERMINATIONS","/hansard/chamber.xscript/debate[16]/subdebate.1/subdebate.2/speech/talk.text/body/p[3]","N/A","N/A","N/A"
"0","0","0","0","0","0","0","1","1","223","N/A","N/A","N/A","N/A","N/A","N/A","BILLS","N/A","BILLS","/hansard/chamber.xscript/debate[17]/debate.text/body/p","N/A","N/A","N/A"
"0","0","0","1","0","0","0","1","1","224","N/A","r4975","N/A","N/A","N/A","N/A","Family Assistance and Other Legislation Amendment Bill 2013","Family Assistance and Other Legislation Amendment Bill 2013","BILLS","/hansard/chamber.xscript/debate[17]/subdebate.1[1]/subdebate.text/body/a/p","N/A","N/A","N/A"
"0","0","0","0","0","0","0","1","1","225","N/A","N/A","N/A","N/A","N/A","N/A","Second Reading","Family Assistance and Other Legislation Amendment Bill 2013","BILLS","/hansard/chamber.xscript/debate[17]/subdebate.1[1]/subdebate.2[1]/subdebate.text/body/p[1]","N/A","N/A","N/A"
"0","0","0","0","0","0","0","1","1","226","N/A","N/A","N/A","N/A","N/A","N/A","Debate resumed on the motion:","Family Assistance and Other Legislation Amendment Bill 2013","BILLS","/hansard/chamber.xscript/debate[17]/subdebate.1[1]/subdebate.2[1]/subdebate.text/body/p[2]","N/A","N/A","N/A"
"0","0","0","0","0","0","0","1","1","227","N/A","N/A","N/A","N/A","N/A","N/A","That this bill be now read a second time.","Family Assistance and Other Legislation Amendment Bill 2013","BILLS","/hansard/chamber.xscript/debate[17]/subdebate.1[1]/subdebate.2[1]/subdebate.text/body/p[3]","N/A","N/A","N/A"
"0","0","0","1","0","0","0","1","0","228","Senator FIFIELD","D2I","N/A","N/A","N/A","N/A","I rise to speak on the Family Assistance and Other Legislation Amendment Bill 2013. This bill seeks to bring in to effect the government's changes to the baby bonus announced in the Mid-Year Economic and Fiscal Outlook 2012-13. The bill also makes a number of other amendments to family assistance and social security payments. I intend to focus my remarks on the baby bonus. The baby bonus is something that has been under attack by this government for some time. The government has repeatedly slashed the baby bonus in an attempt to find savings. In the 2009-10 federal budget, Labor paused the indexation of the upper income limit of the baby bonus at $75,000. In the Mid-Year Economic and Fiscal Outlook of 2011-12, the government paused the indexation of the baby bonus payment until 2014-15 and reduced the rate of payment from $5,437 to $5,000. In the 2012-13 Mid-Year Economic and Fiscal Outlook, the government announced its intention to reduce the baby bonus from $5,000 to $3,000 effective from 1 July 2013. However, as we all know, since then government has been engulfed by yet another budget emergency of its own making and has decided to abolish the baby bonus to save $1.1 billion over the forward estimates. In its place from 1 March 2014, families who are eligible for family tax benefit part A and who are not accessing parental leave will receive an additional loading on their payment. The extra family tax benefit part A payment will provide $2,000 for a family's first child and for each child in a multiple birth and $1,000 for second and subsequent children. It is pretty clear that Australian families are losing out because of this government's complete and utter incapacity to manage the budget of the Commonwealth. The government is ripping money away from Australian families, in effect, to attempt to cover part of the cost of this reckless spending. The baby bonus was introduced for very important public policy reasons. That is pretty straightforward. Australia needs to maintain a high fertility rate. That is critical to our long-term prosperity. The reality was reflected in the Intergenerational report, which was such an important, seminal document when it was first released. That report identified that there were three things that Australia needed to do to ensure its future prosperity. It needed to ensure the population continued to grow, that participation in the Australian economy was there for as many people as possible, and that productivity was increased in Australia. Those were what are often referred to as the three p's: population, participation and productivity. That really was at the heart of the motivation behind the baby bonus. The baby bonus had quite a significant effect in lifting the fertility rate of Australia. That is important, because once a nation's fertility rate declines it is very hard to elevate it again. So the baby bonus was quite successful. If the coalition were in government we would have a different starting point today, compared to where the current government is, because we would have taken different decisions over the course of that period in government. The abolition of the baby bonus is not a decision that we would have taken if we were in government because, as I said, we would have managed the budget differently and had a different starting point. We recognise that the government has completely and utterly trashed the Commonwealth's budget, and for that reason the coalition—although in government we would not be making this decision—will not be opposing this bill.","Family Assistance and Other Legislation Amendment Bill 2013","BILLS","/hansard/chamber.xscript/debate[17]/subdebate.1[1]/subdebate.2[1]/speech[1]/talk.text/body/p[1]","Senator FIFIELD (Victoria—Manager of Opposition Business in the Senate) ","(12:49):","N/A"
"0","0","0","1","0","0","0","1","0","229","Senator MADIGAN","217571","N/A","N/A","N/A","N/A","I wish to speak against this bill in order to record my opposition to yet further erosion of assistance to families. The cuts to the baby bonus are uncalled for. Also, the payment of the baby bonus at a lower level for second and subsequent babies perpetuates the myth that children are cheaper by the dozen. The reality is that the birth of the second and subsequent children brings about additional financial pressure on families. They face increased costs in child care, housing and transport. For over 30 years, governments of both persuasions have departed from the concept of horizontal equity for families and they have reduced families to welfare recipients. I still believe that families are the basic units of society. They make a huge contribution, not just in raising their own children but in forming the citizens of tomorrow. Unfortunately, this is no longer seen as an important social function. Having children is viewed as a private decision. If it is a private decision then you are entirely responsible for funding it. The reduction of the baby bonus in this bill demonstrates that the government no longer believes that children are an investment in the nation's future. Children have been reduced to a commodity for which the user pays. 'If you cannot afford them do not have them; we don't care.' That is the message that this bill gives to families. All families ought to receive some financial recognition for their contribution to society in raising tomorrow's citizens. And low-income families ought to receive additional financial assistance because no child ought to be raised in poverty. Investment in children is an investment in the future, and all parents deserve tax recognition for this important role. Wage earners are now treated as independent individuals with no dependants—a triumph of rampant individualism. Having children makes you an economic basket case. Until the 1970s the tax system took into account the number of dependants that the wage earner provided for before taxing them. The government recognised that supporting families was an investment in the future—not any more. Families are no longer seen as productive social units but as drains on the public purse and as recipients of welfare. The fact that assistance to families is subject to strict income tests means that only low-income families receive financial assistance. It is demeaning for some families to be singled out—by being reduced to welfare recipients—as unable to support their dependants. I believe our economy is best served by looking after families and communities first. Unfortunately, this is not the message that this bill gives families. As such, I will be voting against the bill.","Family Assistance and Other Legislation Amendment Bill 2013","BILLS","/hansard/chamber.xscript/debate[17]/subdebate.1[1]/subdebate.2[1]/speech[2]/talk.text/body/p[1]","Senator MADIGAN (Victoria) ","(12:54):","N/A"
