"question_flag","answer_flag","interjection_flag","speech_flag","petition_flag","quote_flag","motionnospeech_flag","chamber_flag","non_speech_flag","speaker_no","name","name.id","electorate","party","role","page.no","content","subdebateinfo","debateinfo","path","Speaker","Time","Other"
"0","0","0","1","0","0","0","1","0","496","Senator STEPHENS","00AOS","N/A","N/A","N/A","N/A","I want to thank Senator Siewert for her contribution to this debate on the charities legislation tonight, because she has gone to the core—the nub—of this issue. And I want to reassure Senator Fifield that, rather than placing an onerous regulatory burden on our charities and not-for-profit sector, these bills before us tonight are going to enhance the capacity of those organisations that are going to be engaged so intimately in the DisabilityCare Australia process. They are actually going to relieve them of many burdens. I am speaking this evening because I want to acknowledge the long history this suite of bills has had in this place and in previous parliaments—and Senator Fifield perhaps was working in the former Treasurer's office when the first discussions about this occurred. But of course it goes back even further than that, to the Industry Commission report in the 1990s. Many, many people have been involved, and I really want to thank everyone who has been committed to persisting in working to achieve an independent regulator for Australia's charities and not-for-profit sector. Everyone says the seminal document really is the Productivity Commission's report of 2010, which laid out the blueprint for change and reform that had to happen in the sector to modernise the sector and to ensure its long-term sustainability. That report created the snapshot that the sector contributes more than $40 billion a year to GDP, more than 600,000 organisations and more than one million staff—and that is the quantifiable contribution—but that the real value of the sector is often the unattributed contribution to the quality of life that we all experience in Australia. I would like to place on the record the important work of the Community Council for Australia. In their submission to the Parliamentary Joint Committee on Corporations and Financial Services inquiry into these bills they make this point—and this is the nub of why we need this suite of bills: If an NFP wants to hire a local hall at a discounted charitable rate, gain a concession on local rates charges, achieve a reduction in payroll tax, put forward a submission for funding, participate in a government tender process, register a fundraising activity or seek to claim a concession of any kind, the organisation must be able to produce some kind of bona fides, a kind of organisational passport. At present no such document exists. Charities are forced to provide copies of letters from the Australian Taxation Office that define their eligibility for taxation concessions as proof of their charitable status. This situation has proven to be very problematic, costly and counterproductive. That is it, in a nutshell. What is being achieved through these bills is the establishment of an independent regulator. And I want to commend the work of the ACNC task force and the first ACNC commissioner, Susan Pascoe, and her team. They have done the most amazing job in working through the mechanics of how the ACNC will operate as a light-touch regulator and as an enabler of our charities and not-for-profits. Their work through the last six months has been extraordinary, and I would really like to congratulate the staff and the commissioners for their efforts. The passport will be extraordinary. The consequences in savings in time, energy and resources will be amazing, and there will be flow-on reductions to red tape rather than any sense of a regulatory burden. Duplication and compliance costs will be reduced and they will translate into better frontline services for our communities. In the six months the ACNC has been operating, the ACNC team has actually taken over 11,000 phone calls, received over 17,000 email requests for information and had face to face consultations with over 1,000 not-for-profits in workshops and presentations across the country. At the same time, more than 250 new charities have been registered on the new website, more than 10 new guides and fact sheets have been prepared and been released and the ACNC has received over 150 complaints about charities, resolved mostly through various forms of mediation. Not one charity has been deregistered, because that is not what the ACNC is taking as its first line. Its first line of approach is to mediate and resolve and remediate by educating and enabling the organisations. So we have a very effective ACNC in place, and I really do call on the opposition to reconsider their objections to the ACNC and to these bills. The shadow spokesman has already indicated to the sector that it is his intention to wind back the ACNC, to actually reverse the progress that has been made in this important space. So I really do call on the opposition to reconsider that position. I would like the acknowledge the work of the Assistant Treasurer David Bradbury and his staff, Minister Butler and his staff and the many groups and organisation who have worked so hard to advise the ACNC advisory council and bring common sense to the debate. This package of bills is being lauded around the world as the most progressive and substantive not-for-profit governance package of bills, a best practice model for other jurisdictions. They deserve our support.","Charities Bill 2013, Charities (Consequential Amendments and Transitional Provisions) Bill 2013","BILLS","/hansard/chamber.xscript/debate[27]/subdebate.1[4]/subdebate.2[1]/speech[3]/talk.text/body/p[1]","Senator STEPHENS (New South Wales) ","(19:26):","N/A"
"0","0","0","1","0","0","0","1","0","497","Senator BOYCE","H6V","N/A","N/A","N/A","N/A","Once again I will speak very briefly so that there is some vague hope of others having a chance to speak on this bill. I am sure that every senator who has taken and will take part in this debate, truncated as it is, has the best interests of the charities of Australia at heart. But I must admit that I continue to look at the large charities and the smaller charities and I see a vast difference. In many cases it is like the comparison between Myer and the local milk bar, such that recently a Victorian advocate for the not-for-profit sector has established a peak group for not-for-profits that employ two or fewer people. They found that necessary because whilst we have the government telling us how every charity in Australia thinks this is wonderful, the only people who have really been spoken to are the corporate charities, the big ones—the Red Cross, the Salvation Army et cetera. These people do great jobs but they are not the representatives of every entity that should be considered a charity in Australia. I have real concerns about how the government has consulted, if at all, and how the government has heard, if at all, the message coming from small charities. There are also concerns about how this has been put together. Areas have been left out of the human rights aspects of the bill. ACOSS, for example, talked about the lack of clarity when an entity lacks the element of public benefit, and the idea that the way you decide on public benefit is in the absence of evidence to the contrary. If part of this bill is about taking these issues out of the courts and back into the legislature, I have no idea how a section that talks about 'in the absence of evidence to the contrary' assists in this matter. We also have a section put together by Treasury that looks at the amendments that were accepted to this bill. But they do not look at the amendments to the bill that were not accepted, and nor do we have any explanation as to why they were not accepted. We just have to look at the definition of a charity: charity means an entity: that is a not-for-profit entity; and all of the purposes of which are: charitable purposes (see Part 3) that are for the public benefit (see Division 2 of this Part); … No-one has explained quite how op-shops and other enterprises, profit-making enterprises providing profits to charitable organisations, are to work. Section 6 of this bill talks about public benefit. It says: the achievement of the purpose would be of public benefit; … And must be available to: the general public; or a sufficient section of the general public. What does a 'sufficient section' mean? The bill also refers to 'tangible' or 'intangible' benefit. What does that mean? One imagines that all these matters could be something that will be the matter of court action if people do not like the reasons that a 'sufficient section' is involved or that a benefit is 'tangible'. As Senator Stephens alluded to, a coalition government would repeal this bill and would set up a body that was simply designed for educative and training purposes. I am sure they could answer all the questions that Senator Stephens has pointed out are there, without a massive new regulatory burden that undermines 400 years of case law around the definition of 'charity'.","Charities Bill 2013, Charities (Consequential Amendments and Transitional Provisions) Bill 2013","BILLS","/hansard/chamber.xscript/debate[27]/subdebate.1[4]/subdebate.2[1]/speech[4]/talk.text/body/p[1]","Senator BOYCE (Queensland) ","(19:31):","N/A"
"0","0","0","1","0","0","0","1","0","498","Senator XENOPHON","8IV","N/A","N/A","N/A","N/A","Because of the limited time available for this bill because of the guillotine I will truncate my remarks significantly. I indicate my support for this bill. I believe it is overdue, and, as Senator Stephens has pointed out, there have been multiple past inquiries in relation to this. I see this bill as helping the charities sector. I take into account what Senator Boyce has said about having unnecessary red tape for smaller charities, and I believe this bill does have a tiered approach in respect of that. I think we need to define 'charitable purposes' and therefore a 'benefit for the public'. At the moment, we go back to England's Charitable Uses Act of 1601. It has been around for more than 400 years, and we actually need to have some sensible, codified reform in relation to this. We have seen in New Zealand recently and, for a number of years, in the UK that they have had charities commissions in place. I believe these have worked effectively to support organisations and to hold the very few rogue organisations to account. I direct members of the Senate to some of the decisions of the charities commissions in respect of that. I draw senators' attention to the excellent work done by Professor Gino Dal Pont of the University of Tasmania and to his paper on the uniqueness of charity through the prism of public benefit. I was lucky enough to hear his presentation earlier this year. I cannot, because of time, discuss what Professor Dal Pont said, but, basically, he gives a very good explanation of the history of this. I believe it strengthens the need for legislation such as this. It is important to note that a similar test of public benefit exists in other countries—UK, New Zealand, Singapore and a whole range of jurisdictions around the world. Why do we need it? Because, occasionally, there are organisations that abuse that tax-free status. This is not about belief. This is not about advocacy. This is not about impinging on anything like that, but it is about making sure that an organisation that abuses the privilege is held to some measure of reasonable account. Having a public benefit test is important in relation to that. Let us make it very clear, the benefits that we give to charities are between $1 billion and $8 billion a year, according to a Senate economics inquiry that I instigated and was part of in relation to looking at the tax act and the public benefit test. Imagine where we would be, as a nation, without the benefit of charities? I dread to think how many bureaucrats it would take—no disrespect to bureaucrats or those from large corporations—to set up a soup kitchen. The work that charities do is invaluable. The cohesiveness of our society—our social fabric—would be torn without it. I believe that this bill is an evolving measure. Let us see how effective it is. Let us see if it needs to be fine-tuned in years to come, but I believe the principles are sound and I believe that what we see here is a useful piece of legislation that will hold organisations to account. It would be remiss of me not to say, in the remaining 20 seconds, that I became interested in this field because I was approached by a number of victims from the Church of Scientology. I believe that all organisations, if they are behaving in an abusive manner, ought to be held to some measure of account. A public benefit test is a useful measure of that.","Charities Bill 2013, Charities (Consequential Amendments and Transitional Provisions) Bill 2013","BILLS","/hansard/chamber.xscript/debate[27]/subdebate.1[4]/subdebate.2[1]/speech[5]/talk.text/body/p[1]","Senator XENOPHON (South Australia) ","(19:36):","N/A"
"0","0","1","0","0","0","0","1","0","499","The PRESIDENT","N/A","N/A","N/A","N/A","N/A","The question is that the bills be now read a second time.","Charities Bill 2013, Charities (Consequential Amendments and Transitional Provisions) Bill 2013","BILLS","/hansard/chamber.xscript/debate[27]/subdebate.1[4]/subdebate.2[1]/speech[5]/talk.text/body/p[7]","N/A","N/A","N/A"
"0","0","0","0","0","0","0","1","1","500","N/A","N/A","N/A","N/A","N/A","N/A","Third Reading","Charities Bill 2013, Charities (Consequential Amendments and Transitional Provisions) Bill 2013","BILLS","/hansard/chamber.xscript/debate[27]/subdebate.1[4]/subdebate.2[2]/subdebate.text/body/p","N/A","N/A","N/A"
"0","0","0","1","0","0","0","1","0","501","The PRESIDENT","7L6","N/A","N/A","N/A","N/A","The question now is that the remaining stages of these bills be agreed to and the bills be now passed.","Charities Bill 2013, Charities (Consequential Amendments and Transitional Provisions) Bill 2013","BILLS","/hansard/chamber.xscript/debate[27]/subdebate.1[4]/subdebate.2[2]/speech/talk.text/body/p","The PRESIDENT ","(19:50):","N/A"
"0","0","0","1","0","0","0","1","1","502","N/A","r5067","N/A","N/A","N/A","N/A","Crimes Legislation Amendment (Law Enforcement Integrity, Vulnerable Witness Protection and Other Measures) Bill 2013","Crimes Legislation Amendment (Law Enforcement Integrity, Vulnerable Witness Protection and Other Measures) Bill 2013","BILLS","/hansard/chamber.xscript/debate[27]/subdebate.1[5]/subdebate.text/body/a/p","N/A","N/A","N/A"
"0","0","0","0","0","0","0","1","1","503","N/A","N/A","N/A","N/A","N/A","N/A","Second Reading","Crimes Legislation Amendment (Law Enforcement Integrity, Vulnerable Witness Protection and Other Measures) Bill 2013","BILLS","/hansard/chamber.xscript/debate[27]/subdebate.1[5]/subdebate.2[1]/subdebate.text/body/p[1]","N/A","N/A","N/A"
"0","0","0","0","0","0","0","1","1","504","N/A","N/A","N/A","N/A","N/A","N/A","Debate resumed on the motion:","Crimes Legislation Amendment (Law Enforcement Integrity, Vulnerable Witness Protection and Other Measures) Bill 2013","BILLS","/hansard/chamber.xscript/debate[27]/subdebate.1[5]/subdebate.2[1]/subdebate.text/body/p[2]","N/A","N/A","N/A"
"0","0","0","0","0","0","0","1","1","505","N/A","N/A","N/A","N/A","N/A","N/A","That this bill be now read a second time.","Crimes Legislation Amendment (Law Enforcement Integrity, Vulnerable Witness Protection and Other Measures) Bill 2013","BILLS","/hansard/chamber.xscript/debate[27]/subdebate.1[5]/subdebate.2[1]/subdebate.text/body/p[3]","N/A","N/A","N/A"
"0","0","0","1","0","0","0","1","0","506","Senator BRANDIS","008W7","N/A","N/A","N/A","N/A","The Crimes Legislation Amendment (Law Enforcement Integrity, Vulnerable Witness Protection and Other Measures) Bill 2013 makes a number of technical and enabling amendments to streamline investigations and prosecutions of people-smuggling crew which appear to the coalition to be quite sensible changes. This bill was referred to the Senate Standing Committee on Legal and Constitutional Affairs, which reported just yesterday and recommended that the bill be passed—a recommendation in which coalition members joined. It is worth quoting from the additional comments of the Liberal senators. They said: Coalition senators consider that the terms of the … Bill 2013 are directed at a number of apparently useful changes to existing legislation. Some of those changes have been expressly welcomed by submitters to the inquiry. However, Coalition senators take this opportunity to outline their concerns with the lack of proper scrutiny which this bill has been afforded under this rushed reference to the committee. Input to this inquiry has been seriously hampered by the restrictive timeframe, putting at risk the strong reputation of this committee for conducting careful and comprehensive scrutiny of every bill referred to it. It is this fact that Australian Lawyers for Human Rights … raise in their submission where they state: The fact that submissions are required in less than 40 hours destroys any notion of accountability and public scrutiny which is sought to be provided by public involvement in the committee process. They go on to say: However because of the time period the Parliament has chosen to allocate for submissions, ALHR— that is, Australian Lawyers for Human Rights— are unable to assess and respond on these matters. We would like the Committee to note our concern and opposition to such a short time being made for submissions. So, even though this week the government has made a farce of the role of the Senate as a house of review by guillotining through 55 bills in a week—an absolute farce—and although their complicity in that legislative manoeuvre has exposed the Greens to be the rank hypocrites that they are, never will one of them be able to say, without knowing themselves to be uttering wilfully dishonest statements, that they care about the role of the Senate as a house of review. Notwithstanding that, it is worth remembering that it is not merely in the Senate chamber that this government's abridgement of democratic processes is seen. It is also seen in the abuse by the government of the committee system. How extraordinary that a bill of this kind should require public submissions from the time of advertisement to the time of closure to be provided in 40 hours—less than two business days? It is bad enough to guillotine legislation through the chamber; it is even worse to effectively guillotine the committee system, because the committee system is the point of direct intersection between the parliament and the public. It is the point of direct intersection between the parliament and, in particular, the specialist public—like, for example, on a bill relating to the criminal justice system, the legal profession and criminal law practitioners and people who work with victims and work with offenders—to solicit their expert input so that the Senate's deliberations can be informed by the people on the ground, as it were, who are in the best position to advise the parliament as to the effectiveness or appropriateness of bills and opportunities to reform those bills. I think this bill, which the opposition, as I said, does support, provides a shocking example of the way in which the guillotining of legislation not merely interferes with the parliament's capacity to deliberate but it also foreshortens to the point of effective irrelevance the public's capacity to contribute to the Senate committee system. The gibbering fools who comprise the Greens party and who speak so loudly and eloquently about democracy and the role of the Senate as a house of review are complicit in that. So let us not take any protestations from you, Senator Rhiannon, or you Senator Penny Wright, or you Senator Di Natale, or you Senator—whoever you are—Siewert seriously. In any event, having made the point about the disgraceful process which has attended this bill—","Crimes Legislation Amendment (Law Enforcement Integrity, Vulnerable Witness Protection and Other Measures) Bill 2013","BILLS","/hansard/chamber.xscript/debate[27]/subdebate.1[5]/subdebate.2[1]/speech[1]/talk.text/body/p[1]","Senator BRANDIS (Queensland—Deputy Leader of the Opposition in the Senate) ","(19:52):","N/A"
"0","0","1","0","0","0","0","1","0","507","Senator Siewert","e5z","N/A","N/A","N/A","N/A","Mr Acting Deputy President, I rise on a point of order. Senator Brandis can at least use our proper names when he is taking up the valuable time of the Senate hurling abuse. He could at least use our proper names.","Crimes Legislation Amendment (Law Enforcement Integrity, Vulnerable Witness Protection and Other Measures) Bill 2013","BILLS","/hansard/chamber.xscript/debate[27]/subdebate.1[5]/subdebate.2[1]/speech[1]/talk.text/body/p[15]","N/A","N/A","N/A"
"0","0","0","1","0","0","0","1","0","508","Senator BRANDIS","008W7","N/A","N/A","N/A","N/A","Through you, Mr Acting Deputy President: I am sorry, Senator Siewert. I thought your name was Senator Siewert, but I momentarily forgot it.","Crimes Legislation Amendment (Law Enforcement Integrity, Vulnerable Witness Protection and Other Measures) Bill 2013","BILLS","/hansard/chamber.xscript/debate[27]/subdebate.1[5]/subdebate.2[1]/speech[1]/talk.text/body/p[16]","N/A","N/A","N/A"
"0","0","1","0","0","0","0","1","0","509","Senator Siewert","e5z","N/A","N/A","N/A","N/A","Mr Acting Deputy President, he also forgot Senator Di Natale's name.","Crimes Legislation Amendment (Law Enforcement Integrity, Vulnerable Witness Protection and Other Measures) Bill 2013","BILLS","/hansard/chamber.xscript/debate[27]/subdebate.1[5]/subdebate.2[1]/speech[1]/talk.text/body/p[17]","N/A","N/A","N/A"
"0","0","0","1","0","0","0","1","0","510","Senator BRANDIS","008W7","N/A","N/A","N/A","N/A","Mr Acting Deputy President, is there a point of order?","Crimes Legislation Amendment (Law Enforcement Integrity, Vulnerable Witness Protection and Other Measures) Bill 2013","BILLS","/hansard/chamber.xscript/debate[27]/subdebate.1[5]/subdebate.2[1]/speech[1]/talk.text/body/p[18]","N/A","N/A","N/A"
"0","0","1","0","0","0","0","1","0","511","Senator Edwards","N/A","N/A","N/A","N/A","N/A","The ACTING DEPUTY PRESIDENT ( Senator Edwards ): No, it has not risen to one.","Crimes Legislation Amendment (Law Enforcement Integrity, Vulnerable Witness Protection and Other Measures) Bill 2013","BILLS","/hansard/chamber.xscript/debate[27]/subdebate.1[5]/subdebate.2[1]/speech[1]/talk.text/body/p[19]","N/A","N/A","N/A"
"0","0","1","0","0","0","0","1","0","512","A government senator","N/A","N/A","N/A","N/A","N/A","interjecting—","Crimes Legislation Amendment (Law Enforcement Integrity, Vulnerable Witness Protection and Other Measures) Bill 2013","BILLS","/hansard/chamber.xscript/debate[27]/subdebate.1[5]/subdebate.2[1]/speech[1]/talk.text/body/p[20]","N/A","N/A","N/A"
"0","0","1","0","0","0","0","1","0","513","The ACTING DEPUTY PRESIDENT","N/A","N/A","N/A","N/A","N/A","Order! I just remind the chamber that every senator has an obligation to address each of the other senators by their correct name. Thank you very much.","Crimes Legislation Amendment (Law Enforcement Integrity, Vulnerable Witness Protection and Other Measures) Bill 2013","BILLS","/hansard/chamber.xscript/debate[27]/subdebate.1[5]/subdebate.2[1]/speech[1]/talk.text/body/p[21]","N/A","N/A","N/A"
"0","0","0","1","0","0","0","1","0","514","Senator BRANDIS","008W7","N/A","N/A","N/A","N/A","Certainly, Mr Acting Deputy President. I simply forgot Senator Siewert's name momentarily. I was reflecting on the grossness of the hypocrisy of the Greens party in allowing the process of deliberation, not just in the chamber but through the Senate committee process, to be so truncated as to be virtually non-existent. But, nevertheless, the opposition have scrutinised the terms of the bill and we are satisfied with it and find ourselves able to support it. The Liberal senators devoted most of their report to a critique of the inadequacy of the committee process. I have made the observations that I wanted to make about that. As to the substance of the bill, the provisions seem to us to be sensible and, therefore, as indicated at the start, the bill has the coalition's support.","Crimes Legislation Amendment (Law Enforcement Integrity, Vulnerable Witness Protection and Other Measures) Bill 2013","BILLS","/hansard/chamber.xscript/debate[27]/subdebate.1[5]/subdebate.2[1]/speech[1]/talk.text/body/p[22]","N/A","N/A","N/A"
