index,question_flag,answer_flag,interjection_flag,speech_flag,petition_flag,quote_flag,motionnospeech_flag,chamber_flag,name,name.id,electorate,party,role,page.no,content,subdebateinfo,debateinfo,path,Speaker,Time
275,0,0,0,1,0,0,0,1,"REID, George","F4P","N/A","N/A","N/A",2087,"- I suggest to the Minister that the proposed words should be inserted after sub-clause (2), because that sub-clause has close reference to sub-clause (1). Sub-clause (2) provides that whenever any of the holidays set forth hi sub-clause (1) falls upon a Sunday, they shall be observed upon the following Monday ; and it would be well to make a new sub-clause of the words proposed, and insert them after sub-clause (2).","N/A","PUBLIC SERVICE BILL","/hansard/chamber.xscript/debate[6]/speech[60]/talk.start/para","N/A","N/A"
276,0,0,1,0,0,0,0,1,"LYNE, William","KIN","N/A","N/A","N/A",2088,"- I accept the suggestion, and am quite willing that the words should be inserted as a new subclause, after sub-clause (2).Amendment agreed to.Clause, as further amended, agreed to.Clause 71 -The Governor-General may make, alter, or repeal regulations for the carrying out of the provisions of this Act, and in particular for all, or airy, of the following purposes, namely - . . .Prescribing the lowest amount for what the lives of officers shall, having regard to their annual salary be assured.","N/A","PUBLIC SERVICE BILL","/hansard/chamber.xscript/debate[6]/speech[60]/interjection/talk.start/para","N/A","N/A"
277,0,0,0,1,0,0,0,1,"LYNE, William","KIN","N/A","Protectionist","N/A",2088,"- I move-That after the words  assured, in sub-clause (»»), the following words be inserted: - And other matters in connexion with the provisions of section 44.This provision will give power to make regulations under section 44 in reference to assurance.","N/A","PUBLIC SERVICE BILL","/hansard/chamber.xscript/debate[6]/speech[61]/talk.start/para","N/A","N/A"
278,0,0,0,1,0,0,0,1,"ISAACS, Isaac","KJI","Indi","N/A","N/A",2088,"- I think it is a very bad form to adopt to refer to any particular section. In the passage of the Bill through the two Houses it is more than probable that the numbers of the clauses will be altered. If the Minister by the words section 44 means to refer to life assurance  it would be better to insert the words.","N/A","PUBLIC SERVICE BILL","/hansard/chamber.xscript/debate[6]/speech[62]/talk.start/para","N/A","N/A"
279,0,0,0,1,0,0,0,1,"LYNE, William","KIN","N/A","N/A","N/A",2088,"- Perhaps that would be better. I therefore move -That the words  section 44  be omitted with a view to insert in lieu thereof the words  this Act relating to life assurance.Amendment, upon the amendment, agreed to.Clause, as further amended, agreed to. Mr. PIESSE (Tasmania).- I move That the following stand a new clause in the Bill :-Any officer feeling aggrieved by any determination made under this Act affecting such officers position in the service, or his pay, or any promotion or transfer, to which he may consider himself entitled and desiring to appeal from, or to make any complaint in respect of any such determination shall make such appeal or complaint to the commissioner in such manner and within such time as may be prescribed.I think this provision will carry out what many honorable members are desirous of seeing in the Bill. That is to say, it will provide a means whereby any officer who feels himself aggrieved by any determination under the Act can have recourse to am appeal to some constituted authority. But while this new clause will give the opportunity which any aggrieved officer should have I hope it will have the further effect of preventing officers from travelling outside that constituted authority to air their grievances. If such a provision is adopted it will be a part of this Act, and- any departure from its terms will be a breach of the Act, and will bring the offending officer under the penalties which such a breach imposes.","N/A","PUBLIC SERVICE BILL","/hansard/chamber.xscript/debate[6]/speech[62]/continue[1]/talk.start/para","N/A","N/A"
280,0,0,1,0,0,0,0,1,"ISAACS, Isaac","KJI","N/A","N/A","N/A",2088,"- What does the Government say to this proposal ?","N/A","PUBLIC SERVICE BILL","/hansard/chamber.xscript/debate[6]/speech[62]/interjection/talk.start/para","N/A","N/A"
281,0,0,0,1,0,0,0,1,"LYNE, William","KIN","N/A","N/A","N/A",2088,"- I accept it.Mr. ISAACS(Indi).- I should like to point out some practical difficulties which suggest themselves to me. Does the honorable gentleman allow an appeal to the commissioner from the Governor-General,, because that is what this proposal means 1","N/A","PUBLIC SERVICE BILL","/hansard/chamber.xscript/debate[6]/speech[62]/continue[2]/talk.start/para","N/A","N/A"
282,0,0,0,1,0,0,0,1,"LYNE, William","KIN","N/A","N/A","N/A",2088,"- No. My object last night was to allow of an appeal to the commissioner before the commissioner made his recommendation to the Governor-General. If the clause is not worded to carry out that, intention we must alter its wording. I thought that that was the idea which the honorable and learned member for Tasmania, Mr. Piesse,- intended to convey. If we allowed an appeal to the commissioner after the Governor-General had dealt with any matter that would be allowing an appeal from the Governor-General to be decided by the commissioner, which of course was. never contemplated.","N/A","PUBLIC SERVICE BILL","/hansard/chamber.xscript/debate[6]/speech[62]/continue[3]/talk.start/para","N/A","N/A"
283,0,0,0,1,0,0,0,1,"PIESSE, Frederick","KY9","Tasmania","N/A","N/A",2088,"- The position, suggested would be a very awkward one no doubt, but we are in that position at present.. If civil servants appeal to the commissioner,, after the Governor-General has dealt with their cases, they will be met by the commissioner saying - This has been the subject of an appeal to the  Governor-General and I cannot consider it. . Civil, servants now have an appeal from the determination of the Governor -. General. They can bring political pressure to bear even after the determination of the Governor-General, so that by adopting the proposal which I have submitted we should not be * giving any more liberty to civil servants than they at present enjoy. The answer to the honorable and learned member for Indi is that whenever an appeal is made against the Governor-Generals decision. a commissioner would say - I cannot re-open the matter, the appeal is decided. But other appeals, which would not come under that objection, would still be open to the public service. Without some such provision we shall still allow civil servants, who have grievances by reason qf any executive determination to come, as they hitherto have done, to Members of Parliament, and the whole trouble we are trying to prevent will still be open. I hope that the clause will be accepted as it stands.","N/A","PUBLIC SERVICE BILL","/hansard/chamber.xscript/debate[6]/speech[63]/talk.start/para","N/A","N/A"
284,0,0,0,1,0,0,0,1,"COOK, James","K4I","BOURKE, VICTORIA","PROT","N/A",2089,"- I think I am largely responsible for this suggestion regarding an appeal, and I understood that the Ministry were going to put forward a proposal of their own. If the new clause submitted by the honorable and learned member for Tasmania, Mr. Piesse, will meet the case, well and good ; but I think that the honorable and learned member for Indi has raised a very serious point. It appears to me that the new clause is somewhat adverse to what, we desire to carry out. Like the honorable and learned member for Tasmania, I want the members of the public service to have a right of appeal which will obviate the ear-wigging of Members of Parliament, and our having individual grievances ventilated upon the floor of this chamber. I have seen hours and hours wasted in this House upon a discussion of the grievances of some railway porter, simply because he had no decent tribunal to which he could appeal. If a proper tribunal were established to which officers with grievances could appeal, we should save an immense amount of time, ~~and when Members of Parliament were approached, they would be able to say to the civil servant -  Use the machinery provided for you in the Public Service Act, and when you have exhausted that, let us hear what you have to say.","N/A","PUBLIC SERVICE BILL","/hansard/chamber.xscript/debate[6]/speech[64]/talk.start/para","N/A","N/A"
285,0,0,1,0,0,0,0,1,"LYNE, William","KIN","N/A","N/A","N/A",2089,"- What is the honorable members proposal ?","N/A","PUBLIC SERVICE BILL","/hansard/chamber.xscript/debate[6]/speech[64]/interjection/talk.start/para","N/A","N/A"
286,0,0,0,1,0,0,0,1,"COOK, James","K4I","BOURKE, VICTORIA","PROT","N/A",2089,"- I have no proposal ; the question is too complicated for me as a layman.","N/A","PUBLIC SERVICE BILL","/hansard/chamber.xscript/debate[6]/speech[64]/continue/talk.start/para","N/A","N/A"
287,0,0,0,1,0,0,0,1,"REID, George","F4P","East Sydney","N/A","N/A",2089,"- The object of the clause is so good, that we should try to remove the objection that has been raised against it. Really, it is only in point of form that the Governor-General may be said to have arrived at a determination. It would be well, perhaps, to amend the form, to prevent incongruity. I should prefer the use of the word  dissatisfied  to that of  aggrieved,  in connexion with any determination or recommendation of the commissioner;","N/A","PUBLIC SERVICE BILL","/hansard/chamber.xscript/debate[6]/speech[65]/talk.start/para","N/A","N/A"
288,0,0,1,0,0,0,0,1,"ISAACS, Isaac","KJI","N/A","N/A","N/A",2089,"- Instead of  determination, why not use the words report or recommendation, which will mean either the permanent head or the commissioner?","N/A","PUBLIC SERVICE BILL","/hansard/chamber.xscript/debate[6]/speech[65]/interjection/talk.start/para","N/A","N/A"
289,0,0,0,1,0,0,0,1,"REID, George","F4P","N/A","N/A","N/A",2089,"- lt would be better to use the word dissatisfied, instead of aggrieved.Proposed new clause withdrawn.Mr. PIESSE(Tasmania). - I move-That the following new clause stand part of the Bill : -  Any officer feeling dissatisfied with any report or recommendation made under this Act affecting such officers position in the service, or his pay, or any promotion or transfer, may appeal to the commissioner in such manner and within such time as may be prescribed.Clause agreed to.Bill reported with further amendments.","N/A","PUBLIC SERVICE BILL","/hansard/chamber.xscript/debate[6]/speech[65]/continue/talk.start/para","N/A","N/A"
290,0,0,0,1,0,0,0,1,"DEAKIN, Alfred","009MD","Ballarat","Protectionist","Attorney-General",2089,". -I move -That the Bill be now read a second time. This is perhaps the simplest Bill that has been, or is likely to be, brought before us. It provides for the recognition throughout the Commonwealth of the laws, the public Acts and records, and judicial proceedings of the States. As such it is practically an Evidence Bill, and is introduced under the specific power conferred by section 51 of the Constitution, sub-section (25), which empowers the Parliament to legislate in this direction. In this one particular we are authorized to determine in part, at all events, the procedure of State courts, and hence this measure relates to the whole of the proposed federal courts of the Commonwealth, from the High Court downwards. Generally speaking, we should have no power to deal with State courts, but in this measure they also are introduced. As honorable members will see, the Bill embraces clauses which have been taken from the English and State Acts, and, in one case, I think, from an Act of the United States. We provide for judicial notice of certain documents, of certain signatures, and of other matters. The measure is one purely for consideration in committee, because, beyond the fact that the clauses are collected together for a common purpose, they necessarily embrace separate subjects or separate stages and matters of procedure, and under these circumstances I should . be detaining the House if I were now to speak upon points which, if debated at all, will require to be discussed in detail in committee. The marginal notes will help to indicate in most cases the sources from which these clauses have been derived. The measure, though very short and comparatively simple, will be found extremely useful, especially as it provides for a uniform recognition of laws and records throughout the whole of the Commonwealth, by courts of the Commonwealth or courts of the State.","Second Reading","STATE LAWS AND RECORDS RECOGNITION BILL","/hansard/chamber.xscript/debate[7]/subdebate.1/speech[1]/talk.start/para","N/A","N/A"
291,0,0,0,1,0,0,0,1,"ISAACS, Isaac","KJI","Indi","N/A","N/A",2090,"- This will no doubt be a very useful measure in many respects, but, although it is true the clauses are taken in very many instances from existing sections in other Acts, it seems to me that very grave doubts will exist as to whether some of these sections, as they at present stand, are constitutional. The Attorney-General has pointed out that this Bill comes under a particular power - and that is perfectly true - which authorizes the Commonwealth to pass legislation to secure the recognition throughout the Commonwealth of the laws, public acts and records, and judicial proceedings of the States. That is the extent of the power given by theConstitution, but this Bill will be found to deal with many private acts, documents, and records. It seems to me, therefore, at first sight, that it trenches upon State territory, and exceeds the powers of the Commonwealth Parliament. In other respects the clauses are adopted from some of the existing sections in terms which, although perhaps not intended to be so, are departures from the original, and which, as far as I can see at present, leave behind the original intention of the section. For instance, it is quite right to say that in one State where a public record is evidence that record should be judicially noticed in another State or proved in a particular way, and that a copy certified to in a particular way shall be evidence of that public record. That is what is done under existing Acts, but this Bill goes so far, in some cases, as to make a copy of such records evidence  whether the original would be evidence or not. In that respect some words have been omitted from the existing sections, which keep strictly to the point- I have mentioned. I have no doubt that this has been done by inadvertence, but when we come  to debate the matter in committee some light may be thrown upon it.","Second Reading","STATE LAWS AND RECORDS RECOGNITION BILL","/hansard/chamber.xscript/debate[7]/subdebate.1/speech[2]/talk.start/para","N/A","N/A"
292,0,0,1,0,0,0,0,1,"DEAKIN, Alfred","009MD","N/A","N/A","N/A",2090,"- I will be able to show the honorable member that it is intentional.","Second Reading","STATE LAWS AND RECORDS RECOGNITION BILL","/hansard/chamber.xscript/debate[7]/subdebate.1/speech[2]/interjection/talk.start/para","N/A","N/A"
293,0,0,0,1,0,0,0,1,"ISAACS, Isaac","KJI","N/A","N/A","N/A",2090,"- I need not prolong my observations at this stage. My view amounts to this, that except where these doubts arise as to the powers under which the Bill is framed, the measure seems to be a very useful one indeed.","Second Reading","STATE LAWS AND RECORDS RECOGNITION BILL","/hansard/chamber.xscript/debate[7]/subdebate.1/speech[2]/continue/talk.start/para","N/A","N/A"
294,0,0,0,1,0,0,0,1,"REID, George","F4P","East Sydney","N/A","N/A",2090,"- I also look upon this Bill as one which will be a great convenience in all judicial proceedings in the States. A similar point to that raised by the honorable and learned member for Indi occurred to me, but it was more in reference to the use of one word here - the word  arbitrator. Of course, where arbitrators act under certain references of the courts, their acts and their proceedings will probably be well covered by tins Bill ; but it is a loose expression, because the word has a good deal more meaning than. that. It is capable of referring to arbitration of a voluntary character, and not an arbitration through the courts I only mention that as a further matter which might engage the attention of the Attorney-General. It seems to me that the Bill is very well drawn indeed, and will be a very good measure.Question resolved in the affirmative.Bill read a second time, and committed 1>roformat","Second Reading","STATE LAWS AND RECORDS RECOGNITION BILL","/hansard/chamber.xscript/debate[7]/subdebate.1/speech[3]/talk.start/para","N/A","N/A"
295,0,0,0,0,0,0,0,1,"N/A","N/A","N/A","N/A","N/A","N/A","second reading.","N/A","CUSTOMS BILL","/hansard/chamber.xscript/debate[8]/para","N/A","N/A"
296,0,0,0,1,0,0,0,1,"KINGSTON, Charles","KEW","South AustraliaMinister for Trade and Customs","Protectionist","Minister for Trade and Customs",2090,"- I move-That the Bill be now read a second time.In moving the second reading of this Bill I feel that I am dealing with a very important measure. Though possibly it is not a measure which possesses many attractions to . the general public, it is undoubtedly a measure of the greatest consequence to the mercantile community ; and I desire to gratefully acknowledge the various suggestions which I have received in regard to it from representative commercial men. The Government feel that it is essential in connexion with the adoption of a uniform Tariff that there shall be a uniform system of administration, for a uniform Tariff might be rendered practically worthless by the absence of uniformity in administration. Uniformity of administration depends upon uniformity of legislation, which at the present time is, of course, conspicuous by its absence. It will be necessary that we shall at the earliest possible date put upon our statute book laws dealing generally with these questions. Various laws will be required for the purpose, but the chief of them is the Bill with which I am now dealing. I have seen it stated that the measure is an exact copy of the Victorian legislation ; but I can assure honorable members that it is nothing of the sort.","N/A","CUSTOMS BILL","/hansard/chamber.xscript/debate[8]/speech[1]/talk.start/para","N/A","N/A"
297,0,0,0,1,0,0,0,1,"HIGGINS, Henry","KHC","N/A","N/A","N/A",2091,"- What harm would be done if it were 1","N/A","CUSTOMS BILL","/hansard/chamber.xscript/debate[8]/speech[2]/talk.start/para","N/A","N/A"
298,0,0,0,1,0,0,0,1,"KINGSTON, Charles","KEW","N/A","N/A","N/A",2091,"- What harm would be done if it were ? At the same time, it would be strange indeed to find all the wisdom of Customs legislation concentrated in the measure adopted by one of the half-dozen States included in the Commonwealth. That cannot be said of the Customs regulation legislation of Victoria, so far as I know. For the purpose of framing uniform legislation, recourse has . been had to the Customs laws of the different States - to the New South Wales Acts equally with the Victorian Acts ; and Canada has not been forgotten, nor has the legislation of New Zealand, and of the United Kingdom. The Government have . been singularly fortunate in being able to command in connexion with this measure the services of the chief Customs officials of the various Australian States. It is to them that any credit for the form of the legislation which we propose to adopt will attach, and we cheerfully assume all the responsibility for whatever faults the measure may possess. In Dr. Wollaston, the Collector of Customs of Victoria ; in Mr. Lockyer, of New South Wales ; in Mr. - Irving, of Queensland ; in Mr. Stevens, of South Australia ; in Mr. Mason, of WesternAustralia ; and in Mr. Bernard, of Tas- mania, we have found gentlemen capable of giving us the sagest advice. They met , in conference for the purpose of deliberating upon the subject, and the -duty of framing the measure has been discharged  by them with an intelligence and industry which I am delighted to acknowledge. I -have thought it well in dealing with this matter not to slavishly - copy any of .the existing systems. These systems have been handed down to us from  time to time without much modification of the form which they originally possessed. In some instances they have struck us as cumbersome ; in others we have found provisions which there is little or no necessity to apply to the circumstances of to-day ; and we have done what we could to make the Bill as clear and readable as possible, so that Parliament may place in the hands of the community a measure which will not require legal assistance for its interpretation, but will be intelligible to the ordinary lay mind. We feel it necessary, as a matter of principle, to provide in the fullest imaginable way, consistent with fairness, for the protection of the revenue ; but at the same time we have endeavoured to avoid, as far as possible, unnecessary harassing of the mercantile community. We feel that the security of the revenue and the protection of the honest merchants who form the great bulk of our mercantile community, against the devious ways which lax legislation might permit, and which might subject them to unfair competition, are proper objects to pursue; but where those objects are attained, we desire, so far as we can, to avoid unnecessary interference with the ordinary commercial operations of the community. We feel also that the Bill is one which can be more properly dealt with in committee, and one in respect to which no long second reading speech is necessary. Having done our best, we present it for consideration in committee, not with any slavish attachment to line or letter, because we happen to be responsible for its present form, but, despite the jocular criticisms which have been heard from the other side of the chamber, with the intention of welcoming any real amendment which may be suggested, in order that we may do the best we can in respect to a measure which is undoubtedly not a party measure. AVe wish to place on the statute-book a measure under which all can work, and which, in due course, will be a suitable accompaniment to that uniform Tariff which we hope shortly to introduce, and in respect of which it is most likely there will be more room for differences of opinion than exists in respect to this measure. The Bill contains, to be precise, 263 clauses and three schedules ; but, for the comfort of honorable members, I should like to mention that the clauses are very short, and the Bill more condensed, and, I hope, more intelligible than the legislation of the States which deals with similar matters. It is intended that it shall commence upon a day to be fixed by proclamation. That is provided by clause 2, and honorable members can well understand that there will be no unnecessary delay in bringing it into force. It should, of course, precede the final adoption of the uniform Tariff, however much we may and will labour to bring that into force at the earliest possible date. The fourth clause is the interpretation clause, and honorable members will note that a large definition is there given to the term Answer questions and produce documents  - obligations which in various clauses of the measure are cast upon persons in connexion with Customs transactions. For the security of the revenue, it is highly desirable that the Customs authorities shall be in a position to obtain all necessary information as regards the value of goods and a variety of other matters. This information can be secured in two ways - by questioning, and by insisting upon the production of documents. It is to this end that these obligations are cast upon persons transacting Customs business, and the extended meaning which is given to the term is practically this: - That, as regards answering questions, the party questioned shall impart to the best of his knowledge all information which the Customs authorities have a right to know ; and as regards the production of documents, he shall similarly produce whatever documents are required relating to the goods in question. The  Customs  for the purposes of the measure is defined as the Department of Trade and Customs. The next clause to which I wish to call attention is clause 5, which enables me to avoid the necessity of providing time and again, in connexion with offences against the measure, that in the case of any contravention of the clause, on the conviction of the offender he shall be subject to this, that, and the other penalty.","N/A","CUSTOMS BILL","/hansard/chamber.xscript/debate[8]/speech[2]/continue/talk.start/para","N/A","N/A"
299,0,0,1,0,0,0,0,1,"HIGGINS, Henry","KHC","N/A","N/A","N/A",2092,"- The device in the Bill is a very good one.","N/A","CUSTOMS BILL","/hansard/chamber.xscript/debate[8]/speech[2]/interjection/talk.start/para","N/A","N/A"
300,0,0,0,1,0,0,0,1,"KINGSTON, Charles","KEW","SOUTH AUSTRALIA, SOUTH AUSTRALIA","PROT","N/A",2092,"- I am glad that the honorable and learned member approves of the arrangement. I think that the repetition which is indulged in in statutes, although hallowed by precedent, is altogether unnecessary, and is something appalling. We have attempted in this connexion to make the Bill as plain as can be, by putting at the end of particular clauses  penalty so and so, indicating by clause 5 that that is the maximum penalty which attaches totheircontravention.","N/A","CUSTOMS BILL","/hansard/chamber.xscript/debate[8]/speech[3]/talk.start/para","N/A","N/A"
301,0,0,1,0,0,0,0,1,"REID, George","F4P","N/A","N/A","N/A",2092,"- Yet I see that by clause 34 the honorable gentleman proposes to charge a duty on condensation.","N/A","CUSTOMS BILL","/hansard/chamber.xscript/debate[8]/speech[3]/interjection[1]/talk.start/para","N/A","N/A"
