index,question_flag,answer_flag,interjection_flag,speech_flag,petition_flag,quote_flag,motionnospeech_flag,chamber_flag,name,name.id,electorate,party,role,page.no,content,subdebateinfo,debateinfo,path,Speaker,Time
1,0,0,0,0,0,0,0,1,"N/A","N/A","N/A","N/A","N/A","N/A","HouseofRepresentatives.","N/A","N/A","/hansard/chamber.xscript/business.start/para[1]","N/A","N/A"
2,0,0,0,0,0,0,0,1,"N/A","N/A","N/A","N/A","N/A","N/A","Tuesday, 26 May","N/A","N/A","/hansard/chamber.xscript/business.start/para[2]","N/A","N/A"
3,0,0,0,0,0,0,0,1,"N/A","N/A","N/A","N/A","N/A","N/A","Mr. Speaker took the chair at 3 p.m., and read prayers.","N/A","N/A","/hansard/chamber.xscript/business.start/para[3]","N/A","N/A"
4,1,0,0,0,0,0,0,1,"CATTS, James","JWO","N/A","N/A","N/A",11419,"- I wish to ask the Prime Minister whether he has seen in the press of to-day the following -When the fleet was at Magdalena Bay, California, Admiral Thomas made the following request to the associated press : -  I wish that you would convey my request to the people of California, that, us far as may be possible, they refrain from furnishing the men of the fleet with intoxicating liquors. I would consider it a personal favour if they would do so. It is nearly always the case when our men reach a home port that some of the people are inclined to offer them liquor. Many consider it a part of the entertainment, and perhaps it is; but it works a bad end. The men are thus induced to drink, and drink too much.  On board the ships liquor is prohibited, and the men are unaccustomed to its use. When they get ashore there is no such restraint. On the way around South* America the fleet has made an enviable record for good conduct ashore. It would be exceedingly regrettable if, upon reaching the United States again, this good reputation should be dimmed.  I appreciate that most people have the best motives only in offering liquor to the enlisted men, but it would be better for the men and the navy in general if it were not done. I sincerely trust that it will not be.In view of this request on the part of Admiral Thomas, who is in charge of the fleet which will shortly visit Australia, will the Prime Minister issue instructions to the Committees making arrangements for the entertainment of the men that, as a matter of courtesy, the wish of the Admiral in this respect should be conceded?","VISIT OF AMERICAN FLEET","QUESTIONS","/hansard/chamber.xscript/debate[1]/subdebate.1[1]/question/talk.start/para","N/A","N/A"
5,0,0,0,1,0,0,0,1,"DEAKIN, Alfred","009MD","N/A","Protectionist","N/A",11419,"- I saw for the first time this morning the letter from Admiral Thomas published in the press. At the first meeting of the Joint Committee, held last week, this subject was discussed, as far as it could be, in the absence of knowledge of what the wishes of the American Admiral would be. Subject to that consideration, the genera] feeling of the Committee was that undue temptation should not be placed in the way of the sailors..","VISIT OF AMERICAN FLEET","QUESTIONS","/hansard/chamber.xscript/debate[1]/subdebate.1[1]/answer/talk.start/para","N/A","N/A"
6,0,0,1,0,0,0,0,1,"REID, George","F4P","N/A","N/A","N/A",11419,"- Undue temptation! What does that mean?","VISIT OF AMERICAN FLEET","QUESTIONS","/hansard/chamber.xscript/debate[1]/subdebate.1[1]/answer/interjection/talk.start/para","N/A","N/A"
7,0,0,0,1,0,0,0,1,"DEAKIN, Alfred","009MD","N/A","N/A","N/A",11419,"- As the Committee arrived at no resolution absolutely defining its attitude on this subject, I am not here to make a definite statement; but the feeling of the Committee was that whilst no temptation should be placed in the way of the sailors, it was undesirable to ignore those who might wish for other than temperance liquors.","VISIT OF AMERICAN FLEET","QUESTIONS","/hansard/chamber.xscript/debate[1]/subdebate.1[1]/answer/continue/talk.start/para","N/A","N/A"
8,1,0,0,0,0,0,0,1,"MCWILLIAMS, William","JUV","N/A","N/A","N/A",11419,"- Will the Postmaster-General lay upon the table any correspondence relating to the alteration of the Tasmania!) mail service?","TASMANIAN MAIL SERVICE","QUESTIONS","/hansard/chamber.xscript/debate[1]/subdebate.1[2]/question/talk.start/para","N/A","N/A"
9,0,0,0,1,0,0,0,1,"MAUGER, Samuel","KNJ","N/A","Protectionist","N/A",11419,"- There is very little correspondence on the subject, but what there is I shall be pleased to lay on the table.","TASMANIAN MAIL SERVICE","QUESTIONS","/hansard/chamber.xscript/debate[1]/subdebate.1[2]/answer/talk.start/para","N/A","N/A"
10,1,0,0,0,0,0,0,1,"OMALLEY, King","K5D","N/A","N/A","N/A",11419,"- Does the Prime Minister think it fair to take ?250,000 of Customs and Excise revenue for naval and military purposes to protect the property of the wealthy when such money, in the form of indirect taxation, comes for the most part out of the pockets of the never-ending struggling poor? Is he. aware that under such a financial system the great burden of defence oppresses the poor, and allows the rich - who own and control the wealth of Australia - to escape that which is their legitimate liability ? Seeing that the cost of national defence under his proposal brings about this result, will he introduce a Bill to impose a graduated land, income, inheritance, absentee, and wealth tax, so that those who shriek so loudly for naval and military armament in Australia will thus be afforded an opportunity to indorse their lip-loyalty to the Empire and their property inspired Australian patriotism with their own sovereigns?","DEFENCE SCHEME","QUESTIONS","/hansard/chamber.xscript/debate[1]/subdebate.1[3]/question/talk.start/para","N/A","N/A"
11,0,0,0,1,0,0,0,1,"DEAKIN, Alfred","009MD","N/A","Protectionist","N/A",11420,"- When I have an opportunity of seeing the honorable members elaborate question in print, I can take an early opportunity to consider it.","DEFENCE SCHEME","QUESTIONS","/hansard/chamber.xscript/debate[1]/subdebate.1[3]/answer/talk.start/para","N/A","N/A"
12,1,0,0,0,0,0,0,1,"CROUCH, Richard","K7U","N/A","N/A","N/A",11420,"- I have a question to put without notice to the Prime Minister. I am unable to find in the Budget papers or in those detailing the proposals of the Government in regard to the financial relations of the Commonwealth and the States any definite statement as to the services, other than defence and old-age pensions, for which provision is to be made out of the surplus revenue to be withheld . from the States. As the Premier of one State has already started an attack upon the Commonwealth in respect of the Governments financial proposals, will the Prime Minister make an official statement as to the services which the Government propose to take over from the States, and the additional services for which they propose to provide out of the Commonwealths present proportion of Customs and Excise revenue? Further, will the Prime Minister have such a statement circulated for the information of the general public ?","COMMONWEALTH AND STATES : FINANCIAL RELATIONS","QUESTIONS","/hansard/chamber.xscript/debate[1]/subdebate.1[4]/question/talk.start/para","N/A","N/A"
13,0,0,0,1,0,0,0,1,"DEAKIN, Alfred","009MD","N/A","Protectionist","N/A",11420,"- If the honorable member will move for a return of that character,I shall have much pleasure in allowing the motion to go unopposed.","COMMONWEALTH AND STATES : FINANCIAL RELATIONS","QUESTIONS","/hansard/chamber.xscript/debate[1]/subdebate.1[4]/answer/talk.start/para","N/A","N/A"
14,1,0,0,0,0,0,0,1,"THOMSON, John","KW8","N/A","PROT; LP from 1910; NAT from 1917","N/A",11420,"- Has the attention of the Prime Minister been called to the following telegram from Lithgow, published in the Sydney, Morning Herald of Saturday, 23rd inst. : -Mr. Hoskins stated this morning that the blast furnace was working very satisfactorily, and turning out pig-iron equal if not superior to the best Scotch pig. Yet they were not able to sell the local article owing to the fact that the imported article could be sold at a lower price. During one week recently nearly the whole of the product of the furnace of 700 tons was stacked, while on other occasions about 400 tons each week have been stacked. In view of this absence of demand and the excessive cost of manufacture, it will mean that they will have to stop the furnace or get some encouragement either by way of duty or bonus.In view of this report, I wish to ask the Prime Minister what steps he intends to take with regard to the encouragement of this national industry?","IRON INDUSTRY","QUESTIONS","/hansard/chamber.xscript/debate[1]/subdebate.1[5]/question/talk.start/para","N/A","N/A"
15,0,0,0,1,0,0,0,1,"DEAKIN, Alfred","009MD","N/A","Protectionist","N/A",11420,"- The honorable member is probably aware that the Manufactures Encouragement Bill is still on the business paper, and that its further consideration in Committee was suspended pending the determination of what provisions should be included in the Tariff regarding the importation of iron. Those provisions having been practically settled, the Bill will be proceeded with as soon as possible.","IRON INDUSTRY","QUESTIONS","/hansard/chamber.xscript/debate[1]/subdebate.1[5]/answer/talk.start/para","N/A","N/A"
16,1,0,0,0,0,0,0,1,"CATTS, James","JWO","N/A","N/A","N/A",11420,"- Seeing that the business of this national Parliament in connexion with new protection is practically hung up owing to the extraordinary delay in the deliverance of judgment in the harvester excise case, does the Government think a second High Court necessary to do the work of the country, or is the existing High Court afflicted with an exaggerated form of government stroke?","NEW PROTECTION","QUESTIONS","/hansard/chamber.xscript/debate[1]/subdebate.1[6]/question/talk.start/para","N/A","N/A"
17,0,0,0,1,0,0,0,1,"DEAKIN, Alfred","009MD","N/A","Protectionist","N/A",11420,"- If the honorable member had been as well acquainted as most professional men are with the arduous work that the High Court has been discharging, I am sure that he would not have inferred, even by indirect imputation) that there has been any lack of energy or devotion to duty on. the part of the Bench:","NEW PROTECTION","QUESTIONS","/hansard/chamber.xscript/debate[1]/subdebate.1[6]/answer/talk.start/para","N/A","N/A"
18,0,0,1,0,0,0,0,1,"CATTS, James","JWO","N/A","N/A","N/A",11420,"- But they are hearing and giving decisions in other cases.","NEW PROTECTION","QUESTIONS","/hansard/chamber.xscript/debate[1]/subdebate.1[6]/answer/interjection/talk.start/para","N/A","N/A"
19,0,0,0,1,0,0,0,1,"DEAKIN, Alfred","009MD","N/A","N/A","N/A",11420,"- The honorable member does not discriminate, as lawyers would, between the different categories in which those cases must be placed. The particular case to which he has called attention, and on which he, like all of us, desires to obtain, as early as possible, the judgment of the High Court, is one of the greatest, and probably one of the most complex issues submitted in recent years to a judicial Bench. It is above all things desirable in the public interest, that when such a judgment is given it shall be not only well weighed, as it is sure to be, but as complete and as comprehensive as the circumstances of the case warrant and require.","NEW PROTECTION","QUESTIONS","/hansard/chamber.xscript/debate[1]/subdebate.1[6]/answer/continue[1]/talk.start/para","N/A","N/A"
20,0,0,0,1,0,0,0,1,"CATTS, James","JWO","N/A","N/A","N/A",11420,"- I desire to ask the Prime Minister whether he will defer closing the session until the question of the new protection has been dealt with in accordance with his statement that it was portion of the Tariff?","NEW PROTECTION","QUESTIONS","/hansard/chamber.xscript/debate[1]/subdebate.1[6]/answer/continue[2]/talk.start/para","N/A","N/A"
21,0,0,0,1,0,0,0,1,"DEAKIN, Alfred","009MD","N/A","N/A","N/A",11421,"- The Government programme remains unaltered. Whenever the High Court may deliver its judgment, out policy is that the new protection shall be associated with the Tariff.Mr.Wilks.-The judgment will be delivered this week.","NEW PROTECTION","QUESTIONS","/hansard/chamber.xscript/debate[1]/subdebate.1[6]/answer/continue[3]/talk.start/para","N/A","N/A"
22,0,0,0,1,0,0,0,1,"DEAKIN, Alfred","009MD","N/A","N/A","N/A",11421,"- It has been anticipated - I do not know upon what authority - this week. There is not necessity to prolong this session for the purpose of securing the new protection, inasmuch as whenever the judgment is given, the guidance it affords will enable the Government to proceed with its proposals. That course will be pursued whether it be during this session or next session.","NEW PROTECTION","QUESTIONS","/hansard/chamber.xscript/debate[1]/subdebate.1[6]/answer/continue[4]/talk.start/para","N/A","N/A"
23,1,0,0,0,0,0,0,1,"CHANTER, John","JWY","N/A","N/A","N/A",11421,"- I wish to ask the Treasurer whether the Government have made provision for payment of the expenses incurred by Mr. Kennedy, one of the candidates for the representation of Echuca at the election which was voided owing to mistakes on the part of electoral officers? If they have done so, when will the amount be payable?","ECHUCA ELECTION","QUESTIONS","/hansard/chamber.xscript/debate[1]/subdebate.1[7]/question/talk.start/para","N/A","N/A"
24,0,0,0,1,0,0,0,1,"LYNE, William","KIN","N/A","Protectionist","N/A",11421,"- I may tell the honorable member that some delay occurred in furnishing particulars of the claim to which he refers. When I was ready to include in the Additional Estimates not only Mr. Kennedys account, but other accounts, I found that I had not received details of the claims. I had to communicate with those concerned, and to urge them to forward these as soon as possible. The claims have since been received, and have been referred for examination to the Crown Law officers. I am now awaiting their reply before presenting the Supplementary Estimates, of which I spoke the other evening, and which I intend asking the House to pass before Parliament prorogues.","ECHUCA ELECTION","QUESTIONS","/hansard/chamber.xscript/debate[1]/subdebate.1[7]/answer/talk.start/para","N/A","N/A"
25,1,0,0,0,0,0,0,1,"MALONEY, William","KLM","N/A","N/A","N/A",11421,"- I desire to ask the Treasurer whether he will look into the matter of the wages being paid to labourers employed at the Government Printing Office, who, I understand, are now receiving less than 7s. per day, with a view to seeing if the pay cannot be increased? I understand that a short time ago Mr. Bent showed that an additional expenditure of £67 per annum would enable their wages to be raised to £2 2s. per week.","GOVERNMENT PRINTING OFFICE","QUESTIONS","/hansard/chamber.xscript/debate[1]/subdebate.1[8]/question/talk.start/para","N/A","N/A"
26,0,0,0,1,0,0,0,1,"LYNE, William","KIN","N/A","Protectionist","N/A",11421,"- I have already made certain inquiries into this matter, but on the spur of the moment I do not recollect with what result. I shall be glad to make further inquiries, but it must not be forgotten that the Government Printing Office is a State office, and not a Federal one. > It is very difficult to bring about harmonious relations in reference to all these matters. As I have said, I will make further inquiries and refresh my memory as to what is being done.","GOVERNMENT PRINTING OFFICE","QUESTIONS","/hansard/chamber.xscript/debate[1]/subdebate.1[8]/answer/talk.start/para","N/A","N/A"
27,1,0,0,0,0,0,0,1,"FRAZER, Charles","JX9","N/A","N/A","N/A",11421,"- I desire to ask the Prime Minister whether he is in possession of information to the effect that Judge Murray, the Acting Administrator of Papua, whilst sitting on the Executive Council, announced his approval of Lands Office officials holding shares in companies applying for land in that Territory, an action which he has since repudiated, as shown by the papers bearing upon the land scandals that were presented to this Parliament ?","PAPUA","QUESTIONS","/hansard/chamber.xscript/debate[1]/subdebate.1[9]/question[1]/talk.start/para","N/A","N/A"
28,0,0,0,1,0,0,0,1,"DEAKIN, Alfred","009MD","N/A","Protectionist","N/A",11421,"- If the honorable member implies that there is some contradiction involved in the statements made by the Acting Administrator, I confess that I have not noticed it. When refusing authority for land office officials to become applicants for land in Papua it was intimated that the same prohibition would not necessarily apply to their holding shares in some company which was applying for land.","PAPUA","QUESTIONS","/hansard/chamber.xscript/debate[1]/subdebate.1[9]/answer/talk.start/para","N/A","N/A"
29,0,0,1,0,0,0,0,1,"REID, George","F4P","N/A","N/A","N/A",11421,"- There is no distinction between them getting land for themselves and being shareholders in a land company.","PAPUA","QUESTIONS","/hansard/chamber.xscript/debate[1]/subdebate.1[9]/answer/interjection[1]/talk.start/para","N/A","N/A"
30,0,0,0,1,0,0,0,1,"DEAKIN, Alfred","009MD","N/A","N/A","N/A",11421,"- There may be a very great distnction. For instance, the very proper restrictions which are imposed upon honorable members of this House under our Constitution do not apply in regard to a limited liability company in which they may be shareholders. The same doctrine appears to have been adopted by the Acting Administrator and the Executive Council in Papua before they had received the first communication from us, after we had become aware that these applications on the part of Land Office officials were being dealt with. Our communication imposed: very much more stringent conditions than previously obtained upon officials, even if only holding shares in companies endeavouring to secure grants of land.","PAPUA","QUESTIONS","/hansard/chamber.xscript/debate[1]/subdebate.1[9]/answer/continue[1]/talk.start/para","N/A","N/A"
31,0,0,0,1,0,0,0,1,"FRAZER, Charles","JX9","N/A","N/A","N/A",11422,"- In connexion with the trouble which has arisen in Papua, is it a fact that Mr. Drummond was a member of a syndicate, and not a direct applicant for land ?","PAPUA","QUESTIONS","/hansard/chamber.xscript/debate[1]/subdebate.1[9]/answer/continue[2]/talk.start/para","N/A","N/A"
32,0,0,0,1,0,0,0,1,"DEAKIN, Alfred","009MD","N/A","N/A","N/A",11422,"- In the first case speaking from memory - Mr. Drummond was directly interested. I forget whether the application was made only in his name or not. In the second case, he was partner in a syndicate applying for the land. Of course, the honorable member must recollect that the second application was put in by a brother officer - Mr. Pinney - an hour or two in advance of the application of a person who is not a member of the Public Service. It is also recorded in evidence that the application on behalf of the syndicate in which the officers were partners was pressed into a condition of precedence because of the knowledge that a second application was about to be made. In New Guinea, owing to the absence of competition, it has become the invariable rule to grant land to the first applicant. Thus, by securing priority in application, one practically secures the land. This attempt to secure priority was made by Mr. Pinney, another officer who intended to be interested in the land referred to.","PAPUA","QUESTIONS","/hansard/chamber.xscript/debate[1]/subdebate.1[9]/answer/continue[3]/talk.start/para","N/A","N/A"
33,0,0,0,1,0,0,0,1,"FRAZER, Charles","JX9","N/A","N/A","N/A",11422,"- Is the Prime Minister in possession of information that Judge Murray, prior to the trouble arising with the land officials in New Guinea, stated in the Legislative Council that Lands Office officials may be members of a syndicate applying for land within the Territory ?","PAPUA","QUESTIONS","/hansard/chamber.xscript/debate[1]/subdebate.1[9]/answer/continue[4]/talk.start/para","N/A","N/A"
34,0,0,0,1,0,0,0,1,"DEAKIN, Alfred","009MD","N/A","N/A","N/A",11422,"- I know that he made a statement as to shareholders in companies, and my impression is that he made it in the Legislative Council.","PAPUA","QUESTIONS","/hansard/chamber.xscript/debate[1]/subdebate.1[9]/answer/continue[5]/talk.start/para","N/A","N/A"
35,0,0,1,0,0,0,0,1,"FRAZER, Charles","JX9","N/A","N/A","N/A",11422,"- Was that prior to the particular case to which reference has been made?","PAPUA","QUESTIONS","/hansard/chamber.xscript/debate[1]/subdebate.1[9]/answer/interjection[2]/talk.start/para","N/A","N/A"
36,0,0,0,1,0,0,0,1,"DEAKIN, Alfred","009MD","N/A","N/A","N/A",11422,"- Yes. That was the first occasion when . Mr. Drummond and other officials were openly interested in an application for land.","PAPUA","QUESTIONS","/hansard/chamber.xscript/debate[1]/subdebate.1[9]/answer/continue[6]/talk.start/para","N/A","N/A"
37,0,0,1,0,0,0,0,1,"FRAZER, Charles","JX9","N/A","N/A","N/A",11422,"- And the Acting Administrator has since denied having made the statement ?","PAPUA","QUESTIONS","/hansard/chamber.xscript/debate[1]/subdebate.1[9]/answer/interjection[3]/talk.start/para","N/A","N/A"
38,0,0,0,1,0,0,0,1,"DEAKIN, Alfred","009MD","N/A","N/A","N/A",11422,"- I think that is not supported by the papers. It is a tenable theory that he had intimated to officers that under certain conditions they might be applicants for land. But, as I endeavoured to point out, the second case was not merely an application for land in which, as members of a public company, the officers might thereafter have had an interest, but one in which they pushed forward a certain syndicate application to secure priority. This, as I have already explained, would have had the effect of giving them the land, no matter who the second or third applicants might be.","PAPUA","QUESTIONS","/hansard/chamber.xscript/debate[1]/subdebate.1[9]/answer/continue[7]/talk.start/para","N/A","N/A"
39,0,0,1,0,0,0,0,1,"FORREST, John","KFJ","N/A","N/A","N/A",11422,"- Was that proved?","PAPUA","QUESTIONS","/hansard/chamber.xscript/debate[1]/subdebate.1[9]/answer/interjection[4]/talk.start/para","N/A","N/A"
40,0,0,0,1,0,0,0,1,"DEAKIN, Alfred","009MD","N/A","N/A","N/A",11422,"- Yes; the proof is conveyed in the judgment of more than one member of the Council, but more particularly in the written judgment of Mr. Campbell, the Police Magistrate. It was one determining motive with some members of the Council, when they decided that Mr. Drummonds action amounted to an attempt to evade the previous instruction, that officers of. the Lands Depart- . ment should not apply.","PAPUA","QUESTIONS","/hansard/chamber.xscript/debate[1]/subdebate.1[9]/answer/continue[8]/talk.start/para","N/A","N/A"
41,0,0,1,0,0,0,0,1,"WATSON, John Christian","F4R","N/A","N/A","N/A",11422,"- Mr. Drummond was not responsible for the preference given to him over an outside applicant.","PAPUA","QUESTIONS","/hansard/chamber.xscript/debate[1]/subdebate.1[9]/answer/interjection[5]/talk.start/para","N/A","N/A"
42,0,0,0,1,0,0,0,1,"DEAKIN, Alfred","009MD","N/A","N/A","N/A",11422,"- No. Mr. Drummond was associated with the application. It was Mr. Pinney, who, as I have said, was associated with both cases - an officer, I believe, in the Treasury - who lodged the application in the manner to which I have referred.","PAPUA","QUESTIONS","/hansard/chamber.xscript/debate[1]/subdebate.1[9]/answer/continue[9]/talk.start/para","N/A","N/A"
43,1,0,0,0,0,0,0,1,"THOMSON, Dugald","KW6","N/A","FT; ANTI-SOC from 1906","N/A",11422,"- The Prime Minister, has not, I think, made the position quite clear. These criticisms and instructions were, I presume, founded on the fact that it had come to the knowledge of the Department of External Affairs that the. Administrator and the Council had approved of lands being applied for by public servants under certain conditions.","PAPUA","QUESTIONS","/hansard/chamber.xscript/debate[1]/subdebate.1[9]/question[2]/talk.start/para","N/A","N/A"
44,0,0,1,0,0,0,0,1,"WATSON, John Christian","F4R","N/A","N/A","N/A",11422,"- I understand that public servants may participate as members of a company.","PAPUA","QUESTIONS","/hansard/chamber.xscript/debate[1]/subdebate.1[9]/question[2]/interjection[1]/talk.start/para","N/A","N/A"
45,0,0,0,1,0,0,0,1,"THOMSON, Dugald","KW6","N/A","FT; ANTI-SOC from 1906","N/A",11422,"- As I say, public servants may apply for land under certain conditions - that is, they may be interested in lands applied for- and I desire to know whether the objections of the Prime Minister had reached ANew Guinea before Mr. Staniforth Smith took part in allowing an application by an official.","PAPUA","QUESTIONS","/hansard/chamber.xscript/debate[1]/subdebate.1[9]/question[2]/continue[1]/talk.start/para","N/A","N/A"
