"question_flag","answer_flag","interjection_flag","speech_flag","petition_flag","quote_flag","motionnospeech_flag","chamber_flag","name","name.id","electorate","party","role","page.no","content","subdebateinfo","debateinfo","path","Speaker","Time"
"0","0","1","0","0","0","0","1","CONROY, Alfred","K4E","N/A","N/A","N/A","44","44 K4E 0 0 CONROY, Alfred Mr CONROY - If that be so, then the whole case for vaccination goes by the board j since the drop in the severity of small-pox cannot be said to be due to vaccination, inasmuch as the people in the old days were not properly vaccinated. We have no evidence to support compulsory vaccination. As far as we know the system of vaccination in the days covered by my authorities was as successful as it could be to-day. If the honorable member means that it was attended with more risk than it is to-day, I agree with him. That vaccination is regarded as a great preventive, and that it does assist in warding off disease, is not the point disputed by me, nor am I arguing against it. .1 am not arguing against a man being vaccinated if he pleases to submit himself to the operation. If men wished to be vaccinated every day in the year, I would cheerfully vote the money necessary to enable them to do so, and, indeed, to pay the doctor to vaccinate them. But when we practically compel a large body of men to be vaccinated, as we are doing at present, we ought not to forget that Vaccination must necessarily be attended by some biological change, which is not yet understood or fully grasped: An examination of the lymph has not disclosed how the change takes place. Copeman says there is no doubt that there is some specific contagium in connexion with vaccination. That being so, we ought not to have compulsory vaccination forced upon us. Many have conscientious objections to vaccination, and seeing that it is a matter of contagion, and that it is doubtful whether the protection conferred by it extends more than three or four feet beyond the individual treated, is it not clear that the proper methods to adopt are those of isolation and disinfection? It is not right at the present stage of -science, to insist upon compulsory vaccination. There are more deaths from diphtheria, typhoid, measles, and scarlet fever than there are from small-pox, and we ;are making a very serious mistake in proposing this wholesale inoculation of the community. This is a proposal to apply to the public a lever, the consequences of -which we cannot possibly foresee.","N/A","ADJOURNMENT","/hansard/chamber.xscript/debate[17]/speech[1]/continue[14]/talk.start","N/A","N/A"
"0","0","1","0","0","0","0","1","FENTON, James","KEV","N/A","N/A","N/A","45","45 KEV 0 0 FENTON, James Mr Fenton - What does the honorable member suggest?","N/A","ADJOURNMENT","/hansard/chamber.xscript/debate[17]/speech[1]/interjection[13]/talk.start","N/A","N/A"
"0","0","1","0","0","0","0","1","CONROY, Alfred","K4E","N/A","N/A","N/A","45","45 K4E 0 0 CONROY, Alfred Mr CONROY - I suggest, as eminent medical men have proposed, isolation and, :if. you like, compulsory vaccination of contacts; or, if the contacts do not care to undergo vaccination, their segregation in quarantine for the period of fourteen days. during which the disease would be likely to develop. If that be done, there need be no isolation of Sydney. The ordinary trade of thousands of people will be allowed to go on without hindrance. But whilst we are carrying on a system of wholesale quarantine we are destroying the trade of a great city, and depriving of employment thousands of men on the wharfs. Are the Government going to make any provision for these men while they are out of work? I think it highly advisable, in the circumstances, that some provision should be made for them. The officer selected does not seem to me to have acted with the judgment that is desirable. To show that fresh  cases are being reported every day is to me nothing. There are fresh, cases of diphtheria and typhoid every day, and there are deaths from those diseases taking place daily. Yet we hear nothing of them. During the last six months more men have committed suicide than have died from small-pox during the last ten years; but I do not suppose the Minister would propose to inoculate against suicide, and force every member of the community to undergo some course of treatment against selfdestruction.","N/A","ADJOURNMENT","/hansard/chamber.xscript/debate[17]/speech[1]/continue[15]/talk.start","N/A","N/A"
"0","0","1","0","0","0","0","1","WEST, John Edward","KZA","N/A","N/A","N/A","45","45 KZA 0 0 WEST, John Edward Mr West - There has not been one death from small-pox in connexion with the outbreak in Sydney.","N/A","ADJOURNMENT","/hansard/chamber.xscript/debate[17]/speech[1]/interjection[14]/talk.start","N/A","N/A"
"0","0","1","0","0","0","0","1","CONROY, Alfred","K4E","N/A","N/A","N/A","45","45 K4E 0 0 CONROY, Alfred Mr CONROY - That is so. An honorable member last January showed me a case which I diagnosed as cow-pox, and the very outbreak which we are discussing may be one of varicella instead of variola.","N/A","ADJOURNMENT","/hansard/chamber.xscript/debate[17]/speech[1]/continue[16]/talk.start","N/A","N/A"
"0","0","1","0","0","0","0","1","SPEAKER, Mr","10000","N/A","N/A","N/A","45","45 10000 0 0 SPEAKER, Mr Mr SPEAKER - Order ! It has been the custom to suspend the sitting for dinner at 6.30, but if the honorable member will be able to conclude his remarks in a few minutes I propose, with the concurrence of the House, to continue the sitting a little longer.","N/A","ADJOURNMENT","/hansard/chamber.xscript/debate[17]/speech[1]/continue[17]/talk.start","N/A","N/A"
"0","0","1","0","0","0","0","1","CONROY, Alfred","K4E","N/A","N/A","N/A","45","45 K4E 0 0 CONROY, Alfred Mr CONROY - I think that I have done well in drawing attention to this matter. We must not allow any young man, unless he is supported by the best medical authority outside, and leading bacteriologists, to enforce a system of compulsory vaccination. I should allow advice to be given, and, under certain circumstances, permit vaccination, but I would not enforce the operation. I am prepared to admit that much, and to go as far in that direction as any health officer. There is no doubt that if I myself happened to come into contact with a small-pox patient, and I realized that it was to the advantage of the community to submit to vaccination, I should do so; but I would not undergo such a change in my body unless it was made clear that the risks incurred were greater than thoseI face at present. It is, in my opinion, highly unadvisable to interfere with the trade of a great city; and we must realize that if such a regulation as the present one were universal there is not a place in the world that would not be in quarantine. The Labour party, no doubt, remember that when- they first took office in 1910 there were more deaths from small-pox than there had been for some time previously.Sitting suspended from 6.33 to 7. 5 p.m.","N/A","ADJOURNMENT","/hansard/chamber.xscript/debate[17]/speech[1]/continue[18]/talk.start","N/A","N/A"
"0","0","1","0","0","0","0","1","CONROY, Alfred","K4E","N/A","N/A","N/A","46","46 K4E 0 0 CONROY, Alfred Mr CONROY - I had just about concluded when the sitting was suspended for dinner, and I now wish merely to quote further remarks from M. Depaul, who was superintendent of the vaccination service in France, where vaccination was compulsory. These remarks were highly approved by the late M. Lefort who was himself a strong advocate of vaccination, though not of compulsory vaccination. They are as follows -A law to make vaccination compulsory seem? to me vexatious, ineffective, and impracticable. I cannot put out of my mind the offensiveness of such a law to free men; nor can I any more put out of my mind that the father of a family also has rights of which he can hardly be disposed to deprive himself, in order to intrust them to the Government. Still, if we could - not, indeed, entirely suppress smallpox - but at least diminish it substantially by violating this liberty, I could even aBsent to this, notwithstanding my repugnance ; but, as it is not so, I cannot assent to this compulsion.I trust the Government will take those words to heart, so that a method approved by men all over the world may be adopted, and the trade of Sydney permitted to be carried on. Where such a method can be adopted without interference . with commerce, and in such a way as not to be offensive to a large number of citizens, we are entitled to ask the Government to take some other advice than that of a young gentleman who has had no expert experience in dealing with such matters. The mere fact that this young gentleman is the Director of Quarantine is no reason for imposing his wishes on so many members of the community Tt has been said that some of the authorities I quoted were rather old. That suggestion was made when I was quoting from the work of Dr. E. C. Seaton, but I point out that that gentleman . is described on the title page of his book as an  M.D. (Lond.), FRCP.. F I.C , and also as Consulting!; Medical Office of the Surrey County Council, formerly Medical Officer ofHealth for Nottingham, Medical Officer of Health and Public Analyst for Chelsea, and Medical Officer of Health for the County of Surrey, and the date of the book is 1911. The opinions of that gentleman, together with the opinions of others I have quoted, ought to carry some weight. When we recollect that it is shown that over 122 Boards, controlled by different medical men, were all against compulsory vaccination it is surely time we cried a halt, and did not insist on a surgical operation on people who, in many cases, have conscientious objections, and who, so far as we can judge, are supported by a very large number of medical men. The support of the view I have been expressing has steadily increased during the last ten or twelve years, when the condition of the blood, and so forth,, has begun to be more thoroughly understood and grasped than at any previous- time.","N/A","ADJOURNMENT","/hansard/chamber.xscript/debate[17]/speech[1]/continue[19]/talk.start","N/A","N/A"
"0","0","0","1","0","0","0","1","MALONEY, William","KLM","Melbourne","N/A","N/A","46",". - This is a question which, I am sure, mud appeal to you, Mr. Speaker, as it does: to myself and other honorable members. Before offering a few brief remarks T think I may compliment the honorable member for Werriwa on his action to-day. I must certainly say that when the flag: of Labour goes down I am glad to welcome an old friendly face, though I wish that, it were to be seen on this side of the House. It is clearly evident to thinking members that when the trained brain of a splendid advocate like the honorable member, turns his mind to any subject,, he takes points which suit the case to be supported. If I, by interjection,, sought information as to the date of the authorities quoted it was not because I, for the moment, desired to impugn the great names he mentioned, for these stand like stars in the firmament of science. The honorable member was quoting from words, written in 1896, and I am sure he will agree with me that much water has run., under London Bridge since then, and that science has developed more in that period than in any fifty years previously. For instance, the X ray was hardly then known, and in America the fact that an organ can be taken out of the body of  an animal and kept alive for over three - months, is a step unequalled in the history of medicine and surgery. I can remember - that in the days of my boyhood there were. many people in my circle of acquaintance -.- who were pitted with small-pox ; and yet, , during the recent election contest, at the thirty or forty meetings I addressed, I came across only one person so afflicted. It is said that in the French province of Canada there are more pock-marked people than in the whole Empire of Germany; and to-day, when the Government takes strong, firm action they follow the advice of expert evidence, and I compliment them on doing so. That such a step interferes with the trade and commerce of Sydney one must recognise and regret ; but I think I shall be supported by honorable members if I say that to-day the world is ruled by expert evidence based on fact. Even in the science of sociology the expert is used. If I desired to point to two nations that follow expert evidence based on fact, I should mention Germany and Japan. In Germany a case of small-pox is almost absolutely unknown, and for many yearns there has not been a single case in the German army.","N/A","ADJOURNMENT","/hansard/chamber.xscript/debate[17]/speech[2]/talk.start/para","N/A","N/A"
"0","0","1","0","0","0","0","1","CONROY, Alfred","K4E","N/A","N/A","N/A","47","47 K4E 0 0 CONROY, Alfred Mr Conroy - There was no case in the whole of England for some time.","N/A","ADJOURNMENT","/hansard/chamber.xscript/debate[17]/speech[2]/interjection[1]/talk.start","N/A","N/A"
"0","0","1","0","0","0","0","1","MALONEY, William","KLM","N/A","N/A","N/A","47","47 KLM 0 0 MALONEY, William Dr MALONEY - I am speaking under correction, but I think that in London small- pox is endemic.","N/A","ADJOURNMENT","/hansard/chamber.xscript/debate[17]/speech[2]/continue[1]/talk.start","N/A","N/A"
"0","0","1","0","0","0","0","1","CONROY, Alfred","K4E","N/A","N/A","N/A","47","47 K4E 0 0 CONROY, Alfred Mr Conroy - I think that for about six years there were only about thirty odd cases, and in one year none at all.","N/A","ADJOURNMENT","/hansard/chamber.xscript/debate[17]/speech[2]/interjection[2]/talk.start","N/A","N/A"
"0","0","1","0","0","0","0","1","MALONEY, William","KLM","N/A","N/A","N/A","47","47 KLM 0 0 MALONEY, William Dr MALONEY - The honorable member, I fancy, is speaking of the number of deaths from small-pox.","N/A","ADJOURNMENT","/hansard/chamber.xscript/debate[17]/speech[2]/continue[2]/talk.start","N/A","N/A"
"0","0","1","0","0","0","0","1","CONROY, Alfred","K4E","N/A","N/A","N/A","47","47 K4E 0 0 CONROY, Alfred Mr Conroy - Yes, that is so. Dr. MALONEY.- The honorable member will recognise that, with the advancement of science, the treatment of smallpox is safer and much more efficient, and that, therefore, the death-rate is now much lower. In France, on the other hand, a great difference is shown in this respect. In Germany the lamp of science burns brightly, and small-pox is unknown ; but we cannot say that of the French nation and army. A year ago I had a bitter experience; and in a statement 1 made to this House regarding it, I was supported by the honorable member for Franklin, and also by you, Mr. Speaker, who did not then occupy your present position. On that occasion we were supplied with lymph that was not pure, and, with true patriotism, we asked for Australian lymph. However, we were not so supplied, but were given a lymph of anything but a scientific nature. One does not give up the use of sugar because a grocer occasionally mixes sand with it. It would not be right to refuse to use lymph that had been properly provided. Under the system adopted in Victoria and by the Commonwealth Government, a calf adjudged by the highest veterinary experts to be a perfectly healthy animal has the lymph impregnated. It is then collected in glass tubes, hermetically sealed at both ends, because ivory and bone tablets have been discarded for this purpose. When the calf is killed, every organ, and even the hair and hoofs, are carefully examined, and if all are proved to be healthy the vaccine collected from that animal is permitted to go into use. If the animal is found not to have been healthy in any respect the lymph taken from it is destroyed. I may say that in New Zealand these precautions are not taken. The clever Japanese doctor in charge of the ship by which our party travelled from North Queensland informed us, and I was able subsequently to verify his statement from official reports, that those engaged in maritime pursuits in Japan, and who are thus most likely to become affected by the germs of this dread disease, are often vaccinated twice a year. I shall never forget the sight presented when the officers and men employed on the ship by which we travelled lined up to be vaccinated. It was shown as a result that there was not one, from the captain down to the humblest cabin boy, who was not immune. That was a great lesson to the members of our party. Across the narrow seas which divide Japan from China, and in the most completely free-trade port of which I know, such precautions to preserve the public health are not taken, and in 1895 there were 1,100 bodies in the British city of Hong Kong of persons who had died from small-pox, cholera, and plague. Is it any wonder, in the circumstances, that these diseases should reach this country. The Stars and Stripes that fly over the islands belonging to-day to the United States of America stand sentinel for us against the introduction of disease, as they may in future in time of national danger of another kind. In order to encourage commerce 100 is paid for every ship entering the port of Zamboanga; but if a vessel has called at Hong Kong every one on board must be vaccinated before being allowed to land, unless he has been vaccinated within a limited period of time. Every white person landing at Manila to-day must be vaccinated if he stays longer than twenty-four hours.These precautions are due to the efforts of the keenest and finest brains in America to stamp out this vile and virulent disease. The honorable member for Werriwa has said that a greater number of deaths occur from typhoid fever than from small-pox. I grant it; but we have not the power at present to control typhoid that we have to control smallpox.","N/A","ADJOURNMENT","/hansard/chamber.xscript/debate[17]/speech[2]/interjection[3]/talk.start","N/A","N/A"
"0","0","1","0","0","0","0","1","WEST, John Edward","KZA","N/A","N/A","N/A","48","48 KZA 0 0 WEST, John Edward Mr West - Is it not a fact that one of the members of the honorable members party who was vaccinated with Japanese lymph was, four days later, able to speak the Japanese language, so successful was the operation ?","N/A","ADJOURNMENT","/hansard/chamber.xscript/debate[17]/speech[2]/interjection[4]/talk.start","N/A","N/A"
"0","0","1","0","0","0","0","1","MALONEY, William","KLM","N/A","N/A","N/A","48","48 KLM 0 0 MALONEY, William Dr MALONEY - In order to answer that question the honorable member should supply me with a glass of hot grog. The American and Japanese lymph is absolutely perfect. This was proved by the fact that an officer of .this House who slept in the bed which had previously been occupied by the unfortunate lady who brought the contagion to Australia was vaccinated on one arm with Japanese lymph and on the other with American lymph, and entirely escaped the contagion. I claim the attention of every honorable member who has an interest in Sydney while I refer to another matter. I am not speaking as the member for Melbourne, because I give way to no one in my admiration for the beauty city of the Australian coast. I never go to Sydney without anticipations of pleasure, and never leave it without regret. I think that if I were younger I would settle there. I wish to say that opposite the largest centre of population in Australia there is a quarantine station established, and if I could do so by my vote I should remove it to-morrow. Experts say that on a genial day, and there are many such days in each year in Sydney, germs of small-pox may be carried as far as three miles. Honorable members know that, upon conviction, criminals are treated alike, whether they belong to the rich, the middle, or the poorer classes of the community. A person sent to a quarantine ground is a prisoner against his will for the benefit of the community at large. But how are quarantined persons treated ? They are separated into three different classes.. A first saloon passenger can go anywhere, but if a second saloon passenger steps upon a lawn, or goes through a bit of garden, he is told to go away,. because he is only a second class passenger. Mr. Mahon, a gentleman who. was an honoured and honorable member of this House, was ordered away from a. portion of the quarantine ground in Western Australia because he happened to be travelling at the time second class. I maintain that this treatment is not in accordance with the desire of the people of Australia. It is their desire that where men are confined in this way against their will they shall be treated on an equality, for during the time of their detention quarantined persons are the guests of the State for the benefit of the whole community. I lodged my protest in connexion with this matter with the ex-Minister of Customs, but I am sorry to say I got scant courtesy. This was not the fault of Mr. Tudor, but was due to the foolish instructions given by his advisers. These instructions were of such a nature that in a telegram I sent in reply, I said,  I regret that your information is not only inaccurate, but is idiotic. We asked that third-class passengers should be permitted to wash themselves in hot baths, and were informed that there were no baths there for their accommodation. At a meeting of the saloon passengers, to their credit be it said, it was agreed that six baths would be sufficient for them, and there were six other baths which could be used, but the third-class passengers were not allowed to make use of them. I only speak of this in passing, though I hope that this Government, which has shown itself firm in this connexion, will take measures that will insure that the guests of the whole of the Commonwealth shall be treated on an equality.","N/A","ADJOURNMENT","/hansard/chamber.xscript/debate[17]/speech[2]/continue[3]/talk.start","N/A","N/A"
"0","0","1","0","0","0","0","1","CONROY, Alfred","K4E","N/A","N/A","N/A","48","48 K4E 0 0 CONROY, Alfred Mr Conroy - Has it not already been shown that the lymph, however pellucid, shows blood corpuscles ? Do you think that all the streptococci and staphylococci can be eliminated ?","N/A","ADJOURNMENT","/hansard/chamber.xscript/debate[17]/speech[2]/interjection[5]/talk.start","N/A","N/A"
"0","0","1","0","0","0","0","1","MALONEY, William","KLM","N/A","N/A","N/A","48","48 KLM 0 0 MALONEY, William Dr MALONEY - The question of the honorable member is very pertinent, and I shall endeavour to answer it as well as I can. Scientists do differ on that matter, but the majority of the wise men of to-day agree with my honorable friend, only they go further than he does. If he were a contact or in danger of contagion he would, as he has told us, be vaccinated. But although some scientists entertain a certain view, a small minority containing many of the brightest lights and a minority far enough advanced to have their opinions treated with great consideration, hold that it is not so; and at that meeting of the two nations I have mentioned, Germany in particular, and Japan nearly equal, they found great difficulty in dealing with the question. I hope the Government will go on and try to preserve the whole of this State from contagion. I hope the action of this Government, or of any Government that will fill those benches, will not cease in preventing the spread of disease. We are at the present time attacking diseases that too frequently were cloaked and hidden from the public gaze, but which I hope with wiser times the public are going to seize upon; diseases that are far more deadly in the victims they claim that even the dread small-pox. I do not wish what I have said to-night to be taken as a personal attack on my friend, Mr. Tudor. After all, a Minister has too frequently to utter words that are put into his lips.","N/A","ADJOURNMENT","/hansard/chamber.xscript/debate[17]/speech[2]/continue[4]/talk.start","N/A","N/A"
"0","0","1","0","0","0","0","1","OMALLEY, King","K5D","N/A","N/A","N/A","49","49 K5D 0 0 OMALLEY, King Mr King Omalley - N - No fear.","N/A","ADJOURNMENT","/hansard/chamber.xscript/debate[17]/speech[2]/interjection[6]/talk.start","N/A","N/A"
"0","0","1","0","0","0","0","1","MALONEY, William","KLM","N/A","N/A","N/A","49","49 KLM 0 0 MALONEY, William Dr MALONEY - My friend is, perhaps, the living example of the one who in my twenty-three years experience of political life has ruled his Department the best.","N/A","ADJOURNMENT","/hansard/chamber.xscript/debate[17]/speech[2]/continue[5]/talk.start","N/A","N/A"
"0","0","1","0","0","0","0","1","IRVINE, Hans","KJC","N/A","ANTI-SOC; LP from 1910","N/A","49","49 KJC ANTI-SOC; LP from 1910 0 0 IRVINE, Hans Mr HANS IRVINE - He thinks he has.","N/A","ADJOURNMENT","/hansard/chamber.xscript/debate[17]/speech[2]/interjection[7]/talk.start","N/A","N/A"
