index,question_flag,answer_flag,interjection_flag,speech_flag,petition_flag,quote_flag,motionnospeech_flag,chamber_flag,name,name.id,electorate,party,role,page.no,content,subdebateinfo,debateinfo,path,Speaker,Time
211,0,0,0,1,0,0,0,1,"BEST, Robert","JPC","N/A","N/A","N/A",12690,"- No, at a fair valuation. The three Governments are in a dominant position, because they own the island. They say that they propose to recognise whatever right, title, or interest the company has in this particular property, because the interests are British, and, of course, if the compensation cannot be settled by mutual arrangement, the matter will have to be dealt with by the Court, but the three Governments are committed by the agreement to pay a fair valuation, whatever it is:","Second Reading","NAURU ISLAND AGREEMENT BILL","/hansard/chamber.xscript/debate[6]/subdebate.1/speech[3]/continue[19]/talk.start/para","N/A","N/A"
212,0,0,1,0,0,0,0,1,"CHARLTON, Matthew","JXA","N/A","N/A","N/A",12691,"- In determining what a fair valuation is, would not a Court take into consideration the profits that were likely to accrue to the company for the whole of the period of its lease?","Second Reading","NAURU ISLAND AGREEMENT BILL","/hansard/chamber.xscript/debate[6]/subdebate.1/speech[3]/interjection[19]/talk.start/para","N/A","N/A"
213,0,0,0,1,0,0,0,1,"BEST, Robert","JPC","N/A","N/A","N/A",12691,"- Certainly. If the phosphate deposits on Nauru Island belong to the -company for a period pf 90 or 100 years, and the company be dispossessed of them, it is entitled to a fair valuation of the loss of profit it would thus suffer.","Second Reading","NAURU ISLAND AGREEMENT BILL","/hansard/chamber.xscript/debate[6]/subdebate.1/speech[3]/continue[20]/talk.start/para","N/A","N/A"
214,0,0,1,0,0,0,0,1,"KELLY, William","KEA","N/A","N/A","N/A",12691,"- .Surely the honorable member will admit that the company had nothing but a lease from .Germany, which ceased to bo of maturing value the moment the domain of this territory was taken from Germany.","Second Reading","NAURU ISLAND AGREEMENT BILL","/hansard/chamber.xscript/debate[6]/subdebate.1/speech[3]/interjection[20]/talk.start/para","N/A","N/A"
215,0,0,0,1,0,0,0,1,"BEST, Robert","JPC","N/A","N/A","N/A",12691,"- That would be the position but for the fact that, under Article 7, it is provided that any right, title, or interest which, the company or any person may have in .the -deposits, land, buildings, plant, and equipment on the island, shall be converted into a claim for compensation at a fair valuation, so far as such right, title, or interest is not dealt with by the Treaty of Peace.","Second Reading","NAURU ISLAND AGREEMENT BILL","/hansard/chamber.xscript/debate[6]/subdebate.1/speech[3]/continue[21]/talk.start/para","N/A","N/A"
216,0,0,1,0,0,0,0,1,"KELLY, William","KEA","N/A","N/A","N/A",12691,"- Treaty of Peace. That is the whole point.","Second Reading","NAURU ISLAND AGREEMENT BILL","/hansard/chamber.xscript/debate[6]/subdebate.1/speech[3]/interjection[21]/talk.start/para","N/A","N/A"
217,0,0,1,0,0,0,0,1,"MATHEWS, James","KNH","N/A","N/A","N/A",12691,"- Does it mean that the British company will get all the German1 interests and profits accruing thereto?","Second Reading","NAURU ISLAND AGREEMENT BILL","/hansard/chamber.xscript/debate[6]/subdebate.1/speech[3]/interjection[22]/talk.start/para","N/A","N/A"
218,0,0,0,1,0,0,0,1,"BEST, Robert","JPC","N/A","N/A","N/A",12691,"- The British Empire practically takes the place of Germany, and I understood from the Prime Minister (Mr. Hughes) that it is intended to recognise the existing rights of this British company, and I am arguing on that basis. The ordinary state of affairs would be that the German interests in any territory taken from Germany by way of conquest would at once vanish; but. I understood the Prime Minister to say that, as this is a British company, which has a certain right, title, and interest in regard to these deposits, the three Governments concerned are prepared - and most properly so - to recognise these, whatever they may be.","Second Reading","NAURU ISLAND AGREEMENT BILL","/hansard/chamber.xscript/debate[6]/subdebate.1/speech[3]/continue[22]/talk.start/para","N/A","N/A"
219,0,0,1,0,0,0,0,1,"JOWETT, Edmund","KDZ","N/A","N/A","N/A",12691,"- It may cost the people-, of Australia a great deal more to buy out. this British company than to allow it .to supply the phosphates. ,","Second Reading","NAURU ISLAND AGREEMENT BILL","/hansard/chamber.xscript/debate[6]/subdebate.1/speech[3]/interjection[23]/talk.start/para","N/A","N/A"
220,0,0,0,1,0,0,0,1,"BEST, Robert","JPC","N/A","N/A","N/A",12691,"- I am npt prepared to go so far as to. say that; but I am disposed to think that if Nauru Island and Ocean Island are worked together we ought to be able to operate them more effectively and very much more cheaply. Of course, the question of compensation is the disturbing factor, a.nd if it is a fact that full recognition is to be given to the British interests in this company, and if there is anything in the statements which have appeared in the cablegrams that its claim amounts to about £2 ,000, 000, and fair interest is to be allowed on that amount of capital, as well as sinking fund - say, 5 per cent, in one case and 2 per cent, in the other - it will mean adding about £150,000 per annum to the cost qf production.","Second Reading","NAURU ISLAND AGREEMENT BILL","/hansard/chamber.xscript/debate[6]/subdebate.1/speech[3]/continue[23]/talk.start/para","N/A","N/A"
221,0,0,1,0,0,0,0,1,"KELLY, William","KEA","N/A","N/A","N/A",12691,"- The fact that the com±pany is claiming only £2,000.000 on deposits worth over £300,000,000 proves conclusively that the honorable members contention as to the absolute value of a ninety-nine years lease does not hold good.","Second Reading","NAURU ISLAND AGREEMENT BILL","/hansard/chamber.xscript/debate[6]/subdebate.1/speech[3]/interjection[24]/talk.start/para","N/A","N/A"
222,0,0,0,1,0,0,0,1,"BEST, Robert","JPC","N/A","N/A","N/A",12691,"- The company.s claim to compensation would be based upon the profit it is making, and not the capital cost of the material itself. Its production is about 150,000. tons per annum, and it is making a profit of about 7s. per ton. That has to be. estimated over a period of years, always having regard to any altered conditions that may arise. An estimate of £375,000,000 has been made, but I apprehend that to be the gross capital value for all time of the whole of. the deposit. None of us knows what the companys .claim will be. I am merely dealing with what I saw in the newspapers, and the point I am making is that, superadded to present cost of production and cost of administration, to which I have already referred, there will be, for a period of about forty or fifty years, the cost of setting aside so much each year to provide interest on capital and sinking fund.The Prime Minister has said that the output is capable of more or less definite extension, but on further investigation I think he will find that he is npt correct in that statement, because I am told that the output cannot fairly exceed more than about 150,000 tons per annum, when the island is worked on the most economic lines. There is a most up-to-date plant on Nauru Island, but the physical conditions as to means of loading and unloading, the weather and the moorings, are such that the output cannot exceed this quantity with corresponding advantages.","Second Reading","NAURU ISLAND AGREEMENT BILL","/hansard/chamber.xscript/debate[6]/subdebate.1/speech[3]/continue[24]/talk.start/para","N/A","N/A"
223,0,0,1,0,0,0,0,1,"KELLY, William","KEA","N/A","N/A","N/A",12692,"- . Under similar disadvantages, the company has an output of 240,000 per annum on Ocean Island.","Second Reading","NAURU ISLAND AGREEMENT BILL","/hansard/chamber.xscript/debate[6]/subdebate.1/speech[3]/interjection[25]/talk.start/para","N/A","N/A"
224,0,0,0,1,0,0,0,1,"BEST, Robert","JPC","N/A","N/A","N/A",12692,"- I have not sufficient knowledge of the relative difficulties of the two islands, but I know that the matter of mooring vessels is very important. The moorings cost about £3,000 or £4,000, and as they break away frequently, considerable expense is incurred in securing them.If we are sufficiently fortunate to secure Ocean Island, the competition from that quarter will at once cease.","Second Reading","NAURU ISLAND AGREEMENT BILL","/hansard/chamber.xscript/debate[6]/subdebate.1/speech[3]/continue[25]/talk.start/para","N/A","N/A"
225,0,0,1,0,0,0,0,1,"SAMPSON, Sydney","L0P","N/A","N/A","N/A",12692,"- Will that be a good thing for Australia?","Second Reading","NAURU ISLAND AGREEMENT BILL","/hansard/chamber.xscript/debate[6]/subdebate.1/speech[3]/interjection[26]/talk.start/para","N/A","N/A"
226,0,0,0,1,0,0,0,1,"BEST, Robert","JPC","N/A","N/A","N/A",12692,"-I think so, because the two islands can be worked infinitely more economically. But the competition will be great from other quarters. The French have great rock phosphate deposits on Makatea Island, and, what is more important, the Japanese have Angaur Island, which they are working as hard as they can, and where there are enormous deposits. In addition to the advantage of having their own labour, the Japanese are shipping the rock phosphate to Japan, where an unlimited supply of sulphuric acid is readily obtainable for the purpose of manufacturing superphosphates. In this regard Japan is undoubtedly the great competitor of the future. We may protect ourselves fiscally against Japan, but it is essential that the cost of production at Nauru should be reduced to a minimum if we are not to be overwhelmed by the competition from, other quarters. The Prime Minister has already mentioned that there are vast deposits in America and in the north of Africa.While I rejoice in the transfer of this island to the British Empire, and approve of the step which has been taken, I am exceedingly anxious that the utmost care should be exercised, but I am more than doubtful as to the wisdom of creating the administrative machinery provided in the agreement. I do not oppose the agreement; on the contrary, I realize that we have been committed to it by our representatives, and, on the whole, I think the result will be satisfactory, but at the same time, unless, being a business proposition, it is managed on rigid business lines, I feel it will not achieve the glowing anticipations indicated by the Prime Minister in his speech to-day.Debate (on motion by Mr. Poynton) adjourned.","Second Reading","NAURU ISLAND AGREEMENT BILL","/hansard/chamber.xscript/debate[6]/subdebate.1/speech[3]/continue[26]/talk.start/para","N/A","N/A"
227,0,0,0,1,0,0,0,1,"POYNTON, Alexander","KYD","Grey","NAT","Acting Treasurer [6.5]. -(By leave.",12692,"- I desire to announce the present position of the Eighth War Loan, which is known to the public by the name of the Peace Loan. Full details have not yet been, received from all centres, but, so far as can be seen, the total subscriptions amount to £20,000,000. In some respects, this is a satisfactory result, and shows the fine public spirit which exists amongst the great majority of Australians. In considering the total, it has to . be remembered that Australia has previously subscribed about £200,000,000 to war loans, and that before the war the flotation by a State of £1,000,000 or £2,000,000 was considered a good achievement. Taking these things into account, it is . possible to heartily congratulate the many thousands who have done all that they could towards the success of the Loan.I am advised that, undoubtedly, many persons withheld subscriptions, because they thought their money was not needed, and relied upon others. To give these persons an opportunity of doing what, no doubt, they will recognise as their duty, and give a final opportunity to others who, perhaps, would not subscribe under ordinary conditions, though able to do so, it has been decided to keep the Loan open for fourteen days, from the 23rd September. The Government ask that the Central and District Peace Loan Committees, the banks, and all other workers will continue their efforts during the extended period.As I announced a few days ago through the press, the Government are hopeful that voluntary subscriptions will bring the whole amount of £25,000,000, but it would be wrong not to add that, should the Loan be not fully subscribed by the 7th October, the Government will ask the Parliament to impose, a measure of compulsion upon those who have not done their duty. The Bill now before the House may have to be amended somewhat, birt, generally speaking, it is to be expected that the Bill, as it stands, will be passed.The Bill provides that every person may be required to subscribe to the Loan a sum which is equal to six . times the annual average of his Federal income tax paid during the last three years. Those whose taxable incomes are £250 or under are exempt, and compulsion will not apply in respect of income derived from personal exertion by returned soldiers. The first persons to be called upon for compulsory subscriptions will be those who have not subscribed to War or Peace Loans; but, should an insufficient sum be obtained from such persons, it will be necessary to call upon those who, while holding some bonds or stock, have not contributed in accordance with their means.My advice is that every person should subscribe as much as he or she possibly can irrespective of present holdings. Any one called upon for a compulsory subscription may appeal, and the Appeal Board may grant relief, but where the Appeal Board compels a person to subscribe, he will be automatically fined, and the amount of the fine will be one-third of the compulsory subscription. The fine will not relieve the person from the necessity to make the subscription. This automatic fine will operate if the person does not subscribe voluntarily before the date of the closing of - the Loan. The Bill applies to companies as well as to individuals.The Government have entered into arrangements under which, on paying 10 per cent, towards a subscription, any person may obtain a loan from a bank of the remaining 90 per cent., and will have eighteen mouths in which to pay off the overdraft by instalments. Thus, persons without ready cash may subscribe.","N/A","PEACE LOAN","/hansard/chamber.xscript/debate[7]/speech/talk.start/para","N/A","N/A"
228,0,0,1,0,0,0,0,1,"MALONEY, William","KLM","N/A","N/A","N/A",12693,"- Will the Government give our Australian artists a chance in connexion with the loan posters ? The Government seem to go to Rome and elsewhere for designs.","N/A","PEACE LOAN","/hansard/chamber.xscript/debate[7]/speech/interjection[1]/talk.start/para","N/A","N/A"
229,0,0,0,1,0,0,0,1,"POYNTON, Alexander","KYD","N/A","N/A","N/A",12693,"- I certainly think that Australian artists should be given a chance, and I shall be surprised if that is not being done.","N/A","PEACE LOAN","/hansard/chamber.xscript/debate[7]/speech/continue[1]/talk.start/para","N/A","N/A"
230,0,0,1,0,0,0,0,1,"BAMFORD, Frederick","JNV","N/A","N/A","N/A",12693,"- What will become of the fines imposed on those who have neglected to subscribe? Will they be regarded as part of the loan ?","N/A","PEACE LOAN","/hansard/chamber.xscript/debate[7]/speech/interjection[2]/talk.start/para","N/A","N/A"
231,0,0,0,1,0,0,0,1,"POYNTON, Alexander","KYD","N/A","N/A","N/A",12693,"- No; failure to subscribe will be a penal offence, and the fines will be paid into consolidated revenue.","N/A","PEACE LOAN","/hansard/chamber.xscript/debate[7]/speech/continue[2]/talk.start/para","N/A","N/A"
232,0,0,0,1,0,0,0,1,"KELLY, William","KEA","Wentworth","N/A","N/A",12693,".- The speech delivered by the honorable member for Kooyong (Sir Robert Best) interested me very much, but I think the honorable member overlooked this fact, that, whilst one may confidently anticipate in any Government enterprise - even if not hampered by partnership provisions of the nature of this agreement- a slight loss of efficiency, in this case, undoubtedly, the loss of efficiency ought to be far more than counter-balanced by the fact that we shall be producing for ourselves, and therefore will obtain supplies at cost price. We shall have not only that economy in the saving of the profits that would have gone to the company, but, in addition., we shall have a guarantee against being squeezed by the company in the future, and that is a consideration of immense importance to Australia.I was astonished to read in the newspapers, in connexion with the Peace deliberations, that there was any dispute at all in regard to Australias right to this island, and I intend to state to the House my reason. I hope there will be an inquiry into the matter, because evidently somebody connected with the Commonwealth bungled in regard to this Possession, to the immense detriment of Australia. I lay no charge against the Prime Minister (Mr. Hughes) or the existing Government. When the right honorable gentleman went to England in connexion with the Peace Conference, he found that he had to meet things as they were. He put up a stubborn fight, and, in the circumstances, he brought us this agreement; but if the facts are known - and I hope they will be known and those responsible ibr the bungle will be singled out for blame. - this island should belong to Australia in toto. I was in Sydney just before the war broke out, and immediately afterwards. The Prime Minister of that day asked me to go- to Sydney so that the interests affected by the collapse of the ordinary commercial laws owing to the state of war, might approach me, and I might act as a channel of communication between them and the then Attorney-General (Sir William Irvine). People of all kinds came to me, and amongst the first to interview me were two gentlemen who understood the islands well, and who explained to me the enormous prospective value of Nauru. . As a result, I immediately telephoned to Melbourne and asked that the Australian flag be hoisted at once on Nauru, because it was essential that we should make our claim early. The Government acted with promptitude, a ship was immediately despatched, and the Australian flag was hoisted at Nauru just as it was hoisted at Rabaul. The hoisting of our flag at Rabaul was the basis of the complete mandate given to us . over New Guinea. But, having taken possession of Nauru, apparently, in order to. avoid the cost of keeping a few men on guard on the. island - because it was not necessary to garrison against attack while the Empire controlled the ocean - somebody in Australia said to the British Government, Will you stand the racket? And for the sake of saving 8s. per day for a few men, Great Britain and New Zealand were admitted into a contract that should have . been purely Australian.","Second Reading","NAURU ISLAND AGREEMENT BILL","/hansard/chamber.xscript/debate[8]/subdebate.1/speech[1]/talk.start/para","N/A","N/A"
233,0,0,1,0,0,0,0,1,"COOK, Joseph","F4S","N/A","N/A","N/A",12694,"- All the islands which were originally ceded to us in the terms of the capitulation were to be expressly and specifically held at the disposal of the Peace Conference.","Second Reading","NAURU ISLAND AGREEMENT BILL","/hansard/chamber.xscript/debate[8]/subdebate.1/speech[1]/interjection[1]/talk.start/para","N/A","N/A"
234,0,0,0,1,0,0,0,1,"KELLY, William","KEA","N/A","N/A","N/A",12694,"- They were to be held subject to the issue of the war. But when the  barney  began as to who should actually own the islands, the- broad generosity of the British people - and they have been very generous to the overseas Dominions - would not . allow that the Australians should make sacrifices and not receive some benefits from them. That would have been the case with Nauru had not somebody in Australia stepped in and said to Great Britain, We have hoisted our flag, but you had better take over the islands. It is amazing that such an act of official stupidity should have been perpetrated, and I ask the Minister for the Navy (Sir Joseph Cook), he being the senior Minister present in the House, to institute a rigid inquiry in order to ascertain how Great Britain was brought into the guardianship of Nauru.","Second Reading","NAURU ISLAND AGREEMENT BILL","/hansard/chamber.xscript/debate[8]/subdebate.1/speech[1]/continue[1]/talk.start/para","N/A","N/A"
235,0,0,1,0,0,0,0,1,"MATHEWS, James","KNH","N/A","N/A","N/A",12694,"- And New Zealand.","Second Reading","NAURU ISLAND AGREEMENT BILL","/hansard/chamber.xscript/debate[8]/subdebate.1/speech[1]/interjection[2]/talk.start/para","N/A","N/A"
236,0,0,0,1,0,0,0,1,"KELLY, William","KEA","N/A","N/A","N/A",12694,"- I do not know how New Zealand came into the matter, but it is clear that if you take a place and then hand it over to somebody else your rights have gone, and you can come in afterwards, only as a suppliant. And I suppose New Zealand, knowing that something was happening behind the doors in Downing-street, asked for . her share of the spoils. The whole trouble seems to -have occurred because Australia would not . stand the cost of keeping the flag hoisted.","Second Reading","NAURU ISLAND AGREEMENT BILL","/hansard/chamber.xscript/debate[8]/subdebate.1/speech[1]/continue[2]/talk.start/para","N/A","N/A"
237,0,0,1,0,0,0,0,1,"COOK, Joseph","F4S","N/A","N/A","N/A",12694,"-Oh no.","Second Reading","NAURU ISLAND AGREEMENT BILL","/hansard/chamber.xscript/debate[8]/subdebate.1/speech[1]/interjection[3]/talk.start/para","N/A","N/A"
238,0,0,1,0,0,0,0,1,"MASSY-GREENE, Walter","KNF","N/A","LP; NAT from 1917","N/A",12694,"- Is the honorable member quite sure of that statement?","Second Reading","NAURU ISLAND AGREEMENT BILL","/hansard/chamber.xscript/debate[8]/subdebate.1/speech[1]/interjection[4]/talk.start/para","N/A","N/A"
239,0,0,0,1,0,0,0,1,"KELLY, William","KEA","N/A","N/A","N/A",12694,"- Something of the kind must have happened.","Second Reading","NAURU ISLAND AGREEMENT BILL","/hansard/chamber.xscript/debate[8]/subdebate.1/speech[1]/continue[3]/talk.start/para","N/A","N/A"
240,0,0,1,0,0,0,0,1,"COOK, Joseph","F4S","N/A","N/A","N/A",12694,"- It was not that.","Second Reading","NAURU ISLAND AGREEMENT BILL","/hansard/chamber.xscript/debate[8]/subdebate.1/speech[1]/interjection[5]/talk.start/para","N/A","N/A"
241,0,0,0,1,0,0,0,1,"KELLY, William","KEA","N/A","N/A","N/A",12694,"- Then, why has Great Britain come into the matter at all ? We took the island just as we took New Guinea. There was no suggestion of a tripartite arrangement in regard to German . New Guinea. I hesitate to believe that. the British Government would have been so sensitive to the rights of a British company that they would so depart from the arrangement they made in regard to a non-paying German Possession, as to step in and dispossess us of another Possession of immense commercial value?","Second Reading","NAURU ISLAND AGREEMENT BILL","/hansard/chamber.xscript/debate[8]/subdebate.1/speech[1]/continue[4]/talk.start/para","N/A","N/A"
242,0,0,1,0,0,0,0,1,"FINLAYSON, William","KEX","N/A","N/A","N/A",12694,"- Who said it was a trade war?","Second Reading","NAURU ISLAND AGREEMENT BILL","/hansard/chamber.xscript/debate[8]/subdebate.1/speech[1]/interjection[6]/talk.start/para","N/A","N/A"
243,0,0,0,1,0,0,0,1,"KELLY, William","KEA","N/A","N/A","N/A",12694,"- All I know is that when the war broke out, I, as any other person would be who had anything to do, however remotely, with the government of the country, was determined to see how the interests of Australia could be best protected. By good luck, two men in Sydney told me of the value of this island; and through the promptitude of the Government the Australian flag was immediately hoisted there, just as it was hoisted in New Guinea, which, I am afraid, will be a load on Australia for many years to come.","Second Reading","NAURU ISLAND AGREEMENT BILL","/hansard/chamber.xscript/debate[8]/subdebate.1/speech[1]/continue[5]/talk.start/para","N/A","N/A"
244,0,0,1,0,0,0,0,1,"MATHEWS, James","KNH","N/A","N/A","N/A",12694,"- We backed up our claim to Rabaul by the occupation of it.","Second Reading","NAURU ISLAND AGREEMENT BILL","/hansard/chamber.xscript/debate[8]/subdebate.1/speech[1]/interjection[7]/talk.start/para","N/A","N/A"
245,0,0,0,1,0,0,0,1,"KELLY, William","KEA","N/A","N/A","N/A",12694,"- We did back up our possession of Nauru by hoisting our flag, and stationing some men there ; but somebody seems to have asked the British Government to shoulder the expense of keeping the island.","Second Reading","NAURU ISLAND AGREEMENT BILL","/hansard/chamber.xscript/debate[8]/subdebate.1/speech[1]/continue[6]/talk.start/para","N/A","N/A"
246,0,0,1,0,0,0,0,1,"MASSY-GREENE, Walter","KNF","Richmond","LP; NAT from 1917","Minister for Trade and Customs",12695,"- It waa the other way about.","Second Reading","NAURU ISLAND AGREEMENT BILL","/hansard/chamber.xscript/debate[8]/subdebate.1/speech[1]/interjection[8]/talk.start/para","N/A","N/A"
247,0,0,0,1,0,0,0,1,"KELLY, William","KEA","N/A","N/A","N/A",12695,"- This is one of the greatest puzzles of the whole  barney  that occurred in England. I certainly understood that a section of Australian, troops was stationed at Nauru, and that an Australian was actually administering the island. Then, how did the British Government come into the matter? Did they pay the cost of the occupation?","Second Reading","NAURU ISLAND AGREEMENT BILL","/hansard/chamber.xscript/debate[8]/subdebate.1/speech[1]/continue[7]/talk.start/para","N/A","N/A"
248,0,0,1,0,0,0,0,1,"COOK, Joseph","F4S","N/A","N/A","N/A",12695,"- No; we have done so up to date.","Second Reading","NAURU ISLAND AGREEMENT BILL","/hansard/chamber.xscript/debate[8]/subdebate.1/speech[1]/interjection[9]/talk.start/para","N/A","N/A"
