index,question_flag,answer_flag,interjection_flag,speech_flag,petition_flag,quote_flag,motionnospeech_flag,chamber_flag,name,name.id,electorate,party,role,page.no,content,subdebateinfo,debateinfo,path,Speaker,Time
302,0,0,0,1,0,0,0,1,"CHARLTON, Matthew","JXA","N/A","N/A","N/A",12703,"- Nauru was a German Possession. A British company took the risk of buying from the Germans a lease for 100 years. The Germans have lost the island; and I believe that, if the company are repaid the amount of capital they have expended on the island, that is all they have a right to expect. That will be doing justice to them. We have no right to give them anything further. A gentleman told me to-day that he had been informed by a German in Rabaul that the company paid £500,000 for the right to work the deposits for one hundred years. I have heard that the company are asking for a payment of £2,000,000 or £3,000,000.","Second Reading","NAURU ISLAND AGREEMENT BILL","/hansard/chamber.xscript/debate[8]/subdebate.1/speech[4]/continue[10]/talk.start/para","N/A","N/A"
303,0,0,1,0,0,0,0,1,"TUDOR, Frank","KWL","N/A","N/A","N/A",12703,"- I think a cable message stated that the company were asking for £6,000,000.","Second Reading","NAURU ISLAND AGREEMENT BILL","/hansard/chamber.xscript/debate[8]/subdebate.1/speech[4]/interjection[11]/talk.start/para","N/A","N/A"
304,0,0,1,0,0,0,0,1,"SAMPSON, Sydney","L0P","N/A","N/A","N/A",12703,"- £3,000,000.","Second Reading","NAURU ISLAND AGREEMENT BILL","/hansard/chamber.xscript/debate[8]/subdebate.1/speech[4]/interjection[12]/talk.start/para","N/A","N/A"
305,0,0,0,1,0,0,0,1,"CHARLTON, Matthew","JXA","N/A","N/A","N/A",12703,"- When, the honorable member for Kooyong (Sir Robert Best) was speaking, I interjected a question regarding the fair valuation, and his opinion, as a lawyer, coincided with mine as a layman. I recollect an occasion when, as a member of the New South Wales Parliament, I advocated that two private railways in that State should be taken over by the State Government. I made out the best case I could. The Minister for Railways of that day (Mr. Lee) said the proposition was a fair one. On making inquiries, he found that the Act governing one railway provided that the Government might take it over at its value, but the Act governing the other provided that it should be taken over at a fair valuation. The fair valuation had to be determined by arbitration, and the Minister found that the arbitrator had to take into consideration the future prospects of the line. If future prospects must be taken into consideration by any Court of Arbitration that is dealing with the rights of the Pacific Phosphate Company, what will be the result? For purposes of argument, I shall use the figures quoted by the honorable member for Kooyong, although I do not say they are correct. The honorable member said that the output of the company was 150,000 tons per annum, on which the company made a profit of 7s. per ton. That is equivalent to £52,500 per annum. The company had a right to work those deposits for 100 years, and their annual profit multiplied by 100 would give an aggregate profit of £5,250,000. In any arbitration proceedings the company will have a perfect right to make the most of their case, .and they will put forward those figures regarding past and prospective profits as evidence that ought to influence the Court. The Court must give a decision based not on sentiment, but on the facts, adduced. There is a danger in Article 7 that those deposits may be taken over at a very big price. If. we have to pay 5 per cent, on  a purchase price of £5,250,000, there will be an interest charge of £262,500 per annum which the farmers of this country will have to pay. There can be no escape from that.","Second Reading","NAURU ISLAND AGREEMENT BILL","/hansard/chamber.xscript/debate[8]/subdebate.1/speech[4]/continue[11]/talk.start/para","N/A","N/A"
306,0,0,1,0,0,0,0,1,"GIBSON, William","KAY","N/A","N/A","N/A",12704,"- If that had to be paid on an annual output of 150,000 tons, the price of the phosphates would be doubled.","Second Reading","NAURU ISLAND AGREEMENT BILL","/hansard/chamber.xscript/debate[8]/subdebate.1/speech[4]/interjection[13]/talk.start/para","N/A","N/A"
307,0,0,0,1,0,0,0,1,"CHARLTON, Matthew","JXA","N/A","N/A","N/A",12704,"- Not quite, because Australia will have to pay only 42 per cent., while Great Britain pays 42 per cent, and New Zealand 16 peI cent., but the interest charged will add considerably to the price of the phosphates.","Second Reading","NAURU ISLAND AGREEMENT BILL","/hansard/chamber.xscript/debate[8]/subdebate.1/speech[4]/continue[12]/talk.start/para","N/A","N/A"
308,0,0,1,0,0,0,0,1,"JOWETT, Edmund","KDZ","N/A","N/A","N/A",12704,"-^Surely the honorable member does not think the company would be awarded £5,000,000.","Second Reading","NAURU ISLAND AGREEMENT BILL","/hansard/chamber.xscript/debate[8]/subdebate.1/speech[4]/interjection[14]/talk.start/para","N/A","N/A"
309,0,0,0,1,0,0,0,1,"CHARLTON, Matthew","JXA","N/A","N/A","N/A",12704,"- I do not say what the company will be awarded. The Arbitration Court may get from the signatories other evidence which will influence it in fixing the compensation at £2,000,000 or £3,000,000. But whatever amount is fixed will be a permanent charge upon the countries that are parties to the agreement.","Second Reading","NAURU ISLAND AGREEMENT BILL","/hansard/chamber.xscript/debate[8]/subdebate.1/speech[4]/continue[13]/talk.start/para","N/A","N/A"
310,0,0,1,0,0,0,0,1,"JOWETT, Edmund","KDZ","N/A","N/A","N/A",12704,"- The amount cannot be as great as the honorable member has stated.","Second Reading","NAURU ISLAND AGREEMENT BILL","/hansard/chamber.xscript/debate[8]/subdebate.1/speech[4]/interjection[15]/talk.start/para","N/A","N/A"
311,0,0,0,1,0,0,0,1,"CHARLTON, Matthew","JXA","N/A","N/A","N/A",12704,"- Even if the amount of compensation is only half what I have mentioned, we shall have an interest bill annually of £131,000. I repeat that if we repay to the company the money they paid to Germany and any capital expenditure incurred in the island, we shall be acting fairly towards them. All the time they have been working the deposits they have been making profits, and I cannot see any reason why we should take into consideration a claim for anything over and above their actual expenditure. It is all very well for honorable members to say this will happen and that will happen. I have heard predictions of that kind before, but when the practical test was applied we found that we had been trapped and the people had to pay. It is in order to avoid that possibility that I have made this comparison; not because I am opposed to the agreement. Our interest in Nauru will be a good asset to Australia. It will help us to cheapen production in Australia, but we ought to see that no injustice is done to the farmer or to the general public. I venture to assert that, under this agreement, it is quite possible that we may have to pay considerably more for our interest in the island than we ought reasonably to be called upon to give for it.","Second Reading","NAURU ISLAND AGREEMENT BILL","/hansard/chamber.xscript/debate[8]/subdebate.1/speech[4]/continue[14]/talk.start/para","N/A","N/A"
312,0,0,0,1,0,0,0,1,"FENTON, James","KEV","Maribyrnong","N/A","N/A",12704,". - The more one looks into the agreement set out in. the schedule to this Bill the more one feels the necessity for further information in regard to it. In the absence of the particulars with which, we ought to be supplied, we may commit this country to a very considerable expenditure. I quite agree with the argument advanced by the honorable member for Hunter (Mr. Charlton), that if the island and its phosphatic deposits are to be worked as a commercial and profitable enterprise, it is quite possible that we shall erect under this agreement a small public service in connexion with, the operation of the mandate. That at all costs should be avoided. Whilst we may be getting a very good asset, if we are to pay men high salaries to administer the island, we shall find in it but another addition to our many expensive- luxuries. We seem to be all too prone to take over unprofitable enterprises. Many such undertakings could be enumerated, and I fail to see why we should still further burden ourselves with an expenditure of the kind I have indicated. I also indorse the position taken up by the honorable member for Wentworth (Mr. Kelly) when he inquires why Britain has any share in the administration of Nauru. It seems to me that the Pacific Phosphate Company has been at work, and that even while, the representatives of the great Powers were engaged in drawing up the terms of the Peace Treaty, and apportioning various parts of the earth, men possessing interests in this island have been, using their influence to secure that Britain shall have some voice in its management. It may be said that I have a sinister motive in making this suggestion; but it is an undoubted fact that speculators, company mongers, and others interested in big flotations have a better opportunity, putting it plainly, to get at the British Government than they have of getting at the Commonwealth Government. I quite agree with the honorable member for Wentworth, who, I think, should, have carried his argument further than he did. He plainly hinted that, in his opinion, Britains participation in the island, and the benefits accruing- from it, needs to be further examined.It is said by some that, under this agreement, we shall be taking over a very valuable asset. Superphosphates play a very important part, not only in the raising of crops, but in fertilizing grazing land. I fail to understand why the word  agricultural  is used in the agreement. Fertilizers are used in connexion with land employed for pastoral as well as agricultural purposes. I have here a quotation from the Industrial Australian and Mining Standard showing that many of - those who are raising cattle and sheep are using manures of various kinds to recuperate the soil, and to give to it greater fertility -The great arid plains of the Edwards and Mumimbidgee rivers of New South Wales produce sheep that are most conspicuous for frame and constitution. Probably the best merino sheep in the world are grown there - certainly the sheep that return most money per head to their owners. And this largely because there is some wonderful virtue in the soil of these plains that is transmitted through the pasture and herbage into the animals that graze upon it.The writer goes on to point out that there are some soils in Australia which possess considerable natural virtues, and impart those virtues through the pasture and herbage into the animals which graze upon them. There are other grazing lands which, by means of a top dressing of manures, are greatly recuperated to the benefit of the animals depastured on them. I am wondering whether the employment of the word  agricultural  in this agreement will debar the use of these phosphates in . the manufacture of manures to be devoted to grazing lands.Like other honorable members, I have been reading of Nauru and other islands. T learn from an article in Life that Nauru does not consist only of rock. The writer states - iNauru is appropriately called  Pleasant Island. It has a circumference of 12 miles, with wide foreshores, and in the centre a bunch of low-set hills, in which phosphate of lime is found. A. fine road encircles the island, and running through it is a beautiful avenue of coconut palms. Shallow lagoons, on seashore and in the -heart of the hills, mirror the beauties of palm groves, native villages, and make the island a photographers paradise.According to the writer of this article the estimated quantity of the phosphatic rock on the island is not 400,000,000 tons, as stated by the Prime Minister (Mr. Hughes), but only 40,000,000 tons. If the Prime Ministers. information as to the tonnage of phosphatic rock is incorrect, it may be wrong in regard, to many other items which have been submitted by him to the House this afternoon. These facts all go to suggest that there should be a closer investigation of the whole subject.","Second Reading","NAURU ISLAND AGREEMENT BILL","/hansard/chamber.xscript/debate[8]/subdebate.1/speech[5]/talk.start/para","N/A","N/A"
313,0,0,1,0,0,0,0,1,"SAMPSON, Sydney","L0P","N/A","N/A","N/A",12705,"- The Germans estimated the quantity at 300,000,000 tons.","Second Reading","NAURU ISLAND AGREEMENT BILL","/hansard/chamber.xscript/debate[8]/subdebate.1/speech[5]/interjection[1]/talk.start/para","N/A","N/A"
314,0,0,0,1,0,0,0,1,"FENTON, James","KEV","N/A","N/A","N/A",12705,"- I do not know where the honorable member has obtained that information, but I have been quoting from an article published in Life, and evidently giving first-hand information. It is illustrated with plates showing the natives at work excavating the phosphatic rock, and carrying it in baskets to various places.","Second Reading","NAURU ISLAND AGREEMENT BILL","/hansard/chamber.xscript/debate[8]/subdebate.1/speech[5]/continue[1]/talk.start/para","N/A","N/A"
315,0,0,1,0,0,0,0,1,"JOWETT, Edmund","KDZ","N/A","N/A","N/A",12705,"- Who is the author?","Second Reading","NAURU ISLAND AGREEMENT BILL","/hansard/chamber.xscript/debate[8]/subdebate.1/speech[5]/interjection[2]/talk.start/para","N/A","N/A"
316,0,0,0,1,0,0,0,1,"FENTON, James","KEV","N/A","N/A","N/A",12705,"- Mr. Thomas J. McMahon. The honorable member is always delighted to hear something concerning the social environment of people of other countries, and he will perhaps be. interested in a further quotation from this article setting out that -The King of Nauru,  Oweida, is a most charming and affable old gentleman, with the heartiest laugh imaginable. He is to be seen very often riding about on his bicycle, attended by his Master of the Bike, a sturdy young native, who looks after the Royal bicycle, sees that the tyres are in good order and the machine in repair.  0\\aida  is to the fore in all patriotic movements of the island, especially those in aid of the Bed Cross, and invariably has stuck out from the back of his bike a lon pole with a small Red Cross Hag. At public functions His Majesty wears a tall hat, frock coat, coloured vest, nicely creased trousers, black patent-leather shoes with brown laces, a stiff collar, and smart- tie; a walking stick completes the turnout.We are now looking at Nauru, not from the pleasant picture point of .view, but through legislative eyes, with the object of discovering in it some of those potentialities of which the Prime Minister spoke when introducing this Bill. We have to ask ourselves whether we are really getting such a wonderfully good going concern as we might at first imagine. I do not know whether a Court, in determining what compensation should be paid to the Pacific Phosphate Company, would take into account what the future is likely to develop in regard to the fertilization of soils. France, for instance, is not keenly interested to-day in -the addition of phosphatic elements to her soil. . Scientists and chemists there are fertilizing the soil by means of electricity. Marvellous crops of wheat, barley, asparagus, and other produce have been obtained there as the result of the application of electricity. The day may come when the application of phosphatic manures to the soil may give place to a cheaper and more effective process. Prospectively, there may not be nearly sr> much attaching to our having a mandate over the Island of Nauru as the Prime Minister has suggested.We must be careful not to make the island a place wherein luxurious billets may be found. If we do, then, unless we are going to make it absolutely impossible for the farmer to obtain cheap manure manufactured from this rock phosphate, we shall never be able to compete with other countries. The honorable member for Kooyong (Sir Robert Best) said that, unless we erected a fairly high Tariff barrier, we should not be able to compete with Japan in the supply of superphosphate in Australia. I suppose that the honorable member for Calare (Mr. Pigott), with his Free Trade proclivities, would rejoice in Japan being able to undersell the Commonwealth Government in the supply of superphosphate.","Second Reading","NAURU ISLAND AGREEMENT BILL","/hansard/chamber.xscript/debate[8]/subdebate.1/speech[5]/continue[2]/talk.start/para","N/A","N/A"
317,0,0,1,0,0,0,0,1,"PIGOTT, Henry","KYA","N/A","N/A","N/A",12706,"- Is the honorable member aware that Japan, before the .war, was obtaining most of her supplies of phosphatic rock from Nauru?","Second Reading","NAURU ISLAND AGREEMENT BILL","/hansard/chamber.xscript/debate[8]/subdebate.1/speech[5]/interjection[3]/talk.start/para","N/A","N/A"
318,0,0,0,1,0,0,0,1,"FENTON, James","KEV","N/A","N/A","N/A",12706,"- And is the honorable member aware that the Caroline Islands, over which Japan has a mandate, have a larger supply of phosphatic rock than has Nauru, and that it is perhaps of better quality?","Second Reading","NAURU ISLAND AGREEMENT BILL","/hansard/chamber.xscript/debate[8]/subdebate.1/speech[5]/continue[3]/talk.start/para","N/A","N/A"
319,0,0,1,0,0,0,0,1,"PIGOTT, Henry","KYA","N/A","N/A","N/A",12706,"- I am not.","Second Reading","NAURU ISLAND AGREEMENT BILL","/hansard/chamber.xscript/debate[8]/subdebate.1/speech[5]/interjection[4]/talk.start/para","N/A","N/A"
320,0,0,0,1,0,0,0,1,"FENTON, James","KEV","N/A","N/A","N/A",12706,"- It is a well-known fact that the Ocean Island deposits are better than thos9 of Nauru.","Second Reading","NAURU ISLAND AGREEMENT BILL","/hansard/chamber.xscript/debate[8]/subdebate.1/speech[5]/continue[4]/talk.start/para","N/A","N/A"
321,0,0,1,0,0,0,0,1,"PIGOTT, Henry","KYA","N/A","N/A","N/A",12706,"- Why did Japan, before the war, obtain her supplies from Nauru ?","Second Reading","NAURU ISLAND AGREEMENT BILL","/hansard/chamber.xscript/debate[8]/subdebate.1/speech[5]/interjection[5]/talk.start/para","N/A","N/A"
322,0,0,0,1,0,0,0,1,"FENTON, James","KEV","N/A","N/A","N/A",12706,"- Probably because it suited her to . do so. Japan intends to develop the islands over which she .has obtained a mandate, and I believe it is correctly stated that the valuable deposits of .phosphates in the Caroline Islands and elsewhere will be developed by her by means of cheap labour. The product of that cheap labour will pour into this country, and local manufacturers will be crowded out. All these are matters which we shall have to consider. Superphosphates from cheap-labour countries should not have the same opportunity here as those manufactured under reasonable conditions of labour.When the question of compensation is under consideration, will the arbitrators take these facts into consideration, and have regard also to the future? Unless they do, we shall burden the industry, and in all probability cripple its success. If it be true that the company has made an average profit of £52,000 per annum, and that it paid Germany £600,000 for the right to mine for phosphatic rock at Nauru, it ought to be satisfied with that amount of £600,000, without taking into account the prospects of a hundred years ahead. We must be careful we do not pay too much even for this valuable asset.Another suggestion 1 would make is that the Government should take the control of this industry from beginning to end. The Government ought not to be satisfied to merely quarry the rock and carry it on ship to the various ports of Australia; but they should undertake the work of turning the rock into the finished article to he sold to our farmers. -We shall never be able to pay our way by taxing and borrowing alone, and the Government, therefore, ought to take in hand good paying industries, such as the one we are discussing. We expect in three years to own a mercantile marine running into 100 vessels, to be used for the purpose of carrying our produce to the other side of the world, arid if it is a good, policy to own. vessels in that way, we should use them to bring this raw material to Australia, in order that, the profits may not go to private persons, but into the public Treasury. If we are to have the  new world  of which we hear, the Government will have to take a more active interest- in the industries .of the country ; and, unless .they do so in the case of these phosphates, I cannot see how they can be turned into a paying proposition.I hope that at the end of five years, if not before,. Australia, as her share, will be getting, not 42 per cent., but 84 per cent, of the phosphates, leaving to New Zealand the 16 per cent., which is all that is required by the Dominion. The 5,000,000 people in Australia have incurred a debt which represents a burden that will not only bend, but crush, them unless our ordinary sources of revenue from taxation and borrowing are supplemented. An industry such as this, properly managed by the Government from start to finish, should be as profitable, or even more profitable than our mercantile marine.Of course, the agreement has been made on behalf of Australia by the Prime Minister, and I suppose we cannot alter it now; but if there were an opportunity we should certainly see that the United Kingdoms share was transferred to us. The Prime Minister has told us that the United Kingdom is not likely to require 42 per cent, of the phosphates, for the simple reason that she can obtain supplies from Algeria and America, and it seems unlikely that she will come 12,000 miles for raw material of the kind. I think that we, as a Parliament, might, by making proper representations, have the agreement varied in that way; at any rate, I see failure for the whole scheme -unless the Government intend, not only to mine, but to manufacture the phosphates. We ought to remember, too, that our supply of fertilizers does not come only from such deposits as these. I understand that the Mount Lyell Company manufacture certain by-products into fertilizers, and that there are supplies from other quarters. The chemist is now at work, and if ever he were needed he is needed on the farm and in connexion with our soils. One of the great failures on the part of the States is shown in the fact that there is not a proper analysis of Australian soils, whereas we ought tq know exactly the kind of soil to be found in any part of Australia, and be able to add to its fertility by chemical processes, the application of electricity, and other methods. We ought to be most careful how we give our support to a Bill of this character ;: but I suppose we shall simply have to agree to it.","Second Reading","NAURU ISLAND AGREEMENT BILL","/hansard/chamber.xscript/debate[8]/subdebate.1/speech[5]/continue[5]/talk.start/para","N/A","N/A"
323,0,0,1,0,0,0,0,1,"WEST, John Edward","KZA","N/A","N/A","N/A",12707,"- If we pass the Bill, the responsibility will be on this Parliament.","Second Reading","NAURU ISLAND AGREEMENT BILL","/hansard/chamber.xscript/debate[8]/subdebate.1/speech[5]/interjection[6]/talk.start/para","N/A","N/A"
324,0,0,0,1,0,0,0,1,"FENTON, James","KEV","N/A","N/A","N/A",12707,"- Quite so; but what possibility is there of amending the Bill, seeing that the agreement has been signed on behalf of the people of Australia? I do not wish to. speak in terms of condemnation of the Prime Minister; but I think a great -mistake was made by him in regard to Nauru. He ought to have insisted on a mandate being given to Australia and New Zealand only, with the .greater proportion of the power to Australia. As I have said, I should like to see the British interest removed altogether.We ought to know as nearly as possible the tonnage of these deposits. Some figures have been given showing the quantity at 40,000 tons, but the Prime Minister spoke of 400,000,000 tons.","Second Reading","NAURU ISLAND AGREEMENT BILL","/hansard/chamber.xscript/debate[8]/subdebate.1/speech[5]/continue[6]/talk.start/para","N/A","N/A"
325,0,0,1,0,0,0,0,1,"WEST, John Edward","KZA","N/A","N/A","N/A",12707,"- The Prime Minister spoke of S0,000,00O tons.","Second Reading","NAURU ISLAND AGREEMENT BILL","/hansard/chamber.xscript/debate[8]/subdebate.1/speech[5]/interjection[7]/talk.start/para","N/A","N/A"
326,0,0,1,0,0,0,0,1,"GLYNN, Patrick","KCO","N/A","N/A","N/A",12707,"- The . Prime Minister merely informed the House of varying estimates that .had. been made.Mr. FENTON. What is the tonnage?","Second Reading","NAURU ISLAND AGREEMENT BILL","/hansard/chamber.xscript/debate[8]/subdebate.1/speech[5]/interjection[8]/talk.start/para","N/A","N/A"
327,0,0,1,0,0,0,0,1,"GLYNN, Patrick","KCO","N/A","N/A","N/A",12707,"-- The Prime Minister quoted estimates, including one of 300,000,000 tons.","Second Reading","NAURU ISLAND AGREEMENT BILL","/hansard/chamber.xscript/debate[8]/subdebate.1/speech[5]/interjection[9]/talk.start/para","N/A","N/A"
328,0,0,0,1,0,0,0,1,"FENTON, James","KEV","N/A","N/A","N/A",12707,"- There is a great disparity in the estimates that have been presented to us.","Second Reading","NAURU ISLAND AGREEMENT BILL","/hansard/chamber.xscript/debate[8]/subdebate.1/speech[5]/continue[7]/talk.start/para","N/A","N/A"
329,0,0,1,0,0,0,0,1,"SAMPSON, Sydney","L0P","N/A","N/A","N/A",12707,"- The Germans estimated the quantity to be 400,000,000 tons.","Second Reading","NAURU ISLAND AGREEMENT BILL","/hansard/chamber.xscript/debate[8]/subdebate.1/speech[5]/interjection[10]/talk.start/para","N/A","N/A"
330,0,0,0,1,0,0,0,1,"FENTON, James","KEV","N/A","N/A","N/A",12707,"- But what official figures have we? The honorable member would have despised a German estimate not long ago.","Second Reading","NAURU ISLAND AGREEMENT BILL","/hansard/chamber.xscript/debate[8]/subdebate.1/speech[5]/continue[8]/talk.start/para","N/A","N/A"
