index,question_flag,answer_flag,interjection_flag,speech_flag,petition_flag,quote_flag,motionnospeech_flag,chamber_flag,name,name.id,electorate,party,role,page.no,content,subdebateinfo,debateinfo,path,Speaker,Time
124,0,0,0,1,0,0,0,1,"HUGHES, William Morris","DQC","Bendigo","NAT","Prime Min,ister and Attorney-General",12678,". - I mover -That this Bill be now read a second time.This is a . Bill to approve the agreement made1 between- the Government of the United Kingdom, the Government of the Commonwealth of Australia, and the Government of New Zealand, the terms of which are set out in the schedule.Before I proceed to deal with the agreement itself, some general observations are necessary in regard to Nauru, its pre-war position, the circumstances in which it was- taken over- from Germany, and the value and nature of its phosphatic deposits. Nauru, a a honorable members are, no doubt, aware-, is a very small island, about 5-,0(J0 acres in extent, situated a few miles to the south of the equator, and in about the same latitude as Ocean Island.Before the war this island was part of the German Empire, and on the outbreak of the war, or shortly afterwards - in fact, on the 19th August - the British authorities suggested to the Commonwealth Government that it should occupy Nauru, in common with all the rest of the islands of the Bismarck Archipelago. In November, the- intervening time having been spent in the occupation of New Guinea and the adjacent islands, Australian Forces from Rabaul took possession of Nauru, andi are there now, having remained in occupation ever since. So much for the sovereignty of the island.. It was German before the war,, it was occupied at the outbreak of the war, or almost immediately after, by the Australian troops, and is garrisoned by them now.Now, a word, as to the mandate-that is to say; the tenure under which the sovereignty of the. island is held at present. In considering the question of the mandates, the Allies and Associated Powers decided that all the islands in the Pacific south of the line, excepting Samoa and Nauru, should be vested in the Commonwealth of Australia. . Samoa went to New Zealand, and the Council of Four decided that the mandate for Nauru was to be vested in the- British Empire as distinguished from, any particular part thereof. Nauru then became a domestic question to be settled by the various members of the Empire amongst themselves.On behalf of the Commonwealth, I pressed the claim of Australia to control Nauru under exactly the same terms and conditions as the other islands of the Archipelago. I shall not trouble honorable members with any further reference to the negotiations that ensued beyond saying that they were long, difficult, and finally settled by the agreement which honorable members, have now before them. The joint control, of this island was conferred upon Britain, Australia, and New Zealand by the British  Delegation - that body, as I said* previously in. this House, which is usually called the Imperial Cabinet - a body made up of representatives of the various self-governing Dominions of the United Kingdom and of India. The mandate was vested by the Council of the Four in the British Empire. It was left to the various members of the Empire to decide who should administer, it- and work the phosphates. . ,This brings me to the next point to which I wish to draw the attention of honorable members. Before the war the ownership of the island:, as distinguished from its sovereignty - that is to say, the ownership of the phosphates and the right to work them- had been acquired by a British company,, in which . there was at that time a very large German, holding. The German element has been of course, eliminated. .I am not prepared, to say what is the nature of the title of this British, company to this island-. I am not prepared to admit that it has- any title. I am here to protect the interests of the Commonwealth,, but honorable members, if they look, at the agreement, will see in- what way the rights., if any, of this company, or any, company, to this island- are to be acquired. The purpose of the agreement, is to make the phosphates available at cost price to the three parties to the agreement - the United Kingdom, the Commonwealth of Australia, and the Dominion of New Zealand - on the basis of the agricultural requirements of .each. That is to be the basis cai which each one of these parties , is to participate in the phosphatic deposits of Nauru, subject to the terms of the agreement as set out in the schedule, which defines clearly the proportions to which each one is actually entitled.Phosphatic deposits are immensely valuable. I do not speak now of the phosphatic deposits on Nauru only, but of phosphatic deposits generally. They are essential not merely to our agriculture, but to agriculture the world over. The worlds production of rock phosphate before the war was about 7,000,000 tons a year. Of that the United States produced about 3,000,000 tons, and Algeria and Tunis between them another 3,000,000 tons, the balance being made up from Ocean Island, Christmas Island - which is in the Straits Settlements - and Nauru. The pre-war production of Nauru was somewhere between 90,000 and 100,000 tons a year, and that of Ocean Island about 250,000 tons.Before I deal with the extent to which phosphates are at present required for agricultural and pastoral purposes in Australia, I should like to say something as to .the estimated value of this island. As I have said, its actual output before the war was between 90,000 and 100,000 tons a year, while the f.o.b. price before the war was 30s., and, during the war, about £2. It is difficult to get a reliable estimate of the extent and value of the phosphates on the island, of Nauru, for the estimates given differ very widely. A conservative estimate puts it at S0,000,000 tons, another even as low as 42,000,000 tons. Beyond stating that it is a very valuable property, I shall not commit myself to any definite figure. To all intents and purposes, the whole island is made up of phosphatic rock, which some of those best able to judge consider to be worth hundreds of millions. In an article in the West Australian on the 23rd August of this year, Lieutenant Gordon Clifton states that the island is practically one mass of phosphates; that there are approximately 80,000,000 tons in view, and that scientists assert that there are between 430,000,000 and 450,000,000 tons of phosphates available. That writer also states that it is calculated that, given reasonable shipping facilities, the deposit is -sufficient to supply present-day de,mands- -that is the whole worlds demands - for at least 100 years. That, of course, is a statement for which the writer must take full responsibility, but I give it for what it is worth. It is quite as valuable as the one I quoted previously, and the man who wrote the article has, at least, had the advantage of seeing the place, and is, I believe,, an expert. Then, again, in giving evidence before the Inter-State Commission, Mr. King, of the Pacific Phosphate Company, speaking of the value as dis.tinguished from the amount of phosphates, said -From Nauru in 1914 there was exported between 90,000 and .100,000 tons of phosphates. It was estimated that, of the- 5,600 acres which formed the total area of the island, 4,500 acres contained phosphate deposits to the extent of some 300,000,000 tons. The total value of the deposits on Nauru might be put down at £375,000,000.I am unable to say how far such evidence may be regarded as conclusive, but merely give it for what it is worth. That the phosphatic deposits on Nauru are valuable is beyond all question, and it is also certain that our share under the agreement is ample for our requirements for the next hundred years.Without .phosphates Australia cannot progress. .We are a progressive nation, and year .by year require a greater supply of this necessity. Thi3 agreement, which vests in us, as one of the parties, 42 .per cent, of the total output of the island, gives us a most valuable asset, not one that endureth for- a day, but an asset that will last for a century or more. It will give the agriculture of this country, at a reasonable .rate, the material which is its very life blood. We shall be able to sell phosphates to the farmer at cost price; that is- to say, the price at which the Commission is able to get the phosphatic rock into the ship, transport it to the port of discharge, and there turn the rock into the form in which it is immediately available for use by the farmer. The agreement, therefore, is of immense importance to the agricultural, and even the pastoral, welfare of Australia, and will be some set-off against the huge expenditure which -we incurred during the war.I call the attention of the House to  some figures bearing on the terms of the agreement, the application of which honorable members will readily see for themselves. It is estimated that the requirements of Australia in imported phosphates for the next few years will be 200,000 tons per annum. We imported during the year 1914-15 173,000 tons, and during the year 1915-16 .190,000 tons of phosphates from Nauru and Ocean Island. No less than 88 per cent, of all our imports of phosphates of all kinds were rock phosphates from those two islands. The United Kingdom imported only 50,000 tons of rock phosphates from the Pacific Islands, although it imported 562,000 tons from all countries. Thus the United Kingdom imported less- than 10 per cent, of its requirements .in the form of rock phosphates from the Pacific. The prices given to me, which I give to the House for what they are worth, assuming that they are . 1914 prices, although they may he 1915 prices, are: Guano, £4 5s. per ton; superphosphates, £3 3s. per ton ; and rock phosphates, £2 7s. 8d. per ton. Of guano, we imported only 100 tons in 1914-15, and 90 tons in 1915-16, but 13,000 tons in 1916-17, when  we were unable to get superphosphates.The artificial manures used in Australia, covering, not merely phosphates, but all varieties, amounted in 1915-16 to 381,000 tons, and in 1916-17 to 346,000 tons, so that 58 per cent, of all the artificial manures used in this country were rock phosphates. Honorable members will, therefore, see what a tremendous influence this agreement will have on the welfare and progress of the agriculture of the Commonwealth. We shall have at once an assured supply at the cheapest possible rates that can be obtained in the world, because the article will be obtained at cost price. I direct attention, also, to the fact that we get, in addition to this, our share of any profits on the sale of all phosphates over and above what we consume in Australia. .This very valuable property is to be acquired in the way set out in the schedule, at a fair valuation. Article 7 provides -Any right, title, or interest which the Pacific Phosphate Company or any person may have in the said deposits, land, buildings, plant, and equipment (so - far as such right, title, and interest is not dealt with by the Treaty of Peace) shall be converted into a claim for compensation at a fair valuation.That means that if any right, title, or interest is held by an enemy it ils covered by the Treaty of Peace, and . we need not concern ourselves with it. If it is held by a British company, or by some person other than an enemy, it is to be acquired at a fair valuation. The method agreed upon between Lord Milner, Mr. Massey, and myself was that Lord Milner should endeavour to make an agreement with the company at what was considered by all of us to be a fair price, and that, failing an agreement, the matter should go to arbitration in the usual way. I do not intend to indicate to the House what we consider a fair price. If I gave too low a figure, I should mislead the House, and if I gave a figure higher than that which it is worth it would be used by the company in the proceedings before the arbitrator, or in their negotiations with the Secretary of State. I did, however, mention a figure, to the Secretary of State, beyond which we are not prepared to go without consultation. If the matter comes down to a direct affair, and is not referred, to arbitration, that figure, of course, will be presented to this Parliament, which can express its own opinion on it.An important point not raised in this agreement, but nevertheless dealt with during the course of the negotiations between the Governments of Great Britain, New Zealand, and the Commonwealth of Australia, as represented by their respective delegates, is the acquisition of Ocean Island. Its acquisition is quite outside the agreement, but it is owned- by the same company. They say,  You are going to acquire Nauru, and one of two things will happen. Either you will ruin our business, or we shall- compete with you in those markets where you must find openings for your excess products. Probably. the consideration which moved them in the matter at all was the disastrous , effect that our competition would have upon them. It is evident that when a company which had a monopoly, as this company had, for all practical purposes in the Pacific, is faced with an agreement which takes that monopoly from them, and raises up not merely a powerful competitor, but a competitor which can defy them, the value of their shares is forced down on the market, and the value of their property seriously depreciated. So it is probable that we shall ask Parliament to consider the taking over of Ocean Island also. That, however, will form the subject of another agreement. The taking over of Ocean Island would be of incalculable benefit to Australia, and I can think of no better business deal to which this country could commit itself. We shall go into that business, of course; with the United Kingdom and New Zealand, but with the United Kingdom, anyhow. If by any chance New Zealand should not ratify this agreement, Great Britain and Australia - assuming this Parliament will ratify it - will take the whole thing over. Therefore the position is one for this Parliament to determine for itself. I hope that I have made the position clear in regard to Ocean Island. Under this Bill we incur no liability in regard to it, . but it is very much to our interests to secure it, in order that we may be in a position to work both deposits or either to meet the requirements of the market. We shall be able to work the two of them more cheaply.","Second Reading","NAURU ISLAND AGREEMENT BILL","/hansard/chamber.xscript/debate[6]/subdebate.1/speech[1]/talk.start/para","N/A","N/A"
125,0,0,1,0,0,0,0,1,"BOYD, James","JRP","N/A","N/A","N/A",12681,"- Will you work them both under an agreement similar to this?","Second Reading","NAURU ISLAND AGREEMENT BILL","/hansard/chamber.xscript/debate[6]/subdebate.1/speech[1]/interjection[1]/talk.start/para","N/A","N/A"
126,0,0,0,1,0,0,0,1,"HUGHES, William Morris","DQC","N/A","N/A","N/A",12681,"- Yes ; they would come ipso facto under the control of the three Commissioners referred to in this Bill.The agreement itself requires very little explanation beyond the general one which I have already put before the House. The Administrator is to preserve law and- order. He is responsible for the government, of the country as prescribed by .the mandate; that is to say, there shall be no slavery, or forced labour, and no sale of alcohol to indigenes; the .island cannot be fortified, and. so on. In all respects otherwise he is vested with the powers of an ordinary Administrator or Governor in regard to the maintenance of law and order. His functions are quite- distinct from those of the Commissioners. Article 1 provides that he shall have power to make Ordinances for the peace, order, and good government of the island subject to the terms of the agreement, and particularly - but so as not to limit the generality of the foregoing provisions - to provide for the education of children on the island, to establish and maintain the necessary police force, and to establish and appoint Courts and magistrates with civil and criminal jurisdiction. The first Administrator is to be appointed for a term, of five years by the Australian Government. All the expenses of the administration, including the remuneration of the Administrator and of the Commissioners, so far as they are not met by other revenues, are to be defrayed out of the proceeds of the sales of the phosphates.","Second Reading","NAURU ISLAND AGREEMENT BILL","/hansard/chamber.xscript/debate[6]/subdebate.1/speech[1]/continue[1]/talk.start/para","N/A","N/A"
127,0,0,1,0,0,0,0,1,"ORCHARD, Richard","KMC","N/A","N/A","N/A",12681,"- Are not our soldiers in occupation of the island?","Second Reading","NAURU ISLAND AGREEMENT BILL","/hansard/chamber.xscript/debate[6]/subdebate.1/speech[1]/interjection[2]/talk.start/para","N/A","N/A"
128,0,0,0,1,0,0,0,1,"HUGHES, William Morris","DQC","N/A","N/A","N/A",12681,"- We were asked by the British Government to protect the interests of the Pacific Phosphate Company, and we placed soldiers on the island to do so.I come now to the business side of this agreement. There are to be three Commissioners - one to be appointed by the Government of the United Kingdom, one to be appointed by the Government of New Zealand, and the other to be appointed by the Commonwealth Government. Each Commissioner is to hold office during the pleasure of the Government appointing him and the three Governments, or, if they are unable to agree, the majority are to fix the remuneration of the Commissioners. The title to the phosphate deposits and to all land, buildings, plant, and - equipment on .the island used in connexion with the working of the deposits will be vested in the Commissioners.This is a business proposal, and the working of these deposits must be carried out on business lines. Three Governments are concerned in the agreement, and obviously no political influence of any kind can be permitted. The Commissioners cannot be interfered with in the exercise of their functions. . A Government can remove its Commissioner and appoint another in his place, but no one Government can interfere with the Commissioners in carrying out their work, and the whole three Governments can only interfere by varying the agreement itself.","Second Reading","NAURU ISLAND AGREEMENT BILL","/hansard/chamber.xscript/debate[6]/subdebate.1/speech[1]/continue[2]/talk.start/para","N/A","N/A"
129,0,0,1,0,0,0,0,1,"BOYD, James","JRP","N/A","N/A","N/A",12681,"- That is provided for in Article 13 governing the Commissioners, but why does not that article also govern the Administrator ?","Second Reading","NAURU ISLAND AGREEMENT BILL","/hansard/chamber.xscript/debate[6]/subdebate.1/speech[1]/interjection[3]/talk.start/para","N/A","N/A"
130,0,0,0,1,0,0,0,1,"HUGHES, William Morris","DQC","N/A","N/A","N/A",12681,"- The Administrator is in quite a different position. He is to be appointed by the three Governments. They take it in turn to make the appoinment.He is limited by the terms of the agreement. He must not interfere with the -Commissioners in the working of the phosphate deposits. He cannot go outside the terms of the agreement nor of those of the mandate, but under the agreement there are certain duties imposed on him, such as the education of children and others I have already mentioned. Civil administration is one thing; the conduct of a business quite another. Governments have a right to control civil . administration, but this is a business proposition in which three Parliaments, possibly with conflicting interests, are concerned. Who would set his name to an agreement which could be rendered- absolutely worthless by the interference of a Parliament over which we had absolutely no control i Whatever we. may think of doing in this country, we cannot allow other people to interfere and say what we are or are hot to do.Article 7 provides for the taking over of the interests of the Pacific Phosphate Company at a fair valuation, . and the amount of the compensation decided upon is to be contributed by the Governments of the United Kingdom, the Commonwealth of Australia, and the Dominion of New Zealand, in proportions to be mutually agreed upon, or, in the event of their failing to allot proportions, within three months of this agreement coming into force, then in the same proportion as the first allotment of phosphates under Article 14. That Article says that each of the three Governments shall be entitled to an allotment of the phosphates produced each year in the following proportions : -United Kingdom - 42 per cent.Australia - 42 per cent.New Zealand - 16 per cent.Those are the proportions in which we shall contribute towards the compensation to be paid to the Pacific Phosphate Company. We shall pay 42 per cent... the United Kingdom 42 per cent., and New Zealand 16 per cent. In turn, we are entitled to 42 per cent, of the output, the United Kingdom to 42 per cent, of the output, and New Zealand to 16 per cent, of the output.Article 9 provides that the deposits shall be worked and sold under the direction, management, and control of the Commissioners, subject to the terms of the agreement, and .that it shall be the duty of the Commissioners to dispose of the phosphates according to the agricultural requirements of the United Kingdom; Australia, and New Zealand. This article is of fundamental importance. There ds no fixed proportion for the distribution of the phosphates; the agricultural requirements of the three countries are to be ascertained, and upon that basis each has a right, to a proportion of the phosphates on the Island of Nauru. I have already explained that 88 per cent, of Australias importations of phosphates came from the two Pacific islands, Ocean Island and Nauru Island. On the other hand, Britain took less than 10 per cent, of her total importations of phosphates from these two islands. Naturally, our geographical position, compared with hers, serves to prove that we shall be the greatest gainers under this agreement, because we are near at hand while she is far off. She can get her phosphates from Algiers, Tunis, and America. If Britain takes her supplies from Nauru or Ocean Island she must pay freight on a water carriage of 13,000 or 14,000 miles. Australia, on the other hand, is within 2,000 or 3,000 miles of the deposits. Article 10 provides -The Commissioners shall not, except with the unanimous consent of the three Commissioners, sell or supply any phosphates to, or for shipment to, any country or place other than the United Kingdom, Australia, and New Zealand.The Commissioners, cannot, without general consent, sell to any country other than the three parties to. the agreement.","Second Reading","NAURU ISLAND AGREEMENT BILL","/hansard/chamber.xscript/debate[6]/subdebate.1/speech[1]/continue[3]/talk.start/para","N/A","N/A"
131,0,0,1,0,0,0,0,1,"KELLY, William","KEA","N/A","N/A","N/A",12682,"- Does not the use of the word  agricultural  in Article 9 limit the possible extension of the use of phosphates for other purposes?","Second Reading","NAURU ISLAND AGREEMENT BILL","/hansard/chamber.xscript/debate[6]/subdebate.1/speech[1]/interjection[4]/talk.start/para","N/A","N/A"
