index,question_flag,answer_flag,interjection_flag,speech_flag,petition_flag,quote_flag,motionnospeech_flag,chamber_flag,name,name.id,electorate,party,role,page.no,content,subdebateinfo,debateinfo,path,Speaker,Time
1,0,0,0,0,0,0,0,1,"N/A","N/A","N/A","N/A","N/A","N/A","Mr. Speaker (Hon. Sir Littleton Groom) took the chair at 3 p.m., and read prayers.","N/A","N/A","/hansard/chamber.xscript/business.start/para","N/A","N/A"
2,0,0,0,1,0,0,0,1,"SPEAKER, Mr",10000,"N/A","N/A","N/A",22,"- I have received from His Excellency the Governor-General a commission authorizing me to administer at Canberra the oath or affirmation of allegiance to members of the House. I now lay the commission on the table.","N/A","COMMISSION TO ADMINISTER OATH","/hansard/chamber.xscript/debate[1]/speech/talk.start/para","N/A","N/A"
3,0,0,0,1,0,0,0,1,"SPEAKER, Mr",10000,"N/A","N/A","N/A",22,"- During the recent adjournment I received a return to the writ I issued on the 26th April last for the election of a member to serve for the electoral division of Warringah. in the place of the Hon. Sir Granville Ryrie. According to the endorsement on the writ, Mr. Robert Archdale Parkhill has been elected.Mr. Parkhill made and subscribed the oath of allegiance.","N/A","MEMBER SWORN","/hansard/chamber.xscript/debate[2]/speech/talk.start/para","N/A","N/A"
4,0,0,0,1,0,0,0,1,"SPEAKER, Mr",10000,"N/A","N/A","N/A",22,"- I have to report to the House that I waited on His Royal Highness, the Duke of York, on the evening of the 9th of May, and presented to him the Address agreed to by the House on that day. His Royal Highness was graciously pleased to make the following reply : -Mr.Speaker and Members of the House of Representatives of the Parliament of the Commonwealth:I thank you most sincerely for the Address which you have just presented to me on behalf of the House of Representatives of the Parliament of the Commonwealth. The Duchess and I are deeply grateful for your generous words, and I will not fail to convey to the King, my Father, the expressions of duty and loyalty to the Crown and Person of the Sovereign which it contains. The King and Queen retain the most vivid recollections of their visit to Australia when, as your Address recalls, he opened the first Federal Parliament 26 years ago.It is a source of the greatest pride to me that I should have been commissioned by the King to open the first meeting of the Commonwealth Parliament at Canberra, and thereby to inaugurate the new Capital City. The Duchess and I rejoice to have been associated with the people of the Commonwealth on this great and historic occasion. We shall always remember our visit to Australia, and to-days culminating event as one of the proudest and happiest memories of our lives.We pray that our present tour, and especially the ceremony of to-day, performed, as it has been, in the presence of representatives of various parts of the Empire, may be the means of drawing still closer the ties of loyalty, kinship, and affection, which bind together all members of the British Commonwealth.Albert. 9th May,1927.","N/A","ADDRESS TO THE DUKE OF YORK","/hansard/chamber.xscript/debate[3]/speech/talk.start/para","N/A","N/A"
5,0,0,0,1,0,0,0,1,"SPEAKER, Mr",10000,"N/A","N/A","N/A",22,"- I have to announce the receipt of a letter from Mrs. Brooks, the daughter of the late Hon. W. G. Spence, expressing gratitude on behalf of her mother and other members of the family for the resolution of sympathy passed by the House. on the 2nd March last.","N/A","LATE HON. W. G. SPENCE","/hansard/chamber.xscript/debate[4]/speech/talk.start/para","N/A","N/A"
6,0,0,0,0,0,0,0,1,"N/A","N/A","N/A","N/A","N/A","N/A","The Late Mr. W. A. Gale, C.M.G","N/A","DEATH OF THE CLERK","/hansard/chamber.xscript/debate[5]/para","N/A","N/A"
7,0,0,0,1,0,0,0,1,"GROOM, Littleton",10000,"N/A","N/A","N/A",22,"- Honorable members will regret the death of the late Clerk of the House.Mr. Walter A. Gale C.M.G., which occurred since our last meeting. The late Mr. Gale had been associated with the House of Representatives from its first meeting. He was appointed Second Clerk Assistant on the 1st May, 1901, and in July of that year was promoted Clerk Assistant. He occupied that position until the 1st February, 1917 when he became Clerk of the House. He rendered distinguished service in every position that he occupied, and his loss will be keenly felt by the Parliament.","N/A","DEATH OF THE CLERK","/hansard/chamber.xscript/debate[5]/speech[1]/talk.start/para","N/A","N/A"
8,0,0,0,1,0,0,0,1,"BRUCE, Stanley","F4B","Flinders","NAT","Prime Minister and Minister for External Affairs",23,".- I move-That this House records its sincere regret at the death of Walter Augustus Gale, C.M.G., who was an officer of the House of Representatives since the inauguration of the Commonwealth, and Clerk of the House from the 1st February, 1917, until his death; and this House expresses its appreciation of the loyalty and ability with which he devoted himself to his official duties, and tenders its profound sympathy to his wife and family in their great bereavement.The news of the sudden death of Mr. Gale must have come as a shock to every member of this Parliament. He had become a familiar figure to us all, and,I feel sure, was generally regarded as a guide, philosopher and friend, who never failed, when asked, to assist in the unravelling of intricate questions of parliamentary procedure. To new members, particularly, the assistance which Mr. Gale was always ready to give was extremely valuable. There are few men who have occupied a seat in this House who have not owed to him a deep debt of gratitude in this regard. It is with profound sorrow that, at our meeting to-day, we miss his once familiar figure from its customary place. It was a great gratification to him that he was able to take his place at the table at the inaugural meeting of the Parliament at Canberra in May last, his ambition to be in the service of the Parliament at the time of its removal to the permanent capital of the Commonwealth being very strong. The motion will commend itself to every honorable member. We shall keep very dear the memory of Mr. Gale. We held him in great admiration as a parliamentary official, and also as a public servant of the best type. I feel sure that honorable members, would wish to tender their deepest sympathy to Mrs. Gale and to the family of the deceased officer.","N/A","DEATH OF THE CLERK","/hansard/chamber.xscript/debate[5]/speech[2]/talk.start/para","N/A","N/A"
9,0,0,0,1,0,0,0,1,"CHARLTON, Matthew","JXA","Hunter","N/A","N/A",23,".-. In seconding the motion, I associate myself with the remarks which have been made by you, Mr. Speaker, and the right honorable the Prime Minister. Mr. Gale was a trusted officer of this House, and always rendered excellent service. He was held in the highest esteem by every honorable member. He had the goodwill not only of honorable members, but also of every official of the Parliament. As the Prime Minister has said, the loss of such a valuable public servant is a severe one. I, in common with the majority of honorable members, was indebted to him on many occasions for the advice that he was able to give me out of his extensive store of constitutional knowledge and parliamentary procedure. I join in the expression of regret at his sudden death, and trust that it will be of some consolation to his widow and family to learn of the high esteem in which he was held by those who were brought into contact with him.","N/A","DEATH OF THE CLERK","/hansard/chamber.xscript/debate[5]/speech[3]/talk.start/para","N/A","N/A"
10,0,0,0,1,0,0,0,1,"RODGERS, Arthur","KZT","Wannon","LP; NAT from 1917","N/A",23,".- I had the privilege of an intimate acquaintance with the late Mr. Gale, and know something of the lofty ideals which made him a magnetic personality, both in this House and outside, among a wide circle of friends. I have met his widow and family since his death, and I can assure honorable members that it is of great comfort to them to have received from honorable members thoughtful messages of sympathy and to know that he was so universally esteemed. It was fitting that, having served the Parliament since its inception, his remains should find a resting place in the little graveyard opposite this House, where his memory will long be kept green.","N/A","DEATH OF THE CLERK","/hansard/chamber.xscript/debate[5]/speech[4]/talk.start/para","N/A","N/A"
11,0,0,0,1,0,0,0,1,"WATKINS, David","KX9","Newcastle","N/A","N/A",23,".- As one who was acquainted with our late friend for perhaps a longer period than any other honorable member, and more closely associated with him than most, I desire to add my expression of sympathy to those that have already been given. From the inception of Federation, Mr. Gale was not only an officer of this House, but also a friend of every honorable member who entered it. He regarded every member as his charge. His knowledge of parliamentary procedure was profound. It will be difficult indeed to fill his .place. He was an outstanding figure in the chamber, and a guide and a friend to his fellow officers. In every way it can truly be said that he was one of Natures gentlemen.Mr. HUGHES (North Sydney) (3.19]. - I would add my tribute to the memory of Mr. Gale, and associate myself with what has been said by the Right Honorable the Prime Minister, the Leader of the Opposition, and the honorable members for Wannon and Newcastle. I knew Mr. Gale very well. As the honorable member for Newcastle has said, Mr. Gale was associated with this Parliament from its inception, and was the guide, philosopher, and friend of all who entered it. For many years I was his fellow clubman, and proud to call him my friend. He devoted his life and great talents to the service of his country, and was happy in the manner of his death, for he passed away among the surroundings in which he had spent his active life. The Commonwealth lias lost a loyal and zealous servant, and we a good friend and wise counsellor; one from whom every member could seek advice with the absolute assurance that this would be given without party bias. His knowledge was wide and thorough. None questioned his authority on parliamentary procedure or his sincerity. And now he, who was for over a quarter of a century a figure so familiar to us all that he seemed an integral part of the National Parliament, has. gone, and we are left to carry on as best we may without his aid. His memory, however, will live. I join in extending to his widow and family heartfelt sympathy, and I feel sure that the words that have fallen from the lips of honorable members to-day will be treasured by those whom he has left behind.","N/A","DEATH OF THE CLERK","/hansard/chamber.xscript/debate[5]/speech[5]/talk.start/para","N/A","N/A"
12,0,0,0,1,0,0,0,1,"JOHNSON, Elliot","K99","Lang","N/A","N/A",24,". - For some years, and in a period of considerable turbulence, I occupied the position of Speaker of this House, so I have a particular reason for taking this opportunity to express my deep appreciation of the wonderful assistance and counsel that I received from Mr. Gale, often in difficult circumstances and in trying situations. It has been truly said of him that not only was he an efficient officer, but also the guide, counsellor, and friend of every occupant of the Speakers chair, and of every individual member of the House. Whenever an honorable member approached Mr. Gale for advice in connexion with the procedure of the House his assistance was most cheerfully given. I know of no man who had a more kindly disposition, a more tender heart, or greater solicitude for the welfare of honorable members and the staff of the House. I deeply regret his loss to this Parliament, and also to the country, of which he was so valued a citizen.","N/A","DEATH OF THE CLERK","/hansard/chamber.xscript/debate[5]/speech[6]/talk.start/para","N/A","N/A"
13,0,0,0,1,0,0,0,1,"SPEAKER, Mr",10000,"N/A","N/A","N/A",24,"- Before putting the question to the House, may I be permitted to say how deeply I feel the loss that this House has sustained through the passing away of our late Clerk. Mr. Gale met the obligations of his office with marked ability and courtesy, and a high sense of duty. He had a thorough knowledge of the law and customs of Parliament, and he most readily placed that knowledge at the command of honorable members and his fellow officers. The smoothness of the proceedings of the House was often due to his advice. He had the highest respect for the dignity of Parliament, and was jealous of its high traditions. Personally he was of the kindest disposition. He was thoughtful of others and most considerate in his relation with his fellow officers. He was particularly loyal in his friendships. It has been said  There is nothing that can be taken in exchange for a faithful friend - and his excellency is beyond price. Mr. Gale has left behind him a record of service which will be an inspiration to his successors. May it be a true consolation to his widow and family to know how highly his services to the Commonwealth are appreciated.Question resolved in the affirmative, honorable members standing in their places.","N/A","DEATH OF THE CLERK","/hansard/chamber.xscript/debate[5]/speech[6]/continue/talk.start/para","N/A","N/A"
14,0,0,0,1,0,0,0,1,"SPEAKER, Mr",10000,"N/A","N/A","N/A",24,"- In many respects this chamber differs from the chamber which honorable members formerly occupied inMelbourne. This is so especially in regard to entrance doors and passage ways, which are more numerous than we have been accustomed to. In order to avoid confusion, I propose, with the concurrence of honorable members, to adopt the following practice in the taking of divisions : - When the bells are rung, the corner doors will be closed, tout the other doors will be left open. This means that honorable members will be able to enter the chamber not only by the main door from Kings Hall, but also by the doors immediately behind me, and those leading from their party rooms. The rule when the House is in division will be that the tellers will record the names of only those honorable members who are within the line of the back row of seats. For division purposes the passage ways round the chamber will be regarded as being outside its limits. I feel sure that these arrangements will commend themselves to honorable members, and I ask their assistance in giving effect to them.","N/A","PROCEDURE FOR TAKING DIVISIONS","/hansard/chamber.xscript/debate[6]/speech/talk.start/para","N/A","N/A"
15,0,0,0,1,0,0,0,1,"SPEAKER, Mr",10000,"N/A","N/A","N/A",25,"- I have to announce that Mr. Frank Clapin, Clerk Assistant, retired from the service of the House on the 30th June last. Consequent upon his retirement, and upon the death of Mr. Gale, the following officers in attendance in the chamber have been promoted: - Mr. McGregor to be Clerk of the House; Mr. Parkes, Clerk Assistant, Mr. Green, Second Clerk Assistant, and Mr. Tregear, Sergeant-at-Arms.","N/A","PROMOTION OF OFFICERS","/hansard/chamber.xscript/debate[7]/speech/talk.start/para","N/A","N/A"
16,1,0,0,0,0,0,0,1,"PERKINS, John","KXY","N/A","N/A","N/A",25,"- Will the Prime Minister inform me whether there is any truth in- the rumour that has been circulated that the proposed local option poll will be taken in the Federal Capital Territory in November? If the rumour is untrue, will the Prime Minister inform me whether it has been decided when the poll will be taken, and the conditions that will govern it?","FEDERAL CAPITAL TERRITORY","QUESTIONS","/hansard/chamber.xscript/debate[8]/subdebate.1[1]/question[1]/talk.start/para","N/A","N/A"
17,0,0,0,1,0,0,0,1,"BRUCE, Stanley","F4B","N/A","NAT","N/A",25,"- There is jio foundation for the rumour that the poll will be taken in November. The position is that this House decided that the poll should be taken at such time, and subject to such conditions, as Parliament itself might determine when the transfer to the Federal Capital had been effected.","FEDERAL CAPITAL TERRITORY","QUESTIONS","/hansard/chamber.xscript/debate[8]/subdebate.1[1]/answer[1]/talk.start/para","N/A","N/A"
18,1,0,0,0,0,0,0,1,"BLAKELEY, Arthur","JPV","N/A","N/A","N/A",25,"- Can the Prime Minister inform the House when we are likely to have before us a bill to provide for a poll of the residents of Canberra on the question of a liquor licence?","FEDERAL CAPITAL TERRITORY","QUESTIONS","/hansard/chamber.xscript/debate[8]/subdebate.1[1]/question[2]/talk.start/para","N/A","N/A"
19,0,0,0,1,0,0,0,1,"BRUCE, Stanley","F4B","N/A","N/A","N/A",25,"- I cannot give that information at this stage. It is really a matter for the House to determine when action will be taken.","FEDERAL CAPITAL TERRITORY","QUESTIONS","/hansard/chamber.xscript/debate[8]/subdebate.1[1]/answer[2]/talk.start/para","N/A","N/A"
20,1,0,0,0,0,0,0,1,"MAKIN, Norman","KLL","N/A","N/A","N/A",25,"- Will the Prime Minister have laid upon the table of the House the records and minutes of the conference recently held between the Administrator and the various religious missions in the Mandated Territory?","MANDATED TERRITORY,","QUESTIONS","/hansard/chamber.xscript/debate[8]/subdebate.1[2]/question/talk.start/para","N/A","N/A"
21,0,0,0,1,0,0,0,1,"BRUCE, Stanley","F4B","N/A","NAT","N/A",25,"- I shall look into the matter, and see whether it is possible to make the papers available.","MANDATED TERRITORY,","QUESTIONS","/hansard/chamber.xscript/debate[8]/subdebate.1[2]/answer/talk.start/para","N/A","N/A"
22,1,0,0,0,0,0,0,1,"BOWDEN, Eric","JRH","N/A","N/A","N/A",25,"-Can the Attorney-General give the House any idea when the Bankruptcy Act will be brought into force ?","BANKRUPTCY ACT","QUESTIONS","/hansard/chamber.xscript/debate[8]/subdebate.1[3]/question/talk.start/para","N/A","N/A"
23,0,0,0,1,0,0,0,1,"LATHAM, John","KZO","N/A","NAT","N/A",25,"- It is very probable that the Bankruptcy Act will be brought into force at the beginning of next year. It would be highly inconvenient to endeavour to bring it into operation in the course of- a judicial year, but arrangements are now being made with the States for accommodation and staff, and for the service of judges, and those arrangements have reached an advanced stage. I hope, therefore, that the act will be in operation at the commencement of the next judicial year.","BANKRUPTCY ACT","QUESTIONS","/hansard/chamber.xscript/debate[8]/subdebate.1[3]/answer/talk.start/para","N/A","N/A"
24,1,0,0,0,0,0,0,1,"FRANCIS, Grosvenor","JWQ","N/A","NAT","N/A",25,"- Can the Attorney-General give the House any information respecting the Abrahams case?","ABRAHAMS CASE","QUESTIONS","/hansard/chamber.xscript/debate[8]/subdebate.1[4]/question/talk.start/para","N/A","N/A"
25,0,0,0,1,0,0,0,1,"LATHAM, John","KZO","N/A","NAT","N/A",25,"- In consequence of the information obtained by the execution of search warrants, prosecutions have been instituted in the HighCourt for penalties under the Income Tax Assessment Act against the principal taxpayers involved in the matter, and they are to plead guilty to the charges made. Proceedings will also be instituted against other persons concerned, who are also to plead guilty. Bonds of a present market value of £200,000 have been handed to the Crown Solicitor in part payment of income tax liabilities, and security has been given for the payment of a further sum of £300,000; also within fourteen days £10,000 is to be paid to the Crown Solicitor on account of costs.","ABRAHAMS CASE","QUESTIONS","/hansard/chamber.xscript/debate[8]/subdebate.1[4]/answer/talk.start/para","N/A","N/A"
26,1,0,0,0,0,0,0,1,"COLEMAN, Percy","JZK","N/A","N/A","N/A",26,"- Some time ago representations were made by various returned soldiers organizations with a view to having motor-car transport provided for spinal and limbless cases. The Minister for Defence promised to give an early decision in the matter, and I desire to know whether any decision has yet been reached ?","SPINAL AND LIMBLESS SOLDIERS","QUESTIONS","/hansard/chamber.xscript/debate[8]/subdebate.1[5]/question/talk.start/para","N/A","N/A"
27,0,0,0,1,0,0,0,1,"BRUCE, Stanley","F4B","N/A","NAT","N/A",26,"- The decision of the Government will be announced almost immediately.","SPINAL AND LIMBLESS SOLDIERS","QUESTIONS","/hansard/chamber.xscript/debate[8]/subdebate.1[5]/answer/talk.start/para","N/A","N/A"
28,1,0,0,0,0,0,0,1,"PROWSE, John","KYI","N/A","N/A","N/A",26,"- In view of the great scarcity of fodder because of drought in several States of the Commonwealth, and the consequent loss of live stock, will the Government take steps to arrange for additional transport and cheaper freights between the States in order to avoid or mitigate loss of live stock.","TRANSPORT OF DROUGHTSTRICKEN STOCK","QUESTIONS","/hansard/chamber.xscript/debate[8]/subdebate.1[6]/question/talk.start/para","N/A","N/A"
29,0,0,0,1,0,0,0,1,"BRUCE, Stanley","F4B","N/A","NAT","N/A",26,"- I shall look into that suggestion. It is not quite clear to me what steps, if any, the Commonwealth could take in regard to State-owned railways.","TRANSPORT OF DROUGHTSTRICKEN STOCK","QUESTIONS","/hansard/chamber.xscript/debate[8]/subdebate.1[6]/answer/talk.start/para","N/A","N/A"
30,1,0,0,0,0,0,0,1,"WATKINS, David","KX9","N/A","N/A","N/A",26,"- Has the Postmaster-General noticed a report to the effect that on one day last week over 100 applicants for calls on the trunk line between Sydney and Newcastle could not be attended to? I should like to know what progress has been made with the long standing promise to underground the wires in order to give a better service?","SYDNEY-NEWCASTLE TELEPHONE LINE","QUESTIONS","/hansard/chamber.xscript/debate[8]/subdebate.1[7]/question/talk.start/para","N/A","N/A"
31,0,0,0,1,0,0,0,1,"GIBSON, William","KAY","N/A","CP","N/A",26,"- I shall have enquiries made, and let the honorable member know the exact position. In regard to undergrounding the line to Newcastle, I might state that we are putting in several circuits on the carrier wave system, which we hope will obviate much of the congestion that now takes place on that section.","SYDNEY-NEWCASTLE TELEPHONE LINE","QUESTIONS","/hansard/chamber.xscript/debate[8]/subdebate.1[7]/answer/talk.start/para","N/A","N/A"
32,1,0,0,0,0,0,0,1,"GREGORY, Henry","KFE","N/A","N/A","N/A",26,"- A rumour has been current for some time that the amount awarded in the Kidman-Mayoh case has not been paid. What is the actual position ?","KIDMANMAYOH SHIP BUILDING CONTRACT","QUESTIONS","/hansard/chamber.xscript/debate[8]/subdebate.1[8]/question/talk.start/para","N/A","N/A"
33,0,0,0,1,0,0,0,1,"LATHAM, John","KZO","N/A","NAT","N/A",26,"- I am informed by my officers that the full amount has been paid.","KIDMANMAYOH SHIP BUILDING CONTRACT","QUESTIONS","/hansard/chamber.xscript/debate[8]/subdebate.1[8]/answer/talk.start/para","N/A","N/A"
34,1,0,0,0,0,0,0,1,"LACEY, Andrew","KZ6","N/A","N/A","N/A",26,"- Will the Minister for Works and Railways inform the House whether the bill to make provision for the construction of a railway from Red Hill to Port Augusta will be introduced during the session, and will he expedite the matter in view of the large number of unemployed in South Australia at present ?","RED HILL TO PORT AUGUSTA RAILWAY","QUESTIONS","/hansard/chamber.xscript/debate[8]/subdebate.1[9]/question/talk.start/para","N/A","N/A"
35,0,0,0,1,0,0,0,1,"HILL, William","KHG","N/A","CP","N/A",26,"- In respect of the first part of the question my answer is in the affirmative. I did not hear the latter part of the question.","RED HILL TO PORT AUGUSTA RAILWAY","QUESTIONS","/hansard/chamber.xscript/debate[8]/subdebate.1[9]/answer/talk.start/para","N/A","N/A"
36,1,0,0,0,0,0,0,1,"GREEN, Roland","KFA","N/A","CP","N/A",26,"- Has the Minister yet received the report of the Tariff Board concerning the application for an increased duty on imported butter? If so, when will it be available for honorable members ?","DUTY ON IMPORTED BUTTER","QUESTIONS","/hansard/chamber.xscript/debate[8]/subdebate.1[10]/question/talk.start/para","N/A","N/A"
37,0,0,0,1,0,0,0,1,"SPEAKER, Mr",10000,"N/A","N/A","N/A",26,"- I understand that a similar question is on the notice-paper.","DUTY ON IMPORTED BUTTER","QUESTIONS","/hansard/chamber.xscript/debate[8]/subdebate.1[10]/answer/talk.start/para","N/A","N/A"
38,1,0,0,0,0,0,0,1,"NELSON, Harold","JVT","N/A","N/A","N/A",26,"- Has the North Australia Commission yet submitted any schemes for the development of the territory under its control? If so, will the Minister indicate the nature of the suggestions ?","NORTH AUSTRALIA COMMISSION","QUESTIONS","/hansard/chamber.xscript/debate[8]/subdebate.1[11]/question/talk.start/para","N/A","N/A"
39,0,0,0,1,0,0,0,1,"MARR, Charles","KMW","N/A","NAT","N/A",27,"- The commission has not yet reported concerning the development of the territory under its control. As soon as its report has been received it will be submitted for the consideration of the Government.","NORTH AUSTRALIA COMMISSION","QUESTIONS","/hansard/chamber.xscript/debate[8]/subdebate.1[11]/answer/talk.start/para","N/A","N/A"
40,1,0,0,0,0,0,0,1,"MAKIN, Norman","KLL","N/A","N/A","N/A",27,"- Has the Pacific Islands mail contract yet been concluded ; if so, will the Postmaster-General lay upon the table of the House all the papers in connexion with it?","PACIFIC ISLANDS MAIL CONTRACT","QUESTIONS","/hansard/chamber.xscript/debate[8]/subdebate.1[12]/question/talk.start/para","N/A","N/A"
41,0,0,0,1,0,0,0,1,"GIBSON, William","KAY","N/A","CP","N/A",27,"- The question should have been addressed to the Minister for Home and Territories, but I shall have the matter investigated. I am quite certain that the honorable member will receive the information required.","PACIFIC ISLANDS MAIL CONTRACT","QUESTIONS","/hansard/chamber.xscript/debate[8]/subdebate.1[12]/answer/talk.start/para","N/A","N/A"
