index,question_flag,answer_flag,interjection_flag,speech_flag,petition_flag,quote_flag,motionnospeech_flag,chamber_flag,name,name.id,electorate,party,role,page.no,content,subdebateinfo,debateinfo,path,Speaker,Time
82,0,0,0,1,0,0,0,1,"BRUCE, Stanley","F4B","N/A","NAT","N/A",31,"- The answers are as follow : -The report is now being printed, and copies will be available to honorable members at an early date.Consideration of the report was included on the agenda of the Eighth Assembly of the League, which is still in session.Mr. W. Warren Kerr, C.M.G., C.B.E. and Mr. A. F. Bell, C.M.G., accompanied Sir David Gordon to Geneva as Commonwealth representatives at the conference. Australia was entitled to a maximum of five members, participating in a personal capacity.(a) No; (b) No; (c) The Consul-General for Germany in Australian has asked whether the Commonwealth Government contemplates taking steps with regard to the recommendations of the conference.The Belgian and German Governments have, through their consular representatives, notified respectively their approval of an agreement with the resolutions of the conference.The Council of the League at its 45th session, held in June, 1927, considered the recommendations, and passed a resolution commending the report and recommendations to the favorable consideration of all governments.","INTERNATIONAL ECONOMIC CONFERENCE","QUESTIONS","/hansard/chamber.xscript/debate[8]/subdebate.1[29]/answer[1]/talk.start/para","N/A","N/A"
83,1,0,0,0,0,0,0,1,"GREGORY, Henry","KFE","N/A","N/A","N/A",31,"asked the Prime Minister, upon notice -Will he make available as early as possible the report of the Economic Conference of the League of Nations at Geneva?","INTERNATIONAL ECONOMIC CONFERENCE","QUESTIONS","/hansard/chamber.xscript/debate[8]/subdebate.1[29]/question[2]/talk.start/para","N/A","N/A"
84,0,0,0,1,0,0,0,1,"BRUCE, Stanley","F4B","N/A","N/A","N/A",31,"- The report is now being printed, and copies will be available to honorable members at an early date.","INTERNATIONAL ECONOMIC CONFERENCE","QUESTIONS","/hansard/chamber.xscript/debate[8]/subdebate.1[29]/answer[2]/talk.start/para","N/A","N/A"
85,1,0,0,0,0,0,0,1,"CHARLTON, Matthew","JXA","N/A","N/A","N/A",32,"asked the Minister representing the Minister for Defence -Whether he will make available the report of the Air Accidents Investigation Committee, so that stops may be taken to avoid, as far as possible, the loss of life in the future?","AIR ACCIDENTS INVESTIGATION COMMITTEE","QUESTIONS","/hansard/chamber.xscript/debate[8]/subdebate.1[30]/question/talk.start/para","N/A","N/A"
86,0,0,0,1,0,0,0,1,"BRUCE, Stanley","F4B","N/A","NAT","N/A",32,"- The Minister, after reviewing the reports, will make them available for publication, except where it is considered undesirable in the public interest to do so.","AIR ACCIDENTS INVESTIGATION COMMITTEE","QUESTIONS","/hansard/chamber.xscript/debate[8]/subdebate.1[30]/answer/talk.start/para","N/A","N/A"
87,1,0,0,0,0,0,0,1,"MANN, Edward","KMQ","N/A","N/A","N/A",32,"asked the Prime Minister, upon notice -With reference to the World Population Conference opened at Geneva on 31st August, 1927-What was the object of the conference?By whom was the conference convened, and what led to it?Was Australia represented; if so, by whom ?","WORLD POPULATION CONFERENCE","QUESTIONS","/hansard/chamber.xscript/debate[8]/subdebate.1[31]/question/talk.start/para","N/A","N/A"
88,0,0,0,1,0,0,0,1,"BRUCE, Stanley","F4B","N/A","NAT","N/A",32,"- The answers to the honorable members questions are as follow : -The conference was convened to discuss generally all matters relating to the worlds population.The conference was convened by Sir Bernard Mallett, late Registrar-General of England, after an informal discussion with the authorities in other countries interested in the subject.Australia was not represented at the conference, but papers were contributed by Australian writers.","WORLD POPULATION CONFERENCE","QUESTIONS","/hansard/chamber.xscript/debate[8]/subdebate.1[31]/answer/talk.start/para","N/A","N/A"
89,1,0,0,0,0,0,0,1,"CHARLTON, Matthew","JXA","N/A","N/A","N/A",32,"asked the Postmaster-General, upon notice -Whether, in view of his statements on the 11th March, 1926 (Hansard, page 1529); the 20th March, 1926 (Hansard, page 2002); 8th July, 1926 (Hansard, page 3930); and 2nd March last (Hansard, page 31), that the scale of payments to allowance postmasters was then under review, he is now in a position, after nearly eighteen months consideration, to give particulars of the revised scale?","ALLOWANCE TO POSTMASTERS","QUESTIONS","/hansard/chamber.xscript/debate[8]/subdebate.1[32]/question/talk.start/para","N/A","N/A"
90,0,0,0,1,0,0,0,1,"GIBSON, William","KAY","N/A","CP","N/A",32,"- The review of the scale of payment to allowance postmasters has been completed, and approval has been given to the introduction of a new basis which will take effect as from 1st January, 1927, and will result in the total payment for the conduct of non-official offices being increased by approximately, £70,000 per annum.","ALLOWANCE TO POSTMASTERS","QUESTIONS","/hansard/chamber.xscript/debate[8]/subdebate.1[32]/answer/talk.start/para","N/A","N/A"
91,1,0,0,0,0,0,0,1,"JOHNSON, Elliot","K99","N/A","N/A","N/A",32,"asked the Treasurer, upon notice - 1.Will he establish a system in connexion with the Commonwealth Savings Bank for assisting depositors to acquire ownership of their own homes, and thus bring the bank into line with similar Government institutions in the various States, as well as all the principal Savings Banks abroad?Will he consider the advisability of attracting a larger number of Savings Bank depositors to the Commonwealth Bank by fixing the rate of interest on the same basis as that of the State Savings Bank in New South Wales ?- The answer to the honorable members question is as follows : -The policy of the Government in regard to housing will be announced in the House in the near future.","COMMONWEALTH SAVINGS BANK","QUESTIONS","/hansard/chamber.xscript/debate[8]/subdebate.1[33]/question/talk.start/para","N/A","N/A"
92,1,0,0,0,0,0,0,1,"GREGORY, Henry","KFE","N/A","N/A","N/A",32,"asked the Minister for Trade and Customs, upon notice -Will he lay on the table of the Library all papers relating to the proposed importation of di-ammon Phos., its first and later classification, also reports and analysis by the Customs analysts as to its value as a fertilizer?","DI-AMMON PHOS","QUESTIONS","/hansard/chamber.xscript/debate[8]/subdebate.1[34]/question/talk.start/para","N/A","N/A"
93,0,0,0,1,0,0,0,1,"PRATTEN, Herbert","K1J","N/A","NAT","N/A",32,"- The papers will be laid on the table of the Library.","DI-AMMON PHOS","QUESTIONS","/hansard/chamber.xscript/debate[8]/subdebate.1[34]/answer/talk.start/para","N/A","N/A"
94,1,0,0,0,0,0,0,1,"MAKIN, Norman","KLL","N/A","N/A","N/A",32,"asked the Prime Minister, upon notice -How many messages have been diverted from beam to the Cable Company Telegraph System since the inauguration of the beam service to England owing to fading and other failure of beam?What is the total amount paid to the cable companies for diverted beam messages?Who has been debited with the difference in charges between beam and cable messages which have been diverted because of the failure of the beam service through fading or other causes ?","BEAM WIRELESS","QUESTIONS","/hansard/chamber.xscript/debate[8]/subdebate.1[35]/question/talk.start/para","N/A","N/A"
95,0,0,0,1,0,0,0,1,"BRUCE, Stanley","F4B","N/A","NAT","N/A",32,"- The replies to the honorable members questions are as follow : -The proportion of traffic diverted from the beam service to the Cable Company Telegraph System owing to all causes is less than 2 per cent. of the total outward traffic. For some weeks past no diversions have been necessary.£3,293.The difference in charges is borne by the Amalgamated Wireless Company.","BEAM WIRELESS","QUESTIONS","/hansard/chamber.xscript/debate[8]/subdebate.1[35]/answer/talk.start/para","N/A","N/A"
96,1,0,0,0,0,0,0,1,"GREGORY, Henry","KFE","N/A","N/A","N/A",33,"asked the Prime Minister, upon notice -Has the balance-sheet of the Commonwealth Oil Refinery for the year 1926-27 been presented to the Government?When does the Prime Minister propose to lay it on the table of the House?","COMMONWEALTH OIL REFINERY","QUESTIONS","/hansard/chamber.xscript/debate[8]/subdebate.1[36]/question/talk.start/para","N/A","N/A"
97,0,0,0,1,0,0,0,1,"BRUCE, Stanley","F4B","N/A","NAT","N/A",33,"- The replies to the honorable members questions are as follow : -It is expected that the balance-sheet will be available in about a fortnight.As soon as it is received.","COMMONWEALTH OIL REFINERY","QUESTIONS","/hansard/chamber.xscript/debate[8]/subdebate.1[36]/answer/talk.start/para","N/A","N/A"
98,1,0,0,0,0,0,0,1,"CHARLTON, Matthew","JXA","N/A","N/A","N/A",33,"asked the Minister for Home and Territories, upon notice -In connexion with officers whose homes at Melbourne were purchased by the Government, will he give favorable consideration to the question of paying interest on the money paid until such officers have been aide to select suitable homes at reasonable prices, provided it is done within twelve months. If not, will the Minister have interest paid on the money up to the time the Commission is able to quote a price for the house at present occupied?Will the rent paid be allowed if officers eventually decide to purchase houses in Canberra?What is the reason for the Federal Capital Commission requiring rent a fortnight in advance when salaries are not paid in advance? Will he have this practice discontinued?When is it proposed to considerably improve the present transport service in Canberra?Will he have expedited the naming of the streets in the Federal Territory so that residents may be able to give some indication where they live?Will he state what is the amount of general rating to be imposed on lessees of property in the Federal Territory?","CANBERRA","QUESTIONS","/hansard/chamber.xscript/debate[8]/subdebate.1[37]/question[1]/talk.start/para","N/A","N/A"
99,0,0,0,1,0,0,0,1,"MARR, Charles","KMW","N/A","NAT","N/A",33,"- The answers to the honorable members questions are as follow : -Officers whose Melbourne homes have been purchased by the Commonwealth and who have undertaken to build or purchase and to reside in a home at Canberra within twelve months after the date of their arrival in Canberra will be paid interest on the money standing to their credit in the Canberra Building Account until the date upon which their Canberra homes are ready for occupation by them, or until the date of the expiration of the period within which they have undertaken to build or purchase and to reside in homes in Canberra, whichever date shall first occur. If, however, on the expiration of the period within which they have undertaken to build or purchase and to reside in homes in Canberra they have not fully complied with their undertakings, the amount of interest already credited will be deducted from the amount standing to their credit in the Canberra Building Account.A public servant renting a Commission house is allowed a six-months option to purchase, and, in the event of his deciding to exercise the option within that time, the purchase is regarded as having taken effect from the date of occupation, subject to an adjustment of the financial basis to ensure that no loss to the Commission is occasioned by the change in the nature of the tenure.The practice of payment of rent for residences in advance has prevailed in Canberra for a number of years prior to the advent of the Commission, and no request for its modification has been received by the Commission. Moreover, the conditions of all Federal Capital leases provide for rental to be paid in advance.The Commission recently invited public offers for the conduct of a satisfactory bus and hire-car service, but no acceptable offers have been received. The Commission is, therefore, arranging to extend its own existing service to meet the new requirements which have arisen, and the matter is receiving urgent attention.The Commission has been engaged on the preparation of a scheme for allotting suitable names for the streets throughout the City of Canberra. The matter is being submitted to a special historic nomenclature committee, and it is hoped to make an announcement on the question very shortly.The scale of general rating to be imposed on leases of property in the Federal Territory is laid down in the Rates Ordinance1926, which provides for a maximum rate of5d. in the £1 for land in the city area, and 3d. in the £1 on lands outside the city area, based on the unimproved capital value of the land. These rates are levied in respect of each calendar year. For the year 1926 the rates levied were -N/ARates for the current year have not yet been struck by the Commission.","CANBERRA","QUESTIONS","/hansard/chamber.xscript/debate[8]/subdebate.1[37]/answer[1]/talk.start/para","N/A","N/A"
100,1,0,0,0,0,0,0,1,"RILEY, Edward","KYV","N/A","ALP","N/A",33,"asked the Minister for Home and Territories, upon notice -Regarding money held for public servants who sold their houses to the Government prior to being transferred to Canberra, will be state -Is the public servant entitled to purchase a home from a private contractor if he so desires?If so, will an advance of the money due to him be made from time to time as required ?Will the whole of the money be handed to the public servant if at the expiration of twelve months he lias failed to purchase a house in the Federal Territory. If not, what will be done with the money?","CANBERRA","QUESTIONS","/hansard/chamber.xscript/debate[8]/subdebate.1[37]/question[2]/talk.start/para","N/A","N/A"
101,0,0,0,1,0,0,0,1,"MARR, Charles","KMW","N/A","N/A","N/A",34,"- The answers to the honorable members questions are as follow : -Yes.Yes.If, on the expiration of the period of twelve months within which the officer has undertaken to build or purchase and to reside in a house at Canberra, he has not fully complied with his undertaking, the amount standing to his credit in the Canberra Building Account will be reduced by a sum equal to tl.e full amount of interest paid thereon and the balance remaining will be paid to the officer upon a claim being made therefor.","CANBERRA","QUESTIONS","/hansard/chamber.xscript/debate[8]/subdebate.1[37]/answer[2]/talk.start/para","N/A","N/A"
102,1,0,0,0,0,0,0,1,"GREGORY, Henry","KFE","N/A","N/A","N/A",34,"asked the Minister representing the Minister for Defence, upon notice -What has been the average cost of rifles (complete) supplied by the Small Arms Factory at Lithgow during the rears 1922-23, 1923-24, 1924-25, .1.925-20, and 1926-27?","SMALL ARMS FACTORY, LITHGOW","QUESTIONS","/hansard/chamber.xscript/debate[8]/subdebate.1[38]/question/talk.start/para","N/A","N/A"
103,0,0,0,1,0,0,0,1,"LATHAM, John","KZO","N/A","NAT","N/A",34,"- Since 1922 the Small Arms Factory has been reduced to a nucleus basis, financed out of the ordinary votes of the department, and the small number of rifles produced has been issued free of charge to the Military Forces. The cost for labour and material per rifle produced, complete with appurtenances, was - .N/AIt should be noted that the cost of maintaining the factory on a nucleus basis in peace time in such a way as will enable it to be readily expanded to full output in emergency, must be regarded as a contribution towards national insurance for the protection of the country against possible attack.","SMALL ARMS FACTORY, LITHGOW","QUESTIONS","/hansard/chamber.xscript/debate[8]/subdebate.1[38]/answer/talk.start/para","N/A","N/A"
104,1,0,0,0,0,0,0,1,"PARSONS, Walter","KXR","N/A","N/A","N/A",34,"asked the Minister for Home and Territories, upon notice -Who was responsible for the provision of Californian oranges on the tables .at the hotels at Canberra during the celebrations in connexion with the establishment of the Federal Government at Canberra?As oranges were procurable at Adelaide, Salisbury, Renmark, Wakerie, and other centres, why were oranges not secured from these centres?In view of the great difficulties facing the growers of oranges in Australia owing to high production costs, and the bad impression that must arise when foreign oranges are provided for such functions, will the Minister give instructions that Australian and not foreign oranges are purchased for Government services and functions?","CANBERRA CELEBRATIONS","QUESTIONS","/hansard/chamber.xscript/debate[8]/subdebate.1[39]/question/talk.start/para","N/A","N/A"
105,0,0,0,1,0,0,0,1,"MARR, Charles","KMW","N/A","NAT","N/A",34,"- The answers to the honorable members questions are as follow : -The oranges provided at the hotels at Canberra during the celebrations in connexion with the opening of the Federal Parliament in May, 1927, were obtained by the Federal Capital Commission.The practice has been to obtain oranges from the nearest market, viz., Sydney. Upon receipt of a supply of Californian oranges Ill( matter was brought under the notice of the Commissions agents, who replied that the market was absolutely bare of local oranges. Difficulty was being experienced in procuring suitable fruit, and there was not time after the receipt of the oranges in question to make any other arrangements.It is a general rule of the Commission to give preference to Australian products.","CANBERRA CELEBRATIONS","QUESTIONS","/hansard/chamber.xscript/debate[8]/subdebate.1[39]/answer/talk.start/para","N/A","N/A"
106,1,0,0,0,0,0,0,1,"MACKAY, George","KIT","N/A","N/A","N/A",34,"asked the Minister for Trade and Customs, upon notice -What is the number of boxes of butter imported into the Commonwealth during the eight months ended 31st August, 1927?Whether it is a fact that there has been ample supplies of Australian butter (apart from the imported article) available during the period mentioned?Whether the Tariff Board has completed the inquiry in reference to the application for increased Customs duty on butter; if so, when may honorable members expect the report to be presented to Parliament?","BUTTER IMPORTS","QUESTIONS","/hansard/chamber.xscript/debate[8]/subdebate.1[40]/question/talk.start/para","N/A","N/A"
107,0,0,0,1,0,0,0,1,"PRATTEN, Herbert","K1J","N/A","NAT","N/A",34,"- The answers to the honorable members questions are as follow : -141,408.Ample supplies of Australian butter were produced during the period mentioned, but owing to a large quantity being exported, a shortage occurred during certain portions of the period mentioned, and this shortage was met by importing butter from New Zealand.Yes. The report is very recently to hand and has not yet been considered by the Government; when full consideration has been given, the report will be laid upon the table of the House.","BUTTER IMPORTS","QUESTIONS","/hansard/chamber.xscript/debate[8]/subdebate.1[40]/answer/talk.start/para","N/A","N/A"
108,1,0,0,0,0,0,0,1,"JOHNSON, Elliot","K99","N/A","N/A","N/A",35,"asked the Minister in charge of Repatriation, upon notice -In connexion with complaints made at the recent State Congress of the Returned Soldiers League on behalf of patients at  Graythwaite, who are not receiving pensions, has the Minister received a report from the metropolitan vice-president (Mr. L. A. Robb) on the subject, detailing specific cases for consideration; if so, has he arrived at any decision in the matter?","WAR PENSIONS","QUESTIONS","/hansard/chamber.xscript/debate[8]/subdebate.1[41]/question/talk.start/para","N/A","N/A"
109,0,0,0,1,0,0,0,1,"LATHAM, John","KZO","N/A","NAT","N/A",35,"- The Minister has supplied the following answer to the honorable members question : -Last week I received a letter from the federal secretary of the Returnd Sailors and Soldiers Imperial League of Australia conveying the text of a communication from New South Wales regarding inmates of Grayth waite, and giving specific names; each case is being fully investigated.That the report be printed.","WAR PENSIONS","QUESTIONS","/hansard/chamber.xscript/debate[8]/subdebate.1[41]/answer/talk.start/para","N/A","N/A"
110,0,0,1,0,0,0,0,1,"CHARLTON, Matthew","JXA","N/A","N/A","N/A",35,"- At this stage I have no desire to discuss this very important report which deals with the Australian Commonwealth Shipping Line; but, in view of the rumour in circulation, that the Government intends to dispose of the line, or place its fleet of vessels out of commission, and knowing the great injury that such a course would inflict upon the primary producers of Australia, I should -like an assurance from the right honorable the Prime Minister that neither step will be taken until honorable members have had an opportunity to peruse the report of the Public Accounts Committee, and the matter has been brought before Parliament for consideration.","Commonwealth Government Shipping Activities","PUBLIC ACCOUNTS COMMITTEE","/hansard/chamber.xscript/debate[9]/subdebate.1/interjection[1]/talk.start/para","N/A","N/A"
111,0,0,1,0,0,0,0,1,"BRUCE, Stanley","F4B","N/A","N/A","N/A",35,"- I gladly give the honorable member that assurance. It would bc extremely undesirable to attempt to discuss this matter until honorable members had had an opportunity to read and consider the report of the Public Accounts","Commonwealth Government Shipping Activities","PUBLIC ACCOUNTS COMMITTEE","/hansard/chamber.xscript/debate[9]/subdebate.1/interjection[2]/talk.start/para","N/A","N/A"
112,0,0,0,0,0,0,0,1,"N/A","N/A","N/A","N/A","N/A","N/A","The following papers were presented : -","N/A","PAPERS","/hansard/chamber.xscript/debate[10]/para[1]","N/A","N/A"
113,0,0,0,0,0,1,0,1,"N/A","N/A","N/A","N/A","N/A","N/A","River Murray Waters Act - River Murray Commission - Report for the year 1925-26.","N/A","PAPERS","/hansard/chamber.xscript/debate[10]/quote/para","N/A","N/A"
114,0,0,0,0,0,0,0,1,"N/A","N/A","N/A","N/A","N/A","N/A","Ordered to be printed","N/A","PAPERS","/hansard/chamber.xscript/debate[10]/para[2]","N/A","N/A"
115,0,0,0,0,0,0,0,1,"N/A","N/A","N/A","N/A","N/A","N/A","Commonwealth Bank Act - Commonwealth Bank of Australia - Aggregate Balance-sheet at 30th June, 1927, and Statement of the Liabilities and Assets of the Note Issue Department at 30th June, 1 927 ; together with the Auditor-Generals Reports thereon.","N/A","PAPERS","/hansard/chamber.xscript/debate[10]/para[3]","N/A","N/A"
116,0,0,0,0,0,0,0,1,"N/A","N/A","N/A","N/A","N/A","N/A","Federal Capital Commission - Reports for quarter ended - 31st March, 1927. 30th June, 1927.","N/A","PAPERS","/hansard/chamber.xscript/debate[10]/para[4]","N/A","N/A"
117,0,0,0,0,0,0,0,1,"N/A","N/A","N/A","N/A","N/A","N/A","Air Navigation Act - Regulations - Statutory Rules 1927, No. 47.","N/A","PAPERS","/hansard/chamber.xscript/debate[10]/para[5]","N/A","N/A"
118,0,0,0,0,0,0,0,1,"N/A","N/A","N/A","N/A","N/A","N/A","Arbitration (Public Service) Act - Determinations by the Arbitrator, &c. -","N/A","PAPERS","/hansard/chamber.xscript/debate[10]/para[6]","N/A","N/A"
119,0,0,0,0,0,0,0,1,"N/A","N/A","N/A","N/A","N/A","N/A","No. 17 of 1927 - Commonwealth Public Service Clerical Association.","N/A","PAPERS","/hansard/chamber.xscript/debate[10]/para[7]","N/A","N/A"
120,0,0,0,0,0,0,0,1,"N/A","N/A","N/A","N/A","N/A","N/A","No.18 of 1927 - Commonwealth Public Service Clerical Association.","N/A","PAPERS","/hansard/chamber.xscript/debate[10]/para[8]","N/A","N/A"
121,0,0,0,0,0,0,0,1,"N/A","N/A","N/A","N/A","N/A","N/A","No. 20 of 1927 - Commonwealth Telephone Officers Association.","N/A","PAPERS","/hansard/chamber.xscript/debate[10]/para[9]","N/A","N/A"
122,0,0,0,0,0,0,0,1,"N/A","N/A","N/A","N/A","N/A","N/A","No. 25 of 1927 - Commonwealth Public Service Clerical Association.","N/A","PAPERS","/hansard/chamber.xscript/debate[10]/para[10]","N/A","N/A"
123,0,0,0,0,0,0,0,1,"N/A","N/A","N/A","N/A","N/A","N/A","Audit Act -","N/A","PAPERS","/hansard/chamber.xscript/debate[10]/para[11]","N/A","N/A"
124,0,0,0,0,0,0,0,1,"N/A","N/A","N/A","N/A","N/A","N/A","Regulations Amended - Statutory Rules 1927. Nos. 41, 74.","N/A","PAPERS","/hansard/chamber.xscript/debate[10]/para[12]","N/A","N/A"
125,0,0,0,0,0,0,0,1,"N/A","N/A","N/A","N/A","N/A","N/A","Transfers of amounts approved by the Governor-General in Council - Financial Year 1926-27 - Dated 1st June, 1927.","N/A","PAPERS","/hansard/chamber.xscript/debate[10]/para[13]","N/A","N/A"
126,0,0,0,0,0,0,0,1,"N/A","N/A","N/A","N/A","N/A","N/A","Commonwealth Bank Act - Regulations Amended - Statutory Rules 1927, No. 99.","N/A","PAPERS","/hansard/chamber.xscript/debate[10]/para[14]","N/A","N/A"
127,0,0,0,0,0,0,0,1,"N/A","N/A","N/A","N/A","N/A","N/A","Customs Act -","N/A","PAPERS","/hansard/chamber.xscript/debate[10]/para[15]","N/A","N/A"
128,0,0,0,0,0,0,0,1,"N/A","N/A","N/A","N/A","N/A","N/A","Proclamation prohibiting the exportation (except under certain conditions) of Wine (dated 2nd June, 1927).","N/A","PAPERS","/hansard/chamber.xscript/debate[10]/para[16]","N/A","N/A"
129,0,0,0,0,0,0,0,1,"N/A","N/A","N/A","N/A","N/A","N/A","Regulations Amended - Statutory Rules 1927, No. 95.","N/A","PAPERS","/hansard/chamber.xscript/debate[10]/para[17]","N/A","N/A"
130,0,0,0,0,0,0,0,1,"N/A","N/A","N/A","N/A","N/A","N/A","Defence Act - Regulations Amended - Statutory Rules 1927, Nos. 42, 58, 90, 105, 106.","N/A","PAPERS","/hansard/chamber.xscript/debate[10]/para[18]","N/A","N/A"
131,0,0,0,0,0,0,0,1,"N/A","N/A","N/A","N/A","N/A","N/A","Distillation Act - Regulations Amended - Statutory Rules 1927, No. 91.","N/A","PAPERS","/hansard/chamber.xscript/debate[10]/para[19]","N/A","N/A"
132,0,0,0,0,0,0,0,1,"N/A","N/A","N/A","N/A","N/A","N/A","Export Guarantee Act - Return showing Reports, Recommendations, and Assistance granted up to - 31st March. 1927. 30th June, 1926.","N/A","PAPERS","/hansard/chamber.xscript/debate[10]/para[20]","N/A","N/A"
