index,question_flag,answer_flag,interjection_flag,speech_flag,petition_flag,quote_flag,motionnospeech_flag,chamber_flag,name,name.id,electorate,party,role,page.no,content,subdebateinfo,debateinfo,path,Speaker,Time
42,1,0,0,0,0,0,0,1,"RODGERS, Arthur","KZT","N/A","LP; NAT from 1917","N/A",27,"- On the 22nd March last I secured the adjournment of the House to draw the attention of the Government to the great disparity in value between the supplies of superphosphates in New Zealand and Australia. The Prime Minister, in reply, promised that he would have the whole matter investigated by Mr. Olive Macpherson, who had just been appointed the Australian representative on the Phosphate Commission. I should like to know if the Prime Minister is in possession of a report from Mr. Macpherson; and, if not, will be obtain information as to what the position is to-day?","PRICE OF SUPERPHOSPHATES","QUESTIONS","/hansard/chamber.xscript/debate[8]/subdebate.1[13]/question/talk.start/para","N/A","N/A"
43,0,0,0,1,0,0,0,1,"BRUCE, Stanley","F4B","N/A","NAT","N/A",27,"- I discussed the whole matter with Mr. Macpherson. He has gone into the question, and has since submitted a report, which I shall be pleased to show to the honorable member.","PRICE OF SUPERPHOSPHATES","QUESTIONS","/hansard/chamber.xscript/debate[8]/subdebate.1[13]/answer/talk.start/para","N/A","N/A"
44,1,0,0,0,0,0,0,1,"WATKINS, David","KX9","N/A","N/A","N/A",27,"- Has any officer in Melbourne brought under the notice of the Prime Minister the fact that some 30,000 tons of coal has been dumped on land in my electorate? As the land is required in order to wind up an estate, and the Government has not even paid rent for it for the last twelve months, the matter is urgent.","GOVERNMENT COAL DUMP","QUESTIONS","/hansard/chamber.xscript/debate[8]/subdebate.1[14]/question/talk.start/para","N/A","N/A"
45,0,0,0,1,0,0,0,1,"BRUCE, Stanley","F4B","N/A","NAT","N/A",27,"- I remember discussing that subject with the honorable member for Newcastle (Mr. Watkins), and I shall ascertain the exact position in regard to it.","GOVERNMENT COAL DUMP","QUESTIONS","/hansard/chamber.xscript/debate[8]/subdebate.1[14]/answer/talk.start/para","N/A","N/A"
46,1,0,0,0,0,0,0,1,"GARDNER, Sydney","K9H","N/A","N/A","N/A",27,"- Will the Attorney-General inform me whether the Government contemplates taking action in the direction of amending the Copyright Act with regard to the royalties charged for the public performance of musical works?","COPYRIGHT ACT","QUESTIONS","/hansard/chamber.xscript/debate[8]/subdebate.1[15]/question/talk.start/para","N/A","N/A"
47,0,0,0,1,0,0,0,1,"LATHAM, John","KZO","N/A","NAT","N/A",27,"- Until the Copyright Conference has been held at Rome, which will probably be in the spring of next year, it is most unlikely that proposals will be brought down for the amendment of the act.","COPYRIGHT ACT","QUESTIONS","/hansard/chamber.xscript/debate[8]/subdebate.1[15]/answer/talk.start/para","N/A","N/A"
48,1,0,0,0,0,0,0,1,"WEST, John Edward","KZA","N/A","N/A","N/A",27,"- I have a question to submit to the Prime Minister, arising out of the policy of the Government. Owing to the large increase of population in New South Wales since the Lang Government has been in power in that State-","HOUSING SCHEME","QUESTIONS","/hansard/chamber.xscript/debate[8]/subdebate.1[16]/question/talk.start/para","N/A","N/A"
49,0,0,0,1,0,0,0,1,"SPEAKER, Mr",10000,"N/A","N/A","N/A",27,"- It is not within the province of an honorable member to give information to the House when asking a question.","HOUSING SCHEME","QUESTIONS","/hansard/chamber.xscript/debate[8]/subdebate.1[16]/answer/talk.start/para","N/A","N/A"
50,0,0,0,1,0,0,0,1,"WEST, John Edward","KZA","N/A","N/A","N/A",27,"- Up to the present time, I have been unable to ascertain that anything whatever has been done in the direction of putting the Governments housing scheme into effect. The matter is becoming very serious for the people of New South Wales, who are entitled to know whether the Prime Minister intends to carry out his Governments housing policy, or whether he is simply playing an electioneering card.","HOUSING SCHEME","QUESTIONS","/hansard/chamber.xscript/debate[8]/subdebate.1[16]/answer/continue[1]/talk.start/para","N/A","N/A"
51,0,0,0,1,0,0,0,1,"SPEAKER, Mr",10000,"N/A","N/A","N/A",27,"- I direct the honorable members attention to the fact that a question dealing with that subject appears on to-days notice-paper.","HOUSING SCHEME","QUESTIONS","/hansard/chamber.xscript/debate[8]/subdebate.1[16]/answer/continue[2]/talk.start/para","N/A","N/A"
52,0,0,0,1,0,0,0,1,"NOTT, Lewis","K4Y","Herbert","N/A","N/A",27,"- Has any official decision been arrived at with regard to the establishment of a chain of emergency wireless stations under the control of the Postmaster-Generals Department in the cyclonic belt in North Queensland?","WIRELESS WEATHER STATIONS","QUESTIONS","/hansard/chamber.xscript/debate[8]/subdebate.1[17]/speech/talk.start/para","N/A","N/A"
53,0,0,1,0,0,0,0,1,"GIBSON, William","KAY","N/A","N/A","N/A",27,"- No.","WIRELESS WEATHER STATIONS","QUESTIONS","/hansard/chamber.xscript/debate[8]/subdebate.1[17]/speech/interjection/talk.start/para","N/A","N/A"
54,1,0,0,0,0,0,0,1,"ANSTEY, Frank","JLY","N/A","N/A","N/A",28,"- Does the Treasurer intend to introduce a bill this session for the purpose of reducing the income tax, and, if so, what will be the extent of the reduction ?","INCOME TAX","QUESTIONS","/hansard/chamber.xscript/debate[8]/subdebate.1[18]/question/talk.start/para","N/A","N/A"
55,0,0,0,1,0,0,0,1,"PAGE, Earle","C7E","N/A","CP","N/A",28,"- In the budget speech I shall be able to supply the information desired.","INCOME TAX","QUESTIONS","/hansard/chamber.xscript/debate[8]/subdebate.1[18]/answer/talk.start/para","N/A","N/A"
56,1,0,0,0,0,0,0,1,"THOMPSON, Victor","KVU","N/A","N/A","N/A",28,"- Has the Minister for Trade and Customs received the report of the Tariff Board on the tobacco-growing industry; and, if so, when is it likely to be laid on the table of the House ?","TOBACCO GROWING","QUESTIONS","/hansard/chamber.xscript/debate[8]/subdebate.1[19]/question/talk.start/para","N/A","N/A"
57,0,0,0,1,0,0,0,1,"PRATTEN, Herbert","K1J","N/A","NAT","N/A",28,"- The report has been received, but has not yet been considered by the Government.","TOBACCO GROWING","QUESTIONS","/hansard/chamber.xscript/debate[8]/subdebate.1[19]/answer/talk.start/para","N/A","N/A"
58,1,0,0,0,0,0,0,1,"BRENNAN, Frank","JSC","N/A","N/A","N/A",28,"- Why was the report recently .furnished to the Governor-General by the Wireless Commission not released to the public until many weeks after its receipt by the Government?","WIRELESS COMMISSIONS REPORT","QUESTIONS","/hansard/chamber.xscript/debate[8]/subdebate.1[20]/question/talk.start/para","N/A","N/A"
59,0,0,0,1,0,0,0,1,"BRUCE, Stanley","F4B","N/A","NAT","N/A",28,"- All reports of royal commissions have to be considered by the Government, and the usual practice was followed in the case under notice. It is not the practice to release a report the moment it is received.","WIRELESS COMMISSIONS REPORT","QUESTIONS","/hansard/chamber.xscript/debate[8]/subdebate.1[20]/answer/talk.start/para","N/A","N/A"
60,0,0,0,1,0,0,0,1,"FENTON, James","KEV","N/A","N/A","N/A",28,"- It has been reported that when the Government received the Wireless Commissions recommendations they were forwarded to the Wireless Board with a view to that body reporting hack to the Government. Will the Prime Minister inform the House whether the board has so reported back, and if so, what action will be taken ?","WIRELESS COMMISSIONS REPORT","QUESTIONS","/hansard/chamber.xscript/debate[8]/subdebate.1[20]/answer/continue[1]/talk.start/para","N/A","N/A"
61,0,0,0,1,0,0,0,1,"BRUCE, Stanley","F4B","N/A","N/A","N/A",28,"- At the time the report was released - I forget precisely whether it was on the same day or the day after - copies were supplied to the Government directors on the board of Amalgamated Wireless Limited, who were asked for their views on certain recommendations of the commission which concerned the action of the board. We have not yet received their report, but we have had several interviews with the chairman, Sir George Mason Allard, and one,I think, with Sir George Mason Allard and Sir William Vicars. That matter is still being discussed between the Government and its representatives on the board.","WIRELESS COMMISSIONS REPORT","QUESTIONS","/hansard/chamber.xscript/debate[8]/subdebate.1[20]/answer/continue[2]/talk.start/para","N/A","N/A"
62,1,0,0,0,0,0,0,1,"COOK, Robert","K4M","N/A","N/A","N/A",28,"- What are the Commonwealths liabilities with regard to soldier land settlement as the result of the recent conference with the State Premiers?","SOLDIER LAND SETTLEMENT","QUESTIONS","/hansard/chamber.xscript/debate[8]/subdebate.1[21]/question/talk.start/para","N/A","N/A"
63,0,0,0,1,0,0,0,1,"BRUCE, Stanley","F4B","N/A","NAT","N/A",28,"- The whole subject was discussed with the Premiers of the States at the conference held in Sydney, and the arrangement come to between the Commonwealth and the States was that the position in each of the States should be thoroughly examined with a view to laying down certain definite principles, upon which the Commonwealth would be prepared to help the States in arriving at a satisfactory solution of the problem. We are now proceeding to make that investigation, and it is hoped that a final settlement will result.","SOLDIER LAND SETTLEMENT","QUESTIONS","/hansard/chamber.xscript/debate[8]/subdebate.1[21]/answer/talk.start/para","N/A","N/A"
64,1,0,0,0,0,0,0,1,"COLEMAN, Percy","JZK","N/A","N/A","N/A",28,"- Referring to recent proceedings at the Assembly of the League of Nations, during which the Vice-President of the Executive Council (Sir George Pearce), expressed opinions in opposition to international arbitration, may I ask whether Sir George acted after consultation with the Government, and whether discussions have taken place between the British and Australian Governments regarding international policy.","INTERNATIONAL ARBITRATION","QUESTIONS","/hansard/chamber.xscript/debate[8]/subdebate.1[22]/question/talk.start/para","N/A","N/A"
65,0,0,0,1,0,0,0,1,"BRUCE, Stanley","F4B","N/A","NAT","N/A",28,"- To say that Sir George Pearce expressed views in opposition to international arbitration is a statement that is not quite correct. On the subject of international arbitration, Sir George Pearce would express the view of the Government, and, I believe, of the overwhelming majority of the people of Australia, which is that we desire to promote, as far as is practically possible, the principles of international arbitration. In the remarks referred to by the honorable member, Sir George was dealing with an entirely different matter, namely, the proposal to revive the protocol by which the Powers were to guarantee the observance of certain proposed arrangements. On behalf of Great Britain, Sir AustenChamberlain made a full statement, which is entirely endorsed by the Government of Australia, which also approves of the remarks by Sir George Pearce on the subject.asked the Prime Minister, upon notice. - In regard to the recent migration agreement with Britain, will he state -What has been the average cost per migrant under this agreement up to the 30th June, 1927, to (a) Britain and (b) Australia?What was the average cost per migrant prior to this agreement to (a) Britain and (b) Australia?How many assisted migrants have arrived in each State under this agreement up to the 30thJune, 1927, and what has been the total cost incurred in connexion therewith?Have steps yet been taken by the Development and Migration Commission to solve the unemployment problem in Australia? If so, what has been done and with what success?How much money has been allotted by this commission up to the 30th June, 1927, for the development of local industries? To whom and for what purpose has such advance been made ?","INTERNATIONAL ARBITRATION","QUESTIONS","/hansard/chamber.xscript/debate[8]/subdebate.1[22]/answer/talk.start/para","N/A","N/A"
66,0,0,0,1,0,0,0,1,"BRUCE, Stanley","F4B","N/A","NAT","N/A",29,"- The replies to the honorable members questions are as follow :(a) The Commonwealth Government has no figures regarding the cost to the British Government; (b) £12 3s. 3d.(a) The Commonwealth Government has no figures regarding the cost to the British Government; (b) £9 7s.10d.The number of assisted migrants who have arrived in each State during the currency of the Migration Agreement is -N/AThe total cost incurred in connexion therewith is £805,743.The whole question of the solution of the unemployment problem has been receiving the serious consideration of the Government, and the Development and Migration Commission has been asked to furnish a report to the Government on certain phases of the problem, which will be dealt with in conjunction with the report of the Royal Commission on Unemployment and National Insurance. The Development and Migration Commission will present a report on this matter as early as practicable. The more rapid development of the resources of Australia, providing additional avenues of employment, is one of the most hopeful means of combating unemployment, and the Development and Migration Commission is giving close attention to this matter.Reference to section 13 of the Development and Migration Act will indicate that it is not a function of the commission to make advances of money for the development of local industries, but that the commission is empowered to -Investigate and report to the Minister on the condition and development of existing industries in the Commonwealth and the possibility of establishing new industries; andconduct negotiations for the establishment of new industries in Australia and the development of existing industries.On the recommendation of the commission the Commonwealth Government has approved of advances of loan money to the States to a total sum of £3,331,518 for land settlement, afforestation and public works associated with land settlement, under the £34,000,000 Migration Agreement.","MIGRATION AGREEMENT","QUESTIONS","/hansard/chamber.xscript/debate[8]/subdebate.1[23]/answer/talk.start/para","N/A","N/A"
67,1,0,0,0,0,0,0,1,"SCULLIN, James Henry","F4Q","N/A","N/A","N/A",29,"asked the Minister for Home and Territories, upon notice. -What tenders were received for an addressing machine required for the Government Printing Office, Canberra?What was the country of. manufacture, and the price paid for the machine eventually purchased?","GOVERNMENT PRINTING OFFICE, CANBERRA","QUESTIONS","/hansard/chamber.xscript/debate[8]/subdebate.1[24]/question/talk.start/para","N/A","N/A"
68,0,0,0,1,0,0,0,1,"MARR, Charles","KMW","N/A","NAT","N/A",29,"- The replies to the honorable members questions are as follow : -The undermentioned offers were received covering the supply of an addressing machine and associated apparatus for Canberra: - B. J. Ball Limited, £841 0s. 3d.; Spicers & Detmotd, £872 13s., plus packing freight, &c. £100- £972 13s.; Stott & Hoare, machine not entirely automatic £676, automatic machine £1,001.The offer of B. J. Ball & Company was accepted. Material to the value of £595 was made in Germany and the balance in England. The capabilities of all the machines were investigated thoroughly, and the  Adrema  equipment offered by Ball and Company was found to be best suited to the requirements of the printing office. The acceptance of the offer of B. J. Ball & Company was approved by the Stores Supply and Tender Board.","GOVERNMENT PRINTING OFFICE, CANBERRA","QUESTIONS","/hansard/chamber.xscript/debate[8]/subdebate.1[24]/answer/talk.start/para","N/A","N/A"
69,1,0,0,0,0,0,0,1,"CHARLTON, Matthew","JXA","N/A","N/A","N/A",29,"asked the Minister representing the Minister for Defence, upon notice -What amount has been expended on the air defence force for each year since 1922-23 inclusive.Has his attention been drawn to the published statement of Group-Captain Williams, Chief of the Air Staff, on the 19th July, 1927, that  our machines are quite good for training, but they are not adequate for defence. If so, will he make inquiries to see that the money voted by Parliament for that purpose is being spent in the right direction ?","AIR FORCE","QUESTIONS","/hansard/chamber.xscript/debate[8]/subdebate.1[25]/question/talk.start/para","N/A","N/A"
70,0,0,0,1,0,0,0,1,"BRUCE, Stanley","F4B","N/A","NAT","N/A",30,"- The answers to the honorable members questions are as follow : -N/AThe money voted by Parliament for air defence is being spent for that purpose and for no other. It must be borne in mind that the building up of an. air force necessitates a considerable outlay in hangars, workshops, aerodromes, and buildings for the accommodation of personnel, &c., as well as in the training of pilots and mechanics. Up to the present the bulk of the money allotted for air defence has been expended on these services, and the Force has relied chiefly for its aircraft on the gift equipment supplied to Australia by the Imperial Government at the conclusion of the war. These machines are, however, suitable for training purposes, and while they were available, the Government would not have been justified in scrapping them in favour of more modern aircraft. The supply of gift equipment is now becoming exhausted and a commencement is being made this year to re-equip the service units and portions of the flying training school with more modern types.","AIR FORCE","QUESTIONS","/hansard/chamber.xscript/debate[8]/subdebate.1[25]/answer/talk.start/para","N/A","N/A"
71,1,0,0,0,0,0,0,1,"PARSONS, Walter","KXR","N/A","N/A","N/A",30,"asked the Minister for Trade and Customs,upon notice -What quantity of wine of 1927 vintage was shipped prior to the 1st September, 1927, under the 1924 (4s. bounty) act to Great Britain?What amount was shipped under the same head from South Australia?","WINE EXPORT","QUESTIONS","/hansard/chamber.xscript/debate[8]/subdebate.1[26]/question/talk.start/para","N/A","N/A"
72,0,0,0,1,0,0,0,1,"PRATTEN, Herbert","K1J","N/A","NAT","N/A",30,"- The replies to the honorable members questions are as follow : -730,969 gallons.609,308 gallons.","WINE EXPORT","QUESTIONS","/hansard/chamber.xscript/debate[8]/subdebate.1[26]/answer/talk.start/para","N/A","N/A"
73,0,0,0,1,0,0,0,1,"PARSONS, Walter","KXR","N/A","N/A","N/A",30,"asked the Minister for Trade and Customs, upon notice-Whether instructions were issued that wine of 1927 vintage was not to be shipped under the 1924 Wine Bounty Act.If so, by whom were such instructions issued?Was the question as to whether the wine of 1927 vintage was eligible for the bounty under 1924 act submitted to the Attorney-Generals Department for an opinion?If so, what was the opinion?","WINE EXPORT","QUESTIONS","/hansard/chamber.xscript/debate[8]/subdebate.1[26]/answer/continue[1]/talk.start/para","N/A","N/A"
74,0,0,0,1,0,0,0,1,"PRATTEN, Herbert","K1J","N/A","NAT","N/A",30,"- The replies to the honorable members questions are as follow : -No instructions were issued that 1927 vintage wine was not to he shipped. After consultation with representatives of the wine industry a proclamation was issued on the 2nd June,1927, prohibiting the exportation of any fortified wine less than six months old. unless the consent of the Minister for Trade and Customs had been first obtained, and it was also decided to limit the quantity of 1927 vintage wine exported under bounty conditions before the 1st September, 1927, to 25 per cent. of the exportable surplus, subject to half that percentage being blended with wine of earlier vintage.The instructions that were issued were by direction of the Acting-Minister for Trade and Customs.No.See reply to No. 3.","WINE EXPORT","QUESTIONS","/hansard/chamber.xscript/debate[8]/subdebate.1[26]/answer/continue[2]/talk.start/para","N/A","N/A"
75,1,0,0,0,0,0,0,1,"MANN, Edward","KMQ","N/A","N/A","N/A",30,"asked the Prime Minister, upon notice -Will the Government supply to members reports of the proceedings at the conference of Premiers with the Prime Minister herd in Sydney subsequent to the conference in Melbourne dealing with financial relationships of the Commonwealth and States and child endowment of June last?Hashe received notification of the ratification of the financial proposals by any State Parliament; if so, by which?Will he await such ratification before submitting the proposals to the Commonwealth Parliament?","COMMONWEALTH AND STATES","QUESTIONS","/hansard/chamber.xscript/debate[8]/subdebate.1[27]/question/talk.start/para","N/A","N/A"
76,0,0,0,1,0,0,0,1,"BRUCE, Stanley","F4B","N/A","NAT","N/A",30,"- The answers to the honorable members questions are as follow : -A copy of the report of the proceedings at the conferences held in Melbourne and Sydney will be supplied to each member.No.No. The agreements will not come into force until adopted by the Parliaments of the Commonwealth and of the States.","COMMONWEALTH AND STATES","QUESTIONS","/hansard/chamber.xscript/debate[8]/subdebate.1[27]/answer/talk.start/para","N/A","N/A"
77,1,0,0,0,0,0,0,1,"CHARLTON, Matthew","JXA","N/A","N/A","N/A",30,"asked the Prime Minister, upon notice -Wihat quantity of phosphate rock arrived in Australia during the year ended the 30th June, 1927?What was the cost of landing this rock ?How much did it cost to prepare it for use as a fertilizer?What was the price paid bv the farmer for it?","SUPERPHOSPHATES","QUESTIONS","/hansard/chamber.xscript/debate[8]/subdebate.1[28]/question[1]/talk.start/para","N/A","N/A"
78,0,0,0,1,0,0,0,1,"BRUCE, Stanley","F4B","N/A","NAT","N/A",31,"- The replies to the honorable members questions are as follow : -509,799 tons.Average cost per ton, c.i.f., 49s.The raw phosphate is supplied to the superphosphate manufacturing compania*, whoso costs are not published.£5 7s. 6d. per ton for high grade superphosphate in Victoria, South Australia and Western Australia.","SUPERPHOSPHATES","QUESTIONS","/hansard/chamber.xscript/debate[8]/subdebate.1[28]/answer[1]/talk.start/para","N/A","N/A"
79,1,0,0,0,0,0,0,1,"GREGORY, Henry","KFE","N/A","N/A","N/A",31,"asked the Prime Minister, upon notice -What was the cost of rock phosphate from Nauru in 1922, 1923, and 1927?What was the duty on sulphur in 1922-3?What is the present duty?What is the estimated value of the concession in duty on sulphur per ton of superphosphates ?What is the price of superphosphates in the Australian States?What is the price of similar phosphatic value of superphosphates in New Zealand?Has the Minister any information regarding the price of superphosphates in the United States of America and Great Britain: if so, will he make same public?","SUPERPHOSPHATES","QUESTIONS","/hansard/chamber.xscript/debate[8]/subdebate.1[28]/question[2]/talk.start/para","N/A","N/A"
80,0,0,0,1,0,0,0,1,"BRUCE, Stanley","F4B","N/A","N/A","N/A",31,"- The replies to the honorable members questions are as follow : -77s. per ton c.i.f., 49s. 3d. per ton c.i.f., 49s. per ton c.i.f.British preferential tariff, 15s. per ton ; intermediate tariff, 20s. per ton; general tariff, 50s. per ton.Exempt from duty. Item 275a (1) reads -  Provided that, so long as a bounty is payable on sulphur, under any law of the Commonwealth, the importation of sulphur vo which the sub-item 275a (1) applies shall be free of duty. Bounty on sulphur is still payable under Act No. 21 of 1923.About5s.6d.Last seasons price, £5 7s.6d. per ton. Price-lists for next season not yet received, but information received indicates reductions of not less than 2s.6d. per ton, with further reductions for cash.Price ruling in North Island, February last, £511s. Reduction then made to £4 2s. 6d., owing to trade war, which still continues. Price in South Island is £5 9s. 3d. for cash.In Australia and New Zealand most of superphosphate sold is high grade 45 per cent. In Great Britain and United States of America such high grade is not generally used, though it is obtainable. In Great Britain, in lots of a few tons, at about £4 2s. 6d. per ton. Standard grades in Great Britain are 30 per cent. and 35 per cent., and present average price of former is £2 12s.6d. per ton at works. It is understood prices in United States are similar, but no exact information is at present available.","SUPERPHOSPHATES","QUESTIONS","/hansard/chamber.xscript/debate[8]/subdebate.1[28]/answer[2]/talk.start/para","N/A","N/A"
81,1,0,0,0,0,0,0,1,"MANN, Edward","KMQ","N/A","N/A","N/A",31,"asked the Prime Minister, upon notice -Will the Government supply to all honorable members copies of the report of the International Economic Conference held under the auspices of the League of Nations at Geneva in May last?Was that report considered at the recent sitting of the Assembly of the League?Who were the Australian representatives at that Conference besides Sir David Gordon; and how many representatives was Australia entitled to?Has he received any communication from - (a) The British Government; (b) the League of Nations; (c) any representative of a States member of the League as to the intentions of the Australian Government regarding giving effect to the report of the Conference?Are any other steps in contemplation amongst the States members of the League or arranged for by the Council of the League to consider steps for giving general effect to the recommendation of the Conference?","INTERNATIONAL ECONOMIC CONFERENCE","QUESTIONS","/hansard/chamber.xscript/debate[8]/subdebate.1[29]/question[1]/talk.start/para","N/A","N/A"
