"question_flag","answer_flag","interjection_flag","speech_flag","petition_flag","quote_flag","motionnospeech_flag","chamber_flag","name","name.id","electorate","party","role","page.no","content","subdebateinfo","debateinfo","path","Speaker","Time"
"0","0","0","0","0","0","0","1","N/A","N/A","N/A","N/A","N/A","N/A","Mr. Speaker (Hon. W.M. Nairn) took the chair at 3 p.m., and read prayers.","N/A","N/A","/hansard/chamber.xscript/business.start/para","N/A","N/A"
"0","0","0","1","0","0","0","1","SPEAKER, Mr","10000","N/A","N/A","N/A","13","- I have to announce that I have received a return to the writ which I issued on the 28th November, 1940, for the election of a member to serve for the electoral division of Swan, in the State of Western Australia, to fill the vacancy caused by the death of the Honorable Henry Gregory, and by the endorsement thereon it is certified that Thomas William Marwick has been elected in pursuance of the said writ.Mr. Marwick made and subscribed the oath of allegiance.","N/A","NEW MEMBER","/hansard/chamber.xscript/debate[1]/speech/talk.start/para","N/A","N/A"
"0","0","0","1","0","0","0","1","FADDEN, Arthur William","F4T","Darling Downs","CP","Treasurer","13","- It is with deep regret that I refer to the death of Mr. David Sydney Jackson, which occurred at Launceston on the 28th February. Mr. Jackson was formerly a member of this House for the Division of Bass. As a young man of 80 years he was elected at the general elections of 1919, and was subsequently re-elected in 1922, 1925 and 1928. He was defeated at the general election of 1929. He served on the Parliamentary Standing Committee on Public Works from May, 1921, to October, 1925, and from February to September, 1929. In 1928 he was a member of the Commonwealth delegation of the Empire Parliamentary Association which visited Canada.The personnel of this House has changed greatly since Mr. Jackson was associated with it. I did not have the privilege of personal friendship with Mr. Jackson, but members who were here with him speak very highly of his personal qualities and recall his capacity and enthusiasm in the discharge of his public duties. Mr. Jackson was actively connected with many branches of the public and sporting life of Launceston, and his life was devoted to the service of charitable organizations. Northern Tasmania has indued lost a Worthy citizen.I invite honorable members to join in expressing the heartfelt sympathy of this House with his widow in the sad and untimely loss which she has sustained. As Leader of the Country party I take this opportunity to express also the sympathy of my party with Mrs. Jackson in her bereavement. I move -That this House expresses its deep regret at the death of Mr. David Sydney Jackson, a former member for the Division of Bass, places on record its appreciation of his meritorious public service, and tenders its heartfelt sympathy to his widow in herbereavement.","N/A","DEATH OF MR. DAVID SYDNEY JACKSON","/hansard/chamber.xscript/debate[2]/speech[1]/talk.start/para","N/A","N/A"
"0","0","0","1","0","0","0","1","CURTIN, John","009FQ","Fremantle","N/A","Leader of the Opposition","13",". - I second the motion. Every member of the House learned with deep regret of the death of Mr. Jackson, who served as the member for Bass for a period of about ten years. He was well known to those members who were in attendance here prior to 1929. As the Acting Prime Minister has said, Mr. Jacksons public work was much more extensive than the representation of Bass in this Parliament.On my visits to Tasmania I learned that he was widely respected, and that he was engaged in a number of activities, all of which contributed to the welfare and progress of his fellow citizens. A man who is re-elected at successive elections to this Parliament has won a place in the estimation of the electors as one who not only can contribute to their immediate needs, but is also a man of continuing purpose in the service which they desire to have done. In that way, Mr. Jackson has left his mark on Tasmania and, indeed, on the whole of the Commonwealth. On behalf of my party, I express to his widow our deep sympathy, and I join in the tribute to his public service which the Leader of the House has voiced.","N/A","DEATH OF MR. DAVID SYDNEY JACKSON","/hansard/chamber.xscript/debate[2]/speech[2]/talk.start/para","N/A","N/A"
"0","0","0","1","0","0","0","1","BARNARD, Herbert","JNX","Bass","N/A","N/A","13","- I join with the Acting Prime Minister and the Leader of the Opposition in expressing regret at the passing of this young Tasmanian. I knew Mr. Jackson for many years; wo were boys together, we attended the same school, and we grew up in the same city. We became close friends. I know something of Mr. Jacksons public service in the city where he lived and worked; he had numerous interests, as the Acting Prime Minister has said. For instance, he was for a number of years president of the Bush Nursing Association, an organization which renders valuable service to the community. His work in connexion with that organization indicates his outlook on life. A talented musician himself, he was greatly interested in music, and played a conspicuous part in the Launceston Competitions Association, of which he was a member. He was a keen sportsman; for some years he was a champion bowler. He was also a firm supporter of Australian industries, and with his father and brothers conducted a locksmith business at Launceston. Mr. Jackson and I differed in politics, but although our approach to public questions was not the same, happily that did not interfere with the friendship that existed between us. As the Leader of the Opposition stated. Mr. Jackson might be said to have earned the respect of the community inasmuch as he was elected to this Parliament for several terms, and held a record for service in the electorate of Bass,. His passing at the early age of 58 years is deeply regretted by the citizens of Launceston, and by all those who knew him. I join with other honorable members in expressing my deepest sympathy with his widow, and with others who mourn his loss.Sir CHARLES MARR (Parkes).I support the expressions of sympathy with Mrs. Jackson upon the loss of her husband. I oan bear testimony to the good work which Mr. Jackson did in the course of his public life. One phase of that work stands pre-eminent. Mr. Jackson travelled extensively in the Northern Territory, and after he returned he toured the Commonwealth giving lectures, in the course of which he brought under the notice of the public the work being done by the Australian -Inland Mission under the leadership of the Reverend Flynn. As the result of those lectures,  Flynn of the Inland  became well known to the Australian public, and no less than £2,000 was raised to augment the funds of the mission. That work was undertaken voluntarily by Mr. Jackson without expense to the Commonwealth, and long before this Parliament or any other had taken any notice of the work which the mission was doing. Therefore, his memory will remain green in the minds of those who reside in the mors remote parts of Australia - people who at the time when Mr. Jackson rendered them such conspicuous service, did not enjoy even such comforts and amenities as are now &t their disposal. I take the opportunity, therefore, to draw attention to the valuable work which he performed, . and to express the thanks of the Inland Mission for his services.","N/A","DEATH OF MR. DAVID SYDNEY JACKSON","/hansard/chamber.xscript/debate[2]/speech[3]/talk.start/para","N/A","N/A"
"0","0","0","1","0","0","0","1","GUY, James Allan","KFW","Wilmot","N/A","N/A","14","- I desire to associate myself with the expressions of regret and sympathy which have fallen from the lips of the Acting Prime Minister (Mr. Fadden) and other speakers in connexion with the death of Mr. Jackson. I was privileged to know Mr. Jackson for many years, and I always regarded his personal qualities and sincerity of purpose as outstanding. As the Acting Prime Minister has pointed out, Mr. Jackson represented the electorate of Bass faithfully and well in the Commonwealth Parliament for ten years. In 1929, I was chosen as his successor. We had a friendly contest, and the result of that election did not interfere one iota with our personal friendship. Although he was a strong party man, Syd Jackson never Allowed party feeling to interfere with his friendships, or to lessen his estimation of others. He was a progressive and industrious citizen who had the courage of his convictions and was never afraid to give expression to them. He was keenly interested in Australian manufactures, and waa an enthusiastic worker for the advancement of his native State and of Australia. He will be remembered for his great interest in entertainment. A versatile entertainer himself, he rendered valuable assistance at many charitable, philanthropic and patriotic functions. Much of his time, as was pointed out by the honorable member for Bass (Mr. Barnard), was spent in assisting the noble work of Bed Gross institutions in Tasmania. He was a zealous and active member of Parliament, a genial man. who made friends rapidly, and retained the respect and affection of all with whom he came in contact. I express to his widow, and to other members of his family, my deepest sympathy in the great loss they have sustained.Question resolved in the affirmative, honorable members standing in their places.","N/A","DEATH OF MR. DAVID SYDNEY JACKSON","/hansard/chamber.xscript/debate[2]/speech[4]/talk.start/para","N/A","N/A"
"0","0","0","0","0","0","0","1","N/A","N/A","N/A","N/A","N/A","N/A","Assent to the following bills reported : -","N/A","ASSENT TO BILLS","/hansard/chamber.xscript/debate[3]/para[1]","N/A","N/A"
"0","0","0","0","0","0","0","1","N/A","N/A","N/A","N/A","N/A","N/A","Income Tax Assessment Bill (No. 2) 1940.","N/A","ASSENT TO BILLS","/hansard/chamber.xscript/debate[3]/para[2]","N/A","N/A"
"0","0","0","0","0","0","0","1","N/A","N/A","N/A","N/A","N/A","N/A","States Grants Bill 1940.","N/A","ASSENT TO BILLS","/hansard/chamber.xscript/debate[3]/para[3]","N/A","N/A"
"0","0","0","0","0","0","0","1","N/A","N/A","N/A","N/A","N/A","N/A","Defence Equipment Bill 1940.","N/A","ASSENT TO BILLS","/hansard/chamber.xscript/debate[3]/para[4]","N/A","N/A"
"0","0","0","0","0","0","0","1","N/A","N/A","N/A","N/A","N/A","N/A","Wheat Tax (War-time) Assessment Bill 1940.","N/A","ASSENT TO BILLS","/hansard/chamber.xscript/debate[3]/para[5]","N/A","N/A"
"0","0","0","0","0","0","0","1","N/A","N/A","N/A","N/A","N/A","N/A","Wheat Tax (War-time) Bill, 1940.","N/A","ASSENT TO BILLS","/hansard/chamber.xscript/debate[3]/para[6]","N/A","N/A"
"0","0","0","0","0","0","0","1","N/A","N/A","N/A","N/A","N/A","N/A","Wheat Industry (War-time Control) Bill 1940.","N/A","ASSENT TO BILLS","/hansard/chamber.xscript/debate[3]/para[7]","N/A","N/A"
"0","0","0","0","0","0","0","1","N/A","N/A","N/A","N/A","N/A","N/A","Loan (Drought Relief) Bill 1940.","N/A","ASSENT TO BILLS","/hansard/chamber.xscript/debate[3]/para[8]","N/A","N/A"
"0","0","0","0","0","0","0","1","N/A","N/A","N/A","N/A","N/A","N/A","States Grants (Drought Relief) Bill 1940.","N/A","ASSENT TO BILLS","/hansard/chamber.xscript/debate[3]/para[9]","N/A","N/A"
"0","0","0","0","0","0","0","1","N/A","N/A","N/A","N/A","N/A","N/A","Apple and Pear (Appropriation) Bill 1940.","N/A","ASSENT TO BILLS","/hansard/chamber.xscript/debate[3]/para[10]","N/A","N/A"
"0","0","0","0","0","0","0","1","N/A","N/A","N/A","N/A","N/A","N/A","Wire Netting Bounty Bill 1940.","N/A","ASSENT TO BILLS","/hansard/chamber.xscript/debate[3]/para[11]","N/A","N/A"
"0","0","0","0","0","0","0","1","N/A","N/A","N/A","N/A","N/A","N/A","Morgan-Whyalla Waterworks Agreement Bill 1940.","N/A","ASSENT TO BILLS","/hansard/chamber.xscript/debate[3]/para[12]","N/A","N/A"
"0","0","0","0","0","0","0","1","N/A","N/A","N/A","N/A","N/A","N/A","Sales Tax (Exemptions and Classifications) Bill 1940.","N/A","ASSENT TO BILLS","/hansard/chamber.xscript/debate[3]/para[13]","N/A","N/A"
"0","0","0","0","0","0","0","1","N/A","N/A","N/A","N/A","N/A","N/A","Sales Tax Bills (Nos. 1a to 9a) 1940.","N/A","ASSENT TO BILLS","/hansard/chamber.xscript/debate[3]/para[14]","N/A","N/A"
"0","0","0","0","0","0","0","1","N/A","N/A","N/A","N/A","N/A","N/A","Officers Rights Declaration Bill 1940.","N/A","ASSENT TO BILLS","/hansard/chamber.xscript/debate[3]/para[15]","N/A","N/A"
"0","0","0","0","0","0","0","1","N/A","N/A","N/A","N/A","N/A","N/A","Northern Territory (Administration) Bill (No. 2) 1940.","N/A","ASSENT TO BILLS","/hansard/chamber.xscript/debate[3]/para[16]","N/A","N/A"
"0","0","0","0","0","0","0","1","N/A","N/A","N/A","N/A","N/A","N/A","Commonwealth Public Service Bill. 1940.","N/A","ASSENT TO BILLS","/hansard/chamber.xscript/debate[3]/para[17]","N/A","N/A"
"0","0","0","0","0","0","0","1","N/A","N/A","N/A","N/A","N/A","N/A","Income Tax Bill (No. 2) 1940.","N/A","ASSENT TO BILLS","/hansard/chamber.xscript/debate[3]/para[18]","N/A","N/A"
"0","0","0","0","0","0","0","1","N/A","N/A","N/A","N/A","N/A","N/A","War-time (Company) Tax Assessment Bill 1940.","N/A","ASSENT TO BILLS","/hansard/chamber.xscript/debate[3]/para[19]","N/A","N/A"
"0","0","0","0","0","0","0","1","N/A","N/A","N/A","N/A","N/A","N/A","War-time (Company) Tax Bill 1940.","N/A","ASSENT TO BILLS","/hansard/chamber.xscript/debate[3]/para[20]","N/A","N/A"
"0","0","0","0","0","0","0","1","N/A","N/A","N/A","N/A","N/A","N/A","Wine Export Bounty Bill 1940.","N/A","ASSENT TO BILLS","/hansard/chamber.xscript/debate[3]/para[21]","N/A","N/A"
"0","0","0","0","0","0","0","1","N/A","N/A","N/A","N/A","N/A","N/A","Treasury Bills Bill 1940.","N/A","ASSENT TO BILLS","/hansard/chamber.xscript/debate[3]/para[22]","N/A","N/A"
"0","0","0","0","0","0","0","1","N/A","N/A","N/A","N/A","N/A","N/A","Post and Telegraph Rates (Defence Forces) Bill (No. 2) 1940.","N/A","ASSENT TO BILLS","/hansard/chamber.xscript/debate[3]/para[23]","N/A","N/A"
"0","0","0","0","0","0","0","1","N/A","N/A","N/A","N/A","N/A","N/A","Gold Tax Collection Bill (No. 2) 1940.","N/A","ASSENT TO BILLS","/hansard/chamber.xscript/debate[3]/para[24]","N/A","N/A"
"0","0","0","0","0","0","0","1","N/A","N/A","N/A","N/A","N/A","N/A","Australian Soldiers Repatriation Bill (No. 2) 1940.","N/A","ASSENT TO BILLS","/hansard/chamber.xscript/debate[3]/para[25]","N/A","N/A"
"0","0","0","0","0","0","0","1","N/A","N/A","N/A","N/A","N/A","N/A","Invalid and Old-age Pensions Bill 1940.","N/A","ASSENT TO BILLS","/hansard/chamber.xscript/debate[3]/para[26]","N/A","N/A"
"0","0","0","0","0","0","0","1","N/A","N/A","N/A","N/A","N/A","N/A","Appropriation (Works and Buildings) Bill 1940-41.","N/A","ASSENT TO BILLS","/hansard/chamber.xscript/debate[3]/para[27]","N/A","N/A"
"0","0","0","0","0","0","0","1","N/A","N/A","N/A","N/A","N/A","N/A","Appropriation Bill 1940-41.","N/A","ASSENT TO BILLS","/hansard/chamber.xscript/debate[3]/para[28]","N/A","N/A"
"0","0","0","0","0","0","0","1","N/A","N/A","N/A","N/A","N/A","N/A","Mr.FADDEN (Darling Downs - Acting","N/A","MINISTERIAL DUTIES","/hansard/chamber.xscript/debate[4]/para[1]","N/A","N/A"
"0","0","0","0","0","0","0","1","N/A","N/A","N/A","N/A","N/A","N/A","Prime Minister). - I desire formally to inform the House that, in connexion with the departure overseas of the right honorable R. G. Menzies, I was appointed Acting Prime Minister and Acting Minister for Defence Coordination. During the absence of Mr. Menzies, the Minister for Commerce (Sir Earle Page) and the Minister for Supply and Development and Minister of Munitions (Senator McBride) are members of the War Cabinet. I also inform honorable members that, in addition to the duties previously performed by them, the Hon. T. J. Collins is Minister assisting the Postmaster-General, and Senator the Hon. J. W. Leckie is Minister assisting the Minister for the Army. Mr. Collins will, of course, represent the Postmaster-General in this chamber.","N/A","MINISTERIAL DUTIES","/hansard/chamber.xscript/debate[4]/para[2]","N/A","N/A"
"0","0","0","1","0","0","0","1","FADDEN, Arthur William","F4T","Darling Downs","CP","Acting Prime Minister","15",". - I desire to inform the House that I have been appointed Leader of the Country party.","N/A","COUNTRY PARTY LEADERSHIP","/hansard/chamber.xscript/debate[5]/speech/talk.start/para","N/A","N/A"
"0","0","0","1","0","0","0","1","BEASLEY, John","JOM","West Sydney","N/A","N/A","15",". - I wish to advise the House that the party which my colleagues and I represented in this Parliament is now included in the official Opposition. We acknowledge the honorable member for Fremantle (Mr. Curtin), Leader of the Opposition, as our leader in the House of Representatives.","N/A","LABOUR PARTIES","/hansard/chamber.xscript/debate[6]/speech/talk.start/para","N/A","N/A"
"0","0","0","1","0","0","0","1","ROSEVEAR, John","L08","N/A","N/A","N/A","15","- Last session I inquired from the Minister for the Army the reasons why the Abbco Bread Company Proprietary Limited, which had been convicted of defrauding the Government by supplying shortweight breadin fulfilment of military contracts, had received further contracts from the Government. The Minister said that it was because the company had been guilty of only a technical breach. I now ask him whether he has any additional reasons to offer why this firm, which sought to defraud the Government, should still be given Government contracts. I should also like to know whether recent developments and disclosures provide better reasons why the company should not be given Government contracts. Lastly, I desire to know the Governments intentions towards this company in regard to future contracts.","ABBCO BREAD COMPANY","QUESTIONS","/hansard/chamber.xscript/debate[7]/subdebate.1[1]/question[1]/talk.start/para","N/A","N/A"
"0","0","0","1","0","0","0","1","SPENDER, Percy","KUG","N/A","UAP","N/A","15","- The answer which I gave on the 6th December last year was not precisely in the terms indicated by the honorable member. At that time, I told him that the Abbco Bread Company no longer was the contractor for the Commonwealth Government. That statement, I believe, has been elsewhere challenged, but it is unquestionably true. The position was that on the 1st April of last year, a contract for the supply of bread to the Army was given to the Abbco Bread Company. In July of last year, the contract was renewed for a period which expired in October. That was after R. J. White and Company had taken up the contract for five days and had, forsome reason which has not been determined, abandoned it.","ABBCO BREAD COMPANY","QUESTIONS","/hansard/chamber.xscript/debate[7]/subdebate.1[1]/answer[1]/talk.start/para","N/A","N/A"
"0","0","0","0","0","0","0","1","ROSEVEAR, John","L08","N/A","N/A","N/A","16","- Has the Minister any reason for that?","ABBCO BREAD COMPANY","QUESTIONS","/hansard/chamber.xscript/debate[7]/subdebate.1[1]/answer[1]/interjection/talk.start/para","N/A","N/A"
"0","0","0","0","0","0","0","1","SPENDER, Percy","KUG","N/A","N/A","N/A","16","- All the facts will be ventilated. When the honorable member asked the question, I said at the time that in respect of any Army contract, no particular firm or person who had been prosecuted and found guilty of that offence, or any similar offence with regard to quantity or quality, was to be re-employed by the Army. The Abbco Bread Company, or any other company which is associated with it, has hot, I am informed,been re-employed since that date. When the matter of the Abbco Bread Company arose in the Legislative Assembly of New South Wales last week, I immediately issued instructions to the Inspector-General of Administration, who is an outside business man and independent entirely of the Army, to make full inquiries into the whole of the circumstances surrounding the prosecution, the original granting of the contract, the renewal of the contract after the offence had been proved against the company, the administration of the Army regarding the supply and checking of bread, and all details connected with the matter as revealed during the debate on the censure motion in the Legislative Assembly of New South Wales. At my request, the Inspector-General of Administration has expedited the inquiry and I have been promised a report by to-morrow morning. Whatever its contents, I shall have no hesitation in placing the document upon the table of the House. Like every other honorable member, I desire to see that on no occasion shall any firm defraud the Commonwealth. As to Captain Rigney, whose name has been mentioned and who has been said to be guilty of either negligence or collusion with this firm, I took the responsibility, without pre-judging the man, of standing him off duty until the report comes to hand.","ABBCO BREAD COMPANY","QUESTIONS","/hansard/chamber.xscript/debate[7]/subdebate.1[1]/answer[1]/continue/talk.start/para","N/A","N/A"
"0","0","0","1","0","0","0","1","MCCALL, William","KOQ","N/A","UAP","N/A","16","- If itbe found that the report is not satisfactory, will the Acting Prime Minister give consideration to the advisability of appointing a joint royal commission comprising representatives of both the Commonwealth and New South Wales to inquire fully into all details of the case? I understand that a precedent has been established for that, as joint royal commissions have been appointed in the past.","ABBCO BREAD COMPANY","QUESTIONS","/hansard/chamber.xscript/debate[7]/subdebate.1[1]/question[2]/talk.start/para","N/A","N/A"
"0","0","0","1","0","0","0","1","FADDEN, Arthur William","F4T","N/A","CP","N/A","16","- I promise the honorable member that full consideration will be given to the subject-matter of the report mentioned by the Minister for the Army.","ABBCO BREAD COMPANY","QUESTIONS","/hansard/chamber.xscript/debate[7]/subdebate.1[1]/answer[2]/talk.start/para","N/A","N/A"
"0","0","0","1","0","0","0","1","MARR, Charles","KMW","N/A","N/A","N/A","16","- Will the Minister representing the Minister for the Interior say whether, as is reported in the press, the Government proposes to erect two new blocks of offices at the back of the present Parliament House, on the site reserved in the Griffin plan for the erection of the permanent Parliament House? Were such buildings recommended by the National Capital Planning and Development Committee, or will they be constructed in opposition to the recommendation of that body? Is it a fact that the foundations for a permanent structure were completed years ago on the proper site mentioned in the Griffin plan in front of Parliament House, and that by deferring the ornamental external features, the interior of this building could be erected at a price equivalent to the cost of constructing two temporary buildings at the back of Parliament House, as suggested?","CANBERRA : ADDITIONAL OFFICE ACCOMMODATION","QUESTIONS","/hansard/chamber.xscript/debate[7]/subdebate.1[2]/question/talk.start/para","N/A","N/A"
"0","0","0","1","0","0","0","1","COLLINS, Thomas","K0D","N/A","CP","N/A","16","- I think that it is the intention of the department to erect certain buildings, details of which I shall ask the Minister for the Interior to make available for the information of the honorable member.","CANBERRA : ADDITIONAL OFFICE ACCOMMODATION","QUESTIONS","/hansard/chamber.xscript/debate[7]/subdebate.1[2]/answer/talk.start/para","N/A","N/A"
"0","0","0","1","0","0","0","1","LAZZARINI, Hubert","L07","N/A","N/A","N/A","16","- During the recessI addressed to the Treasurer a communication asking for information about interest rates charged by the trading banks. In one passage of his reply, the Treasurer stated :  Interest rates charged by the trading banks are not published. Will the Treasurer say why they are not published? How can the general public, and honorable members know whether the banks are charging undue rates of interest if . the information is kept a close secret?","INTEREST RATES","QUESTIONS","/hansard/chamber.xscript/debate[7]/subdebate.1[3]/question/talk.start/para","N/A","N/A"
"0","0","0","1","0","0","0","1","FADDEN, Arthur William","F4T","N/A","CP","N/A","17","- The rate of interest charged by the trading banks is not published simply because they do not publish the information. I know of no other reason.","INTEREST RATES","QUESTIONS","/hansard/chamber.xscript/debate[7]/subdebate.1[3]/answer/talk.start/para","N/A","N/A"
"0","0","0","1","0","0","0","1","BRENNAN, Frank","JSC","N/A","N/A","N/A","17","- Did the Acting Prime Minister, on or about the 13th February of this year, cause to issue for public information an important statement on the international situation, concluding with these words :  We think we should tell the people of Australia that it is the considered opinion of the War Council that the war has moved to a new stage, involving the utmost gravity  ? Was this statement published over the signatures of persons other than responsible Ministers of the Crown and if so, why was it not supported, since support was considered necessary, by responsible persons only, with the weight and authority of the War Cabinet?","INTERNATIONAL SITUATION","QUESTIONS","/hansard/chamber.xscript/debate[7]/subdebate.1[4]/question/talk.start/para","N/A","N/A"
"0","0","0","1","0","0","0","1","FADDEN, Arthur William","F4T","N/A","CP","N/A","17","- I shall reply adequatelyto the question during the secret meeting of the members of both chambers.","INTERNATIONAL SITUATION","QUESTIONS","/hansard/chamber.xscript/debate[7]/subdebate.1[4]/answer/talk.start/para","N/A","N/A"
