"question_flag","answer_flag","interjection_flag","speech_flag","petition_flag","quote_flag","motionnospeech_flag","chamber_flag","name","name.id","electorate","party","role","page.no","content","subdebateinfo","debateinfo","path","Speaker","Time"
"0","0","0","0","0","0","0","1","BLACKBURN, Maurice","JPN","N/A","N/A","N/A","30","- Certainly not! But for my part, I am perfectly satisfied to know that the Government is alive to the danger, and that it is in consultation with the Leader of the Opposition (Mr. Curtin). I do not want to know more than that. People can see that our defences, far from being perfect, are really inadequate. They do not require to be told that.","N/A","ADJOURNMENT","/hansard/chamber.xscript/debate[9]/speech[10]/continue[2]/talk.start/para","N/A","N/A"
"0","0","0","1","0","0","0","1","BELL, George","JOS","Darwin","N/A","N/A","31",".- I can see no virtue or advantage in the proposed secret meeting. Very  largely, 1 agree with the opinion of the honorable member for Bourke (Mr. Blackburn). At any secret meeting that I have attended, I have not heard one word that could not have been uttered in public, and I cannot imagine a Minister making to such a gathering a statement which could not, or should not, have been made known. If it is to be a secret meeting at all, it should be a secret sitting of the House, where members will be definitely bound to secrecy, and be liable for punishment if they repeat anything that they hear at the meeting. But I cannot see how honorable members can be bound to secrecy regarding the proceedings at the proposed informal gathering. I consider that there is nothing to be gained from a meeting of the kind proposed..","N/A","ADJOURNMENT","/hansard/chamber.xscript/debate[9]/speech[11]/talk.start/para","N/A","N/A"
"0","0","0","1","0","0","0","1","MORGAN, Charles","JVA","Reid","N/A","N/A","31",". - I endorse the sentiments expressed by the honorable member for Barker (Mr. Archie Cameron) and other honorable members regarding the proposed secret meeting. Democracy, to function, must be told the facts. The people fear only what they do not know. If Australians are told the worst, they will face the situation squarely. The effect of this proposed secret meeting will be to alarm people and cramp our war effort. The only way in which to obtain a united war effort is to acquaint the public with all the facts.I am placed in an invidious position regarding an answer which was given to me by the Minister for the Army and regarding the equipment of the Australian Imperial Force abroad. In my opinion, no disservice will be done to this country by publishing the facts because the danger has now passed. No reflection is cast upon the ability of the Minister for the Army, because he was not responsible for the position. At that time he did not hold his present portfolio, and he was just as agitated as I was about the matter. Subsequently, he made a special trip abroad to ascertain whether the rumours had any foundation, and he discovered that the troops were then adequately equipped. In the circumstances, no harm can bc done now by disclosing the facts.From information given to me, I am satisfied that my fears were justified. Of the 16,000 soldiers who have been repatriated or discharged from the Army, many served in the Middle East, and will substantiate my statements. The matter should be the subject of a public inquiry, or should be investigated by a select committee of this House, so that those responsible will be appropriately dealt with. A real disservice would be done to Australia by allowing anybody to remain in a position where he could be responsible for a recurrence of the trouble, and an exhaustive inquiry should be held in order to sheet home the guilt. The debacle in France was accomplished by fifth columnists behind the lines, and we do not want a similar experience in Australia. If there be any fifth columnists here, they should be immediately exposed and placed where they can do no harm.I should like the Acting Prime Minister (Mr. Fadden) to inform me how long the oath of secrecy imposed upon members of the Advisory War Council endures. How long after a particular danger, which has been known to the Council, has passed will it be permissible to discuss the matter in Parliament? I desire that information in order to clear myself regarding the answer which was given to me by the Minister for the Army; I am confident that he will substantiate my statements, although he may differ from me as to whether I exaggerated the position. It will be shown definitely that for six months our troops in Palestine had no armoured equipment. In view of the importance of armoured equipment in modern warfare, any reasonable person will agree that the Australian Imperial Force should never have been left in such a defenceless state. Whether fifth columnists were responsible, or whether some officials relied upon others to do their job, I do not know. I want to know from the Acting Prime Minister whether any discussion that took place on this matter in the Advisory War Council can now be made public?","N/A","ADJOURNMENT","/hansard/chamber.xscript/debate[9]/speech[12]/talk.start/para","N/A","N/A"
"0","0","0","0","0","0","0","1","FADDEN, Arthur William","F4T","N/A","N/A","N/A","32","- No; the oath of secrecy still obtains.","N/A","ADJOURNMENT","/hansard/chamber.xscript/debate[9]/speech[12]/interjection/talk.start/para","N/A","N/A"
"0","0","0","0","0","0","0","1","MORGAN, Charles","JVA","N/A","N/A","N/A","32","- Then there is nothing more that I can say.","N/A","ADJOURNMENT","/hansard/chamber.xscript/debate[9]/speech[12]/continue/talk.start/para","N/A","N/A"
"0","0","0","1","0","0","0","1","FRANCIS, Josiah","JWT","Moreton","N/A","N/A","32",".- I sympathize with the Acting Prime Minister (Mr. Fadden) in the position in which he has been placed as the result of the objection to a secret meeting voiced by most honorable members who have spoken. My view is that Parliament is not exercising its true function if it does not take every opportunity to obtain information. I read the press statements about the war. I do not criticize the journals when I say that what they publish is conflicting. We should have the true story from the Ministry. We have not had it yet. We have had no. information since Parliament last sat, except a few observations from time to time about the defence policy.","N/A","ADJOURNMENT","/hansard/chamber.xscript/debate[9]/speech[13]/talk.start/para","N/A","N/A"
"0","0","0","0","0","0","0","1","CAMERON, Archie","JTY","N/A","N/A","N/A","32","- There is a costly Department of Information.","N/A","ADJOURNMENT","/hansard/chamber.xscript/debate[9]/speech[13]/interjection/talk.start/para","N/A","N/A"
"0","0","0","0","0","0","0","1","FRANCIS, Josiah","JWT","N/A","N/A","N/A","32","- The Department of Information is not functioning as I should like it to function. I hope that the Acting Prime Minister will brush aside the suggestion that we should not hold a secret meeting. It should be held, and the Acting Prime Minister should give to us the information which he contemplates giving, irrespective of the fact that certain honorable members have reserved the right to deal with that information as they think fit. I, too, have been dissatisfied with the information that we have received. The times are critical and, as they become more critical, as they will before victory is won, we must be called together and be given information. We are not carrying out our trust to the people if we do not attend such meetings. Ministers do not perform their true function if they do not give the fullest information, secret and otherwise, so that we may vote with knowledge. I hope that the Acting Prime Minister will not take this debate as an indication that the majority do not want a secret session. If we are told what we do not already know the secret session will be justified. I can understand the apathy of honorable members if they come here expecting information as to the exact position in Australia and overseas, but are given merely a rehash of what has already appeared in the press. Even in the statements made from time to time by the Minister for External Affairs there has been nothing that has not already appeared either in the press or the fortnightly journal issued by the External Affairs Department. That is not fair to honorable members. I do not endorse the observations of some honorable members, particularly honorable members opposite, and I ask for the information to which we are entitled. I shall continue to ask for that information until I get it.","N/A","ADJOURNMENT","/hansard/chamber.xscript/debate[9]/speech[13]/continue/talk.start/para","N/A","N/A"
"0","0","0","1","0","0","0","1","CALWELL, Arthur","BV8","Melbourne","N/A","N/A","32",".- The Acting Prime Minister (Mr. Fadden) flattered honorable members by telling them that they are national trustees. Neither the Acting Prime Minister nor any member of the Ministry in the last three months has treated any honorable member outside the Ministry and members of the Advisory War Council as if he were a national trustee. No information about the war effort, not already made known in the press, has been supplied to any member of the House or of the Senate. The announcement by the Acting Prime Minister sounds to me like a new discovery, rivalling the announcement a few years ago of Professor Ensteins theory of relativity. If the announcement is any indication of ti changed attitude I welcome it, but the Ministry seems to proceed from the assumption that only Ministers and honorable members of the Advisory War Council are fit to be trusted with information about the war, and that no other honorable member has a right to ask questions or to be supplied with information if it is not thought advisable for it to be given to him. If we are national trustees, we ought to be given all the information available to Ministers.","N/A","ADJOURNMENT","/hansard/chamber.xscript/debate[9]/speech[14]/talk.start/para","N/A","N/A"
"0","0","0","0","0","0","0","1","FADDEN, Arthur William","F4T","N/A","N/A","N/A","32","- That is what the meeting is to be for.","N/A","ADJOURNMENT","/hansard/chamber.xscript/debate[9]/speech[14]/interjection[1]/talk.start/para","N/A","N/A"
"0","0","0","0","0","0","0","1","CALWELL, Arthur","BV8","N/A","N/A","N/A","32","- I am just as entitled to information as is any other honorable member of this Parliament. The purpose of a question which I asked earlier to-day about the necessity for the presence of the service chiefs was inspired by my lack of faith in the capacity of Ministers to answer any questions arising out of the type-written statements which they will read to the House. By a process of deductive logic I assume that their conduct on this occasion will parallel their conduct on other occasions when secret meetings have been held. All of those meetings have been well described as farcical, and if the capacity of Ministers to answer questions at the proposed meeting is not better than it was on previous occasions and at this sitting we shall not get very far. Ministers in the House of Commons are much more frank than Ministers of the Commonwealth Parliament are in dealing with private members.","N/A","ADJOURNMENT","/hansard/chamber.xscript/debate[9]/speech[14]/continue[1]/talk.start/para","N/A","N/A"
"0","0","0","0","0","0","0","1","BLAIN, Adair","JPT","N/A","N/A","N/A","33","- Does the House of Commons hold secret sessions?","N/A","ADJOURNMENT","/hansard/chamber.xscript/debate[9]/speech[14]/interjection[2]/talk.start/para","N/A","N/A"
"0","0","0","0","0","0","0","1","CALWELL, Arthur","BV8","N/A","N/A","N/A","33","- Yes, and, what is more important, it holds public sessions, and Parliament is not closed for three months on end as it is here. As a matter of fact in 1940 the House of Commons had 131 sitting days. This Parliament has to go back to the days of the Scullin Government to find a similar record of a ministry facing the House.","N/A","ADJOURNMENT","/hansard/chamber.xscript/debate[9]/speech[14]/continue[2]/talk.start/para","N/A","N/A"
"0","0","0","0","0","0","0","1","CAMERON, Archie","JTY","N/A","N/A","N/A","33","- I do not think that the honorable members party would want to go back to those days.","N/A","ADJOURNMENT","/hansard/chamber.xscript/debate[9]/speech[14]/interjection[3]/talk.start/para","N/A","N/A"
"0","0","0","0","0","0","0","1","CALWELL, Arthur","BV8","N/A","N/A","N/A","33","- If we had more public sessions than we do hold, the ranks of Tuscany would be considerably depleted. The secret meetings which have been held have been farcical, and I reserve to myself the right, as other honorable members do, to decide what I shall do. If I find that I have been summoned to a series pf lectures by a number of Ministers who will read something which has been written for them by someone else I shall know what to do. I wanted the service chiefs to be present so that honorable members could question them in the same way as Ministers and honorable members of the Advisory War Council question them. If they are not present we shall not get very much information. I give place to nobody in this Parliament in my desire to do all that is humanly possible to help this war to a successful conclusion, but equally I give place to nobody in my desire to ensure that the fullest possible information shall be given to the representatives of the people and that more information shall be given to the people in order that they may have more faith in this Parliament than they have disclosed in conversations with honorable members in the streets and at public meetings. There is lack of faith in the capacity of this Parliament, and it has been brought about largely by secrecy and the desire of Ministers to vouchsafe just as little information as they can possibly give.","N/A","ADJOURNMENT","/hansard/chamber.xscript/debate[9]/speech[14]/continue[3]/talk.start/para","N/A","N/A"
"0","0","0","1","0","0","0","1","EVATT, Herbert Vere","DTN","Barton","N/A","N/A","33",".- As I understand it, the Acting Prime Minister (Mr. Fadden) wishes to make important information available to honorable members of this House. The Leader of the Opposition (Mr. Curtin) supports his request. We do not know exactly what the character of the information will be, but the Acting Prime Minister thinks that it should not be given at a public session. If the meeting be held, no member of the House will be under any obligation so far as legal sanction is concerned. But it happens that the Acting Prime Minister wishes to impart to all honorable members information which he thinks is important and should not be disclosed in public. He could pick for the meeting a place which is outside this chamber. He could invite members of this House and the Senate to attend such a meeting. Would there be anything wrong in that? I see no objection. I do not know what the information is to he. I am in the same position as the honorable member for Melbourne (Mr. Calwell), who has had no information in the last three months. Probably we shall be given information as to naval and military matters which cannot be revealed outside. Why should we anticipate what we shall be told? There should be no dispute on the point.The honorable member for Batman (Mr. Brennan) has set out the position accurately. The information which we shall get we can only divulge if one might in honour do so. But I cannot understand the objections raised. One might think that the situation in which Australia and the Empire are placed at the moment is a situation of profound peace. Military, naval and air secrets may be placed at our disposal. Why should the Acting Prime Minister not have the opportunity to place them at our disposal ?","N/A","ADJOURNMENT","/hansard/chamber.xscript/debate[9]/speech[15]/talk.start/para","N/A","N/A"
"0","0","0","0","0","0","0","1","CAMERON, Archie","JTY","N/A","N/A","N/A","34","- Does the honorable member argue that that information should be given at an informal meeting ?","N/A","ADJOURNMENT","/hansard/chamber.xscript/debate[9]/speech[15]/interjection[1]/talk.start/para","N/A","N/A"
"0","0","0","0","0","0","0","1","EVATT, Herbert Vere","DTN","N/A","N/A","N/A","34","- Certainly. If the Acting Prime Minister asked me to attend an informal meeting, I should go, because I should be interested in what was to be said. If he asked me personally to attend a meeting at which information affecting the safety of the realm was to be given, I should go, and if he asked that the information should not be divulged, I should regard that request as binding upon me. Why should we not agree ? The mere fact that this meeting is to be held in this chamber is nothing to the point. No member is bound to attend.","N/A","ADJOURNMENT","/hansard/chamber.xscript/debate[9]/speech[15]/continue[1]/talk.start/para","N/A","N/A"
"0","0","0","0","0","0","0","1","CAMERON, Archie","JTY","N/A","N/A","N/A","34","-1- One honorable member opposite says that he will use his own discretion.","N/A","ADJOURNMENT","/hansard/chamber.xscript/debate[9]/speech[15]/interjection[2]/talk.start/para","N/A","N/A"
"0","0","0","0","0","0","0","1","EVATT, Herbert Vere","DTN","N/A","N/A","N/A","34","- Of course he will. Some information may be trifling and of no value, but we should not assume that it will be, and, therefore, not entitled to secrecy. It comes to this: That the Government wishes to have an opportunity to give information. It has nothing to do with the Advisory War Council. There is an invitation to honorable members to ask questions. Why should we not accept that invitation? Common courtesy demands as much. Is the Government not entitled to have an opportunity for disclosure?","N/A","ADJOURNMENT","/hansard/chamber.xscript/debate[9]/speech[15]/continue[2]/talk.start/para","N/A","N/A"
"0","0","0","0","0","0","0","1","WARD, Edward","KX7","N/A","N/A","N/A","34","- It is not entitled to waste time.","N/A","ADJOURNMENT","/hansard/chamber.xscript/debate[9]/speech[15]/interjection[3]/talk.start/para","N/A","N/A"
"0","0","0","0","0","0","0","1","EVATT, Herbert Vere","DTN","N/A","N/A","N/A","34","- For an hour it has been said that we are not legally bound not to divulge the information which is given to us. True, we need not attend. For myself, I shall attend. I want to hear what information is to be placed at our disposal. If the Government thinks it cannot be divulged to the public, well and good; we shall know at the end of the meeting whether the Governments present view is justified. The honorable member for Martin (Mr. McCall) put his finger on the real point: Why should we now prejudice the position by assuming that the information will be of such a kind that it can be disclosed? We do not know; it is for the Government to say whether it should make the information available to honorable members","N/A","ADJOURNMENT","/hansard/chamber.xscript/debate[9]/speech[15]/continue[3]/talk.start/para","N/A","N/A"
"0","0","0","0","0","0","0","1","CAMERON, Archie","JTY","N/A","N/A","N/A","34","- It is the Governments information.","N/A","ADJOURNMENT","/hansard/chamber.xscript/debate[9]/speech[15]/interjection[4]/talk.start/para","N/A","N/A"
"0","0","0","0","0","0","0","1","EVATT, Herbert Vere","DTN","N/A","N/A","N/A","34","- That is true. But there is the Governments invitation, and why should we not accept it? Speech after speech has been delivered in the same strain and to the same effect. It is true that we will be hound not to divulge military secrets; but why not hear the information, always reserving our rights as representatives of the people, to criticize the Government for wasting time or for requiring us to accept the obligation of secrecy. I cannot understand honorable members who complain of lack of information, of not being consulted, yet reject an invitation of this kind. If anything emerges that may with safety he disclosed, I am sure it will finally be disclosed to the public by the Government.","N/A","ADJOURNMENT","/hansard/chamber.xscript/debate[9]/speech[15]/continue[4]/talk.start/para","N/A","N/A"
"0","0","0","0","0","0","0","1","CALWELL, Arthur","BV8","N/A","N/A","N/A","34","- No satisfactory explanation has been given of the necessity for the holding of this meeting.","N/A","ADJOURNMENT","/hansard/chamber.xscript/debate[9]/speech[15]/interjection[5]/talk.start/para","N/A","N/A"
"0","0","0","0","0","0","0","1","EVATT, Herbert Vere","DTN","N/A","N/A","N/A","34","- It has the authority and the backing of the Leader of the Government and the approval of the Leader of the Opposition. It is an invitation that, in exercising our duty to our constituents, we should accept. The meeting could be held in another way; the House could adjourn, and the Acting Prime Minister could ask those who wish to attend to do so. That is practically what we are invited to do now. Why not adopt that course? We are in the middle of the greatest war in history, and the greatest peril that ever confronted this nation. I .am prepared to attend and listen before 1 give judgment against those who wish to impart this information to us and ask us to keep it secret in the national interest.","N/A","ADJOURNMENT","/hansard/chamber.xscript/debate[9]/speech[15]/continue[5]/talk.start/para","N/A","N/A"
"0","0","0","1","0","0","0","1","HUTCHINSON, William","KIX","Deakin","N/A","N/A","34",". - This Parliament is a democratic institution. Every member of it is for the time being one of the rulers of this nation. It is true that in war-time the Executive has a great deal more power than normally, but it is equally true that, in the long run, this Parliament is the master of the situation. If honorable members are to he able to judge the issues fairly, they must be informed as far as it is possible for them to be informed. We cannot expect to be given information regarding the disposition of our armed forces- or the movements of naval vessels ; but all the information at the disposal of the Government as to the gravity or otherwise of the present situation should be placed before us. Only a few weeks ago the Acting Prime Minister (Mr. Fadden) made a statement to the people of Australia that the situation had drifted to one of the utmost gravity. I am completely ignorant of the reason for that statement.. From my reading of the press I can, of course, as can any other member of the public, place my own interpretation on if, but I do not know what factual information the Government has, and to judge the issues clearly and conscientiously I must be acquainted with all the facts of the situation. I cannot accept the contention thatany honorable member does not want to know the facts. We have the right to know them. I take it that no honorable member is bound to observe complete secrecy about everything he may hear - that must be in the discretion of the honorable member concerned - but if any honorable member, after hearing secret information, should impart facts that would be of value to the enemy, it will be the. duty of the Government to take action against him. Similar restrictions were placed on members of parliament in Great Britain. It is to be assumed that every member of this Parliament is a responsible person, genuine in his desire to procure the safety of the realm ; in order to enable bini to accept the full responsibilities of his office, he should be in possession of all the information that the Government can put before him.","N/A","ADJOURNMENT","/hansard/chamber.xscript/debate[9]/speech[16]/talk.start/para","N/A","N/A"
"0","0","0","1","0","0","0","1","FALSTEIN, Sydney","KEU","Watson","N/A","N/A","35",".- After a recess of three months, it is singular that the Government, with a session o£ four weeks before it, and with only two bills announced, neither of which is yet in- its final form, should occupy the time of the Parliament by spending hours, even days, in discussing allegedly secret reports. On two occasions during the last sittings I asked for a secret sitting of the1 Parliament. A secret sitting, was held, not at my instigation, but at the instigation of the honorable member for. Barker (Mr: Archie Cameron).","N/A","ADJOURNMENT","/hansard/chamber.xscript/debate[9]/speech[17]/talk.start/para","N/A","N/A"
"0","0","0","0","0","0","0","1","CAMERON, Archie","JTY","N/A","N/A","N/A","35","- I did not ask for a secret session.","N/A","ADJOURNMENT","/hansard/chamber.xscript/debate[9]/speech[17]/interjection[1]/talk.start/para","N/A","N/A"
"0","0","0","0","0","0","0","1","FADDEN, Arthur William","F4T","N/A","N/A","N/A","35","- But the honorable member brought it about.","N/A","ADJOURNMENT","/hansard/chamber.xscript/debate[9]/speech[17]/interjection[2]/talk.start/para","N/A","N/A"
