index,question_flag,answer_flag,interjection_flag,speech_flag,petition_flag,quote_flag,motionnospeech_flag,chamber_flag,name,name.id,electorate,party,role,page.no,content,subdebateinfo,debateinfo,path,Speaker,Time
54,0,0,0,1,0,0,0,1,"PAGE, Earle","C7E","N/A","CP","N/A",52,"- Details regarding exports to Great Britain for this, the second meat year of the war, have already been fixed. Total shipments to Great Britain will be approximately 198,000 tons.","PIG MEATS","QUESTIONS","/hansard/chamber.xscript/debate[2]/subdebate.1[22]/answer/talk.start/para","N/A","N/A"
55,0,0,0,1,0,0,0,1,"FRANCIS, Josiah","JWT","N/A","N/A","N/A",52,"- -What is the position of pig meats ?","PIG MEATS","QUESTIONS","/hansard/chamber.xscript/debate[2]/subdebate.1[22]/answer/continue[1]/talk.start/para","N/A","N/A"
56,0,0,0,1,0,0,0,1,"PAGE, Earle","C7E","N/A","N/A","N/A",52,"- All meats are included in that figure. Arrangements were recently made for the shipment of the heavier types of pig carcasses, exceeding 120 lb., then in store. Pigs weighing from 80 lb. to 120 lb. are being accepted for export.","PIG MEATS","QUESTIONS","/hansard/chamber.xscript/debate[2]/subdebate.1[22]/answer/continue[2]/talk.start/para","N/A","N/A"
57,1,0,0,0,0,0,0,1,"MARR, Charles","KMW","N/A","N/A","N/A",52,"- Months ago, a fishing trawler was lost off the coast of New South Wales and members of the crew were drowned. All my representations on behalf of their widows and children who are suffering as the result of the loss of the breadwinners have brought replies from various departments that, because of the omission of one word from the recently amended Australian Soldiers Repatriation Act, the dependants are deprived of repatriation benefits. Will the Prime Minister give urgent consideration to the necessity for amending the act, in order to make those dependants eligible to receive the benefits that it provides?","REPATRIATION BENEFITS","QUESTIONS","/hansard/chamber.xscript/debate[2]/subdebate.1[23]/question/talk.start/para","N/A","N/A"
58,0,0,0,1,0,0,0,1,"MENZIES, Robert","N76","N/A","UAP","N/A",52,"- I shall have the matter examined immediately.","REPATRIATION BENEFITS","QUESTIONS","/hansard/chamber.xscript/debate[2]/subdebate.1[23]/answer/talk.start/para","N/A","N/A"
59,1,0,0,0,0,0,0,1,"CLARK, Joseph","JUQ","N/A","N/A","N/A",53,"- I ask the Minister for Defence Co-ordination whether the report which has appeared in newspapers, purporting to be the report of the Commonwealth Man-power and Resources Survey Committee, recommending that the Government establish a munitions annexe at Broken Hill, is correct? If so, what action does the Government intend to take on that report?","COMMONWEALTH MAN-POWER AND RESOURCES SURVEY COMMITTEE","QUESTIONS","/hansard/chamber.xscript/debate[2]/subdebate.1[24]/question/talk.start/para","N/A","N/A"
60,0,0,0,1,0,0,0,1,"FADDEN, Arthur William","F4T","N/A","CP","N/A",53,"- The subject-matter of the honorable gentlemans question is receiving the consideration of Cabinet.","COMMONWEALTH MAN-POWER AND RESOURCES SURVEY COMMITTEE","QUESTIONS","/hansard/chamber.xscript/debate[2]/subdebate.1[24]/answer/talk.start/para","N/A","N/A"
61,1,0,0,0,0,0,0,1,"FALSTEIN, Sydney","KEU","N/A","N/A","N/A",53,"- In view of the fact that it is now generally recognized that the tragedy which has befallen Europe is in some part owing to the fact that the administration of the domestic and foreign affairs of certain European countries was left in the bands of old men, I ask the Prime Minister whether he will consider the holding of a referendum in conjunction with the next general elections with the object of altering the Constitution to provide that the members of Parliament and federal judges shall be compulsorily retired on their reaching the age of 65 years?","AGE LIMIT FOR MEMBERS OF PARLIAMENT","QUESTIONS","/hansard/chamber.xscript/debate[2]/subdebate.1[25]/question/talk.start/para","N/A","N/A"
62,0,0,0,1,0,0,0,1,"MENZIES, Robert","N76","N/A","UAP","N/A",53,"- The Attorney-General (Mr. Hughes) has agreed to go into conference with me on the matter.","AGE LIMIT FOR MEMBERS OF PARLIAMENT","QUESTIONS","/hansard/chamber.xscript/debate[2]/subdebate.1[25]/answer/talk.start/para","N/A","N/A"
63,1,0,0,0,0,0,0,1,"RIORDAN, William","KZ9","N/A","N/A","N/A",53,"- It was announced in the press that the Government was setting up a committee to inquire into the production of copper sheeting at Mount Morgan. Will the Minister for Supply and Development extend the terms of reference of that committee in order to enable it to inquire into the whole question of the production of copper? Will he also make arrangements for the committee to visit the copper-fields of North Queensland, particularly the Cloncurry and Chillagoe-Etheridge fields ?","COPPER PRODUCTION","QUESTIONS","/hansard/chamber.xscript/debate[2]/subdebate.1[26]/question/talk.start/para","N/A","N/A"
64,0,0,0,1,0,0,0,1,"SPENDER, Percy","KUG","N/A","UAP","N/A",53,"- The committee was set up to go into the whole question of copper production. The detail of the honorable members question I shall communicate to the Minister for Supply and Development so that he can give a further answer to it.","COPPER PRODUCTION","QUESTIONS","/hansard/chamber.xscript/debate[2]/subdebate.1[26]/answer/talk.start/para","N/A","N/A"
65,1,0,0,0,0,0,0,1,"LAZZARINI, Hubert","L07","N/A","N/A","N/A",53,"- Will the Minister for Commerce tell the House what is the method of controlling the supply of greasy wool and skins to fellmongers and wool-scourers in Australia? Can the Minister give any reason why works at Liverpool are threatened to be closed, causing 60 or 70 men to be thrown out of work, because those works cannot obtain any supplies of greasy wool or skins?","WOOL SUPPLIES","QUESTIONS","/hansard/chamber.xscript/debate[2]/subdebate.1[27]/question/talk.start/para","N/A","N/A"
66,0,0,0,1,0,0,0,1,"PAGE, Earle","C7E","N/A","CP","N/A",53,"-Wool for Australian manufacture is dealt with under special terms of the agreement with the British Government, which has purchased the whole of the wool clip. Wool owned by the British Government and outside of the range of those special terms is a matter for the Central Wool Committee and the British Government. The Central Wool Committee, I know from personal investigation, has been in close consultation with the British Government in order to ensure that maximum quantities of wool are available for carbonizing and wool-scouring concerns in Australia. The result has been that in many of the establishments two or three shifts are working at a greater pace than before the war. In the last few weeks, unfortunately, there has not been wool available to the same degree as formerly, with consequent unemployment. The Central Wool Committee is ascertaining to what extent extra wool can be obtained in order to alleviate the position.","WOOL SUPPLIES","QUESTIONS","/hansard/chamber.xscript/debate[2]/subdebate.1[27]/answer/talk.start/para","N/A","N/A"
67,1,0,0,0,0,0,0,1,"WILSON, Alexander","L1L","N/A","N/A","N/A",53,"- I ask the Minister representing the Minister for Supply and Development whether the Government has come to any decision regarding a change of policy in order to effect decentralization of war industries?","DECENTRALIZATION OF WAR INDUSTRIES","QUESTIONS","/hansard/chamber.xscript/debate[2]/subdebate.1[28]/question[1]/talk.start/para","N/A","N/A"
68,0,0,0,1,0,0,0,1,"SPENDER, Percy","KUG","N/A","UAP","N/A",53,"- The policy of the Government has been to decentralize war industries as much as possible. I can obtain details for the honorable member which, I believe, will prove that statement.","DECENTRALIZATION OF WAR INDUSTRIES","QUESTIONS","/hansard/chamber.xscript/debate[2]/subdebate.1[28]/answer[1]/talk.start/para","N/A","N/A"
69,1,0,0,0,0,0,0,1,"PROWSE, John","KYI","N/A","N/A","N/A",54,"- I ask the Minister representing the Minister for Munitions whether, in view of the necessity for an all-in war effort, he will cause an effective survey to be made of machinery available in country towns of substantial size which could be used to augment the production of munition factories in the capital cities? This would tend to decentralize war production.","DECENTRALIZATION OF WAR INDUSTRIES","QUESTIONS","/hansard/chamber.xscript/debate[2]/subdebate.1[28]/question[2]/talk.start/para","N/A","N/A"
70,0,0,0,1,0,0,0,1,"SPENDER, Percy","KUG","N/A","N/A","N/A",54,"- I understand that such a survey is being conducted. I believe that fair progress has been made.","DECENTRALIZATION OF WAR INDUSTRIES","QUESTIONS","/hansard/chamber.xscript/debate[2]/subdebate.1[28]/answer[2]/talk.start/para","N/A","N/A"
71,1,0,0,0,0,0,0,1,"JAMES, Rowland","KJQ","N/A","N/A","N/A",54,"- I ask the Prime Minister when the Government intends to redeem its promise that a munitions factory would be established on the coalfields, in the Hunter electorate? I ask the question for two reasons: first, because our troops overseas are short of equipment; and, secondly, because my stocks are certain to fall if the promise be not honoured. Whereas I am usually unopposed at election time I had an opponent at the last election.","MUNITIONS FACTORY ON COAL-FIELDS","QUESTIONS","/hansard/chamber.xscript/debate[2]/subdebate.1[29]/question/talk.start/para","N/A","N/A"
72,0,0,0,1,0,0,0,1,"MENZIES, Robert","N76","N/A","UAP","N/A",54,"- I shall do my best to see the honorable member through on this matter. I am a little out of touch with the developments, but I shall ascertain the position.","MUNITIONS FACTORY ON COAL-FIELDS","QUESTIONS","/hansard/chamber.xscript/debate[2]/subdebate.1[29]/answer/talk.start/para","N/A","N/A"
73,0,0,0,1,0,0,0,1,"JAMES, Rowland","KJQ","N/A","N/A","N/A",54,"- The right honorable gentleman must be surprised that the factory has not yet been erected.","MUNITIONS FACTORY ON COAL-FIELDS","QUESTIONS","/hansard/chamber.xscript/debate[2]/subdebate.1[29]/answer/continue[1]/talk.start/para","N/A","N/A"
74,0,0,0,1,0,0,0,1,"MENZIES, Robert","N76","N/A","N/A","N/A",54,"- I am. I shall give the honorable member a reply in the morning.","MUNITIONS FACTORY ON COAL-FIELDS","QUESTIONS","/hansard/chamber.xscript/debate[2]/subdebate.1[29]/answer/continue[2]/talk.start/para","N/A","N/A"
75,1,0,0,0,0,0,0,1,"MORGAN, Charles","JVA","N/A","N/A","N/A",54,"- In view of the fact that nearly three months has elapsed since the death of Sir Harry Sheehan, and in view of the importance of the Commonwealth Bank in financing the war, I ask the Treasurer whether the Government is awaiting directions from the private banks before appointing a successor to the deceased Governor of the Commonwealth Bank.","COMMONWEALTH BANK","QUESTIONS","/hansard/chamber.xscript/debate[2]/subdebate.1[30]/question/talk.start/para","N/A","N/A"
76,0,0,0,1,0,0,0,1,"FADDEN, Arthur William","F4T","N/A","CP","N/A",54,"- A successor to the late Sir Harry Sheehan will be appointed in due course.","COMMONWEALTH BANK","QUESTIONS","/hansard/chamber.xscript/debate[2]/subdebate.1[30]/answer/talk.start/para","N/A","N/A"
77,1,0,0,0,0,0,0,1,"CALWELL, Arthur","BV8","N/A","N/A","N/A",54,"- I ask the Minister for Labour and National Service whether it is a fact that a regulation has been gazetted which limits the rights of employees to transfer their employment? If so, will the Minister consider the gazettal of supplementary regulations which forbid employers to dismiss employees without the permission of the Department of Labour and National Service ?","SKILLED WAR WORKERS","QUESTIONS","/hansard/chamber.xscript/debate[2]/subdebate.1[31]/question/talk.start/para","N/A","N/A"
78,0,0,0,1,0,0,0,1,"HOLT, Harold","009MC","N/A","UAP","N/A",54,"- A regulation has been in force for some time restricting the right of employers to engage skilled labour, particularly in the metal trades, if they are not engaged in the manufacture of munitions. Last night an additional regulation was gazetted, the effect of which is that before engaging certain classes of employees an employer engaged in munitions work must register with the Department of Labour and National Service such particulars about the employee, including the name and address of his previous employer, as the Minister specifies. The appropriate labour exchange must be notified by the employer of his intention to engage specified classes of employees. In addition, all employers, whether engaged in munitions work or not, will not be allowed in future to invite applications for employment from the specified classes of employees unless they include in the invitation or advertisement a statement -Applications will not be considered from any person who is engaged in the production, repair, or overhaul of munitions of war, war equipment, or war supplies, unless such person is not actually employed in his usual trade or occupation.The question of limiting the right of employers to dismiss skilled labour in the same classifications is under the consideration of the Department of Labour and National Service at the present time.","SKILLED WAR WORKERS","QUESTIONS","/hansard/chamber.xscript/debate[2]/subdebate.1[31]/answer/talk.start/para","N/A","N/A"
79,1,0,0,0,0,0,0,1,"BREEN, John","JS9","N/A","N/A","N/A",54,"- Can the Minister assist ing the Minister for Commerce tell the House whether arrangements have been made between the New South Wales Apple and Pear Acquisition Committee and some of the growers in that State whereby the orchardists are permitted to repurchase their fruit from the committee? If this be so, is the State committee discriminating between growers from different districts by charging a higher reselling price in some districts than in others?","APPLES AND PEARS","QUESTIONS","/hansard/chamber.xscript/debate[2]/subdebate.1[32]/question/talk.start/para","N/A","N/A"
80,0,0,0,1,0,0,0,1,"ANTHONY, Hubert","JLZ","N/A","CP","N/A",55,"- The New South Wales Apple and Pear Acquisition Committee has made arrangements whereby growers may repurchase their fruit for immediate disposal, but not for coldstorage purposes. I shall have inquiries made in order to ascertain whether there is any discrimination between growers from different districts.","APPLES AND PEARS","QUESTIONS","/hansard/chamber.xscript/debate[2]/subdebate.1[32]/answer/talk.start/para","N/A","N/A"
81,1,0,0,0,0,0,0,1,"WARD, Edward","KX7","N/A","N/A","N/A",55,"- I ask the Attorney-General whether there exists, under the control of his department, a service known as the security service? If so, who are its officers, and what are their duties ?","COMMONWEALTH SECURITY SERVICE","QUESTIONS","/hansard/chamber.xscript/debate[2]/subdebate.1[33]/question/talk.start/para","N/A","N/A"
82,0,0,0,1,0,0,0,1,"HUGHES, William Morris","DQC","N/A","UAP","N/A",55,"- There is such a service. Its duties are such as spring naturally from its designation. The officer in control is Lieutenant-Colonel Longfield Lloyd.","COMMONWEALTH SECURITY SERVICE","QUESTIONS","/hansard/chamber.xscript/debate[2]/subdebate.1[33]/answer/talk.start/para","N/A","N/A"
83,0,0,0,1,0,0,0,1,"MENZIES, Robert","N76","Kooyong","UAP","Prime Minister",55,". - I understand that it is the general wish of honorable members that they be given some opportunity to discuss certain matters privately. Therefore, Mr. Speaker, I direct your attention to the presence of strangers in the House.","N/A","SECRET MEETING OF SENATORS AND MEMBERS","/hansard/chamber.xscript/debate[3]/speech[1]/talk.start/para","N/A","N/A"
84,0,0,0,1,0,0,0,1,"NAIRN, Walter",10000,"N/A","N/A","N/A",55,"-The question is -That strangers be ordered to withdraw.Question resolved in the affirmative.Sitting suspended from 3.15 to 11.21 p.m.Motion (by Mr. Spender) agreed to-That strangers be admitted.","N/A","SECRET MEETING OF SENATORS AND MEMBERS","/hansard/chamber.xscript/debate[3]/speech[2]/talk.start/para","N/A","N/A"
85,0,0,0,0,0,0,0,1,"N/A","N/A","N/A","N/A","N/A","N/A","The following papers were presented : -","N/A","PAPERS","/hansard/chamber.xscript/debate[4]/para[1]","N/A","N/A"
86,0,0,0,0,0,1,0,1,"N/A","N/A","N/A","N/A","N/A","N/A","Holdsworthy Detention Camp - Reports (4) by Inspector-General of Administration, Department of Defence Co-ordination, April, 1941.","N/A","PAPERS","/hansard/chamber.xscript/debate[4]/quote/para","N/A","N/A"
87,0,0,0,0,0,0,0,1,"N/A","N/A","N/A","N/A","N/A","N/A","Commonwealth Public Service Act - Appointment of W. E. Hardman, Department of Commerce.","N/A","PAPERS","/hansard/chamber.xscript/debate[4]/para[2]","N/A","N/A"
88,0,0,0,0,0,0,0,1,"N/A","N/A","N/A","N/A","N/A","N/A","Northern Territory Acceptance Act and Northern Territory (Administration) Act-","N/A","PAPERS","/hansard/chamber.xscript/debate[4]/para[3]","N/A","N/A"
89,0,0,0,0,0,0,0,1,"N/A","N/A","N/A","N/A","N/A","N/A","Ordinances - 1941 -","N/A","PAPERS","/hansard/chamber.xscript/debate[4]/para[4]","N/A","N/A"
90,0,0,0,0,0,0,0,1,"N/A","N/A","N/A","N/A","N/A","N/A","No. 7 - Registration of Births, Deaths and Marriages.","N/A","PAPERS","/hansard/chamber.xscript/debate[4]/para[5]","N/A","N/A"
91,0,0,0,0,0,0,0,1,"N/A","N/A","N/A","N/A","N/A","N/A","No. 8 - Medical Benefits Tax.","N/A","PAPERS","/hansard/chamber.xscript/debate[4]/para[6]","N/A","N/A"
92,0,0,0,0,0,0,0,1,"N/A","N/A","N/A","N/A","N/A","N/A","No. 9 - Medical Benefits and Hospitals.","N/A","PAPERS","/hansard/chamber.xscript/debate[4]/para[7]","N/A","N/A"
93,0,0,0,0,0,0,0,1,"N/A","N/A","N/A","N/A","N/A","N/A","Regulations - 1941 -","N/A","PAPERS","/hansard/chamber.xscript/debate[4]/para[8]","N/A","N/A"
94,0,0,0,0,0,0,0,1,"N/A","N/A","N/A","N/A","N/A","N/A","No. 1 - (Motor Vehicles Ordinance).","N/A","PAPERS","/hansard/chamber.xscript/debate[4]/para[9]","N/A","N/A"
95,0,0,0,0,0,0,0,1,"N/A","N/A","N/A","N/A","N/A","N/A","No. 2 - (Medical Benefits and Hospitals Ordinance).","N/A","PAPERS","/hansard/chamber.xscript/debate[4]/para[10]","N/A","N/A"
96,0,0,0,0,0,0,0,1,"N/A","N/A","N/A","N/A","N/A","N/A","No. 3 - (Medical Benefits Tax Ordinance).","N/A","PAPERS","/hansard/chamber.xscript/debate[4]/para[11]","N/A","N/A"
97,0,0,0,0,0,0,0,1,"N/A","N/A","N/A","N/A","N/A","N/A","No. 5 - (Aboriginals Ordinance).","N/A","PAPERS","/hansard/chamber.xscript/debate[4]/para[12]","N/A","N/A"
98,0,0,0,0,0,0,0,1,"N/A","N/A","N/A","N/A","N/A","N/A","Superannuation Act - Eighteenth Annual","N/A","PAPERS","/hansard/chamber.xscript/debate[4]/para[13]","N/A","N/A"
99,0,0,0,0,0,0,0,1,"N/A","N/A","N/A","N/A","N/A","N/A","Report of the Superannuation Board, for year 1939-40.","N/A","PAPERS","/hansard/chamber.xscript/debate[4]/para[14]","N/A","N/A"
100,0,0,0,0,0,0,0,0,"N/A","N/A","N/A","N/A","N/A","N/A","The following answers to questions were circulated: -","N/A","ANSWERS TO QUESTIONS","/hansard/answers.to.questions/debate/para","N/A","N/A"
101,0,0,0,1,0,0,0,0,"MORGAN, Charles","JVA","N/A","N/A","N/A",55,"asked the Minister for Commerce, upon notice -In view of the necessity for conservation of oil supplies and lowering of running costs, will the Government, following the example of other countries in this regard, give encouragement to the use of diesel oil engines?","Petrol Rationing: Diesel Oil Engines","ANSWERS TO QUESTIONS","/hansard/answers.to.questions/debate/subdebate.1[1]/question/talk.start/para","N/A","N/A"
102,0,0,0,1,0,0,0,0,"PAGE, Earle","C7E","N/A","CP","N/A",55,"- The provision of fuel oil supplies requires the use of tankers and overseas funds just as motor spirit does, and our present difficulties concerning fuel stocks are due to the nonavailability of tankers. Stocks of diesel oil fuel have been built up on the basis of normal uses of that fuel, and no trouble has been experienced so far in maintaining stocks for those uses. If, however, any extensive new uses were encouraged, it would have to be at the expense and to the detriment of present uses, for which no ready substitute is available, since it is not possible to increase our imports of diesel fuel. For these reasons, it would not be desirable at this stage to advocate a more extensive use of diesel oil engines, even if they could be obtained, which is doubtful.","Petrol Rationing: Diesel Oil Engines","ANSWERS TO QUESTIONS","/hansard/answers.to.questions/debate/subdebate.1[1]/answer/talk.start/para","N/A","N/A"
103,0,0,0,1,0,0,0,0,"CALWELL, Arthur","BV8","N/A","N/A","N/A",56,"asked the Minister representing the Minister for the Interior, upon notice -What is the estimated cost of the construction of a railway line between Canberra and Yass, in the State of New South Wales?Has a preliminary survey of the route been made?In view of the great economic value of such a railway to the people domiciled on the Monaro tableland and the South Coast of New South Wales, will the Government open up discussions with the Government of New South Wales on the question of its construction ?","Yass-Canberra Railway","ANSWERS TO QUESTIONS","/hansard/answers.to.questions/debate/subdebate.1[2]/question/talk.start/para","N/A","N/A"
104,0,0,0,1,0,0,0,0,"COLLINS, Thomas","K0D","N/A","CP","N/A",56,"- The Minister for the Interior has supplied the following answers : -The last estimate showed that the cost of a railway would amount to £971,100. This estimate was based on certain recommendations by the Parliamentary Standing Committee on Public Works, which had previously considered and reported on the proposal (Parliamentary Paper No. 70 of 1924). The estimate of £971,100 is made up as under -N/AYes.Not in existing circumstances.","Yass-Canberra Railway","ANSWERS TO QUESTIONS","/hansard/answers.to.questions/debate/subdebate.1[2]/answer/talk.start/para","N/A","N/A"
105,0,0,0,1,0,0,0,0,"MAKIN, Norman","KLL","N/A","N/A","N/A",56,"asked the Minister representing the Minister for the Interior, upon notice -What is the total number of buildings being rented by the Commonwealth in each of the capital cities?What is the total floor space and the total amount being paid for such premises?","Commonwealth Departmental Office Accommodation","ANSWERS TO QUESTIONS","/hansard/answers.to.questions/debate/subdebate.1[3]/question/talk.start/para","N/A","N/A"
106,0,0,0,1,0,0,0,0,"COLLINS, Thomas","K0D","N/A","CP","N/A",56,"- The information is being obtained.","Commonwealth Departmental Office Accommodation","ANSWERS TO QUESTIONS","/hansard/answers.to.questions/debate/subdebate.1[3]/answer/talk.start/para","N/A","N/A"
107,0,0,0,1,0,0,0,0,"CALWELL, Arthur","BV8","N/A","N/A","N/A",56,"asked the Prime Minister, upon notice -How many officers have been appointed to the Commonwealth Public Service under section 36a of the Commonwealth Public Service Act?What are (a) their names, (b) the dates of their appointments, (c) the salaries at which they were appointed, (d) the salaries they are at present receiving, (e) their official designations, and (f) the departments to which they are at present attached?","Commonwealth Public Service: Appointments","ANSWERS TO QUESTIONS","/hansard/answers.to.questions/debate/subdebate.1[4]/question/talk.start/para","N/A","N/A"
108,0,0,0,1,0,0,0,0,"MENZIES, Robert","N76","N/A","UAP","N/A",56,"- The information is being obtained, and will be furnished to the honorable member as soon as possible.","Commonwealth Public Service: Appointments","ANSWERS TO QUESTIONS","/hansard/answers.to.questions/debate/subdebate.1[4]/answer/talk.start/para","N/A","N/A"
109,0,0,0,1,0,0,0,0,"MARTENS, George","KMZ","N/A","N/A","N/A",56,"asked the Minister representing the Minister for the Interior, upon notice -Have any passports been issued to enemy aliens to enable them to leave Australia since the outbreak of the war?If so, how many have been issued, and what is the nationality of the persons to whom the passports were issued?","Enemy Aliens : Departure from Australia; Issue of Passports.","ANSWERS TO QUESTIONS","/hansard/answers.to.questions/debate/subdebate.1[5]/question/talk.start/para","N/A","N/A"
110,0,0,0,1,0,0,0,0,"COLLINS, Thomas","K0D","N/A","CP","N/A",56,"- The Minister for the Interior has supplied the following answers : -Passports are not issued by the Commonwealth authorities to aliens, but all aliens, including enemy aliens, require to have either national passports or some document of identity which must be endorsed by the Commonwealth authorities in accordance with the requirements of the National Security (Passport) Regulations before the holders can leave the Commonwealth. No passport facilities have been given for any enemy aliens to leave the Commonwealth unless it was first ascertained from the competent military authorities that there was no objection to their departure.Up to 30th April, 1941, the number of enemy alien residents of Australia of German nationality who left the Commonwealth since the outbreak of war with Germany was 53; and the number of Italians who left Australia since the outbreak of war with Italy was ten.","Enemy Aliens : Departure from Australia; Issue of Passports.","ANSWERS TO QUESTIONS","/hansard/answers.to.questions/debate/subdebate.1[5]/answer/talk.start/para","N/A","N/A"
