index,question_flag,answer_flag,interjection_flag,speech_flag,petition_flag,quote_flag,motionnospeech_flag,chamber_flag,name,name.id,electorate,party,role,page.no,content,subdebateinfo,debateinfo,path,Speaker,Time
111,0,0,0,1,0,0,0,0,"CALWELL, Arthur","BV8","N/A","N/A","N/A",56,"asked the Prime Minister, upon notice -Is it a fact that from January of this year till the present sittings the Senate has sat for only 38½ hours and the House of Representatives for only 74¼ hours?Is it a fact that the expenditure on parliamentary allowances including salaries for the presiding officers, for the period 1st January to 31st May of this year, is approximately £16,000 for the Senate and £32,000 for the House of Representatives?Is it a fact that in the same period Ministers will have drawn approximately £8,375 additional as salaries?Is it a fact that such brief meetings of Parliament in the past five months and at a cost of approximately £56,000 in salaries and allowances to parliamentarians alone, do not conduce to a proper appreciation of our democratic institutions by the general public?","Commonwealth Parliament : Sittings ; Expenditure","ANSWERS TO QUESTIONS","/hansard/answers.to.questions/debate/subdebate.1[6]/question/talk.start/para","N/A","N/A"
112,0,0,0,1,0,0,0,0,"MENZIES, Robert","N76","N/A","UAP","N/A",57,"- The answers to the honorable members questions are as follows : -The sitting hours of the Senate and the House of Representatives during the parliamentary sittings held earlier this year (covering the period 12th March to 3rd April inclusive) are as stated by the honorable member.Yes.Yes.The general public is well aware that Parliament is in session as frequently as is necessary in the light of all the circumstances. The honorable member, moreover, overlooks the fact that members of Parliament are paid not only for their attendance in Parliament but also for their continuing responsibility to, and their work in the interests of, the public.","Commonwealth Parliament : Sittings ; Expenditure","ANSWERS TO QUESTIONS","/hansard/answers.to.questions/debate/subdebate.1[6]/answer/talk.start/para","N/A","N/A"
113,0,0,0,1,0,0,0,0,"BARNARD, Herbert","JNX","N/A","N/A","N/A",57,"asked the Minister representing the Minister for the Interior, upon notice -What funds were available for the last financial year for the home-building Loan scheme in the Australian Capital Territory?What funds have been made available for this financial year?Will funds be available for the 1841-42 financial year; if so, will the amount compare favorably with former years?Have tenders been accepted for the twenty cottages which were the balance of the 35 originally advertised?Has construction been commenced on the five cottages to be built by day labour?","Canberra : Housing","ANSWERS TO QUESTIONS","/hansard/answers.to.questions/debate/subdebate.1[7]/question/talk.start/para","N/A","N/A"
114,0,0,0,1,0,0,0,0,"COLLINS, Thomas","K0D","N/A","CP","N/A",57,"- The Minister for the Interior has supplied the following answers : -£70,000.£40,000.Financial arrangements for 1941-42 have not yet been finally determined, but it is anticipated that substantial provision will be made.Yes.Yes.","Canberra : Housing","ANSWERS TO QUESTIONS","/hansard/answers.to.questions/debate/subdebate.1[7]/answer/talk.start/para","N/A","N/A"
115,0,0,0,1,0,0,0,0,"GUY, James Allan","KFW","N/A","N/A","N/A",57,"asked the Minister for Commerce, upon notice -Is there provision in any agreement providing for a depot in each State where supplies of sugar must be kept; if so, is it a fact that no such depot exists in Tasmania and that the small stocks of sugar held in that State is causing great concern?","Sugar: Storage in Tasmania.","ANSWERS TO QUESTIONS","/hansard/answers.to.questions/debate/subdebate.1[8]/question/talk.start/para","N/A","N/A"
116,0,0,0,1,0,0,0,0,"PAGE, Earle","C7E","N/A","FSU; CP from 1920","N/A",57,"-Arrangements have been made with the Australian sugar industry to place emergency supplies of sugar in all States. The Commonwealth Government is now discussing with the Government of Tasmania proposals recently made regarding the sharing of liabilities due to guarantees given to the Commonwealth Bank in connexion with the financial stability of persons and firms actually holding stocks of sugar.","Sugar: Storage in Tasmania.","ANSWERS TO QUESTIONS","/hansard/answers.to.questions/debate/subdebate.1[8]/answer/talk.start/para","N/A","N/A"
117,0,0,0,1,0,0,0,0,"GUY, James Allan","KFW","N/A","N/A","N/A",57,"asked the Minister represent ing the Postmaster-General, upon notice -In order to assist and improve educational facilities in Australia, will the Postmaster-General take the necessary action to relieve all schools throughout the Commonwealth from payment of wireless licence-fees where any wireless receiving set is used solely for educational purposes?","Wireless Broadcasting : Licence-fees; Exemption of Schools.","ANSWERS TO QUESTIONS","/hansard/answers.to.questions/debate/subdebate.1[9]/question/talk.start/para","N/A","N/A"
118,0,0,0,1,0,0,0,0,"COLLINS, Thomas","K0D","N/A","CP","N/A",57,"- The Postmaster-General has supplied the following answers: -The exemption of schools from the payment of broadcast listeners licence-fees has been sympathetically considered on many occasions in conjunction with numerous other requests for a similar concession on behalf of charitable institutions, pensioners, &c. In view, however, of the administrative difficulties which would be involved the Government has decided that the only exemption from payment of the fee shall be in respect of blind persons.","Wireless Broadcasting : Licence-fees; Exemption of Schools.","ANSWERS TO QUESTIONS","/hansard/answers.to.questions/debate/subdebate.1[9]/answer/talk.start/para","N/A","N/A"
119,0,0,0,1,0,0,0,0,"LANGTRY, Joseph","KZN","N/A","N/A","N/A",57,"asked the Treasurer, upon notice -Why werethe proposals for the establishment of a mortgage bank shelved for such a long period previous to the outbreak of war?Is it a fact that over two years elapsed between the unanimous recommendation of the Banking Commission, in favour of the establishment of a mortgage bank, and the outbreak of war?Is it a fact that the Bank of International Settlement was established with a capital of only one American dollar?Is subscribed capital an essential condition for the establishment of a mortgage bank?","MORTGAGE BANK.","ANSWERS TO QUESTIONS","/hansard/answers.to.questions/debate/subdebate.1[10]/question/talk.start/para","N/A","N/A"
120,0,0,0,1,0,0,0,0,"FADDEN, Arthur William","F4T","N/A","CP","N/A",58,"- The answers to the honorable members questions are as follows : -A bill to amend the Commonwealth Bank Act to provide for the establishment of a mortgage bank department was introduced on the 25th November, 1938, and the bill reached the second-reading stage. Some delay was caused by the necessity to examine issues raised by institutions and interests directly affected by the proposals. Before this examination was completed the Government was engaged upon urgent legislation made necessary by the rapidly worsening international position which culminated in the outbreak of war in September, 1939.Yes.No.It is improbable that a mortgage bank without subscribed capital would be able to borrow the funds necessary to enable it to make loans on mortgages.","MORTGAGE BANK.","ANSWERS TO QUESTIONS","/hansard/answers.to.questions/debate/subdebate.1[10]/answer/talk.start/para","N/A","N/A"
121,0,0,0,1,0,0,0,0,"FADDEN, Arthur William","F4T","N/A","CP","N/A",58,"- Yesterday the honorable member for Melbourne (Mr. Calwell) asked the following question, upon notice -How much of the total loan raisings of the Commonwealth Government for war purposes (including war and works loans) consists of (a) loans at interest, (b) loans without interest, and (c) gifts?The answer to the honorable members question is as follows: -The total loan raisings of the Commonwealth in Australia for war purposes by way of public flotation or acceptance of interest-free loans we: -","Commonwealth Loans","ANSWERS TO QUESTIONS","/hansard/answers.to.questions/debate/subdebate.1[11]/question/talk.start/para","N/A","N/A"
122,0,0,0,1,0,0,0,0,"FADDEN, Arthur William","F4T","N/A","CP","N/A",58,"- Yesterday, the honorable member for Melbourne (Mr. Calwell) asked the following question, upon notice -In order to encourage the capitalist class generally to make some sacrifice for the all-in war effort, will he indicate the names of those persons or firms that have contributed £500 or more, showing the exact amount in each instance, as (a) gifts, and (b) loans without interest, to the several war loans floated to date?The answer to the honorable members question is as follows: -Amounts of £500 or more contributed as loans without interest or as gifts to assist the war effort total -N/ATo indicate the individual amounts and the names of persons or firms who have made these 2,888 contributions would involve a volume of work which could not) be justified at the present juncture. Many of the contributors have requested that their contributions should remain anonymous.","War Finance : Gifts and Interest-free Loans","ANSWERS TO QUESTIONS","/hansard/answers.to.questions/debate/subdebate.1[12]/question/talk.start/para","N/A","N/A"
123,0,0,0,1,0,0,0,0,"CALWELL, Arthur","BV8","N/A","N/A","N/A",58,"asked the Prime Minister, upon notice -How many meetings of (a) the Cabinet, (b) the War Cabinet, and (c) the Advisory War Council have been held in Canberra, Melbourne, Sydney, Brisbane, Adelaide, Perth and Hobart, respectively, since the outbreak of war to the 21st April, 1941 ?What is the total number of meetings held under (a), (b) and (c), respectively, In the same period?","Meetings of Cabinet, War Cabinet and Advisory War Council","ANSWERS TO QUESTIONS","/hansard/answers.to.questions/debate/subdebate.1[13]/question/talk.start/para","N/A","N/A"
124,0,0,0,1,0,0,0,0,"MENZIES, Robert","N76","N/A","UAP","N/A",58,"- The answers to the honorable members questions are as follows :Full Cabinet meetings, 2nd September, 1939, to 21st April, 1941 - Canberra, 64; Sydney, 20; Melbourne, 34; Brisbane, nil; Adelaide, nil; Perth, nil; Hobart, nil; Total, 118.War Cabinet meetings, 27th September, 1939, to 21st April, 1941-Canberra, 36; Sydney, 14; Melbourne, 73; Brisbane, 1; Adelaide, nil; Perth, nil; Hobart, nil; Total, 124.Advisory War Council meetings, 29th October, 1940, to 21st April, 1941 - Canberra, 10; Sydney, 4; Melbourne, 14; Brisbane, nil; Adelaide, nil; Perth, nil; Hobart, nil; Total, 28.","Meetings of Cabinet, War Cabinet and Advisory War Council","ANSWERS TO QUESTIONS","/hansard/answers.to.questions/debate/subdebate.1[13]/answer/talk.start/para","N/A","N/A"
125,0,0,0,1,0,0,0,0,"CALWELL, Arthur","BV8","N/A","N/A","N/A",58,"asked the Attorney-General, upon notice -What acts of the Commonwealth Parliament provide power for the Governor -General to make regulations?","Governor-General: Power to make Regulations.","ANSWERS TO QUESTIONS","/hansard/answers.to.questions/debate/subdebate.1[14]/question/talk.start/para","N/A","N/A"
126,0,0,0,1,0,0,0,0,"HUGHES, William Morris","DQC","N/A","UAP","N/A",58,"- Practically all machinery acts of the Commonwealth Parliament contain provisions giving power to the Governor-General to make regulations. The section giving this power is usually the last section in the act.","Governor-General: Power to make Regulations.","ANSWERS TO QUESTIONS","/hansard/answers.to.questions/debate/subdebate.1[14]/answer/talk.start/para","N/A","N/A"
