"question_flag","answer_flag","interjection_flag","speech_flag","petition_flag","quote_flag","motionnospeech_flag","chamber_flag","name","name.id","electorate","party","role","page.no","content","subdebateinfo","debateinfo","path","Speaker","Time"
"0","0","0","1","0","0","0","1","CALWELL, Arthur","BV8","N/A","N/A","N/A","21","- If it be decided to hold another secret session of both Houses of this Parliament, will the Acting Prime Minister arrange for the presence of the service chiefs of the Navy, Army and Air Force in order that honorable members may question them on matters relating to the defence of this country in particular and the progress of Australias war effort in general ?","SECRET SESSION","QUESTIONS","/hansard/chamber.xscript/debate[7]/subdebate.1[19]/question/talk.start/para","N/A","N/A"
"0","0","0","1","0","0","0","1","FADDEN, Arthur William","F4T","N/A","CP","N/A","21","- No.","SECRET SESSION","QUESTIONS","/hansard/chamber.xscript/debate[7]/subdebate.1[19]/answer/talk.start/para","N/A","N/A"
"0","0","0","1","0","0","0","1","FALSTEIN, Sydney","KEU","N/A","N/A","N/A","21","- I ask the Attorney-General if it is a fact that a New Zealand subsidiary of the Sydney firm known as Schering Proprietary Limited has been declared, after a thorough examination of all relevant facts by the New Zealand Government, to be an enemy trader? Does the Minister intend that the parent company in Sydney shall be allowed to continue its operations?","ENEMY TRADERS","QUESTIONS","/hansard/chamber.xscript/debate[7]/subdebate.1[20]/question/talk.start/para","N/A","N/A"
"0","0","0","1","0","0","0","1","HUGHES, William Morris","DQC","N/A","UAP","N/A","21","- If the honorable gentleman will provide me with the facts to which he refers I shall give him an answer; I am not in a position to answer offhand. I do not know whether the firm mentioned is an enemy trader or not, and I am not aware of any firm or person carrying on business that calls for interference by my department.","ENEMY TRADERS","QUESTIONS","/hansard/chamber.xscript/debate[7]/subdebate.1[20]/answer/talk.start/para","N/A","N/A"
"0","0","0","1","0","0","0","1","BLAIN, Adair","JPT","N/A","N/A","N/A","21","- In view of my representations to the Prime Minister (Mr. Menzies) last session to have £5,000 set aside for air raid precaution work in Darwin, I now ask the Acting Prime Minister if he can assure the House that the proximity of Darwin to foreign countries has not been overlooked by the Commonwealth Government, and that sufficient money is available for the construction of tunnels to shelter Darwin residents?","DARWIN AIR-RAID PRECAUTIONS","QUESTIONS","/hansard/chamber.xscript/debate[7]/subdebate.1[21]/question/talk.start/para","N/A","N/A"
"0","0","0","1","0","0","0","1","FADDEN, Arthur William","F4T","N/A","CP","N/A","22","- In my capacity as Treasurer I can assure the honorable member that Darwins needs have not been forgotten.","DARWIN AIR-RAID PRECAUTIONS","QUESTIONS","/hansard/chamber.xscript/debate[7]/subdebate.1[21]/answer/talk.start/para","N/A","N/A"
"0","0","0","1","0","0","0","1","MCCALL, William","KOQ","N/A","N/A","N/A","22","- I ask the Minister for External Affairs if it is a fact that in order to foster friendly relations between the United States of America and Australia an official invitation has been issued to Mr. Wendell Willkie to visit this country?","INVITATION TO MR. WENDELL WILLKIE","QUESTIONS","/hansard/chamber.xscript/debate[7]/subdebate.1[22]/question/talk.start/para","N/A","N/A"
"0","0","0","1","0","0","0","1","STEWART, Frederick","KV7","N/A","UAP","N/A","22","- Yes. A final answer to the invitation has not yet been received.","INVITATION TO MR. WENDELL WILLKIE","QUESTIONS","/hansard/chamber.xscript/debate[7]/subdebate.1[22]/answer/talk.start/para","N/A","N/A"
"0","0","0","1","0","0","0","1","BREEN, John","JS9","N/A","N/A","N/A","22","- Will the Minister representing the Minister for Supply and Development take steps to find out whether Army contractors are having difficulty in obtaining supplies of dried fruits, particularly prunes? If he learns that difficulty is not being experienced, will he consult with the Minister for Commerce and recommend to that honorable gentleman that the regulations prohibiting the export of dried fruits be repealed ?","SUPPLIES OF DRIED FRUITS","QUESTIONS","/hansard/chamber.xscript/debate[7]/subdebate.1[23]/question/talk.start/para","N/A","N/A"
"0","0","0","1","0","0","0","1","SPENDER, Percy","KUG","N/A","UAP","N/A","22","- I shall give full consideration to the subject-matter of the honorable members question.","SUPPLIES OF DRIED FRUITS","QUESTIONS","/hansard/chamber.xscript/debate[7]/subdebate.1[23]/answer/talk.start/para","N/A","N/A"
"0","0","0","1","0","0","0","1","DEDMAN, John","KCF","N/A","N/A","N/A","22","- I ask the Minister representing the Minister for Repatriation a question which arises from the following statement published in the Melbourne Age: -Unless the injury or death of a soldier in Australia is directly attributable to war service, neither he nor his dependants are entitled to a military pension. A ruling to that effect was given to the Victorian branch of the Returned Soldiers League by the Solicitor-General, through the Minister of Repatriation (Senator McLeay). The decision affects every member of the Australian Imperial Force in Australia and also men voluntarily enlisted for home defence for the duration of the war. It was sought by the Returned Soldiers League, as the result of an accident in which four soldiers were killed while returning from leave in an army truck.","AUSTRALIAN IMPERIAL FORCE","QUESTIONS","/hansard/chamber.xscript/debate[7]/subdebate.1[24]/question[1]/talk.start/para","N/A","N/A"
"0","0","0","1","0","0","0","1","SPEAKER, Mr","10000","N/A","N/A","N/A","22","- I remind the honorable member that the reading of lengthy extracts from newspapers is not permitted when a question is being asked; he may summarize the statement if he wishes to base a question upon it.","AUSTRALIAN IMPERIAL FORCE","QUESTIONS","/hansard/chamber.xscript/debate[7]/subdebate.1[24]/answer[1]/talk.start/para","N/A","N/A"
"0","0","0","1","0","0","0","1","DEDMAN, John","KCF","N/A","N/A","N/A","22","- The statement relates to a ruling given by the Solicitor-General after four soldiers travelling in a military transport vehicle were killed en route to their camp at Seymour. Does the Minister intend to have the Australian Soldiers Repatriation Act amended so that, in cases of this kind, full compensation will be paid to the men concerned or their dependants?","AUSTRALIAN IMPERIAL FORCE","QUESTIONS","/hansard/chamber.xscript/debate[7]/subdebate.1[24]/question[2]/talk.start/para","N/A","N/A"
"0","0","0","1","0","0","0","1","HOLT, Harold","009MC","N/A","UAP","N/A","22","- I shall bring the matter to the notice of the Minister for Repatriation and see if I can obtain an answer for the honorable member.","AUSTRALIAN IMPERIAL FORCE","QUESTIONS","/hansard/chamber.xscript/debate[7]/subdebate.1[24]/answer[2]/talk.start/para","N/A","N/A"
"0","0","0","1","0","0","0","1","MCLEOD, Donald","KSD","N/A","N/A","N/A","22","- Will the Minister for the Army state whether or not it is a fact that the wife and dependent children of a soldier are not eligible for the increased rate of allowance to dependants of the Australian Imperial Force if the wife has a court order against her husband ?","AUSTRALIAN IMPERIAL FORCE","QUESTIONS","/hansard/chamber.xscript/debate[7]/subdebate.1[24]/question[3]/talk.start/para","N/A","N/A"
"0","0","0","1","0","0","0","1","SPENDER, Percy","KUG","N/A","UAP","N/A","22","- This question has been raised more than once. Originally, when a wife was issued with a court order against her husband, who might have been unemployed or earning very little at the time when the order was made, the Army officer dealing with the matter took the view, quite erroneously in my opinion, that the order determined the amount of allowance to be made to the wife. A number of honorable members, including the honorable member for East Sydney (Mr. Ward), brought the matter to my attention, and as the result of their representations I gave a direction that a court order should not be used other than as a guide in determining the rate of allowance to be made. If the soldier was not in employment at the time when the order was made, it would be disregarded altogether.","AUSTRALIAN IMPERIAL FORCE","QUESTIONS","/hansard/chamber.xscript/debate[7]/subdebate.1[24]/answer[3]/talk.start/para","N/A","N/A"
"0","0","0","1","0","0","0","1","SCULLY, William","KQB","N/A","N/A","N/A","22","- Following the advice of the chairman of the Wheat Industry Stabilization Board to wheat-growers that they should proceed with normal sowings of wheat this season, will the Minister for Commerce consider the withdrawal, or the suspension for this season at least, of the wheat stabilization regulations concerning the restriction of acreage, in order to allow wheat-farmers to escape the irksome and irritating conditions which such regulations impose?","WHEAT INDUSTRY","QUESTIONS","/hansard/chamber.xscript/debate[7]/subdebate.1[25]/question/talk.start/para","N/A","N/A"
"0","0","0","1","0","0","0","1","PAGE, Earle","C7E","N/A","CP","N/A","23","- The reason why the wheat-farmers are asked to register this year is that the department may be enabled to control next years harvest, which is the one in connexion with which the wheat stabilization plan will operate for the benefit of farmers. In order to make certain that there will be the least possible hardship inflicted on farmers this year, the Wheat Industry Stabilization Board is dealing with the matter with some elasticity.","WHEAT INDUSTRY","QUESTIONS","/hansard/chamber.xscript/debate[7]/subdebate.1[25]/answer/talk.start/para","N/A","N/A"
"0","0","0","1","0","0","0","1","DRAKEFORD, Arthur","KCM","N/A","N/A","N/A","23","- Can the Minister for Labour and National Service say whether his department is taking any steps to have the shortage of housing for munition workers in the vicinity of the Maribyrnong establishments remedied, and if so, have such steps gone beyond the stage of a preliminary inquiry? Will be arrange for the officers investigating the matter to confer, as early as possible, with representatives of the municipalities in and near to which the munition establishments are located in order to obtain their advice and assistance as to suitable cheap land which is known to be available in the vicinity, and their aid in obtaining the early construction of the necessary acfcommodation?","HOUSING: MUNITION WORKERS AND AIR FORCE PERSONNEL","QUESTIONS","/hansard/chamber.xscript/debate[7]/subdebate.1[26]/question[1]/talk.start/para","N/A","N/A"
"0","0","0","1","0","0","0","1","HOLT, Harold","009MC","N/A","UAP","N/A","23","- The Government recently secured the services of Mr. H. H. Brodie, who was formerly secretary of the Homes for Unemployed Trust in New South Wales, to investigate the alleged shortage of housing accommodation for munition workers who are engaged on government projects. Mr. Brodie has already made a full investigation of conditions at Glen Davis, and has carried out some investigations of conditions at Lithgow. Following his inquiries, a project is now in course of development for the erection of a number of houses at Glen Davis, and plans are well advanced for the production of a certain amount of accommodation at Lithgow. He has also made a preliminary survey of housing needs in the neighbourhood of the establishments at Footscray, and I expect that he will be in Melbourne again early next week, when he can carry his inquiries further. He has had some contact with officials of the Footscray Municipal Council. The honorable members suggestion that he should confer with representatives of other councils in the neighbourhood of munitions establishments in Victoria, will be favorably considered.","HOUSING: MUNITION WORKERS AND AIR FORCE PERSONNEL","QUESTIONS","/hansard/chamber.xscript/debate[7]/subdebate.1[26]/answer[1]/talk.start/para","N/A","N/A"
"0","0","0","1","0","0","0","1","FRANCIS, Josiah","JWT","N/A","N/A","N/A","23","- In view of the fact that Mr. Brodie is engaged on an investigation of the housing conditions at Glen Davis, Lithgow, Footscray and Maribyrnong, will the Minister for the Air consider the representations that I have already made to him, in connexion with the problem of accommodating the personnel associated with the Royal Australian Air Force Aerodrome at Amberley, near Ipswich? Will the Minister obtain from the Minister for Labour and National Service authority for Mr. Brodie to conduct a. similar examination at Ipswich, Queensland?","HOUSING: MUNITION WORKERS AND AIR FORCE PERSONNEL","QUESTIONS","/hansard/chamber.xscript/debate[7]/subdebate.1[26]/question[2]/talk.start/para","N/A","N/A"
"0","0","0","1","0","0","0","1","MCEWEN, John","009MB","N/A","CP","N/A","23","- I shall be glad to consult with my colleague with a view to considering the possibility of taking action along the lines suggested.","HOUSING: MUNITION WORKERS AND AIR FORCE PERSONNEL","QUESTIONS","/hansard/chamber.xscript/debate[7]/subdebate.1[26]/answer[2]/talk.start/para","N/A","N/A"
"0","0","0","1","0","0","0","1","PRICE, John","KYH","N/A","ALP; UAP from 1931","N/A","23","- Can the Minister for Social Services say whether, when he visited South Australia recently, he inquired into the operations of the Housing Trust in that State? If so, has he anything to report to this House in connexion with tha.t inquiry?","HOUSING: MUNITION WORKERS AND AIR FORCE PERSONNEL","QUESTIONS","/hansard/chamber.xscript/debate[7]/subdebate.1[26]/question[3]/talk.start/para","N/A","N/A"
"0","0","0","1","0","0","0","1","STEWART, Frederick","KV7","N/A","UAP","N/A","23","- It is true that last week I visited Adelaide, primarily for the purpose of inspecting the work that has been done by the South Australian Housing Trust in providing houses at cheap rents. I was greatly impressed with the development of the work there, and I hope that what I gleaned will be a useful contribution towards the information which I have been gathering throughout Australia in connexion with the housing problem.","HOUSING: MUNITION WORKERS AND AIR FORCE PERSONNEL","QUESTIONS","/hansard/chamber.xscript/debate[7]/subdebate.1[26]/answer[3]/talk.start/para","N/A","N/A"
"0","0","0","1","0","0","0","1","MORGAN, Charles","JVA","N/A","N/A","N/A","23","- Following his recent trip to Palestine, the Minister for the Army (Mr. Spender) announced that he was satisfied that the Australian troops in the Middle East were now adequately equipped. I now ask him what was the position, as regards the equipment of the troops, during the first six months after their arrival in the Middle East, as, according to authentic reports which have since come to hand, they were left there for approximately six months in a practically defenceless state through lack of armoured equipment?","EQUIPMENT OF AUSTRALIAN IMPERIAL FORCE","QUESTIONS","/hansard/chamber.xscript/debate[7]/subdebate.1[27]/question[1]/talk.start/para","N/A","N/A"
"0","0","0","0","0","0","0","1","SPEAKER, Mr","10000","N/A","N/A","N/A","24","- Order!","EQUIPMENT OF AUSTRALIAN IMPERIAL FORCE","QUESTIONS","/hansard/chamber.xscript/debate[7]/subdebate.1[27]/question[1]/continue/talk.start/para","N/A","N/A"
"0","0","0","1","0","0","0","1","MORGAN, Charles","JVA","N/A","N/A","N/A","24","- Has the Minister called for a report as to who was responsible for such shocking neglect of our troops; if so, will he table the report?","EQUIPMENT OF AUSTRALIAN IMPERIAL FORCE","QUESTIONS","/hansard/chamber.xscript/debate[7]/subdebate.1[27]/question[2]/talk.start/para","N/A","N/A"
"0","0","0","1","0","0","0","1","SPENDER, Percy","KUG","N/A","UAP","N/A","24","- In the first place, I challenge the honorable member to produce any authentic statement to the effect that our troops were left practically defenceless. Such an allegation is almost wholly untrue. It is true that when the troops were sent there some of them had training equipment only. The details of that matter will be given to Parliament in a statement which will be submitted at a later stage. But to allege in the terms that the honorable member has used that the troops were left defenceless for six months is to do a disservice to the country. The allegation is not true.","EQUIPMENT OF AUSTRALIAN IMPERIAL FORCE","QUESTIONS","/hansard/chamber.xscript/debate[7]/subdebate.1[27]/answer/talk.start/para","N/A","N/A"
"0","0","0","1","0","0","0","1","RANKIN, George","K2A","N/A","N/A","N/A","24","- In view of the issue of a booklet by the Defence Department in which is pointed out the importance of the proper fitting of boots, will the Minister for the Army say whether he approves of the issue of second-hand boots - boots which have been worn by other men - to trainees who have been called up under the compulsory provisions of the Defence Act?","ARMY BOOTS","QUESTIONS","/hansard/chamber.xscript/debate[7]/subdebate.1[28]/question/talk.start/para","N/A","N/A"
"0","0","0","1","0","0","0","1","SPENDER, Percy","KUG","N/A","UAP","N/A","24","- If particulars are supplied to me, I shall have inquiries made into the matter referred to by the honorable member. I understand that on some occasions boots which have been worn for short periods have been re-conditioned and re-issued; if that can be called issuing second-hand boots, the answer in in the affirmative. I see no objection to that being done.","ARMY BOOTS","QUESTIONS","/hansard/chamber.xscript/debate[7]/subdebate.1[28]/answer/talk.start/para","N/A","N/A"
"0","0","0","1","0","0","0","1","WARD, Edward","KX7","N/A","N/A","N/A","24","- Can the Acting Prime Minister say whether the Government has recently received any instructions from Lady Blarney?","LADY BLAMEY","QUESTIONS","/hansard/chamber.xscript/debate[7]/subdebate.1[29]/question[1]/talk.start/para","N/A","N/A"
"0","0","0","1","0","0","0","1","FADDEN, Arthur William","F4T","N/A","CP","N/A","24","- The answer to the honorable members question is  No .","LADY BLAMEY","QUESTIONS","/hansard/chamber.xscript/debate[7]/subdebate.1[29]/answer[1]/talk.start/para","N/A","N/A"
"0","0","0","1","0","0","0","1","CALWELL, Arthur","BV8","N/A","N/A","N/A","24","- Will the Acting Prime Minister say who was the Minister responsible for issuing authority to Lady Blarney to leave Australia? Does the Government intend to remove that Minister from office? Will the Leader of the House present to this Parliament a report setting out all the circumstances in which a passport was issued to Lady Blarney? Will he say whether any other applications for passports to wives of members of the Australian Imperial Force have been made, and if so whether they were approved or refused; and whether the policy followed in respect of Lady Blarney is to operate in respect of relatives of other members of the Australian Imperial Force who may wish to proceed overseas?","LADY BLAMEY","QUESTIONS","/hansard/chamber.xscript/debate[7]/subdebate.1[29]/question[2]/talk.start/para","N/A","N/A"
"0","0","0","1","0","0","0","1","FADDEN, Arthur William","F4T","N/A","N/A","N/A","24","- The War Cabinet, not any individual Minister, gave permission for Lady Blarney to leave Australia, and the issue of a passport to her by the appropriate Minister was with the consent of the War Cabinet.","LADY BLAMEY","QUESTIONS","/hansard/chamber.xscript/debate[7]/subdebate.1[29]/answer[2]/talk.start/para","N/A","N/A"
"0","0","0","0","0","0","0","1","SPEAKER, Mr","10000","N/A","N/A","N/A","24","- Order ! These interjections prevent proper answers to questions being given, and I therefore appeal to honorable members to allow questions to be answered without interruption.","LADY BLAMEY","QUESTIONS","/hansard/chamber.xscript/debate[7]/subdebate.1[29]/continue/talk.start/para","N/A","N/A"
"0","0","0","1","0","0","0","1","FADDEN, Arthur William","F4T","N/A","N/A","N/A","24","- I intend to give a frank and straightforward reply to the honorable members question. The War Cabinet gave permission for Lady Blarney to leave Australia, and subsequently a passport was issued to her by the appropriate Minister. No individual Minister was responsible for issuing the passport. Subsequently the fullCabinet considered that the War Cabinet had made a mistake in allowing Lady Blarney to leave Australia, and, therefore, decided to request her to return home. That was done. Lady Blarney is a resident of Australia who has been given a passport, and she is standing on her legal rights.","LADY BLAMEY","QUESTIONS","/hansard/chamber.xscript/debate[7]/subdebate.1[29]/answer[3]/talk.start/para","N/A","N/A"
"0","0","0","1","0","0","0","1","FADDEN, Arthur William","F4T","N/A","CP","N/A","25","- Ministers will not answer any further questions without notice to-day.","QUESTIONS WITHOUT NOTICE","QUESTIONS","/hansard/chamber.xscript/debate[7]/subdebate.1[30]/question/talk.start/para","N/A","N/A"
"0","0","0","0","0","0","0","1","N/A","N/A","N/A","N/A","N/A","N/A","Motion (by Mr. Fadden) agreed to -","N/A","ORDER OF BUSINESS","/hansard/chamber.xscript/debate[8]/para","N/A","N/A"
"0","0","0","0","0","1","0","1","N/A","N/A","N/A","N/A","N/A","N/A","That, unless otherwise ordered, Government business shall, on each day of sitting, have precedence of all other business, except on that Thursday on which, under the provisions of Standing Order No. 241, the question is put  That Mr. Speaker do now leave the chair . On such Thursday, general business shall have precedence of Government business until 9 oclock p.m.","N/A","ORDER OF BUSINESS","/hansard/chamber.xscript/debate[8]/quote/para","N/A","N/A"
"0","0","0","0","0","0","0","1","N/A","N/A","N/A","N/A","N/A","N/A","Secret Meeting of Senators and Members - Broken Hill Proprietary Company Limited: Capital IssueShipbuilding - Australianimperial Force : Equipment - Unemployment in Hunter Electorate.","N/A","ADJOURNMENT","/hansard/chamber.xscript/debate[9]/para","N/A","N/A"
"0","0","0","1","0","0","0","1","FADDEN, Arthur William","F4T","Darling Downs","CP","Acting Prime Minister","25",". - I move -That the House do now adjourn.I invite honorable members and senators to meet in this chamber immediately after the adjournment of the House. I do so for the purpose of presenting at a secret meeting an outline of the international position, and of what we are doing and have already done by way of defence preparation in Australia, so that honorable members shall be fully conversant with the situation as the Government and the War Advisory Council see it. I shall present a statement to the meeting, and statements will also be made by the Minister for External Affairs (Sir Frederick Stewart), the Minister for the Army (Mr. Spender), the Minister for the Navy (Mr. Hughes), the Minister for Air (Mr. McEwen) and the Minister for Munitions (Senator McBride). It is desired that the position shall be clearly presented to members of Parliament, who are looked upon as national trustees for the people. The subjects discussed in these statements will be open to debate and question, and I hope that there will be full and frank discussion in the course of which doubts and misunderstandings will be removed, so that we may put forward a united effort in the best interests of Australia.","N/A","ADJOURNMENT","/hansard/chamber.xscript/debate[9]/speech[1]/talk.start/para","N/A","N/A"
"0","0","0","1","0","0","0","1","WARD, Edward","KX7","East Sydney","N/A","N/A","25",". - I should like to obtain some information from the Acting Prima Minister in regard to the matters which are to be discussed at the secret meeting of members. I can understand that the reports of Ministers in charge of the fighting services may contain matters which must necessarily remain confidential. However, at a previous secret meeting, members introduced subjects which, in my opinion, and in the opinion of other honorable members, could quite well have been debated in open parliament. This afternoon, the honorable member for Batman (Mr. Brennan) asked a question of the Acting Prime Minister, who replied by saying that he would make a statement later. He meant, I take it, that he would make a statement on the subject at the secret meeting of members. For my part, I can see no reason why such a question should not be answered in open parliament. I do not feel disposed to attend a. secret meeting if its purpose is to prevent criticism of the Government or of individual Ministers. I have no objection to such a meeting if it is to confine its attention to statements by Ministers in charge of the services on matters which obviously should be confidential, such as the disposition of the Forces, but if its purpose is to enable Ministers to answer in secret questions such as that asked by the honorable member for Batman, I assure the Acting Prime Minister that I do not want to be associated with it.","N/A","ADJOURNMENT","/hansard/chamber.xscript/debate[9]/speech[2]/talk.start/para","N/A","N/A"
