index,question_flag,answer_flag,interjection_flag,speech_flag,petition_flag,quote_flag,motionnospeech_flag,chamber_flag,name,name.id,electorate,party,role,page.no,content,subdebateinfo,debateinfo,path,Speaker,Time
1,0,0,0,0,0,0,0,1,"N/A","N/A","N/A","N/A","N/A","N/A","Mr. Speaker (Hon. W. M. Nairn) took the chair at 3 p.m., and read prayers.","N/A","N/A","/hansard/chamber.xscript/business.start/para","N/A","N/A"
2,0,0,0,1,0,0,0,1,"CURTIN, John","009FQ","Fremantle","ALP","Prime Minister",4,"I moveThat the following resolution be transmitted through His Excellency the Governor-General to His Majesty the King: - We, the members of the House of Representatives in the Parliament of the Commonwealth of Australia, record our sorrow at the death of His Royal Highness the Duke of Kent, and express our profound sympathy in the great loss whichYour Majesty, Her Royal Highness the Duchess of Kent and her children, Her Majesty Queen. Mary, the other members of the Royal Family, and the people »f the United Kingdom have sustained.Honorable members will know that His Royal Highness was killed in an air accident in the north of Scotland on the 25th August, 1942, while on his way to Iceland on active service duty as Air Commodore attached to the staff of the Inspector-General of the Royal Air Force.Australians, in common with the other peoples of the British Commonwealth of Nations, have followed the career of the Duke of Kent with marked interest; particularly has this been so since His Majestys choice of the Duke as Governor-General designate of this country. We feel very deeply for Her Royal Highness the Duchess of Kent and her children, who have sustained such a great personal loss - a loss which is shared by Their Majesties the King and Queen, Her Majesty Queen Mary, and the other members of the Royal Family.In the countries of the British Commonwealth and in the countries of our allies, there will be widespread sympathy for the members of the British Royal Family, whose ready acceptance of all the risks attendant upon war conditions has given us such an inspiring example in our war tasks.I know that the terms of the resolution express the feelings of every member of this House.","N/A",">DEATH OF HIS ROYAL HIGHNESS THE DUKE OF KENT","/hansard/chamber.xscript/debate[1]/speech[1]/talk.start/para","N/A","N/A"
3,0,0,0,1,0,0,0,1,"FADDEN, Arthur William","F4T","Darling Downs","N/A","N/A",15,"- I second the motion. I share with the right honorable the Prime Minister feelings of profound regret at the untimely death of His Royal Highness the Duke of Kent - death in such tragic circumstances, that it came as a severe shock to the peoples of all the democratic nations of the world. It has caused a feeling of deep sorrow in Australia because, but for the outbreak of war, the Duke of Kent would now have been in this country as Governor-General of the Commonwealth. Australians, who looked forward to welcoming His Royal Highness to this country with the coming of peace, now mourn his passing. They also pay homage to a distinguished member of the Royal Family who lost his life in theservice of the Empire. They will cherish the memory of one who, like so many of their own countrymen, and the bravo airmen of the allied nations, met his death while on a war mission to which he had been assigned.Like the other members of the Royal Family, the Duke of Kent shared the dangers of war. He gave his life, as others have given their lives, in order that liberty and freedom may prevail.The Opposition expresses its sympathy with their Majesties the King and Queen, the Duchess of Kent and her children, Her Majesty Queen Mary, and the other members of the Royal Family, in the great loss that they have suffered.Question resolved in the affirmative, honorable members standing in their places.","N/A",">DEATH OF HIS ROYAL HIGHNESS THE DUKE OF KENT","/hansard/chamber.xscript/debate[1]/speech[2]/talk.start/para","N/A","N/A"
4,0,0,0,0,0,0,0,1,"N/A","N/A","N/A","N/A","N/A","N/A","Motion (by Mr. Curtin) agreed to -","N/A","SPECIAL ADJOURNMENT","/hansard/chamber.xscript/debate[2]/para","N/A","N/A"
5,0,0,0,0,0,1,0,1,"N/A","N/A","N/A","N/A","N/A","N/A","That the House, at its rising, adjourn to 7.30 p.m. this day.","N/A","SPECIAL ADJOURNMENT","/hansard/chamber.xscript/debate[2]/quote/para","N/A","N/A"
6,0,0,0,1,0,0,0,1,"CURTIN, John","009FQ","Fremantle","ALP","Prime Minister",16,". - As a mark of respect to the memory of the Duke of Kent, I move -That the House do now adjourn.Question resolved in the affirmative.House adjourned at 3.7 p.m.","N/A","ADJOURNMENT","/hansard/chamber.xscript/debate[3]/speech/talk.start/para","N/A","N/A"
7,0,0,0,1,0,0,0,1,"CURTIN, John","009FQ","Fremantle","ALP","Prime Minister",17,". - It is with deep regret that I inform honorable members of the death of the Honorable Richard Beaumont Orchard, C.B.E., a former member of the House of Representatives, and - a Minister of the Crown, who passed away at Sydney on the 24th July. 1942. This sad event has removed from his family, and from a large circle of friends, a man who had for many years been associated with the public affairs of this country.Mr. Orchard was elected to the House of Representatives for Nepean, New South Wales, at the general election in 1913 and was re-elected in 1914 and 1917. He was a member of the Federal Parliamentary Recruiting Committee in 1917-18, and in his capacity of an Assistant Minister from March, 1918, ho was specially in charge of recruiting. He visited England at the invitation of the United Kingdom branch of the Empire Parliamentary Association in 1916. He resigned ministerial office on the 31st January, 1919, and retired on the expiration of the seventh Parliament in 1919.Apart from his notable work in connexion with the campaign for recruits for the Australian Imperial Force during the last war, into which he threw all his enthusiasm and organizing ability, he will be principally remembered for his work as a member of the Australian Broadcasting Commission from the 26th May, 1932, until the 31st December, 1939. He was specially fitted for the duties associated with the functions of the Broadcasting Commission by virtue of his special interest in, and knowledge of, music and drama.His widow and family will find consolation in the knowledge that he rendered fine service to his country, and earned the highest respect of his fellow men. I move -That this House records its sincere regret at the death of the Honorable Richard Beaumont Orchard, C.B.E., a former member of the House of Representatives for the Division of Nepean and a Minister of the Crown, places on record its appreciation of his meritorious public Bervice, and tenders its deep sympathy to his widow and family in their bereavement.","N/A","DEATH OF THE HONORABLE RICHARD BEAUMONT ORCHARD. C.B.E","/hansard/chamber.xscript/debate[4]/speech[1]/talk.start/para","N/A","N/A"
8,0,0,0,1,0,0,0,1,"HUGHES, William Morris","DQC","North Sydney","N/A","N/A",17,"- I second the motion, and desire to associate myself and my colleagues of the Opposition with the Prime Ministers expression of regret at the death of the Honorable R. B. Orchard and of deep sympathy with his widow and family in their bereavement. I knew the late Mr. Orchard well, and I entertained for him high esteem and warm regard. We were fellow members in this Parliament, and colleagues in the Government during the war of 1914-18 and in the post-war years. He was a man of fine character, upright and honorable. He was an excellent organizer and administrator, and as Minister in Charge of Recruiting rendered valuable service to the Commonwealth during a period of intense strain. It may be truly said of him that he was a man who loved his fellow men, for he devoted his life to their service, and was ever active in all movements designed to improve the conditions and promote the welfare of his fellow citizens. He met life with a smile. He went about cheering people up with friendly speech, with music and song, and he gave generously to those in need. He was a lovable man and thousands of people whose necessities he relieved, whose downcast spirits he cheered, will deeply mourn his loss. I sincerely regret his death, and extend my heartfelt sympathy to his widow and family in their bereavement.Question resolved in the affirmative, honorable members standing in their places.","N/A","DEATH OF THE HONORABLE RICHARD BEAUMONT ORCHARD. C.B.E","/hansard/chamber.xscript/debate[4]/speech[2]/talk.start/para","N/A","N/A"
9,0,0,0,1,0,0,0,1,"CURTIN, John","009FQ","Fremantle","ALP","Prime Minister",18,". - With deep regret I inform honorable members of the death of the Honorable James Newton Haxton Hume-Cook, a former member of the Mouse of Representatives and a Minister of the Crown, who passed away at Melbourne on the 7th August, 1942. The late honorable gentleman also had the distinction of being a member of the first Commonwealth Parliament; of those who shared that honour, very few remain. He served his parliamentary apprenticeship as a member of the Legislative Assembly in Victoria, to which he was elected in September, 1894, to represent East Bourke Boroughs, which seat he held until November, 1900, when he was defeated. At the general election in 1901, he was elected to the House of Representatives for Bourke, Victoria, and he was reelected in 1 903 and 1906. He became whip to the first Deakin Ministry, and served as a member of the Select Committee on Decimal Coinage in 1901. He was appointed an honorary Minister from the 28th January, 1903, to the 12th November, 1906. He was chairman of the Royal Commission on Postal Services 1908-10 - until December, 1908, when he resigned his seat on the commission. He was defeated at the general election in 1910.The late honorable gentlemanwas born in New Zealand, and as ayouth migrated to Victoria. At an early age he took an active interest in local government matters, and after a period of service in the Victorian State legislature, transferred his activities to the Commonwealth sphere on the establishment of federation.Although it is more than 30 years since Mr. Hume-Cook sat in this Parliament, his name has stood out prominently during the intervening period in connexion with many public movements. He was closely associated with the Australian Natives Association, and the Australian Industries Protection League, through both of which organizations he worked with enthusiasm and energy towards the advancement of Australia, and the prosperity of its people. These labours made a material contribution to the development of Australian industries. The deceased gentleman also took an active part in the administration of a number of societies established for the health and social welfare of the people. He gave unsparingly of his time and labour over a long period in the service of his country. I move - flint this House records its sincere regret at the death of the Honorable James Newton Haxton Hume-Cook, a former member of the House of Representatives for the Division of Bourke, a member of the First Commonwealth Parliament and a Minister of the Crown, places on record its appreciation of his meritorious public service, and tenders its deep sympathy to his widow and family in their bereavement.","N/A","DEATH OF THE HONORABLE JAMES NEWTON HAXTON HUME-COOK","/hansard/chamber.xscript/debate[5]/speech[1]/talk.start/para","N/A","N/A"
10,0,0,0,1,0,0,0,1,"HUGHES, William Morris","DQC","North Sydney","N/A","N/A",18,"- I second the motion, and desire to associate myself and my colleagues with the Prime Minister in expressing regret at the death of Mr. Hume-Cook, and nf deep sympathy with his widow and family in their bereavement. The late Mr. Hume-Cook was my friend - and our friendship, extending over 40 years and ripening as the years went by, remained unbroken to the end. He was, like myself, a member of the first Commonwealth Parliament, and remained a member until 1910. He had sat in the State Parliament of Victoria, where he had made for himself a reputation as a first-class debater, with a wide knowledge of public affairs. In the Commonwealth Parliament he proved that this reputation was well deserved.He spoke well and clearly, developed his arguments logically, and pressed his pointshome. As an organizer and administrator he took high rank. A master of detail, he had a range of outlook that enabled him to deal with matters in their broadest aspects. He believed in Australia, and was never tired of chanting its praises and advancing its interests. He was a life member of the Australian Natives Association, and until his death was one of the leaders of its governing council. He was a fearless champion of Australian industries. From his earliest years in public life he devoted himself to their development. For many years he was the secretary of the Australian Industries Protection League - an organization established to promote the interests of Australian secondary industries. He was a prolific writer on all subjects relating to. the expansion of Australian industries, and their present proud position is in no small degree due to his untiring labours. During his term of parliamentary life, I learned to know and to esteem him, and in later years, when our relations became still more intimate, to look upon him as a dear friend. The news of his death was to me a severe blow, and leaves me to mourn a man for whom I had conceived a sincere affection. To his wife and family I extend my deep sympathy.Question resolved in the affirmative. honorable members standing in their places.","N/A","DEATH OF THE HONORABLE JAMES NEWTON HAXTON HUME-COOK","/hansard/chamber.xscript/debate[5]/speech[2]/talk.start/para","N/A","N/A"
11,0,0,0,1,0,0,0,1,"CURTIN, John","009FQ","Fremantle","ALP","Prime Minister",19,". - by leave - Honorable members will. I am sure wish me to welcome back to the Parliament the Eight Honorable the Attorney-General (Dr. Evatt), who undertook a mission, on behalf of the Government, of the utmost importance to lbc Commonwealth. Dr. Evatt proceeded to the United States of America, and to the United Kingdom, in both of which countries he most capably represented Australian opinion on the conduct of the war. and worked indefatigably for the solution of our problems, and the filling of our requirements. During his stayin the United Kingdom, the was the accredited representative of the CommonwealthGovernment at meetings of the War Cabinet and the Pacific War Council.","N/A","RE TURN OF DR. EVATT","/hansard/chamber.xscript/debate[6]/speech/talk.start/para","N/A","N/A"
12,0,0,0,1,0,0,0,1,"CURTIN, John","009FQ","Fremantle","ALP","Prime Minister",19,". - by leave - Honorable members will, I am sure join with me in expressing our pleasure in the safe return to Australia and to the Parliament of the right honorable member for Cowper (Sir Earle Page), and in his restoration to health. In order that his knowledge and experience gained as a special representative of the Commonwealth on the British War Cabinet and the Pacific War Council in London may be available in dealing with the conduct of the war, Sir Earle Page will act as a co-opted member of the Australian Advisory War Council, and will attend meetings of the War Cabinet when it is considered that his advice will be of value.","N/A","RETURN OF SIR EARLE PAGE","/hansard/chamber.xscript/debate[7]/speech[1]/talk.start/para","N/A","N/A"
13,0,0,1,0,0,0,0,1,"CAMERON, Archie","JTY","Barker","ALP","Minister for Aircraft Production",19,"- Will the Prime Minister move that this statement be printed, as there are certain things 1 should like to say regarding it ?","N/A","RETURN OF SIR EARLE PAGE","/hansard/chamber.xscript/debate[7]/speech[1]/interjection[1]/talk.start/para","N/A","N/A"
14,0,0,0,1,0,0,0,1,"CURTIN, John","009FQ","N/A","N/A","N/A",19,"- I shall answer the honorable members question to-morrow.","N/A","RETURN OF SIR EARLE PAGE","/hansard/chamber.xscript/debate[7]/speech[1]/continue[1]/talk.start/para","N/A","N/A"
15,0,0,1,0,0,0,0,1,"CAMERON, Archie","JTY","N/A","N/A","N/A",19,"- Then I propose to move that the statement of the Prime Minister be printed, and to ask leave to continue my remarks later.","N/A","RETURN OF SIR EARLE PAGE","/hansard/chamber.xscript/debate[7]/speech[1]/interjection[2]/talk.start/para","N/A","N/A"
16,0,0,0,1,0,0,0,1,"CURTIN, John","009FQ","N/A","N/A","N/A",19,"- I did not table any paper.","N/A","RETURN OF SIR EARLE PAGE","/hansard/chamber.xscript/debate[7]/speech[1]/continue[2]/talk.start/para","N/A","N/A"
17,0,0,0,1,0,0,0,1,"NAIRN, Walter",10000,"N/A","N/A","N/A",19,"-No paper has been tabled.","N/A","RETURN OF SIR EARLE PAGE","/hansard/chamber.xscript/debate[7]/speech[2]/talk.start/para","N/A","N/A"
18,0,0,0,1,0,0,0,1,"CAMERON, Archie","JTY","N/A","N/A","N/A",19,"- This matter is of the utmost importance to the House, and no matter what the supporters of the Government may think about it, there are certain things which I want to say on the subject. In view of the extraordinary circumstances, I ask the Prime Minister to be good enough to move that the statement which he has just read regarding the right honorable member for Cowper (Sir Earle Page) be printed.","N/A","RETURN OF SIR EARLE PAGE","/hansard/chamber.xscript/debate[7]/speech[2]/continue[1]/talk.start/para","N/A","N/A"
19,0,0,0,1,0,0,0,1,"CURTIN, John","009FQ","N/A","N/A","N/A",19,"- I told the honorable member that I would answerhis question to-morrow.","N/A","RETURN OF SIR EARLE PAGE","/hansard/chamber.xscript/debate[7]/speech[2]/continue[2]/talk.start/para","N/A","N/A"
20,0,0,0,1,0,0,0,1,"CAMERON, Archie","JTY","N/A","N/A","N/A",19,"- I accept that assurance for the time being.","N/A","RETURN OF SIR EARLE PAGE","/hansard/chamber.xscript/debate[7]/speech[2]/continue[3]/talk.start/para","N/A","N/A"
21,0,0,0,0,0,0,0,1,"N/A","N/A","N/A","N/A","N/A","N/A","Messages reported transmitting Estimates of Revenue and Expenditure and Estimates of Expenditure for Additions, New Works, Buildings, &c, for the year ending the 30th June, 1943, and recommending appropriations accordingly.","N/A","ESTIMATES 1942-43","/hansard/chamber.xscript/debate[8]/para[1]","N/A","N/A"
22,0,0,0,0,0,0,0,1,"N/A","N/A","N/A","N/A","N/A","N/A","Ordered to be printed, and referred to Committee of Supply forthwith.","N/A","ESTIMATES 1942-43","/hansard/chamber.xscript/debate[8]/para[2]","N/A","N/A"
23,0,0,0,1,0,0,0,1,"CHIFLEY, Ben","A48","Macquarie","ALP","Treasurer",20,". - To-day completes the third year of the most momentous war in all history. It is not merely a conflict between peoples; it is a clash between principles. We fight to assert, the democratic life of personal liberty against the living death of a -totalitarian system which enslaves the individual to party dictators. We fight to prevent the vast spiritual, social, political, economic and industrial progress achieved in past centuries from being thrown back into the chaos of a new kind of barbarism.Our effort is rising to new heights and is becoming worthy of the great cause. This budget epitomizes that effort in facts and figures. These are eloquent. But behind them is something vastly more- eloquent, vastly more precious - the spiritual zeal of our people, the readiness to sacrifice money, good*, labour and even life itself, as needed and when needed, to uphold the faith that is in us.The year just ended brought t.o us a new and nearer menace. We responded with a new and mightier effort - crystallized in the expansion of war expenditure from £170,000,000 in 1940-41 to almost double that amount last year. For the current year a further enormous increase is inevitable. Security reasons prevent me from giving in detail exactly what that means in the number of fighting men to be paid, equipped, fed and transported. But T can say that our fighting forces now exceed anything that we ever thought possible, and that our army of war workers behind those fighting men has risen to heights which seemed impossible. In our direct war effort we have more than three times n* much man-power as we had at any time in the last war. We are still expanding and this huge budget provides for payment of the financial price of that expansion.","In Committee of Supply:","BUDGET 1942-43","/hansard/chamber.xscript/debate[9]/subdebate.1[1]/speech/talk.start/para","N/A","N/A"
24,0,0,1,0,0,0,0,1,"SPENDER, Percy","KUG","N/A","N/A","N/A",27,"- How much of the £300,000,000 does the Treasurer expect to get by ordinary loan?","Budget Summary 1942-43","BUDGET 1942-43","/hansard/chamber.xscript/debate[9]/subdebate.1[18]/interjection/talk.start/para","N/A","N/A"
25,0,0,0,1,0,0,0,1,"CHIFLEY, Ben","A48","N/A","ALP","N/A",27,"- At least £200,000,000. To show the comparison of normal transactions more clearly, I have omitted from both revenue and expenditure of 1942-43 an amount of £27,174,000 which is to be collected and paid to the States under the uniform tax plan and, together with an estimated £6,315,000 of outstanding States taxes to be collected, will bring the payments to the States under that plan to the statutory figure of approximately £33,489,000.That the first item in the Estimates under division 1 - The Senate - namely,  Salaries and Allowances - £ 8,660 be agreed to.","Budget Summary 1942-43","BUDGET 1942-43","/hansard/chamber.xscript/debate[9]/subdebate.1[18]/speech/talk.start/para","N/A","N/A"
26,0,0,0,0,0,0,0,1,"N/A","N/A","N/A","N/A","N/A","N/A","The following paper was presented : -","N/A","PAPER","/hansard/chamber.xscript/debate[10]/para[1]","N/A","N/A"
27,0,0,0,0,0,1,0,1,"N/A","N/A","N/A","N/A","N/A","N/A","The Budget 1942-43. - Papers presented by the Honorable J. B.Chifley, M.P., for the information of honorable members on the occasion of the Budget of 1942-43.","N/A","PAPER","/hansard/chamber.xscript/debate[10]/quote/para","N/A","N/A"
28,0,0,0,0,0,0,0,1,"N/A","N/A","N/A","N/A","N/A","N/A","Ordered to be printed.","N/A","PAPER","/hansard/chamber.xscript/debate[10]/para[2]","N/A","N/A"
29,0,0,0,1,0,0,0,1,"BEASLEY, John","JOM","West Sydney","ALP","Minister for Supply and Development",34,". - I move - [Customs Tariff Amendment (No. 8).]That the Schedule to the Customs Tariff 1933-1939, as proposed to be amended by Customs Tariff Proposals introduced into the House of Representatives on the fifth day of March, One thousand nine hundred and forty-two, be further amended as hereinafter set out, and that on and after the third day of September, One thousand nine hundred and forty-two, at nine oclock in the forenoon, reckoned according to standard time in the Australian Capital Territory, Duties of Customs be collected in pursuance of the Customs Tariff 1933-1939 as so amended.N/AN/AN/AImpost Duties - continued.N/A[Excise Tariff Amendment (No. 7).]That theSchedule to the Excise Tariff 1921-1939, as proposed to be amended by Excise Tariff Proposals, be farther amended as hereinafter set out, and that on and after the third day of September, One thousand nine hundred and forty-two, atnine oclock in the forenoon, reckoned according to standard time in the Australian Capital Territory, duties of Excise be collected in pursuance of the Excise Tariff 1921-1939 as so amended.That, where any goods specified in Item 1 hereinafter -were manufactured or produced in Australia before that date ; andwere, on that date, subject to the control of the Customs or to Excise supervision, or in the stock, custody or possession of, or belonged to, any brewer thereof, and duties of Excise were paid thereon before that date, additional duties of Excise be collected thereon equal to the amount (if any) by which the duties of Excise so paid are less than the duties of Excise which would be payable thereon if the duties of Excise had not been so paid.That in this Resolution  Excise Tariff Proposals  mean the Excise Tariff Proposals introduced into the House of Representatives on the following dates, namely : - 5th March, 1942 ; and 25th March, 1942.N/AExcise Duties - continued.N/AN/AThe tariff proposals that I have just introduced set out the individual increases in customs and excise duties, which the Treasurer in his budget speech has indicated should yield a total increase of revenue of £12,000,000 in the remaining ten months of the current financial year, or an increase of £14,200,000 in a full financial year based on estimates of revenue previously submitted to the Treasury. The Treasurer has also stated the need for additional revenue.The resolutions provide for the following increases of customs and excise duties : -Ale, beer, Ac. -1s. 7d. per gallon.Spirituous liquors - 15s. 6d. per gallon.Tobacco, manufactured - 2s. 8d. per lb.Cigarettes - 8s. per lb.Cigars -11s. 4d. per lb.Playing cards - 8s. per dozen packs.Matches - 4s. per gross boxes of 60 matches.The increases of duties have been so calculated that the whole of the amount paid by the public in increased prices as a result of the additional duties will be returned to the Commonwealth Treasury.The customs duties have been increased only to preserve the existing margin between customs and excise duties, and have little revenue significance, as importation of the goods on which higher duties have been imposed is restricted under the Customs (Import Licensing)Regulations. The increased revenue yield is therefore expected almost solely from excise duties.The only other item affected by the resolutions is customs item 370, wherein provision has now been made for goods, the property of the Commonwealth, irrespective of the manner in which they are used, to be admitted free of duty, when, in the opinion of the Minister for Trade and Customs, on declaration by the Comptroller-General, it is in the national interest to do so.Progress reported.","In Committee of Ways and Means:","TARIFF PROPOSALS 1942","/hansard/chamber.xscript/debate[11]/subdebate.1[2]/speech/talk.start/para","N/A","N/A"
