index,question_flag,answer_flag,interjection_flag,speech_flag,petition_flag,quote_flag,motionnospeech_flag,chamber_flag,name,name.id,electorate,party,role,page.no,content,subdebateinfo,debateinfo,path,Speaker,Time
174,0,0,0,0,0,0,0,1,"N/A","N/A","N/A","N/A","N/A","N/A","Debate resumed from the 28thFebruary (vide page 564, Volume No. 216), on motion by Mr. Townley -","N/A","WAR SERVICE HOMES","/hansard/chamber.xscript/debate[22]/para[1]","N/A","N/A"
175,0,0,0,0,0,1,0,1,"N/A","N/A","N/A","N/A","N/A","N/A","That the following paper be printed: - War Service Homes - Ministerial statement.","N/A","WAR SERVICE HOMES","/hansard/chamber.xscript/debate[22]/quote[1]/para","N/A","N/A"
176,0,0,0,1,0,0,0,1,"EVATT, Herbert Vere","DTN","Barton","N/A","Leader of the Opposition",46,". - On the last occasion that this matter was before the House I had practically concluded what I had to say. The Minister for Social Services (Mr. Townley), who administers the War Service Homes Act stated that after a certain date assistance to returned servicemen in respect of existing homes will not be continued. Although he later announced a modification in the case of existing contracts for such homes, the broad principle of the Governments action in this matter is as I have stated. The honorable member for Lalor (Mr. Pollard) dealt with this subject from the point of view of the Opposition, but to give the House an opportunity to express its opinion of the principle involved in the statement of the Minister, I move -That the following words be added to the motion : -  and this House expresses the opinion that the Government should arrange to continue and fully maintain assistance under the War Service Homes Act for the purpose of enabling servicemen to purchase an existing home .","N/A","WAR SERVICE HOMES","/hansard/chamber.xscript/debate[22]/speech[1]/talk.start/para","N/A","N/A"
177,0,0,1,0,0,0,0,1,"CALWELL, Arthur","BV8","N/A","N/A","N/A",46,"-i second the amendment.","N/A","WAR SERVICE HOMES","/hansard/chamber.xscript/debate[22]/speech[1]/interjection/talk.start/para","N/A","N/A"
178,0,0,0,1,0,0,0,1,"POLLARD, Reginald","KYC","Lalor","N/A","N/A",46,".- The subject-matter of the debate at the moment is of profound importance to the returned servicemen of Australia. It follows upon the action of the Government in November last when it introduced legislation to amend the War Service Homes Act. During the course of the debate on that occasion it was revealed that, among other purposes, the amendment was designed to increase the amount of the advance that might be obtained by applicants for war service homes, but only in respect of homes which the War Service Homes Division was able to build or proposed to build; it denied financial assistance to those ex-servicemen who were able to negotiate privately with a contractor, or the owner of a new home or an old home. Previously, it had been the practice of all governments to approve, through the War Service Homes Division, the discharge of mortgages in relation to existing properties, new or old, and thereby to assist returned servicemen to become owners of properties. If the War Service Homes Division itself could not build the home or could not securea contractor to build it; or if the soldier himself could not arrange to secure the services of a builder who had been approved by the division he still had some prospect of securing a home by the process of discharging the mortgage on an existing property.During the debate on the bill introduced by the Minister for Social Services (Mr. Townley) it became evident that some dissention existed in the ranks of the Government parties. It was necessary that the amending bill should be studied in order to ascertain by what method the Government proposed to implement the restrictive policy which the Minister referred to in his second-reading speech. With perfect clarity he announced then that it was the intention of the Government, in respect of homes built by the War Service Homes Division, or in respect of which an ex-serviceman could secure a contract approved by the Division, to increase the advances available from £2,000 to £2,750. However, the Minister also announced that in respect of an existing property, be it old or new, which the soldier had selected himself, and the structural condition of which was approved by the division, the advance would still be restricted to £2,000.However, as the debate on the measure proceeded, and as the announcement by the Minister was more closely analysed, it was revealed that even an advance of £2,000 would not be made available by the Government in respect of the purchase of an existing property or the discharge of an existing mortgage. Careful study of the bill disclosed that the Government intended to prevent the purchase of an existing property or the discharge of an existing mortgage by the use of machinery contained in the proposed amendment of section 20 of the principal act. That section, which had been in operation since the end of World War I., provided that the Director of War Service Homes, at his discretion might, among other things, arrange for the construction of homes, the purchase of existing properties, or the discharge of mortgages on properties approved as suitable.wish to emphasize that the Director of War Service Homes was entitled, under the act, to do all or any of those things in order to assist returned soldiers. By means of the amending legislation, his powers were taken away from him. For the edification of honorable members and also of ex-servicemen who were promised that war service homes would be in a de available to them, I point out that the amendment of section 20 of the principal act reads as follows: -Bil,im t to t 11 i: Act and to the directions of the Minister as to matters of general policy, the Director may, upon application in writing, make an advance to an eligible person on the prescribed security, for the purpose of enabling him - («) to erect a dwelling house on a holdi jio- nf the applicant.Formerly the director could erect a dwelling house on land owned by the soldier or of which he was the lessee under a Crown lease, purchase land and erect thereon a dwelling house, complete a partially erected dwelling house, enlarge a dwelling house, or discharge any mortgage, charge or encumbrance existing on a home or holding. Those were the powers of the director under the act prior to the enactment of the amending legislation introduced by this Government.In his second-reading speech the Minister blandly announced that no longer was it to be the policy of the Government to advance moneys or to discharge mortgages on existing properties. Let us consider how vital that is to the whole policy of war service homes construction. For the information of honorable members I point out that since the inception of the war service homes scheme at the termination of hostilities in 1918 the War Service Homes Division has built, or has arranged finance for the discharge of existing mortgages in connexion with 75,500 homes. It is interesting to note that 32,000 of the transactions for which finance was arranged related to the purchase of existing properties or to the discharge of mortgages. That is the story in a nutshell. I invite honorable members to consider how much more vital the principle has become in existing circumstances. Since the cessation of hostilities in 1945, the War Service Homes Division itself has built 11,000 homes, but 26,000 transactions have been financed by the division for the purchase of existing properties or for the discharge of existing mortgages. That policy has resulted in the provision of homes for many thousands of servicemen of the two world wars, but the Government has announced, in effect, that only one of the two methods that were adopted in the past to provide homes will be continued. Moreover, the figures show that the method which the Government will continue has provided the least number of homes for soldiers.The position in 1951 emphasized the need to continue the policy that previously proved so successful. In that year, only 26 per cent, of the transactions for soldiers homes were direct contracts for building by the division itself whereas 74 per cent, of the applicants obtained homes which were existing properties or for which arrangements were made to discharge mortgages. If the demand for soldiers homes is as great this year as it was last year, only 26 per cent, will be satisfied as the result of the provisions of this amending legislation. I admit that the aims and objectives of the Minister and his colleagues may be all right. They claim that the discharge of mortgages on existing properties and the purchase of existing properties will not add one home to the total number that are available in Australia for occupation by soldiers and their families. However, that has always been the case. If it had not been for the policy that was laid down in the past by other governments, allowing the division to purchase existing properties and discharge existing mortgages,, considerably less than 50 per cent, and probably under 40 per cent, of the ex-servicemen who have obtained homes would be purchasers or owners of homes now.Arising out of these circumstances and to appease two members of the Government who staged a revolt within its ranks, the Minister forSocial Services made a milk-and-water statement on the 28th February, J 952. In effect, he said, In any case where a soldier has practically completed his arrangements for the purchase of a home before the 28th February and can demonstrate to the division that he may lose his home if the contract is not concluded, the Government will graciously arrange for the completion of the contract between the soldier and the seller . That is the Governments appeasement policy and it does not mean a thing because it applies no longer. It cannot apply because the limiting date was the 26th February. By a change of policy that was unknown to the soldiers themselves, the right of the soldier to arrange for the purchase of an existing property oi- for the discharge of a. mortgage has disappeared entirely. The Treasurer (Sir Arthur Fadden) has referred to the chaos in the building industry.","N/A","WAR SERVICE HOMES","/hansard/chamber.xscript/debate[22]/speech[2]/talk.start/para","N/A","N/A"
179,0,0,0,1,0,0,0,1,"SPEAKER, Mr",10000,"N/A","N/A","N/A",48,"-Order! The honorable member cannot refer at this stage to the events of to-day in this Parliament.","N/A","WAR SERVICE HOMES","/hansard/chamber.xscript/debate[22]/speech[2]/continue[1]/talk.start/para","N/A","N/A"
180,0,0,0,1,0,0,0,1,"POLLARD, Reginald","KYC","N/A","N/A","N/A",48,"- It was just a passing reference, sir. The Treasurer referred to the necessity for people to build their own homes. Everybody realizes that there are difficulties in the. building industry. The War Service Homes Division itself has been deeply affected. It has not been able to operate, on the black market to secure contractors and give fantastic prices on behalf of soldiers. The division cannot engage in illegal transactions. That is all the more reason why the old policy should be continued when a soldier presents a first-class proposition for the purchase of an existing property, old or new, and needs the financial facilities that have been available since the war of 1914-1S. Until this House, is given an assurance by the Government that those facilities will be available throughout the country, thousands of dissatisfied soldiers and their wives will be in opposition to the Government on this question.Honorable members know that the loan moneys available for the Minister and his department were limited to £25,000,000. Would it matter to the Government if approved applications involved £30,000,000? The Government said, in effect, to the ex-servicemen, as it has said to the unfortunate State governments,  We are sorry, boys, but we have run out of loan money . The Government did not tell the men when they enlisted that if it were short of money, they would have to wait for homes. In these circumstances, not only members of the Opposition should support the amendment that has been moved by the Leader of the Opposition (Dr. Evatt). Those who have been critical of the Governments policy should live up to their threats and indicate that they disagree entirely with the policy of the Government which has discontinued a practice that, has been satisfactory to the soldiers. Every member of this House should record dissatisfaction with a policy which limits the opportunities of ex-servicemen to obtain homes.","N/A","WAR SERVICE HOMES","/hansard/chamber.xscript/debate[22]/speech[2]/continue[2]/talk.start/para","N/A","N/A"
181,0,0,0,1,0,0,0,1,"TOWNLEY, Athol","KWH","Denison","LP","Minister ;or Social Services",48,", - My remarks will be brief, but I welcome the opportunity to make them because it is highly desirable that I should present the facts to the House. Never before has there been such a mass of misstatement, illogicality and deliberate misinterpretation of my statements and of those of others whose words arc less likely to be misunderstood than are mine. In this House on two previous occasions, over the air and in press statements, I have enunciated the policy of the Government in relation to war service homes ; but either deliberately or unintentionally my remarks have been misconstrued and misinterpreted by honorable members opposite. I shall not ask the House merely to accept my word on this matter: I shall substantiate my statements with figures. As a general indication of the kind of misstatements that have been made about this subject I produce to the House, through you, MrSpeaker, a. copy of an article that was published in a certain newspaper. I hold in my hand a press report which is headed, in big heavy type,  £2.000,000 homes concession forced from the Government. That sort of misstatement is consistent with the misstatements that were made by the honorable member for Lalor (Mr. Pollard) only a few moments ago. The interesting aspect of the newspaper article is that it bears- the date-line Canberra, Wednesday. The newspaper from which the cutting was extracted was published in a capital city on a Thursday. The article reads -Hank and file members of the Liberal and Country parties in an outspoken discussion to-day at a joint party meeting forced the Government to alter drastically the proposal to amend the War Service Homes Act.The writer then mentioned the name of a man who was not present at the meeting and referred to another man who was said to have made a powerful statement but who, in fact, did not speak at the gathering.Any member of this Parliament who asked the Secretary of the Treasury to inform him of the date upon which with him and one of his senior officers I finalized the provision of an additional £2,000,000 in the budget for war service homes would be informed that that took place on the Friday which preceded the clay upon which the party meeting to which the newspaper article referred was alleged to have been held.The honorable member for Lalor has suggested that by some strange alchemy I had taken to myself certain powers from the Director of War Service Homes - that I had become a kind of sawdust Caesar. I do not know whether honorable members are aware that the Director of War Service Homes has wrestled with professional wrestlers and was at one time a renowned middleweight champion. The idea that. I had pushed him round is amazing. The honorable member for Lalor knows very well - perhaps much hotter than I do because of his long political experience - that in days gone by although technically the director was empowered to do certain things, his power to do them was completely limited by the amount of funds made available to him 1,i his Minister. A quibble of that kind i.s mere- apple sauce!By inference the honorable member said that we had altered our policy in relation to war service homes. In a long and involved attempt to explain how we had done so, the honorable member said that we had done something which we should not have done and that as a result ex-servicemen were broken-hearted. The truth is that every month we have received 2,000 applications for war service homes. I could cite Hansard to prove that the honorable member has also said that the granting of a loan of £2,000 for the purchase of a war service home was completely useless and that ex-servicemen could not obtain homes for that figure. The truth is that there has been such a rush of applications for assistance of that kind that we have had completed a twelve months programme in a little over eight months, and we have had to ask applicants to wait their turn. That is the kind of misrepresentation which characterized the whole of the honorable members speech. He also said that I had dictatorial ambitions. He went on to say that I had made a milk-and-water statement in an attempt to appease the ex-servicemen - that I had thrown them a bone or a few crumbs in order to keep them and the people quiet. Let us consider the facts. When we found that in order to carry out our policy it would be necessary to restrict to some degree advances for war service homes, we said to the ex-servicemen,  We are aware that this decision may entail on your part some temporary interim financing. We did not want to hurt anybody. We realized that many applicants whose applications had been approved would expect help from, the War Service Homes Division. We realized that those who had already entered into commitments would also have to be protected. Having covered those two contingencies we realized that in spite of every care we took to avoid it some hardship might be discovered for which we had not planned.As honorable members will recall, the Prime Minister (Mr. Menzies) said in this House and in subsequent statements to the press that we would protect in three different ways those whose requirements had to be temporarily deferred. Is that the milkandwater appeasement, the bone or the few crumbs to which the honorable member for Lalor has referred? Let us ascertain what was entailed. The commitments we had already entered into under these provisions, which we honoured, totalled £1,508,750. Applicants who had entered into contracts, and who might have lost their deposits if they were not covered, were protected to a total amount of £232,100. Cases of hardship were assisted to the tune of £200,500. Thus, the total assistance granted amounted to £1,941,350. That is real folding money and not a bone or a handful of crumbs to be offered in  appeasement . It is a very real measure of assistance.I shall refer now to the last point that was made by the honorable member for Lalor because my reply to it can be most effectively stated at this stage. I have suggested, and I have backed up my suggestion with some evidence, that plain unvarnished untruths have been uttered or printed about this matter. Why should that be so? I have given information to the House; I have made statements over the air, and I have placed information in the hands of the press about this subject. Moreover, the Prime Minister himself has done likewise. Yet a mass of inconsistencies is being injected into the mind of the general public and of ex-servicemen. Why is that being done? The answer is perfectly clear. The facts are being twisted and perverted for purposes of party political propaganda. I readily acknowledge the gallant service that the honorable member for Lalor and other honorable members opposite rendered as members of our armed forces; but it is strange to see other persons who all their lives have taken little or no interest in the welfare of ex-servicemen suddenly, and for party political advantage, jumping on to the band wagon of the ex-servicemen.I have said that the facts and figures in relation to war service homes have been misinterpreted and distorted. I shall remind the House of some of those hard, cold facts and figures because only to the degree that honorable members examine them will they be able to determine whether the Government has a good case in this matter. The War Service Homes Act was implemented in 1919, that is 33 years ago, but whereas in the 30 years up to the 1st January, 1950, just a few weeks before this Government assumed office, the number of houses that had been provided was 55,541, this Government, by the 30th June of this year, will have, provided no fewer than 37,000 war service homes during the two and a half years that it will have been in office. I emphasize those figures. The Government, since it assumed office approximately two and a half years ago has provided 40 per cent, of the total number of war service homes that have been provided since the act came into operation 33 years ago. During the first 30 years of that period, successive governments provided on an average 1,S00 homes a year, but during the two and a half years that this Government has been in office it has provided on an average, not 1,S00, 5,000 or even 10,000 homes a year, but well over 12,000 war service homes a year, or an increase in that average of over 700 per cent. Yet the Leader of the Opposition has submitted an amendment the effect of which is that the Government should do more than it is doing in the provision of war service homes. I again ask the House to realize that the most that honorable members opposite did in any one year when they were in office was to provide 6,000 war service homes for an expenditure of £8,000,000. That amount is only one-third of the sum that this Government is expending annually for this purpose, and the number of homes is less than one-third of those we have provided. During the 30 years prior to this Government assuming office, previous governments expended £53,000,000 in the provision of war service homes, yet this Government, which the Opposition now claims is not doing sufficient in this sphere, expended to the end of March last a total sum of £55,000,000 for that purpose and at the end of the current financial year will have expended £63,000,000 under that heading during the two and a half years that it will have been in office. 7n addition to the actual provision of war service homes the Government has also helped to provide housing for ex-servicemen under the Commonwealth and State housing agreement, which stipulates that 50 per cent, of houses that are provided under it for letting shall be made available to ex-service personnel. In respect of that agreement the Government has provided £26,000,000 in addition to the expenditure that it has incurred under the War Service HomesAct. Having regard to those facts, the attitude that honorable members opposite now adopt reminds me of the well-known saying. They say, they say; what they say let them say . I am impelled to try to reconcile what honorable members opposite now say with what they did when they were in office. The best, that Labour was able to do in any of the eight years that it was in power was to provide 6.000 war service homes at a cost of :£S,000,000. Yet, honorable members opposite now say that the Government should spend more than it is expending in the provisions of these homes which is three times better than the Labour Governments record year. The Governments record in this respect has not been excelled in the history of war service homes. It has an outstanding record not in words but in results, and no sensible person who is aware of the facts could fail to be convinced completely of the wisdom that it had exercised in achieving such a dramatic result.","N/A","WAR SERVICE HOMES","/hansard/chamber.xscript/debate[22]/speech[3]/talk.start/para","N/A","N/A"
