index,question_flag,answer_flag,interjection_flag,speech_flag,petition_flag,quote_flag,motionnospeech_flag,chamber_flag,name,name.id,electorate,party,role,page.no,content,subdebateinfo,debateinfo,path,Speaker,Time
1,0,0,0,0,0,0,0,1,"N/A","N/A","N/A","N/A","N/A","N/A","Mr. Speaker (Hon. Archie Cameron) took the chair at 3 p.m., and read prayers.","N/A","N/A","/hansard/chamber.xscript/business.start/para","N/A","N/A"
2,0,0,0,1,0,0,0,1,"SPEAKER, Mr",10000,"N/A","N/A","N/A",3,"- I have to announce that I have received a return to the writ which I issued on the 19th February, for the election of a member to serve for the electoral division of Lyne, in the State of New South Wales, to fill the vacancy caused by the death of Mr. Eldred James Eggins, and that, by the endorsement thereon, it is certified that Philip Ernest Lucock has been elected in pursuance of the said writ.Mr. Lucock made and subscribed the oath of allegiance.","Return to Writ: Mr. Philip Ernest Lucock Sworn","LYNE ELECTORAL DIVISION","/hansard/chamber.xscript/debate[1]/subdebate.1/speech/talk.start/para","N/A","N/A"
3,0,0,0,1,0,0,0,1,"MENZIES, Robert","N76","Kooyong","LP","Prime Minister",3,". - Since the House met last we have all been shocked and grieved by the news of the death of the Prime Minister of Ceylon. I desire to submit to the House on this very sad occasion the following motion : -That this House expresses its sincere regret at the death of Don Stephen Senanayake, who was at the time of his death Prime Minister of Ceylon, records its sensibility of the great loss sustained both by that dominion and the whole British Commonwealth as a result of his death, and extends to his widow and his family its profound sympathy.Ceylon is one of the last of the great communities under the British Crown to achieve self-government. In the achievement of that self-government, not only the late Prime Minister, Don Stephen Senanayake, but also the entire Senanayake family, played a great part. The first Prime Minister of the new self-governing Ceylon was the man whose death we mourn to-day. A great number of honorable members of this House had the pleasure of meeting him when he was in Australia. I, myself, have had the pleasure of having a great deal of contact with him during the last two or three years and I should like to express on behalf of myself and of all honorable members our very sincere sorrow at his untimely dea.th and our warmest sympathy with his very distinguished and loving family.The late Prime Minister of Ceylon was a man who worked and struggled hard to achieve complete self-government in his own country. But he did not believe that the achievement of self-government was an end; he understood very, very clearly that it was a means of raising the living standards mid encouraging the future prosperity of his own people. All of us who knew him must have been very much struck by the fact that he had no time to waste on the battles of the past. All his time was devoted to the battles of the future to discovering how, when and where lie could do something for the good of his own people. In that respect lie was one of the distinguished democratic leaders of our own time; and the world can ill afford to lose any of its distinguished democratic leaders. He was a man who was forward-looking, who had no ambiguity in his mind about the substance and importance of the British Commonwealth but who, at all times, believed that his first duty was To promote the real interests and the real needs of his own people. I and, I believe, all honorable members had profound respect for him in that capacity. In our personal relations I had the deepest affection for him. He was a man in every sense of the word. He was an all-round man. He had played his part in sport and in serious affairs, and he had played his part in Ceylon and in the world. Throughout all his activities he had an almost boyish humour, a good nature, u friendliness and yet a firmness which 1 ;im perfectly convinced laid hold of the people he knew so well and produced in them a feeling of profound affection.I should like to say on behalf of the Parliament to the Government and the people of Ceylon how much we value the work he did and how much we mourn his death. I think I may be permitted to add that we have some feeling of personal satisfaction in the knowledge that his son is the new Prime Minister of Ceylon and that a great family tradition is being woven into what I am sure will bp a great national tradition.","N/A","DEATH OF DON STEPHEN SEN AN AY ABLE","/hansard/chamber.xscript/debate[2]/speech[1]/talk.start/para","N/A","N/A"
4,0,0,0,1,0,0,0,1,"EVATT, Herbert Vere","DTN","Barton","N/A","Leader of the, Opposition",4,". - On behalf of Her Majestys Opposition I second the motion. I endorse the remarks of the Prime Minister (Mr. Menzies). The sudden, tragic death of Mr. Senanayake adds to a list of statesmen the passing of whom has been a tremendous loss to the British Commonwealth during a comparatively few number of years - Mackenzie King of Canada, Smuts of South Africa, Fraser of Kew Zealand, Chifley of Australia and Liaquat Ali Khan of Pakistan. We do well to pay honour to the work and memory of the late Prime Minister of Ceylon and to extend our heart-felt sympathy to his family and to the people of Ceylon.The Prime Minister of Ceylon fought hard for self-government for his country as a member of the British Commonwealth, and helped to negotiate a very difficult period in the constitutional history of the British Commonwealth. He also fought hard for the welfare of his people. He was a big man physically and in every other way; he had broad vision, and was tolerant and wise. He was the man for the job in a great crisis. He had a deep feeling for the people of Australia. It was a great honour to bc associated with him, as some of us were, during earlier periods, and he was intensely grateful to the people of this country for the economic help that came to Ceylon in a time of great crisis during the last war. I feel sure that his work will help to bind his country to ours, and to the British Commonwealth, for untold years to come. It is a great honour to associate myself with the motion submitted by the Prime Minister.Question resolved in the affirmative, honorable members standing in their places.","N/A","DEATH OF DON STEPHEN SEN AN AY ABLE","/hansard/chamber.xscript/debate[2]/speech[2]/talk.start/para","N/A","N/A"
5,0,0,0,1,0,0,0,1,"MENZIES, Robert","N76","Kooyong","LP","Prime Minister",4,". - Within the last few days, we have learned of the death of the Ambassador of France in this country, M. Gabriel Padovani, who had been with us for three years. There may be many people who did not have the opportunity to meet him during that period, but there are many members of this House who met him and acquired a special feeling in relation to him. lt has not been a frequent happening in the history of a country that an ambassador accredited from a foreign power dies in the country to which he is accredited. The death of M. Padovani was entirety unexpected, and it is profoundly regretted by everybody who knew him. Australia, in comparison with some countries, has not a long international history,, but it has had during this century the deepest and closest associations with France - in difficulty and then in triumph in World War I., in disaster and then again in triumph in World War II. I do not need to emphasize how profoundly concerned everybody in this House is with the future of France as a great European power, with the significance of France in the achievement of balance and peace in the world, and, in particular, with our relations with France in South-East Asia and in the islands of the South- West Pacific. Wc have had the honour and the pleasure of having several representatives of France since we have exchanged diplomatic missions with that country, and during the- last three years we have had in M. Padovani a gentleman of experience, understanding, humour and a quiet but persuasive personality who has achieved much in the relations between the two countries, which owe to each other the duty and privilege of friendship, because of their traditions of culture and their mutual passion for peace and tranquillity in the world. Therefore, I express to the members of the family of M. Padovani who are so far away from us, the mutual and unanimous feeling of this House of sorrow at his death and of appreciation of the work that he has done in this country to consolidate the friendship which is of such importance to aH of us. With these thoughts, I move -That this House expresses its deep regret lit the death of M. Gabriel Padovani, for three years Ambassador of the Republic of Franc in this country, and tenders its sincere sympathy to his wife and family in their bereavement.","N/A","DEATH OF M. GABRIEL PADOVANI","/hansard/chamber.xscript/debate[3]/speech[1]/talk.start/para","N/A","N/A"
6,0,0,0,1,0,0,0,1,"EVATT, Herbert Vere","DTN","Barton","N/A","Leader of the Opposition",5,". - I second the motion. Few happenings could be sadder than the sudden death of the French Ambassador so far from his homeland and his family, and the Opposition joins in the tribute that has been paid by the Prime Minister (Mr. Menzies) to M. Padovani. whose work was of great value in diplomatic circles in Canberra. I think that his last official act as. ambassador was to- lay a wreath bearing the tricolour of France on the Stone of Remembrance at the Australian National War Memorial at Canberra on Anzac Day. That wreath was a reminder to us of something that we tend to forget - the close association of Great Britain and Australia with France throughout all the great struggles of World War I., in which the Gallipoli campaign figured so prominently. The Opposition feels a deep sense of loss at the death of this distinguished Frenchman, and I hope that our unanimous expressions of sympathy will be some small consolation to his family and to the Government that he served so long and so faithfully.Question resolved in the affirmative, honorable members standing in their places.","N/A","DEATH OF M. GABRIEL PADOVANI","/hansard/chamber.xscript/debate[3]/speech[2]/talk.start/para","N/A","N/A"
7,0,0,0,0,0,0,0,1,"N/A","N/A","N/A","N/A","N/A","N/A","The following bills were returned from the Senate without amendment: -","N/A","BILLS RETURNED FROM THE SENATE","/hansard/chamber.xscript/debate[4]/para[1]","N/A","N/A"
8,0,0,0,0,0,1,0,1,"N/A","N/A","N/A","N/A","N/A","N/A","Treaty of Peace (Japan) Bill 1952. Security Treaty (Australia, New Zealand, and the United States of America) Bill1952.","N/A","BILLS RETURNED FROM THE SENATE","/hansard/chamber.xscript/debate[4]/quote/para[1]","N/A","N/A"
9,0,0,0,0,0,0,0,1,"N/A","N/A","N/A","N/A","N/A","N/A","Fisheries Bill 1952. Pearl Fisheries Bill 1952.","N/A","BILLS RETURNED FROM THE SENATE","/hansard/chamber.xscript/debate[4]/para[2]","N/A","N/A"
10,0,0,0,0,0,0,0,1,"N/A","N/A","N/A","N/A","N/A","N/A","Assent to the following bills reported: : -","N/A","ASSENT TO BILLS","/hansard/chamber.xscript/debate[5]/para[1]","N/A","N/A"
11,0,0,0,0,0,0,0,1,"N/A","N/A","N/A","N/A","N/A","N/A","Ministers of State Bill 1952. Parliamentary Allowances Bill 1952. Parliamentary Retiring Allowances Bill 1932.","N/A","ASSENT TO BILLS","/hansard/chamber.xscript/debate[5]/para[2]","N/A","N/A"
12,0,0,0,0,0,0,0,1,"N/A","N/A","N/A","N/A","N/A","N/A","Income Tax and Social Services Contribution","N/A","ASSENT TO BILLS","/hansard/chamber.xscript/debate[5]/para[3]","N/A","N/A"
13,0,0,0,0,0,0,0,1,"N/A","N/A","N/A","N/A","N/A","N/A","Assessment Bill 1952. Treaty of Peace (Japan) Bill 1952. Security Treaty (Australia, New Zealand and the United States of America) Bill","N/A","ASSENT TO BILLS","/hansard/chamber.xscript/debate[5]/para[4]","N/A","N/A"
14,0,0,0,0,0,0,0,1,"N/A","N/A","N/A","N/A","N/A","N/A","1952.","N/A","ASSENT TO BILLS","/hansard/chamber.xscript/debate[5]/para[5]","N/A","N/A"
15,0,0,0,0,0,0,0,1,"N/A","N/A","N/A","N/A","N/A","N/A","Fisheries Bill 1952. Pearl Fisheries Bill 1952.","N/A","ASSENT TO BILLS","/hansard/chamber.xscript/debate[5]/para[6]","N/A","N/A"
16,1,0,0,0,0,0,0,1,"EVATT, Herbert Vere","DTN","N/A","N/A","N/A",5,"- Will the Treasurer include in the financial statement, which, I understand, he will make to-night, particulars of contributions, including official and semi-official contributions, made to the Fifteenth Security Loan?","SECURITY LOANS.","QUESTIONS","/hansard/chamber.xscript/debate[6]/subdebate.1[1]/question/talk.start/para","N/A","N/A"
17,0,0,0,1,0,0,0,1,"FADDEN, Arthur William","F4T","N/A","CP","N/A",5,"- I am sure that the Leader of the Opposition knows that it is not the practice, nor is it desirable, to disclose particulars of loan subscriptions.","SECURITY LOANS.","QUESTIONS","/hansard/chamber.xscript/debate[6]/subdebate.1[1]/answer/talk.start/para","N/A","N/A"
18,0,0,1,0,0,0,0,1,"CALWELL, Arthur","BV8","N/A","N/A","N/A",6,"- Why not?","SECURITY LOANS.","QUESTIONS","/hansard/chamber.xscript/debate[6]/subdebate.1[1]/answer/interjection/talk.start/para","N/A","N/A"
19,0,0,0,1,0,0,0,1,"FADDEN, Arthur William","F4T","N/A","N/A","N/A",6,"- It was never done during the eight years of Labour government.","SECURITY LOANS.","QUESTIONS","/hansard/chamber.xscript/debate[6]/subdebate.1[1]/answer/continue/talk.start/para","N/A","N/A"
20,1,0,0,0,0,0,0,1,"BRIMBLECOMBE, Wilfred","JSG","N/A","N/A","N/A",6,"- I direct the Treasurers attention to an apparent anomaly in the collection of income tax at Manus Island. Whereas wages and salaries of employees of the Department of Works and Housing are exempted from income tax, servicemen are required to pay income tax on their pay and allowances. Will the Treasurer investigate the matter with a view to removing this apparent injustice?","TAXATION.","QUESTIONS","/hansard/chamber.xscript/debate[6]/subdebate.1[2]/question[1]/talk.start/para","N/A","N/A"
21,0,0,0,1,0,0,0,1,"FADDEN, Arthur William","F4T","N/A","CP","N/A",6,"- The situation touched upon by the honorable member arises from the implementation of the Income Tax Assessment Act 1936- 1952. Income derived in the Territory of New Guinea - and that, of course, includes Manus Island - does not come within the provisions of the act when derived from sources in the territory. Government employees receive differential treatment because of special considerations, but the whole matter is now being investigated in order to determine what can be done about it. I point out, however, that the situation has existed ever since 1936.","TAXATION.","QUESTIONS","/hansard/chamber.xscript/debate[6]/subdebate.1[2]/answer[1]/talk.start/para","N/A","N/A"
22,1,0,0,0,0,0,0,1,"GRIFFITHS, Charles","KFG","N/A","N/A","N/A",6,"- Can the Prime Minister say whether anything has been done to expedite the hearing in the High Court of the case, Commissioner of Taxation v. Fletcher Clarence Dixon, or in respect of the general subject of the taxation of servicemens made-up pay? Does he remember receiving correspondence on this matter last September from a branch of the Returned Sailors, Soldiers and Airmens Imperial League of Australia to which some weeks later hp replied -I am informed that the Crown Law authorities are doing all that is possible to hasten the hearing and it is confidently expected that the case will be heard this month.In view of the fact that more than six months have elapsed since it was expected that that case would be heard and as many ex-servicemen are unable to have their accounts with the Taxation Branch finalized, will the right honorable gentleman see what can be done to have that case expedited?","TAXATION.","QUESTIONS","/hansard/chamber.xscript/debate[6]/subdebate.1[2]/question[2]/talk.start/para","N/A","N/A"
23,0,0,0,1,0,0,0,1,"MENZIES, Robert","N76","N/A","LP","N/A",6,"- I shall certainly act upon the honorable members suggestion. Of course, I, personally, have no knowledge of the progress of the proceedings to which he has referred, but I shall ascertain the position from the Crown Law authorities this afternoon and advise him to-morrow.","TAXATION.","QUESTIONS","/hansard/chamber.xscript/debate[6]/subdebate.1[2]/answer[2]/talk.start/para","N/A","N/A"
24,1,0,0,0,0,0,0,1,"COSTA, Dominic","K6T","N/A","N/A","N/A",6,"- Has the Prime Minister taken any notice of the statement that was made by Sir John Latham at the time of his retirement from the Chief Justiceship of the High Court of Australia. Sir John said that it was about time that consideration was given to bringing the Australian Constitution up to date. He also said that section 92 of the Constitution should be mad a a little clearer. It is obvious to everybody that this should be done because of the conflicting nature of judgments by members of the High Court bench from time to time. Other matters which Sir John Latham suggested for review were the financial relations of the Commonwealth and the States, and section 51 of the Constitution, which deals with the industrial powers of the Commonwealth. Will the Prime Minister consider taking action to have the Constitution reviewed oil a non-party basis as Sir John Latham has suggested? I believe that the Prime Minister will agree that most thinking people are of the opinion that the Constitution is a horse and buggy affair at present and that, until it is modernized, many of our important national problems will remain unsolved.","CONSTITUTION ALTERATION.","QUESTIONS","/hansard/chamber.xscript/debate[6]/subdebate.1[3]/question/talk.start/para","N/A","N/A"
25,0,0,0,1,0,0,0,1,"SPEAKER, Mr",10000,"N/A","N/A","N/A",6,"- Order! The honorable gentlemans question is becoming rather lengthy and it includes a good deal of comment.","CONSTITUTION ALTERATION.","QUESTIONS","/hansard/chamber.xscript/debate[6]/subdebate.1[3]/question/continue[1]/talk.start/para","N/A","N/A"
26,0,0,0,1,0,0,0,1,"COSTA, Dominic","K6T","N/A","N/A","N/A",6,"- Will the Prime Minister give this matter some thought with a view to taking early action?","CONSTITUTION ALTERATION.","QUESTIONS","/hansard/chamber.xscript/debate[6]/subdebate.1[3]/question/continue[2]/talk.start/para","N/A","N/A"
27,0,0,0,1,0,0,0,1,"MENZIES, Robert","N76","N/A","LP","N/A",6,"- I read the reported remarks of the former Chief Justice of the High Court with great interest, and, of course, with great respect. The problems that he referred to are very much in my mind and very much under consideration by the Government. The whole trouble about these constitutional problems, of course, is that from day to day one grows hot and cold and hot and cold. It is very difficult to strike a happy medium.","CONSTITUTION ALTERATION.","QUESTIONS","/hansard/chamber.xscript/debate[6]/subdebate.1[3]/answer/talk.start/para","N/A","N/A"
28,1,0,0,0,0,0,0,1,"FALKINDER, Charles","KEP","N/A","N/A","N/A",7,"- The Minister for Labour and National Service undoubtedly is aware that a very serious position lias arisen on the waterfront in Tasmania in relation to the fruit export season, which is very restricted. Has the Minisler any information concerning action that may be taken to alleviate the situation?","WATERFRONT EMPLOYMENT.","QUESTIONS","/hansard/chamber.xscript/debate[6]/subdebate.1[4]/question/talk.start/para","N/A","N/A"
29,0,0,0,1,0,0,0,1,"HOLT, Harold","009MC","N/A","LP","N/A",7,"- We have been giving active attention to the problem that has arisen at Hobart. The honorable member has asked what action may be taken to alleviate the situation. The most useful action that could be taken would be for the Waterside Workers Federation to lift its ban on the working of overtime, particularly at Hobart, where, as the honorable member has pointed out, the loading season for the apple crop is very short. We have tried to improve the position in various ways, such as by attracting labour from the mainland and from other ports in Tasmania that are not fully engaged at this time. However, these are only palliatives. The Australian Council of Trades Unions, through its secretary, Mr. Broadby, also has tried to obtain the co-operation of the Waterside Workers Federation but so far it has been unsuccessful. I remind the House that important legal proceedings which have a bearing on this matter, and on other ports as well, are at present in train before the Commonwealth Court of Conciliation and Arbitration.","WATERFRONT EMPLOYMENT.","QUESTIONS","/hansard/chamber.xscript/debate[6]/subdebate.1[4]/answer/talk.start/para","N/A","N/A"
30,1,0,0,0,0,0,0,1,"LAWSON, George","KZX","N/A","N/A","N/A",7,"- Is the Minister for Health aware that, owing to the import restrictions that have been imposed by this Government, imports from overseas of urgently needed vitamins will be considerably reduced? Does he know that Vitamin E, discovered by the Shute Foundation for Medical Research, has an amazing effect upon people suffering from heart ailments and that at the present time many thousands of sufferers from these ailments are being treated with this vitamin, with extraordinarily good results? Owing to the Governments import restrictions, Vitamin E now is in desperately short supply in this country. In view of this serious position, will the right honorable gentleman take steps immediately to ensure that the import restrictions that have been imposed upon this important commodity will be relaxed?","DRUGS.","QUESTIONS","/hansard/chamber.xscript/debate[6]/subdebate.1[5]/question/talk.start/para","N/A","N/A"
31,0,0,0,1,0,0,0,1,"PAGE, Earle","C7E","N/A","CP","N/A",7,"- The importation of drugs that are indispensable in the treatment of human diseases has been carefully considered. The list of drugs of that kind that are in short supply in this country has been continually brought to the notice of the Minister for Trade and Customs, who is giving very sympathetic consideration to the matter. Doubtless, the honorable gentleman will be glad to learn that the drug that he has mentioned is now being made in Australia and, therefore, there is no need to wory about importing supplies of it.","DRUGS.","QUESTIONS","/hansard/chamber.xscript/debate[6]/subdebate.1[5]/answer/talk.start/para","N/A","N/A"
32,1,0,0,0,0,0,0,1,"WILSON, Keith Cameron","KBH","N/A","N/A","N/A",7,"- Has the attention of the Minister for Immigration been directed to complaints that have been made by residents of Gepps Cross immigrant hostel about charges for board? Will the honorable gentleman give urgent consideration to the request made by those residents that kitchenettes be installed at the hostel in order that they may cook their own meals?","IMMIGRATION.","QUESTIONS","/hansard/chamber.xscript/debate[6]/subdebate.1[6]/question[1]/talk.start/para","N/A","N/A"
33,0,0,0,1,0,0,0,1,"HOLT, Harold","009MC","N/A","LP","N/A",7,"- I am aware that complaints have been made about the recent increase of charges to residents in the Gimps Cross hostel. I point out to the honorable member that no other increase ha? been made since July of last year, although during that time not only have the operating costs of the hostel increased considerably but also the basic wage has risen by approximately 40s. Therefore, it is only reasonable to insist that some portion of the increased operating costs shall be passed on to the residents of hostels of this kind. The Government is anxious that the charges shall be fair and reasonable, but we must have regard in this matter to the interests of the Australian taxpayers. I remind the honorable member that, for the next financial year, an appropriation of nearly £1,500,00 has been made to meet concessional allowances for immigrants and their dependants who are living in hostels. In the circumstances, it cannot be claimed that the present charges are unduly high. The installation of kitchenettes raises a very difficult question. We have already given some consideration to the matter. I know that a specific scheme has been prepared in relation to the Gepps Cross hostel, in which the honorable gentleman is interested. I give him an undertaking that the matter will be fully examined.","IMMIGRATION.","QUESTIONS","/hansard/chamber.xscript/debate[6]/subdebate.1[6]/answer[1]/talk.start/para","N/A","N/A"
34,1,0,0,0,0,0,0,1,"MINOGUE, Daniel","JUX","N/A","N/A","N/A",8,"- In view of the acute shortage of houses in all States and the present indication of widespread unemployment, due to the Governments credit restriction policy and the provision of insufficient loan funds for public works, will the Minister for Immigration state the number of immigrants that he intends to bring to this country within the next twelve months?","IMMIGRATION.","QUESTIONS","/hansard/chamber.xscript/debate[6]/subdebate.1[6]/question[2]/talk.start/para","N/A","N/A"
