index,question_flag,answer_flag,interjection_flag,speech_flag,petition_flag,quote_flag,motionnospeech_flag,chamber_flag,name,name.id,electorate,party,role,page.no,content,subdebateinfo,debateinfo,path,Speaker,Time
260,0,0,0,1,0,0,0,1,"HULME, Alan","KIF","N/A","LP","N/A",26,"- I do not know whether the honorable member is referring to legislation in relation to translators which was passed by this Parliament last year, but from technical advice that I have received I believe that translators are not suitable as a means of providing television at Kalgoorlie. I do not think that a decision has yet been reached on how we might provide television in this area. This is now being investigated by those who advise me on these matters.","TELEVISION.","QUESTIONS","/hansard/chamber.xscript/debate[21]/subdebate.1[13]/answer/talk.start/para","N/A","N/A"
261,0,0,0,1,0,0,0,1,"DRURY, Edward","KCU","RYAN, QUEENSLAND","N/A","N/A",26,"- In addressing my question to the Minister for Supply I refer to a letter which he kindly wrote me recently relating to an inquiry into the operation of the European Launcher Development Organization. Will he indicate, for the information of honorable members and the Australian people, what part Australia is playing in this organization and what publicity is being arranged to inform the Australian people of what is going on?","EUROPEAN LAUNCHER DEVELOPMENT ORGANIZATION.","QUESTIONS","/hansard/chamber.xscript/debate[21]/subdebate.1[14]/question/talk.start/para","N/A","N/A"
262,0,0,0,1,0,0,0,1,"FAIRHALL, Allen","KEN","PATERSON, NEW SOUTH WALES","LP","Minister for Supply",26,"- The honorable member will recall that the development of Blue Streak, an inter-continental ballistic missile, was part of the British rocket programme. When this missile was superseded an arrangement was made with a number of European countries and the European Launcher Development Organization was formed. It was decided that the Blue Streak rocket would act as the first stage of a vehicle to launch satellites into orbit, basically for peaceful purposes and primarily, I should think, for use in communications. Because of our set-up at Woomera and the availability of launching gantries and so on, Australia was invited to join Eldo. This we did, and although we are now a full member of the European Launcher Development Organization and have access to all the technology available from laboratories of member countries, we pay no membership fee. In addition, of course, we are paid for the work that we do at Woomera on behalf of Eldo. It is quite possible that the first test firings of the Eldo vehicle have already been made.Later there will be full-scale firings of the vehicle, probably in April or May of this year. When these firings are made - and this is, of course, only the first stage, and there will be more to follow - naturally we will take every possible opportunity to bring home to the Australian people what this developing technology means to Australia, because having been invited to be members of Eldo, our membership gives us full access to any commercial developments which may arise out of the Eldo experiments.I think it should be kept in mind that a company has been formed to operate communications systems by satellites, and it may well be that within the next month a definite programme will be worked out by which the worlds first satellite communications system will be put into operation. At the moment we, as a nation, are hovering on the periphery of discussions on these matters, but we may well be invited to enter such discussions and perhaps be given an opportunity to take membership in the company. All in all, this is an enormously important organization. It represents an enormously important opportunity for Australia to join in a world-wide communications system, and the honorable members will realize how important this is in these times, when trade follows communications.","EUROPEAN LAUNCHER DEVELOPMENT ORGANIZATION.","QUESTIONS","/hansard/chamber.xscript/debate[21]/subdebate.1[14]/answer/talk.start/para","N/A","N/A"
263,0,0,0,1,0,0,0,1,"CAMERON, Clyde","2V4","HINDMARSH, SOUTH AUSTRALIA","N/A","N/A",26,"- My question is directed to the Treasurer. I preface it by saying that a recent press report stated that dependants of those who were killed in the Voyager will receive payments fixed in accordance with the Commonwealth Employees Compensation Act. It is with this matter that I am particularly concerned at the moment. Does the Minister know that in Queensland the lump sum payment made to the dependant of a worker who is killed during the course of his employment is £3,300 plus £110 for each child under 16, or, if receiving full-time education, up to 21 years of age; that in Western Australia the amount is £3,386 plus £90 for each child under 16; that in Tasmania it is £4,000 plus £100 for each child under 16 or, if receiving full-time education, up to 21 years of age; that in New South Wales the amount of - compensation is £4,300 plus £2 3s. a week for each child under 16, while the Commonwealth legislation will entitle the dependants of those killed in this unfortunate accident involving the Voyager to only £3,000 plus £100 for each child? If he is aware of these facts, what action does he propose to take to ensure that dependants of those killed as a result of the Voyager accident will receive the same amount as they would receive if the provisions of the New South Wales legislation applied to them?","DEPENDANTS OF VOYAGER VICTIMS","QUESTIONS","/hansard/chamber.xscript/debate[21]/subdebate.1[15]/question/talk.start/para","N/A","N/A"
264,0,0,0,1,0,0,0,1,"HOLT, Harold","009MC","N/A","LP","N/A",27,"- I think the general principles which apply in matters of this kind remain as they existed at the time when the last Labour Administration was in office. I am speaking of the principles, not of the amounts. In other words, the principles which apply in cases of this kind have been consistently applied, to the best of my knowledge. As to the provisions made under workers compensation legislation, It has been the practice of the Commonwealth Government to study the legislation of the States. I think it is quite misleading to select one aspect of a comprehensive workers compensation scheme and measure that against something which has just been plucked out of a piece of State legislation. You have to look at the legislation as a whole. I think it can be fairly claimed that, over the broad field of workers compensation, the Commonwealth provision has not been less generous than the provisions of the States. The Commonwealth must pay regard to the fact that it should be as consistent with the provisions made by the States as is practicable, otherwise injustice is likely to arise for citizens who come under State legislation rather than under Commonwealth legislation. In the light of what the honorable gentleman has put, I shall study the details of the applications likely to be made in respect of this matter. I am sure that all members of the House wish to see generous treatment consistent with the principles established under the legislation.","DEPENDANTS OF VOYAGER VICTIMS","QUESTIONS","/hansard/chamber.xscript/debate[21]/subdebate.1[15]/answer/talk.start/para","N/A","N/A"
265,0,0,0,1,0,0,0,1,"ERWIN, Dudley","KDO","BALLAARAT, VICTORIA","N/A","N/A",27,"- My question to the Minister for the Army concerns the development of the American Red Eye heatseeking missile, which can be fired from a mans shoulder, and the acceptance of that missile by the United States Army. I ask: Is the honorable gentleman in a position to tell the House whether this missile is being considered for use by the Australian Army?","RED EYE MISSILE.","QUESTIONS","/hansard/chamber.xscript/debate[21]/subdebate.1[16]/question/talk.start/para","N/A","N/A"
266,0,0,0,1,0,0,0,1,"FORBES, Alexander","KFH","N/A","LP","N/A",27,"- I understand that the ground-to-air missile referred to by the honorable member is still under development in the United States of America. We are extremely interested in it. We have been closely watching developments and will continue to do so.","RED EYE MISSILE.","QUESTIONS","/hansard/chamber.xscript/debate[21]/subdebate.1[16]/answer/talk.start/para","N/A","N/A"
267,0,0,0,1,0,0,0,1,"CALWELL, Arthur","BV8","N/A","N/A","N/A",27,"- I ask the Prime Minister: Why did he not take suitable, effective and immediate action in relation to all matters concerning the aftermath of the Voyager disaster by detailing a Minister of Cabinet rank to act on his behalf? Was it the decision of the Minister for the Army to send ill, exhausted and shocked survivors back to their homes at night, in seating accommodation only, by second-class rail transport? Who is to be responsible in this House for answering questions relating to the Voyager disaster? Is it to be the Minister for the Army, the Minister for the Navy designate, or somebody whose ability, experience and responsibility are such as to enable him to deal with the problems covering the scope and significance of the shocking disaster?","LOSS OF H.M.A.S. VOYAGER.","QUESTIONS","/hansard/chamber.xscript/debate[21]/subdebate.1[17]/question/talk.start/para","N/A","N/A"
268,0,0,0,1,0,0,0,1,"MENZIES, Robert","N76","N/A","LP","N/A",27,"- I hope my honorable friend does not feel very proud of his question. He has been wont to stray of late and if he will go back to the facts he will remember that on the morning after the disaster, the matter was not dealt with by a Minister not of Cabinet rank; it was dealt with by me as Prime Minister.","LOSS OF H.M.A.S. VOYAGER.","QUESTIONS","/hansard/chamber.xscript/debate[21]/subdebate.1[17]/answer/talk.start/para","N/A","N/A"
269,0,0,1,0,0,0,0,1,"CALWELL, Arthur","BV8","N/A","N/A","N/A",27,"- In a mere statement.","LOSS OF H.M.A.S. VOYAGER.","QUESTIONS","/hansard/chamber.xscript/debate[21]/subdebate.1[17]/answer/interjection/talk.start/para","N/A","N/A"
270,0,0,1,0,0,0,0,1,"MENZIES, Robert","N76","N/A","N/A","N/A",27,"- I made a statement having consulted already with the Minister for the Navy, the Minister for the Navy designate and the Chief of the Naval Staff. There had been already a meeting of the Naval Board. It was then that I decided on my own responsibility that we would have an investigation by a royal commission, presided over by a judge, and therefore open to the public and to the full glare ofpublicity. I stated at the time that this was the proper procedure because nothing would satisfy the public mind except the most penetrating and public examination of what had occurred. This was my decision, and it was announced by me. I do not know why the honorable gentleman takes exception by suggesting that a Minister of Cabinet rank should have handled the matter. I suppose that I am still a Minister of Cabinet rank and I handled it myself.The honorable gentleman said that something else happened later on about accommodation. I hope that if in the inscrutable wisdom of providence the honorable gentleman becomes Prime Minister he will not take up the attitude that his Minister for a service department is unfit to handle the problems of that service department. This collision was a calamity that shocked the nation. It was therefore fairly and squarely a matter for me to deal with. But if I thought the Minister for the Navy was incapable of dealing with naval administration - apart from this large matter - then I think 1 would have to remove him from being Minister for the Navy. This is a new doctrine - that service Ministers are not competent, are not to be entrusted with the performance of their duties in the service departments. I do not believe it for a moment. I do not think that holding to such a doctrine is the way to get good Ministers, and I do not think it is the way to get good administration. Now, on this matter, apart from particular grievances that the honorable member may have, the thing that was of burning public importance was handled at the earliest possible moment, the morning after this unhappy event - this terrible event - and was handled, I believe I may say, in a fashion that gave considerable satisfaction to the people of Australia.","LOSS OF H.M.A.S. VOYAGER.","QUESTIONS","/hansard/chamber.xscript/debate[21]/subdebate.1[17]/answer/continue/talk.start/para","N/A","N/A"
271,0,0,0,1,0,0,0,1,"ENGLAND, John","KDN","CALARE, NEW SOUTH WALES","N/A","N/A",28,"- I ask the Minister for External Affairs a question. On 29th October last the Minister reminded members of this House of the terms of Article 19 of the United Nations Charter which, in short, dictates that a member nation in arrears in its financial contributions shall have no vote in the General Assembly and pointed out that if, by January, 1964 - last month - the Soviet Union had not paid all or part of its dues it could be confronted with the application of this article. Has the Soviet Union - and its allies - changed its attitude with regard to the costs of peace keeping operations, and what is the position of its dues now?","UNITED NATIONS.","QUESTIONS","/hansard/chamber.xscript/debate[21]/subdebate.1[18]/question/talk.start/para","N/A","N/A"
272,0,0,0,1,0,0,0,1,"BARWICK, Garfield",126,"PARRAMATTA, NEW SOUTH WALES","LP","Minister for External Affairs",28,"- As of now, the attitude of the Soviet Union to the payment of the expenses of peace-keeping activity which is not under the direct control of the Security Council remains as it was aforetime. There has been no change. So far as its dues are concerned, the Soviet Union has not reduced the level of its arrears below that figure which, under Article 19, will bring into jeopardy its right to vote. I think I ought to say, though, to make that answer complete, that there are perhaps two straws in the wind which, we hope, promise something more substantial. First, the Czechoslovakian Government in January paid enough into the fund to reduce its arrears below the level which would disentitle it to vote; secondly, Chairman Khrushchev, in his New Year letter, spoke of the maintenance of peace in terms which, if he carries them through logically, might conceivably lead to a change of attitude on the part of the Soviet Union in relation to this matter.","UNITED NATIONS.","QUESTIONS","/hansard/chamber.xscript/debate[21]/subdebate.1[18]/answer/talk.start/para","N/A","N/A"
273,0,0,0,1,0,0,0,1,"WHITLAM, Gough","6U4","WERRIWA, NEW SOUTH WALES","N/A","N/A",28,"- I direct a question to the Treasurer. The right honorable gentleman recently announced that accounting and adding machines would be converted, on the introduction of decimal currency, at a cost to the Commonwealth of about £30,000,000. I ask him whether any consideration was given to the Commonwealth itself carrying out these conversion operations or letting contracts for them to be done on its behalf, thus preventing some, at least, of this very large sum going into the hands of private companies, most of them, in fact, owned overseas?","DECIMAL CURRENCY.","QUESTIONS","/hansard/chamber.xscript/debate[21]/subdebate.1[19]/question/talk.start/para","N/A","N/A"
274,0,0,0,1,0,0,0,1,"HOLT, Harold","009MC","N/A","LP","N/A",28,"- The Government set up the Decimal Currency Board. It is a very strongly constituted board, as I think honorable members will agree when they consider its composition. It is under the chairmanship of Mr. Walter Scott. It has the deputy managing director of the Commonwealth Banking Corporation, Mr. Armstrong, as one of its members, together with Sir Kenneth Coles and other leading figures well known to honorable members. The board had available to it the experience of South Africa, where a similar conversion operation had to take place and where compensation arrangements also operated. It is quite a formidable task for the companies directly concerned to carry this work out smoothly on what will be, in total, some 300,000 machines, to put it broadly. I do not think that it would be a practicable proposition for the Government to establish some instrumentality to try to engage the highly skilled labour that would normally be working with the established companies and to employ that labour to do the work for a government organization. I have no doubt that that possibility was considered by the board, which, I believe, has made its recommendations in a manner that will effect the smoothest possible conversion with the utmost economy.A very substantial sum has been mentioned. This cost will be spread, we believe, over three financial years. Set off against it will be great savings due to economy, greater efficiency and other factors once the decimal currency system is in operation. The conversion cost is a price that we shall have to pay for the benefits that we shall gain later. I do not think that there is any way in which we could reasonably economize on this cost. .It represents not so much amounts that will be paid to companies producing. machines, but rather compensation that will be paid to machine owners to meet reasonable costs of conversion incurred by them. I think that there is sufficient competition among companies engaged in converting machines to ensure that the owners for whom the machines are converted are not treated unreasonably.","DECIMAL CURRENCY.","QUESTIONS","/hansard/chamber.xscript/debate[21]/subdebate.1[19]/answer/talk.start/para","N/A","N/A"
275,0,0,0,1,0,0,0,1,"STOKES, Philip","KVG","MARIBYRNONG, VICTORIA","N/A","N/A",29,"- My question is directed to the Minister for Housing. By way of preface, I refer to the Governments proposal to make grants of £1 for every £3 paid into approved accounts in recognized institutions, with a limit of £250 on the grants. I ask: In view of the fact that many features of these grants are not yet clear and that many members of this House are daily receiving inquiries about the effects of the legislation under which this proposal will be adopted, how soon will the Minister be in a position to give the House some information that will enable honorable members to clarify the situation for their constituents?","HOUSING.","QUESTIONS","/hansard/chamber.xscript/debate[21]/subdebate.1[20]/question/talk.start/para","N/A","N/A"
276,0,0,0,1,0,0,0,1,"BURY, Leslie","JTP","WENTWORTH, NEW SOUTH WALES","LP","Minister for Housing",29,"- These issues are not by any means entirely simple. They need considerable sifting in consultation with various parties, as does the proposal to equalise petrol prices. The issues in this instance also involve the creation of a department to deal with them. Honorable members will appreciate that it takes some time even to put in motion Parkinsons law. I certainly wish to let every one know as soon as possible where he stands. During the last week, I have issued for the information of the public and honorable members a statement that I hope will elucidate some points. If any honorable member needs another copy of that statement or has not yet received one, he may obtain a copy from my office, where some are available. All these questions that arise will certainly be resolved as soon as possible once the normal physical problems of detailed consideration have been dealt with. Indeed, drafting of a bill to implement these proposals has already begun, and the measure will be brought before this House at the earliest possible moment.","HOUSING.","QUESTIONS","/hansard/chamber.xscript/debate[21]/subdebate.1[20]/answer/talk.start/para","N/A","N/A"
277,0,0,0,1,0,0,0,1,"FRASER, Jim","JWX","N/A","ALP","N/A",29,"- I ask the Prime Minister: Has he had drawn to his attention the fact that the lady who contested the Australian Capital Territory seat for the Liberal Party of Australia at the election in November last polled not only a record vote for a Liberal Party candidate but also a record percentage of the votes? Does the right honorable gentleman know that the lady joined vigorously in a campaign for the grant of full voting rights for the member for the Australian Capital Territory? Will he now test his stated belief that it would be more difficult for me to retain this seat if it carried full voting rights, and will he accordingly amend the Australian Capital Territory ^Representation Act so as to remove all restrictions on the voting rights of the member for the Australian Capital Territory?","THE PARLIAMENT.","QUESTIONS","/hansard/chamber.xscript/debate[21]/subdebate.1[21]/question/talk.start/para","N/A","N/A"
278,0,0,0,1,0,0,0,1,"MENZIES, Robert","N76","N/A","LP","N/A",29,"- The honorable members question relates, of course, to a matter of policy, and he has been here long enough to know that such matters are not dealt with at question time. But I am grateful to him for directing my attention to the fact that his opponent polled so well. In fact, I understood that the honorable gentleman himself at the time had said, She polled frightfully well for a woman. She certainly did poll very well. There is no doubt about it. The honorable member was right. She polled very well indeed last time, and next time she will poll even better.","THE PARLIAMENT.","QUESTIONS","/hansard/chamber.xscript/debate[21]/subdebate.1[21]/answer/talk.start/para","N/A","N/A"
279,0,0,0,0,0,0,0,1,"N/A","N/A","N/A","N/A","N/A","N/A","Ministerial Statement","N/A","LOSS OF H.M.A.S. VOYAGER.","/hansard/chamber.xscript/debate[22]/para","N/A","N/A"
280,0,0,0,1,0,0,0,1,"MENZIES, Robert","N76","KooyongPrime Minister","LP","N/A",30,"- by leave - It is my melancholy duty to report formally to the House that on Monday, 10th February, as the result of a collision off the south-east coast of Australia between H.M.A.S. Melbourne and H.M.A.S. Voyager, H.M.A.S. Voyager sank with a loss of 82 lives. The House will join me in extending to the bereaved families of those who have sustained this sudden and tragic loss, the very deepest sympathy. All Australia mourns with them. I inform honorable members, because I think it ought to be in the records of the House, that the Government has established a royal commission to investigate this tragedy. The commissioner is the Honorable Sir John Spicer. Chief Judge of the Commonwealth Industrial Court. He will be assisted by counsel who will, of course, be assisted in their turn by technical experts. There will beother counsel to represent the Navy and, Inotice already, one or two other relevant interests.The terms of reference of the royal commission are as follows: -To inquire into and report on -the cause or causes of the collision that occurred on the tenth day of February, One thousand nine hundred and sixty-four, between the ships of our Australian Navy,  Melbourne  and Voyager and the resulting loss of  Voyager  and of the lives of persons on board  Voyager ;the facts and circumstances leading up to, contributing to or otherwise relating to the collision and the loss, including, so far as relevant to the cause of the collision, the nature of the exercise on which the ships were engaged and the suitability and preparedness of the ships and of their equipment and crews for that exercise; andthe facts and circumstances relating to the rescue and treatment of survivors.We believe that these terms, which we put at once under very close study and which I announced earlier, should be comprehensive. In relation to this collision, it is essential that nothing that should be made known is hidden. That is the whole object in this matter. Therefore, the terms should enable a thorough judicial investigation to be made. So far as we are concerned, no effort will be spared in bringing to light all the facts relating to this most tragic event. The first hearings of the Royal Commission opened in Sydney to-day.","N/A","LOSS OF H.M.A.S. VOYAGER.","/hansard/chamber.xscript/debate[22]/speech[1]/talk.start/para","N/A","N/A"
281,0,0,0,1,0,0,0,1,"CALWELL, Arthur","BV8","Melbourne","N/A","Leader of the Opposition",30,". - by leave - Mr. Speaker, the terms of reference announced by the Prime Minister (Sir Robert Menzies) are far too narrow. The first two relate to the cause or causes of the collision and the facts and circumstances leading up to, contributing to or otherwise relating to it. The third term deals with the facts and circumstances relating to the rescue and treatment of survivors. The treatment of survivors might include those matters to which I referred in the question I addressed to the Prime Minister a short time ago. But even if the inquiry covers all those matters, it still does not cover everything that might relate to the disaster. The Royal Australian Navy has suffered other disasters in recent times. There was the loss of five midshipmen off the Queensland coast.","N/A","LOSS OF H.M.A.S. VOYAGER.","/hansard/chamber.xscript/debate[22]/speech[2]/talk.start/para","N/A","N/A"
282,0,0,1,0,0,0,0,1,"SPEAKER, Mr",10000,"N/A","N/A","N/A",30,"- Order! I point out to the Leader of the Opposition that he has leave to speak to the subject-matter before the Chair. He would not be in order if he raised any matter not connected with this subject.","N/A","LOSS OF H.M.A.S. VOYAGER.","/hansard/chamber.xscript/debate[22]/speech[2]/continue[1]/talk.start/para","N/A","N/A"
283,0,0,1,0,0,0,0,1,"CALWELL, Arthur","BV8","N/A","N/A","N/A",30,"- I have asked for leave to make a statement so that I can give the Oppositions view on this disaster and suggest that the inquiry should cover not only this disaster but everything affecting the administration of the Navy that may be connected with the disaster or have some bearing on it.","N/A","LOSS OF H.M.A.S. VOYAGER.","/hansard/chamber.xscript/debate[22]/speech[2]/continue[2]/talk.start/para","N/A","N/A"
