index,question_flag,answer_flag,interjection_flag,speech_flag,petition_flag,quote_flag,motionnospeech_flag,chamber_flag,name,name.id,electorate,party,role,page.no,content,subdebateinfo,debateinfo,path,Speaker,Time
186,0,0,0,0,0,0,0,1,"N/A","N/A","N/A","N/A","N/A","N/A","It is also the fact that Australian industries are expanding their operations overseas, using Australian components and raw materials. My advisers are studying the details of a scheme of insurance against non-commercial risks such as expropriation or war. So soon as conclusions have been reached, a further announcement will be made.","N/A","GOVERNOR-GENERALS SPEECH","/hansard/chamber.xscript/debate[14]/para[34]","N/A","N/A"
187,0,0,0,0,0,0,0,1,"N/A","N/A","N/A","N/A","N/A","N/A","International trade negotiations under the General Agreement on Tariffs and Trade are scheduled to begin in May. For the first time the reduction of barriers to international trade in primary products will be given as much emphasis in these negotiations as the reduction of tariffs against industrial goods. Special commodity groups have already been established, to negotiate on the problems of improving access to world markets and obtaining remunerative prices for cereals, meat and dairy products. The United Nations Conference on Trade and Development is to begin next month. Australia will participate, in its work.","N/A","GOVERNOR-GENERALS SPEECH","/hansard/chamber.xscript/debate[14]/para[35]","N/A","N/A"
188,0,0,0,0,0,0,0,1,"N/A","N/A","N/A","N/A","N/A","N/A","The Government will continue its policy of supporting the stabilization of our primary industries. Legislation will be introduced to give effect to arrangements under which the Commonwealth will match £1 for £1 additional funds contributed by wool growers for wool promotion in excess of their present levy.","N/A","GOVERNOR-GENERALS SPEECH","/hansard/chamber.xscript/debate[14]/para[36]","N/A","N/A"
189,0,0,0,0,0,0,0,1,"N/A","N/A","N/A","N/A","N/A","N/A","Legislation is also in preparation to support a meat industry plan for developing and diversifying the overseas markets for Australian meat. A stabilization proposal for the dried fruits industry will shortly be put to a vote by growers in the industry. Further, subject to the concurrence of the State Governments who have a large responsibility in this regard, my Government is prepared to bring down legislation to support a stabilization scheme for the Australian egg industry.","N/A","GOVERNOR-GENERALS SPEECH","/hansard/chamber.xscript/debate[14]/para[37]","N/A","N/A"
190,0,0,0,0,0,0,0,1,"N/A","N/A","N/A","N/A","N/A","N/A","Scientific research in the rural industries is of the highest importance. Special funds are already available to the States to assist in having the benefits of research available to the man on the land. However, my advisers believe that the process, can be quickened. They are prepared to work out arrangements with the States to bring this about.","N/A","GOVERNOR-GENERALS SPEECH","/hansard/chamber.xscript/debate[14]/para[38]","N/A","N/A"
191,0,0,0,0,0,0,0,1,"N/A","N/A","N/A","N/A","N/A","N/A","The Commonwealth Aid Roads .legislation, under which the Commonwealth will have paid £230,000,000 to the States for roads over the past five years, expires on 30th June next. Legislation for a new scheme, which will involve larger payments, will be presented to the Parliament in this session following discussions wilh the State Premiers.","N/A","GOVERNOR-GENERALS SPEECH","/hansard/chamber.xscript/debate[14]/para[39]","N/A","N/A"
192,0,0,0,0,0,0,0,1,"N/A","N/A","N/A","N/A","N/A","N/A","Up-to-date communications facilities are needed in a rapidly growing economy. Important steps towards the fulfilment of the national telephone plan have been made. These include the introduction of a new operational system, extended calling areas without the payment of trunk call fees, the progressive extension of subscriber trunk dialling facilities and a number of large scale coaxial cable and radio trunk installation projects, linking capital cities and rural areas.","N/A","GOVERNOR-GENERALS SPEECH","/hansard/chamber.xscript/debate[14]/para[40]","N/A","N/A"
193,0,0,0,0,0,0,0,1,"N/A","N/A","N/A","N/A","N/A","N/A","Progress is being made with the extension of television to provincial and country areas. The Government has maintained its policy of providing for dual national and commercial services. When the current expansion is completed by the end of 1966, television will be available to more than 90 per cent, of the Australian community. Recent legislation providing for translator stations, to relay programmes from country stations, will enable even wider coverage.","N/A","GOVERNOR-GENERALS SPEECH","/hansard/chamber.xscript/debate[14]/para[41]","N/A","N/A"
194,0,0,0,0,0,0,0,1,"N/A","N/A","N/A","N/A","N/A","N/A","Australia has participated in the construction of a marine cable known as COMPAC to link Canada with Australia and New Zealand as part of a round-the-world cable scheme. The final stage was completed in December, 1963. A cable link known as SEACOM will also be established wilh South-East Asia and work is already progressing.","N/A","GOVERNOR-GENERALS SPEECH","/hansard/chamber.xscript/debate[14]/para[42]","N/A","N/A"
195,0,0,0,0,0,0,0,1,"N/A","N/A","N/A","N/A","N/A","N/A","There are significant developments in shipbuilding. The latest passenger vessel built in Australia, the Empress of Australia, was launched recently and should be completed at the end of the year. Tenders are now open for the construction of four 47,000-ton bulk carriers in Australian shipyards, and these will be the largest ever built here.","N/A","GOVERNOR-GENERALS SPEECH","/hansard/chamber.xscript/debate[14]/para[43]","N/A","N/A"
196,0,0,0,0,0,0,0,1,"N/A","N/A","N/A","N/A","N/A","N/A","The coastal carriage of petroleum products in Australian registered and Australian built tankers has been under discussion with interested parties. The policy of financial assistance in the construction of ships in Australia has also been under consideration following a recent rev:sw by the Tariff Board.","N/A","GOVERNOR-GENERALS SPEECH","/hansard/chamber.xscript/debate[14]/para[44]","N/A","N/A"
197,0,0,0,0,0,0,0,1,"N/A","N/A","N/A","N/A","N/A","N/A","Later this year the two major internal . airlines will introduce jet aircraft. In international aviation my Government recently approved of Qantas purchasing early delivery positions for supersonic aircraft to come into international service in the 1970s. The Government is carrying out a five year plan of airport construction and the installation of long range radar equipment for all-traffic control purposes.","N/A","GOVERNOR-GENERALS SPEECH","/hansard/chamber.xscript/debate[14]/para[45]","N/A","N/A"
198,0,0,0,0,0,0,0,1,"N/A","N/A","N/A","N/A","N/A","N/A","Following publication of the Governments broad statement on restrictive trade practices, my advisers have received criticisms and suggestions and have had valuable discussions with various organizations. The Government will introduce a bill to the Parliament and leave it open to public scrutiny for a reasonable time before it is taken up in debate.","N/A","GOVERNOR-GENERALS SPEECH","/hansard/chamber.xscript/debate[14]/para[46]","N/A","N/A"
199,0,0,0,0,0,0,0,1,"N/A","N/A","N/A","N/A","N/A","N/A","My Government will put into effect at the earliest possible date two housing proposals, one to make it easier for young married people to own a home of their own, and the other to increase the flow of private funds for housing in Australia.","N/A","GOVERNOR-GENERALS SPEECH","/hansard/chamber.xscript/debate[14]/para[47]","N/A","N/A"
200,0,0,0,0,0,0,0,1,"N/A","N/A","N/A","N/A","N/A","N/A","The first scheme aims at encouraging young people to save to acquire a dwelling by offering a financial incentive for such saving. My Minister for Housing, intends to introduce into the Parliament early this session legislation to authorize the operation of this scheme. The proposed conditions of eligibility of savings for the grant and the manner of operation of the scheme will then be put before the Parliament.","N/A","GOVERNOR-GENERALS SPEECH","/hansard/chamber.xscript/debate[14]/para[48]","N/A","N/A"
201,0,0,0,0,0,0,0,1,"N/A","N/A","N/A","N/A","N/A","N/A","The second proposal is designed to Improve the availability of loans on reasonable terms from private sources for the purchase or construction of a home, or the discharge of an casting mortgage. My Government intends to present to the Parliament legislation to authorize insurance of the repayment of principal and the payment of interest on private loans for any of these purposes.","N/A","GOVERNOR-GENERALS SPEECH","/hansard/chamber.xscript/debate[14]/para[49]","N/A","N/A"
202,0,0,0,0,0,0,0,1,"N/A","N/A","N/A","N/A","N/A","N/A","The Government will introduce legislation to increase child endowment for the third and subsequent children to 15s. a week and to grin endowment of 15s. a week in respect of full-time students between the ages of 16 and 21 years.","N/A","GOVERNOR-GENERALS SPEECH","/hansard/chamber.xscript/debate[14]/para[50]","N/A","N/A"
203,0,0,0,0,0,0,0,1,"N/A","N/A","N/A","N/A","N/A","N/A","Legislation will be introduced during this session for the purpose of giving effect to two policy changes in the health field, namely, that Commonwealth medical benefits be increased by 33i per cent, and that the existing limit of ,£10,000,000 applying to grants to the States for the building or equipping of mental health treatment centres will not apply for the next three years. All contributors to medical benefits insurance funds will be entitled to the increase in the Commonwealth medical benefits without being required to make any increase in their weekly contributions to the funds.","N/A","GOVERNOR-GENERALS SPEECH","/hansard/chamber.xscript/debate[14]/para[51]","N/A","N/A"
204,0,0,0,0,0,0,0,1,"N/A","N/A","N/A","N/A","N/A","N/A","In the very important field of education, my Government will continue to provide substantial financial assistance for universities. In addition to the grants to the States for their universities, which were provided by the act of 1963, legislation will provide additional finance for the teaching costs of medical hospitals during the 1964-66 triennium, and towards meeting the costs of higher levels of academic salaries. For the purpose of its grants to the States, the Government has accepted an interim level of academic salaries as from 1st July, 1963, and will shortly be establishing an inquiry to recommend a level of academic salaries for grant purposes during the current triennium.","N/A","GOVERNOR-GENERALS SPEECH","/hansard/chamber.xscript/debate[14]/para[52]","N/A","N/A"
205,0,0,0,0,0,0,0,1,"N/A","N/A","N/A","N/A","N/A","N/A","The Government keenly recognizes scientific research as vital both for higher education and for national growth. It is giving further consideration to its role in- this field.","N/A","GOVERNOR-GENERALS SPEECH","/hansard/chamber.xscript/debate[14]/para[53]","N/A","N/A"
206,0,0,0,0,0,0,0,1,"N/A","N/A","N/A","N/A","N/A","N/A","In the near future the Government will receive, and at once consider, a report from a committee which has been studying various aspects of tertiary education with a view to recommending what the future pattern of education in this field should be.","N/A","GOVERNOR-GENERALS SPEECH","/hansard/chamber.xscript/debate[14]/para[54]","N/A","N/A"
207,0,0,0,0,0,0,0,1,"N/A","N/A","N/A","N/A","N/A","N/A","The Government has received a mandate for new measures of assistance for secondary and technical education. It will introduce a scheme of secondary school scholarships involving 10,000 awards annually, open competitively to all secondary school students for the last two years of secondary education, and providing a maintenance grant of £100 per annum without means test and up to £100 per annum for fees and books. There will be 2,500 scholarships annually on a comparable basis for students at technical schools. An amount of £5,000,000 per annum will be made available to all secondary schools, government and independent, for the provision of building and equipment facilities for science teaching. There will be an annual grant of £5,000,000 to the States towards the building and equipment costs of technical schools.","N/A","GOVERNOR-GENERALS SPEECH","/hansard/chamber.xscript/debate[14]/para[55]","N/A","N/A"
208,0,0,0,0,0,0,0,1,"N/A","N/A","N/A","N/A","N/A","N/A","The development of comprehensive and detailed arrangements between the Commonwealth and the States and independent school authorities has been put in hand. Effect will be given to the new measures, by legislation where necessary, as soon as practicable.","N/A","GOVERNOR-GENERALS SPEECH","/hansard/chamber.xscript/debate[14]/para[56]","N/A","N/A"
209,0,0,0,0,0,0,0,1,"N/A","N/A","N/A","N/A","N/A","N/A","My advisers consider that it is necessary to increase the size of the Ministry to meet modern circumstances. A bill to amend the Ministers of State Act will be placed before the Parliament in the early days of this session. Its purpose will be to permit the appointment of 25 Ministers instead of 22.","N/A","GOVERNOR-GENERALS SPEECH","/hansard/chamber.xscript/debate[14]/para[57]","N/A","N/A"
210,0,0,0,0,0,0,0,1,"N/A","N/A","N/A","N/A","N/A","N/A","My Government will submit amendments to the Representation Act and to the Electoral Act. Under the current provisions of the Representation Act, the Chief Electoral Officer, in determining the number of members each State shall have in the House of Representatives, is required to find that where, after dividing the State population by the electoral quota, there is a remainder equal to less than one-half of the quota, no member shall be chosen in respect of that remainder. In a situation where State populations are growing at different rates, this requirement can have the effect that some States may lose representation, despite a general growth. My Government considers that, in such circumstances, there should be no loss of representation, and proposes to legislate accordingly.","N/A","GOVERNOR-GENERALS SPEECH","/hansard/chamber.xscript/debate[14]/para[58]","N/A","N/A"
211,0,0,0,0,0,0,0,1,"N/A","N/A","N/A","N/A","N/A","N/A","Regarding the Electoral Act, my Government will introduce amending legislation to make it clear that, in making any proposed distribution of a State into divisions for electoral purposes, the Distribution Commissioners shall take into account community of economic, social and regional interests, difficulties of communication, remoteness or distance, the trend of population changes, physical features, and the relative areas of proposed divisions. No fixed quota differential is proposed.","N/A","GOVERNOR-GENERALS SPEECH","/hansard/chamber.xscript/debate[14]/para[59]","N/A","N/A"
212,0,0,0,0,0,0,0,1,"N/A","N/A","N/A","N/A","N/A","N/A","I now leave you to the discharge of your high and important duties, in the faith that Divine Providence will guide your deliberations and further the welfare of the people of the Commonwealth.","N/A","GOVERNOR-GENERALS SPEECH","/hansard/chamber.xscript/debate[14]/para[60]","N/A","N/A"
213,0,0,0,0,0,0,0,1,"N/A","N/A","N/A","N/A","N/A","N/A","Motion (by Sir Robert Menzies) agreed ito -","N/A","ADDRESS-IN-REPLY","/hansard/chamber.xscript/debate[15]/para","N/A","N/A"
214,0,0,0,0,0,1,0,1,"N/A","N/A","N/A","N/A","N/A","N/A","That a committee, consisting of Mr. Kevin Cairns, Mi. Maisey and the mover, be appointed to prepare an Address-in-Reply to the Speech delivered by His Excellency the Governor-General to both Houses of the Parliament, and that the committee do report this day.","N/A","ADDRESS-IN-REPLY","/hansard/chamber.xscript/debate[15]/quote/para","N/A","N/A"
215,0,0,0,1,0,0,0,1,"MENZIES, Robert","N76","KooyongPrime Minister","LP","N/A",14,"- As honorable members know, since we last met the death by assassination of President John Kennedy of the United States of America occurred on Friday, 22nd November, 1963. He was the thirty-fifth President of his country and had held office for two years and ten months when his life, as I have said, came to its end in this brutal fashion. President Kennedy was sworn in on 20th January, 1961, and in his inaugural address to the people of the United States he set forth both the aim and the promise of his administration, namely, to begin anew the quest for peace and to seek a world alliance against tyranny, poverty, disease and war.The late president was born in Massachusetts on 29th May, 1917. He was elected to the United States House of Representatives in 1946. In 1952 he entered the United States Senate as senator for the State of Massachusetts. In 1960 he won the Democratic Partys nomination for the presidency and was elected president in November of that year. He was the youngest man ever to be elected President of the United States.During the war he served with very great courage and distinction in the United States Navy and, as honorable members know, he had an association at that time with our own country through the activities of an Australian coast watcher, activities which he never ceased to refer to with marked gratitude.He was a very remarkable man. I will always regard it as a great privilege to have known him and to have discussed various matters with him. He was a remarkable man from the point of view of the world because he had large ideas and, as experience grew, he was able to pursue those ideas with more and more force and point. He undoubtedly had a great contribution yet to make to the world. He was of great significance to us in Australia because in a simple, unaffected and inquiring way he had a feeling of friendship for Australia and a feeling of interest in this country which I am bound to say I have never known quite equalled by any of his predecessors. He was a friend of ours.So the world has lost a leader and we have lost a friend. His wife has lost a famous husband and his children have lost a great father. Most of us in one way or another have taken the opportunity to say something about this event and to convey our sympathy, but I think it is appropriate that we in this House should place our feelings on record in due parliamentary form so that our expression is the product of this Parliament and of this country. I therefore move -That this House records its sincere regret at the death- of John Fitzgerald Kennedy, President of the United States of America, places on record its appreciation of his high courage and devoted service to the cause of international peace, expresses to the people of the United States its profound regret at the loss they have suffered, and tenders its deep sympathy to Mrs. Kennedy and her family in their bereavement.","N/A","DEATH OF PRESIDENT KENNEDY OF THE UNITED STATES OF AMERICA","/hansard/chamber.xscript/debate[16]/speech[1]/talk.start/para","N/A","N/A"
216,0,0,0,1,0,0,0,1,"CALWELL, Arthur","BV8","Melbourne","N/A","Leader of the Opposition",15,". - I support the motion. 1 want to say only a few words about the person who was taken from this earth so suddenly and in such shocking circumstances in November of last year. A great and good man died and a generous and noble heart ceased to beat when John Fitzgerald Kennedy, the thirty-fifth President of the United States, fell before an assassins bullet at Dallas, Texas, on 22nd November, 1963.President Kennedy attained the worlds highest elective office at the early age of 43. His occupancy of that office ended all too soon, with his work, so full of promise for his country, so full of hope for us all, only just begun. Like his illustrious predecessor Abraham Lincoln, he sought to make great and significant changes in the society in which he was called to lead. Like Lincoln, he knew that a house divided against itself cannot stand; it was President Kennedy who said, in the spirit of Lincoln -The science of weapons and war has made us all one world and one human race, with one common destiny.Like Lincoln, he met his death at the hands of an assassin.Death is always sad, whenever, at whatever age, it comes. Death takes on an unutterable sadness when it strikes down a nations chief executive at the full height of his powers, with great prospects opening up for him and his country. But when death comes as it did to John Fitzgerald Kennedy - the youngest president the United States has yet known, highly gifted, deeply dedicated, justly proud of his achievements, gracefully confident of his power to achieve more - and when that death comes with all the meaninglessness of assassination, then its sadness takes on a horror never to be obliterated from our memories.Let not the manner of his death obscure the meaning of his life, for in life his successes were noble and substantial. He will be remembered by a grateful world for his work in negotiating with Premier Khrushchev and Mr. Macmillan the partial nuclear test ban treaty. This is, and must be, regarded as a, milestone along the long and difficult road towards universal disarmament. His firm but restrained handling of the Cuban crisis in 1962, his clear but calm attitude towards the Berlin problem and his vigorous warnings of the futility of nuclear war all raised the hopes of mankind for a better, saner world. By his very strength of character and the purpose and ability with which he pursued his policies for human betterment; President Kennedy naturally became a controversial figure in his own country and beyond it. He strove to break down the barriers of racial discrimination. In doing so, he stirred up bitter animosities. In the light of the many still unresolved century-old problems created by the Civil War, such a situation seemingly was inevitable.What John F. Kennedy might have achieved had he lived out his full term of office and had he been, as seems most likely, elected for a second term, remains a subject only for speculation now. He will always remain a symbol of youthful promise, unfulfilled through tragic early death. But it is what he achieved that matters, and already he had won a place in the hearts of his fellow citizens and of freedom-loving people everywhere. In his last message to the people of the world, delivered at the United Nations General Assembly a few weeks before he died, John F. Kennedy spoke of the qest for peace and said that the badge of responsibility in the modern world was a willingness to seek peaceful solutions.  Let us , he said,  take our stand in the United Nations and let us see if we, in our time-, can move the world towards a just and lasting peace. These words, from one of his last great speeches, might well be his epitaph. May his memory remain ever-green and may the sum total of his achievements shine as a beacon light for those who seek the path to peace and a better life for all mankind.No tribute to the late president should neglect to make reference to his brave and gracious wife. The days of sorrow have been more difficult for her than for any one else, but she was blessed, as few women have been, to give her hero husband the comfort of her arms in the hour of his death. In life and in death she was beside him. History will not fail to find its place for Jacqueline Kennedy as one of the most distinguished women of America and one of its most notable and courageous First Ladies.Question resolved in the affirmative, honorable members standing in their places.","N/A","DEATH OF PRESIDENT KENNEDY OF THE UNITED STATES OF AMERICA","/hansard/chamber.xscript/debate[16]/speech[2]/talk.start/para","N/A","N/A"
