index,question_flag,answer_flag,interjection_flag,speech_flag,petition_flag,quote_flag,motionnospeech_flag,chamber_flag,name,name.id,electorate,party,role,page.no,content,subdebateinfo,debateinfo,path,Speaker,Time
194,0,0,0,1,0,0,0,1,"Senator PARER","KI4","(Queensland)","LP","N/A",1692,"—That is on amendment No. 1. Amendment No. 2 states:The Minister must cause a copy of the corporate plan to be laid before each House of Parliament:(a)within 15 sitting days after the Minister received the plan, if the Minister did not direct the members to vary the plan; or(b)within 15 sitting days after the Minister received a revised plan, if the Minister did direct the members to vary the plan..An argument was put that this is really a GBE and, as such, the rules, regulations and conditions that apply to other GBEs should apply to AA, or Airservices Australia. We have taken a contrary point of view because it is plainly obvious that AA is not a normal GBE in that it is a monopoly. It is no good saying that this will appear in the annual report, because the annual report will not be seen by members of parliament for 12 months. Therefore, that is the purpose of that amendment.The third amendment relates to the minister giving a direction under various sections of the act. The minister shall cause a copy of the direction or notice to be laid before each house of parliament within 15 sitting days. I draw the attention of the Senate to the fact that this was a recommendation of the joint house committee chaired by Mr Peter Morris which was ignored by the government.In summary, the first amendment, for which we do not have the support of the minor parties, we would like to see embodied in the legislation. But, in the interests of time, we will not call a division. We have the support of the other parties for the second two amendments. Again in the interests of time, I suggest that the government follows the same course that we are proposing for amendment No. 1.","N/A","CIVIL AVIATION LEGISLATION AMENDMENT BILL 1995 AIR SERVICES BILL 1995","/html/body/hansard/chamber.xscript/debate[11]/debate.sub1[1]/speech[6]/talk.start[2]/para","N/A","N/A"
195,0,0,0,1,0,0,0,1,"Senator SCHACHT","4J4","(South Australia-","ALP","Minister for Small Business, Customs and Construction)",1693,"—I acknowledge coming in at very short notice on the rotation of duty ministers. I acknowledge the fact that Senator Parer is trying to save time; we appreciate that. In relation to amendment No. 1, I am advised that, where it says `CASA, it should read `Airservices Australia. But that amendment is not supported by the other parties and he is not calling a division on it. With regard to amendment No. 2, I am advised that the minister believes this is an important amendment, so he does want to call a division.","N/A","CIVIL AVIATION LEGISLATION AMENDMENT BILL 1995 AIR SERVICES BILL 1995","/html/body/hansard/chamber.xscript/debate[11]/debate.sub1[1]/speech[7]/talk.start[1]/para","N/A","N/A"
196,0,0,1,0,0,0,0,1,"Senator Parer","KI4","N/A","N/A","N/A","N/A","—He didnt do it last time.","N/A","CIVIL AVIATION LEGISLATION AMENDMENT BILL 1995 AIR SERVICES BILL 1995","/html/body/hansard/chamber.xscript/debate[11]/debate.sub1[1]/speech[7]/interject[1]/talk.start/para","N/A","N/A"
197,0,0,0,1,0,0,0,1,"Senator SCHACHT","4J4","(South Australia-","ALP","Minister for Small Business, Customs and Construction)",1693,"—I am advised that it was not considered relevant then but that we do think it is this time. We will call a division on amendment No. 2. With regard to amendment No. 3, we will record the fact that we do not accept the amendment, but we will not call a division.","N/A","CIVIL AVIATION LEGISLATION AMENDMENT BILL 1995 AIR SERVICES BILL 1995","/html/body/hansard/chamber.xscript/debate[11]/debate.sub1[1]/speech[7]/talk.start[2]/para","N/A","N/A"
198,0,0,1,0,0,0,0,1,"Senator Parer","KI4","N/A","N/A","N/A","N/A","—I reiterate the point that we are not calling a division simply in the interests of time.Amendment No. 1 negatived.Question put:That amendment No. 2 ( Senator Parers ) be agreed to.Amendment No. 3 agreed to.Bill, as amended, agreed to.Bills reported with amendments; report adopted.","N/A","CIVIL AVIATION LEGISLATION AMENDMENT BILL 1995 AIR SERVICES BILL 1995","/html/body/hansard/chamber.xscript/debate[11]/debate.sub1[1]/speech[7]/interject[2]/talk.start/para","N/A","N/A"
199,0,0,0,0,0,0,0,1,"N/A","N/A","N/A","N/A","N/A","N/A","Bills (on motion by Senator Schacht ) read a third time.","N/A","CIVIL AVIATION LEGISLATION AMENDMENT BILL 1995 AIR SERVICES BILL 1995","/html/body/hansard/chamber.xscript/debate[11]/debate.sub1[2]/proctext/para","N/A","N/A"
200,0,0,0,1,0,0,0,1,"Senator SCHACHT","4J4","(South Australia-","ALP","Minister for Small Business, Customs and Construction)",1694,"—I move:That intervening business be postponed till after consideration of government business order of the day No. 7 (Competition Policy Reform Bill 1995).Honourable senators should also note it is the governments intention that only the second reading of this bill will be completed between 12.45 p.m. and 2 p.m. today.","N/A","ORDER OF BUSINESS","/html/body/hansard/chamber.xscript/debate[12]/debate.sub1/speech[1]/talk.start/para","N/A","N/A"
201,0,0,0,1,0,0,0,1,"Senator HARRADINE","6H4","(Tasmania)","IND","N/A",1694,"—I am not sure that I heard Senator Schacht correctly, but I thought he said that it is the intention of the government that speeches be given during the second reading debate on the Competition Policy Reform Bill 1995 and that the second reading be concluded by 2 p.m. That is not my understanding of the situation, because, as I see the list, I look to be No. 15 or 16 on the list, and I just do not think that we are going to get through all of the speeches to be made at the second reading stage.","N/A","ORDER OF BUSINESS","/html/body/hansard/chamber.xscript/debate[12]/debate.sub1/speech[2]/talk.start/para","N/A","N/A"
202,0,0,0,1,0,0,0,1,"Senator SCHACHT","4J4","(South Australia-","ALP","Minister for Small Business, Customs and Construction)",1694,"—What that means is that we will only hear speeches in the second reading stage in the time available. That time will only be for speeches made during the second reading stage. Clearly, there will be time for speeches to be made during further second reading debate. We are not cutting anybody out. Of course, if all senators wished to compress their speeches so that we could complete it by 2 oclock today, the government would be delighted, but that is only said in hope.Question resolved in the affirmative.","N/A","ORDER OF BUSINESS","/html/body/hansard/chamber.xscript/debate[12]/debate.sub1/speech[3]/talk.start/para","N/A","N/A"
203,0,0,0,0,0,0,0,1,"N/A","N/A","N/A","N/A","N/A","N/A","Debate resumed from 29 March, on motion by Senator Crowley :","N/A","COMPETITION POLICY REFORM BILL 1995","/html/body/hansard/chamber.xscript/debate[13]/debate.sub1/proctext/para[1]","N/A","N/A"
204,0,0,0,0,0,0,0,1,"N/A","N/A","N/A","N/A","N/A","N/A","That this bill be now read a second time.","N/A","COMPETITION POLICY REFORM BILL 1995","/html/body/hansard/chamber.xscript/debate[13]/debate.sub1/proctext/para[2]","N/A","N/A"
205,0,0,0,1,0,0,0,1,"Senator GIBSON","BX5","(Tasmania)","LP","N/A",1694,"—I rise on behalf of the coalition to speak about the Competition Policy Reform Bill 1995. The coalition supports this important bill and we welcome the moves to increase competition in the economy.The Trade Practices Act has applied to the corporate sector of the economy—which is most of it—for over 20 years since 1974. The essence of this bill is to extend the Trade Practices Act to reach the government sector and the unincorporated enterprises within the economy. With the government sector—the government businesses, the government commercial enterprises—we are talking about something like 10 per cent of our GDP. So it is a very important sector and a very important provider of essential services. We want competition within that sector so that it is more efficient and so that businesses can get on with being more efficient and world competitive.The proposed framework allows competition within these sectors and the onus goes back on government, particularly the state governments, to adopt competition policies. We are talking about a new procedure—an access regime—whereby people will be able to access the essential monopolies, such as electricity for the transmission grid, gas pipelines, rail lines and ports. There are two arms in relation to this bill: the administrative and enforcement arm, which is the Australian Competition and Consumer Commission; and the policy and advice arm, which is the National Competition Council.This bill comes to us because, at long last, there has been agreement between the Commonwealth and the states, with each of the states agreeing to implement competition in their respective areas. There will be hurdles for the states with respect to performance on electricity, gas, water and road transport over the ensuing years. If the states clear those hurdles, as will be judged by the NCC, they will qualify for additional income from the Commonwealth.Why is this competition important? It is extremely important because it offers the prospect of increased efficiency within the economy. I commend to senators and to the public the Industry Commissions report of March of this year on the growth and revenue implications of the Hilmer and associated reforms. It estimates that implementing all those reforms will add 5.5 per cent to GDP. Since GDP is presently around $470 billion, that increase is equivalent to around $23 billion. For consumers, that will mean an additional $9 billion, the equivalent of about $1,500 per household, if these reforms are implemented.The reforms by the Commonwealth will contribute about $4 billion out of the $23 billion, with the Commonwealth getting increased revenue of about $6 billion. If the states carry out all the reforms, they will contribute about $19 billion to the $23 billion and will have increased revenues of about $3 billion.I would like to share my experience in one of those monopoly areas—the electricity industry. When I was in the commercial world I had experience as a major electricity buyer for Australian Newsprint Mills. I was the leader of a team which built a newsprint mill at Albury in New South Wales about 15 years ago. We spent $200 million at that time establishing a world-class, internationally competitive pulp and paper mill. But we were very dependent upon electricity.Within 12 months of building the mill and getting it going, the Wran government doubled the price of electricity to the mill, making it uneconomic. The mill would never have been built if the directors had known that the New South Wales government was going to do that. If there had been a national grid at that time and if we had been able to negotiate with a different supplier, that particular mill would have been profitable from the end of its first year. Instead, it had major losses for several years.I suggest that, had it not had to meet that price rise, the mill would have doubled in size by now, attracting, in current day costs, an additional $500 million in investment. Australia would be importing much less newsprint and would probably be exporting some of similar grades. But that has not happened because a state government doubled the price of electricity to an industry without due warning. That disastrous experience is a good example of how to frighten off investors.On the other side of the coin, before coming here I was chairman of the Hydro-Electric Commission, an electricity supplier, for four years. It was obvious that a national grid was coming and we went through a major program of reform in the face of eventual competition. We spent a lot of time and effort on improving productivity. I am proud to say that that organisation has doubled its labour productivity over the last several years through contracting out and outsourcing goods and services rather than having everyone employed within the one organisation. Sadly, I refer to an article in last Mondays Hobart Mercury , which reports that Labors state opposition energy spokesman, Dr Amos, has criticised the HEC for engaging so many consultants. According to the article:Dr Amos said an organisation should be able to manage its own affairs.If an organisation cannot manage its own affairs, then it is an organisation that is out of control, he said.What absolute nonsense! The whole point is that organisations cannot have experts in everything involved within the organisation. They need to contract out and buy in external services. That is part of being efficient.The Hilmer reform puts the onus back on the states to perform but they get rewards for doing so. If they clear the hurdles, they get additional income from the Commonwealth. So it is up to them. The states can exclude some entities from competition if they wish to, but of course the community will not get the overall benefits if that is done.Also in my home state of Tasmania, as reported in the Mercury of last week, there has been some criticism from the Public Sector Union, warning that competition may not be good for Tasmania. It suggests that we could see price rises, service cuts, loss of public revenue and great dangers for consumers. Again, what absolute nonsense!We must have more efficient public sector businesses so that the whole of the economy is facing up to being internationally competitive. There is no question about that. My own state has to face up to that and I know that the Tasmanian government is facing up to it. On the same theme, Hilmer said that national competition policy is not an agreement to be signed; it is a raft of difficult reforms to be implemented over many years.","N/A","COMPETITION POLICY REFORM BILL 1995","/html/body/hansard/chamber.xscript/debate[13]/debate.sub1/speech[1]/talk.start[1]/para","N/A","N/A"
206,0,0,1,0,0,0,0,1,"Senator Kernot","XW4","N/A","N/A","N/A","N/A","—To whose benefit?","N/A","COMPETITION POLICY REFORM BILL 1995","/html/body/hansard/chamber.xscript/debate[13]/debate.sub1/speech[1]/interject/talk.start/para","N/A","N/A"
207,0,0,0,1,0,0,0,1,"Senator GIBSON","BX5","(Tasmania)","LP","N/A",1694,"—To the consumers benefit. Read the Industry Commissions report. I might also add that New South Wales is quite well prepared for this. Last week, the Premier, Mr Carr, made reference to the fact that the general government sector—government departments and agencies—would be required to engage in contracting reviews and market testing. That is, it will be calling tenders for the provision of particular services to see if outside contractors can provide them more cheaply but without loss of quality. We applaud that move. All state governments are doing this. I know that in my state of Tasmania the government has made enormous gains in efficiency and competitiveness.As I said before, the coalition welcomes these reforms but we have problems with the lack of action exhibited by the federal government. The reforms do not cover the labour market. For example, the National Farmers Federation gave evidence before a Senate committee on 5 May about the meat industry and said that, while the product markets for that industry are exposed to world markets, the labour market is not and, as a consequence, the cost of processing meat in Australia is double that of other world processors.The government backed away from secondary boycotts and shifted them from the Trade Practices Act to the Industrial Relations Act and substantially weakened the concept. It is a real threat to small business and big business. We have an example in aviation where the government backed down on the trans-Tasman integration. The government failed to meet the agreement it had entered into.We have the example of the waterfront where a lot of money has been spent, but with what result? There has not been much improvement in efficiency. Contship Containerliners measures wharf productivity at about 40 world ports based on the experiences of its own ships. In the first half of 1993 Sydney ranked 31 out of 40 and Melbourne ranked 20. By late 1994, Sydney ranked 31 out of 44 and Melbourne ranked 39. That is a serious deterioration. We have other figures in a similar vein.The Commonwealth government has backed away from shipping. It has done nothing about the trans-Tasman accord which was an agreement tied up by Australian and New Zealand unions to remove competition. The government has refused to allow international ships to trade on the Australian coastline. The government has retained part 10 of the Trade Practices Act for outward cargo liner shipping services operated by an international cartel—called a conference in the trade. This was against advice that the government received from the Hilmer committee, the Trade Practices Commission, the Prices Surveillance Authority, the Treasury and the Industry Commission. We also have the example of the government ducking issues concerning ANL.Recently we had the Commonwealth government ducking issues with regard to compact disks. The Australian community was promised efficiency and world prices for compact disks, but when it came to the crunch the government backed away.What has the government done to help business and investment in Australia? The government has added substantial taxes to the business sector. While the government talks competition, it is headed in the reverse direction on things which are within its own control. Since Prime Minister Keating came into power the total revenue of this government will rise from $100 billion in 1993-94 to an expected $124 billion next year. That is a huge increase in revenue. It is an example of a high taxing, high spending government.The opposition welcomes the Competition Policy Reform Bill 1995. We are pleased to see competition being brought in for an additional substantial sector of the Australian economy. The emphasis now moves back to the states. The coalition is delighted that the state premiers have signed off and have agreed to implement these difficult reforms.","N/A","COMPETITION POLICY REFORM BILL 1995","/html/body/hansard/chamber.xscript/debate[13]/debate.sub1/speech[1]/talk.start[2]/para","N/A","N/A"
208,0,0,0,1,0,0,0,1,"Senator KERNOT","XW4","(Queensland-","AD","Leader of the Australian Democrats)",1697,"—Here we go again, embracing another theory. Despite all the evidence of the last decade, here we go again. Unquestionably competition is always good—","N/A","COMPETITION POLICY REFORM BILL 1995","/html/body/hansard/chamber.xscript/debate[13]/debate.sub1/speech[2]/talk.start[1]/para","N/A","N/A"
209,0,0,1,0,0,0,0,1,"Senator Panizza","JI4","N/A","N/A","N/A","N/A","—Of course it is.","N/A","COMPETITION POLICY REFORM BILL 1995","/html/body/hansard/chamber.xscript/debate[13]/debate.sub1/speech[2]/interject[1]/talk.start/para","N/A","N/A"
210,0,0,0,1,0,0,0,1,"Senator KERNOT","XW4","(Queensland-","AD","Leader of the Australian Democrats)",1697,"—I will go on to talk about that in my speech. I might refer to Compass Airlines. I will come back to aviation later. Through you, Mr Acting Deputy President, I say to Senator Panizza: you cannot always embrace theories unilaterally or universally without thinking about their impact on ordinary people. You must ask the question: who pays the cost of change? That is the point I want to make in this speech.The Competition Policy Reform Bill 1995 will help set in train one of the most radical and far-reaching public reforms. The public sector as we know it will be forced to restructure in far-reaching and not necessarily positive ways. This bill will force public service agencies to reassess their role, their relationship to the public, and to realign their operations. I do not object to any of that. However, the focus is to do all of this on largely economic commercially driven lines. As I said, nobody objects to the notion of an efficient public sector, but the question is who pays for it.In the Democrats view, competition policy represents the victory of economics over equity, of competition over compassion and of accounting over accountability in the management of public services. Yet this bill, and the ramifications of this bill, have been the subject of very little public debate. It has been the subject of minimal public scrutiny. It has been debated in closed forums—not by Australian people who own this debate and the outcome of it.While the Industry Commission has debated it, while cabinet has debated it, and while COAG has debated it, everywhere I go Australian people are catching up with the fact that it exists. In my view, this bill highlights that parliament has been largely sidelined by the Keating government as the forum for policy debate.The deal with the states on competition policy is already signed and sealed, and all this bill does is make sure it is delivered. The merits of the argument as to whether the Hilmer path, as opposed to any other path, is the best path or the only path have not been adequately aired. It is simply assumed. The majority of the media in this country has already accepted the Hilmer philosophy as gospel without any challenge to the likely effects or the fundamentally doctrinaire belief underpinning it that all competition is good and all regulation is bad—just like Animal Farm .The Democrats foreshadow that we will be doing all we can to raise the profile of the competition policy debate because the potential of this bill in terms of restructuring the public sector, and the role the public sector has in supporting and holding together our society, cannot just be discounted. As we always say, the devil is in the detail and it will be in the detail of the implementation. We want to closely monitor the way that the states put this package into effect.We will need to make sure that higher user charges, the end of cross-subsidisation, the narrowing of community service obligations and the inevitable path to privatisation paved by this package do not lead to fewer public services to those who need them most—the low income earners and, especially, regional Australians. Competition policy has great potential for banditry and bastardy. We want to make sure that we keep the bandits and the bastards as honest as possible.The bill has six major components. It sets up an Australian Competition and Consumer Commission by merging the Trade Practices Commission and the Prices Surveillance Authority. It sets up a National Competition Council to oversee the general performance of governments in promoting competition policy reform. For the Commonwealth sector it establishes provisions for the declaration of certain infrastructure services to be available for access by the private sector to compete against the public sector provider. It modifies existing provisions in the Trade Practices Act on competitive conduct, including allowing the authorisation of price fixing for goods and for resale price maintenance, the repeal of price discrimination, the extension of the act to cover services as well as goods, the application of notification to third line forcing, and the removal of the shield of crown immunity for states and territories in running businesses.The bill facilitates the extension of the Trade Practices Act to individuals within state jurisdictions following agreement with the relevant states and territories. It abolishes prices surveillance, downgrading former powers of the PSA to price monitoring, and extends its power to state and territory businesses.It is predominantly because we do not believe that this bill has had enough public debate—and I do not mean parliamentary debate; I mean genuine Australian citizenry debate—that we are going to vote against it. We are not doing that because we believe everything in the bill is bad—of course there are some positive aspects to it—but because the competition policy reform agenda is based on a flawed premise and a duping of the Australian public.We are told that competition is good. Senator Gibson said that. The Hilmer report is laudatory of the untrammelled benefits of market and competition underpinning it. But we have heard that line for 12 years in this country since our first foray into deregulation. We were assured that deregulating financial markets would usher in a new competitive world of banking. It did, but for whom? For corporate customers who saw unlimited lines of credit open up before them. But for the hundreds of thousands of home borrowers and small businesses—","N/A","COMPETITION POLICY REFORM BILL 1995","/html/body/hansard/chamber.xscript/debate[13]/debate.sub1/speech[2]/talk.start[2]/para","N/A","N/A"
211,0,0,1,0,0,0,0,1,"Senator Boswell","YE4","N/A","N/A","N/A","N/A","—And farmers.","N/A","COMPETITION POLICY REFORM BILL 1995","/html/body/hansard/chamber.xscript/debate[13]/debate.sub1/speech[2]/interject[2]/talk.start/para","N/A","N/A"
