index,question_flag,answer_flag,interjection_flag,speech_flag,petition_flag,quote_flag,motionnospeech_flag,chamber_flag,name,name.id,electorate,party,role,page.no,content,subdebateinfo,debateinfo,path,Speaker,Time
117,0,0,0,1,0,0,0,1,"Senator COULTER","TF4","(South Australia)","AD","N/A",1672,"—I move:That the Senate take note of the answer given by the Minister for Primary Industries and Energy (Senator Bob Collins), to a question without notice asked by Senator Coulter this day, relating to an Australian Quarantine Inspection Service report into the importation of pilchards.This government has accepted, at least on paper, the precautionary principle. The precautionary principle says that one does not do things which potentially are likely to damage the environment in a significant way unless one is certain that the long-term effects are not going to be adverse. What we heard from the minister today was that, against a background of almost total ignorance, this government has placed no restrictions whatsoever on the importation of pilchards and their use in the wide variety of the Australian environment. We also heard about that lack of background information. I am glad that Minister Cook is in the chamber. Minister, this is an area where we need publicly funded research and we need a great deal more of it. This government is not providing those funds.","N/A","N/A","/html/body/hansard/chamber.xscript/qwn/question.block[23]/speech/talk.start/para","N/A","N/A"
118,0,0,1,0,0,0,0,1,"The Clerk",10001,"N/A","N/A","N/A","N/A","—Petitions have been lodged for presentation as follows:The petition of certain residents of the State of Western Australia respectfully showeth that the tax on selected building products, proposed in the May, 1995 Budget, will place an unwelcome burden on all Australians planning to build a new home, or carry out alterations and additions, or repairs/maintenance to existing homes. Moreover, it is considered that the tax is iniquitous in that, when introduced, it will apply retrospectively to people currently building homes, who had entered in good faith into `fixed price building contracts.Your petitioners most humbly pray that the Senate, in Parliament assembled, should reject the extension of proposed wholesales sales tax to building products.To the Honourable the President and Members of the Senate in the Parliament assembled:We the undersigned citizens strongly urge the Government to accept the Democrats proposal to drop the intended tax on essential building materials.We believe the proposed tax—adding between $600 and $1,200 on the cost of a medium-sized home and up to $3,000 over the life of a mortgage—will make it more difficult for Australians to buy their own home, increase maintenance costs and rents on existing houses, and hinder growth in the building industry.We call on the Government to drop the tax on essential building materials.To the Honourable the President and members of the Senate in Parliament assembled.We the undersigned respectfully call upon the Federal Government to phase out aerial spraying in accordance with recommendation 89 of the report of the Senate Select Committee on Agricultural and Veterinary Chemicals in Australia.To the Honourable the President and Members of the Senate in Parliament assembled:The petition of the undersigned citizens of Australia respectfully showeth that:1.We are opposed to the sex guide endorsed by Ms Lawrence, Minister for Health in the Keating Government, and published in the December issue of Cleo.2.We believe that the sex guide encourages dangerous sexual practices which could have serious medical and moral effects.We request the Senate to call on Ms Lawrence to withdraw her endorsement of this sex guide and for the Prime Minister, Mr Keating, to indicate his disapproval.And your petitioners, as in duty bound, will ever pray.","N/A","N/A","/html/body/hansard/chamber.xscript/petition.grp[1]/proctext/interject/talk.start/para","N/A","N/A"
119,0,0,0,1,0,0,0,1,"Senator COLSTON","PF4","(Queensland)","ALP","N/A",1673,"—On behalf of the Standing Committee on Regulations and Ordinances I give notice that 15 sitting days after today I shall move that the following delegated legislation be disallowed:The list read as follows —1.Applied Laws (Implementation)(Amendment) Ordinance 1995, Territory of Christmas Island Ordinance No.1 of 1995, made under the Christmas Island Act 19582.Applied Laws (Implementation)(Amendment) Ordinance 1995, Territory of Cocos (Keeling) Islands Ordinance No.1 of 1995, made under the Cocos (Keeling) Islands Act 19553.Determination No.2 of 1995, made under s.356 of the Student and Youth Assistance Act 19734.Road Transport Reform (Heavy Vehicle Standards) Regulations, as contained in Statutory Rules 1995 No.55, and made under the Road Transport Reform (Vehicles and Traffic) Act 19935.Instrument No.126 of 1995, made under ss.196B(2) of the Veterans Entitlements Act 19866.Radiocommunications (Multipoint Distribution Station Licences—Regional Licences) Guidelines No.1 of 1995, as contained in Statutory Rules 1995 No.74, and made under the Radiocommunications Act 19927.Civil Aviation Orders, Part 105 AD/B747/147, made under the Civil Aviation Act 19888.Determination No.T7 of 1995, made under s.15 of the Higher Education Funding Act 1988I seek leave to make a short statement about the committees concerns with this legislation.Leave granted.","N/A","NOTICES OF MOTION","/html/body/hansard/chamber.xscript/debate[1]/debate.sub1[1]/speech[1]/talk.start[1]/para","N/A","N/A"
120,0,0,0,1,0,0,0,1,"Senator COLSTON","PF4","(Queensland)","ALP","N/A",1673,"—The committees concerns with these instruments include possible prejudicial retrospectivity, discretions with no indication whether subject to review, possible invalidity, discrepancies requiring clarification, strict liability offences and a possible breach of personal rights. As usual, I seek leave to incorporate in Hansard a short summary of the matters raised by the committee.Leave granted.The summary read as follows —Applied Laws (Implementation)(Amendment) Ordinance 1995Territory of Christmas Island Ordinance No.1 of 1995 made under the Christmas Island Act 1958Applied Laws (Implementation)(Amendment) Ordinance 1995Territory of Cocos (Keeling) Islands Ordinance No.1 of 1995 made under the Cocos (Keeling) Islands Act 1955The Ordinances reinsert the Financial Institutions Duty Act 1983 (WA)(CI) and the Financial Institutions Duty Act 1983 (WA)(CKI) into the Schedule of the Applied Laws (Implementation) Ordinance 1992.These Ordinances are made retrospective to 1 January 1995. The Explanatory Statements for both Ordinances note that the Act that is being reinserted was inadvertently removed from the Schedule by the 1994 Ordinance. The Committee has written to the Minister seeking confirmation that the retrospectivity involved does not prejudicially affect any person other than the Commonwealth.Determination No.2 of 1995 made under s.356 of the Student and Youth Assistance Act 1973The Determination revokes Determination No.1 of 1995 and determines Guidelines for the exercise of the Secretarys power under s.355 of the Act.The Committee did not receive copies of Determination No.1 of 1995. Although Determination No.1 dated 6 January 1995 was published in the Gazette on 9 January 1995, Determination No.1 does not appear to have been tabled in either the Senate or the House of Representatives. If Determination No.1 was not tabled, then, under the provisions of subsection 48(3) of the Acts Interpretation Act 1901, it would cease to have effect on the expiration of 15 sitting days from its commencement date which would have been 9 March 1995.According to the Explanatory Statement for Determination No.2 of 1995, the Department operated under Determination No.1 until it was revoked. If so, the Department may have been acting without the authority of any Guidelines from 9 March 1995 until the commencement of No.2 of 1995.Given that the instrument deals with the release of private information, the Committee has written to the Minister seeking advice as to whether the above matters outlined are correct, and, if so, for advice as to whether any information was released in reliance on the Guidelines after the date of expiry and the legal consequences of releasing personal information without legal authority.As Determination No.2 of 1995 deals with the release of sensitive personal information, the Committee has also asked the Minister for confirmation that the Privacy Commissioner was consulted during the process of developing the Guidelines.Road Transport Reform (Heavy Vehicle Standards) Regulations Statutory Rules 1995 No.55The Regulations provide a set of standards, uniform throughout Australia, for the construction and performance of heavy motor vehicles and trailers.Proposed Regulation 7 provides that the Minister may exempt a specified vehicle from a requirement of the Heavy Vehicle Standards on being satisfied after applying a number of criteria. Section 18 of the Road Transport Reform (Vehicles and Traffic) Act 1993 provides for the delegation of this power and the subdelegation of it thereafter. The Committee wrote to the Minister seeking advice as to whether there is a right to an independent review of the exercise of this discretion.Proposed subregulation 9(1) provides strict liability in relation to the failure of a trailer to comply with a requirement in the proposed Regulations. Whereas it may be reasonable that the owner of the trailer and the driver of a vehicle towing the trailer should be subject to strict liability, the Committee notes that the owner of any motor vehicle towing the trailer would be subject to the same liability. The Committee is concerned that in some circumstances, according strict liability to the owner of a vehicle may be unreasonable. The Committee wrote to the Minister seeking advice in respect of the strict liability provisions.The Minister replied to the Committees correspondence regarding the above concerns. The Committee however, has written back to the Minister seeking further clarification of the interim legislative arrangements.Instrument No.126 of 1995 made under ss.196B(2) of the Veterans Entitlements Act 1986This instrument amends instrument No.99 of 1995 which determined a Statement of Principles relating to chronic myeloid leukaemia.The amendment replaces the word acute with the word chronic in clause 1(a). The Explanatory Statement notes that this amendment reflects the correct decision of the Repatriation Medical Authority. Instrument No.99 of 1995 was, however, part of the legal process reflecting that decision, and the decision was not accurately reflected in that instrument.The Committee has written to the Minister seeking confirmation that no person other than the Commonwealth has been prejudiced by the making of this amendment.Radiocommunications (Multipoint Distribution Station Licences—Regional Licences) Guidelines No.1 of 1995Statutory Rules 1995 No.74This instrument establishes the interference management regime for services provided under licences based on a Pal-B video transmission format and the Reference Receiving System relating to Multipoint Distribution Stations for Regional Australia Transmitter Licences.Under Guideline 17, the Spectrum Management Agency (SMA) may impose or vary the conditions of licences without regard to nearly all the other provisions of the Guidelines. Guideline 18 states that holders of licences are to be involved in the alteration and consent process and must agree before the Guidelines are breached. The only holders who may be involved in the process, however, are those holders of licences whose services, in the opinion of the SMA, may be affected by the variation or imposition of a condition under Guideline 17.The Committee has written to the Minister seeking advice as to whether the exercise of the discretion conferred on the SMA in Guidelines 17 and 18 is subject to an independent review on the merits.Civil Aviation Orders, Part 105 AD/B747/147 made under the Civil Aviation Act 1988This instrument amends the Schedule of Airworthiness Directives dealing with Stretched Upper Deck Evacuation Slides.The Directive states that compliance is prior to 6 April 1998. Given the background against which this date is set, the Committee has written to the Minister seeking confirmation that the compliance date is correct.Determination No.T7 of 1995 made under s.15 of the Higher Education Funding Act 1988This Determination provides for payment to nine universities to reimburse States for the HECS liability for State funded places in respect of the 1994 year.The Determination confers a substantial sum of money on the Southern Cross University. That institution, however, does not appear in the Table in subsection 4(1) of the Higher Education Act 1988 under any name. The Committee has written to the Minister seeking advice as to whether a declaration under subsections 4(2) and 4(3) has been made changing Table A to include Southern Cross University. If not, the Committee has asked the Minister for advice as to the authority under which the present Determination confers funds on this institution.The Committee has also written to the Minister requesting clarification as to discrepancies which exist between the institutions named in the Table in subsection 4(1) of the Act and those named in the Determination, and whether the appropriate declarations have been made under subsections 4(2) and 4(3) of the Act.","N/A","NOTICES OF MOTION","/html/body/hansard/chamber.xscript/debate[1]/debate.sub1[1]/speech[1]/talk.start[2]/para","N/A","N/A"
121,0,0,0,1,0,0,0,1,"Senator COLSTON","PF4","(Queensland)","ALP","N/A",1675,"—On behalf of the Standing Committee on Regulations and Ordinances, I give notice that, at the giving of notices on the next day of sitting, I shall withdraw Business of the Senate Notices of Motion Nos 1, 2 and 3 standing in my name for seven sitting days after today. I seek leave to make a short statement.Leave granted.","N/A","NOTICES OF MOTION","/html/body/hansard/chamber.xscript/debate[1]/debate.sub1[1]/speech[2]/talk.start[1]/para","N/A","N/A"
122,0,0,0,1,0,0,0,1,"Senator COLSTON","PF4","(Queensland)","ALP","N/A",1675,"—On 5 June 1995, I reported to the Senate on the committees concerns with these instruments, which related to a discretion with no indication whether subject to review and possible discrepancies requiring clarification. The relevant ministers have now provided the committee with information which meets our concerns. The committee is grateful for this cooperation. As usual, I seek leave to incorporate the committees correspondence in Hansard .Leave granted.The correspondence read as follows —11 May 1995Senator the Hon Nick BolkusMinister for Immigration and Ethnic AffairsParliament HouseCANBERRA ACT 2600Dear MinisterI refer to Statutory Rules 1995 No 38 being the Migration Regulations (Amendment) which were considered by the Committee at its meeting on 11 May 1995.Regulation 71 (on Page 41) amends item 8108 by adding a new discretion. Prior to the amendment the visa condition contained in item 8108 provided that the holder must not be employed in Australia by any one employer for more than 3 months. The amendment adds the phrase without the prior permission in writing of the Secretary.As this amendment confers a significant discretion on the Secretary the Committee would appreciate your confirmation that the exercise of this discretion is subject to independent review.Yours sincerelyMal ColstonChairman20 June 1995Senator Mal ColstonChairmanStanding Committee on Regulations and OrdinancesParliament HouseCANBERRA ACT 2600Dear Mal,Thank you for your letter of 11 May 1995 concerning the amendment to condition 8108 of the Migration Regulations in Statutory Rule No 38 of 1995.As you know, regulation 71 of Statutory Rule No 38 of 1995 amends condition 8108 to require that a person must not be employed in Australia by any one employer for more than 3 months without the permission in writing of the Secretary. Condition 8108 is only imposed in relation to subclass 417 (Working Holiday) visas.The working holiday scheme provides an opportunity for young people to holiday in Australia and supplement their funds through incidental work. Australia has formal working holiday agreements with Canada, the Republic of Ireland, Japan, the Republic of Korea, the United Kingdom and the Netherlands. The agreements enable nationals of those countries who have turned 18, but have not turned 31, to enter Australia as working holiday makers, provided they satisfy all prescribed criteria. Nationals of other countries who have turned 18, but have not turned 26, may also enter as working holiday makers, once again provided they satisfy all prescribed criteria for the grant of the visa.As the main reason for subclass 417 visa holders being in Australia is to holiday, it is intended that any employment in Australia should be incidental to that purpose. It is considered that, in most cases, working for long periods with one employer would be inconsistent with this policy intent. Accordingly, subclass 417 (Working Holiday) visas are granted subject to condition 8108.Prior to amendments to the Regulations in September 1994, the equivalent to condition 8108 (ie condition 9217) required that a person must not be employed by any one employer in Australia for more than three months without the permission in writing of the Secretary. It appears that the words without the permission in writing of the Secretary were omitted due to a drafting error during the drafting of the September 1994 Regulations. The amendment to condition 8108 accordingly restores the former position.As condition 8108 is a condition which attaches to a visa, rather than a criterion relating to the grant of a visa, the Secretarys discretion in relation to this condition is not subject to formal merits review. The exercise of this discretion is, however, subject to other accountability measures such as investigation by the Ombudsman.Thank you for bringing this matter to my attention.Yours sincerelyNICK BOLKUS11 May 1995The Hon Simon Crean MPMinister for Employment Education and TrainingParliament HouseCANBERRA ACT 2600Dear MinisterI refer to Determination No T29 of 1994 made under s.16 of the Higher Education Funding Act 1988 which is presently before the Committee.This Determination provides for the additional allocations of grants for limited operating purposes for 1995 to institutions throughout Australia that are not part of the Unified National System.The Explanatory Statement (last sentence) states that the additional grants represent cost supplementation for base operating grants for three named institutions. Two of the institutions named, the Australian National University and the University of Canberra, are not mentioned in the Determination itself, whereas three other institutions are. These three institutions, being Avondale College, Marcus Oldham College of Farm Management and Batchelor College, are not referred to in the Explanatory Statement.The Committee would appreciate your advice as to whether the institutions named in either document, the Determination or the Explanatory Statement, should be substituted for others.Yours sincerelyMal ColstonChairman11 May 1995The Hon Simon Crean MPMinister for Employment Education and TrainingParliament HouseCANBERRA ACT 2600Dear MinisterI refer to Determination No T34 of 1994 made under s.15 of the Higher Education Funding Act 1988 which adjusts the Higher Education Contribution Scheme liabilities of institutions for 1994.A discrepancy concerning the name of an institution has been noted by the Committee. The Table in s.4(1) of the Higher Education Funding Act 1988 refers to an institution as the Ballarat University College. The Determination refers to the University of Ballarat. It is also noted that the procedure for changing the name of an institution in the Table is set out in subss. 4(2) and 4(3) of the Act.The Committee would be grateful for your advice confirming whether these institutions are one and the same, and, if they are, whether a declaration has been made under subss. 4(2) and 4(3) of the Higher Education Funding Act 1988 to amend the Table in s.4(1) by changing the name of the institution.Yours sincerelyMal ColstonChairman9 June 1995Senator Mal ColstonChairmanSenate Standing Committee on Regulations and OrdinancesParliament HouseCANBERRA ACT 2600Dear Senator ColstonThank you for your letters of 11 May 1995 concerning Determinations Nos. 29 of 1994, 34 of 1994 and G2 of 1995. I provide the following in response to your questions.In regard to Determination No. 29 of 1994, your Committee sought advice on whether the institutions named in either the Determination or the Explanatory Memorandum should be substituted for others. The names in the Explanatory Memorandum are incorrect. The Australian National University and the University of Canberra should be substituted by Avondale College, Marcus Oldham College of Farm Management and Batchelor College.The Committee sought confirmation, in relation to Determination No 34 of 1994, that the Ballarat University College and the University of Ballarat are the same institution. On 1 February 1994 I declared under subsection 4(2) of the Higher Education Funding Act 1988 that subsection 4(1) of the Act was amended by deleting Ballarat University College and inserting University of Ballarat. I have attached a copy of this declaration for your information.The Committee also sought confirmation that the confusion in the numbering system, as a result of Determination No G2 of 1995, would be avoided in the future. My Department will ensure that a more prominent system of numbering will be adopted in the future.Yours SincerelySIMON CREAN","N/A","NOTICES OF MOTION","/html/body/hansard/chamber.xscript/debate[1]/debate.sub1[1]/speech[2]/talk.start[2]/para","N/A","N/A"
123,0,0,0,1,0,0,0,1,"Senator COLSTON","PF4","(Queensland)","ALP","N/A",1677,"—Pursuant to notice given on 21 June, on behalf of the Regulations and Ordinances Committee I now withdraw business of the Senate notices of motion Nos 1 to 15 standing in my name for today.","N/A","NOTICES OF MOTION","/html/body/hansard/chamber.xscript/debate[1]/debate.sub1[1]/speech[3]/talk.start/para","N/A","N/A"
124,0,0,0,1,0,0,0,1,"Senator McMULLAN","5I4","(Australian Capital Territory-","ALP","Minister for Trade)",1678,"—I give notice that, on the next day of sitting, I shall move:That the order of the Senate of 29 November 1994, relating to the consideration of legislation, not apply to the following bills:Child Care Legislation Amendment Bill 1995Electoral and Referendum Amendment Bill 1995Industry Research and Development Amendment Bill 1995.","N/A","NOTICES OF MOTION","/html/body/hansard/chamber.xscript/debate[1]/debate.sub1[2]/speech/talk.start/para","N/A","N/A"
125,0,0,0,1,0,0,0,1,"Senator COULTER","TF4","(South Australia)","AD","N/A",1678,"—I give notice that, on the next day of sitting, I shall move:That the following matters be referred to the Environment, Recreation, Communications and the Arts References Committee for inquiry and report by the last sitting day of the 1996 Winter sittings:The management of water and biological nutrients in Australia, with particular emphasis on their loss from the terrestrial environment and the problems that this loss into the marine and coastal environment within Australias economic zone causes by way of pollution from land run-off, stormwater and sewage outfalls including:(a)the adequacy of existing Commonwealth, State and Territory legislation to give effect to Australias obligations under the United Nations Convention on the Law of the Sea, and other international treaties, to address land-based and ship-sourced marine pollution and its effects;(b)administrative arrangements required to better conserve the marine and coastal environment, including consideration of an oceans management policy and its implementation and the scientific research needed to achieve this;(c)impact of pollution on water and sediment quality, marine biodiversity, and commercial and recreational users; and(d)ways of maximising local community involvement in all aspects of the assessment and management of marine and coastal pollution.","N/A","NOTICES OF MOTION","/html/body/hansard/chamber.xscript/debate[1]/debate.sub1[3]/speech[1]/talk.start/para","N/A","N/A"
126,0,0,0,1,0,0,0,1,"Senator COULTER","TF4","(South Australia)","AD","N/A",1678,"—I give notice that, on the next day of sitting, I shall move:That the time for the presentation of the report of the Environment, Recreation, Communications and the Arts References Committee on the role of national sporting coaches in the international transfer of Australian players be extended to 31 August 1995.","N/A","NOTICES OF MOTION","/html/body/hansard/chamber.xscript/debate[1]/debate.sub1[3]/speech[2]/talk.start[1]/para","N/A","N/A"
127,0,0,0,1,0,0,0,1,"Senator COULTER","TF4","(South Australia)","AD","N/A",1678,"—I seek leave to make a statement in relation to this notice.Leave granted.","N/A","NOTICES OF MOTION","/html/body/hansard/chamber.xscript/debate[1]/debate.sub1[3]/speech[2]/talk.start[2]/para","N/A","N/A"
