index,question_flag,answer_flag,interjection_flag,speech_flag,petition_flag,quote_flag,motionnospeech_flag,chamber_flag,name,name.id,electorate,party,role,page.no,content,subdebateinfo,debateinfo,path,Speaker,Time
92,0,0,0,1,0,0,0,1,"Senator KNOWLES","TH4","(Western Australia)","LP","N/A",1382,"—Okay, from what you have heard I have said so far. What I listed at question time, Senator Evans, was the whole list of 143 breaches committed by the Department of the Prime Minister and Cabinet in terms of simple things such as failure to remit income tax instalment, failure to issue group certificates, failure to pay superannuation productivity benefits and casual staff wages paid from petty cash. If people in the private sector had actually done that, they would be subject to prosecution and, as I said before, hefty penalties.The situation remains constant that this Prime Minister (Mr Keating) can consistently skirt around all of these things. It does not matter whether or not it is his own personal income tax return that he fails to lodge, whether it is that of his piggery or anything else. It matters not to this Prime Minister. In the Auditor-Generals report, under the `Department of the Prime Minister and Cabinet, it states:This section details the results of the ANAO audit into irregularities concerning minor expenditure, including the payment of wages from petty cash to casual staff, at the Lodge and Kirribilli House (the Official Establishments) and the action taken to rectify the irregularities.Surely these irregularities should not be occurring in the Department of the Prime Minister and Cabinet. The report continues:This matter was raised in the press in August 1994 where it was alleged that the payment of wages from petty cash was highly irregular and in contravention of section 70AH of the Audit Act 1901 .As I say, that is not the only thing that has been found to be irregular. The report also states:Casual staff are employed to assist with catering for large functions, as well as to fill vacancies pending permanent filling of positions. Before mid-1994, casual staff were paid wages from petty cash, no employee declaration forms were completed, no tax was paid on their behalf or group certificates issued, and no employer superannuation contribution payments were made.This is simply and utterly not acceptable, coming as it does from the Department of the Prime Minister and Cabinet and from institutions such as the Lodge and Kirribilli House. We need to be reminded that it was those staff members at the Lodge who were dismissed without any reason whatsoever. If that too had happened in the private sector, then there would have been very serious questions asked. But for some reason this Prime Minister seems to be able to get away with all of these things and get off scot-free.The report notes that the investigation revealed that the press reports were accurate. The report states that the departments administrative procedural manual included in its definition of petty cash expenditure:. . . expenditure not exceeding $100 in respect of any single purchase or service. Cash payments to casual employees or cash payments for supplies for the Official Establishments are exempt from this definition.The report goes on to say:This definition conflicted with the requirements of section 70AH of the Audit Act, which prohibits payments to employees in cash unless otherwise determined by the Minister for Finance. Such a determination had not been obtained.The issue is that this Prime Minister seems to be able to go about things willy-nilly. At the end of the day, he has to be held responsible for something. The buck has to stop somewhere. Presumably the Prime Minister is ultimately responsible for the Department of the Prime Minister and Cabinet. Where does the buck stop? Is this man prepared to take any responsibility? The report goes on to say:The ANAO noted that during 1993-94 there had been nineteen petty cash reimbursements totalling about $43 000 for the Lodge and Kirribilli House. Casual staff wages included in these reimbursements totalled almost $10 000 in nearly 80 transactions.This is not just a one-off thing. People might say that he may not have known that this was going on, but this was happening in the residences in which he lives and he attends the functions in those residences. Surely he should be aware of what is going on. The report also notes that two casuals had their days wages retrospectively approved. The report further states:The ANAOs examination also identified that there were no receipts for some household requisites. The ANAO recommended that receipts be obtained for all individual purchases from petty cash which exceeded $20.The Department agreed with the recommendations and advised that the recommendation has been implemented to the extent that it is cost-effective to do so.Who decides whether it is cost effective or not?Question resolved in the affirmative.","N/A","N/A","/html/body/hansard/chamber.xscript/qwn/question.block[25]/speech/talk.start[2]/para","N/A","N/A"
93,0,0,0,1,0,0,0,1,"Senator ELLISON","9X5","(Western Australia)","LP","N/A",1383,"—I move:That the Senate take note of the answer given by the Minister for Foreign Affairs (Senator Evans) this day, to a question without notice asked by Senator Ellison on 2 March, relating to the detention of Mr Eric Robert Bowra in the United Arab Emirates.Up until last Friday, Robert Bowra was a prisoner in the United Arab Emirates. Mr Bowra had been imprisoned as a result of a collision between two boats. He was driving one boat which he was using to exhibit to the United Arab Emirates navy. He was doing that in the course of his employment. If this had happened in Australia he would not have been charged with any offence under our law. Nonetheless, we must respect the law of foreign countries. Under the law of the United Arab Emirates, he was accordingly convicted and sentenced to a term of 12 months imprisonment. That was reduced on 5 February 1995 to six months. However, notwithstanding the order of the court that he serve only six months, which expired on 6 February, he served another month before his release last Friday.I want to place on record my congratulations for the efforts of Mr Philip Nixon, a business associate of Mr Bowra, who worked untiringly to secure his release and also pay tribute to the Bowra family and in particular Jenny Bowra, Rob Bowras wife, who travelled to the United Arab Emirates in an effort to free her husband. This has been a trying time for the family. They have suffered personally, emotionally and financially. As I understand it, the business that Mr Bowra is involved in has suffered irretrievably and the human cost has been gigantic.This serves as a lesson to the government that there are Australian citizens who travel to remote parts of the world in an effort to promote exports for this country and that, from time to time, through no fault of their own they may run foul of foreign laws. It is in that context that I put it to the government in the strongest terms that it has to stand by our citizens who go abroad and run into strife in these sorts of circumstances.It is not unreasonable for any Australian to expect its government to stand by them in times of strife overseas. This was not your normal situation of a drug runner or someone who had committed a heinous crime overseas. It has to be distinguished greatly from that sort of situation. I say to the government and the people of Australia: let us learn from this lesson and ensure that in future this sort of situation does not happen again. This man was imprisoned whilst he had been granted bail. He was not released, even though a court order had granted him bail. He was kept beyond his sentence for a whole month and not released. I would submit that this is a clear instance where the government could use its full weight and make communications at the highest level.Whilst I acknowledge that Senator Evans did write to the Minister for Foreign Affairs in the United Arab Emirates, I put it to the government that this could have been done at an earlier stage. I note that on the Today program on Channel 9, Peter Harvey, who is travelling with the Prime Minister, said that the Prime Minister was going to make representations in the United Arab Emirates in an endeavour to gain the release of this man. Of course, Mr Bowra was released last Friday. Either Mr Harvey got his facts wrong or he just was not aware of the situation. Maybe the Prime Minister had misled him or perhaps even the Prime Minister was not aware of the situation.Nonetheless, this has been a most serious case. I believe it is one that we must learn from. The government must set in plan a future program for the effective assistance of Australian nationals who get into this sort of strife overseas.","N/A","N/A","/html/body/hansard/chamber.xscript/qwn/question.block[26]/speech/talk.start/para","N/A","N/A"
94,0,0,0,1,0,0,0,1,"Senator GARETH EVANS","VD4","(Victoria-","ALP","Minister for Foreign Affairs)",1384,"—Senator Ellison has let his enthusiasm run away a little bit from the facts of the situation. The Australian government made its position very clear at the outset: while there are limitations to what we can do for ordinary Australian citizens who get in strife with the law in other countries in circumstances where that law is apparently being applied properly by its own standards, where it becomes apparent that there is something questionable about the application of that countrys law we will respond very quickly with appropriate representations. That is what happened in this instance.","N/A","N/A","/html/body/hansard/chamber.xscript/qwn/question.block[27]/speech/talk.start[1]/para","N/A","N/A"
95,0,0,1,0,0,0,0,1,"Senator Ellison","9X5","N/A","N/A","N/A","N/A","—It didnt happen with the bail. Not with the bail.","N/A","N/A","/html/body/hansard/chamber.xscript/qwn/question.block[27]/speech/interject[1]/talk.start/para","N/A","N/A"
96,0,0,0,1,0,0,0,1,"Senator GARETH EVANS","VD4","(Victoria-","ALP","Minister for Foreign Affairs)",1384,"—Once it became apparent that there was a problem on the bail front, representations were made at an official level by our diplomatic representation based in Riyadh, and that was followed up by direct representations from me. It is always a matter of making a judgment in these cases as to whether or not your representations are going to be productive or whether they will simply be counterproductive in all the circumstances of the case. That is a matter which you just have to make case by case judgments about.I believe we did everything possible in the circumstances of this matter to move it forward with results that I think are now evident. I am not sure at the end of the day what was the most influential factor—whether the ministerial representations did make any difference or whether it was simply a matter of the law of Abu Dhabi working itself out.Throughout all of this, Australia continues to offer in these sorts of cases, whether or not we make extra representations, what consular advice and assistance we can to prisoners, whoever they are and whatever the state of play may be with the law of the country inquestion and its observance in that case. We did that in the form of basic consular assistance with Mr Bowra right from the beginning.As to the Prime Ministers willingness to take this matter up, there were only very limited options available to him not least because he was only stopping in Dubai, not in Abu Dhabi. There is a completely different legal system basically in operation in the two emirates. He was nonetheless going to ask the ambassador to convey his concern about the situation to the authorities in Abu Dhabi when our ambassador met them tomorrow.","N/A","N/A","/html/body/hansard/chamber.xscript/qwn/question.block[27]/speech/talk.start[2]/para","N/A","N/A"
97,0,0,1,0,0,0,0,1,"Senator Ellison","9X5","N/A","N/A","N/A","N/A","—But that was only after I asked the question, Senator. That is the truth.","N/A","N/A","/html/body/hansard/chamber.xscript/qwn/question.block[27]/speech/interject[2]/talk.start/para","N/A","N/A"
98,0,0,0,1,0,0,0,1,"Senator GARETH EVANS","VD4","(Victoria-","ALP","Minister for Foreign Affairs)",1384,"—Only because we had not been aware until last week that he had not been released as was promised to be the case.","N/A","N/A","/html/body/hansard/chamber.xscript/qwn/question.block[27]/speech/talk.start[3]/para","N/A","N/A"
99,0,0,1,0,0,0,0,1,"Senator Ellison","9X5","N/A","N/A","N/A","N/A","—But for three weeks he had been inside.","N/A","N/A","/html/body/hansard/chamber.xscript/qwn/question.block[27]/speech/interject[3]/talk.start/para","N/A","N/A"
100,0,0,0,1,0,0,0,1,"Senator GARETH EVANS","VD4","(Victoria-","ALP","Minister for Foreign Affairs)",1384,"—Okay, you made a hero of yourself, Senator Ellison. That is fine. I am delighted for Mr Bowra that you were working on his behalf and all the rest of it. I just do not want you to be unfair in the aspersions you cast upon the government. There is only so much we can do for Australian citizens who get themselves in strife overseas. There seems to be a belief around the place that governments are absolutely omnipotent in terms of our capacity not only to be aware of all these situations and every one of their ins and outs but also to make a difference as to the way in which people are dealt with. Our hands are remarkably tied in these situations. There are very limited things we can do. Often when we do seek to make representations in circumstances where a matter of sensitivity is involved, it can be counterproductive unless those representations are extremely carefully handled.I became officially aware only this morning when a cable arrived—Senator Ellison might have heard earlier than that—that he had been released. By this stage, the Prime Minister was well on his way from Singapore to Dubai, and Mr Harvey had no doubt already filed his account of what was going to happen from Singapore. To be critical of the Prime Minister—as Senator Ellison was—the Prime Ministers staff or the government for not keeping people up to speed in that respect is, again, very unfair in all the circumstances. We were doing our best to keep track of a situation that clearly did need some attention. We gave it that attention. You have had a good result; now be gracious about it.Question resolved in the affirmative.","N/A","N/A","/html/body/hansard/chamber.xscript/qwn/question.block[27]/speech/talk.start[4]/para","N/A","N/A"
101,0,0,0,1,0,0,0,1,"Senator PANIZZA","JI4","(Western Australia)","LP","N/A",1385,"—Perhaps Senator Evans can give my colleague Senator MacGibbon an extra five minutes to make up for the five minutes he took up.","N/A","N/A","/html/body/hansard/chamber.xscript/qwn/question.block[28]/speech/talk.start[1]/para","N/A","N/A"
102,0,0,1,0,0,0,0,1,"Senator Gareth Evans","VD4","N/A","N/A","N/A","N/A","—Come on!","N/A","N/A","/html/body/hansard/chamber.xscript/qwn/question.block[28]/speech/interject[1]/talk.start/para","N/A","N/A"
103,0,0,0,1,0,0,0,1,"Senator PANIZZA","JI4","(Western Australia)","LP","N/A",1385,"—You said you were only going to talk for two minutes. I move:That the Senate take note of the answer given by the Minister for Small Business, Customs and Construction (Senator Schacht), to a question without notice asked by Senator McKiernan this day, relating to transport links between Western Australia and the rest of Australia.While I welcome the ministers statement that international carriers will be allowed to carry extra containers to get over this crisis, the final condemnation must rest with the government for the lack of road funding that has caused this situation.","N/A","N/A","/html/body/hansard/chamber.xscript/qwn/question.block[28]/speech/talk.start[2]/para","N/A","N/A"
104,0,0,1,0,0,0,0,1,"Senator Schacht","4J4","N/A","N/A","N/A","N/A","—Oh, strike me!","N/A","N/A","/html/body/hansard/chamber.xscript/qwn/question.block[28]/speech/interject[2]/talk.start/para","N/A","N/A"
105,0,0,0,1,0,0,0,1,"Senator PANIZZA","JI4","(Western Australia)","LP","N/A",1385,"—You listen; we will get there. The national highway system in Australia is a disgrace. Western Australia has 25 per cent of the national highway system, yet receives only seven per cent of the funding. WA needs $100 million annually for its highways; it only gets $58 million.","N/A","N/A","/html/body/hansard/chamber.xscript/qwn/question.block[28]/speech/talk.start[3]/para","N/A","N/A"
106,0,0,1,0,0,0,0,1,"Senator Schacht","4J4","N/A","N/A","N/A","N/A","—They get a higher proportion of state grants.","N/A","N/A","/html/body/hansard/chamber.xscript/qwn/question.block[28]/speech/interject[3]/talk.start/para","N/A","N/A"
107,0,0,0,1,0,0,0,1,"Senator PANIZZA","JI4","(Western Australia)","LP","N/A",1385,"—We will come to that. That is the situation now. Senator Schacht probably wants to know what this has got to do with Cyclone Bobby and the road being cut. It has got a lot to do with it: if the funds had been available before, the highway would have been done earlier. If you are not battling for the last dollar, you can do a far better job. The highway could be completed by cutting off a section and using the old highway to build a new one. You can cut one down the side—like you do with a pipeline—finish it properly and then cut it in at the end. The government stands condemned for the lack of road funding that has caused this situation in the west.Question resolved in the affirmative.","N/A","N/A","/html/body/hansard/chamber.xscript/qwn/question.block[28]/speech/talk.start[4]/para","N/A","N/A"
108,0,0,1,0,0,0,0,1,"The Clerk",10001,"N/A","N/A","N/A","N/A","—Petitions have been lodged for presentation as follows:To the Honourable the President and Members of the Senate in Parliament assembled.We are dismayed at the continuing destruction of old growth and wilderness forests around Australia, despite the National Forest Policy Statement jointly signed by the Commonwealth and all States except Tasmania.Intensive logging, most often to feed a voracious woodchip industry is underway or planned for many high conservation value forests. These forests should be protected by the commitments of the Commonwealth and State Governments under the NFPS.These forests include:Coolangubra Wilderness and other areas of the S.E. Forests of NSW along with rainforest and other N.E. areas of NSW including Wingham, Mistake, Richmond Range, Chaelundi, North Washpool, Barrington and Dorrigo.The Southern Highlands, Great Western Tiers and Tarkine Wilderness of Tasmania.The Karri and Jarrah forests of S.W. Western Australia.The Errinundra Plateau and other areas of the East Gippsland forests of Victoria.The rainforests of the Proserpine region of Queensland.We request that the Government act urgently to protect our precious forests by utilising the Commonwealths legal and constitutional powers, including:Refusal of export woodchip licencesPowers to control corporationsProtection of areas listed on the register of the National EstateProtection and effective funding of areas identified for their World Heritage values.Genuine and effective action by the Government to protect these and other old growth and wilderness forests is critical. A comprehensive plantation strategy rather than exploiting native forests is the way forward for a truly environmentally responsible timber industry. We further request that the Government take effective action without further delay.To the Honourable the President and Members of the Senate in Parliament assembledThe petition of the undersigned respectfully showeth:That the ancient and irreplaceable native forests in the South West of Western Australia are being destroyed by logging for woodchipping, that many species in these forests are in danger of extinction, and that Federal Government intervention is urgently needed to protect our natural heritage.Your petitioners most humbly pray that the Senate, in parliament assembled, should call on the Federal Government to:1.immediately use its powers to protect Hawke, Sharpe, Giblett and Rocky blocks and all other high conservation value and old growth forests in the South West of Western Australia,2.refuse to renew woodchip export licences unless it is guaranteed that the wood comes from tree crops, agroforestry or plantations and,3.take steps to ensure the rapid transfer of the wood products industry from all native forests and on to plantations, tree crops and agroforestry.To the Honourable the President and Members of the Senate in Parliament assembled. We the undersigned citizens of Australia respectfully submit that:The Federal Minister for Immigration, Senator Bolkus reverse a decision refusing entry to Australia for Dana Nance, the Romanian adopted daughter of South Australian parents, Graham and Jennifer Nance and, that the Minister use his powers under Section 35(1) of the Migration Act 1958 in the public interest to personally intervene and allow Dana Nance to become an Australian citizen.Your petitioners, as in duty bound, will ever pray.To the Honourable the President and Members of the Senate in Parliament assembled:The petition of the undersigned citizens of Australia respectfully showeth that:1.We are opposed to the sex guide endorsed by Ms Lawrence, Minister for Health in the Keating Government, and published in the December issue of Cleo.2.We believe that the sex guide encourages dangerous sexual practices which could have serious medical and moral effects.We call on Ms Lawrence to withdraw her endorsement of this sex guide and for the Prime Minister, Mr Keating, to indicate his disapproval.And your petitioners, as in duty bound, will ever pray.To the Honourable President and Members of the Senate in Parliament assembled. The petition of the undersigned shows:Australias old growth forest and wilderness areas are being diminished as a result of continued logging. The Federal Government has granted new woodchip export licences despite its agreement for a moratorium on logging in high conservation areas.Your petitioners ask that the Senate should:apply conditions retrospectively to woodchip licences in order to meet Commonwealth obligations, andexclude from licences, woodchip derived from old growth forests and wilderness.","N/A","N/A","/html/body/hansard/chamber.xscript/petition.grp/proctext/interject/talk.start/para","N/A","N/A"
109,0,0,0,1,0,0,0,1,"Senator SCHACHT","4J4","(South Australia-","ALP","Minister for Small Business, Customs and Construction)",1387,"—I give notice that, on the next day of sitting, I shall move:That the order of the Senate of 29 November 1994, relating to the consideration of legislation, be amended as follows:After paragraph (1), add the following paragraph:`(1A)For the purposes of paragraph (1), a bill which has been passed by the House of Representatives in a period of sittings shall be taken to have been received by the Senate in that period of sittings..","N/A","NOTICES OF MOTION","/html/body/hansard/chamber.xscript/debate[1]/debate.sub1[1]/speech/talk.start/para","N/A","N/A"
