index,question_flag,answer_flag,interjection_flag,speech_flag,petition_flag,quote_flag,motionnospeech_flag,chamber_flag,name,name.id,electorate,party,role,page.no,content,subdebateinfo,debateinfo,path,Speaker,Time
71,0,0,0,1,0,0,0,1,"Senator BOB COLLINS","OF4","NT","ALP","N/A",1656,"—I am aware of Senator OChees interest and activity in this issue. I am also aware that Senator OChee has been in contact with Mr Rowleys solicitors, Bottoms English—I did not make that up—trying to broker a deal in area E of the east coast tuna fishery. In relation to the two specific questions Senator OChee has asked, I am advised that the Fisheries Management Act provides for transferability of permits under section 32(10). In fact, it is the management arrangements in place for a particular fishery that determine whether the permit may be transferable or not.As far as the east coast tuna fishery is concerned, I am advised that permits in area E are not transferable at the present time. Where a permit is held by a body corporate, there is no provision in the Fisheries Management Act 1991 to inquire as to the beneficial ownership of that company or the nationality of the shareholders. It is therefore possible for ownership of a company, and therefore a fishing permit, to change hands without the knowledge of the Australian Fisheries Management Authority.In response to the second question, permits may be held by Australian companies in accordance with existing government policy, and foreign nationals may legitimately be shareholders of such companies. The Australian Fisheries Management Authority will continue to apply the existing legislation for, and policy of, renewing permits as long as the vessel being used is an Australian boat and complies with the other management requirements of that particular fishery.","N/A","N/A","/html/body/hansard/chamber.xscript/qwn/question.block[11]/answer[1]/talk.start/para","N/A","N/A"
72,0,0,0,1,0,0,0,1,"Senator OCHEE","EU4","QLD","NP","N/A",1656,"—I thank the minister for the answer, but I am concerned that we now have a situation where the non-transferability of permits within that area is quite clearly being flouted. It is a restricted fishery, which means that Australian owned operators cannot get access. There is general recognition that there should be a restricted fishery. Does the government believe it is satisfactory that these Taiwanese should be allowed to continue to exploit the resource? Furthermore, is the government concerned that an increase in the effort in this area will just lead to more rapacious efforts by the Taiwanese—and we chased them out of the area a long time ago?","N/A","N/A","/html/body/hansard/chamber.xscript/qwn/question.block[11]/question[2]/talk.start/para","N/A","N/A"
73,0,0,0,1,0,0,0,1,"Senator BOB COLLINS","OF4","NT","ALP","N/A",1656,"—I have no personal detailed knowledge of that particular fishery, but I will refer Senator OChees supplementary question to the minister responsible for fisheries.","N/A","N/A","/html/body/hansard/chamber.xscript/qwn/question.block[11]/answer[2]/talk.start/para","N/A","N/A"
74,0,0,1,0,0,0,0,1,"Senator Gareth Evans","VD4","N/A","N/A","N/A","N/A","—Mr President, I ask that further questions be placed on the Notice Paper .","N/A","N/A","/html/body/hansard/chamber.xscript/qwn/question.block[11]/answer[2]/interject/talk.start/para","N/A","N/A"
75,0,0,0,1,0,0,0,1,"Senator GARETH EVANS","VD4","VIC","ALP","N/A",1657,"—In question time today, Senator Hill asked me to clarify the situation with respect to who wrote to whom in the French government about the nuclear test question. I am happy to do that, having had an opportunity to check my recollection, which I frankly acknowledge was a bit wobbly earlier this morning, having had two hours sleep last night and 28 hours of travel yesterday. Having checked my recollection, I am pleased to be able to advise the Senate that neither I nor Senator Ray said anything misleading.The situation is this: I did make oral representations to Alain Juppe, who was then foreign minister, just a few days before the French election when I met him in France in which the subject of nuclear tests was very specifically on the agenda and about which I made quite strong points to him. After the election, I did write to Alain Juppe, but that was simply a letter of congratulations which referred to the previous discussion that we had but did not—Senator Ian Macdonald interjecting —","N/A","N/A","/html/body/hansard/chamber.xscript/qwn/question.block[12]/answer/talk.start[1]/para","N/A","N/A"
76,0,0,0,1,0,0,0,1,"Senator GARETH EVANS","VD4","VIC","ALP","N/A",1657,"—No, this is before the announcement—after the election but before the announcement. He is a colleague and a counterpart who had moved on to greater things. Even Senator Macdonald, with his lack of appreciation of the niceties of these things, would appreciate that is a reasonable, sensible and decent thing to do. I incorporated by reference, as it were, the previous discussion by referring to the discussions we had, but I did not specifically refer to the tests. It was on that basis that Senator Ray was advised to respond as he did in his clarifying remark earlier in the week. I was closely involved, as you would expect, in the preparation of the letter that went from Prime Minister Keating to President Chirac which, again, went very explicitly to the nuclear tests question. There had been discussion as to whether that letter would be best from Mr Keating to President Chirac or from Mr Keating to Prime Minister Juppe or from me to Prime Minister Juppe or from me to my foreign minister counterpart. At the particular moment this morning, I could not quite remember whether I had written specifically to Prime Minister Juppe on the French test question. I hope that explains and clarifies that matter.","N/A","N/A","/html/body/hansard/chamber.xscript/qwn/question.block[12]/answer/talk.start[2]/para","N/A","N/A"
77,0,0,1,0,0,0,0,1,"Senator Hill","BH4","N/A","N/A","N/A","N/A","—You did; you said you had.","N/A","N/A","/html/body/hansard/chamber.xscript/qwn/question.block[12]/answer/interject/talk.start/para","N/A","N/A"
78,0,0,0,1,0,0,0,1,"Senator GARETH EVANS","VD4","VIC","ALP","N/A",1657,"—If I did say that I explicitly wrote to him on the French test question, I was wrong and I apologise. It is a function of 2 1/2 hours sleep and 28 hours travel. I was also asked to table these letters. It is simply not the practice to release copies of any governmental correspondence. These things are conducted on an in confidence basis. That has always been the practice. I am sure Senator Hill would acknowledge that.","N/A","N/A","/html/body/hansard/chamber.xscript/qwn/question.block[12]/answer/talk.start[3]/para","N/A","N/A"
79,0,0,0,1,0,0,0,1,"Senator HILL","BH4","(South Australia-","LP","Leader of the Opposition)",1658,"—I move:That the Senate take note of the answer given by the Minister for Foreign Affairs (Senator Gareth Evans), to a question without notice asked by Senator Hill this day, relating to the resumption of French nuclear testing in the South Pacific region.That explanation of Senator Gareth Evans really demonstrates our concern in this matter. Earlier this week when we raised the question of what the Australian government did between the election of the French President and his announcement, when the whole world knew that he was going to announce the resumption of tests, when it was running hot in the international media, when it had been a specifically stated promise in the course of the French elections, what did the Australian government do? The answer we heard in the Senate on that occasion was twofold—the Prime Minister of Australia (Mr Keating) had written a simple letter and so had Foreign Minister Evans to the now Prime Minister of France, Monsieur Juppe, formerly the foreign minister.Later in the week Senator Ray had to come in here and say, `No, in actual fact, the letter from Senator Evans didnt refer to the tests at all. Today Senator Evans got up and said, `I wrote to the Prime Minister raising concern about these tests. After question time he said that in fact it now seems he did not write to the Prime Minister raising the issue of the test. What a confused state of affairs! It demonstrates and underlines that the Australian government took so little action. At the only time when it had any realistic chance of influencing a change of policy on the part of France, the Australian government did next to nothing. That is the point. It seems that the Australian foreign minister personally took no action at all. I accept what he said; in fact, he is picking up a statement that my leader made. Obviously, in these circumstances you make a graduated response. You do not fire off all your shots at once.The point is that at the time when there was a chance that the Australian government could have influenced a change, it did not fire off any shots at all. This delegation that Senator Evans led to France is not firing off all your shots. If it was worthwhile doing, why wasnt it done before the public announcement of the French policy? Why didnt Senator Evans take diplomats from the South Pacific, or better still take leaders from the South Pacific, to France to express concern as to what would happen if the French election promise was implemented? It did not occur to him to do so because he was concerned with other matters. That is the point that we are seeking to make. Senator Evans did nothing at the time when he might have influenced a change of direction.Secondly, when the public announcement was made, what did Senator Evans do? He talked down the decision that France had made. There is only one way that that gets interpreted. We all know diplomatic code. That is interpreted by France and intended to be interpreted as a form protest.","N/A","N/A","/html/body/hansard/chamber.xscript/qwn/question.block[13]/speech/talk.start[1]/para","N/A","N/A"
80,0,0,1,0,0,0,0,1,"Senator Alston","LD4","N/A","N/A","N/A","N/A","—A wink and a nod.","N/A","N/A","/html/body/hansard/chamber.xscript/qwn/question.block[13]/speech/interject[1]/talk.start/para","N/A","N/A"
81,0,0,0,1,0,0,0,1,"Senator HILL","BH4","(South Australia-","LP","Leader of the Opposition)",1658,"—As Senator Alston says, a wink and a nod. Senator Evans was saying, `I am going through the motions, doing what the Australian people would expect me to do but dont take it too seriously. When Senator Evans was immediately asked about it, he said that he deplores the decision of France. That is fine, on the one hand. On the other hand, he said:We do acknowledge that the context in which these tests will be taking place is really very different from that in which they have taken place in the past. There are some very clear assurances that they will be limited in number . . .He goes on and eventually says that the situation is not as bad as it could have been. How else could France have interpreted that other than to say that Australia is not serious about its protest? There is no other way in which that could reasonably be interpreted. That is the whole point. A graduated response, yes, but take it seriously. When Senator Evans had a chance to influence a change of policy he should have done something. When the announcement was made he should have made a vigorous protest, not compromise the situation by almost talking it away before he led this delegation to France. The graduated responses that he has made have been as a reaction of the anger of the Australian people, not as a result of his recognition as to how serious this matter should be treated or his capacity to influence—","N/A","N/A","/html/body/hansard/chamber.xscript/qwn/question.block[13]/speech/talk.start[2]/para","N/A","N/A"
82,0,0,1,0,0,0,0,1,"Senator Gareth Evans","VD4","N/A","N/A","N/A","N/A","—Where was your statement on day one? If you had something here on the record that would be much better.","N/A","N/A","/html/body/hansard/chamber.xscript/qwn/question.block[13]/speech/interject[2]/talk.start/para","N/A","N/A"
83,0,0,0,1,0,0,0,1,"Senator HILL","BH4","(South Australia-","LP","Leader of the Opposition)",1658,"—Senator Evanss only real explanation today is to attack the opposition because it had a different policy during the days of the Cold War. How inadequate is that response? The opposition is not in judgment here; it is the performance of the minister, and he has been found wanting.","N/A","N/A","/html/body/hansard/chamber.xscript/qwn/question.block[13]/speech/talk.start[3]/para","N/A","N/A"
84,0,0,0,1,0,0,0,1,"Senator COULTER","TF4","(South Australia)","AD","N/A",1659,"—Well may members of the opposition wave their arms around in anger when, in fact, they have had a pro-nuclear policy ever since the Ranger inquiry in the 1970s. They were the ones who began the uranium mining and the export of uranium. They were the ones who have supported the very industry which lies at the basis of both the civil and military nuclear program. For a short time the government took an ethical position. The Labor Party had a policy of opposing uranium mining and export but it too adopted a very pragmatic position later on and its present position is totally indefensible.What we have had today from Senator Hill is simply more arm waving. He is talking about who did what and when, not what should have been done. That is the important point. I remind the Senate that yesterday, when we raised this matter through seeking a suspension of standing orders, we raised the really important issue of whether Australia should continue to mine and export uranium and, particularly, to send that uranium to France, underpinning the very industry which is now the basis of those nuclear tests in the Pacific. We found that, with the exception of the Greens, this whole Senate—as a body—sat on this side of the chamber and voted against the suspension of standing orders.Those people did not want to debate the really important issue of what might be done effectively to send a message to France that in things nuclear we totally separate ourselves from what the French are doing and what other nations are now threatening to do—although I see from this mornings newspaper that the US seems to be drawing back from further nuclear tests. That is the issue that should be debated here, not whether the minister took action this week or last week and whether that action was weak—as it was. We accept the oppositions statement that what the minister said was clearly sending a message to France that Australia was not serious about taking significant action against the French.We stress again that our party since 1977 has consistently taken a position of opposing the mining and export of uranium because of the position we now find ourselves in. The minister may well speak in a moment. He will point to the non-proliferation treaty and other things, but they are bits of paper which have no ability whatsoever—as we see with these tests and as the minister in his reply has indicated—to restrict the use of the uranium that Australia sends to other countries once it has left our shores. There is no ability to control that.We know that even under the NPT it is possible for a country to make all the hardware for a nuclear weapon, short of actually arming it, go through the processes of giving notice, withdraw from the NPT in six months, put plutonium into the bomb and explode its weapons. There is no protection in the sorts of paper agreements to which the minister has drawn attention on a number of previous occasions.The issue is what substantive action Australia should take to indicate not only to France, but to the rest of the world, that we will not participate in any way in any part of this nuclear fuel cycle, bearing in mind that there are clear links between the civil and military programs, links which are indicated by the reticence of the Americans to support the sale of Russian reactors to Iran and the concerns we have expressed over the sale of nuclear reactors to North Korea. There are clear links and we should desist from that uranium mining and export.We have not made the enormous profits predicted back in the 1970s. There has not been the predicted expansion in the mining industry. It is not a great booming industry for Australia and I believe that for very good reasons we should withdraw from that industry.","N/A","N/A","/html/body/hansard/chamber.xscript/qwn/question.block[14]/speech/talk.start/para","N/A","N/A"
85,0,0,0,1,0,0,0,1,"Senator CHAMARETTE","SN5","(Western Australia)","GWA","N/A",1660,"—I wish to take note of the inadequacy of the response of Senator Gareth Evans to the question put by Senator Hill. That also applies to Senator Alstons and my questions. I reiterate that the response of this government—and the foreign minister in particular—to the resumption of nuclear testing was totally weak and inadequate. We have to ask: does it really represent foreign policy or is it representing the kind of fancy diplomatic footwork that was described in Senator Evanss answers? It raises the other question of where and how we derive our foreign policy. Senator Evans did not answer my question which asked whether he was aware how out of touch he is with the people of Australia. That is what I would like to mention here.Where does the attitude of the population of Australia come into determining the strength of the stance that is going to be taken by the Australian government and the foreign minister on this issue? Basically, Senator Evans has found himself in the position of defending the indefensible, and we have to ask what was achieved by the fancy diplomatic footwork and the courtesies of international discourse that he described so repetitively and eloquently to us.I would like to comment on the French news on SBS last Sunday. The news described the New Zealand people as `a little bit nervous and said that `they seem to have an allergy to the atomic bomb. However, the foreign minister of France, Herve de Charette, speaking from Canada, reassured us. He said, `My Australian colleague, he understands. Is that the kind of foreign policy we want to see reflected on the world stage? The achievement that Senator Evans said he made at this delegation in Paris, that the French government will eventually cease after they have done eight more tests, is the same position that the French government took in its initial statement about what it intended to do.I want to continue with the statements of the French foreign minister on the SBS news on Sunday. Before Senator Evans had even reached Paris, the French foreign minister said, `You dont understand. There are two decisions made by President Chirac and one is much more important than the other. The first is we are just going to have eight little atomic bomb tests in Mururoa Atoll, and the second is that definitivement we will be ceasing in May. That is no consolation to the people of Australia, New Zealand and the South Pacific. It must not continue.No one in the region will be happy with the French governments stance, or the stance that has been reflected by this government, until the position of the French government changes so that there will not be a resumption of underground nuclear bomb testing in Mururoa Atoll or by any other country anywhere else in the world. It is a planetary position we hold, and we have to take care of the planet.","N/A","N/A","/html/body/hansard/chamber.xscript/qwn/question.block[15]/speech/talk.start/para","N/A","N/A"
86,0,0,0,1,0,0,0,1,"Senator TEAGUE","PJ4","(South Australia)","LP","N/A",1660,"—The point that the parliament is making is that the French tests must stop. The criticism of the Minister for Foreign Affairs (Senator Gareth Evans) and of this government is demonstrated by the credibility and the representativeness of Senator Hills question today, his supplementary question and his motion to take note of the ministers inadequate answer. Even the silence from the ministers own colleagues behind him indicate the criticism from within his own party ranks, let alone the Left caucus of the Labor Party, let alone the eloquent speeches by Senator Chamarette and Senator Coulter.I support entirely Senator Hills remarks. I reiterate that the Australian public in the last two weeks has been so outraged by the way the Australian government has let down the national interest that it has made this an issue which will hang around the neck of the minister and the government. It is only rarely that foreign policy issues become election issues and I put it to the minister, in reiterating the protest from every part of this chamber, that, for his inadequate answer today, his inadequate action since the election of the new President of France who has declared his intention to renew atomic testing in the South Pacific, the Australian public will hold him and the government accountable.The minister may well say, `Life is unfair. He may say that he has been working flat out, had two hours sleep, had six years as foreign minister, achieved enormous gains—with bipartisan support on most issues, such as the NPT conference relevant to this matter, such as pressure for disarmament, such as, with Senator McMullan, pressure on the French with regard to agricultural subsidies in Europe, and so on. Despite all that, when a major mistake is made, this parliament and the people of Australia know it. We require of this minister and this government a more substantial response. There needs to be some mea culpa that there was an opportunity to act and there was no action.The Joint Committee on Foreign Affairs, Defence and Trade happened to meet two weeks ago with the French ambassador. It is not appropriate for the private discussion between all members of the committee and the French ambassador to be disclosed here, because it was a private meeting. I can only speak with regard to my own statements to the French ambassador. This occurred before the decision to test was made. I say it now because it is also on the public record that I was not alone as a parliamentarian in saying to the representative of France in this country before the decision to test: `There are three issues, ambassador, that detract from what can be an excellent relationship between Australia and France, and they have been longstanding. The three issues are, firstly, your intention to continue nuclear tests in the South Pacific, which we totally object to, which all parts of the parliament totally reject; secondly, you have a continuing colonial record in the South Pacific and it is time that that colonial record was finished and there was independence for the peoples of the South Pacific; and the third issue is the common agricultural policy and Frances role, along with the others in the European Union, to act unfairly against Australia with regard to agricultural imports. The ambassador heard those protests loudly and clearly, not least from me, a member of the Australia-France friendship group within this parliament.I put it to you as credibly as I can, minister, that Senator Hills motion to take note of your answer and all the remarks he made are well understood by this parliament. This government has been found wanting. This is a matter that has the publics attention in Australia and a great deal more substance needs to be given to it by you and your government.","N/A","N/A","/html/body/hansard/chamber.xscript/qwn/question.block[16]/speech/talk.start/para","N/A","N/A"
