index,question_flag,answer_flag,interjection_flag,speech_flag,petition_flag,quote_flag,motionnospeech_flag,chamber_flag,name,name.id,electorate,party,role,page.no,content,subdebateinfo,debateinfo,path,Speaker,Time
181,0,0,0,1,0,0,0,1,"Senator BURNS","2F4","(Queensland)","ALP","N/A",1404,"—I present the transcript of evidence for the supplementary hearing of the consideration of the additional estimates by the Rural and Regional Affairs and Transport Legislation Committee, together with additional information received by the committee.","N/A","COMMITTEES","/html/body/hansard/chamber.xscript/debate[9]/debate.sub1[1]/debate.sub2/speech/talk.start/para","N/A","N/A"
182,0,0,0,1,0,0,0,1,"Senator BURNS","2F4","(Queensland)","ALP","N/A",1404,"—On behalf of Senator Jones, I present the additional information received by the Foreign Affairs, Defence and Trade Legislation Committee in response to additional estimates hearings.","N/A","COMMITTEES","/html/body/hansard/chamber.xscript/debate[9]/debate.sub1[2]/debate.sub2/speech/talk.start/para","N/A","N/A"
183,0,0,0,1,0,0,0,1,"Senator REID","VI4","(Australian Capital Territory)","LP","N/A",1404,"—On behalf of the Joint Standing Committee on National Capital and External Territories, I present the report of the committee on freight and passenger transport to Australias external territories, entitled Delivering the goods , together with submissions and the transcript of evidence, and seek leave to move a motion in relation to the report.Leave granted.","N/A","COMMITTEES","/html/body/hansard/chamber.xscript/debate[9]/debate.sub1[3]/debate.sub2/speech[1]/talk.start[1]/para","N/A","N/A"
184,0,0,0,1,0,0,0,1,"Senator REID","VI4","(Australian Capital Territory)","LP","N/A",1404,"—I move:That the Senate take note of the report.I know there are a number of other senators who wish to comment upon the report, so I shall keep my remarks to just some of the matters in which I took a particular interest. I did not go to either Christmas Island or Cocos Island, and other senators are more familiar with those areas.Coming to the last point first, I refer to recommendation 26, which states:The Committee recommends that the requirement for Export Clearance Numbers for supplies sent from mainland Australia to the external Territories be abolished, without any change to their Australian duty-free status.I would recommend to the Commonwealth that that matter be expedited and dealt with. The committee does deal with these external territories and, in particular, of course, that matter which is most important to them because of their isolation—transport. The report is timely because of the fact that the Norfolk Island shipping, as it is presently organised, will shut down at the end of this year, and there seems to be considerable uncertainty in the Western Australian area of shipping to Cocos Island and Christmas Island as well.After looking at a number of options in relation to Norfolk Island, the committee came to the view that the Commonwealth should provide a capital ships grant for the purchase of a vessel to service that island, even though the vessel may not be precisely the size that is required to qualify for such a grant at the present time. It was the view of the committee that some modifications should be made to enable the grant to be applicable to a ship suitable for this service and that that would meet the needs of the islands.I think all of us recognise that it might be nice to have a large harbour, a marina and all of these things at Norfolk Island but, in view of the size of the population, it would be somewhat difficult to come to this place and suggest that expenditure of that nature be embarked upon by the Commonwealth. Even if that was attractive to the Norfolk Island government and the people of Norfolk Island, one would doubt the ability of a population the size of the island to service the debt involved in that sort of infrastructure itself. We were presented with a proposition which I think most of us felt reasonably met the needs and would enable the transport of goods to continue to Norfolk Island, as it must do.It is difficult to fully service an island of that size the way one might like to with such a small population. I believe that the integrity of the island, its government and the lifestyle that most people there seem to want should be maintained and that any intervention of the Commonwealth should leave the island pretty much as it is at the present time. I would not see an interventionist role for the Commonwealth government. We have recommended an inquiry on background and funding with some reluctance on my part. I feel that there is a risk that, in doing that, it might be seen as being interventionist in the islands affairs. I would not want that to end up by changing significantly the way the island functions, the way it does business and the way it lives at the present time because it is my belief that most of the people there want it to be the way that it is.We looked to an extent at the air services to the island and, although there are some difficulties with Norfolk, there are no specific recommendations for action by the Commonwealth that the committee has recommended. It is a bit of a chicken and egg situation—the number of aircraft determine the number of tourists who can visit an island. Then again, if you want to preserve the integrity of the island without having too many people there, you are not going to get the light aircraft in. I think we recognised the difficulties that they are faced with.We also had the experience of watching the unloading of ships at the present time. It looked pretty hairy to me, but it was not a particularly rough day. I gather on other occasions it might be far more exciting than it was the day that we were there. At present, from fairly old boats servicing the island, the union purchase method of unloading is used of shifting goods into these flat-bottomed whale boats, bringing them into shore and then taking it off again. It basically is fairly dangerous. We also heard of the controversy as to whether container ships would be desirable. We heard evidence for and against the use of containers for the island. I think, on balance, I would take the view that a more secure means of transporting goods there would be more desirable in the end.I think in view of the time that is available for discussing this matter this afternoon, it is perhaps not a matter that I should continue with at any greater length. I think the committee would feel as I do that we were indebted to those who have serviced the committee: Joanne Towner earlier on and then Meg Crooks; Susan Johnston, as the inquiries secretary; Di Singleton; and Robyn Barter, who were respectively the past and present administrative officers to the committee.I hope the government will look at our recommendations promptly because, at least as far as Norfolk Island is concerned, I do believe it is necessary to get on with making a decision so that there is no risk of there being any delay in the supply of goods later in the year when the present shipping arrangements will change. It is a difficult matter, but the island must have a service of some kind. I believe what we have recommended enables it to have such a service. There was one dissenting report from Senator Coates that he will speak to. I disagree with the approach he takes to the matters he has raised. I need not say any more about that because he will speak for himself. I commend the report to the Senate and the government.","N/A","COMMITTEES","/html/body/hansard/chamber.xscript/debate[9]/debate.sub1[3]/debate.sub2/speech[1]/talk.start[2]/para","N/A","N/A"
185,0,0,0,1,0,0,0,1,"Senator COLSTON","PF4","(Queensland)","ALP","N/A",1405,"—I am pleased to be associated with the report of the Joint Standing Committee on the National Capital and External Territories. The committee has reported extensively on the reference which it was given in relation to freight difficulties experienced by Christmas Island, Cocos (Keeling) Island and Norfolk Island. The terms of reference are reproduced in the report. To fulfil its duties responsibly, the committee travelled to the three territories to become familiar with them and to hold public hearings. In this respect, the committee visited Christmas Island once, Cocos (Keeling) Island twice and Norfolk Island twice. Public hearings were also conducted in Brisbane, Canberra and Perth.The committee has made 26 recommendations in relation to its terms of reference. Before canvassing any of these recommendations, I intend to mention some matters about the three territories and their inhabitants. Because of their isolation, it would be possible to neglect the needs of these territories. Christmas Island and Cocos (Keeling) Island are directly represented in the federal parliament by senators for the Northern Territory and by the House of Representatives member for the Northern Territory. Even so, because few members of the national parliament visit the territories, it would be easy for the majority of members of the parliament to be unaware of the needs of these two islands.The same may also be said for Norfolk Island. However, that island has no direct representative link with the federal parliament. It has its own legislature, but its only link to the federal government of the day is via the administrator of Norfolk Island or through the minister for territories or his or her parliamentary secretary. Some of the Norfolk Island residents are enrolled in the electorate of Canberra, but others who can establish a link with another mainland electorate are entitled to be enrolled there. There is no person in the federal parliament who has a direct representative duty to highlight the needs of the Norfolk Islanders and their island government. This lack of direct representation may have to be addressed in the future.Beyond these factors, however, which could lead to a case of out of sight out of mind, it should be remembered that all three islands—Christmas, Cocos (Keeling) and Norfolk—are Australian territories and are predominantly peopled by Australian citizens. These citizens deserve similar services to those available to their fellow citizens on the Australian mainland. In many respects, this is not the case. If the federal government wishes to fulfil its responsibilities to all Australians, irrespective of where they live, it must be prepared to provide resources for all the territories.As the title of the report, which has been presented to the Senate today, suggests, it deals principally with problems of freight to and from these island territories. As with many other services, the problems which exist with freight would simply not be endured by mainland communities. None has a river system or a harbour which allows safe loading and unloading of goods transported by sea. Some mainland communities can rely on road transport for the delivery of bulky goods. No such system exists for the three island communities. Apart from the bulk phosphate loading on Christmas Island, goods are loaded and unloaded in conditions which are unsafe for workers and precarious for the goods being transported.The report entitled Delivering the goods outlines some options for improving the passage of goods and having goods arrive at these territories at a reasonable cost. I do not intend to canvass these recommendations as they are outlined fully in the report, except to make a plea to the government not to place the recommendations in the too hard basket.Port facilities on Norfolk Island have been a concern raised with the federal government since about the time of Federation. It has never been a responsible attitude to put off making improvements to the islands port facilities. It would be irresponsible to do so now. Norfolk Islanders deserve a regular shipping service and adequate port facilities. The current port at Cascade is a dangerous place to work because of an overhanging and dangerously unstable cliff. Those who are working at Cascade are playing a Norfolk Island game of Russian roulette. It is only a matter of time before someone loses their life because of falling boulders from the cliff. The Norfolk Island stevedores and those who collect and transport goods which have been unloaded deserve far better working conditions.The report also addresses the issue of air transport to the three territories. Each territory is serviced by Ansett. Christmas Island also receives services from Sampati Air, which operates out of Indonesia, and Norfolk Island has regular Air New Zealand flights from Auckland as well as some less regular flights from some other islands. These air links are vital to the economic well being of each of the islands. The committee has not seen it necessary to make a formal recommendation in relation to air services.A matter of some concern to the committee and which is featured in the report was a proposed cost increase in the postage rate for mail deliveries from the Australian mainland to Norfolk Island. The island has its own postal service. During the course of the inquiry, I gained the impression that Australia Post resented having to cooperate with the territory postal service, although there was no direct evidence to support my suspicion.Whatever is the case, the residents of Norfolk Island, who I again stress are predominantly Australian citizens, deserve similar postal services and at similar affordable rates as other like communities on the mainland receive. While Norfolk Island conducts its own postal service, it may set its postal rates as it sees fit. The citizens of Norfolk Island have the opportunity at the elections for their assembly to voice their disapproval if the rates are set too high.The rates charged by Australia Post for parcel post impact on all Norfolk Island residents because the postal charges are added to the cost of goods purchased on the mainland. While the Norfolk Island government claims that it does not want to be subsidised by Australia Post, it does deserve reasonable rates and it should expect efforts to be made by Australia Post to negotiate more favourable rates for the carriage of mail to Norfolk Island. It is a fact that subsidised rates are not unknown for Australia Post parcel post rates on the Australian mainland and if reasonable rates, subsidised or otherwise, are not set for the carriage of parcels to Norfolk Island more goods could be purchased in New Zealand and sent to Norfolk Island at New Zealand postal rates. Businesses on the Australian mainland would be adversely affected if that occurred.Of the 26 recommendations in the report, I support all but one—recommendation 15 for which I have only lukewarm support. This recommendation suggests that an investigation be made about the prospects of establishing a coconut oil producing industry on Cocos (Keeling) Island to provide fuel for the islands use. While the proposal has superficial merit, I am yet to be convinced that the energy needed to extract the oil would be less than the energy which would be produced by the end product. Despite my less than enthusiastic support for that recommendation, however, I urge the government to examine all the recommendations carefully and where funds are necessary for their implementation, at least some of those funds be provided in the 1995 federal budget.Finally, I will express some words of thanks. Firstly, I mention the chairman of the committee, Mr Bob Chynoweth MP, for the sterling way in which he conducted this wide ranging and important inquiry. I also thank the deputy chair, Senator Reid, for her detailed interest and assistance to Mr Chynoweth.Of course, committee reports like this are not produced without the assistance of a dedicated staff. Those members of the staff should be justly proud of the publication which has resulted. The former secretary of the committee, Joanne Towner, heeded a call to move to a different committee before the inquiry concluded. Meg Crooks took over from Joanne. It is difficult to understand how such a first class report has resulted when Meg did not have the benefit of a visit to the three territories.Susan Johnston was with the committee for the whole of the inquiry and for a short time was acting secretary. Her detailed knowledge of the issues and evidence was readily apparent when the committee was considering its report. Until Di Singleton left to take up other duties she dealt efficiently with those many administrative tasks which surround inquiries like this. She was ably followed by Robyn Barter who joined the committee in August 1994. I must also mention Margaret Gibson who gave the committee invaluable assistance when public hearings were held on Norfolk Island. This was an interesting and at times demanding inquiry and I have been pleased to have been part of it. Not only do I commend the report to the Senate but I commend it to the government as well.","N/A","COMMITTEES","/html/body/hansard/chamber.xscript/debate[9]/debate.sub1[3]/debate.sub2/speech[2]/talk.start/para","N/A","N/A"
186,0,0,0,1,0,0,0,1,"Senator IAN MACDONALD","YW4","(Queensland)","LP","N/A",1408,"—I commend the report of the Joint Committee on the National Capital and External Territories to the Senate and the recommendations to the government. I would like to congratulate the chair of the committee, Mr Bob Chynoweth, on the sterling job that he did. I would also like to congratulate my colleague Senator Margaret Reid, the deputy chairman, particularly in relation to her work on Norfolk Island.I join other senators in very sincerely thanking the former committee secretary, Mrs Joanne Towner, for the sterling work she did. I also thank Susan Johnston who, as Senator Colston said, has been with the committee right through and Di Singleton who did tremendous work for the committee. I also thank Meg Crooks and Robyn Barter who came into the inquiry part way through. The staff have certainly made a major contribution to the writing and tabling of this report and really do deserve our thanks. Some of them looked after us in very difficult circumstances. They even shepherded us into a building when a cyclone was about to hit during our second visit to Cocos Island.We should also thank all of those people who gave evidence before the committee. The committee travelled to each island twice. We almost became personal friends with a number of people on the various islands. We were aware that many of those people gave up quite a bit to give evidence. Some of them were even courageous in giving evidence in a small community. Their views may not always have been shared by other members of those quite small communities. As I said, on the second occasion that we were on Cocos Island people from Christmas Island who came over to give evidence were, like the committee, caught by the cyclone. It was very inconvenient for them as they could not get off the island. We should acknowledge their role in giving evidence.There is no doubt that there are real problems with freight on all three islands as they all have very difficult access. This is mainly due to the sheer nature of the coastline on both Norfolk Island and Christmas Island and the difficulties with reefs and moving sands and environmental problems on Cocos Island. The wave action on Christmas Island, which unfortunately I did not see but which we saw photos of, is really quite amazing. One wonders how they get any freight in there at all for many parts of the year. In fact, several weeks—even months—go by at a time when it is impossible to get any sea freight in.There are obviously very real problems. There are only small populations on each of the islands. In each case, there are only very small economic bases, but the solutions are big money items. There has to be some solutions. The type of freight access to those islands cannot continue as it is. But solutions could be very expensive. It is something that the government will obviously have to think about before any money is spent on those solutions.I want to indicate at this time that Senator Tambling, who is the coalitions shadow minister for the external territories, did want to make a contribution to this debate on the report but time will not allow him to speak. I do indicate that he will speak later as there are some comments he wishes to make.Some of the recommendations of the committee deserve some attention by the Senate. I refer to the decision by the committee in the case of each island—Cocos, Christmas and Norfolk—to conduct inquiries by the ABS on the cost of living for those islands vis-a-vis the rest of Australia. A lot of submissions put to us suggested that the cost of living is very high. But some suggestions were made that there were countervailing conditions that perhaps overcame some of that apparent very high cost of living on those islands. It is important that, before decisions are made, we get some idea of just what the cost of living in those communities is in comparison with other parts of Australia, particularly remote mainland Australia.There have been recommendations to look at new shipping services to Christmas and Cocos islands and perhaps even Norfolk Island. A lot of evidence was given on the part that cabotage played in connection with the cost of getting goods into and out of those islands. The committee with the wisdom of Solomon decided eventually to recommend that, when tenders were called, they be called on two bases—the first where the status quo remained and whereby Christmas and Cocos islands were considered to be part of the coasting trade of Australia and the second where they be granted exemption from cabotage provisions. The tenderers themselves could in the best way possible indicate to us which they preferred. I think that was a good way to do it.There were recommendations that there be consultations with the Christmas Island workers in relation to the upgrade of the main mooring system. That is quite obvious. There were some important recommendations regarding some environmental problems on Christmas Island due to the storing of drums. There was a recommendation to get rid of those by having bulk storage on Christmas Island in the future. The suggestion of tenders being called for the operation of stevedoring and freight handling on Christmas Island with port facilities being leased by the Commonwealth was a good one and deserves government consideration.I refer to Cocos Island. The recommendation that the Cocos Island Cooperative Society be reconstituted under Australian law is an important one. There is a real problem there, in that there is a conflict of interest. Most of the board members of the cooperative society are also councillors on Cocos Islands shire council. There are laws in the Western Australian Local Government Act, under which that island now operates, which do have very severe penalties for conflicts of interest. I really think that has to be looked at.My colleague Senator Colston mentioned recommendation 15 which refers to coconut oil extraction. Whilst I agree that we should not spend a great deal of money on that, I do think it is worth looking at a little further. Obviously, Cocos Island has a helluva lot of coconut trees on it. It is by far the major feature of Cocos Island. If something could be done, it would be of interest.There is a question about quarantine on both Cocos and Christmas islands. The committee makes recommendations about that. It must be very seriously looked at. The committee rejected almost out of hand the proposal for the inter-island ring road, and I think that is very sensible. It would be foolish to spend any more money on that.I share Senator Reids reservations about inquiries into Norfolk Island. It is fair to say that Norfolk Islanders are split on whether they should have closer ties with Australia or whether the existing ties should be removed a bit and made even a little bit more remote. But I would be very cautious about any involvement of the government of Australia which brings Norfolk Islanders into a situation vis-a-vis Australia which they really do not want to be involved in. I share the reservations outlined very clearly and concisely by Senator Reid in her contribution.Finally, I draw the attention of the government to recommendation 26, which recommends the abolition of the requirement for export clearance numbers. It seems from the evidence that that was a bit of bureaucratic nonsense which really achieved nothing. It made it much more expensive to get goods to and from those islands. I conclude with a commendation of this particular report and the recommendations.","N/A","COMMITTEES","/html/body/hansard/chamber.xscript/debate[9]/debate.sub1[3]/debate.sub2/speech[3]/talk.start/para","N/A","N/A"
