index,question_flag,answer_flag,interjection_flag,speech_flag,petition_flag,quote_flag,motionnospeech_flag,chamber_flag,name,name.id,electorate,party,role,page.no,content,subdebateinfo,debateinfo,path,Speaker,Time
1,0,0,0,0,0,0,0,1,"N/A","N/A","N/A","N/A","N/A","N/A","The PRESIDENT (Senator the Hon. Michael Beahan) took the chair at 2.00 p.m., and read prayers.","N/A","N/A","/html/body/hansard/chamber.xscript/business.start/proctext/para","N/A","N/A"
2,0,0,0,1,0,0,0,1,"Senator HILL","BH4","SA","LP","N/A",1361,"—My question is directed to the Leader of the Government in the Senate. I refer to the latest bulletin of the Business Council of Australia which, on the result of a survey of firms, states:Export values are expected to slow from 16 per cent to 7 per cent per annum . . . Import values are expected to grow from 9 per cent per annum to 13 per cent per annum.I ask the minister: in the light of six out of the last seven current account deficits being over $2 billion, what is the government doing about this frightening forecast of even greater deterioration in our balance of payments? Is the governments only answer that which it tried in the late 1980s of forcing up interest rates to dampen demand? Hasnt the government learned any lessons from that experience?","N/A","N/A","/html/body/hansard/chamber.xscript/qwn/question.block[1]/question[1]/talk.start/para","N/A","N/A"
3,0,0,0,1,0,0,0,1,"Senator GARETH EVANS","VD4","VIC","ALP","N/A",1361,"—I have not seen the terms of that particular survey. I am not sure on what it is based, how comprehensive it is or how seriously the particular figures of Senator Hill should be taken. Our own estimate, as I have said in the last week or so in this place, is that we fully expect exports to pick up in the context of world recovery, in the context of better commodity prices and in the context of a continued effective penetration by Australian business of the regional market, in particular, which is continuing to expand at a dramatic rate. There is no particular reason to anticipate that there will be any serious downturn in exports. In fact, in respect of the period ahead, our confidence is very strong.Of course, it is the case that imports can be expected to surge in the context of the present recovery and very strong growth that we are experiencing and, in particular, the very strong demand for capital goods. That is to be expected. But, of course, that is building a substantial and solid base for a productive future and ought, as a result, to be regarded as a cause for optimism about the future and our future capacity to penetrate those markets, rather than just focusing wholly on the short-term pessimism with which Senator Hill is so comfortable.","N/A","N/A","/html/body/hansard/chamber.xscript/qwn/question.block[1]/answer[1]/talk.start/para","N/A","N/A"
4,0,0,0,1,0,0,0,1,"Senator HILL","BH4","SA","LP","N/A",1361,"—It is not a question of being comfortable. Actually, we on this side are particularly uncomfortable with what is happening in the country. But what we are asking is that the government take note of the messengers. It happened in the late 1980s when the messengers were telling the government that its policy was going to lead to a terrible recession. It ignored those messengers. Now the Business Council is saying to you that in fact its assessment, on the basis of what its member firms are saying to it, is much more pessimistic. Will you take note of that; will you recognise that, on top of the already terrible current account situation, there is the chance of further deterioration; and will you address it with policies other than simply pushing up interest rates?","N/A","N/A","/html/body/hansard/chamber.xscript/qwn/question.block[1]/question[2]/talk.start/para","N/A","N/A"
5,0,0,0,1,0,0,0,1,"Senator GARETH EVANS","VD4","VIC","ALP","N/A",1361,"—Yes, we will take notice of any sensibly based survey information which tells us something about expectations and about the psychology of the business community if not necessarily always about the actual facts on which things are based. Of course we will take notice of that, and of course we will continue with an economic policy which is not wholly premised on what monetary policy and what interest rates might be able to contribute to the necessary breaking of the economy. Of course we will concentrate very heavily on the fiscal side of the equation. That is what this budget is all about; we have made that perfectly clear.We do have to do something about improving the savings base in this country. We do have to improve that in the public sector as well as in the private sector. Of course, that is what the fiscal arrangements that we will be bidding for and implementing in this budget are all about.","N/A","N/A","/html/body/hansard/chamber.xscript/qwn/question.block[1]/answer[2]/talk.start/para","N/A","N/A"
6,0,0,0,1,0,0,0,1,"Senator BURNS","2F4","QLD","ALP","N/A",1362,"—My question is directed to the Minister for Primary Industries and Energy. Given the level of public, media and industry interest in the allegations concerning the meat industry recently raised by the Community and Public Sector Union, I ask the minister to advise the Senate what steps he has taken to have the allegations investigated. Is the minister in a position to give the Senate any preliminary advice on the nature and scope of the allegations?","N/A","N/A","/html/body/hansard/chamber.xscript/qwn/question.block[2]/question/talk.start/para","N/A","N/A"
7,0,0,0,1,0,0,0,1,"Senator COLLINS","OF4","NT","ALP","N/A",1362,"—The Community and Public Sector Union has given me a great deal of paper. Most of it comprises photocopies of acts of parliament and meat regulations. Fundamentally, the union has raised about half a dozen allegations. I believe that that was substantially what the union told the Senate committee last Friday—the members of the committee who were there would be able to confirm that. As I say, most of the paper that I have is photocopies of acts of parliament or regulations, but there are half a dozen or so allegations in that paper, most of which have been canvassed publicly before.I gave a series of public undertakings to the union before receiving those documents that any allegations that were brought forward by the union would be rigorously pursued, and I am now in the process of doing that. In this regard, my office has formally written to the Australian Government Solicitor expressing my wish to obtain expert independent legal advice on the implications of the matters that have been raised in the paperwork that has been given to me by the CPSU. The Australian Government Solicitor has been asked to examine the documents and then advise me on what steps, if any, should be taken. Depending on that advice, I may ask that the documents be referred to other agencies for appropriate action.I have informed the Australian Government Solicitor that the compliance legal and evaluation unit of the Australian Quarantine and Inspection Service is available to assist in the examination of the documents. I might add for the information of honourable senators that that compliance unit of AQIS routinely handles quite a large number of complaints that are made from time to time to do with things, for example, like substituting mutton for lamb—a practice not confined to the meat industry, I might add. There is a fair bit of it around here at times.","N/A","N/A","/html/body/hansard/chamber.xscript/qwn/question.block[2]/answer/talk.start[1]/para","N/A","N/A"
8,0,0,1,0,0,0,0,1,"Senator Boswell","YE4","N/A","N/A","N/A","N/A","—That is a sexist remark.","N/A","N/A","/html/body/hansard/chamber.xscript/qwn/question.block[2]/answer/interject/talk.start/para","N/A","N/A"
9,0,0,0,1,0,0,0,1,"Senator COLLINS","OF4","NT","ALP","N/A",1362,"—I was not talking about you, Ron, or me. I have informed the Australian Government Solicitor that the compliance legal and evaluation unit of the Australian Quarantine and Inspection Service is available to assist in the examination of the documents. I repeat my previous public assurances that the results of this investigation will be made public.","N/A","N/A","/html/body/hansard/chamber.xscript/qwn/question.block[2]/answer/talk.start[2]/para","N/A","N/A"
10,0,0,0,1,0,0,0,1,"Senator BOSWELL","YE4","QLD","NP","N/A",1362,"—My question is addressed to the Minister for Trade. I refer to comments last week by President Clinton that the success of the Uruguay Round world trade deal in cutting farm export subsidies `should not be undermined by any effort unilaterally to reduce subsidies at home and that he views the EEP as an important part of our ability to meet and match international competition. Considering the tremendous damage done to Australian primary industry by US subsidy programs—for example, the 90 per cent reduction in our sugar import quotas over the past 14 years and the $2.4 billion losses because of the subsidy trade war in the wheat industry—I ask: in view of the Uruguay Round agreements, is the US required to tariffy all its import quotas such as presently affect our beef and sugar industries? Does the government believe the US will introduce more subsidies before the start of the Uruguay Round? In what ways does the government believe it can influence the forthcoming US farm bill in view of President Clintons recent words?","N/A","N/A","/html/body/hansard/chamber.xscript/qwn/question.block[3]/question/talk.start/para","N/A","N/A"
11,0,0,0,1,0,0,0,1,"Senator McMULLAN","5I4","ACT","ALP","N/A",1362,"—I thank Senator Boswell for his question. I think it is the first opposition trade question I have had for some time. I am not aware of any fresh remarks made last week by President Clinton, but I am aware of comments he has made. I think we are referring to the same comments—I will not quibble about the timing. It is a cause of concern for Australia that, while we welcome the progress that has been made—I know Senator Boswell does and we all do—in the Uruguay Round, there is no sense in which Australia or any of the other Cairns Group countries believe that what was achieved is anything like sufficient. It was a useful first step. It is nothing like sufficient to say that we now have fair agricultural trading rules.We have terribly unfair, distorted agricultural trading rules internationally which are particularly bad for Australia and for the other free traders in agriculture, particularly those in the Cairns Group. So we will continue to focus on the issues that you raised. I will start from the last issue you raised and work up.The most important issue on which we will be focusing in 1995—and Senator Collins and I are working closely together on this with the industry—is the farm bill. The biggest decisions that will be made in the United States this year by Congress in determining the shape and nature of agricultural trade globally, but particularly to the United States and by the United States in other markets, will be in the farm bill.We have convened a committee with representatives of all the major interested commodity groups and with Senator Collins and me. We are working on a coordinated strategy. I very much appreciate the cooperation of the commodity groups in that they have taken a series of delegations—the most publicised of which was the dairy one—to Washington. Senator Collins is going this month and I will be going subsequently. The ambassador, as you know, has been making fairly high profile representations on this matter. That is our No. 1 focus for this year.Senator Boswell asked whether there will be more subsidies before 1 July. We expect there will be more subsidised exports under existing programs. The thing we have most sought to do is achieve a circumstance where there will be no further announcements of dairy export subsidies before 1 July, following on that most unwelcome round that was recently declared, about which we spoke earlier, Senator Boswell, and about which the industry made representations. As a result of our representations and those of the industry, we think there is a high probability that there will be no more. Mr Rowley and others from the dairy industry have not been able to obtain categorical assurances that there will be no further allocations. My personal view is that the industry in the United States would like them. I suspect that for budget and administrative reasons the odds are that there will not be any, but I can give no guarantee.Under EEP there is continuing pressure in the United States to proceed on export enhancement programs and to move it after the Uruguay Round to a market support program. That would be a concern, but at least the size of it will be constrained by the Uruguay Round agreements. Each year the extent to which there are subsidies available will be constrained by the limits negotiated from now until the end of the century through the Uruguay Round—not sufficient limits, but a very good start. So, over the years, as ABARE and other assessments have made clear, there will be improved access for Australian products to those global markets. (Time expired)","N/A","N/A","/html/body/hansard/chamber.xscript/qwn/question.block[3]/answer/talk.start/para","N/A","N/A"
12,0,0,0,1,0,0,0,1,"Senator FORSHAW",656,"NSW","ALP","N/A",1363,"—My question is directed to the Minister for the Environment, Sport and Territories. I draw the ministers attention to a story on the front page of todays Sydney Morning Herald which claims that within the next year two million Australian drivers will have to pay up to $350 each to convert their car airconditioners so that they can use non-ozone depleting refrigerants instead of CFCs. Could the minister advise the Senate as to whether these claims are correct or not?","N/A","N/A","/html/body/hansard/chamber.xscript/qwn/question.block[4]/question/talk.start/para","N/A","N/A"
13,0,0,0,1,0,0,0,1,"Senator FAULKNER","5K4","NSW","ALP","N/A",1363,"—I have seen the article to which Senator Forshaw refers in his question. It seems to me, unfortunately, that the article has been crafted to cause very unnecessary alarm. Let me first say that the headline of the article to which Senator Forshaw refers—that is, that two million Australians will have to pay up to $350 each within the next year to convert their car airconditioners—is categorically incorrect.It is well known that the manufacture and import of CFCs, apart from those needed for essential uses, will cease on 31 December 1995. This is consistent with the requirements of the Montreal protocol. CFCs have already been phased out in many industry sectors, including aerosols and refrigeration. The car airconditioning sector has in fact been one of the last to change.The Sydney Morning Herald article implies that all car owners will have to convert their car airconditioners in the next year. This is untrue. People with systems operating well can keep using them as long as they want to. There is no legal requirement for car airconditioners to be changed over to an alternative refrigerant by the end of the year. I stress that people do not have to rush out and convert their airconditioning equipment. But in the future when people need to have their equipment serviced, they might find that CFC is becoming either unavailable or very expensive. That is why the EPA is advising car owners to replace their car airconditioner gas with one of the new ozone-benign alternatives at the next major service. If they have it converted as part of routine servicing I have been advised that this will cost no more than $100 extra. This is because most parts are changed in a major service due to normal wear and tear.The Environment Protection Agency will conduct a public awareness campaign and a program to assist auto mechanics to provide accurate information to car owners. Australias actions in phasing out CFCs are part of a global commitment under the Montreal protocol on substances that deplete the ozone layer. The phase-out of all ozone depleting substances has the support of Commonwealth, state and territory governments. It has the support of industry and it has the support of the community. There are already signs that the Montreal protocol controls are starting to slow the rate of stratospheric ozone destruction. I am sure that will please all Australians.","N/A","N/A","/html/body/hansard/chamber.xscript/qwn/question.block[4]/answer/talk.start/para","N/A","N/A"
14,0,0,0,1,0,0,0,1,"Senator BELL","7U4","TAS","AD","N/A",1364,"—My question is directed to the Minister for the Environment, Sport and Territories. Is it true that there is a plan to expand the woodchip exports from Tasmania from the present approximately 2.9 million tonnes to 4 million tonnes? Given that we are constantly told that only waste material, not suitable for sawn timber, is used for woodchips, can the minister assure the Senate that there are markets for the more than 25 per cent increase in sawn timber which this expansion would imply—in other words, an additional 275,000 tonnes of sawn timber? Can the minister tell the Senate where this additional sawn timber will be sold, or will we simply see logs suitable for sawn timber being diverted in even greater numbers into chips to meet the increased export requirement?","N/A","N/A","/html/body/hansard/chamber.xscript/qwn/question.block[5]/question[1]/talk.start/para","N/A","N/A"
15,0,0,0,1,0,0,0,1,"Senator FAULKNER","5K4","NSW","ALP","N/A",1364,"—That is a matter that is outside my portfolio and it is a matter that should be properly directed to the Minister representing the Minister for Resources.","N/A","N/A","/html/body/hansard/chamber.xscript/qwn/question.block[5]/answer[1]/talk.start/para","N/A","N/A"
16,0,0,0,1,0,0,0,1,"Senator BELL","7U4","TAS","AD","N/A",1364,"—With that response I remind you that I am seeking an indication of whether the woodchip exports are being derived from waste timber or not. We want to know: is it waste timber that is going into these woodchips or is it some other form of timber? I thought the minister for the environment would be able to answer that—which is the thrust of the question.","N/A","N/A","/html/body/hansard/chamber.xscript/qwn/question.block[5]/question[2]/talk.start/para","N/A","N/A"
17,0,0,0,1,0,0,0,1,"Senator FAULKNER","5K4","NSW","ALP","N/A",1364,"—I am only willing to answer questions directed to me as the minister for the environment that go to my own portfolio responsibilities. I think all senators are aware that woodchip exports are derived from both integrated logging operations and from sawmill residues. That is no secret. I believe that all senators and many people in the general community are well aware of that. As I have said on many occasions, the governments approach on this issue is that we are striving to find a balance between protecting the environment in this country and protecting the jobs of Australian workers. That has been a commitment we have held to for a long period. We will be advancing this issue within that framework.","N/A","N/A","/html/body/hansard/chamber.xscript/qwn/question.block[5]/answer[2]/talk.start/para","N/A","N/A"
18,0,0,0,1,0,0,0,1,"Senator CHAMARETTE","SN5","WA","GWA","N/A",1364,"—My question is also directed to the Minister for the Environment, Sport and Territories. I ask: what stage has been reached by the working group of technical experts under the steering committee of ANZECC and the Australian Forestry Council in formulating recommendations on broad criteria on which to base reserve systems to protect the nature conservation values of forests? In particular, is this process so advanced that it will be possible to have in place a comprehensive, adequate and representative reserve system to protect old-growth forest and wilderness values by the end of 1995? If not, why not, and when will such an inadequate reserve system be established?","N/A","N/A","/html/body/hansard/chamber.xscript/qwn/question.block[6]/question[1]/talk.start/para","N/A","N/A"
19,0,0,0,1,0,0,0,1,"Senator FAULKNER","5K4","NSW","ALP","N/A",1364,"—The working group that Senator Chamarette refers to has been making what can only be described as very slow progress. It is true that the New South Wales government and New South Wales representatives on that particular working group have not supported the publication of the work that has been done to date by the so-called Janis working group.I can say that, for the Commonwealths part, we are very committed to seeing the establishment of a forest reserve system. We are very committed, as I have said in the past, to seeing a forest reserve system that is comprehensive, adequate and representative. I can say that we have been concerned about the lack of progress between the states and the government, that is, the Janis group, which has been developing the criteria for the comprehensive, adequate and representative reserve system.In view of the difficulty in achieving agreement through the mechanism that is envisaged in the national forest policy statement, the Commonwealth does intend to develop its own position on CAR criteria to stimulate the policy debate and to move it forward. In fact, my own department has done substantial work to provide a basis for discussion on the CAR criteria within the Commonwealth by the development of a draft working paper.I can say as far as the Commonwealth is concerned—and I believe this is a principle that is shared by state governments—that a CAR reserve system will form an integral part of regional forest agreements. These agreements to be negotiated between the Commonwealth and the states will be aimed at striking a balance between a range of economic and environmental obligations that both tiers of government have regarding the management and protection of forests.As I said in answer to Senator Bells supplementary question, I can confirm with you, Senator, that we are committed as we progress this work to the development of a very balanced approach—to balance the interests of both conservation and those who work in the forestry sector. I can assure you that the establishment of a genuinely comprehensive, adequate and representative reserve system is very high on the agenda of this government.","N/A","N/A","/html/body/hansard/chamber.xscript/qwn/question.block[6]/answer[1]/talk.start/para","N/A","N/A"
20,0,0,0,1,0,0,0,1,"Senator CHAMARETTE","SN5","WA","GWA","N/A",1364,"—Mr President, I ask a supplementary question. I thank the minister for his answer. I ask: how does the current rapid assessment process fit with these provisions of the NFPS? What criteria are being used to assess the values of the areas being assessed under the rapid assessment process?","N/A","N/A","/html/body/hansard/chamber.xscript/qwn/question.block[6]/question[2]/talk.start/para","N/A","N/A"
21,0,0,0,1,0,0,0,1,"Senator FAULKNER","5K4","NSW","ALP","N/A",1364,"—The criteria in relation to the assessment process have now been made public in announcements made by government over the period of the last four weeks. They are in the public arena. I am fairly confident that Senator Chamarette is well aware, as are many others, of the approach that government is taking. I can say to Senator Chamarette that cabinet is meeting again today to look at a certain number of coupes. When the Prime Minister made his original statement, it was made clear that there would be an eight-week period. At the conclusion of that eight-week period of assessment, final decisions will be made in relation to those 509 coupes that have been identified in the past. (Time expired)","N/A","N/A","/html/body/hansard/chamber.xscript/qwn/question.block[6]/answer[2]/talk.start/para","N/A","N/A"
22,0,0,0,1,0,0,0,1,"Senator KNOWLES","TH4","WA","LP","N/A",1365,"—My question is directed to the Minister representing the Prime Minister. In the recently tabled Auditor-Generals report on financial statement audits, the Auditor-General identified the following breaches at official establishments, otherwise known as the Lodge and Kirribilli House: 79 breaches of law where casual staff were paid from petty cash; 12 breaches of law of no employee declaration forms being completed—in other words, no tax was paid on their behalf; 26 breaches of issuing no group certificates; and 26 breaches of no employer superannuation contributions being made. Can the minister confirm that all of these breaches occurred at the Lodge or Kirribilli House and arose out of a dereliction of duty by the Prime Minister, who is responsible for both establishments?","N/A","N/A","/html/body/hansard/chamber.xscript/qwn/question.block[7]/question[1]/talk.start[1]/para","N/A","N/A"
23,0,0,1,0,0,0,0,1,"Senator Collins","OF4","N/A","N/A","N/A","N/A","—Yes, he sits there and issues the tax stamps.","N/A","N/A","/html/body/hansard/chamber.xscript/qwn/question.block[7]/question[1]/interject/talk.start/para","N/A","N/A"
24,0,0,0,1,0,0,0,1,"Senator KNOWLES","TH4","WA","LP","N/A",1365,"—You might think that this a very funny thing, but others do not. Can the minister explain what is actually going on in the Department of the Prime Minister and Cabinet in relation to these matters or does it use the same accountant as Mr Keating used when he failed to lodge his own personal tax return some years ago?","N/A","N/A","/html/body/hansard/chamber.xscript/qwn/question.block[7]/question[1]/talk.start[2]/para","N/A","N/A"
25,0,0,0,1,0,0,0,1,"Senator GARETH EVANS","VD4","VIC","ALP","N/A",1365,"—It is manifestly absurd to suggest that the Prime Minister personally should have any practical responsibility for the preparation of returns of that kind.","N/A","N/A","/html/body/hansard/chamber.xscript/qwn/question.block[7]/answer[1]/talk.start[1]/para","N/A","N/A"
