index,question_flag,answer_flag,interjection_flag,speech_flag,chamber_flag,name,name.id,electorate,party,role,page.no,content,subdebateinfo,debateinfo,path,Speaker,Time
87,0,0,0,1,1,"Katter, Bob, MP","HX4","Kennedy","KAP","N/A",44," It is a very great honour to be able to say a few words on behalf of my homeland. My homeland gave to Australia Qantas, Waltzing Matilda, the Royal Flying Doctor Service and the labour movement—I doubt whether theres a single family in this place of old Australians that didnt receive a benefit from the great labour movement. Dame Mary Gilmore, who is on our $10 note, one of the great ladies of the Labor movement—I hope Im not embarrassing the Prime Minister about his great-great-aunt—is buried in my home town of Cloncurry.Briefly, whats this area about? Its one-tenth of the surface area of Australia. There are hardly any people living there: there are only about 12,000 or 15,000 of us. I think the best poem that sums it up was by Richard Magoffin, the great historian of Waltzing Matilda: For what do we strive? For what do we fight? For a slab of dirt on a windswept plain thatll keep us broke till we go insane. And you say, Well, these people are stupid, arent they. My best friend is a guy called Ronnie Purse. When he went up into the wilderness there, there were no cattle. He and I owned half a million acres together. I contributed absolutely nothing, I must emphasise. Im not saying that out of any humility; its just the truth. By the time hed finished 45 years up there, we were producing $50 million worth of cattle a year. These are the people that produce for you the fourth-biggest export industry in this country, and the sixth-biggest secondary industry, meat processing, is one of the biggest employers in this country.I just want to quickly mention three families. One of them, whose family I went to school with right through, Im going to call Gary. I knew his great-grandparents. One was Chinese and came out in the gold rushes; the other was an Afghan camel driver. They didnt have it easy, I can tell you. Nor did the Scottish Presbyterians. For five generations, theyve battled it out there, starting with nothing. Even three generations ago, they were just shearing. Now theyve got probably one of the biggest middle-range cattle stations. They went through the TB eradication program, which took 650,000 of our cattle off us. They went through the live cattle dispute, which halved our incomes for three or four years. They went through the Japanese embargo, which the Australian government did nothing to fight, where we got $1 a head for our cattle. Its normally $100 a head. They went through the 74 flood—the most unbelievable thing Id ever seen in my life and maybe the worst flooding in Australian history. They went through Cyclone Ted. I lost half of my cattle in Cyclone Ted. There were 127,000 head of cattle, and maybe one-tenth of our entire herd went to Cyclone Ted.They went through the fires. For those of you who havent read Colleen McCulloughs book: youve got a front of 60 kilometres; its rolling at 60 miles an hour and its 60 feet high. This familys neighbours did a wonderful thing—well, it was a terrible thing. He had a rifle in his hands, and the television interviewer said, You lost your father and your brother. He said: My father and brother and the ringer. The ringer got tangled in the fence. They went back to save him, and all three of them were incinerated. That was 20 years ago to this very day. He was loading his rifle, and they said, What are you doing now? He said, I have to shoot my sheep. The sun was going down; the sheep had their entrails hanging out. Bang, bang, bang! Its all over for us.In this case, I rang this bloke up and I said, Mate, Im just on the phone to listen. He said: Bob, I went down to one of the bottom paddocks. There were 2,000 breeders in that paddock, and I didnt count 200. Thats just one paddock. Hes probably got about 12 or 15 paddocks. So youd have to say hes gone; hes got absolutely no hope of surviving. After five generations, coming out with camels—the Chinese and the Scottish Presbyterians and all of it—theres nothing left. He didnt say, I want some money. He didnt say, I want some help. He just said, Bobby, I went down and counted the 2,000 breeders, and there are less than 200 of them left.The second case—and Ill try to be as brief as possible. This blokes a real rough nut, a real hard man. Hes one of the big men in the cattle industry in Australia. I was with him at the rodeo. A bloke knocked down three people, and he came over and joined us. It was his brother. I said, Why didnt you go and help him? He said, Well, he didnt need any help, did he. These are hard men. This bloke drove 200 miles into town for a rugby league meeting, to get it going. I said, Good of you to come down, mate. He said, I didnt come down to town for rugby league. If the boy cant play football, hes not coming home. Thats the sort of people they are. I rang up one of his brothers. Hes in a chopper. I said, Im listening, mate. He said, Theres no hay in the country. Even if there was, there are no choppers to deliver it. Then he made some emotional sounds, and the telephone blanked out. His brother—again, one of the hardest people Ive ever met—on television broke down and cried. We dont cry in our country.In the third case, an extremely good-looking young woman—in one of our many disasters, her father took Cromoxin, the cruellest way possible to die; his kids had to survive on a station out in the middle of nowhere—lost one of her children from a very strange disease that we have in these areas. I rang her up. She didnt cry. She just said, Thank you for ringing, Mr Katter. Theyre selling up their stations, one by one. Presumably, theyd been wiped out—not by the banks. Im not trying to condemn the banks, but thats whats happening. So theyre watching them go, one by one. Theyre a fifth-generation family. Theyve lost everything. She was there at the meeting in a big straw sombrero. I kept looking at her and thinking, Thank you for ringing, Mr Katter.One-tenth of the nations cattle herd is in this area. Its the fourth-biggest export earner the country has. In Cyclone Ted we lost 127,000 head, and theyre telling us that the number will be four or five times those losses. And if we lose 300,000 calf factories, 300,000 cows, once you process them out youre looking at $600 million a year. If you say, Well, Ill capitalise that, then youre looking at $6,000 million worth of losses. In passing, I must mention, Mr Prime Minister and Mr Leader of the Opposition, we need a centralised control. Peter Beattie was passionate and very good. He brought in General Cosgrove for Cyclone Larry. Finally, I cant help but say: Why are you stupid? Why do you keep going up there? They say: Yeah, well, were giving our country one-tenth of its entire cattle industry. Please, get behind us—for us to keep going.I praise the Prime Minister very greatly here. If we can hold a little bit of that water back its not going to solve our problems, but one-tenth of that floodwater—where its 30 or 40 feet over the bridge at Normanton, it will only be one-tenth less than that height. Thats a big thing. If we do those water schemes that were doing now—thank you, Prime Minister, and thank you, Mr Leader of the Opposition, because you people have been very positive towards it—in those three towns, the water is stored and we can grow fodder so that when we get in these situations we have an answer. The fodder is there. With each of these cattle stations—all of them—their creeks and rivers run every year. Were not like the rest of Australia. Our creeks and rivers run every year. Our wet season is compressed into a tiny month or two-month period. So if you give them that, on their stations and in their towns, we can solve these problems.I cant speak today without mentioning the reconstruction authority. In every disaster in Australian history, up to 20 years ago, the government went in. They bought the debt off the banks. The banks wanted to offload it, so the banks would give you a 70 per cent cut. Your debt was immediately cut by 30 per cent. Then youd have government interest rates. I dont know what they are now. They were a bit under three per cent last time I looked. And thats all youd pay. These blokes are now paying, maybe, $100,000 a year. The banks are suddenly paying about $30,000 or $25,000 a year. Thats how we brought all of our industries through. I speak with great confidence because thats exactly what we did in the sugar industry when I had responsibility for the same thing.Finally, I hope, Mr Prime Minister and Mr Leader of the Opposition, that our country has not lost its vision. Surely we can see that we can hold back a little bit of those massive floodwaters drowning Townsville, regularly drowning Ingham, and send it out onto those barren western plains, which have the best soil in the world—thats the research station talking, not me—flat, rolling, treeless black soil. Ill finish on that note. There is a vision for the future. Out of all of this hardness and trauma and heartbreak, please let us be able to see a vision for our country.","Australian Natural Disasters","STATEMENTS ON INDULGENCE","/hansard/chamber.xscript/debate[11]/subdebate.1[2]/speech[3]/talk.text/body/p[1]","Mr KATTER (Kennedy) ","(14:38):"
88,0,0,0,1,1,"OToole, Cathy, MP",249908,"Herbert","ALP","N/A",46," I am a born and raised Townsvillean. It is my home. I have been through our worst natural disasters. I was there during Cyclone Althea and all of the subsequent cyclones, the massive flood of the late 1970s, the 1988 flood, which was dubbed The Night of Noah. But nothing can compare to the disaster and devastation of the floods we experienced last week. Townsville experienced the worst floods in our recorded history. We received a years rainfall in nine days, with 1,134 millimetres recorded up to 9 am, Monday, 4 February 2019, reaching over 1.65 metres. The Ross River Dam reached a record-breaking 244 per cent capacity. More than 22,000 homes and 110 roads in Townsville were affected by this extreme weather event.Over the last week, I have been visiting the residents in the areas affected by this disaster—people like Elaine from Railway Estate, whose home has been destroyed and whose irreplaceable antique family furniture has been lost, and residents on Queens Road, Hermit Park, whose livelihoods and lifetime belongings have been left in piles on the side of the road. I understand what people are going through because my mother was seriously affected as well. I understand what it is like to stand beside a loved family member as they part with their precious belongings because their home has been inundated. It becomes simply overwhelming, and the slightest thing can be the tipping point. For my mum, it was a large wooden frog that was given to her by my brother. When I said to her, Its destroyed, Mum; it will have to go, she simply burst into tears. So we kept it, damaged and all.These floods have destroyed livelihoods, but they cannot break the spirit of Townsvillean people, because after the devastation Townsville is showing just how strong and resilient we truly are. The entire community has been out helping—people taking those who have been affected by the floods into their homes without a second thought; the entire city rolling up its sleeves to get on with the massive clean-up; and businesses donating food, tarpaulins, money, goods and shelter. Our Australian Defence Force, police and ambulance services, firefighters and other emergency services, the SES, council workers and Ergon workers were out during the lead-up to the awful night, rescuing residents in very unsafe conditions. They are still out there now helping to clean up. We had two policemen who hung on, one to a tree and one to a light pole, waiting for nearly an hour to be rescued.To my volunteers who have been out since day one helping to shift the furniture and clean enormous amounts of mould—to all of the generous volunteers—I want to say, in this place, a huge thank you, because you are what makes Townsville great. Together we will recover and together we will get through this, and we will be better than we were before.","Australian Natural Disasters","STATEMENTS ON INDULGENCE","/hansard/chamber.xscript/debate[11]/subdebate.1[2]/speech[4]/talk.text/body/p[1]","Ms OTOOLE (Herbert) ","(14:50):"
89,0,0,0,1,1,"Christensen, George, MP",230485,"Dawson","LNP","N/A",47," I will make my comments brief. I was shocked to see the devastation, so widespread across the Townsville region, that was caused by these floods, particularly in areas in my electorate of Dawson. Suburbs such as Oonoonba, Idalia and Annandale were hard hit, all of them suburbs that border on the Ross River. I wonder what was going through peoples heads as they saw that tragedy unfold that night. They must have been thinking that it was the worst thing theyd ever seen. As the Prime Minister and I arrived in Idalia the day after the floodwaters had receded—it was Tuesday—people were coming back to their homes and looking at the mess. We walked through a couple of homes, and they were an absolute mess. I couldnt help but think, What is going through their heads?We walked through the home of a lady with a young daughter. Her home is uninsured. Without the generous payments that state and federal governments make available, she would have to bear extra costs, and there would have been many others just like her throughout the community.What I went to tell all those people is that there is hope. There definitely is hope. The member for Herbert has just told us about the community effort. I saw that, too, from those who were on the frontline, whether it was police; our Australian Defence Force personnel, with the 3rd Brigade led quite ably by Brigadier Scott Winter; and other emergency services personnel, whether they were paramedics, ambulance or fire brigade. People who were directly affected themselves were giving up their time, while their homes were damaged, and going out and helping others. More than that—there were volunteers. I saw young veterans out there cleaning up the homes of people they didnt even know. That is the kind of spirit that Townsvilleans and North Queenslanders have.I went to the Calvary Christian Church, where, within one day, they had amassed what looked like a warehouse of linen, childrens clothes and a whole range of other things that people may have needed in the aftermath of this event. They were inviting people to come and get that stuff for free. On top of that, they were inviting them to come in and have a meal if they couldnt prepare one at home themselves. The Salvos actually went into all of the evacuation centres and prepared all the meals for the people there. The hope was there in those communities. The Cowboys were going out on boats and rescuing people in suburbs like Idalia and Oonoonba. That stuff is priceless. That stuff is what shines through in such a terrible disaster as the one we have seen. Yes, we have spoken about it here numerous times, including all the woes of insurance—I certainly know about that, having helped my community with Cyclone Debbie. All the woes of the insurance dramas are going to come through, and this place will be watching and ensuring the right thing is done by all of those who have copped the brunt of this natural disaster. But what I say to all of those people is that there is hope—it is there in your community—and we are looking out for you, and, if help is needed, this House will surely provide it.","Australian Natural Disasters","STATEMENTS ON INDULGENCE","/hansard/chamber.xscript/debate[11]/subdebate.1[2]/speech[5]/talk.text/body/p[1]","Mr CHRISTENSEN (Dawson) ","(14:53):"
90,0,0,0,1,1,"Mr Katter ","N/A","N/A","N/A","N/A","N/A","Mr Katter interjecting— I havent called the member for Kennedy yet. The member for Kennedy can speak briefly; he has had a long indulgence.","Australian Natural Disasters","STATEMENTS ON INDULGENCE","/hansard/chamber.xscript/debate[11]/subdebate.1[2]/speech[5]/talk.text/body/p[5]","N/A","N/A"
91,0,0,1,0,1,"SPEAKER, The",10000,"N/A","N/A","N/A",48,"48 SPEAKER, The 10000","Australian Natural Disasters","STATEMENTS ON INDULGENCE","/hansard/chamber.xscript/debate[11]/subdebate.1[2]/speech[5]/interjection/talk.start","N/A","N/A"
92,0,0,0,1,1,"Katter, Bob, MP","HX4","Kennedy","KAP","N/A",48," I wanted to mention Townsville and the northern beaches area. On the first day, when I was working on sandbagging, there was a lady who was 66 years of age—I hope she doesnt mind me mentioning that—working on one side of me and two 13-year-old kids working on the other side of me. The rest of them were miners on rostered weeks off. They worked there all day long; there was about a quarter of an acre covered in sandbags. I found it very inspirational. I congratulate and back up the member for Dawson and the member for Herbert.","Australian Natural Disasters","STATEMENTS ON INDULGENCE","/hansard/chamber.xscript/debate[11]/subdebate.1[2]/speech[6]/talk.text/body/p","Mr KATTER (Kennedy) ","(14:57):"
93,0,0,0,1,1,"Collins, Julie, MP","HWM","Franklin","ALP","N/A",48," I speak today on behalf of my fellow Tasmanian federal members in this place and on behalf of our communities when I say thank you to the nation. Whilst the fire emergency might be extinguished a little in Tasmania, certainly the fires are not out. Tasmania continues to burn, as we have heard from both the Prime Minister and the Leader of the Opposition. But Tasmanian communities have been strong. Sadly, weve been through it before. The 1967 bushfires in Tasmania are well remembered. The bushfires over recent weeks have re-traumatised some of the communities in Tasmania.This fire was unusual. It was unusual in that the emergency went on for 2½ to three weeks. One of the hardest things I had to do during those few weeks was go to the evacuation centre and sit and talk to the local residents. One gentleman told me he wasnt so worried about himself; he was worried about his wife, who suffered from some anxiety. The constant packing up and being on edge—every day waking up, listening to the emergency warnings, hearing about where the fire was or wasnt and the change of direction from the wind—had put his wife and him on edge. It was the unknown day in, day out. They were waking up—or actually seeing light, because, of course, they rarely slept—and not knowing what the evening before had brought and what the coming days would bring. It was: You can go home. You may be able to go home. You can retrieve a few more of your things if you have time. Well close the road only one way. It was the backwards and forwards that was really taking its toll on these individuals and their families.On behalf of Tasmanians I want to put on record thanks for the wonderful support that we have received from all across the country and from the fire brigades from other states and overseas. Support and help has come in from all over Australia. We say thank you to Australia for the support we have received.I want to place on record my thanks to the local mayor in my Huon Valley. She has been extraordinary. She is a new mayor. She was elected only in October. She was at the evacuation centre every day for 2½ weeks, even though she had been evacuated from her own home. She was worried about her own community. She was there making sure that people got fed and that medications, mental health support and the practical things people evacuated from their homes with no notice or little notice needed day to day were available.It has been an extraordinary effort by the three tiers of government, particularly by local government, which has borne a lot of the burden in Tasmania. I want to say a huge thank you to the volunteer fire brigade in particular. There is a story running about one of the firemen in my electorate who missed his sons first Christmas, his sons first birthday and his wedding anniversary because as a volunteer firefighter he had been fighting fires every day since Christmas Day right through till early February.It has been an extraordinary time in Tasmania. These fires are quite unusual. As Ive said, they are now mostly under control, but they continue to burn. They also of course continue to impact the World Heritage area and the tourism and small businesses in Tasmania. Tasmanian businesses would want me to say that theyre still open for business. Most of the roads in Tasmania are still open. Most of our national parks are still open. People should still come and visit Tasmania because we need you more than ever at this difficult time as we recover. We are a resilient community. As Ive said, weve been through this before and well get through it again. Thank you.","Australian Natural Disasters","STATEMENTS ON INDULGENCE","/hansard/chamber.xscript/debate[11]/subdebate.1[2]/speech[7]/talk.text/body/p[1]","Ms COLLINS (Franklin) ","(14:58):"
94,0,0,0,1,1,"Morrison, Scott, MP","E3L","Cook","LP","N/A",49," I table a revised ministry list, reflecting the appointment of Andrew Gee to the ministry as the Assistant Minister to the Deputy Prime Minister.The document read as follows—MORRISON MINISTRYTitleMinisterPrime MinisterHon. Scott Morrison MPMinister for Indigenous AffairsSenator the Hon. Nigel ScullionMinister for WomenHon. Kelly ODwyer MPAssistant Minister to the Prime MinisterHon. Steve Irons MPDeputy Prime Minister and Minister for Infrastructure, Transport and Regional DevelopmentHon. Michael McCormack MPMinister for Regional Services, Sport, Local Government and DecentralisationSenator the Hon. Bridget McKenzieMinister for Cities, Urban Infrastructure and PopulationHon. Alan Tudge MPAssistant Minister for Regional Development and TerritoriesHon. Sussan Ley MPAssistant Minister for Roads and TransportHon. Scott Buchholz MPAssistant Minister to the Deputy Prime MinisterHon. Andrew Gee MPTreasurerHon. Josh Frydenb e rg MPAssistant TreasurerHon. Stuart Robert MPAssistant Minister for Treasury and FinanceSenator the Hon. Zed SeseljaMinister for Finance and the Public Service(Vice-President of the Executive Council)(Leader of the Government in the Senate)Senator the Hon. Mathias CormannSpecial Minister of StateHon. Alex Hawke MPAssistant Minister for Treasury and FinanceSenator the Hon. Zed SeseljaMinister for Defence(Leader of the House)Hon. Christopher Pyne MPMinister for Defence IndustryHon. Steven Ciobo MPMinister for Veterans AffairsHon. Darren Chester MPMinister for Defence Personnel(Deputy Leader of the House)Hon. Darren Chester MPMinister Assisting the Prime Minister for the Centenary of ANZACHon. Darren Chester MPAssistant Minister for DefenceSenator the Hon. David FawcettMinister for Foreign AffairsSenator the Hon. Marise PayneMinister for Trade, Tourism and Investment(Deputy Leader of the Government in the Senate)Senator the Hon. Simon BirminghamAssistant Minister for International Development and the PacificSenator the Hon. Anne RustonAssistant Minister for Trade, Tourism and InvestmentHon. Mark Coulton MPAttorney-GeneralHon. Christian Porter MPMinister for Home AffairsHon. Peter Dutton MPMinister for Immigration, Citizenship and Multicultural AffairsHon. David Coleman MPAssistant Minister for Home AffairsSenator the Hon. Linda Reynolds CSCMinister for Communications and the Arts(Manager of Government Business in the Senate)Senator the Hon. Mitch FifieldMinister for Jobs and Industrial RelationsHon. Kelly ODwyer MPMinister for Small and Family Business, Skills and Vocational EducationSenator the Hon. Michaelia CashMinister for Resources and Northern AustraliaSenator the Hon. Matthew CanavanMinister for Industry, Science and TechnologyHon. Karen Andrews MPMinister for EducationHon. Dan Tehan MPMinister for HealthHon. Greg Hunt MPMinister for Senior Australians and Aged CareHon. Ken Wyatt AM MPMinister for Indigenous HealthHon. Ken Wyatt AM MPMinister for Families and Social ServicesHon. Paul Fletcher MPMinister for Human Services and Digital TransformationHon. Michael Keenan MPAssistant Minister for Social Services, Housing and Disability ServicesHon. Sarah Henderson MPAssistant Minister for Children and FamiliesHon. Michelle Landry MPMinister for Agriculture and Water ResourcesHon. David Littleproud MPAssistant Minister for Agriculture and Water ResourcesSenator the Hon. Richard ColbeckMinister Assisting the Prime Minister for Drought Preparation and ResponseHon. David Littleproud MPMinister for the EnvironmentHon. Melissa Price MPMinister for EnergyHon. Angus Taylor MPEach box represents a portfolio. Cabinet Ministers are shown in bold type. As a general rule, there is one department in each portfolio. However, there is a Department of Human Services in the Social Services portfolio and a Department of Veterans Affairs in the Defence portfolio. The title of a department does not necessarily reflect the title of a minister in all cases. Assistant Ministers in italics are designated as Parliamentary Secretaries under the Ministers of State Act 1952.","N/A","MINISTERIAL ARRANGEMENTS","/hansard/chamber.xscript/debate[12]/speech/talk.text/body/p[1]","Mr MORRISON (Cook—Prime Minister) ","(15:02):"
