index,question_flag,answer_flag,interjection_flag,speech_flag,chamber_flag,name,name.id,electorate,party,role,page.no,content,subdebateinfo,debateinfo,path,Speaker,Time
1,0,0,0,0,1,"N/A","N/A","N/A","N/A","N/A","N/A","Tuesday, 12 February 2019","N/A","N/A","/hansard/chamber.xscript/business.start/body/p[1]","N/A","N/A"
2,0,0,0,0,1,"N/A","N/A","N/A","N/A","N/A","N/A","The SPEAKER ( Hon. Tony Smith ) took the chair at 12:00, made an acknowledgement of country and read prayers.","N/A","N/A","/hansard/chamber.xscript/business.start/body/p[2]","N/A","N/A"
3,0,0,0,1,1,"Smith, Tony, MP","00APG","Casey","LP","N/A",1," Pursuant to standing order 17, I lay on the table my warrant revoking the nomination of the honourable member for Calare to be a member of the Speakers panel.","N/A","PARLIAMENTARY OFFICE HOLDERS","/hansard/chamber.xscript/debate[1]/subdebate.2/speech/talk.text/body/p","The SPEAKER ","(12:01):"
4,0,0,0,1,1,"Smith, Tony, MP","00APG","Casey","LP","N/A",2," I have received a message from the Senate informing the House of a resolution of the Senate referring to the Joint Standing Committee on Electoral Matters established in the next Parliament the matter of a review of the operation of the amendments, dealing with foreign donations and related matters, made by the Electoral Legislation Amendment (Electoral Funding and Disclosure Reform) Act 2018.The message read as follows—(1) That the following matter be referred to the Joint Standing Committee on Electoral Matters established in the next Parliament, for commencement of a review on the second anniversary of the Royal Assent for the Electoral Legislation Amendment (Electoral Funding and Disclosure Reform) Act 2018:A review of the operation of the amendments, dealing with foreign donations and related matters, made by the Electoral Legislation Amendment (Electoral Funding and Disclosure Reform) Act 2018.The review will consider:(a) the operation of the amendments during the federal election immediately following the enactment of the amendments;(b) the clarity of public guidance products issued by regulators;(c) how the bills objectives can continue to be achieved in the most effective way while minimising red tape; and(d) any impacts from the amendments that are relevant to issue-based advocacy.(2) That the committee report within 6 months of receiving the reference.","Electoral Matters Committee","COMMITTEES","/hansard/chamber.xscript/debate[3]/subdebate.1[1]/subdebate.2/speech/talk.text/body/p[1]","The SPEAKER ","(12:02):"
5,0,0,0,1,1,"Smith, Tony, MP","00APG","Casey","LP","N/A",3," I have received a message from the Senate informing the House that Senator Waters has been discharged from the Joint Standing Committee on Northern Australia and Senator Siewert has been appointed a member of the committee.","Northern Australia Committee","COMMITTEES","/hansard/chamber.xscript/debate[3]/subdebate.1[2]/subdebate.2/speech/talk.text/body/p","The SPEAKER ","(12:02):"
6,0,0,0,1,1,"Hawke, Alex, MP","HWO","Mitchell","LP","N/A",3," I move:That the amendment be agreed to.","Treasury Laws Amendment (2017 Enterprise Incentives No. 1) Bill 2017","BILLS","/hansard/chamber.xscript/debate[4]/subdebate.1[1]/subdebate.2/speech[1]/talk.text/body/p[1]","Mr HAWKE (Mitchell—Special Minister of State) ","(12:04):"
7,0,0,0,1,1,"Leigh, Andrew, MP","BU8","Fenner","ALP","N/A",3," Labor is pleased that the government has seen sense in removing schedule 2 from the Treasury Laws Amendment (2017 Enterprise Incentives No. 1) Bill 2017. Schedule 2 of this bill gave taxpayers the choice to self-assess the effective life of certain intangible depreciating assets. Labor said, when the bill came before the House, that we would support schedule 1 but not schedule 2. We said that we could see some modest policy argument for it in good fiscal times. If the rivers of gold that flowed in the Howard and Costello years were still flowing, then it might be possible to make fiscally profligate decisions such as this. But we were then told that the measure would cost the budget $80 million over the forward estimates, and we could not in good conscience support that. Our reason for that is simple: net government debt now is around $350 billion, which is almost $14,000 for every person in Australia.That contrasts with when the coalition won office, when net debt was just $175 billion. Gross debt now exceeds half a trillion dollars—five times as large as when then opposition leader Malcolm Turnbull launched his debt truck back in 2009. If they were being honest about the state of government debt in the country, they should be commissioning a debt road train to replace their debt truck. We found out, when the government announced it last year, that the government was dropping schedule 2. The government said:Given the lack of parliamentary support the Government has decided not to proceed with this measure …When the government, in the Mid-Year Economic and Fiscal Outlook, on 17 December 2018, announced that it wouldnt proceed with schedule 2, it told us something else remarkable. The government told us that the cost of schedule 2 was not $80 million, as this House had been informed, but was a whopping $425 million. Thats how much this unnecessary tax concession would have cost the budget if Labor had not stood in its way.So, again, Labor has demonstrated ourselves to be the party of prudent and responsible economic management. At a time when net debt has been doubled by the Abbott-Turnbull-Morrison government, it is Labor that is standing against the extension of fiscally reckless loopholes in our tax system. We support the amended bill. It was Labors idea that the bill be amended in this way. And we simply thank our lucky stars that this tax loophole, originally $80 million and now costed at $425 million, has been avoided.Question agreed to.","Treasury Laws Amendment (2017 Enterprise Incentives No. 1) Bill 2017","BILLS","/hansard/chamber.xscript/debate[4]/subdebate.1[1]/subdebate.2/speech[2]/talk.text/body/p[1]","Dr LEIGH (Fenner) ","(12:04):"
8,0,0,0,1,1,"Hawke, Alex, MP","HWO","Mitchell","LP","N/A",5," I move:That the amendments be agreed to.Question agreed to.","Treasury Laws Amendment (2018 Measures No. 4) Bill 2018","BILLS","/hansard/chamber.xscript/debate[4]/subdebate.1[2]/subdebate.2/speech/talk.text/body/p[1]","Mr HAWKE (Mitchell—Special Minister of State) ","(12:07):"
9,0,0,0,1,1,"Kelly, Craig, MP",99931,"Hughes","LP","N/A",6," On behalf of the Parliamentary Joint Committee on Law Enforcement I present a corrigendum to the committees report entitled Inquiry into the trade in elephant ivory and rhinoceros horn.","Law Enforcement Committee","COMMITTEES","/hansard/chamber.xscript/debate[5]/subdebate.1/subdebate.2/speech/talk.text/body/p","Mr CRAIG KELLY (Hughes) ","(12:09):"
10,0,0,0,1,1,"Prentice, Jane, MP",217266,"Ryan","LP","N/A",6," I present the report of the Australian parliamentary delegation to the 10th Asia-Europe Parliamentary Partnership Meeting, ASEP10, held in Brussels from 27 to 28 September 2018.","Australian Parliamentary Delegation to the 10th Asia-Europe Parliamentary Partnership Meeting","DELEGATION REPORTS","/hansard/chamber.xscript/debate[6]/subdebate.1/speech/talk.text/body/p","Mrs PRENTICE (Ryan) ","(12:09):"
11,0,0,0,1,1,"Andrews, Kevin, MP","HK5","Menzies","LP","N/A",6," On behalf of the Joint Standing Committee on the National Disability Insurance Scheme, I present the following reports: Provision of assistive technology under the National Disability Insurance Scheme and National Disability Insurance Scheme ICT systems.Reports made parliamentary papers in accordance with standing order 39(e).","National Disability Insurance Scheme Committee","COMMITTEES","/hansard/chamber.xscript/debate[7]/subdebate.1[1]/subdebate.2/speech/talk.text/body/p[1]","Mr ANDREWS (Menzies) ","(12:10):"
12,0,0,0,1,1,"Conroy, Pat, MP",249127,"Shortland","ALP","N/A",6," On behalf of the Standing Committee on the Environment and Energy, I present the committees Report on the inquiry into the management and use of Commonwealth environmental water, together with minutes of the proceedings.Report made a parliamentary paper in accordance with standing order 39(e).","Environment and Energy Committee","COMMITTEES","/hansard/chamber.xscript/debate[7]/subdebate.1[2]/subdebate.2/speech/talk.text/body/p[1]","Mr CONROY (Shortland) ","(12:10):"
13,0,0,0,1,1,"MemberContinuation",249127,"N/A","N/A","N/A","N/A","Mr CONROY: by leave—Im pleased to present the report of the Standing Committee on Environment and Energy on our inquiry into the management and use of Commonwealth environmental water. The Commonwealth Environmental Water Holder controls a quantity of water in the Murray-Darling Basin. This water is for release from storage at times and locations where plants and animals need higher river flows or when wetlands need replenishment. Setting aside water for the environment is a relatively new concept and best practices are still evolving. This inquiry provided an opportunity for the committee to assess the water holders work to date and progress being made.The committee commenced its inquiry in February 2018 and held public hearings and site inspections around the basin area between March and June, including visits to Albury, Shepparton, Mildura, Murray Bridge and Goolwa, and an observation flight over the Menindee Lakes. In general, participants in the inquiry praised the work of the water holder and the way environmental water was being managed. It was acknowledged that the benefits of environmental watering are only likely to become apparent over the long term. The committee has recommended that the water holder continues certain practices, including the good-neighbour policy of working respectfully and harmoniously with other water holders and landholders, working with Indigenous communities, funding complementary measures, water trading and continued investment in infrastructure programs to maximise water efficiency. The committee also recommended that the water holder could improve in some areas, including better communicating the outcomes of environmental water, strengthening mechanisms for consultation with the community, considering establishment of an advisory or consultative group to inform on environmental water use decisions, and utilising the best available technology to monitor water movements and assess environmental conditions. It also made a recommendation on working around the vexed issue of shepherding environmental water. Its fair to say that, in all our hearings, the issue of shepherding environmental water was the most controversial. If you look at the reports on recent events around the Menindee Lakes, it is an issue that is most up-front in peoples minds around the management of the Murray-Darling Basin.On behalf of the committee, I would like to thank everyone who contributed to the inquiry. I thank the secretariat for their excellent work. I also want to acknowledge the strong work of the two chairs of the committee that we had during this process: the member for Mallee and the member for Calare. I thank both of them for their good work on this committee. I commend the report to the House.","Environment and Energy Committee","COMMITTEES","/hansard/chamber.xscript/debate[7]/subdebate.1[2]/subdebate.2/speech/talk.text/body/p[3]","N/A","N/A"
14,0,0,1,0,1,"Conroy, Pat, MP",249127,"Shortland","ALP","N/A",6,"6 Conroy, Pat, MP 249127 Shortland ALP","Environment and Energy Committee","COMMITTEES","/hansard/chamber.xscript/debate[7]/subdebate.1[2]/subdebate.2/speech/continue/talk.start","N/A","N/A"
15,0,0,0,1,1,"Sudmalis, Ann, MP",241586,"Gilmore","LP","N/A",7," On behalf of the Standing Committee on Indigenous Affairs, I present the committees Report on the impact of inauthentic art and craft in the style of First Nations peoples, together with the minutes of proceedings.Report made a parliamentary paper in accordance with standing order 39(e).","Indigenous Affairs Committee","COMMITTEES","/hansard/chamber.xscript/debate[7]/subdebate.1[3]/subdebate.2[1]/speech[1]/talk.text/body/p[1]","Mrs SUDMALIS (Gilmore) ","(12:13):"
16,0,0,0,1,1,"MemberContinuation",241586,"N/A","N/A","N/A","N/A","Mrs SUDMALIS: by leave—On behalf of the standing committee, I rise today to make a statement with regard to this report. It was presented to the Speaker out of session on 19 December last year.I acknowledge the Aboriginal and Torres Strait Islander peoples of this nation and the traditional custodians of country throughout Australia. I pay respect to ancestors and elders past, present and future and extend my thanks to all those who took part in the committees inquiry. In addition, I have come to have a greater respect and understanding of guardianship of culture for our First Nations people. I especially love the work of the dozens of art centre products, some currently on my walls, but the brilliant printing expertise of the women of Nagula Jarndu, a womens art and resource centre, I am wearing today in their honour. You can buy the material and make your own clothing, as I have done.First Nations art and craft is not simply a collection of design elements in some artistic media presentation. Rather, it is integral to their cultural identity, stories and history of the First Nations peoples.So it has been alarming to learn that up to 80 per cent of souvenirs sold in Australia, seemingly representing our First Nations cultures, are fake. These imitation products have no connection to First Nations people or their culture and are often cheaply made imports.And although the First Nations fine-art market is not affected by authenticity issues to the same extent, the committee heard some troubling reports of unethical practices in this market as well.It is not surprising that First Nations artists and communities feel disrespected and cheated, while for consumers there is no reliable way of knowing if what they are buying is genuine.The misrepresentation of First Nations cultures is unacceptable, so the committee makes eight recommendations to significantly reduce the prevalence of imitation products and create opportunities for First Nations artists and their communities. The key recommendations include:increased funding for the Indigenous Art Code to foster responsible retail and supply practicesincreased resourcing for First Nations art centres for capacity-building activitiesanalysis of the First Nations art and craft market to assess the lost revenue and opportunities linked to imitation products and identify potential economic opportunities for First Nations artists and their communitiesand starting a consultation process to develop standalone laws to protect Indigenous cultural intellectual property.There are individuals and businesses making outstanding contributions to safeguard Indigenous cultural expression. The committee is keen to support their efforts.The Indigenous Art Code does an impressive code of getting businesses to adopt its voluntary code of practice, to behave ethically and responsibly when selling First Nations art and craft, but limited resourcing affects its ability to achieve its full potential.We recommend increased resourcing for the Indigenous Art Code with a review after two years to see whether the voluntary code is affected or if a mandatory system should be considered.As well, First Nations art centres provide opportunities for artists and communities to foster and preserve their heritage.Unfortunately, centres struggle to keep qualified staff due to a lack of infrastructure, services and housing. Many would also benefit from greater access to business development expertise. So we recommend more support for capacity building through Indigenous business sector strategy funding. With many centres operating in remote areas, the committee learned about and was inspired by the art centre as businesses and community capacity builders. There are obvious social and economic benefits to growing them as self-supporting businesses.Additionally, we believe it is important to better understand the impacts of inauthentic products and, for this reason, recommend that the Productivity Commission conduct a comprehensive analysis of the First Nations art and craft market. This will play a vital role in implementing effective strategies to combat the sale of fake art.As to current legislation, consumer law allows the ACCC to take action where there is explicit evidence that consumers have been misled about inauthenticity—for example, by false labelling—but the absence of a consistent and recognisable labelling system for Indigenous art and craft products provides little protection for artists, communities or consumers.Therefore, we recommend IP Australia, in consultation with stakeholders, develop a certification trademark scheme for First Nations art and craft.Equally, copyright law is designed to protect an individuals artistic work over several decades, and it does this well, but these protections do not extend to the communal and enduring nature of First Nations traditional knowledge and cultural expression.For this reason, we recommend the development of standalone legislation to protect Indigenous cultural and intellectual properties rights. This could be facilitated through the establishment of a national Indigenous art and cultural authority, which is being explored by the Australia Council.First Nations people have been the custodians of their cultures for tens of thousands of years. It is an ethical and moral demand that we assist this guardianship into the future.Its my hope that the committees report and its recommendations will help foster and preserve authentic First Nations cultural expression for the benefit of all Australians.In concluding, Id like to acknowledge that this inquiry would not have been possible without the many contributions from First Nations artists and communities. For this we are extremely grateful. I also acknowledge contributions from industry peak bodies, Indigenous organisations, government agencies, academics and others. I thank the committees deputy chair, Warren Snowdon, and other committee members for their commitment to this inquiry. I also acknowledge the complete dedication of the secretariat team including Mel Brocklehurst, Kilian Perrem, Louise Milligan, Joel Bateman and Ben Vea Vea and all of the other support staff from broadcasting, Hansard and IT. Without their efforts we would not have been so well able to capture the essence of the guardianship, the love of country and the significance of our Australian First Peoples songlines. I commend this report to the House.","Indigenous Affairs Committee","COMMITTEES","/hansard/chamber.xscript/debate[7]/subdebate.1[3]/subdebate.2[1]/speech[1]/talk.text/body/p[3]","N/A","N/A"
17,0,0,1,0,1,"Sudmalis, Ann, MP",241586,"Gilmore","LP","N/A",7,"7 Sudmalis, Ann, MP 241586 Gilmore LP","Indigenous Affairs Committee","COMMITTEES","/hansard/chamber.xscript/debate[7]/subdebate.1[3]/subdebate.2[1]/speech[1]/continue/talk.start","N/A","N/A"
