index,question_flag,answer_flag,interjection_flag,speech_flag,chamber_flag,name,name.id,electorate,party,role,page.no,content,subdebateinfo,debateinfo,path,Speaker,Time
174,0,0,0,1,1,"MemberContinuation","DYW","N/A","N/A","N/A","N/A","Mr BURKE: The second issue thats referred to in the legal advice goes to the issue of whether or not, before this ultimately gets taken to the Governor-General, an appropriation would have to be made. For that reason, when we get to the next stage of the debate—and Im referring to it simply because part of this amendment is that the amendments be considered immediately—the amendment that will later be used will contain these words: a person is not entitled to remuneration in respect to their position as a member of the panel. In doing that, the two legal issues that have been raised will both be dealt with.Now, I must say: if the government was so determined that this was a constitutional principle, why do you think the letter from the Attorney-General to the Speaker carried the final sentence: I provide the advice on a confidential basis for a limited purpose of assisting you in the consideration of the Senate amendments and would appreciate you not circulating it further? If the Attorney-General were confident of his arguments, he would never have put that in. But he deliberately thought he would play a game of gazumping everybody on the final day. It takes a special Attorney-General to be able to deliver a 15-minute speech on this issue and not once refer to whether or not people who are ill can get medical care, but it was not referred to once.Im not going to delay the House a long time with this, but in the Attorney-Generals speech he referred to the 1,200 people who drowned. I have to say that, whenever that figure is referred to, it should be added, every single time, that half of them drowned after the Liberal and National parties voted against the Malaysia outcome. The member for Warringah has made clear that that was an error, but todays Prime Minister still stands by a decision that may well have been able to save not just one or two lives but half the lives that were lost. At the Press Club, he made a comment, something like, Oh, you cant cut the number in half. Well, we nearly did, and it will always hang over the members of the Liberal and National parties who chose to vote against an outcome not because they were outraged by it but because they knew it would work. They knew it would work; that was why. They wanted to keep the issue running all the way to the election.What is in front of us now allows us to make sure that, when people need medical care, the decisions around their medical care are made by people who are medically qualified. This legislation would not have been required were it not for the fact that those calling out, It happens now, have taken case after case through the courts trying to prevent people from getting medical care. Thats why weve got to this situation and so—","Home Affairs Legislation Amendment (Miscellaneous Measures) Bill 2018","BILLS","/hansard/chamber.xscript/debate[22]/subdebate.1/subdebate.2/speech[3]/talk.text/body/p[10]","N/A","N/A"
175,0,0,0,1,1,"MemberInterjecting","00AKI","N/A","N/A","N/A","N/A","Mr Dutton: Complete rubbish!","Home Affairs Legislation Amendment (Miscellaneous Measures) Bill 2018","BILLS","/hansard/chamber.xscript/debate[22]/subdebate.1/subdebate.2/speech[3]/talk.text/body/p[14]","N/A","N/A"
176,0,0,0,1,1,"MemberContinuation","DYW","N/A","N/A","N/A","N/A","Mr BURKE: Complete rubbish! Theres a refutation! Youre doing really well there, Minister! What we have in front of us now is a resolution, an amendment, to what the government has moved that does not in any way defy the information provided to the House by the Speaker, that allows the House to assert its rights in the same way that the Howard government did in 1996. It also deals with the other issue with respect to the Governor-General and the appropriation through the amendment that will come shortly.Every legal issue raised by the Attorney-General has now been addressed. This all could have been done in an orderly way had the Attorney-General not been so determined to keep this secret to get the element of surprise. When the way to deal with this is already contained within House of Representatives Practice, it doesnt take long to basically copy a resolution from the Howard government.I urge the House today to vote for the amendment, to vote for the motion as amended and to then vote for the amendments which will be used, because the difference they will make is simple: if someone is unwell they will be able to get medical care. When were we ever told that part of protecting our borders, as they say, was making sure that people who are unwell stay that way? When were we told that that was a principle? When did it suddenly become a pillar of border protection that people who are unwell need to be denied medical care? The amendment will deliver nothing more than that. I urge the House to support the amendment and to support the subsequent amendments that would then be moved.","Home Affairs Legislation Amendment (Miscellaneous Measures) Bill 2018","BILLS","/hansard/chamber.xscript/debate[22]/subdebate.1/subdebate.2/speech[3]/talk.text/body/p[15]","N/A","N/A"
177,0,0,1,0,1,"SPEAKER, The",10000,"N/A","N/A","N/A",91,"91 SPEAKER, The 10000","Home Affairs Legislation Amendment (Miscellaneous Measures) Bill 2018","BILLS","/hansard/chamber.xscript/debate[22]/subdebate.1/subdebate.2/speech[3]/interjection[1]/talk.start","N/A","N/A"
178,0,0,1,0,1,"Burke, Tony, MP","DYW","Watson","ALP","N/A",91,"91 Burke, Tony, MP DYW Watson ALP","Home Affairs Legislation Amendment (Miscellaneous Measures) Bill 2018","BILLS","/hansard/chamber.xscript/debate[22]/subdebate.1/subdebate.2/speech[3]/continue[1]/talk.start","N/A","N/A"
179,0,0,1,0,1,"Dutton, Peter, MP","00AKI","Dickson","LNP","N/A",92,"92 Dutton, Peter, MP 00AKI Dickson LNP","Home Affairs Legislation Amendment (Miscellaneous Measures) Bill 2018","BILLS","/hansard/chamber.xscript/debate[22]/subdebate.1/subdebate.2/speech[3]/interjection[2]/talk.start","N/A","N/A"
180,0,0,1,0,1,"Burke, Tony, MP","DYW","Watson","ALP","N/A",92,"92 Burke, Tony, MP DYW Watson ALP","Home Affairs Legislation Amendment (Miscellaneous Measures) Bill 2018","BILLS","/hansard/chamber.xscript/debate[22]/subdebate.1/subdebate.2/speech[3]/continue[2]/talk.start","N/A","N/A"
181,0,0,0,1,1,"Bandt, Adam, MP","M3C","Melbourne","AG","N/A",92," This is urgent. This can be dealt with now and it must be dealt with now, because people are sick and people are dying. One thing has become crystal clear, and it is made even clearer by the governments attempt to stop us even debating giving people the help they need, and that is you cannot trust this government to give people the help they need when theyre sick.We have heard report after report that strikes at the heart of most of us on the crossbench and most people in this country. When you have 11- or 12-year-old girls threatening to kill themselves and setting themselves alight because they have been stuck in conditions to the point where they break, where you have people who have committed no crime—no crime whatsoever—being put into prisons and have them deteriorate on our watch, under our care, and get denied the medical treatment they so desperately need, it is clear that something needs to change and that something needs to change quickly.It will come as no surprise that I do not support the system of offshore detention. I do not support it. I have not supported it for some time, but I know that others do and I accept that others do. There are potentially others on the crossbench who do and there are others in this parliament who do, but whether you do or you dont, and whether you are a voter who supports or doesnt support offshore detention, no-one can argue with the very simple proposition that when there is someone who is sick, who is under our care, then they need to get the medical treatment they need, and we can make that happen by passing this amendment and dealing with this now.","Home Affairs Legislation Amendment (Miscellaneous Measures) Bill 2018","BILLS","/hansard/chamber.xscript/debate[22]/subdebate.1/subdebate.2/speech[4]/talk.text/body/p[1]","Mr BANDT (Melbourne) ","(17:27):"
182,0,0,0,1,1,"Pyne, Christopher, MP","9V5","Sturt","LP","N/A",93," What an extraordinary series of admissions by the Manager of Opposition Business in the House in his address. First of all, he admitted—","Home Affairs Legislation Amendment (Miscellaneous Measures) Bill 2018","BILLS","/hansard/chamber.xscript/debate[22]/subdebate.1/subdebate.2/speech[5]/talk.text/body/p","Mr PYNE (Sturt—Minister for Defence and Leader of the House) ","(17:29):"
183,0,0,0,1,1,"Burke, Tony, MP","DYW","Watson","ALP","N/A",93," I move:That the question be now put.","Home Affairs Legislation Amendment (Miscellaneous Measures) Bill 2018","BILLS","/hansard/chamber.xscript/debate[22]/subdebate.1/subdebate.2/speech[6]/talk.text/body/p[1]","Mr BURKE (Watson—Manager of Opposition Business) ","(17:30):"
184,0,0,0,1,1,"Smith, Tony, MP","00APG","Casey","LP","N/A",95," The question is that the amendment moved by the Manager of Opposition Business be agreed to.","Home Affairs Legislation Amendment (Miscellaneous Measures) Bill 2018","BILLS","/hansard/chamber.xscript/debate[22]/subdebate.1/subdebate.2/speech[7]/talk.text/body/p","The SPEAKER ","(17:39):"
185,0,0,0,1,1,"Smith, Tony, MP","00APG","Casey","LP","N/A",96," The question is that the motion, as amended, be agreed to.","Home Affairs Legislation Amendment (Miscellaneous Measures) Bill 2018","BILLS","/hansard/chamber.xscript/debate[22]/subdebate.1/subdebate.2/speech[8]/talk.text/body/p","The SPEAKER ","(17:42):"
186,0,0,0,1,1,"Pyne, Christopher, MP","9V5","Sturt","LP","N/A",98," I move:That the Senate amendments be disagreed to.The government does not agree to the amendments that have been sent to us by the Senate. As the Attorney-General so eloquently pointed out in his speech about the other question that was before the chair, we should not be dealing with these amendments at all in the House of Representatives today. Before I was shut down by the Manager of Opposition Business, I was going to make the very valid point that, in his speech, he admitted the central gravamen of the Attorney-Generals argument—that this bill makes an appropriation and therefore cannot be considered by the House of Representatives without giving up 109 years of parliamentary precedents.Why do we know that the Manager of Opposition Business has admitted the central tenet of the Attorney-Generals argument? He seeks to amend this Senate amendment to make the doctors who would form the health panel voluntary, so he has admitted that therefore there must be remuneration in the original amendments from the Senate and it is therefore an appropriation bill, and thats why he seeks to amend it: to remove that appropriation. As the Attorney-Generals central thesis was that the House of Representatives could not allow the Senate to make an appropriation, he has admitted the Attorney-Generals argument, he has admitted that the Solicitor-Generals advice is right and he has admitted that the Attorney-Generals letter to the Speaker is correct.Therefore what the opposition and the crossbenchers have done today in their last series of votes is decide that they dont care about the Australian Constitution and they dont care about the Westminster traditions that form the basis of our Constitution and our parliamentary system. I would remind the House that the English fought a civil war over this matter. The civil war in England between King Charles I and the parliament was over the right of the parliament or the king to make the appropriation. The king tried to implement a ship tax, the parliament said that wasnt his right to do so and they fought a civil war over it, yet the Labor Party today, because of their sheer desperation to score political points, have convinced the crossbench that it is wiser to throw out 109 years of parliamentary precedents and to throw out the hundreds of years of tradition which have formed the basis of our Westminster system in order to make a cheap political point.Its bad enough that, to do so, Labor is prepared to weaken our border protection. By passing these Senate amendments, the Labor Party is prepared to put the people smugglers back in business, to put out the welcome mat to the people smugglers, to run the green light, if you like, for the people-smuggling trade. Theyre prepared to do all of that because they want to make cheap political points in the lead-up to an election.Im very disappointed that the crossbenchers have acquiesced to allowing this debate to occur, because, for two very significant reasons, theyll be remembered, unfortunately, under parliamentary precedents. This will all become the way the parliament now practises. Theyll be remembered for allowing the Senate to send us appropriations initiated in the wrong house, without a message from the Governor-General, just so that the Labor Party could make political points.Government members: Shame!","Home Affairs Legislation Amendment (Miscellaneous Measures) Bill 2018","BILLS","/hansard/chamber.xscript/debate[22]/subdebate.1/subdebate.2/speech[9]/talk.text/body/p[1]","Mr PYNE (Sturt—Minister for Defence and Leader of the House) ","(17:46):"
187,0,0,0,1,1,"MemberContinuation","9V5","N/A","N/A","N/A","N/A","Mr PYNE: It is a shameful act on the part of the Labor Party. As the Labor Party are the only other party that can form government in this country, they have a wider responsibility to act in the interests of the parliament, in the interests of our parliamentary system—the Westminster tradition, which is the foundation of it. They will rue establishing precedents like this. It doesnt really matter what the result of the next election is, at some stage in the future therell be other hung parliaments where governments will not have a majority, and therell be crossbenchers who are passionate about a particular issue. Labor might well be in power at that time, in some distant future, and they will rue the day that they established the precedent where the peoples house, the house which forms the government, which has for hundreds of years been the only house that can appropriate money, has abrogated that responsibility to the Senate, which can never be the basis of a house that forms a government.","Home Affairs Legislation Amendment (Miscellaneous Measures) Bill 2018","BILLS","/hansard/chamber.xscript/debate[22]/subdebate.1/subdebate.2/speech[9]/talk.text/body/p[9]","N/A","N/A"
188,0,0,1,0,1,"Pyne, Christopher, MP","9V5","Sturt","LP","N/A",99,"99 Pyne, Christopher, MP 9V5 Sturt LP","Home Affairs Legislation Amendment (Miscellaneous Measures) Bill 2018","BILLS","/hansard/chamber.xscript/debate[22]/subdebate.1/subdebate.2/speech[9]/continue/talk.start","N/A","N/A"
189,0,0,0,1,1,"Shorten, Bill, MP","00ATG","Maribyrnong","ALP","N/A",99," I move:That all words after That be omitted with a view to substituting the following words:the Senate amendments be agreed to with the amendments as set out in the schedule circulated to honourable Members.The amendments read as follows—(1) Amendment (2), at the end of section 198C, add:Note: Any transitory person who is brought to Australia for a temporary purpose must be kept in immigration detention whilst in Australia. That immigration detention must continue until the time of removal from Australia or until the Minister determines that immigration detention is no longer required.(2) Amendment (2), subsection 198D(2), omit Within 24 hours of, substitute After.(3) Amendment (2), after subsection 198D(2), insert:(2A) The Minister must make a decision under subsection (2):(a) as soon as practicable after being notified; and(b) no later than 72 hours after being notified.(4) Amendment (2), omit subsection 198D(3), substitute:(3) The Minister must approve the persons transfer to Australia unless:(a) the Minister reasonably suspects that the transfer of the person to Australia would be prejudicial to security within the meaning of the Australian Security Intelligence Organisation Act 1979, including because an adverse security assessment in respect of the person is in force under that Act; or(b) the Minister knows that the person has a substantial criminal record (as defined by subsection 501(7) as in force at the commencement of this section) and the Minister reasonably believes the person would expose the Australian community to a serious risk of criminal conduct.(3A) Within 72 hours of the Minister being notified under subsection (1), ASIO should advise the Minister if the transfer of the person to Australia may be prejudicial to security within the meaning of the Australian Security Intelligence Organisation Act 1979 (including because an adverse security assessment in respect of the person is in force under that Act) and if that threat cannot be mitigated.(5) Amendment (2), subsection 198D(5), omit the subsection, substitute:(5) If the Minister does not make a decision under subsection (2) within the time required by subsection (2A), the Minister is, at the end of the time, taken to have approved the persons transfer under subsection (2).(6) Amendment (2), omit subsection 198E(2), substitute:(2) A transitory person is a relevant transitory person if:(a) the person:(i) is in a regional processing country on the day this section commences; or(ii) is born in a regional processing country; and(b) in the opinion of a treating doctor for the person:(i) the person requires medical or psychiatric assessment or treatment; and(ii) the person is not receiving appropriate medical or psychiatric assessment or treatment in the regional processing country; and(iii) it is necessary to remove the person from a regional processing country for appropriate medical or psychiatric assessment or treatment.(7) Amendment (2), subsection 198E(3), omit Within 24 hours of, substitute After.(8) Amendment (2), after subsection 198E(3), insert:(3A) The Minister must make a decision under subsection (3):(a) as soon as practicable after being notified; and(b) no later than 72 hours after being notified.(9) Amendment (2), omit subsection 198E(4), substitute:(4) The Minister must approve the persons transfer to Australia unless:(a) the Minister reasonably believes that it is not necessary to remove the person from a regional processing country for appropriate medical or psychiatric assessment or treatment; or(b) the Minister reasonably suspects that the transfer of the person to Australia would be prejudicial to security within the meaning of the Australian Security Intelligence Organisation Act 1979, including because an adverse security assessment in respect of the person is in force under that Act; or(c) the Minister knows that the person has a substantial criminal record (as defined by subsection 501(7) as in force at the commencement of this section) and the Minister reasonably believes the person would expose the Australian community to a serious risk of criminal conduct.(4A) Within 72 hours of the Minister being notified under subsection (1), ASIO should advise the Minister if the transfer of the person to Australia may be prejudicial to security within the meaning of the Australian Security Intelligence Organisation Act 1979 (including because an adverse security assessment in respect of the person is in force under that Act) and if that threat cannot be mitigated.(10) Amendment (2), omit subsection 198E(5), substitute:(5) If the Minister does not make a decision under subsection (3) within the time required by subsection (3A), the Minister is, at the end of the time, taken to have approved the persons transfer under subsection (3).(11) Amendment (2), subsection 198F(2), omit Within 24 hours of, substitute As soon as practicable, and no later than 72 hours, after.(12) Amendment (2), subsection 198F(4), omit Within 24 hours of, substitute After.(13) Amendment (2), after subsection 198F(4), insert:(4A) The Minister must make a decision under subsection (4):(a) as soon as practicable after being informed by the panel of its findings and recommendations; and(b) no later than 24 hours after being informed by the panel of its findings and recommendation.(14) Amendment (2), omit subsection 198F(5), substitute:(5) If the panel recommends that the persons transfer be approved, the Minister must approve the persons transfer to Australia unless:(a) the Minister reasonably suspects that the transfer of the person to Australia would be prejudicial to security within the meaning of the Australian Security Intelligence Organisation Act 1979, including because an adverse security assessment in respect of the person is in force under that Act; or(b) the Minister knows that the person has a substantial criminal record (as defined by subsection 501(7) as in force at the commencement of this section) and the Minister reasonably believes the person would expose the Australian community to a serious risk of criminal conduct.(15) Amendment (2), omit subsection 198F(6), substitute:(6) If the Minister does not make a decision under subsection (4) within the time required by subsection (4A), the Minister is, at the end of that time, taken to have approved the persons transfer under subsection (4).(16) Amendment (2), subsection 198G(2), omit Within 24 hours of, substitute After.(17) Amendment (2), after subsection 198G(2), insert:(2A) The Minister must make a decision under subsection (2):(a) as soon as practicable after being informed; and(b) no later than 72 hours after being informed.(18) Amendment (2), omit subsection 198G(3), substitute:(3) The Minister must approve the persons transfer to Australia unless:(a) the Minister reasonably suspects that the transfer of the person to Australia would be prejudicial to security within the meaning of the Australian Security Intelligence Organisation Act 1979, including because an adverse security assessment in respect of the person is in force under that Act; or(b) the Minister knows that the person has a substantial criminal record (as defined by subsection 501(7) as in force at the commencement of this section) and the Minister reasonably believes the person would expose the Australian community to a serious risk of criminal conduct.(3A) Within 72 hours of the Minister being informed under subsection (1), ASIO should advise the Minister if the transfer of the person to Australia may be prejudicial to security within the meaning of the Australian Security Intelligence Organisation Act 1979 (including because an adverse security assessment in respect of the person is in force under that Act) and if that threat cannot be mitigated.(19) Amendment (2), section 198H, after 198E(4) (b) insert or (c).(20) Amendment (2), at the end of section 199B, add:(4) A person is not entitled to remuneration in respect of their position as a member of the panel.Last week the Prime Minister said that this amended bill would be superfluous and to ignore it. The Leader of the Opposition will resume his seat. The Leader of the House?","Home Affairs Legislation Amendment (Miscellaneous Measures) Bill 2018","BILLS","/hansard/chamber.xscript/debate[22]/subdebate.1/subdebate.2/speech[10]/talk.text/body/p[1]","Mr SHORTEN (Maribyrnong—Leader of the Opposition) ","(17:51):"
190,0,0,0,1,1,"MemberInterjecting","9V5","N/A","N/A","N/A","N/A","Mr Pyne: Mr Speaker, the Leader of the Opposition referred to amendments that have been circulated to the House. I dont see any amendments that have been circulated to the House on the table, and therefore he cant proceed until theyve been circulated. Ive ruled on this before. There need to be a reasonable number of amendments that are there being circulated. I can see the amendments being circulated. The Leader of the Opposition has four minutes, and Im sure theyll be circulated in that time. The Leader of the Opposition has the call.","Home Affairs Legislation Amendment (Miscellaneous Measures) Bill 2018","BILLS","/hansard/chamber.xscript/debate[22]/subdebate.1/subdebate.2/speech[10]/talk.text/body/p[68]","N/A","N/A"
