"question_flag","answer_flag","interjection_flag","speech_flag","chamber_flag","name","name.id","electorate","party","role","page.no","content","subdebateinfo","debateinfo","path","Speaker","Time"
"0","1","0","0","1","Morrison, Scott MP","E3L","Cook","LP","N/A","25"," Ill ask the minister for aged care to add to my answer. As I remarked in response to a question earlier today from the Leader of the Opposition, this pandemic is taking a heavy toll on the entire world and on Australia. In particular, our most vulnerable and our frailest are in the most vulnerable of all positions. I think we all understand that. While I know international comparisons provide no comfort to those who have lost loved ones, we do know that the outbreaks in Canada, for example, are around 13 times greater than what we see in this country. We do know that Australias fatality rate is one of the lowest in the world, certainly amongst the OECD countries. We do know that the investments that we have made—the changing of close contact rules and the investment in the boosted wage payments of aged care workers, including those working in non-care settings—are all assisting the sector to deal with a big challenge. But those who pretend that the pandemic can have no impact are misleading Australians and are diminishing the scale of what is a very difficult challenge. I will ask the minister for aged care to add further to my answer.","Aged Care","QUESTIONS WITHOUT NOTICE","/hansard/chamber.xscript/debate[9]/subdebate.1[3]/answer[1]/talk.text/body/p","Mr MORRISON (Cook—Prime Minister) ","(14:24):"
"0","1","0","0","1","Hunt, Greg MP","00AMV","Flinders","LP","N/A","25"," I recognise that this has been a very challenging time for many people in aged care in Australia and, of course, around the world. In particular, over the course of the summer weve been working very closely with our aged-care facilities, and we have dispatched over 48 million units of PPE in 2022 alone. That includes a total now of 10.9 million rapid antigen tests to aged-care facilities, which commenced in August of last year, and it has included over 6.7 million this year.","Aged Care","QUESTIONS WITHOUT NOTICE","/hansard/chamber.xscript/debate[9]/subdebate.1[3]/answer[2]/talk.text/body/p[1]","Mr HUNT (Flinders—Minister for Health and Aged Care) ","(14:25):"
"0","1","0","0","1","MemberInterjecting","140590","N/A","N/A","N/A","N/A","Ms ONeil: A point of order, Mr Speaker. The Prime Minister and the minister have now had two minutes to go to the point of this question, which is about the incompetence of the minister for aged-care services. Could they please address that key part of the question?","Aged Care","QUESTIONS WITHOUT NOTICE","/hansard/chamber.xscript/debate[9]/subdebate.1[3]/answer[2]/talk.text/body/p[2]","N/A","N/A"
"0","1","0","0","1","MemberInterjecting","265967","N/A","N/A","N/A","N/A"," The member for Hotham would know that the question was directed at, in effect, the state of the aged-care sector, and the minister for health is being directly relevant.","Aged Care","QUESTIONS WITHOUT NOTICE","/hansard/chamber.xscript/debate[9]/subdebate.1[3]/answer[2]/talk.text/body/p[3]","N/A","N/A"
"0","1","0","0","1","MemberContinuation","00AMV","N/A","N/A","N/A","N/A","Mr HUNT: In terms of the specific response to support the aged-care sector, which I would hope is the real concern of every person in this House, there have been 14.8 million units of masks, 17.5 million units of gloves, 5.9 million units of gowns and 3.9 million units of goggles. All of these are real actions that have been taken to support that sector. In addition to that, the changed furlough requirements were fundamental to ensuring continuity of workforce, in both the definition of a close contact and the capacity in critical sectors such as aged care for asymptomatic close contacts to work. Thats been backed up by 80,000 shifts which have been put in place by the government and, in addition, the support for workforce retention and now the ADF.","Aged Care","QUESTIONS WITHOUT NOTICE","/hansard/chamber.xscript/debate[9]/subdebate.1[3]/answer[2]/talk.text/body/p[4]","N/A","N/A"
"0","0","1","0","1","ONeil, Clare Ellen MP","140590","Hotham","ALP","N/A","25","25 ONeil, Clare Ellen MP 140590 Hotham ALP","Aged Care","QUESTIONS WITHOUT NOTICE","/hansard/chamber.xscript/debate[9]/subdebate.1[3]/answer[2]/interjection[1]/talk.start","N/A","N/A"
"0","0","1","0","1","Wallace, Andrew MP ","265967","Fisher","LNP","N/A","25","25 Wallace, Andrew MP (The SPEAKER) 265967 Fisher LNP","Aged Care","QUESTIONS WITHOUT NOTICE","/hansard/chamber.xscript/debate[9]/subdebate.1[3]/answer[2]/interjection[2]/talk.start","N/A","N/A"
"0","0","1","0","1","Hunt, Greg MP","00AMV","Flinders","LP","N/A","25","25 Hunt, Greg MP 00AMV Flinders LP","Aged Care","QUESTIONS WITHOUT NOTICE","/hansard/chamber.xscript/debate[9]/subdebate.1[3]/answer[2]/continue/talk.start","N/A","N/A"
"1","0","0","0","1","Conaghan, Pat MP","279991","Cowper","NATS","N/A","25"," My question is to the Deputy Prime Minister. This week the Morrison-Joyce government announced the reopening of our international borders. Will the Deputy Prime Minister please update the House on how the aviation and transport sectors will facilitate international travellers and help boost the tourist economy, and is the Deputy Prime Minister aware of any alternative approaches?","COVID-19: International Travel","QUESTIONS WITHOUT NOTICE","/hansard/chamber.xscript/debate[9]/subdebate.1[4]/question/talk.text/body/p","Mr CONAGHAN (Cowper) ","(14:27):"
"0","1","0","0","1","Joyce, Barnaby MP","e5d","New England","NATS","N/A","25"," I thank the honourable member for his question. I would also briefly like to acknowledge the great service of Her Majesty Queen Elizabeth II—both her service to the Commonwealth and her example to the world on the dignity of high office.Obviously, tourism is incredibly important. I note for the member for Cowper that, in places such as Port Macquarie and Coffs Harbour especially, which rely so heavily on what was a peak of 1.2 million passengers a month, passengers went down to merely 6½ thousand in the midst of the pandemic. This placed incredible stress on so many businesses throughout the member for Cowpers electorate.But it is not only the member for Cowpers electorate. It has been seen in the tourism industry in places such as Uluru, Alice Springs and Kakadu in the member for Lingiaris seat, the Great Barrier Reef and the Whitsundays in the member for Dawsons electorate, Cairns and the Great Barrier Reef in the member for Leichhardts seat, Carnarvon Gorge, Great Keppel Island and Mount Etna National Park in the member for Capricornias electorate. And it goes on. In the member for Hunters seat, whos not here today, it has affected the wineries of Pokolbin and Barrington Tops.So it is with great pleasure that we once more open up our nation to get our tourism industry back onto the footing that it was on beforehand and to meet the position that wed reached, especially on an economic basis—with the great work of the Treasurer—with exceptionally low unemployment and economic growth.The CEO of Qantas last night contacted me directly, telling me: Its great news about the international borders. It means Australia is truly open for business. Its fantastic for the industry, as a whole, and for the regions that have been doing it tough without the flow of tourists and labour. Thanks for staying the course. In noting staying the course, he of course notes the great support that was given by the Commonwealth government to keep the airline industry in a position where they can be the greatest beneficiary of this new opening. This is going to be incredibly important—that people such as Virgin Australia also get back in the air. The CEO, Jayne Hrdlicka, said, Todays announcement made by the Australian government is an important step forward in reigniting the travel industry and opening Australia to the rest of the world at a critical time of recovery. This will also come as positive news for travellers looking to reconnect with loved ones in Australia and will be a huge boost for our tourism industry.Of course, it goes without saying—I go back to the member for Cowper and the immense work he has done for the travel agents. We will note that the travel agents will also be looking forward to the reopening of these borders and the reinvigoration of their income stream.","COVID-19: International Travel","QUESTIONS WITHOUT NOTICE","/hansard/chamber.xscript/debate[9]/subdebate.1[4]/answer/talk.text/body/p[1]","Mr JOYCE (New England—Deputy Prime Minister and Minister for Infrastructure, Transport and Regional Development and Leader of the Nationals) ","(14:28):"
"1","0","0","0","1","Albanese, Anthony MP","R36","Grayndler","ALP","N/A","26"," Yesterday the Prime Minister announced the defence forces would be operating in aged care, after repeatedly ruling it out—on 13 January, 19 January, 4 February and at other times. Why does the Prime Minister reject good ideas time and time again, always taking action which is too little too late and after a problem becomes a crisis?","COVID-19: Prime Minister","QUESTIONS WITHOUT NOTICE","/hansard/chamber.xscript/debate[9]/subdebate.1[5]/question/talk.text/body/p","Mr ALBANESE (Grayndler—Leader of the Opposition) ","(14:31):"
"0","1","0","0","1","Morrison, Scott MP","E3L","Cook","LP","N/A","26"," When will the Leader of the Opposition stop trying to politicise the pandemic? Time and again, the Leader of the Labor Party continues to misrepresent the facts. I simply said in January—","COVID-19: Prime Minister","QUESTIONS WITHOUT NOTICE","/hansard/chamber.xscript/debate[9]/subdebate.1[5]/answer/talk.text/body/p[1]","Mr MORRISON (Cook—Prime Minister) ","(14:31):"
"0","1","0","0","1","Opposition members ","N/A","N/A","N/A","N/A","N/A","Opposition members interjecting—","COVID-19: Prime Minister","QUESTIONS WITHOUT NOTICE","/hansard/chamber.xscript/debate[9]/subdebate.1[5]/answer/talk.text/body/p[2]","N/A","N/A"
"0","1","0","0","1","MemberInterjecting","265967","N/A","N/A","N/A","N/A"," The Prime Minister will resume his seat for one moment. Im trying to listen to the answer. I cant hear the answer when theres such noise on my left. The Prime Minister has the call.","COVID-19: Prime Minister","QUESTIONS WITHOUT NOTICE","/hansard/chamber.xscript/debate[9]/subdebate.1[5]/answer/talk.text/body/p[3]","N/A","N/A"
"0","1","0","0","1","MemberContinuation","E3L","N/A","N/A","N/A","N/A","Mr MORRISON: I made the point, quite openly and honestly, that the suggestion that the defence forces could be a replacement workforce for the aged-care sector was not a realistic option. Thats all Ive said. That is not what the government has now done. I was very clear yesterday about what the targeted involvement would be of the defence forces, as I asked them on the very day the Leader of the Labor Party accuses me of saying they had no role. On the very day, or thereabouts, I spoke to the Vice Chief of Defence Force and asked him to work—","COVID-19: Prime Minister","QUESTIONS WITHOUT NOTICE","/hansard/chamber.xscript/debate[9]/subdebate.1[5]/answer/talk.text/body/p[4]","N/A","N/A"
"0","1","0","0","1","MemberInterjecting","265967","N/A","N/A","N/A","N/A"," The Leader of the Opposition, on a point of order?","COVID-19: Prime Minister","QUESTIONS WITHOUT NOTICE","/hansard/chamber.xscript/debate[9]/subdebate.1[5]/answer/talk.text/body/p[5]","N/A","N/A"
"0","1","0","0","1","MemberInterjecting","R36","N/A","N/A","N/A","N/A","Mr Albanese: It goes to relevance. The Prime Minister said, Ive seen the suggestion that the defence forces can go in and operate in aged care. No, thats not the case. Thats what you—","COVID-19: Prime Minister","QUESTIONS WITHOUT NOTICE","/hansard/chamber.xscript/debate[9]/subdebate.1[5]/answer/talk.text/body/p[6]","N/A","N/A"
"0","1","0","0","1","MemberInterjecting","265967","N/A","N/A","N/A","N/A"," The Leader of the Opposition will resume his seat. Theres no valid point of order. The Prime Minister has the call.","COVID-19: Prime Minister","QUESTIONS WITHOUT NOTICE","/hansard/chamber.xscript/debate[9]/subdebate.1[5]/answer/talk.text/body/p[7]","N/A","N/A"
"0","1","0","0","1","MemberContinuation","E3L","N/A","N/A","N/A","N/A","Mr MORRISON: The Leader of the Labor Party can snarl and growl all he likes, as he has done over the course of this pandemic. He has constantly been negative when it comes to the serious challenges that our country has faced. He can seek to downplay Australians efforts, in how weve come through this pandemic, with his constant negativity, snarling and growling, but the facts are these: on each occasion, we have worked to address the situation that we have had before us. On each and every occasion, we have sought to apply the resources—whether they be the defence forces, our own Public Service officers and those around the country—to address the needs that have been required, particularly in the aged-care sector, where our defence forces were applied in Victoria during the second wave and are now being used in a similar way with targeted interventions, not with the wholesale replacement of the aged-care workforce. If the Leader of the Opposition—the Leader of the Labor Party—were actually interested in solving the problem, he would have attended himself to the facts of those issues. The Leader of the Labor Party is all about exploiting this pandemic, not about addressing it.","COVID-19: Prime Minister","QUESTIONS WITHOUT NOTICE","/hansard/chamber.xscript/debate[9]/subdebate.1[5]/answer/talk.text/body/p[8]","N/A","N/A"
"0","0","1","0","1","Wallace, Andrew MP ","265967","Fisher","LNP","N/A","26","26 Wallace, Andrew MP (The SPEAKER) 265967 Fisher LNP","COVID-19: Prime Minister","QUESTIONS WITHOUT NOTICE","/hansard/chamber.xscript/debate[9]/subdebate.1[5]/answer/interjection[1]/talk.start","N/A","N/A"
"0","0","1","0","1","Morrison, Scott MP","E3L","Cook","LP","N/A","26","26 Morrison, Scott MP E3L Cook LP","COVID-19: Prime Minister","QUESTIONS WITHOUT NOTICE","/hansard/chamber.xscript/debate[9]/subdebate.1[5]/answer/continue[1]/talk.start","N/A","N/A"
"0","0","1","0","1","Wallace, Andrew MP ","265967","Fisher","LNP","N/A","26","26 Wallace, Andrew MP (The SPEAKER) 265967 Fisher LNP","COVID-19: Prime Minister","QUESTIONS WITHOUT NOTICE","/hansard/chamber.xscript/debate[9]/subdebate.1[5]/answer/interjection[2]/talk.start","N/A","N/A"
"0","0","1","0","1","Albanese, Anthony MP","R36","Grayndler","ALP","N/A","26","26 Albanese, Anthony MP R36 Grayndler ALP","COVID-19: Prime Minister","QUESTIONS WITHOUT NOTICE","/hansard/chamber.xscript/debate[9]/subdebate.1[5]/answer/interjection[3]/talk.start","N/A","N/A"
"0","0","1","0","1","Wallace, Andrew MP ","265967","Fisher","LNP","N/A","26","26 Wallace, Andrew MP (The SPEAKER) 265967 Fisher LNP","COVID-19: Prime Minister","QUESTIONS WITHOUT NOTICE","/hansard/chamber.xscript/debate[9]/subdebate.1[5]/answer/interjection[4]/talk.start","N/A","N/A"
"0","0","1","0","1","Morrison, Scott MP","E3L","Cook","LP","N/A","26","26 Morrison, Scott MP E3L Cook LP","COVID-19: Prime Minister","QUESTIONS WITHOUT NOTICE","/hansard/chamber.xscript/debate[9]/subdebate.1[5]/answer/continue[2]/talk.start","N/A","N/A"
"1","0","0","0","1","Bandt, Adam Paul MP","M3C","Melbourne","AG","N/A","27"," My question is to the Prime Minister. Isnt it the case that, if your Religious Discrimination Bill is passed, even with your amendments, a school can sack an unmarried teacher because shes pregnant, if its against the schools beliefs; a doctor can tell their patient that their sickness is a punishment from God because theyre gay; and a student can be expelled because theyre transgender? We all support protecting religious groups from victimisation. But why are you using the dying days of this parliament to push through a Trojan Horse for hate that will mean more discrimination, not less?","Religious Discrimination Bill 2021","QUESTIONS WITHOUT NOTICE","/hansard/chamber.xscript/debate[9]/subdebate.1[6]/question/talk.text/body/p[1]","Mr BANDT (Melbourne—Leader of the Australian Greens) ","(14:34):"
"1","0","0","0","1","MemberInterjecting","265967","N/A","N/A","N/A","N/A"," Just before the Prime Minister rises, Im concerned—and Im happy to hear from the Manager of Opposition Business and the Leader of the House—that the question involves legal opinion. Im happy to hear from the Manager of Opposition Business.","Religious Discrimination Bill 2021","QUESTIONS WITHOUT NOTICE","/hansard/chamber.xscript/debate[9]/subdebate.1[6]/question/talk.text/body/p[2]","N/A","N/A"
"1","0","0","0","1","Mr Bandt ","M3C","N/A","N/A","N/A","N/A","Mr Bandt interjecting—","Religious Discrimination Bill 2021","QUESTIONS WITHOUT NOTICE","/hansard/chamber.xscript/debate[9]/subdebate.1[6]/question/talk.text/body/a/p","N/A","N/A"
"1","0","0","0","1","MemberInterjecting","265967","N/A","N/A","N/A","N/A","The SPEAK ER: Does the member for Melbourne wish to rephrase the question?","Religious Discrimination Bill 2021","QUESTIONS WITHOUT NOTICE","/hansard/chamber.xscript/debate[9]/subdebate.1[6]/question/talk.text/body/p[3]","N/A","N/A"
"1","0","0","0","1","MemberContinuation","M3C","N/A","N/A","N/A","N/A","Mr BANDT: I wish to address your point of order.","Religious Discrimination Bill 2021","QUESTIONS WITHOUT NOTICE","/hansard/chamber.xscript/debate[9]/subdebate.1[6]/question/talk.text/body/p[4]","N/A","N/A"
"1","0","0","0","1","MemberInterjecting","265967","N/A","N/A","N/A","N/A"," The member for Melbourne has the call.","Religious Discrimination Bill 2021","QUESTIONS WITHOUT NOTICE","/hansard/chamber.xscript/debate[9]/subdebate.1[6]/question/talk.text/body/p[5]","N/A","N/A"
"1","0","0","0","1","MemberContinuation","M3C","N/A","N/A","N/A","N/A","Mr BANDT: Mr Speaker, that goes to questions about things that the Prime Minister has said previously about what is in this bill and what is not in this bill and the effect of this bill. So it is asking about things that the Prime Minister has already said. It is about what the effect of legislation will be—not about giving legal advice about an existing situation but, What will be the case if the legislation is passed? If you cant ask government ministers, What will be the effect of your laws if theyre passed? because it amounts to legal advice, then none of us can ask anything about any government legislation in this parliament.","Religious Discrimination Bill 2021","QUESTIONS WITHOUT NOTICE","/hansard/chamber.xscript/debate[9]/subdebate.1[6]/question/talk.text/body/p[6]","N/A","N/A"
"1","0","0","0","1","MemberInterjecting","265967","N/A","N/A","N/A","N/A"," I accept the explanation of the member for Melbourne. The Prime Minister has the call.","Religious Discrimination Bill 2021","QUESTIONS WITHOUT NOTICE","/hansard/chamber.xscript/debate[9]/subdebate.1[6]/question/talk.text/body/p[7]","N/A","N/A"
"0","0","1","0","1","Wallace, Andrew MP ","265967","Fisher","LNP","N/A","27","27 Wallace, Andrew MP (The SPEAKER) 265967 Fisher LNP","Religious Discrimination Bill 2021","QUESTIONS WITHOUT NOTICE","/hansard/chamber.xscript/debate[9]/subdebate.1[6]/question/interjection[1]/talk.start","N/A","N/A"
"0","0","1","0","1","27 Mr Bandt ","N/A","N/A","N/A","N/A","27","27 Mr Bandt interjecting—","Religious Discrimination Bill 2021","QUESTIONS WITHOUT NOTICE","/hansard/chamber.xscript/debate[9]/subdebate.1[6]/question/interjection[2]/talk.start","N/A","N/A"
"0","0","1","0","1","Wallace, Andrew MP ","265967","Fisher","LNP","N/A","27","27 Wallace, Andrew MP (The SPEAKER) 265967 Fisher LNP","Religious Discrimination Bill 2021","QUESTIONS WITHOUT NOTICE","/hansard/chamber.xscript/debate[9]/subdebate.1[6]/question/interjection[3]/talk.start","N/A","N/A"
"0","0","1","0","1","Bandt, Adam Paul MP","M3C","Melbourne","AG","N/A","27","27 Bandt, Adam Paul MP M3C Melbourne AG","Religious Discrimination Bill 2021","QUESTIONS WITHOUT NOTICE","/hansard/chamber.xscript/debate[9]/subdebate.1[6]/question/continue[1]/talk.start","N/A","N/A"
"0","0","1","0","1","Wallace, Andrew MP ","265967","Fisher","LNP","N/A","27","27 Wallace, Andrew MP (The SPEAKER) 265967 Fisher LNP","Religious Discrimination Bill 2021","QUESTIONS WITHOUT NOTICE","/hansard/chamber.xscript/debate[9]/subdebate.1[6]/question/interjection[4]/talk.start","N/A","N/A"
"0","0","1","0","1","Bandt, Adam Paul MP","M3C","Melbourne","AG","N/A","27","27 Bandt, Adam Paul MP M3C Melbourne AG","Religious Discrimination Bill 2021","QUESTIONS WITHOUT NOTICE","/hansard/chamber.xscript/debate[9]/subdebate.1[6]/question/continue[2]/talk.start","N/A","N/A"
"0","0","1","0","1","Wallace, Andrew MP ","265967","Fisher","LNP","N/A","27","27 Wallace, Andrew MP (The SPEAKER) 265967 Fisher LNP","Religious Discrimination Bill 2021","QUESTIONS WITHOUT NOTICE","/hansard/chamber.xscript/debate[9]/subdebate.1[6]/question/interjection[5]/talk.start","N/A","N/A"
"0","1","0","0","1","Morrison, Scott MP","E3L","Cook","LP","N/A","27"," Im very happy to answer the members question. If he is seeking a legal opinion on the matters that he has raised, about what the impacts are, as he has outlined them, then he should check with the member for Isaacs, because the very issues that the member raises are a result of the laws introduced by the Labor Party in relation to transgender children or children of different sexual orientation. Those laws, to allow the expulsion of those students, were introduced by the Labor Party when they were last in government.Im asked whether I should be coming here and making changes to laws that were introduced by the Labor Party that have the exact effect of what you are speaking about. What I am introducing and what I introduced at this dispatch box was a set of positive laws which werent about the Sex Discrimination Act—positive laws that prevent discrimination against people of religious faith or who have no religious faith. The issues that are contained in that bill do not provide the powers to do the things that you talk about. Those powers exist in the law as it stands today, as was introduced by the Labor Party when they were last in government.So our laws are about speaking to all of those Australians that have come from places far and wide around the globe—and we were at a Greek Orthodox church today, but we could easily have been at a Maronite church or at a Coptic Orthodox church; we could have been at those churches. I can tell you that their parishioners would say this to you, as Bishop Tarabay—a good friend of many in this chamber—has said to me: they came here to flee religious persecution and discrimination, and they came to this country believing this was a country where those things would be protected, and they are finding that not to be their experience. So Im prepared to legislate on behalf of our government. I took this to the Australian people and they supported us, and they supported, at the ballot box, those protections being provided to people of religious faith.Now, if those in this chamber want to speak about multiculturalism and how great a multicultural society it is, then they must acknowledge the role of faith and culture in this country, and if they want to support multiculturalism in this chamber then I urge them to support the bill, because I know the faith communities of suburban Melbourne, whether they be the Sikhs or the Hindus, or the Muslims of Sydney and Melbourne, or the Christians of north-western Sydney or Queensland or southern Tasmania or northern Tasmania or wherever you happen to be. If you support religious freedom and opposing religious discrimination, support the bill. (Time expired)","Religious Discrimination Bill 2021","QUESTIONS WITHOUT NOTICE","/hansard/chamber.xscript/debate[9]/subdebate.1[6]/answer/talk.text/body/p[1]","Mr MORRISON (Cook—Prime Minister) ","(14:36):"
"1","0","0","0","1","McIntosh, Melissa MP","281513","Lindsay","LP","N/A","27"," My question is to the Treasurer. Will the Treasurer remind the House how the Morrison governments strong and principled economic management is driving unemployment to its lowest level in 13 years and how we plan to generate even more jobs for Australian families and businesses into the future? Is the Treasurer aware of any alternative policies?","Economy","QUESTIONS WITHOUT NOTICE","/hansard/chamber.xscript/debate[9]/subdebate.1[7]/question/talk.text/body/p","Mrs McINTOSH (Lindsay) ","(14:39):"
"0","1","0","0","1","Frydenberg, Josh MP","FKL","Kooyong","LP","N/A","28"," I thank the member for Lindsay for her question. I had the opportunity to join her recently in her electorate and visit an earthmoving business that was investing in new equipment by using our immediate expensing provisions.When the coalition came to government, the unemployment rate was 5.7 per cent and rising. When the coalition came to government, there were one million fewer women in work. And, when the coalition came to government, under Labor, one in eight manufacturing jobs were lost. Now, after the biggest economic shock since the Great Depression, the picture is very different. The unemployment rate, at 4.2 per cent, is at a 13-year low and is on track to being at a 50-year low. There are a record number of Australians in a trade apprenticeship. And there are 1.7 million more Australians in work today than when Labor was last in office. Our economic plan is working, investing in skills, lower taxes—","Economy","QUESTIONS WITHOUT NOTICE","/hansard/chamber.xscript/debate[9]/subdebate.1[7]/answer/talk.text/body/p[1]","Mr FRYDENBERG (Kooyong—Treasurer) ","(14:40):"
"0","1","0","0","1","Ms Coker ","263547","N/A","N/A","N/A","N/A","Ms Coker interjecting—","Economy","QUESTIONS WITHOUT NOTICE","/hansard/chamber.xscript/debate[9]/subdebate.1[7]/answer/talk.text/body/a[1]/p","N/A","N/A"
