"question_flag","answer_flag","interjection_flag","speech_flag","chamber_flag","name","name.id","electorate","party","role","page.no","content","subdebateinfo","debateinfo","path","Speaker","Time"
"0","0","0","1","1","Leeser, Julian MP","109556","Berowra","LP","N/A","74"," Im pleased to speak in support of the Religious Discrimination Bill. I bring a particular perspective to this debate as a Jewish Australian who has served on the boards of religious and lay bodies in my own community, and as a former employee of the largest mission of the Catholic Church in Australia who has served both educational and health missions of the church. I hope I can speak to the great strength that faith based institutions and religion more generally offer our country. Working in a faith environment is deeply satisfying. You see a demonstration of faith in action through the mission and identity of the institution and the way it manifests itself in the interactions people have with one another.As a person of faith, I believe that the maintenance of religion and religious institutions is vital to the moral ecology of our nation. I believe religion has a particular role to play in the world in bringing meaning into peoples lives. It calls people to serve others, providing a sense of identity and a purpose to life that is larger and more enduring than fulfilling the needs of the material self. Faith brings people together from a range of different backgrounds and builds a sense of community. The search for meaning in peoples lives has never been stronger than it is today. The 2018 Study of the Economic Impact of Religion on Society attempted to measure some of the economic contributions that faith groups make to our country. Religious people who attend services contribute an extra 30½ million hours of volunteering time in Australia each year. Being religious makes people more likely to donate money, not just to religious causes but to social good projects as a whole.Christians have pioneered many of our great social institutions in aged care and in health and social services. The Royal Flying Doctor Service, Lifeline, Barnardos and Mission Australia all began as the work of Christian men and women who were motivated by the gospel to love God and their neighbour as themselves. If we return to the early days of the RSPCA in Britain, it was evangelical Christians who established that organisation as well. In the early 1980s here in Australia, when the AIDS virus first appeared, there was great panic about people whod contracted AIDS and many hospitals were turning away HIV and AIDS patients. But the Sisters of Charity at St Vincents Hospital in Darlinghurst, called by the Christian command to treat the poor and the sick, made the decision to admit, treat and care for patients with AIDS when others refused. At a time when little was known about the virus, this was an act of grace and courage. Over half of all the people with AIDS in Australia were treated at St Vincents.Our entire concept of human rights comes from what Jonathan Sacks has described as that radical idea at the heart of the Judeo-Christian tradition: that all people are made in the image and likeness of God. Whether were tall or short, young or old, or able to speak and walk or severely limited in our ability, our lives matter and are of equal worth. This is an idea defended by the people of faith among us. When a society loses its sense of human dignity, that society loses its soul. Im certainly not suggesting that only people of faith care about others—thats manifestly not the case—but I am suggesting that we should be careful about pulling too far away from our roots.The church continues to play an extremely important role in our culture, a role that many people respect and cherish. Many people who are not churchgoers send their children to Christian schools. We have a Prime Minister whos open about his faith. Church institutions continue to play an essential role in the delivery of many services such as aged care and family support. Sixty per cent of Australians ascribe to some form of faith. There are over 150 different faith communities in this country. From European settlement until 1981 Judaism was the major non-Christian denomination, but since that time the number of Muslims, Buddhists, Hindus and Sikhs has overtaken the number of Jews in this country. One of the exciting things about Australias future will be the growth of its religious diversity. While there has rightly been a lot of talk about the way in which this bill will affect Christians, I suspect it will be the minority faiths that will most take advantage of its protections.Some people have asked why this bill is necessary. The governments response has been in part because it completes a patchwork of discrimination law in this country, but this is only a partial answer. Unfortunately, we have to be clear eyed about the difficulties and discriminations that people of faith face in Australia today too. Anti-Semitism is on the rise. As reported at the annual conference of the Executive Council of Australian Jewry last year, during the 12-month period to 30 September 2021 there was an increase of 35 per cent in the overall number of reported anti-Semitic incidents to Jewish community organisations compared to the previous year. Behind the statistics lie some horrific personal stories of persistent anti-Semitic bullying of Jewish students at schools, the brutal physical assault of a man on his way to synagogue, the spray-painting of Free Palestine, F Zionists, Free Palestine on the signage at the front of a synagogue in Adelaide, the flying of a Nazi flag above a synagogue in Brisbane and the draping of two Palestinian flags and two shredded Israeli flags at the front entrance of a synagogue in Sydney. What is perhaps worse is the disgraceful discourse online, occasionally in the mainstream media as well, of those who for whatever reason seek to rationalise or minimise this egregious behaviour.In 2017, when I served on the PJCHRs inquiry on free speech in Australia, I remember Muslim community leaders asking for the extension of the Racial Discrimination Act to cover their community. Their leaders produced a number of examples of discrimination against Muslims at that time. Today the Islamophobia Register contains several examples of discrimination against Muslims in Australia, and these will help illustrate the point. A Muslim female applicant went to a job interview without her hijab, knowing she had a lower chance of employment if she wore one. Having secured the job, she started wearing her hijab. The employer was not happy, saying he wouldnt have hired her if hed known she wore a hijab. In another case, a patient seeing a Muslim doctor complained about how, A Muslim got on the premises, and that, We dont want their sort here. She refused to see the Muslim doctor. A doctor wearing a headscarf seeing a patient was told in a dehumanising manner: Thats not touching me. Thats not my doctor. Get me another doctor.Its not just Muslims and Jews. Buddhists in my electorate have told me about public libraries that refuse to stock their holy books. In October 2018 a Hindu temple in Regents Park was set on fire during one of its most sacred times of the year. Prayer carpets were burned and statues of Hindu gods were destroyed. It was really disgraceful behaviour.Even today Sikh doctors and health workers are discriminated against in six Australian jurisdictions, being forced to choose between shaving their beards, contrary to their religion, so they can fit a surgical mask or practising medicine. In New South Wales and Western Australia the Clinical Excellence Commission has approved the wearing of surgical masks on top of an elastic band, obviating their need to say shave, but elsewhere Sikh doctors are being stood down at a time when we need them most.While there are fewer physical threats against Christians, there is a cultural and existential threat to Christianity as people have tried to delegitimise the place of Christianity in the public square and force it off the national stage. The public position of Christians has been weakened through not just a decline in religious observance but also a decline in the level of religious literacy and empathy for religion among the general population.Debate interrupted.","Religious Discrimination Bill 2021, Religious Discrimination (Consequential Amendments) Bill 2021, Human Rights Legislation Amendment Bill 2021","BILLS","/hansard/chamber.xscript/debate[22]/subdebate.1/subdebate.2/speech[9]/talk.text/body/p[1]","Mr LEESER (Berowra) ","(19:22):"
"0","0","0","1","1","Wells, Anika MP","264121","Lilley","ALP","N/A","76"," Mr Speaker, as of today, over 90 per cent of the eligible Queensland population are fully vaccinated, a fact Im sure you will celebrate as much as I do. Unfortunately I cannot be in my electorate of Lilley today to celebrate this joyous day that we have waited so long for, but I would like to take this opportunity that we have here tonight to thank our healthcare workers, nurses, general practitioners and everybody who has helped in the vaccine rollout in places like the Doomben Racecourse and the Boondall entertainment centre over the past 11 months to achieve this record. I would also like to acknowledge and thank the vast majority of northsiders who have collectively agreed to roll up their sleeves and get the jab, to protect our community. This major milestone signposts the next stage of our social and economic recovery beyond COVID.In January I sent a survey to every household in Lilley asking for feedback on which local infrastructure and community projects we need funded to create new jobs and boost our local economy. The responses I have received to this, in addition to feedback I have received from conducting mobile offices across every suburb and at community events across my electorate, have been used to inform our 2022-23 Lilley budget submission. This is a budget submission by the people of Lilley, for the people of Lilley. It includes a list of our local funding priorities relating to sporting infrastructure, roads and transport, the Urban Congestion Fund, health, education and community initiatives. I seek leave to table the 2022-23 Lilley budget submission for the consideration of the Treasurer ahead of the release of the next federal budget, in March.Leave granted.","COVID-19: Vaccination, Lilley Electorate: Budget Submission","ADJOURNMENT","/hansard/chamber.xscript/debate[23]/subdebate.1[1]/speech/talk.text/body/p[1]","Ms WELLS (Lilley) ","(19:30):"
"0","0","0","1","1","MemberContinuation","264121","N/A","N/A","N/A","N/A","Ms WELLS: Lilley residents will remember this element of cooperation to try and get all of our local projects funded in the coming budget that we will see from the Treasurer in March. It was disappointing that literally none of the budget projects that we submitted last financial year were accepted by the Treasurer, but I have hopes that generosity will prevail in the coming weeks and that we will finally get some of these much-needed infrastructure projects.In the 2019-20 financial year Brisbane recorded the highest population growth rate of all Australian capital cities, at 1.9 per cent. In 2021, despite extended COVID lockdowns in Victoria and New South Wales, more than 30,000 new residents called Queensland home. You cant blame them. We are the best state in the country. This significant population influx has a ripple effect on employment, housing affordability and the cost of living and infrastructure needs. We need more support for small businesses who have been affected by COVID. One Nundah business owner recently wrote to me asking for help. She said: It is so sad to see shops closing all over town. We are struggling to make ends meet and we feel like we are doing it all alone.The Prince Charles Hospital desperately needs a fully funded MRI licence so northsiders have access to life-saving scans through a public system. We need a planning study to identify solutions to fix Gympie Road. Since 2015 Gympie Road has been identified by the RACQ and by the AAMI Crash Index as the most dangerous and one of the most congested roads in Queensland. The Brisbane Netball Association at Bradbury Park celebrated their 50th anniversary this year. The ageing clubhouse is a constant drain on the associations resources, and they desperately need a new facility. These are just a handful of the projects that my electorate of Lilley are asking the Morrison government to fund in their upcoming budget, in late March, when we come back to this place.There are so many more worthy projects that we could get onto, but lets start with these most urgent ones first. I urge the Treasurer and the Prime Minister to put their money where their mouths are, to take the submission that we are tabling here in the House tonight and to deliver the funding for these projects that our community needs. It will be such an exciting time for Brisbane in the next 10 years as we approach the 2032 Olympics and all of the opportunities that that presents us. Every single sporting club is coming to me and saying, If we have the capacity to house an international standard, with different countries coming to visit, that will provide us with legacy infrastructure that will allow us to support the communities that we love in the years to come. I look forward to us working across the aisle—I see the member for Fairfax there—with our state government, with the federal government and with local government to make sure that each of these worthy sporting clubs get those opportunities in the 10 years coming, alongside other worthy projects like road, infrastructure and supporting our health infrastructure like the great Prince Charles Hospital.Mr Speaker, I thank you for the time to speak tonight. I wasnt expecting to get to do it in the end, but Im very pleased that we have used this opportunity to table the Lilley budget submission for 2022-23.","COVID-19: Vaccination, Lilley Electorate: Budget Submission","ADJOURNMENT","/hansard/chamber.xscript/debate[23]/subdebate.1[1]/speech/talk.text/body/p[4]","N/A","N/A"
"0","0","0","1","1","MemberInterjecting","265967","N/A","N/A","N/A","N/A"," That makes two of us.","COVID-19: Vaccination, Lilley Electorate: Budget Submission","ADJOURNMENT","/hansard/chamber.xscript/debate[23]/subdebate.1[1]/speech/talk.text/body/p[9]","N/A","N/A"
"0","0","1","0","1","Wells, Anika MP","264121","Lilley","ALP","N/A","76","76 Wells, Anika MP 264121 Lilley ALP","COVID-19: Vaccination, Lilley Electorate: Budget Submission","ADJOURNMENT","/hansard/chamber.xscript/debate[23]/subdebate.1[1]/speech/continue/talk.start","N/A","N/A"
"0","0","1","0","1","Wallace, Andrew MP ","265967","Fisher","LNP","N/A","77","77 Wallace, Andrew MP (The SPEAKER) 265967 Fisher LNP","COVID-19: Vaccination, Lilley Electorate: Budget Submission","ADJOURNMENT","/hansard/chamber.xscript/debate[23]/subdebate.1[1]/speech/interjection/talk.start","N/A","N/A"
"0","0","0","1","1","Hamilton, Garth MP","291387","Groom","LNP","N/A","77"," I share the previous speakers surprise at my speaking at this time. The town of Oakey in my electorate of Groom is a very proud garrison town. If you drive down the main street in the morning, youll see plenty of men and women in uniform dropping off their kids at school or shopping in the street before heading into the base some five minutes outside of town.Just a few weeks ago I was speaking to the owner of Oakeys Great Country Pies, Vicki Reeves, about the impact of this defence trade on the town. When the base closes for the Christmas break, theres a noticeable drop in pie sales. Conversely, when theres a big project going on at the base, like the construction of the new medical centre, the demand for these delicious baked goods peaks. I refer to this as the Oakey pie index, or the OPI. Its a fantastic measure of regional fiscal health. With the shops main customer base in Acland, and the Acland mine having closed recently, trade—particularly from those members of the Defence Force—is so important. Thats why attracting new investment and opportunities to the Oakey Army Aviation Centre is so important to me.One of my key focuses as the member for Groom is that I want to see defence spending at Oakey double over the next decade, and I think were very well set for that. Were located as a significant part of defence across Australia, with ample space to expand, perfect flying weather and a strong track record of being able to host our allies long term. Weve seen a very successful partnership with the Republic of Singapore, which has chosen to have five Chinooks based at Oakey, and that number is soon to increase to 10. We frequently see these helicopters flying with our own in joint training exercises, and they recently flew in an emergency response capacity during the 2020 bushfires. Once again, I take the time to thank the Republic of Singapore for their support. This partnership also boosts our local supply chain, with maintenance of these helicopters occurring on site. I strongly support the continuation of this program and would, in fact, like to see the opportunity for more allies to take up a similar residency. Certainly, there are extensive grounds for expansion out at the Oakey base. Its wonderful to have seen the Singaporean base built by local contractors.I was extremely heartened to see the ministers personal interest in the base and its future during his visit last Wednesday. He came to officially open the new $18 million health centre I mentioned earlier. This new health facility brings together primary healthcare services, dental services, mental health care, physiotherapy, rehabilitation and pharmacy services on base to keep our people fit for life and fit for the fight, in the words of the minister at the time. Its such an important investment to make in our people, and one of the things we can do as a government is to make sure we always provide the best services to our fighting men and women. Its a significant boost and one that shows this governments great faith in the people and the role that the army aviation centre plays.The next big investment we need to see at Oakey is securing a new fleet of helicopters. The fast-tracked retirement of the MRH-90 Taipan and Tiger helicopters presents an opportunity for us in this regard. While these models are being phased out between 2025 and 2028, Australia will be taking delivery of new model Black Hawks, Foxtrot and Apache helicopters. Where better to base them than along General MacArthurs old Brisbane Line? In fact, if you look at the old Brisbane Line, youll see it curves up to include Toowoomba, where the Bowenville bomber was, at the Oakey base. If it was good enough for MacArthur, its good enough for me. The Brisbane Line was an acknowledgement of the advantages of having strong defences in South-East Queensland to protect against aggression from the north. A new fleet would also bring with it new maintenance and training opportunities, further expanding the significance and the role of the Oakey Army Aviation Centre. As the Groom MP, its my priority to ensure that in this period of change we do not take a backwards step. I want to make sure we capitalise on the situation and we grow at the Oakey Army Aviation Centre.I know that my ambitions for the base are also supported by the work that the leadership at the centre has put in, and Id like to highlight the contributions made by the former commandant of the base, Colonel Charlie Barton, who retired at the end of last year. I know that his replacement, Colonel David Lynch, brings a very steady pair of hands to continue guiding the bases growth, and I appreciate very much his confidence and support in helping to further build those links with the Oakey community.Perhaps reflective of my surprise coming here, Ill end quickly by saying I think theres a wonderful place for Oakey to play in Australias defence future. (Time expired)","Groom Electorate: Oakey Army Aviation Centre","ADJOURNMENT","/hansard/chamber.xscript/debate[23]/subdebate.1[2]/speech/talk.text/body/p[1]","Mr HAMILTON (Groom) ","(19:35):"
"0","0","0","1","1","Steggall, Zali MP","175696","Warringah","IND","N/A","78"," Just over two years ago, on 25 January 2020, the first case of COVID-19 was detected in Australia. While our initial response was strong and we took advantage of our isolation on an island, according to Jane Halton and others, weve fallen short in the second half of the game and weve seen policy responses swing through a cycle of panic and neglect. In consulting broadly across the health sector, almost everyone Ive spoken to agrees that Australia would benefit from a royal commission into the health response to the pandemic and preparedness for future challenges. Various epidemiologists have highlighted that Australia did not learn enough from SARS and MERS, which were warning signs of what could happen with COVID-19. We routinely conduct military exercises and constantly prepare for the unlikely event of a physical invasion or terrorism incident, yet the chance of a global pandemic invading our shores has not been the subject of a preparedness exercise since 2008.Thankfully, our geography gave us an advantage, and we were able to stave off and slow the arrival of COVID, giving us time to prepare, wait for the vaccine to be developed and dust off the plans. But the latest wave of omicron has shown that, despite a two-year head start, we still have not got the plan right. People are dying, we lack testing capacity, hospitals are stretched, and the aged-care system is failing to the point where were talking of the military needing to be deployed to meet the shortfall in staff. Its for this reason that I am calling for a royal commission to be established immediately, with an interim report to be delivered as soon as possible, to ensure we identify the gaps in the current system, prioritise areas for improvement across the whole system to better prepare for the next variants and future pandemics, and prepare for the challenges of an ageing population and the associated increase in chronic disease. Such a commission should cover mental health services, which continue to struggle under the load of the pandemic and see surging call numbers.In January, Lifeline hit its highest number of daily calls since the beginning of the pandemic at 3,600 calls across the network, double what was considered a big day before COVID. Similarly, our hospital system has been stretched beyond capacity. Its not sustainable to continue at the pace we are. The pandemic has delayed the diagnosis and treatment of many other conditions and diseases, including cancer, and thats dangerous and negligent. It has also prolonged the pain and suffering of many who are waiting for elective surgery. General practices have been the backbone of our response to the pandemic, especially the vaccination program, yet they need a refresh to include a more holistic approach, including mental health as a key component of general practices, with professionals more closely integrated into the system. Rather than a volume based model, we actually need an outcome based model.Finally, the aged-care sector is in crisis. Theres no point in denying it. We knew this already, and we have the recommendations of the royal commission. Its there to implement. It needs to be implemented with even greater urgency.We need a royal commission into the health sector as a whole that integrates federal and state responsibilities, primary care, delivery of services, acute care, intensive care, aged care, mental health and our pandemic response, in particular. We need to properly assess the management of our medical stockpile, supply chains and medical research investment to ensure preparedness. We must learn from the last two years. This is not about political pointscoring. This is not about looking at the overall response. I know the opposition are talking of JobKeeper and other things. This is actually talking about how we are going to make sure we save lives in the future and make sure we learn from the mistakes that have happened and understand properly what has worked and what hasnt worked.We have been a divided nation, with different states going their different ways. This is not the best practice model. The pandemic is not over. We need to improve our ability to respond to the next wave and the one after that. We need to analyse what has worked and what hasnt. We need to increase transparency around health and medical advice and adopt a more consistent national approach. We need Australians to be able to have trust and faith in the medical advice of the chief health officers and to understand the distinction between the medical advice and the political decisions that governments need to make. We owe it to all Australians, and especially to our health workers, to make sure we have a sustainable health model.","Health Care","ADJOURNMENT","/hansard/chamber.xscript/debate[23]/subdebate.1[3]/speech/talk.text/body/p[1]","Ms STEGGALL (Warringah) ","(19:40):"
