index,question_flag,answer_flag,interjection_flag,speech_flag,chamber_flag,name,name.id,electorate,party,role,page.no,content,subdebateinfo,debateinfo,path,Speaker,Time
500,0,0,0,1,1,"Georganas, Steve MP","DZY","Adelaide","ALP","N/A",2533," Ensuring Australians have access to affordable medicines is absolutely essential. Id like to start off by thanking the minister for health, Mark Butler, for ensuring mechanisms such as the PBS are maintained and improved, and we have seen a lot of improvement in the last 10 months. The PBS is an essential element to Australia, providing a system for the government to subsidise the cost of medications for the treatment of Australian patients. It is a Pharmaceutical Benefits Scheme that truly does benefit all Australians. Just in my electorate of Adelaide over $300,000 was saved on PBS medications by constituents in January and February this year alone by the new prices that came out. The PBS was put in place to not only enhance the quality of life but also provide access to important life-saving medication. Unfortunately, not all medication is listed on the PBS. The decision for example, by Novo Nordisk to withdraw Fiasp from the Pharmaceutical Benefits Scheme is deeply distressing for Australians living with type 1 diabetes and their families, and this is a prime example of how lack of access to medication can be so detrimental. Many people come to see me seeking assistance and help, as Im sure all members of this place see people wanting assistance and help. These people need life-saving medication and cannot get access, due to significant cost.Ive recently been assisting a constituent of mine who came to our office with no viable option to have access to necessary treatment. Shes been fighting breast cancer for seven years. The medication Tukysa was recommended by an oncologist to my constituent as her last option. The medication is registered by the TGA. This medication has been proven and recognised to help, so we wrote to the ministers for health, both the state minister and the federal minister, and were grateful for the advice they gave us and that we received. Through that advice we wrote to the pharmaceutical company to request the medication be provided to this constituent on compassionate grounds, and I must say they did provide it on compassionate grounds. We assisted the constituent with her personal letters to the company, as well as support letters from my office. After a lot of correspondence to and from and a lot of concern, this constituent has been offered six months access to the medication, with a potential cost-sharing scheme at the end—an offer that is still not ideal, due to the unknown financial liability. She has informed my office shell be taking the offer up, and rightly so. Weve made sure she knows well continue for fight for her. Well continue to do whatever we can, and we are continuing to liaise with the ministers for health both state and federal.Another constituent had mantle cell lymphoma. He needed CAR T-cell therapy, which was available only in Melbourne, not in South Australia. My constituent was not medically able to travel, and his window of opportunity was very limited. Like many, the medication was registered by the TGA and received highly positive recommendations by the Medical Services Advisory Committee. He was an eligible candidate for the treatment, yet he was not able to access it. This was the last hope to fight for survival, and we spent weeks corresponding trying to get answers and results. Whilst we were eventually successful in assisting this constituent with access to the treatment, by the time this happened he sadly passed away. This was another long fight for a life-saving medication.These patients simply do not have time to waste. As we know, there is unfortunately much uncertainty in the life of a patient with cancer—or any life-threatening disease, for that matter. We know these patients already fight hard enough as it is. Having to also fight to access a life-saving medication is a huge additional and unknown burden to bear for these people. There needs to be a mechanism to ensure these people are protected and looked after. It is so sad for these patients when perhaps there are medicines that can help—and, in this case, in both circumstances there were medicines and are medicines that can help—or, for example, when a medication has been directly recommended to them but the patient cannot have access to the medication, as it is not seen to be cost effective. Were putting cost effectiveness in front of peoples lives. These medications, all of the ones Ive dealt with, are backed by scientific trials and registered by the TGA. (Time expired)","Pharmaceutical Benefits Scheme","ADJOURNMENT","/hansard/chamber.xscript/debate[12]/subdebate.1[2]/speech/talk.text/body/p[1]","Mr GEORGANAS (Adelaide) ","(19:34):"
501,0,0,0,1,1,"Young, Terry MP",201906,"Longman","LNP","N/A",2534," I rise to speak tonight on the Pharmaceutical Benefits Scheme, the PBS. This scheme began in 1948 in a limited form, mainly for pensioners, with a list of 139 life-saving and disease medicines, which were provided at no charge. I am proud to be a member of the coalition, which, when last in government, listed almost 3,000 new or amended medicines on the PBS. This represents an average of around 30 listings per month, or one per day, which amounted to an investment of just shy of $15 billion. That sounds like a lot of money and is a lot of money. But, when I speak to taxpaying Australians, I know the vast majority are happy to see a portion of their tax dollars go to subsidising medicines to ensure that they are affordable for those in our communities who depend on these life-saving medicines and so that those people can continue to enjoy a more comfortable life, and sometimes just stay alive. After all, what can be more Australian than helping out a mate?I was pleased to see that, prior to the election, Labor matched the coalitions promise of committing to even cheaper medicines on the PBS. But, sadly, like so many Labor promises, that promise has been broken. The promise of cheaper medicines has been broken. Of course, there was the appearance of cheaper medicines with the announcement of the reduction from $42.50 to $30. What they didnt announce was that, at the same time, the decision was made to remove some medicines from the PBS, including a life-saving diabetes drug, Fiasp, which 15,000 Australians rely on. This life-saving medicine will now cost those who depend on it over $200 per script as opposed to $42.50 per script when it was listed on the PBS under the previous coalition government. It is concerning that this is happening so early in the term, as last time those opposite were in government it was towards the end of their last term that they ran out of ideas and ways of saving money, and thats when they stopped listing items on the PBS. For them to be doing it so early in the term shows how out of their depth they are economically. They have also made the decision to not list the drug Trikafta, which is used to treat children between six and 11 years old with cystic fibrosis. This is despite the Pharmaceutical Benefits Advisory Committee recommending that Trikafta be placed on the PBS. This drug can cost families up to $250,000 per year. Well just add this to the ever-growing list of broken promises made by this government and this Prime Minister.Weve seen them break the promise of cheap electricity, namely that there would be a reduction of $275 in household power bills. Theres the broken promise that mortgages would be lower under Labor. There is the no changes to super promise—broken. We have the were not touching franking credits promise—broken. There will be no industry-wide bargaining promise—broken. Well get real wages moving promise—broken. We wont raise taxes promise—broken. Well cut the costs of contractors and consultants promise—broken.Mr Albanese also promised that every nursing home would have a 24-hour nurse by July this year, which we said wouldnt happen, as there simply was not the workforce there to meet that kind of obligation. Well, guess what? Mr Albanese has now conceded that they will break that promise as well. Why? Because there isnt a workforce to meet this commitment. Whod have thought?The greatest summary of all these promises made and broken is by the then Leader of the Opposition and now Prime Minister Albanese himself: Australians will be better off under a Labor government—broken, broken, broken. More shallow promises that sound good just to win a vote, regardless of the facts. This is typical of a party that continually misleads Australians, because they do everything on emotion. They hear of a problem and give some instant fix with no planning and no costing. But what would you expect from a prime minister and a party who, in the main, are career politicians, political and union staffers? What can you expect from a prime minister who has been in this place for over 25 years and who before that had jobs in political offices since he graduated from university? Most Australians expect their Prime Minister to have some experience in the real world so they can relate to the issues that they face.Theres nothing more valuable than keeping your word, but on this front this government and this Prime Minister are simply dismal failures. They continuously blame outside factors and the previous government instead of just getting on with the job of governing, finding solutions of the day and leading. So the question really is: why do Australians always pay more under Labor?","Pharmaceutical Benefits Scheme","ADJOURNMENT","/hansard/chamber.xscript/debate[12]/subdebate.1[3]/speech/talk.text/body/p[1]","Mr YOUNG (Longman) ","(19:40):"
502,0,0,0,1,1,"Lawrence, Tania MP",299150,"Hasluck","ALP","N/A",2534," This week we have seen yet another example of what can be achieved by a responsible, disciplined and mature government, a government willing to engage constructively with a broad crossbench and, yes, with those opposite to ensure legislation is passed in the best interests of our nation. It cannot be overstated just how important it is that we will be able to pass the safeguard mechanism through both places this week, move on to the implementation of the policy and start seeing the beneficial effects on the economy and the environment sooner rather than later.The coalition have once again failed to support good and useful legislation, something that they are now becoming known for. The clock is ticking. Perhaps its not too late for a change of heart in the other place. Coalition failures in regard to the safeguard mechanism, however, are not a recent phenomenon, and continuing to lament their inability to do what is right for the nations people, the environment and the economy is becoming a chore.As someone who has spent most of their life living in regional towns and in the bush, as I do now in my wonderful electorate of Hasluck, I am acutely aware of the risk of bushfires. My husband and I had our own home completely destroyed by the 2007 Toodyay bushfires. I am entirely cognisant of the rapid increase in that risk over the years due in part to a drying climate brought about by anthropogenic climate change. I ran on a platform of tangible action for the environment. The safeguard mechanism is just that. I ran on integrity and restoring trust in government, and the cooperative way in which this government engaged the crossbench goes some way to demonstrating that politicians motivated by the right reasons have the ability to get on with the job of responsible governing. I ran on the promise to build a better future, with a sustainable economy and secure, meaningful jobs.The safeguard mechanism bill neatly captures some of the many issues that informed the mood for change at the last election. Most importantly, the safeguard mechanism is good for our planet. It is the missing piece of the puzzle to successfully reach 43 per cent emissions reduction by 2030 and net zero by 2050. The reduction in carbon emissions as a result of the safeguard mechanism will be the equivalent of taking two-thirds of the nations cars off the road by 2030. Its immense and it cant come soon enough.But, just as the sun will rise in the morning, the naysayers will be crowing about the economy-wrecking impacts of this policy when they couldnt be further from the truth. This will help businesses remain competitive in a decarbonising global economy. Australian heavy industry and our largest exporters know that global markets are moving to a low-carbon future, with more than 80 per cent of Australias trade now covered by other countries net zero commitments.From the moment my candidacy for the seat of Hasluck was announced, I have been lobbied, consulted, pushed, prodded, quizzed, questioned and grilled on what action Labor will be taking in relation to carbon emissions and environmental conservation. The Perth Hills Climate Change Interest Group are a vivacious bunch, with a persistence only outmatched by their passion for the environment. The Citizens Climate Lobby are another group I have met with on multiple occasions to hear their thoughtful, considered and impassioned pleas for action. Ive met with the Climate Action Network Australia, Save Perth Hills, Solutions for Climate Australia—the list goes on. I feel confident that no-one will be accusing me of not listening and not taking their passion—my passion—to conserve and preserve what remains of our fragile environment to my caucus colleagues here in Canberra.Individuals like Philip from Glen Forrest want to see much more action to combat climate change. Nathan from Ellenbrook and Annie from Woodbridge both recently wrote to me excited about the prospect of more affordable EVs. Shane from Gidgegannup is an engineer in oil and gas who really wants to see companies be compelled to apply science today to reduce emissions. Just this morning I received an email of congratulations from the Climate Council to the government and the caucus on the safeguard mechanism deal. The Climate Council described the deal as a good compromise.Anyone in Australia with any skin in the game at all made a submission on the consultation for the mechanism and, in a near unanimous chorus, were accepting that, whatever its final form, this mechanism required teeth. Politics is the art of the possible, and I thank Minister Bowen for his efforts on behalf of my constituents, on behalf of the government, on behalf of the Climate Caucus and on behalf of the country. (Time expired)","Climate Change: Safeguard Mechanism","ADJOURNMENT","/hansard/chamber.xscript/debate[12]/subdebate.1[4]/speech/talk.text/body/p[1]","Ms LAWRENCE (Hasluck) ","(19:45):"
503,0,0,0,1,1,"Wilson, Rick MP",198084,"OConnor","LP","N/A",2535," I rise tonight to talk about the impact that the impending phase-out of the live export trade will have on our trade relationship with our long-term friends in the Middle East. I spoke earlier in the week about the impact on our farming communities and sheep producers across my home state of Western Australia, but tonight I want to expand that conversation out to our trading relationships.Kuwait is our largest importer of live sheep. We have a 60-year history of trading with Kuwait. In the decade from 2012 to 2022, Kuwait imported 5.6 million sheep, worth in excess of $652 million. They were mostly out of my electorate of OConnor in Western Australia, but certainly there have been sheep come out of the member for Duracks electorate as well.How do we treat these very good friends and long-term trading partners? Well, I have here a letter from the Minister of Commerce and Industry of Kuwait addressed to the Hon. Murray Watt, Minister for Agriculture, Fisheries and Forestry in the Albanese government. One paragraph says: Last year, representatives from your government visited Kuwait to confirm Australias intention to phase out live sheep exports by sea into the Middle East by 2025. This greatly concerned us, given the significance of live sheep imports from Australia to Kuwait. It came to our attention that the Australian delegation—and that would be the Secretary of the Department of Agriculture, Fisheries and Forestry, Mr Metcalfe—met with a representative from the Kuwait Public Authority for Food and Nutrition and the Kuwait public authority of agricultural affairs. However, the Minister of Commerce and Industry is the main authority for all matters of trade, especially live food exports, and all policies relating to food security for Kuwait.So here we have a senior public servant, representing Australia, blundering around the Middle East telling customers of 60 years standing that they are no longer welcome to do business with us. I think the Kuwaitis, certainly from the tone of the letter to the minister, are quite offended by that. I dont blame them.Why is that important? Why is Kuwait important to Australia, and in particular Western Australia? Mr Speaker, when the Chinese government in 2021 banned imports of barley into China—five million tonnes of barley out of Western Australia—it was the Middle East trading partners who stepped up. Kuwait took $199 million worth of barley. Thats just shy of a million tonnes of barley. They took $168 million worth of wheat. Thats about 500,000 tonnes of wheat. Of course, they took their usual quota of $49 million to $50 million worth of live sheep.The other important aspect of our relationship with Kuwait is that they invest $12.7 billion here in Australia. Under this government, weve seen the Japanese government become very concerned about sovereign risk. Were now seeing countries in the Middle East whove invested heavily in Australia start to become very concerned with the sovereign risk of investing here in Australia, where their investments, made in good faith, effectively can be cancelled out overnight by pressure from various activist groups.The other key partner in the Middle East that I want to talk about this evening is the United Arab Emirates. In government, we were progressing the comprehensive partnership agreement with the UAE. They are a very significant trading partner of ours, with over $10 billion of trade pre-COVID. Once again, they are very large investors in Australia, at $14 billion. It is with great pleasure on Thursday—if given leave by our whip—I will be meeting with His Excellency Abdulla Alsaboosi in Perth and escorting him, amongst others, on a tour of a live feedlot down in Baldivas and I will certainly reassuring be him and his country that a coalition government will support live export going forward.","Live Animal Exports","ADJOURNMENT","/hansard/chamber.xscript/debate[12]/subdebate.1[5]/speech/talk.text/body/p[1]","Mr RICK WILSON (OConnor) ","(19:50):"
504,0,0,0,1,1,"Laxale, Jerome MP",299174,"Bennelong","ALP","N/A",2536," Much like the member for Hasluck, I too wish to congratulate the Minister for Climate Change and Energy for the successful passage of the Safeguard Mechanism (Crediting) Amendment Bill 2022 through this House. This is such an important step towards reaching net zero by 2050 and also the legislated 43 per cent emissions reduction by 2030, ensuring our economy is ready to take advantage of the opportunities that the legislation will present and also to mitigate the impacts of climate change and greenhouse gas emissions on our environment.The safeguard mechanism will ensure the nations highest emitters will deliver a higher proportional share of the national 2030 target, encouraging and forcing these facilities to reduce their emissions and invest in clean energy technologies. It will deliver 205 million tonnes of emissions reductions by 2030. That is equal to taking two-thirds of Australias cars off the road ,and it will aggregate emissions reductions from 153 million tonnes this year down to just 100 million tonnes in 2030. The changes this bill will bring are essential if we are to meet our commitments under the Paris agreement and do our part as a global citizen to mitigate the impacts of climate change, because we cannot afford to idly sit by and ignore the growing threat of climate change here in Australia and across the world.After a decade of inaction and denial by those opposite, this bill represents a responsible and desperately needed response to the genuine threat of climate change, and it is what those in my electorate of Bennelong voted for. The Liberals and Nationals have repeatedly shown themselves to be completely out of touch on climate action and the environment. They are out of touch with all the businesses who are also taking action on climate change and they are out of touch with everyday Australians, who, in May last year, voted for strong climate action. And stunningly, those opposite continue to deny, delay and create chaos for the government here, which wishes to take climate action.Those opposite consistently oppose meaningful action on climate change, choosing instead to prioritise the interests of our biggest polluters and fringe climate deniers over the health and wellbeing of our planet, and we see again and again the Liberals and Nationals refusing to support climate action here in this House, voting against not only our 43 per cent legislated target brought to this place last year but also the safeguard mechanism a few days ago. But this government will not let their short-sightedness and lack of vision hold us back. We must continue to take bold action on climate change and this bill is an essential step in that direction.In contrast to those opposite, I commend the efforts of the crossbench to work collaboratively to secure the passage of this critical legislation through this place. It is testament to the strength of our democracy that we can work together in this place to achieve meaningful outcomes for Australia. The opposition could learn a lot from the crossbench, instead of consistently dealing themselves out of legislation and making themselves irrelevant. This government recognises the importance of working with everyone in parliament and engaging in constructive and respectful dialogue while considering the concerns and priorities of all parties involved. This approach allows the government to make improvements and adjustments to our proposed legislation. It is important. It is how this place is meant to work and it is how parliament will work as long as Labor continues to form government.I urge those in the Senate to work collaboratively to get this bill through the parliament. Failure to pass this critical legislation this week will not only cause us to miss our 2030 emissions target but could set back the target even further. The reforms are a vital component of the Powering Australia Plan announced 15 months ago, which was endorsed by the Australian people at the election. It is crucial that we act on the commitments we have made and implement these reforms so they can start from 1 July 2023. The parliament cannot afford to make the same mistakes of the past and lose another decade of reasonable and considered climate action. We must seize this opportunity and take decisive action on climate change. It is what Bennelong voted for, it is what Australia voted for and the time is now.House adjourned at 20:00","Safeguard Mechanism (Crediting) Amendment Bill 2022","ADJOURNMENT","/hansard/chamber.xscript/debate[12]/subdebate.1[6]/speech/talk.text/body/p[1]","Mr LAXALE (Bennelong) ","(19:55):"
505,0,0,0,0,2,"N/A","N/A","N/A","N/A","N/A","N/A","Tuesday, 28 March 2023","N/A","N/A","/hansard/fedchamb.xscript/business.start/body/p[1]","N/A","N/A"
506,0,0,0,0,2,"N/A","N/A","N/A","N/A","N/A","N/A","The DEPUTY SPEAKER ( Mr Young ) took the chair at 16:00.","N/A","N/A","/hansard/fedchamb.xscript/business.start/body/p[2]","N/A","N/A"
