index,question_flag,answer_flag,interjection_flag,speech_flag,chamber_flag,name,name.id,electorate,party,role,page.no,content,subdebateinfo,debateinfo,path,Speaker,Time
171,0,1,0,0,1,"MemberInterjecting",265585,"N/A","N/A","N/A","N/A","Mr Littleproud: Mr Speaker, a point of order on relevance: the question is very specific and was asking for a time line for when they will receive those guidelines. The minister failed last week, and were giving her another chance. It now gets to a point in time.","Infrastructure","QUESTIONS WITHOUT NOTICE","/hansard/chamber.xscript/debate[7]/subdebate.1[5]/answer/talk.text/body/p[4]","N/A","N/A"
172,0,1,0,0,1,"MemberInterjecting",53517,"N/A","N/A","N/A","N/A"," It doesnt quite work that way. Resume your seat. Ill hear from the Leader of the House.","Infrastructure","QUESTIONS WITHOUT NOTICE","/hansard/chamber.xscript/debate[7]/subdebate.1[5]/answer/talk.text/body/p[5]","N/A","N/A"
173,0,1,0,0,1,"MemberInterjecting","DYW","N/A","N/A","N/A","N/A","Mr Burke: I was rising to object to the add-ons at the end. The question itself refers to local government grants that the minister is talking about.","Infrastructure","QUESTIONS WITHOUT NOTICE","/hansard/chamber.xscript/debate[7]/subdebate.1[5]/answer/talk.text/body/p[6]","N/A","N/A"
174,0,1,0,0,1,"MemberInterjecting",53517,"N/A","N/A","N/A","N/A"," The minister is being relevant because she is referring—","Infrastructure","QUESTIONS WITHOUT NOTICE","/hansard/chamber.xscript/debate[7]/subdebate.1[5]/answer/talk.text/body/p[7]","N/A","N/A"
175,0,1,0,0,1,"An honourable member ","N/A","N/A","N/A","N/A","N/A","An honourable member interjecting—","Infrastructure","QUESTIONS WITHOUT NOTICE","/hansard/chamber.xscript/debate[7]/subdebate.1[5]/answer/talk.text/body/p[8]","N/A","N/A"
176,0,1,0,0,1,"MemberInterjecting",53517,"N/A","N/A","N/A","N/A","The SPEAK ER: Yes, Im aware that that was part of the question, but what you asked was a broad question. And she is referring to the programs. You might not like the answer, but she is being directly relevant because you asked a question about that program, and she is referring to it. If shes not, Ill bring her back into line. I give her the call.","Infrastructure","QUESTIONS WITHOUT NOTICE","/hansard/chamber.xscript/debate[7]/subdebate.1[5]/answer/talk.text/body/p[9]","N/A","N/A"
177,0,1,0,0,1,"MemberContinuation",281988,"N/A","N/A","N/A","N/A","Ms McBAIN: Coming back to the answer, if you would care to listen, Im telling you that we are consulting with local governments. You failed to do it. We are doing it. We are talking directly to them, and we will continue to do that because local governments are a trusted delivery partner. We brought them back to the table of National Cabinet. Were listening to them. We are implementing the Australian Council of Local Government after you got rid of it, after a decade where you failed to understand they are the critical delivery partner across the nation—546 of them. And perhaps if you took any care at all in your communities and backed their local ideas and understood how they deliver for us you would be interested in engaging with them too.","Infrastructure","QUESTIONS WITHOUT NOTICE","/hansard/chamber.xscript/debate[7]/subdebate.1[5]/answer/talk.text/body/p[10]","N/A","N/A"
178,0,0,1,0,1,"Littleproud, David MP",265585,"Maranoa","LNP","N/A",2484,"2484 Littleproud, David MP 265585 Maranoa LNP","Infrastructure","QUESTIONS WITHOUT NOTICE","/hansard/chamber.xscript/debate[7]/subdebate.1[5]/answer/interjection[1]/talk.start","N/A","N/A"
179,0,0,1,0,1,"Dick, Milton MP ",53517,"Oxley","ALP","N/A",2484,"2484 Dick, Milton MP (The SPEAKER) 53517 Oxley ALP","Infrastructure","QUESTIONS WITHOUT NOTICE","/hansard/chamber.xscript/debate[7]/subdebate.1[5]/answer/interjection[2]/talk.start","N/A","N/A"
180,0,0,1,0,1,"Burke, Tony MP","DYW","Watson","ALP","N/A",2484,"2484 Burke, Tony MP DYW Watson ALP","Infrastructure","QUESTIONS WITHOUT NOTICE","/hansard/chamber.xscript/debate[7]/subdebate.1[5]/answer/interjection[3]/talk.start","N/A","N/A"
181,0,0,1,0,1,"Dick, Milton MP ",53517,"Oxley","ALP","N/A",2484,"2484 Dick, Milton MP (The SPEAKER) 53517 Oxley ALP","Infrastructure","QUESTIONS WITHOUT NOTICE","/hansard/chamber.xscript/debate[7]/subdebate.1[5]/answer/interjection[4]/talk.start","N/A","N/A"
182,0,0,1,0,1,"Dick, Milton MP ",53517,"Oxley","ALP","N/A",2484,"2484 Dick, Milton MP (The SPEAKER) 53517 Oxley ALP","Infrastructure","QUESTIONS WITHOUT NOTICE","/hansard/chamber.xscript/debate[7]/subdebate.1[5]/answer/interjection[5]/talk.start","N/A","N/A"
183,1,0,0,0,1,"Perrett, Graham Douglas MP","HVP","Moreton","ALP","N/A",2485," My question is to the Minister for Infrastructure, Transport, Regional Development and Local Government. How is the Albanese Labor government working to deliver a successful Brisbane 2032 Paralympic and Olympic Games? What legacy was left by the previous government?","Brisbane Olympic and Paralympic Games","QUESTIONS WITHOUT NOTICE","/hansard/chamber.xscript/debate[7]/subdebate.1[6]/question/talk.text/body/p","Mr PERRETT (Moreton) ","(14:35):"
184,0,1,0,0,1,"King, Catherine Fiona MP","00AMR","Ballarat","ALP","N/A",2485," I thank very much the member for Moreton for his question and commend him on his ongoing work on the 2032 Olympic and Paralympic Games and ensuring that they are a success and that they leave a lasting legacy across the community. Of course, these games will be the largest event to be ever held in Queensland. For two weeks the eyes of the world will be on Brisbane, and across that fine, fine state of Queensland, as the best athletes in the world go head to head for the race to gold. Brisbane 2032 will be another opportunity to show the world just what Australia can do but it has to do more than that, it has to provide a lasting benefit. Thats why this government is partnering with the Palaszczuk government to secure infrastructure projects that will have a long-term and transformational impact on Queensland as we count down to 2032.The Queensland government will fund the $2.7 billion redevelopment of the Gabba, while the federal government will provide $2.5 billion for the Brisbane arena development. Sixteen new or upgraded venues will receive close to $1.87 billion in co-funding on a fifty-fifty basis between the two governments. The Brisbane arena is planned to be built within the Roma Street precinct with easy access for people of all mobilities to the city bus network.But, of course, Im asked about what the legacy is of the previous government when it comes to the Olympics and that can be summed up in two words: absolutely nothing. The previous government did not commit a single cent to the Brisbane Olympics. I went looking, when we came into government, to see where the was money for the Brisbane Olympics. What we inherited from the previous government was one line in a letter committing the Commonwealth to fifty-fifty funding. I went looking. I thought, Is it in the previous May budget? Is it in the contingency reserve? You would think someone, a Queenslander maybe on ERC, would have thought, Maybe you need to put some money in the contingency reserve for this commitment to the biggest event ever for Queenslanders. But what was there? Zilch, nothing, not a single cent provisioned for the Brisbane Olympics. The other side of the House are full of talk on this. The member for Fairfax may still spruik whatever make-work job he had made up for himself, but the reality is that their last budget did not commit a single cent to this event, not a single cent. What we inherited from the previous government was one line in a letter: no funding.We know how important the Olympics are to Queensland. The Olympic flame is going to be lit in 2032. Brisbane will be ready and it will be no thanks to those opposite.","Brisbane Olympic and Paralympic Games","QUESTIONS WITHOUT NOTICE","/hansard/chamber.xscript/debate[7]/subdebate.1[6]/answer/talk.text/body/p[1]","Ms CATHERINE KING (Ballarat—Minister for Infrastructure, Transport, Regional Development and Local Government) ","(14:35):"
185,0,1,0,0,1,"Honourable memb ers ","N/A","N/A","N/A","N/A","N/A","Honourable memb ers interjecting—","Brisbane Olympic and Paralympic Games","QUESTIONS WITHOUT NOTICE","/hansard/chamber.xscript/debate[7]/subdebate.1[6]/answer/talk.text/body/p[5]","N/A","N/A"
186,0,1,0,0,1,"Mr Sukkar ",242515,"N/A","N/A","N/A","N/A","Mr Sukkar interjecting—","Brisbane Olympic and Paralympic Games","QUESTIONS WITHOUT NOTICE","/hansard/chamber.xscript/debate[7]/subdebate.1[6]/answer/talk.text/body/a[1]/p","N/A","N/A"
187,0,1,0,0,1,"Mr Hamilton ",291387,"N/A","N/A","N/A","N/A","Mr Hamilton interjecting—","Brisbane Olympic and Paralympic Games","QUESTIONS WITHOUT NOTICE","/hansard/chamber.xscript/debate[7]/subdebate.1[6]/answer/talk.text/body/a[2]/p","N/A","N/A"
188,0,1,0,0,1,"MemberInterjecting",53517,"N/A","N/A","N/A","N/A"," Before I call the member for Flinders, theres far too much noise in the chamber. The members for Deakin and Groom are now warned. Youve had a good go.","Brisbane Olympic and Paralympic Games","QUESTIONS WITHOUT NOTICE","/hansard/chamber.xscript/debate[7]/subdebate.1[6]/answer/talk.text/body/p[6]","N/A","N/A"
189,0,0,1,0,1,"2485 Mr Sukkar ","N/A","N/A","N/A","N/A",2485,"2485 Mr Sukkar interjecting—","Brisbane Olympic and Paralympic Games","QUESTIONS WITHOUT NOTICE","/hansard/chamber.xscript/debate[7]/subdebate.1[6]/answer/interjection[1]/talk.start","N/A","N/A"
190,0,0,1,0,1,"2485 Mr Hamilton ","N/A","N/A","N/A","N/A",2485,"2485 Mr Hamilton interjecting—","Brisbane Olympic and Paralympic Games","QUESTIONS WITHOUT NOTICE","/hansard/chamber.xscript/debate[7]/subdebate.1[6]/answer/interjection[2]/talk.start","N/A","N/A"
191,0,0,1,0,1,"Dick, Milton MP ",53517,"Oxley","ALP","N/A",2485,"2485 Dick, Milton MP (The SPEAKER) 53517 Oxley ALP","Brisbane Olympic and Paralympic Games","QUESTIONS WITHOUT NOTICE","/hansard/chamber.xscript/debate[7]/subdebate.1[6]/answer/interjection[3]/talk.start","N/A","N/A"
192,1,0,0,0,1,"McKenzie, Zoe MP",124514,"Flinders","LP","N/A",2485," My question is to the Prime Minister. The governments deal with the Greens for a hard emissions cap will force up power prices and further risk domestic gas supply. This comes after the Australian Energy Market Operators warning of gas shortages in Victoria. Can the Prime Minister guarantee there will be no disruption to gas supply to Victorians this winter?","Energy","QUESTIONS WITHOUT NOTICE","/hansard/chamber.xscript/debate[7]/subdebate.1[7]/question/talk.text/body/p","Ms McKENZIE (Flinders) ","(14:38):"
193,0,1,0,0,1,"Albanese, Anthony MP","R36","Grayndler","ALP","N/A",2485," Only a party addicted to secrecy, cover-ups and denial would say that its a bad thing that this parliament is prepared to work with colleagues across the parliament in order to achieve reform and change. We make no apologies for engaging across this parliament. Its just a pity that those opposite are now the observers rather than the participants in this parliament. They chose to be nowhere near any of this. Its no wonder that the member for Bass had this to say:Im utterly exasperated by the lack of engagement from my own side to come to the table and engage in a constructive conversation …The fact is that we—","Energy","QUESTIONS WITHOUT NOTICE","/hansard/chamber.xscript/debate[7]/subdebate.1[7]/answer/talk.text/body/p[1]","Mr ALBANESE (Grayndler—Prime Minister) ","(14:39):"
194,0,1,0,0,1,"Ms Ley ","00AMN","N/A","N/A","N/A","N/A","Ms Ley interjecting—","Energy","QUESTIONS WITHOUT NOTICE","/hansard/chamber.xscript/debate[7]/subdebate.1[7]/answer/talk.text/body/a[1]/p","N/A","N/A"
195,0,1,0,0,1,"Mr Ted OBrien ",138932,"N/A","N/A","N/A","N/A","Mr Ted OBrien interjecting—","Energy","QUESTIONS WITHOUT NOTICE","/hansard/chamber.xscript/debate[7]/subdebate.1[7]/answer/talk.text/body/a[2]/p","N/A","N/A"
196,0,1,0,0,1,"MemberInterjecting",53517,"N/A","N/A","N/A","N/A"," The Deputy Leader of the Opposition and the member for Fairfax will cease interjecting.","Energy","QUESTIONS WITHOUT NOTICE","/hansard/chamber.xscript/debate[7]/subdebate.1[7]/answer/talk.text/body/p[4]","N/A","N/A"
197,0,1,0,0,1,"MemberContinuation","R36","N/A","N/A","N/A","N/A","Mr ALBANESE: Im asked about arrangements in this parliament in order to achieve the legislation that is through. What we had from those opposite was ongoing scare campaigns. Remember when we met in December the member for Hume said, Labors diabolical plan will undermine new investment in Australia. The Leader of the Nats: It will tear away at investment confidence. The Leader of the Opposition: It will disrupt investment into our country. Well, have a look at whats happened today on investment.","Energy","QUESTIONS WITHOUT NOTICE","/hansard/chamber.xscript/debate[7]/subdebate.1[7]/answer/talk.text/body/p[5]","N/A","N/A"
198,0,1,0,0,1,"MemberInterjecting",53517,"N/A","N/A","N/A","N/A"," The Prime Minister will pause. Ill hear from the Manager of Opposition Business.","Energy","QUESTIONS WITHOUT NOTICE","/hansard/chamber.xscript/debate[7]/subdebate.1[7]/answer/talk.text/body/p[6]","N/A","N/A"
199,0,1,0,0,1,"MemberInterjecting","L6B","N/A","N/A","N/A","N/A","Mr Fletcher: On relevance, a straight question: can the Prime Minister guarantee there will be no disruption to gas supply to Victorians this winter?","Energy","QUESTIONS WITHOUT NOTICE","/hansard/chamber.xscript/debate[7]/subdebate.1[7]/answer/talk.text/body/p[7]","N/A","N/A"
200,0,1,0,0,1,"MemberInterjecting",53517,"N/A","N/A","N/A","N/A"," That was part of the question.","Energy","QUESTIONS WITHOUT NOTICE","/hansard/chamber.xscript/debate[7]/subdebate.1[7]/answer/talk.text/body/p[8]","N/A","N/A"
201,0,1,0,0,1,"MemberInterjecting","L6B","N/A","N/A","N/A","N/A","Mr Fletcher: Please give us a straight answer, Prime Minister.","Energy","QUESTIONS WITHOUT NOTICE","/hansard/chamber.xscript/debate[7]/subdebate.1[7]/answer/talk.text/body/p[9]","N/A","N/A"
202,0,1,0,0,1,"MemberInterjecting",53517,"N/A","N/A","N/A","N/A"," Resume your seat. The point of relevance is not just to pick out the point of the question that you want answered; it is the entirety. If you want to read the whole question out, thats not okay. You just need to state the point of relevance. The Prime Minister is being relevant and may continue.","Energy","QUESTIONS WITHOUT NOTICE","/hansard/chamber.xscript/debate[7]/subdebate.1[7]/answer/talk.text/body/p[10]","N/A","N/A"
203,0,1,0,0,1,"MemberContinuation","R36","N/A","N/A","N/A","N/A","Mr ALBANESE: Today we have, in the Financial Review:Canadian giant Brookfield has pledged to invest billions of dollars to accelerate the decarbonisation of Origin Energy after sealing a long-awaited $18.7 billion deal to buy out the Australian electricity and gas supplier together with US partner EIG.It went on to say this:… the binding agreement puts to bed any lingering doubts in the market that what was the second-biggest takeover proposal announced in 2022 in Australia would be derailed by the federal governments intervention into energy markets to rein in runaway prices.No wonder theyre against solar power, because they keep predicting the sky will fall in. Thats why theyre against solar power—because they keep predicting that the sky will fall in. The sky wont fall in. We have the best solar resources in the world, and were going to use them.","Energy","QUESTIONS WITHOUT NOTICE","/hansard/chamber.xscript/debate[7]/subdebate.1[7]/answer/talk.text/body/p[11]","N/A","N/A"
204,0,1,0,0,1,"Mr McCormack ",219646,"N/A","N/A","N/A","N/A","Mr McCormack interjecting—","Energy","QUESTIONS WITHOUT NOTICE","/hansard/chamber.xscript/debate[7]/subdebate.1[7]/answer/talk.text/body/a[3]/p","N/A","N/A"
205,0,1,0,0,1,"MemberInterjecting",53517,"N/A","N/A","N/A","N/A"," The member for Riverina, if he continues with that interjection, will be warned.","Energy","QUESTIONS WITHOUT NOTICE","/hansard/chamber.xscript/debate[7]/subdebate.1[7]/answer/talk.text/body/p[16]","N/A","N/A"
206,0,0,1,0,1,"2485 Ms Ley ","N/A","N/A","N/A","N/A",2485,"2485 Ms Ley interjecting—","Energy","QUESTIONS WITHOUT NOTICE","/hansard/chamber.xscript/debate[7]/subdebate.1[7]/answer/interjection[1]/talk.start","N/A","N/A"
207,0,0,1,0,1,"Mr Ted OBrien interjecting—","N/A","N/A","N/A","N/A",2485,"2485 Mr Ted OBrien interjecting—","Energy","QUESTIONS WITHOUT NOTICE","/hansard/chamber.xscript/debate[7]/subdebate.1[7]/answer/interjection[2]/talk.start","N/A","N/A"
208,0,0,1,0,1,"Dick, Milton MP ",53517,"Oxley","ALP","N/A",2485,"2485 Dick, Milton MP (The SPEAKER) 53517 Oxley ALP","Energy","QUESTIONS WITHOUT NOTICE","/hansard/chamber.xscript/debate[7]/subdebate.1[7]/answer/interjection[3]/talk.start","N/A","N/A"
209,0,0,1,0,1,"Dick, Milton MP ",53517,"Oxley","ALP","N/A",2486,"2486 Dick, Milton MP (The SPEAKER) 53517 Oxley ALP","Energy","QUESTIONS WITHOUT NOTICE","/hansard/chamber.xscript/debate[7]/subdebate.1[7]/answer/interjection[4]/talk.start","N/A","N/A"
210,0,0,1,0,1,"Fletcher, Paul MP","L6B","Bradfield","LP","N/A",2486,"2486 Fletcher, Paul MP L6B Bradfield LP","Energy","QUESTIONS WITHOUT NOTICE","/hansard/chamber.xscript/debate[7]/subdebate.1[7]/answer/interjection[5]/talk.start","N/A","N/A"
211,0,0,1,0,1,"Dick, Milton MP ",53517,"Oxley","ALP","N/A",2486,"2486 Dick, Milton MP (The SPEAKER) 53517 Oxley ALP","Energy","QUESTIONS WITHOUT NOTICE","/hansard/chamber.xscript/debate[7]/subdebate.1[7]/answer/interjection[6]/talk.start","N/A","N/A"
212,0,0,1,0,1,"Fletcher, Paul MP","L6B","Bradfield","LP","N/A",2486,"2486 Fletcher, Paul MP L6B Bradfield LP","Energy","QUESTIONS WITHOUT NOTICE","/hansard/chamber.xscript/debate[7]/subdebate.1[7]/answer/interjection[7]/talk.start","N/A","N/A"
213,0,0,1,0,1,"Dick, Milton MP ",53517,"Oxley","ALP","N/A",2486,"2486 Dick, Milton MP (The SPEAKER) 53517 Oxley ALP","Energy","QUESTIONS WITHOUT NOTICE","/hansard/chamber.xscript/debate[7]/subdebate.1[7]/answer/interjection[8]/talk.start","N/A","N/A"
214,0,0,1,0,1,"2486 Mr McCormack ","N/A","N/A","N/A","N/A",2486,"2486 Mr McCormack interjecting—","Energy","QUESTIONS WITHOUT NOTICE","/hansard/chamber.xscript/debate[7]/subdebate.1[7]/answer/interjection[9]/talk.start","N/A","N/A"
215,0,0,1,0,1,"Dick, Milton MP ",53517,"Oxley","ALP","N/A",2486,"2486 Dick, Milton MP (The SPEAKER) 53517 Oxley ALP","Energy","QUESTIONS WITHOUT NOTICE","/hansard/chamber.xscript/debate[7]/subdebate.1[7]/answer/interjection[10]/talk.start","N/A","N/A"
216,1,0,0,0,1,"Charlton, Andrew MP","I8M","Parramatta","ALP","N/A",2486," My question is to the Minister for Government Services. Why is it important to support the delivery of government services through the myGov platform? What are the current financial circumstances of the myGov platform?","MyGov","QUESTIONS WITHOUT NOTICE","/hansard/chamber.xscript/debate[7]/subdebate.1[8]/question/talk.text/body/p","Dr CHARLTON (Parramatta) ","(14:42):"
217,0,1,0,0,1,"Shorten, Bill MP","00ATG","Maribyrnong","ALP","N/A",2486," Members of the House would be aware that myGov provides a secure and convenient way to access 15 government services. For example, there are 19 million myGov accounts which are linked to Medicare, and 97 per cent of the claims which people made in the last 12 months for disaster relief were done through myGov. On average, every day 1.4 million people use myGov, which is more than people who use public transport to commute to and from work. Also, myGov helps protect peoples personal information. I believe that myGov will be developed as a trusted system which will be used to verify someones identity, avoiding the need for private-sector organisations to pile masses of data which then can be inconveniently hacked.The myGov user audit, which was done this year as part of our election policy, has proposed ideas which were currently considering to improve reliability and functionality and provide a user-friendly experience. Its built upon David Thodeys independent review of the Australian Public Service, and I think it adds to the roadmap of how myGov can achieve a better vision for the delivery of government services and build trust between citizens and their government. The audit thinks that its an indispensable national digital infrastructure.This is a good story and good news, but there is a catch. The previous government decided that the job would be done by 30 June this year. The Francis Fukuyamas, the End of History people, believed that history would end on 30 June and that we would reach Utopia. There was no need to do any more—mission accomplished, as a former American president said! And when you look at the 2021-22 portfolio budget statement, theres $92 million dollars in 2021-22—good, tick—and $80 million in 2022-23.","MyGov","QUESTIONS WITHOUT NOTICE","/hansard/chamber.xscript/debate[7]/subdebate.1[8]/answer/talk.text/body/p[1]","Mr SHORTEN (Maribyrnong—Minister for the National Disability Insurance Scheme and Minister for Government Services) ","(14:43):"
218,0,1,0,0,1,"Mr Littleproud ",265585,"N/A","N/A","N/A","N/A","Mr Littleproud interjecting—","MyGov","QUESTIONS WITHOUT NOTICE","/hansard/chamber.xscript/debate[7]/subdebate.1[8]/answer/talk.text/body/a/p","N/A","N/A"
219,0,1,0,0,1,"MemberInterjecting",53517,"N/A","N/A","N/A","N/A"," The Leader of the Nationals will cease interjecting.","MyGov","QUESTIONS WITHOUT NOTICE","/hansard/chamber.xscript/debate[7]/subdebate.1[8]/answer/talk.text/body/p[4]","N/A","N/A"
220,0,1,0,0,1,"MemberContinuation","00ATG","N/A","N/A","N/A","N/A","Mr SHORTEN: But when you look for the next year, theres nothing. The real import of this—","MyGov","QUESTIONS WITHOUT NOTICE","/hansard/chamber.xscript/debate[7]/subdebate.1[8]/answer/talk.text/body/p[5]","N/A","N/A"
221,0,1,0,0,1,"Opposition member s ","N/A","N/A","N/A","N/A","N/A","Opposition member s interjecting—","MyGov","QUESTIONS WITHOUT NOTICE","/hansard/chamber.xscript/debate[7]/subdebate.1[8]/answer/talk.text/body/p[6]","N/A","N/A"
222,0,1,0,0,1,"MemberContinuation","00ATG","N/A","N/A","N/A","N/A","Mr SHORTEN: And despite the howls from those opposite—","MyGov","QUESTIONS WITHOUT NOTICE","/hansard/chamber.xscript/debate[7]/subdebate.1[8]/answer/talk.text/body/p[7]","N/A","N/A"
223,0,1,0,0,1,"MemberInterjecting",53517,"N/A","N/A","N/A","N/A"," The minister will resume his seat so I can hear from the member for Hume.","MyGov","QUESTIONS WITHOUT NOTICE","/hansard/chamber.xscript/debate[7]/subdebate.1[8]/answer/talk.text/body/p[8]","N/A","N/A"
224,0,1,0,0,1,"MemberInterjecting",231027,"N/A","N/A","N/A","N/A","Mr Taylor: A point of order on relevance, Mr Speaker. The government had a budget in October. They could have included—","MyGov","QUESTIONS WITHOUT NOTICE","/hansard/chamber.xscript/debate[7]/subdebate.1[8]/answer/talk.text/body/p[9]","N/A","N/A"
225,0,1,0,0,1,"MemberInterjecting",53517,"N/A","N/A","N/A","N/A"," Resume your seat, member for Hume, that is not a point of order. I ask the minister to return to the question.","MyGov","QUESTIONS WITHOUT NOTICE","/hansard/chamber.xscript/debate[7]/subdebate.1[8]/answer/talk.text/body/p[10]","N/A","N/A"
226,0,1,0,0,1,"MemberContinuation","00ATG","N/A","N/A","N/A","N/A","Mr SHORTEN: The summary of this issue, and the reason it is important to people listening to parliament, is that the previous government was absolutely guilty in its budgets of cooking the books. They would pretend that they needed to make no provision for the future, and in that way they were misleading the Australian people on every budget night. And that habit has to stop.","MyGov","QUESTIONS WITHOUT NOTICE","/hansard/chamber.xscript/debate[7]/subdebate.1[8]/answer/talk.text/body/p[11]","N/A","N/A"
227,0,0,1,0,1,"2486 Mr Littleproud ","N/A","N/A","N/A","N/A",2486,"2486 Mr Littleproud interjecting—","MyGov","QUESTIONS WITHOUT NOTICE","/hansard/chamber.xscript/debate[7]/subdebate.1[8]/answer/interjection[1]/talk.start","N/A","N/A"
228,0,0,1,0,1,"Dick, Milton MP ",53517,"Oxley","ALP","N/A",2486,"2486 Dick, Milton MP (The SPEAKER) 53517 Oxley ALP","MyGov","QUESTIONS WITHOUT NOTICE","/hansard/chamber.xscript/debate[7]/subdebate.1[8]/answer/interjection[2]/talk.start","N/A","N/A"
229,0,0,1,0,1,"Dick, Milton MP ",53517,"Oxley","ALP","N/A",2486,"2486 Dick, Milton MP (The SPEAKER) 53517 Oxley ALP","MyGov","QUESTIONS WITHOUT NOTICE","/hansard/chamber.xscript/debate[7]/subdebate.1[8]/answer/interjection[3]/talk.start","N/A","N/A"
230,0,0,1,0,1,"Taylor, Angus MP",231027,"Hume","LP","N/A",2487,"2487 Taylor, Angus MP 231027 Hume LP","MyGov","QUESTIONS WITHOUT NOTICE","/hansard/chamber.xscript/debate[7]/subdebate.1[8]/answer/interjection[4]/talk.start","N/A","N/A"
231,0,0,1,0,1,"Dick, Milton MP ",53517,"Oxley","ALP","N/A",2487,"2487 Dick, Milton MP (The SPEAKER) 53517 Oxley ALP","MyGov","QUESTIONS WITHOUT NOTICE","/hansard/chamber.xscript/debate[7]/subdebate.1[8]/answer/interjection[5]/talk.start","N/A","N/A"
232,1,0,0,0,1,"Katter, Bob MP","HX4","Kennedy","KAP","N/A",2487," My question is for the Minister for the Environment and Water. There are 24,000 kilometres of prickly melodica weed tree, the worst environmental disaster in our history. It is reducing what some have described as Australias best natural grasslands into degraded, eroded wastelands bereft of native flora and fauna, dooming, inter alia, the western dunnart, to extinction. Minister, as North Queenslands mid-west population has fallen from 40,000 to 24,000, will the Hughenden irrigation scheme be a template for overcoming the degradation and creating the freedom of property and space, a nature wonderland of hope, prosperity and— (Time expired)","Environment: Prickly Acacia","QUESTIONS WITHOUT NOTICE","/hansard/chamber.xscript/debate[7]/subdebate.1[9]/question/talk.text/body/p","Mr KATTER (Kennedy) ","(14:46):"
