index,question_flag,answer_flag,interjection_flag,speech_flag,chamber_flag,name,name.id,electorate,party,role,page.no,content,subdebateinfo,debateinfo,path,Speaker,Time
104,0,0,0,1,1,"MemberContinuation","00AMN","N/A","N/A","N/A","N/A","Ms LEY: I withdraw. The Prime Minister couldnt name the interest rate in April but thought he could promise Australians a cheaper mortgage in May. The Prime Minister knew there was a war in Ukraine and then promised a $275 reduction in power bills—28 times—after the invasion. And the Prime Minister promised no new taxes but broke that commitment too.How can this arrogant out-of-touch Prime Minister seriously say, Its been a good 10 months? The Prime Minister is breaking promises he made hundreds of times before the last election and ramming policies through this parliament that he didnt even mention once. This is a prime minister allergic to the truth. This is not the leadership the Prime Minister promised. He said he would leave no-one behind but hes leaving everyone behind. Small businesses: left behind. Workers: left behind. Mortgage holders: left behind. Retirees: left behind. Renters: left behind.In the coalition, we are here for the small businesses of this great country and we are here for the mortgage holders in the suburbs and the regions.","Prime Minister","STATEMENTS BY MEMBERS","/hansard/chamber.xscript/debate[5]/subdebate.1[19]/speech/talk.text/body/p[7]","N/A","N/A"
105,0,0,0,1,1,"MemberInterjecting",53517,"N/A","N/A","N/A","N/A"," In accordance with standing order 43, the time for members statements has concluded.","Prime Minister","STATEMENTS BY MEMBERS","/hansard/chamber.xscript/debate[5]/subdebate.1[19]/speech/talk.text/body/p[10]","N/A","N/A"
106,0,0,1,0,1,"Claydon, Sharon MP ",248181,"Newcastle","ALP","N/A",2231,"2231 Claydon, Sharon MP (The DEPUTY SPEAKER) 248181 Newcastle ALP","Prime Minister","STATEMENTS BY MEMBERS","/hansard/chamber.xscript/debate[5]/subdebate.1[19]/speech/interjection[1]/talk.start","N/A","N/A"
107,0,0,1,0,1,"DEPUTY SPEAKER, The",10000,"N/A","N/A","N/A",2231,"2231 DEPUTY SPEAKER, The 10000","Prime Minister","STATEMENTS BY MEMBERS","/hansard/chamber.xscript/debate[5]/subdebate.1[19]/speech/interjection[2]/talk.start","N/A","N/A"
108,0,0,1,0,1,"DEPUTY SPEAKER, The",10000,"N/A","N/A","N/A",2231,"2231 DEPUTY SPEAKER, The 10000","Prime Minister","STATEMENTS BY MEMBERS","/hansard/chamber.xscript/debate[5]/subdebate.1[19]/speech/interjection[3]/talk.start","N/A","N/A"
109,0,0,1,0,1,"Dick, Milton MP ",53517,"Oxley","ALP","N/A",2231,"2231 Dick, Milton MP (The SPEAKER) 53517 Oxley ALP","Prime Minister","STATEMENTS BY MEMBERS","/hansard/chamber.xscript/debate[5]/subdebate.1[19]/speech/interjection[4]/talk.start","N/A","N/A"
110,0,0,0,1,1,"Albanese, Anthony MP","R36","Grayndler","ALP","N/A",2231," I inform the House that of the Minister for Government Services will be absent from question time today and the Minister for Social Services will answer questions on his behalf. I also inform the House that the Minister for Home Affairs will be absent from question time today and the Minister for Immigration, Citizenship and Multicultural Affairs will answer questions on her behalf.","Temporary Arrangements","MINISTRY","/hansard/chamber.xscript/debate[6]/subdebate.1/speech/talk.text/body/p","Mr ALBANESE (Grayndler—Prime Minister) ","(13:59):"
111,1,0,0,0,1,"Dutton, Peter Craig MP","00AKI","Dickson","LNP","N/A",2231," My question is to the Prime Minister. On 15 occasions in this parliament, Ive asked the Prime Minister to repeat his election promise to cut power bills for Australian families by $275 every year. On 15 occasions the Prime Minister has refused. Will the Prime Minister finally admit he has broken his promise.","Energy","QUESTIONS WITHOUT NOTICE","/hansard/chamber.xscript/debate[7]/subdebate.1[1]/question/talk.text/body/p","Mr DUTTON (Dickson—Leader of the Opposition) ","(13:59):"
112,0,1,0,0,1,"Albanese, Anthony MP","R36","Grayndler","ALP","N/A",2231," Im asked about energy policy and promises. We know we inherited an energy system that was broken. Twenty-two policies announced, none of them landed. An energy grid built for the last century.We have taken action to provide direct power bill relief for Australians, and those opposite voted against it. Weve taken action for energy price caps, and those opposite, you guessed it, voted against it. Weve taken action to promote investment in renewable energy and, you guessed it, they voted against it. And now we have the safeguards mechanism before the parliament and, of course, those opposite are voting against it. The member for Bass, to her credit, this morning pointed out the issues which were there.In the 2019 election, the member for Hume promised to reduce the wholesale price of electricity to $70 per megawatt. Seventy dollars by the end of 2021. Spoiler alert! It didnt happen. When they left office, it was not $70, not $170, not even $270, but $286! Missed it by that much! Promised $70, got $286.","Energy","QUESTIONS WITHOUT NOTICE","/hansard/chamber.xscript/debate[7]/subdebate.1[1]/answer/talk.text/body/p[1]","Mr ALBANESE (Grayndler—Prime Minister) ","(14:00):"
113,0,1,0,0,1,"Mr Taylor ",231027,"N/A","N/A","N/A","N/A","Mr Taylor interjecting—","Energy","QUESTIONS WITHOUT NOTICE","/hansard/chamber.xscript/debate[7]/subdebate.1[1]/answer/talk.text/body/a[1]/p","N/A","N/A"
114,0,1,0,0,1,"MemberInterjecting",53517,"N/A","N/A","N/A","N/A"," The member for Hume will cease interjecting, particularly with those interjections, and I will hear from the Manager of Opposition Business.","Energy","QUESTIONS WITHOUT NOTICE","/hansard/chamber.xscript/debate[7]/subdebate.1[1]/answer/talk.text/body/p[4]","N/A","N/A"
115,0,1,0,0,1,"MemberInterjecting","L6B","N/A","N/A","N/A","N/A","Mr Fletcher: Mr Speaker, its on relevance. It was a very specific question about the promise to cut power bills by $275 every year. Speaker Jenkins ruled on these issues, and indeed youve ruled on these issues. Id submit that the Prime Minister should be asked to be directly relevant to a tightly worded question.","Energy","QUESTIONS WITHOUT NOTICE","/hansard/chamber.xscript/debate[7]/subdebate.1[1]/answer/talk.text/body/p[5]","N/A","N/A"
116,0,1,0,0,1,"MemberInterjecting",53517,"N/A","N/A","N/A","N/A"," The Prime Minister was asked about commitments hes made about energy prices. Im going to ask him to return back to the question. I give him the call.","Energy","QUESTIONS WITHOUT NOTICE","/hansard/chamber.xscript/debate[7]/subdebate.1[1]/answer/talk.text/body/p[6]","N/A","N/A"
117,0,1,0,0,1,"MemberContinuation","R36","N/A","N/A","N/A","N/A","Mr ALBANESE: Thanks very much, Mr Speaker. Of course, one of the things we havent done is to commit money like they did. They committed $4 million to the feasibility study on the Collinsville coal fired power plant. Those opposite also promised $1 billion that was going to deliver 3,800 megawatts of new power generation. How much did you deliver?","Energy","QUESTIONS WITHOUT NOTICE","/hansard/chamber.xscript/debate[7]/subdebate.1[1]/answer/talk.text/body/p[7]","N/A","N/A"
118,0,1,0,0,1,"MemberInterjecting",53517,"N/A","N/A","N/A","N/A"," The Prime Minister will pause. I will hear from the Leader of the Opposition.","Energy","QUESTIONS WITHOUT NOTICE","/hansard/chamber.xscript/debate[7]/subdebate.1[1]/answer/talk.text/body/p[8]","N/A","N/A"
119,0,1,0,0,1,"MemberInterjecting","00AKI","N/A","N/A","N/A","N/A","Mr Dutton: Mr Speaker, I think your ruling is being treated with complete contempt. You gave the Prime Minister a very clear instruction. He defies that direction from you. He will not mention this figure. He has broken his promise and he cant speak with a straight tongue.","Energy","QUESTIONS WITHOUT NOTICE","/hansard/chamber.xscript/debate[7]/subdebate.1[1]/answer/talk.text/body/p[9]","N/A","N/A"
120,0,1,0,0,1,"MemberInterjecting",53517,"N/A","N/A","N/A","N/A"," The member for Dickson will resume his seat.","Energy","QUESTIONS WITHOUT NOTICE","/hansard/chamber.xscript/debate[7]/subdebate.1[1]/answer/talk.text/body/p[10]","N/A","N/A"
121,0,1,0,0,1,"Ms Murphy ",133646,"N/A","N/A","N/A","N/A","Ms Murphy interjecting—","Energy","QUESTIONS WITHOUT NOTICE","/hansard/chamber.xscript/debate[7]/subdebate.1[1]/answer/talk.text/body/a[2]/p","N/A","N/A"
122,0,1,0,0,1,"MemberInterjecting",53517,"N/A","N/A","N/A","N/A"," The member for Dunkley will cease interjecting. I cant hear what is being said. If members continue to interject, they will be warned and asked to leave the chamber.","Energy","QUESTIONS WITHOUT NOTICE","/hansard/chamber.xscript/debate[7]/subdebate.1[1]/answer/talk.text/body/p[11]","N/A","N/A"
123,0,1,0,0,1,"Mr Dutton ","00AKI","N/A","N/A","N/A","N/A","Mr Dutton interjecting—","Energy","QUESTIONS WITHOUT NOTICE","/hansard/chamber.xscript/debate[7]/subdebate.1[1]/answer/talk.text/body/a[3]/p","N/A","N/A"
124,0,1,0,0,1,"MemberInterjecting",53517,"N/A","N/A","N/A","N/A"," I dont need any assistance from the Leader of the Opposition. The Prime Minister has been asked about his commitments and energy prices. He is being relevant as long as he sticks to his commitments and energy prices. Hes had a preamble; hes got one minute left to go. I give him the call.","Energy","QUESTIONS WITHOUT NOTICE","/hansard/chamber.xscript/debate[7]/subdebate.1[1]/answer/talk.text/body/p[12]","N/A","N/A"
125,0,1,0,0,1,"MemberContinuation","R36","N/A","N/A","N/A","N/A","Mr ALBANESE: Thanks, Mr Speaker. Ive spoken about—","Energy","QUESTIONS WITHOUT NOTICE","/hansard/chamber.xscript/debate[7]/subdebate.1[1]/answer/talk.text/body/p[13]","N/A","N/A"
126,0,1,0,0,1,"MemberInterjecting","00AKI","N/A","N/A","N/A","N/A","Mr Dutton: Did you make a promise or not?","Energy","QUESTIONS WITHOUT NOTICE","/hansard/chamber.xscript/debate[7]/subdebate.1[1]/answer/talk.text/body/p[14]","N/A","N/A"
127,0,1,0,0,1,"MemberInterjecting",53517,"N/A","N/A","N/A","N/A"," The Leader of the Opposition has asked his question. I appreciate he wants an answer. So do I. I call the Prime Minister.","Energy","QUESTIONS WITHOUT NOTICE","/hansard/chamber.xscript/debate[7]/subdebate.1[1]/answer/talk.text/body/p[15]","N/A","N/A"
128,0,1,0,0,1,"MemberContinuation","R36","N/A","N/A","N/A","N/A","Mr ALBANESE: Thanks, Mr Speaker. Ive spoken directly about what we have done, which is bringing legislation—","Energy","QUESTIONS WITHOUT NOTICE","/hansard/chamber.xscript/debate[7]/subdebate.1[1]/answer/talk.text/body/p[16]","N/A","N/A"
129,0,1,0,0,1,"MemberInterjecting",242515,"N/A","N/A","N/A","N/A","Mr Sukkar: Say the number 275!","Energy","QUESTIONS WITHOUT NOTICE","/hansard/chamber.xscript/debate[7]/subdebate.1[1]/answer/talk.text/body/p[17]","N/A","N/A"
130,0,1,0,0,1,"MemberInterjecting",53517,"N/A","N/A","N/A","N/A"," The member for Deakin is now warned!","Energy","QUESTIONS WITHOUT NOTICE","/hansard/chamber.xscript/debate[7]/subdebate.1[1]/answer/talk.text/body/p[18]","N/A","N/A"
131,0,1,0,0,1,"MemberContinuation","R36","N/A","N/A","N/A","N/A","Mr ALBANESE: here into this parliament to give relief on power prices, and those opposite voted against it—$1.5 billion and they voted against it. They did promise a billion dollars to deliver new power generation. You know how much they spent? Zero. Not a single kilowatt, not enough to light a single light globe, from those opposite. They failed in government and they are failing in opposition.","Energy","QUESTIONS WITHOUT NOTICE","/hansard/chamber.xscript/debate[7]/subdebate.1[1]/answer/talk.text/body/p[19]","N/A","N/A"
132,0,0,1,0,1,"2231 Mr Taylor ","N/A","N/A","N/A","N/A",2231,"2231 Mr Taylor interjecting—","Energy","QUESTIONS WITHOUT NOTICE","/hansard/chamber.xscript/debate[7]/subdebate.1[1]/answer/interjection[1]/talk.start","N/A","N/A"
133,0,0,1,0,1,"Dick, Milton MP ",53517,"Oxley","ALP","N/A",2231,"2231 Dick, Milton MP (The SPEAKER) 53517 Oxley ALP","Energy","QUESTIONS WITHOUT NOTICE","/hansard/chamber.xscript/debate[7]/subdebate.1[1]/answer/interjection[2]/talk.start","N/A","N/A"
134,0,0,1,0,1,"Fletcher, Paul MP","L6B","Bradfield","LP","N/A",2231,"2231 Fletcher, Paul MP L6B Bradfield LP","Energy","QUESTIONS WITHOUT NOTICE","/hansard/chamber.xscript/debate[7]/subdebate.1[1]/answer/interjection[3]/talk.start","N/A","N/A"
135,0,0,1,0,1,"Dick, Milton MP ",53517,"Oxley","ALP","N/A",2232,"2232 Dick, Milton MP (The SPEAKER) 53517 Oxley ALP","Energy","QUESTIONS WITHOUT NOTICE","/hansard/chamber.xscript/debate[7]/subdebate.1[1]/answer/interjection[4]/talk.start","N/A","N/A"
136,0,0,1,0,1,"Dick, Milton MP ",53517,"Oxley","ALP","N/A",2232,"2232 Dick, Milton MP (The SPEAKER) 53517 Oxley ALP","Energy","QUESTIONS WITHOUT NOTICE","/hansard/chamber.xscript/debate[7]/subdebate.1[1]/answer/interjection[5]/talk.start","N/A","N/A"
137,0,0,1,0,1,"Dutton, Peter Craig MP","00AKI","Dickson","LNP","N/A",2232,"2232 Dutton, Peter Craig MP 00AKI Dickson LNP","Energy","QUESTIONS WITHOUT NOTICE","/hansard/chamber.xscript/debate[7]/subdebate.1[1]/answer/interjection[6]/talk.start","N/A","N/A"
138,0,0,1,0,1,"Dick, Milton MP ",53517,"Oxley","ALP","N/A",2232,"2232 Dick, Milton MP (The SPEAKER) 53517 Oxley ALP","Energy","QUESTIONS WITHOUT NOTICE","/hansard/chamber.xscript/debate[7]/subdebate.1[1]/answer/interjection[7]/talk.start","N/A","N/A"
139,0,0,1,0,1,"2232 Ms Murphy ","N/A","N/A","N/A","N/A",2232,"2232 Ms Murphy interjecting—","Energy","QUESTIONS WITHOUT NOTICE","/hansard/chamber.xscript/debate[7]/subdebate.1[1]/answer/interjection[8]/talk.start","N/A","N/A"
140,0,0,1,0,1,"Dick, Milton MP ",53517,"Oxley","ALP","N/A",2232,"2232 Dick, Milton MP (The SPEAKER) 53517 Oxley ALP","Energy","QUESTIONS WITHOUT NOTICE","/hansard/chamber.xscript/debate[7]/subdebate.1[1]/answer/interjection[9]/talk.start","N/A","N/A"
141,0,0,1,0,1,"2232 Mr Dutton ","N/A","N/A","N/A","N/A",2232,"2232 Mr Dutton interjecting—","Energy","QUESTIONS WITHOUT NOTICE","/hansard/chamber.xscript/debate[7]/subdebate.1[1]/answer/interjection[10]/talk.start","N/A","N/A"
142,0,0,1,0,1,"Dick, Milton MP ",53517,"Oxley","ALP","N/A",2232,"2232 Dick, Milton MP (The SPEAKER) 53517 Oxley ALP","Energy","QUESTIONS WITHOUT NOTICE","/hansard/chamber.xscript/debate[7]/subdebate.1[1]/answer/interjection[11]/talk.start","N/A","N/A"
143,0,0,1,0,1,"Dutton, Peter Craig MP","00AKI","Dickson","LNP","N/A",2232,"2232 Dutton, Peter Craig MP 00AKI Dickson LNP","Energy","QUESTIONS WITHOUT NOTICE","/hansard/chamber.xscript/debate[7]/subdebate.1[1]/answer/interjection[12]/talk.start","N/A","N/A"
144,0,0,1,0,1,"Dick, Milton MP ",53517,"Oxley","ALP","N/A",2232,"2232 Dick, Milton MP (The SPEAKER) 53517 Oxley ALP","Energy","QUESTIONS WITHOUT NOTICE","/hansard/chamber.xscript/debate[7]/subdebate.1[1]/answer/interjection[13]/talk.start","N/A","N/A"
145,0,0,1,0,1,"Sukkar, Michael MP",242515,"Deakin","LP","N/A",2232,"2232 Sukkar, Michael MP 242515 Deakin LP","Energy","QUESTIONS WITHOUT NOTICE","/hansard/chamber.xscript/debate[7]/subdebate.1[1]/answer/interjection[14]/talk.start","N/A","N/A"
146,0,0,1,0,1,"Dick, Milton MP ",53517,"Oxley","ALP","N/A",2232,"2232 Dick, Milton MP (The SPEAKER) 53517 Oxley ALP","Energy","QUESTIONS WITHOUT NOTICE","/hansard/chamber.xscript/debate[7]/subdebate.1[1]/answer/interjection[15]/talk.start","N/A","N/A"
147,1,0,0,0,1,"Scrymgour, Marion MP","F2S","Lingiari","ALP","N/A",2232," My question is to the Minister for Indigenous Australians. Minister, what progress has been made on the referendum to enshrine a voice for Aboriginal and Torres Strait Islander people in the Constitution?","Australian Constitution: Aboriginal and Torres Strait Islander Voice","QUESTIONS WITHOUT NOTICE","/hansard/chamber.xscript/debate[7]/subdebate.1[2]/question/talk.text/body/p","Ms SCRYMGOUR (Lingiari) ","(14:05):"
148,0,1,0,0,1,"Burney, Linda Jean MP","8GH","Barton","ALP","N/A",2232," I think the member for Lingiari for her question. This is truly a really great day for this nation. Last night the Senate passed the referendum machinery bill with bipartisan support, and just a few hours ago the Prime Minister announced the wording of the constitutional amendment and the question that will be put to Australians at the referendum. That question is:A proposed law: to alter the Constitution to recognise the First Peoples of Australia by establishing an Aboriginal and Torres Strait Islander Voice.Do you approve this proposed alteration?Its a simple question. Its a matter from the heart.Six years ago, Aboriginal and Torres Strait Islander people met at Uluru. The Statement from the Heart was the largest-ever First Nations consensus on a way forward for this country. There were 12 regional dialogues with more than 1,200 representatives—grassroots, bottom-up, not top-down. The Statement from the Heart is an invitation to walk together in a movement of the Australian people for a better future, to create constitutional reform so that Aboriginal and Torres Strait Islander people can take our rightful place in the Constitution.I thank all members of the working group, the Attorney-General, Assistant Minister McCarthy and the legendary Senator Dodson for all their commitment and work. I also acknowledge the bravery and commitment of the Prime Minister, which the nation saw so clearly today, as well as my colleagues across the parliament who want to make a difference.This has been a rigorous and comprehensive process. The Australian people can be confident the work has been done to ensure a voice that works, a voice that makes a practical difference, a voice that is not another layer of bureaucracy but will hold bureaucracy to account, a voice that will move Australia forward for everyone.When we listen to people, lives change for the better. As Marcia Langton said:Were here to draw a line in the sand and say, This has to change, peoples lives have to improve.We know from the evidence that what improves peoples lives is when they get a say. Lets work together and get this done.","Australian Constitution: Aboriginal and Torres Strait Islander Voice","QUESTIONS WITHOUT NOTICE","/hansard/chamber.xscript/debate[7]/subdebate.1[2]/answer/talk.text/body/p[1]","Ms BURNEY (Barton—Minister for Indigenous Australians) ","(14:05):"
149,1,0,0,0,1,"Ley, Sussan Penelope MP","00AMN","Farrer","LP","N/A",2233," My question is to the Prime Minister. The Prime Minister promised 97 times before the election that he would cut power prices by $275 per year—a promise he continued to make, 28 times, after Russia invaded Ukraine. Will the Prime Minister finally admit he has broken his promise?","Energy","QUESTIONS WITHOUT NOTICE","/hansard/chamber.xscript/debate[7]/subdebate.1[3]/question/talk.text/body/p","Ms LEY (Farrer—Deputy Leader of the Opposition) ","(14:08):"
150,0,1,0,0,1,"Albanese, Anthony MP","R36","Grayndler","ALP","N/A",2233," I thank the Deputy Leader of the Liberal Party for her question. Its not surprising its question 2. I foreshadow that when the shadow Treasurer asks a question today Im going to give the Treasurer a go today at question 4.Im asked about the pressure on energy prices and the context we have. None other than former WA Liberal Premier—when the Liberal Party had more than two people in the Legislative Assembly!—Richard Court said that the past decade of national energy policy has been a slow-moving trainwreck. Jennifer Westacott from the Business Council of Australia said:… weve not done the work that we should have done for the last decade. … weve really made a mess of energy policy.Dominic Perrottet—do you remember him? Hes the bloke who wont be seen anywhere near this fellow opposite me. But there are two days to go! Dont miss the opportunity! I was in Monaro this morning—","Energy","QUESTIONS WITHOUT NOTICE","/hansard/chamber.xscript/debate[7]/subdebate.1[3]/answer/talk.text/body/p[1]","Mr ALBANESE (Grayndler—Prime Minister) ","(14:08):"
151,0,1,0,0,1,"MemberInterjecting",53517,"N/A","N/A","N/A","N/A"," The Prime Minister will pause and Ill hear from—","Energy","QUESTIONS WITHOUT NOTICE","/hansard/chamber.xscript/debate[7]/subdebate.1[3]/answer/talk.text/body/p[5]","N/A","N/A"
152,0,1,0,0,1,"Mr Littleproud ",265585,"N/A","N/A","N/A","N/A","Mr Littleproud interjecting—","Energy","QUESTIONS WITHOUT NOTICE","/hansard/chamber.xscript/debate[7]/subdebate.1[3]/answer/talk.text/body/a[1]/p","N/A","N/A"
153,0,1,0,0,1,"MemberInterjecting",53517,"N/A","N/A","N/A","N/A"," The Leader of The Nationals! Im trying to hear the Deputy Leader of the Liberal Party.","Energy","QUESTIONS WITHOUT NOTICE","/hansard/chamber.xscript/debate[7]/subdebate.1[3]/answer/talk.text/body/p[6]","N/A","N/A"
154,0,1,0,0,1,"MemberInterjecting","00AMN","N/A","N/A","N/A","N/A","Ms Ley: I raise a point of order on relevance. The Prime Minister has not mentioned the commitment to reduce power prices once. I believe hes flouting your ruling. I ask you to bring him back to the question or sit him down.","Energy","QUESTIONS WITHOUT NOTICE","/hansard/chamber.xscript/debate[7]/subdebate.1[3]/answer/talk.text/body/p[7]","N/A","N/A"
155,0,1,0,0,1,"MemberInterjecting",53517,"N/A","N/A","N/A","N/A"," I thank the deputy leader for her assistance. I always enjoy her contributions, so I appreciate her assistance. I havent made a ruling yet. Your point of order was on relevance. The Prime Minister has been going for one minute. The question was about power prices and was related to the war in Ukraine and to his commitment, so Im going to listen carefully to what he says. He is talking about energy prices and quotes around energy prices, so he is being relevant, but Ill make sure that he sticks to the question. I give him the call.","Energy","QUESTIONS WITHOUT NOTICE","/hansard/chamber.xscript/debate[7]/subdebate.1[3]/answer/talk.text/body/p[8]","N/A","N/A"
156,0,1,0,0,1,"MemberContinuation","R36","N/A","N/A","N/A","N/A","Mr ALBANESE: I certainly will, Mr Speaker. But I do note that a New South Wales Liberal Party member just objected to even the words Dominic Perrottet being mentioned in this chamber—","Energy","QUESTIONS WITHOUT NOTICE","/hansard/chamber.xscript/debate[7]/subdebate.1[3]/answer/talk.text/body/p[9]","N/A","N/A"
157,0,1,0,0,1,"MemberInterjecting",53517,"N/A","N/A","N/A","N/A"," The Prime Minister will continue with his answer.","Energy","QUESTIONS WITHOUT NOTICE","/hansard/chamber.xscript/debate[7]/subdebate.1[3]/answer/talk.text/body/p[10]","N/A","N/A"
158,0,1,0,0,1,"MemberContinuation","R36","N/A","N/A","N/A","N/A","Mr ALBANESE: but this is what the New South Wales Premier had to say:The issue here, that NSW, Victoria, Queensland and South Australia are dealing with now, has been the ideological war when it comes to climate change and energy policy in this country, and that has led to a lack of private sector investment …Why is it that, across other parliaments, the coalition and the Labor Party understand that this is about—","Energy","QUESTIONS WITHOUT NOTICE","/hansard/chamber.xscript/debate[7]/subdebate.1[3]/answer/talk.text/body/p[11]","N/A","N/A"
159,0,1,0,0,1,"Mr Ted OBrien ",138932,"N/A","N/A","N/A","N/A","Mr Ted OBrien interjecting—","Energy","QUESTIONS WITHOUT NOTICE","/hansard/chamber.xscript/debate[7]/subdebate.1[3]/answer/talk.text/body/a[2]/p","N/A","N/A"
160,0,1,0,0,1,"MemberInterjecting",53517,"N/A","N/A","N/A","N/A"," Order, the member for Fairfax! The Prime Minister will pause.","Energy","QUESTIONS WITHOUT NOTICE","/hansard/chamber.xscript/debate[7]/subdebate.1[3]/answer/talk.text/body/p[14]","N/A","N/A"
161,0,1,0,0,1,"MemberInterjecting",138932,"N/A","N/A","N/A","N/A","Mr Ted OBrien: Hes not answering the question.","Energy","QUESTIONS WITHOUT NOTICE","/hansard/chamber.xscript/debate[7]/subdebate.1[3]/answer/talk.text/body/p[15]","N/A","N/A"
162,0,1,0,0,1,"MemberInterjecting",53517,"N/A","N/A","N/A","N/A"," The member for Fairfax!","Energy","QUESTIONS WITHOUT NOTICE","/hansard/chamber.xscript/debate[7]/subdebate.1[3]/answer/talk.text/body/p[16]","N/A","N/A"
163,0,1,0,0,1,"Government members ","N/A","N/A","N/A","N/A","N/A","Government members interjecting—","Energy","QUESTIONS WITHOUT NOTICE","/hansard/chamber.xscript/debate[7]/subdebate.1[3]/answer/talk.text/body/p[17]","N/A","N/A"
164,0,1,0,0,1,"MemberInterjecting",53517,"N/A","N/A","N/A","N/A"," Order! The Prime Minister will pause. Member on my right! The member for Fairfax is close to me; I am hearing him. Trust me, Im hearing him. If he continues to interject in that way, I will warn him.","Energy","QUESTIONS WITHOUT NOTICE","/hansard/chamber.xscript/debate[7]/subdebate.1[3]/answer/talk.text/body/p[18]","N/A","N/A"
165,0,1,0,0,1,"Government members ","N/A","N/A","N/A","N/A","N/A","Government members interjecting—","Energy","QUESTIONS WITHOUT NOTICE","/hansard/chamber.xscript/debate[7]/subdebate.1[3]/answer/talk.text/body/p[19]","N/A","N/A"
166,0,1,0,0,1,"Mr Bowen ","DZS","N/A","N/A","N/A","N/A","Mr Bowen interjecting—","Energy","QUESTIONS WITHOUT NOTICE","/hansard/chamber.xscript/debate[7]/subdebate.1[3]/answer/talk.text/body/a[3]/p","N/A","N/A"
167,0,1,0,0,1,"MemberInterjecting",53517,"N/A","N/A","N/A","N/A"," Order! Members on my right! The Minister for Climate Change and Energy will cease interjecting as well. Im going to ask the Prime Minister to return to the question with his answer.","Energy","QUESTIONS WITHOUT NOTICE","/hansard/chamber.xscript/debate[7]/subdebate.1[3]/answer/talk.text/body/p[20]","N/A","N/A"
168,0,1,0,0,1,"MemberContinuation","R36","N/A","N/A","N/A","N/A","Mr ALBANESE: Im asked about the issue of energy prices, and, very directly, the war—Russias illegal war—against Ukraine was raised by the deputy leader in her question, and then they refuse to acknowledge that the ongoing impact of that war has had an impact on global energy prices. That is just a fact.","Energy","QUESTIONS WITHOUT NOTICE","/hansard/chamber.xscript/debate[7]/subdebate.1[3]/answer/talk.text/body/p[21]","N/A","N/A"
