index,question_flag,answer_flag,interjection_flag,speech_flag,chamber_flag,name,name.id,electorate,party,role,page.no,content,subdebateinfo,debateinfo,path,Speaker,Time
465,0,0,0,1,1,"Gorman, Patrick MP",74519,"Perth","ALP","N/A",2247," After that performance, arent we lucky we didnt have another 10 months of that mob in government—the not my job coalition. We are so fortunate that the Australian people chose to give them the time in opposition to think about the failures that they left behind and what they need to do to reform themselves. If we want to talk about the first 10 months, if we want to compare notes, lets have a look at the first 10 months of the Leader of the Opposition when he was health minister.In his first 10 months, health minister Peter Dutton offered Australia a $7 GP tax. He was trying to make it more expensive for every Australian to go to the doctor. It was a fundamental assault on Medicare. That was the first 10 months of the Leader of the Opposition when he was health minister.","Albanese Government","MATTERS OF PUBLIC IMPORTANCE","/hansard/chamber.xscript/debate[11]/subdebate.1/speech[3]/talk.text/body/p[1]","Mr GORMAN (Perth—Assistant Minister to the Prime Minister) ","(15:21):"
466,0,0,0,1,1,"MemberInterjecting",248181,"N/A","N/A","N/A","N/A","The DEPUTY SPEAKER ( Ms Claydon ): Is there a point of order? What is your point of order?","Albanese Government","MATTERS OF PUBLIC IMPORTANCE","/hansard/chamber.xscript/debate[11]/subdebate.1/speech[3]/talk.text/body/p[3]","N/A","N/A"
467,0,0,0,1,1,"MemberInterjecting",218019,"N/A","N/A","N/A","N/A","Mr Hogan: Relevance. The MPI is on the first 10 months of this government.The DEPUTY SPEAKER: The Assistant Minister to the Prime Minister is being entirely relevant to the very broad terms of the matter of public importance, and you know that as well as I do, Member for Page, so I wouldnt jump up again.","Albanese Government","MATTERS OF PUBLIC IMPORTANCE","/hansard/chamber.xscript/debate[11]/subdebate.1/speech[3]/talk.text/body/p[4]","N/A","N/A"
468,0,0,0,1,1,"Mr Repacholi ",298840,"N/A","N/A","N/A","N/A","Mr Repacholi interjecting—The DEPUTY SPEAKER: Member for Longman?","Albanese Government","MATTERS OF PUBLIC IMPORTANCE","/hansard/chamber.xscript/debate[11]/subdebate.1/speech[3]/talk.text/body/a[1]/p","N/A","N/A"
469,0,0,0,1,1,"MemberInterjecting",201906,"N/A","N/A","N/A","N/A","Mr Young: If the member for Hunter wants to keep interjecting, could he do it from his chair?The DEPUTY SPEAKER: Ill be the person who determines interjections from where anyone is sitting, and if you interject, even in your seat, Ill pull you up. Likewise, the member for Hunter will not be interjecting from his seat, whether hes in his proper or the one hes currently sitting in. Now, Id really like to hear from the Assistant Minister to the Prime Minister.","Albanese Government","MATTERS OF PUBLIC IMPORTANCE","/hansard/chamber.xscript/debate[11]/subdebate.1/speech[3]/talk.text/body/p[7]","N/A","N/A"
470,0,0,0,1,1,"MemberContinuation",74519,"N/A","N/A","N/A","N/A","Mr GORMAN: It is entirely relevant, because in the last 10 months of this government we have been cleaning up the 10 years of mess that was left by those opposite, and that mess started when the Leader of the Opposition was appointed as the health minister. He offered Australia a $7 GP tax—a fundamental assault on Medicare. He tried to increase the cost of medicines by $5. And then he had his big, bright policy idea: that we would charge people when they rock up to emergency departments.That was what happened in the first 10 months when the now Leader of the Opposition was in the position of health minister. No wonder one of his other achievements in his first 10 months was to be voted the worst-ever health minister.But we can continue. Lets look at his 10 months as opposition leader. The Leader of the Opposition, in his first 10 months, couldnt even get invited to the campaign launch of the New South Wales Liberal Party. He showed his fantastic judgement in the first 10 months when he called the robodebt royal commission a witch-hunt, when, as it has turned out, it has exposed so much of the failure that sat underneath the Morrison-Abbott-Turnbull government. We found ourselves seeing the Leader of the Opposition defending the secret ministries. Then, when it came to whether or not there were any new policy ideas from the Leader of the Opposition, he found that he didnt even have his own policy ideas. He was still stuck with Tony Abbotts one-word policy prescription, no—or, to turn it into a three-word slogan, no, no, no.I have to wonder why we are having an MPI about the last 10 months, because, if we were to talk about the last 11 months, maybe we would also be covering things such as the secret ministries scandal, which saw the then Prime Minister, the member for Cook, holding five secret ministries. There were two secret assistant ministers, which we only found out about last week. None of them had the guts to stand up and tell us about the two secret assistant ministers operating in the Morrison government. I thought it was interesting that the shadow minister opposite didnt mention that the inflation problem started on their watch, didnt mention that interest rates started increasing on their watch and didnt mention that, when they walked out the door, they left a trillion dollars of Liberal debt for the Australian taxpayers to repay.Of course, Im disappointed that the shadow minister is no longer here, because they also left us with a secret energy price increase. Im fascinated by this, because what we know about the secret energy price increase is, firstly, that the shadow minister, when he was asked on 26 October last year whether he had known before the election that prices would rise, said, No, I didnt. A week later, on 1 November, when he was asked if he had signed the regulation delaying notification of the price rise, he said, I did, as it was recommended by the industry department. So we have someone who is lecturing the current government when his own record was one of deception, hiding things from the Australian people before an election, and then refusing after the election to even own up to it.","Albanese Government","MATTERS OF PUBLIC IMPORTANCE","/hansard/chamber.xscript/debate[11]/subdebate.1/speech[3]/talk.text/body/p[9]","N/A","N/A"
471,0,0,0,1,1,"Mr Hogan ",218019,"N/A","N/A","N/A","N/A","Mr Hogan interjecting—","Albanese Government","MATTERS OF PUBLIC IMPORTANCE","/hansard/chamber.xscript/debate[11]/subdebate.1/speech[3]/talk.text/body/a[2]/p","N/A","N/A"
472,0,0,0,1,1,"MemberContinuation",74519,"N/A","N/A","N/A","N/A","Mr GORMAN: I will take the interjection from those opposite, who are saying they want to hear more about what the Albanese government is doing for the people of Australia. I take that interjection. Lets look at it. We supported an increase—again, because of a choice the Australian people made—to the minimum wage. We said, Absolutely we support it. Those opposite went to the election saying they didnt support an increase in the minimum wage. We have backed a pay increase for aged-care workers, 15 per cent, so that they start to get the pay they deserve for the work for which we have for far too long said, Thank you, but not given them the pay that they deserve. Weve cut the price of PBS medicines down to $30, saving a family with two or three scripts a month up to $450 a year, and in 100 days from today we will see child care cheaper for 1.2 million Australian families. I will contrast that with what we saw from those opposite, who proudly presided over a 49 per cent increase in the cost of child care for working families in Australia over 10 years.Also, when it was clear that we needed to take urgent action because of the challenges in the energy market, we brought this parliament back on 15 December, brought legislation into this place and asked every member: did they want to vote for cheaper electricity or did they want to vote for higher energy prices? Those in the opposition voted for higher energy prices. They voted against price relief for families in their own electorates. Then they come in here with stories about their constituents, and never do they say that they have explained to those constituents or to businesses that they voted against energy price relief. They simply ignore the fact that, when they were asked to act and to do their fundamental job of voting for legislation in this place, they chose not to vote for energy price relief.I know that we have some fantastic speakers on this MPI coming—maybe not on that side, but Im pretty confident on this side. As to some of the other things that have been achieved, I want to commend the work that the member for Macquarie has done in making sure that we once again value our arts and creative industries. I commend her and the minister for their work on the Revive cultural policy, a fantastic piece of work that had been missing for 10 years. We didnt have a national cultural policy. We didnt get rid of it; I dont know who did. But Im pleased that we have a government that once again believes in making sure we have a proper cultural policy with new money.I want to commend the work of the member for Jagajaga, whos been out there campaigning for cheaper child care. She knows its not just about helping families with cost of living; its about investing in our children and the productivity of our economy. Shes been a leading campaigner for that.I want to commend the work of the member for Lalor, as the Chief Government Whip, who has made sure so much of the governments legislative agenda when it comes to Jobs and Skills Australia, to those 20,000 university places, to legislation to open the doors of opportunity—again, people on this side are committed to making sure—An opposition member: Give the member for Hunter a rap!","Albanese Government","MATTERS OF PUBLIC IMPORTANCE","/hansard/chamber.xscript/debate[11]/subdebate.1/speech[3]/talk.text/body/p[14]","N/A","N/A"
473,0,0,0,1,1,"MemberContinuation",74519,"N/A","N/A","N/A","N/A","Mr GORMAN: I will give the member for Hunter a rap. He never left a trillion dollars of debt! The member for Hunter didnt spend $3.4 billion on submarines that were never built. Hes never spent a billion dollars on government advertising. He is a fantastic advocate for his region, and he is also a strong advocate for manufacturing jobs. He has been, in this place, time and time again, asking those opposite to back the National Reconstruction Fund so that we can once again back manufacturing in this country, as opposed to those opposite— (Time expired)","Albanese Government","MATTERS OF PUBLIC IMPORTANCE","/hansard/chamber.xscript/debate[11]/subdebate.1/speech[3]/talk.text/body/p[20]","N/A","N/A"
474,0,0,1,0,1,"Claydon, Sharon MP ",248181,"Newcastle","ALP","N/A",2247,"2247 Claydon, Sharon MP (The DEPUTY SPEAKER) 248181 Newcastle ALP","Albanese Government","MATTERS OF PUBLIC IMPORTANCE","/hansard/chamber.xscript/debate[11]/subdebate.1/speech[3]/interjection[1]/talk.start","N/A","N/A"
475,0,0,1,0,1,"Hogan, Kevin MP",218019,"Page","NATS","N/A",2247,"2247 Hogan, Kevin MP 218019 Page NATS","Albanese Government","MATTERS OF PUBLIC IMPORTANCE","/hansard/chamber.xscript/debate[11]/subdebate.1/speech[3]/interjection[2]/talk.start","N/A","N/A"
476,0,0,1,0,1,"DEPUTY SPEAKER, The",10000,"N/A","N/A","N/A",2247,"2247 DEPUTY SPEAKER, The 10000","Albanese Government","MATTERS OF PUBLIC IMPORTANCE","/hansard/chamber.xscript/debate[11]/subdebate.1/speech[3]/interjection[3]/talk.start","N/A","N/A"
477,0,0,1,0,1,"2247 Mr Repacholi ","N/A","N/A","N/A","N/A",2247,"2247 Mr Repacholi interjecting—","Albanese Government","MATTERS OF PUBLIC IMPORTANCE","/hansard/chamber.xscript/debate[11]/subdebate.1/speech[3]/interjection[4]/talk.start","N/A","N/A"
478,0,0,1,0,1,"DEPUTY SPEAKER, The",10000,"N/A","N/A","N/A",2247,"2247 DEPUTY SPEAKER, The 10000","Albanese Government","MATTERS OF PUBLIC IMPORTANCE","/hansard/chamber.xscript/debate[11]/subdebate.1/speech[3]/interjection[5]/talk.start","N/A","N/A"
479,0,0,1,0,1,"Young, Terry MP",201906,"Longman","LNP","N/A",2247,"2247 Young, Terry MP 201906 Longman LNP","Albanese Government","MATTERS OF PUBLIC IMPORTANCE","/hansard/chamber.xscript/debate[11]/subdebate.1/speech[3]/interjection[6]/talk.start","N/A","N/A"
480,0,0,1,0,1,"DEPUTY SPEAKER, The",10000,"N/A","N/A","N/A",2247,"2247 DEPUTY SPEAKER, The 10000","Albanese Government","MATTERS OF PUBLIC IMPORTANCE","/hansard/chamber.xscript/debate[11]/subdebate.1/speech[3]/interjection[7]/talk.start","N/A","N/A"
481,0,0,1,0,1,"2248 Mr Hogan ","N/A","N/A","N/A","N/A",2248,"2248 Mr Hogan interjecting—","Albanese Government","MATTERS OF PUBLIC IMPORTANCE","/hansard/chamber.xscript/debate[11]/subdebate.1/speech[3]/interjection[8]/talk.start","N/A","N/A"
482,0,0,0,1,1,"Hogan, Kevin MP",218019,"Page","NATS","N/A",2248," I can see some very big smiles—and so there should be—on some of the backbenchers opposite, because that was a woeful performance and there will be some opportunities open up the front benches after that terrible performance by the assistant minister. When you get an opportunity to talk about what your government has done in the first 10 months of its operation, youd think you would spend some time saying with pride what you think the government has done. In that woeful performance he spent about 7½ to eight minutes having a crack at the other side—and some of it was on stuff from 10 years ago. There were some big smiles on some faces on the backbench because that was woeful.Lets go to the first 10 months of this governments performance, which, as well, has been woeful. Im going to start with one thing that is quite traumatic; I feel very strongly about this. When the Prime Minister says its been a pretty good 10 months, it hasnt been a pretty good 10 months in those remote communities where the cashless welfare card has been removed. The cashless welfare card was having some real practical impacts on the ground. I know one of the communities quite well and have been to one of those communities quite a lot as well. Those communities were telling me they did think the cashless welfare card was working, and the stats prove it. Since that cashless welfare card has been removed from some of those remote and regional communities, domestic violence is up, child abuse is up—A government member: Wheres the source!","Albanese Government","MATTERS OF PUBLIC IMPORTANCE","/hansard/chamber.xscript/debate[11]/subdebate.1/speech[4]/talk.text/body/p[1]","Mr HOGAN (Page—Deputy Manager of Opposition Business) ","(15:31):"
483,0,0,0,1,1,"MemberContinuation",218019,"N/A","N/A","N/A","N/A","Mr HOGAN: I take that interjection. I say: talk to the communities. Im quite shocked about the ideology of those opposite. Their blind ideology means women are getting raped and children are getting bashed that werent beforehand—","Albanese Government","MATTERS OF PUBLIC IMPORTANCE","/hansard/chamber.xscript/debate[11]/subdebate.1/speech[4]/talk.text/body/p[4]","N/A","N/A"
484,0,0,0,1,1,"MemberInterjecting",248181,"N/A","N/A","N/A","N/A","The DEPUTY SPEAKER ( Ms Claydon ): The member for Lalor, on a point of order?","Albanese Government","MATTERS OF PUBLIC IMPORTANCE","/hansard/chamber.xscript/debate[11]/subdebate.1/speech[4]/talk.text/body/p[5]","N/A","N/A"
485,0,0,0,1,1,"MemberInterjecting",249224,"N/A","N/A","N/A","N/A","Ms Ryan: I would ask the member to withdraw.","Albanese Government","MATTERS OF PUBLIC IMPORTANCE","/hansard/chamber.xscript/debate[11]/subdebate.1/speech[4]/talk.text/body/p[6]","N/A","N/A"
486,0,0,0,1,1,"MemberContinuation",218019,"N/A","N/A","N/A","N/A","Mr HOGAN: I will not withdraw. I encourage the member for Lalor, at 10 oclock on Monday morning—The DEPUTY SPEAKER: It would—","Albanese Government","MATTERS OF PUBLIC IMPORTANCE","/hansard/chamber.xscript/debate[11]/subdebate.1/speech[4]/talk.text/body/p[7]","N/A","N/A"
487,0,0,0,1,1,"MemberContinuation",218019,"N/A","N/A","N/A","N/A","Mr HOGAN: to come to a meeting. I will tell the member where the meeting is, and the people at that meeting—The DEPUTY SPEAKER: Excuse me! Member for Page, it would assist the House—","Albanese Government","MATTERS OF PUBLIC IMPORTANCE","/hansard/chamber.xscript/debate[11]/subdebate.1/speech[4]/talk.text/body/p[9]","N/A","N/A"
488,0,0,0,1,1,"MemberContinuation",218019,"N/A","N/A","N/A","N/A","Mr HOGAN: I will not withdraw.The DEPUTY SPEAKER: Would you like to defy the ruling of the chair?","Albanese Government","MATTERS OF PUBLIC IMPORTANCE","/hansard/chamber.xscript/debate[11]/subdebate.1/speech[4]/talk.text/body/p[11]","N/A","N/A"
489,0,0,0,1,1,"MemberContinuation",218019,"N/A","N/A","N/A","N/A","Mr HOGAN: I am not going to withdraw that statement.The DEPUTY SPEAKER: Then you are moving dissent from my ruling. Is that what youre moving? I think you should consider your situation. It would be a courtesy to the House if you would withdraw.","Albanese Government","MATTERS OF PUBLIC IMPORTANCE","/hansard/chamber.xscript/debate[11]/subdebate.1/speech[4]/talk.text/body/p[13]","N/A","N/A"
490,0,0,0,1,1,"MemberContinuation",218019,"N/A","N/A","N/A","N/A","Mr HOGAN: I will withdraw as a courtesy to you, Deputy Speaker. But I invite the member for Lalor, on Monday morning at 10 oclock, to come to a meeting where there will be representatives of those communities who will be talking about the real impact of it. I invite you to come to that meeting if you so wish.The DEPUTY SPEAKER: Excuse me! The member has withdrawn his statement, but do you have another point of order?","Albanese Government","MATTERS OF PUBLIC IMPORTANCE","/hansard/chamber.xscript/debate[11]/subdebate.1/speech[4]/talk.text/body/p[15]","N/A","N/A"
491,0,0,0,1,1,"MemberInterjecting",249224,"N/A","N/A","N/A","N/A","Ms Ryan: Im happier with an unconditional withdrawal.The DEPUTY SPEAKER: No. I have accepted there has been a withdrawal, and—","Albanese Government","MATTERS OF PUBLIC IMPORTANCE","/hansard/chamber.xscript/debate[11]/subdebate.1/speech[4]/talk.text/body/p[17]","N/A","N/A"
492,0,0,0,1,1,"MemberContinuation",218019,"N/A","N/A","N/A","N/A","Mr HOGAN: I withdraw it.The DEPUTY SPEAKER: The member for Page, I am listening very, very carefully.","Albanese Government","MATTERS OF PUBLIC IMPORTANCE","/hansard/chamber.xscript/debate[11]/subdebate.1/speech[4]/talk.text/body/p[19]","N/A","N/A"
493,0,0,0,1,1,"MemberContinuation",218019,"N/A","N/A","N/A","N/A","Mr HOGAN: And I invite the other members opposite who said where are you getting this information from or these statistics from. I will spread the information about where this meeting is at 10 oclock on Monday morning. There are going to be community members from these communities who will tell their stories, and I will invite you to come. It will be interesting to see which of you members do turn up to that who dont believe whats been going on in these communities. Again, I think the blind ideology that you have had about that card has caused great distress in those communities, and I think it certainly hasnt been a pretty good 10 months for those communities.Obviously that topic has taken up more time than I thought it would, but there are other things I do wish to mention very briefly. This government said that its energy policy was the most modelled policy by an opposition in history. The Ukraine war had started, when they came into government, and they were saying they were going to lower everyones electricity bills. Again, it hasnt been a good 10 months for anyone who has to pay an energy bill. The mortgages—they actually said mortgages would be lower under them when they came into government, and, again, it hasnt been a great 10 months for any mortgage repayment person in this country. So theres a lot that this government has to be ashamed of in its first 10 months.","Albanese Government","MATTERS OF PUBLIC IMPORTANCE","/hansard/chamber.xscript/debate[11]/subdebate.1/speech[4]/talk.text/body/p[21]","N/A","N/A"
494,0,0,1,0,1,"Claydon, Sharon MP ",248181,"Newcastle","ALP","N/A",2249,"2249 Claydon, Sharon MP (The DEPUTY SPEAKER) 248181 Newcastle ALP","Albanese Government","MATTERS OF PUBLIC IMPORTANCE","/hansard/chamber.xscript/debate[11]/subdebate.1/speech[4]/interjection[1]/talk.start","N/A","N/A"
495,0,0,1,0,1,"Ryan, Joanne MP",249224,"Lalor","ALP","N/A",2249,"2249 Ryan, Joanne MP 249224 Lalor ALP","Albanese Government","MATTERS OF PUBLIC IMPORTANCE","/hansard/chamber.xscript/debate[11]/subdebate.1/speech[4]/interjection[2]/talk.start","N/A","N/A"
496,0,0,1,0,1,"DEPUTY SPEAKER, The",10000,"N/A","N/A","N/A",2249,"2249 DEPUTY SPEAKER, The 10000","Albanese Government","MATTERS OF PUBLIC IMPORTANCE","/hansard/chamber.xscript/debate[11]/subdebate.1/speech[4]/interjection[3]/talk.start","N/A","N/A"
497,0,0,1,0,1,"DEPUTY SPEAKER, The",10000,"N/A","N/A","N/A",2249,"2249 DEPUTY SPEAKER, The 10000","Albanese Government","MATTERS OF PUBLIC IMPORTANCE","/hansard/chamber.xscript/debate[11]/subdebate.1/speech[4]/interjection[4]/talk.start","N/A","N/A"
498,0,0,1,0,1,"DEPUTY SPEAKER, The",10000,"N/A","N/A","N/A",2249,"2249 DEPUTY SPEAKER, The 10000","Albanese Government","MATTERS OF PUBLIC IMPORTANCE","/hansard/chamber.xscript/debate[11]/subdebate.1/speech[4]/interjection[5]/talk.start","N/A","N/A"
499,0,0,1,0,1,"DEPUTY SPEAKER, The",10000,"N/A","N/A","N/A",2249,"2249 DEPUTY SPEAKER, The 10000","Albanese Government","MATTERS OF PUBLIC IMPORTANCE","/hansard/chamber.xscript/debate[11]/subdebate.1/speech[4]/interjection[6]/talk.start","N/A","N/A"
500,0,0,1,0,1,"DEPUTY SPEAKER, The",10000,"N/A","N/A","N/A",2249,"2249 DEPUTY SPEAKER, The 10000","Albanese Government","MATTERS OF PUBLIC IMPORTANCE","/hansard/chamber.xscript/debate[11]/subdebate.1/speech[4]/interjection[7]/talk.start","N/A","N/A"
501,0,0,1,0,1,"Ryan, Joanne MP",249224,"Lalor","ALP","N/A",2249,"2249 Ryan, Joanne MP 249224 Lalor ALP","Albanese Government","MATTERS OF PUBLIC IMPORTANCE","/hansard/chamber.xscript/debate[11]/subdebate.1/speech[4]/interjection[8]/talk.start","N/A","N/A"
502,0,0,1,0,1,"DEPUTY SPEAKER, The",10000,"N/A","N/A","N/A",2249,"2249 DEPUTY SPEAKER, The 10000","Albanese Government","MATTERS OF PUBLIC IMPORTANCE","/hansard/chamber.xscript/debate[11]/subdebate.1/speech[4]/interjection[9]/talk.start","N/A","N/A"
503,0,0,1,0,1,"DEPUTY SPEAKER, The",10000,"N/A","N/A","N/A",2249,"2249 DEPUTY SPEAKER, The 10000","Albanese Government","MATTERS OF PUBLIC IMPORTANCE","/hansard/chamber.xscript/debate[11]/subdebate.1/speech[4]/interjection[10]/talk.start","N/A","N/A"
504,0,0,0,1,1,"Thwaites, Kate MP",282212,"Jagajaga","ALP","N/A",2249," I am more than happy to spend a Thursday afternoon standing up here talking about what this government has achieved over the last 10 months, because I have to tell you there has been a big change both in this place and outside of this place. Still, when Im in my community and talking to people, it is absolutely the case that people walk up to me and say, Look, I just want to say: you guys are doing a really good job, or, I just want to say, its so impressive having the adults in charge again. I just want to say how refreshing that feels. So thats what is happening in our community at the moment, and its happening because this government is getting on with the job of all the things that those opposite ignored, and not just ignored for 10 months; they ignored them for nearly 10 years!There is no clearer example of this than those opposites drift and denial when it comes to climate change. Deputy Speaker, I cannot tell you how many times people in my community came up to me in despair under the previous government, in absolute despair about where this country was heading, in absolute despair about the future of their children, of this country and of our entire world, because what they could see was that nothing was happening—absolutely nothing under those opposite. Those opposite dont even believe climate change is real. The member for New England has made that very, very clear. So, as a result of all of that, this government came in with a very big task, and we have been getting on with it.In the last 10 months, our government has delivered this countrys first real climate change policy in a decade. That is a massive achievement. We know we havent got it all done yet. We know how much there is still to do, but we are on the right track. We are on the track that gives this country a future, which helps build the jobs and the industries of the future, which helps make sure that we are a clean, green energy superpower.Over the past 10 years—10 months! Not 10 years. Over the past 10 months—","Albanese Government","MATTERS OF PUBLIC IMPORTANCE","/hansard/chamber.xscript/debate[11]/subdebate.1/speech[5]/talk.text/body/p[1]","Ms THWAITES (Jagajaga) ","(15:36):"
505,0,0,0,1,1,"MemberInterjecting",144732,"N/A","N/A","N/A","N/A","Ms Payne: It feels like 10 years with all the things weve done.","Albanese Government","MATTERS OF PUBLIC IMPORTANCE","/hansard/chamber.xscript/debate[11]/subdebate.1/speech[5]/talk.text/body/p[5]","N/A","N/A"
506,0,0,0,1,1,"MemberContinuation",282212,"N/A","N/A","N/A","N/A","Ms THWAITES: As the member for Canberra says, it feels like 10 years because weve been so busy. We have been so busy over the last 10 months—","Albanese Government","MATTERS OF PUBLIC IMPORTANCE","/hansard/chamber.xscript/debate[11]/subdebate.1/speech[5]/talk.text/body/p[6]","N/A","N/A"
507,0,0,0,1,1,"MemberInterjecting",219646,"N/A","N/A","N/A","N/A","Mr McCormack: Tell us how good you are!","Albanese Government","MATTERS OF PUBLIC IMPORTANCE","/hansard/chamber.xscript/debate[11]/subdebate.1/speech[5]/talk.text/body/p[7]","N/A","N/A"
