index,question_flag,answer_flag,interjection_flag,speech_flag,chamber_flag,name,name.id,electorate,party,role,page.no,content,subdebateinfo,debateinfo,path,Speaker,Time
166,0,1,0,0,1,"Bowen, Chris MP","DZS","McMahon","ALP","N/A",70," I thank the honourable member for her question and I acknowledge her interest. I also acknowledge that 82,000 of her constituents are receiving a tax cut this week, which I know everyone would support.In relation to the honourable members question, I also acknowledge her engagement with me on this. As shes aware, I have referred to the Climate Change Authority advice on better methane reporting. I requested that advice as part of our general check-up on reporting, including under the NGER scheme. It is appropriate and important that we properly capture methane emissions and report them appropriately and in accordance with our international obligations; that is right. It is also right that it is a scientifically complicated issue and that there are different views about the way to capture those emissions. There are contested views, and Ive taken the time to work those issues through very carefully—to consider the arguments that are before me. My consideration of those measures is very advanced, and I will be making announcements shortly.","Climate Change","QUESTIONS WITHOUT NOTICE","/hansard/chamber.xscript/debate[12]/subdebate.1[1]/answer/talk.text/body/p[1]","Mr BOWEN (McMahon—Minister for Climate Change and Energy) ","(14:23):"
167,1,0,0,0,1,"Rae, Sam MP",300122,"Hawke","ALP","N/A",70," My question is to the Minister for Climate Change and Energy. How is the Albanese Labor government providing cost-of-living relief, including through lower energy bills? What policies has the government rejected, and why?","Cost of Living: Energy","QUESTIONS WITHOUT NOTICE","/hansard/chamber.xscript/debate[12]/subdebate.1[2]/question/talk.text/body/p","Mr RAE (Hawke) ","(14:24):"
168,0,1,0,0,1,"Bowen, Chris MP","DZS","McMahon","ALP","N/A",70," I thank my honourable friend for the question. As a Victorian, he would know that, as of this week, with the $300 in energy bill relief from the Albanese government and the impact of the Victorian market offer, we are seeing Victorian energy bills, on average, come down by 23 per cent for households and 15 per cent for small businesses. That is how you deliver cost-of-living relief—concrete measures now, not fantasy nuclear reactors in 20 years time.The honourable member asked me how this is different from other approaches. Its different because it reduces prices, rather than increasing them. Its different because it cuts prices, rather than increasing them. This week weve seen more policy from the opposition which pushes prices up. They want to rip up renewables contracts and they want to break up supermarkets. Ripping up renewables contracts puts energy prices up, and breaking up supermarkets puts grocery bills up.We saw the headline in the Australian Financial Review this morning: Former competition regulator Graeme Samuel has savaged Peter Duttons plan to break up supermarket giants, warning it could push up grocery prices for households. We know energy prices have gone up by between $200 and $1,000, and now theyre trying to put grocery prices up as well.","Cost of Living: Energy","QUESTIONS WITHOUT NOTICE","/hansard/chamber.xscript/debate[12]/subdebate.1[2]/answer/talk.text/body/p[1]","Mr BOWEN (McMahon—Minister for Climate Change and Energy) ","(14:25):"
169,0,1,0,0,1,"Mr Violi ",300147,"N/A","N/A","N/A","N/A","Mr Violi interjecting—","Cost of Living: Energy","QUESTIONS WITHOUT NOTICE","/hansard/chamber.xscript/debate[12]/subdebate.1[2]/answer/talk.text/body/a[1]/p","N/A","N/A"
170,0,1,0,0,1,"MemberInterjecting",53517,"N/A","N/A","N/A","N/A"," The member for Casey will cease interjecting.","Cost of Living: Energy","QUESTIONS WITHOUT NOTICE","/hansard/chamber.xscript/debate[12]/subdebate.1[2]/answer/talk.text/body/p[4]","N/A","N/A"
171,0,1,0,0,1,"MemberContinuation","DZS","N/A","N/A","N/A","N/A","Mr BOWEN: Its not just the direct impact; theres also the impact on taxpayers. The opposition wants to create not one but two new government organisations to run its nuclear policy, which would add hundreds of billions of dollars of public debt, at the expense of taxpayers.A couple of weeks ago the shadow Treasurer said hes not having any subsidies on his watch—none. Hes dead against subsidies. When he was asked about his policy, he said: Dont worry about it. Its all off budget. That makes it okay. But, on 5 June this year, almost exactly a month ago, the shadow Treasurer had a different view about off-budget spending. He was talking about off-budget spending and he said, Billions of dollars of off-budget funds are causing higher inflation, higher interest rates and higher taxes. So $45 billion off budget is terrible but $600 billion off budget is hunky-dory. Its hunky-dory according to the shadow Treasurer.","Cost of Living: Energy","QUESTIONS WITHOUT NOTICE","/hansard/chamber.xscript/debate[12]/subdebate.1[2]/answer/talk.text/body/p[5]","N/A","N/A"
172,0,1,0,0,1,"Dr Chalmers ",37998,"N/A","N/A","N/A","N/A","Dr Chalmers interjecting—","Cost of Living: Energy","QUESTIONS WITHOUT NOTICE","/hansard/chamber.xscript/debate[12]/subdebate.1[2]/answer/talk.text/body/a[2]/p","N/A","N/A"
173,0,1,0,0,1,"MemberInterjecting",53517,"N/A","N/A","N/A","N/A"," The Treasurer will cease interjecting.","Cost of Living: Energy","QUESTIONS WITHOUT NOTICE","/hansard/chamber.xscript/debate[12]/subdebate.1[2]/answer/talk.text/body/p[7]","N/A","N/A"
174,0,1,0,0,1,"MemberContinuation","DZS","N/A","N/A","N/A","N/A","Mr BOWEN: When they released their policy, they said:From today, we will be speaking right across the country on the merits of our plan.Have we heard much since? We have the Queensland Liberal National Party conference on the weekend: 173 items, none of them about nuclear power, none about lifting the ban. To be fair—as we know, I like to be fair—there are more important issues. Theyre debating banning the Aboriginal flag at public events, theyre debating selling the ABC and theyre debating getting rid of mandatory medical certificates for elderly drivers. What a forward-looking vision for our country! It warms the heart. But theres nothing about nuclear, nothing about lifting the ban in Queensland and nothing about energy prices, because this Leader of the Opposition is running a rabble. (Time expired)","Cost of Living: Energy","QUESTIONS WITHOUT NOTICE","/hansard/chamber.xscript/debate[12]/subdebate.1[2]/answer/talk.text/body/p[8]","N/A","N/A"
175,0,0,1,0,1,"70 Mr Violi ","N/A","N/A","N/A","N/A",70,"70 Mr Violi interjecting—","Cost of Living: Energy","QUESTIONS WITHOUT NOTICE","/hansard/chamber.xscript/debate[12]/subdebate.1[2]/answer/interjection[1]/talk.start","N/A","N/A"
176,0,0,1,0,1,"Dick, Milton MP ",53517,"Oxley","ALP","N/A",70,"70 Dick, Milton MP (The SPEAKER) 53517 Oxley ALP","Cost of Living: Energy","QUESTIONS WITHOUT NOTICE","/hansard/chamber.xscript/debate[12]/subdebate.1[2]/answer/interjection[2]/talk.start","N/A","N/A"
177,0,0,1,0,1,"70 Dr Chalmers ","N/A","N/A","N/A","N/A",70,"70 Dr Chalmers interjecting—","Cost of Living: Energy","QUESTIONS WITHOUT NOTICE","/hansard/chamber.xscript/debate[12]/subdebate.1[2]/answer/interjection[3]/talk.start","N/A","N/A"
178,0,0,1,0,1,"Dick, Milton MP ",53517,"Oxley","ALP","N/A",70,"70 Dick, Milton MP (The SPEAKER) 53517 Oxley ALP","Cost of Living: Energy","QUESTIONS WITHOUT NOTICE","/hansard/chamber.xscript/debate[12]/subdebate.1[2]/answer/interjection[4]/talk.start","N/A","N/A"
179,1,0,0,0,1,"Ley, Sussan Penelope MP","00AMN","Farrer","LP","N/A",71," My question is to the Prime Minister. Is the Prime Minister still committed to treaty and truth-telling?","First Nations Australians","QUESTIONS WITHOUT NOTICE","/hansard/chamber.xscript/debate[12]/subdebate.1[3]/question/talk.text/body/p","Ms LEY (Farrer—Deputy Leader of the Opposition) ","(14:28):"
180,0,1,0,0,1,"Albanese, Anthony MP","R36","Grayndler","ALP","N/A",71," I thank the deputy leader for her question. When it comes to treaty there are negotiations taking place at the state level, as Ive said before, so I refer to those previous answers. Once every couple of months, when theyre short of questions in question time, this question pops up. The fact is that those negotiations are at different stages in different states, and that is how treaties are being advanced or not advanced. In Queensland there was some bipartisanship, and in New South Wales there is bipartisanship.","First Nations Australians","QUESTIONS WITHOUT NOTICE","/hansard/chamber.xscript/debate[12]/subdebate.1[3]/answer/talk.text/body/p","Mr ALBANESE (Grayndler—Prime Minister) ","(14:28):"
181,1,0,0,0,1,"Repacholi, Dan MP",298840,"Hunter","ALP","N/A",71," My question is to the Minister for Employment and Workplace Relations. How have the Albanese Labor governments workplace relations reforms delivered better pay and more job security and closed the gender pay gap, after a decade of wages being kept deliberately low?","Workplace Relations","QUESTIONS WITHOUT NOTICE","/hansard/chamber.xscript/debate[12]/subdebate.1[4]/question/talk.text/body/p","Mr REPACHOLI (Hunter) ","(14:29):"
182,0,1,0,0,1,"Burke, Tony MP","DYW","Watson","ALP","N/A",71," I thank the member for Hunter for his question, in particular his commitment to closing the labour hire loophole and delivering same job, same pay.I previously referred to the statistics on the three issues the member for Hunter has gone through. Of the 870,000 jobs created under the Albanese Labor government, more than half a million of them had been full time in a real shift for job security. Wages are now running at 4.1 per cent, whereas they averaged 2.2 per cent under those opposite. And the gender pay gap has never been lower than it is now. But I think to explain the difference that it makes in peoples lives, theres nothing stronger than to go to an individual example, and an individual example of a mine worker in the Hunter—a mine worker by the name of Danielle.In mining, when we talk about the labour hire loophole, its actually one of the ways that the gender pay gap has remained so big in mining because, disproportionately, men in the industry have been directly employed and women in the industry have worked through labour hire. So, disproportionately, you end up with the lower pay scales going to where women are more likely to work.I referred to Danielle in an answer to a question asked by the member for Paterson a few weeks ago. At that point, the company had announced they were going to employ people directly. We didnt yet know what the pay difference would be for those workers. For Danielle, she has now been given confirmation of what her pay change will be as a result of the laws that were changed by this government. It is $33,000 a year. Its $33,000 a year for a woman who works driving trucks at a coal mine in the Hunter—$33,000 a year! On top of that, shes also getting a tax cut of $3,700 a year. For workers like Danielle, this is absolutely life changing. When I called her, she told me it brings her a bit closer to reaching her dream of pulling together a deposit and owning her own home.Being paid more is an essential part of housing affordability and an essential part of cost of living, but those opposite, at every opportunity theyve had, have wanted people to be taxed more and paid less. On this side and with this Prime Minister, the Albanese Labor government is making sure people like Danielle are earning more, and they are keeping more of what they earn. It is life changing, but every one of the changes that have made a difference for Danielle have been something that we have had to fight to get through this parliament, that those opposite have opposed at every single turn. If you support more secure jobs, if you support better pay, if you support closing the gender pay gap then you have to support the exact laws that those opposite are targeting and wanting to repeal.","Workplace Relations","QUESTIONS WITHOUT NOTICE","/hansard/chamber.xscript/debate[12]/subdebate.1[4]/answer/talk.text/body/p[1]","Mr BURKE (Watson—Minister for Employment and Workplace Relations, Minister for the Arts and Leader of the House) ","(14:29):"
183,1,0,0,0,1,"Taylor, Angus MP",231027,"Hume","LP","N/A",71," My question is to the Prime Minister. Will the Prime Minister guarantee that a government he leads will not make any changes to the tax treatment of residential rental properties?","Housing","QUESTIONS WITHOUT NOTICE","/hansard/chamber.xscript/debate[12]/subdebate.1[5]/question/talk.text/body/p","Mr TAYLOR (Hume) ","(14:32):"
184,0,1,0,0,1,"Chalmers, Jim MP",37998,"Rankin","ALP","N/A",71," Thanks to the member for Hume for his question and his dodgy little prop that he thinks is really clever, which hes waving around in the desperate hope that somebody will notice him up there in the press gallery. There are no photographers up there, Gus. As always, youve made a mess of it.","Housing","QUESTIONS WITHOUT NOTICE","/hansard/chamber.xscript/debate[12]/subdebate.1[5]/answer/talk.text/body/p[1]","Dr CHALMERS (Rankin—Treasurer) ","(14:33):"
185,0,1,0,0,1,"MemberInterjecting",53517,"N/A","N/A","N/A","N/A"," The Treasurer will pause.","Housing","QUESTIONS WITHOUT NOTICE","/hansard/chamber.xscript/debate[12]/subdebate.1[5]/answer/talk.text/body/p[2]","N/A","N/A"
186,0,1,0,0,1,"Mr Ramsey ","HWS","N/A","N/A","N/A","N/A","Mr Ramsey interjecting—","Housing","QUESTIONS WITHOUT NOTICE","/hansard/chamber.xscript/debate[12]/subdebate.1[5]/answer/talk.text/body/a[1]/p","N/A","N/A"
187,0,1,0,0,1,"MemberInterjecting",53517,"N/A","N/A","N/A","N/A"," The member for Grey—no; were not having any props. The member for Herberts been trying it on, and the member for Hume. Whatever youre holding up—I cant see it, but its your iPad.","Housing","QUESTIONS WITHOUT NOTICE","/hansard/chamber.xscript/debate[12]/subdebate.1[5]/answer/talk.text/body/p[3]","N/A","N/A"
188,0,1,0,0,1,"Mr Taylor ",231027,"N/A","N/A","N/A","N/A","Mr Taylor interjecting—","Housing","QUESTIONS WITHOUT NOTICE","/hansard/chamber.xscript/debate[12]/subdebate.1[5]/answer/talk.text/body/a[2]/p","N/A","N/A"
189,0,1,0,0,1,"MemberInterjecting",53517,"N/A","N/A","N/A","N/A"," I dont know why you would hold an iPad that way, just concentrate on the answer.","Housing","QUESTIONS WITHOUT NOTICE","/hansard/chamber.xscript/debate[12]/subdebate.1[5]/answer/talk.text/body/p[4]","N/A","N/A"
190,0,1,0,0,1,"Mr Pasin ",240756,"N/A","N/A","N/A","N/A","Mr Pasin interjecting—","Housing","QUESTIONS WITHOUT NOTICE","/hansard/chamber.xscript/debate[12]/subdebate.1[5]/answer/talk.text/body/a[3]/p","N/A","N/A"
191,0,1,0,0,1,"MemberInterjecting",53517,"N/A","N/A","N/A","N/A"," And the member for Barker is definitely not helping his cause. Order. The Treasurer is going to continue with his answer.","Housing","QUESTIONS WITHOUT NOTICE","/hansard/chamber.xscript/debate[12]/subdebate.1[5]/answer/talk.text/body/p[5]","N/A","N/A"
192,0,1,0,0,1,"MemberContinuation",37998,"N/A","N/A","N/A","N/A","Dr CHALMERS: Thank you, Mr Speaker. He cant organise a responsible economic policy and he cant organise a photographer to take a photo of his dodgy little prop. What hope do they have over there when this bloke is the key economic spokesperson for their party?","Housing","QUESTIONS WITHOUT NOTICE","/hansard/chamber.xscript/debate[12]/subdebate.1[5]/answer/talk.text/body/p[6]","N/A","N/A"
193,0,1,0,0,1,"MemberInterjecting",53517,"N/A","N/A","N/A","N/A"," The Treasurer will return to the question.","Housing","QUESTIONS WITHOUT NOTICE","/hansard/chamber.xscript/debate[12]/subdebate.1[5]/answer/talk.text/body/p[7]","N/A","N/A"
194,0,1,0,0,1,"MemberContinuation",37998,"N/A","N/A","N/A","N/A","Dr CHALMERS: As the Prime Minister made clear yesterday, when he was asked a very similar question, our focus, when it comes to housing, is elsewhere. Our focus is on $32 billion of new investment, including $6 billion in the last budget, to the great credit of the housing minister, who fought for and secured a really substantial boost to housing in the budget. So our focus, when it comes to housing supply, is in new funding in the budget. When it comes to tax reform, once again, our focus is elsewhere. Our focus in tax reform is multinational tax arrangements, so I shout out the assistant minister for introducing the legislation this week to help ensure that multinationals pay their fair share. I know that this is a longstanding commitment from the assistant minister. I pay tribute to him for his work. Our focus when it comes to tax reform is not on the question that we were asked a moment ago. Our focus is on multinationals. Our focus is on build to rent, which you voted against. Our focus is on the PRRT—","Housing","QUESTIONS WITHOUT NOTICE","/hansard/chamber.xscript/debate[12]/subdebate.1[5]/answer/talk.text/body/p[8]","N/A","N/A"
195,0,1,0,0,1,"MemberInterjecting",53517,"N/A","N/A","N/A","N/A"," The Treasurer will pause. The Leader of the Opposition on his point of order.","Housing","QUESTIONS WITHOUT NOTICE","/hansard/chamber.xscript/debate[12]/subdebate.1[5]/answer/talk.text/body/p[9]","N/A","N/A"
196,0,1,0,0,1,"MemberInterjecting","00AKI","N/A","N/A","N/A","N/A","Mr Dutton: Like yesterday, this is a very tight question. Will the Prime Minister guarantee that a government he leads will not make any changes to tax treatment of residential rental properties? The Treasurer has done everything to avoid answering this question, but it is telling that he wont answer it, that the Prime Minister refuses to even make one comment—","Housing","QUESTIONS WITHOUT NOTICE","/hansard/chamber.xscript/debate[12]/subdebate.1[5]/answer/talk.text/body/p[10]","N/A","N/A"
197,0,1,0,0,1,"MemberInterjecting",53517,"N/A","N/A","N/A","N/A"," Resume your seat. Youre making a point on relevance. Its okay. Order! I just require you not to make additional statements as part of the question, alright? Were going to deal with this point of order, and then Ill call the Leader of the House.","Housing","QUESTIONS WITHOUT NOTICE","/hansard/chamber.xscript/debate[12]/subdebate.1[5]/answer/talk.text/body/p[11]","N/A","N/A"
198,0,1,0,0,1,"Mr Dutton ","00AKI","N/A","N/A","N/A","N/A","Mr Dutton interjecting—","Housing","QUESTIONS WITHOUT NOTICE","/hansard/chamber.xscript/debate[12]/subdebate.1[5]/answer/talk.text/body/a[4]/p","N/A","N/A"
199,0,1,0,0,1,"MemberInterjecting",53517,"N/A","N/A","N/A","N/A"," Youll get the call straight away.","Housing","QUESTIONS WITHOUT NOTICE","/hansard/chamber.xscript/debate[12]/subdebate.1[5]/answer/talk.text/body/p[12]","N/A","N/A"
200,0,1,0,0,1,"MemberInterjecting","00AKI","N/A","N/A","N/A","N/A","Mr Dutton: Mr Speaker, on that basis, I ask that you direct the minister to be relevant to the question, and that is a pretty reasonable request to make.","Housing","QUESTIONS WITHOUT NOTICE","/hansard/chamber.xscript/debate[12]/subdebate.1[5]/answer/talk.text/body/p[13]","N/A","N/A"
201,0,1,0,0,1,"MemberInterjecting",53517,"N/A","N/A","N/A","N/A"," It is a reasonable request, so I will ask the Treasurer to make sure—and I will listen carefully to make sure—he is being relevant. He did specifically say, The question I was asked about, and his answer was, Our focus is not on that; its on other issues, so I can appreciate the leader, under the standing orders, would like a yes or no—a rule in or rule out. But, as we have gone down this road many times, the Treasurer will need to phrase his answer to make sure he is being—","Housing","QUESTIONS WITHOUT NOTICE","/hansard/chamber.xscript/debate[12]/subdebate.1[5]/answer/talk.text/body/p[14]","N/A","N/A"
202,0,1,0,0,1,"Opposition members ","N/A","N/A","N/A","N/A","N/A","Opposition members interjecting—","Housing","QUESTIONS WITHOUT NOTICE","/hansard/chamber.xscript/debate[12]/subdebate.1[5]/answer/talk.text/body/p[15]","N/A","N/A"
203,0,1,0,0,1,"MemberInterjecting",53517,"N/A","N/A","N/A","N/A"," The Treasurer will need to make sure his answer is directly relevant, and my ruling is to ensure that he is directly relevant, that he must be on the topic and that hes got to ensure that he is addressing the question.","Housing","QUESTIONS WITHOUT NOTICE","/hansard/chamber.xscript/debate[12]/subdebate.1[5]/answer/talk.text/body/p[16]","N/A","N/A"
204,0,1,0,0,1,"MemberContinuation",37998,"N/A","N/A","N/A","N/A","Dr CHALMERS: I have addressed and am addressing the question when I say that our focus in tax reform and in housing reform is not on the issues that the shadow minister has asked us about.","Housing","QUESTIONS WITHOUT NOTICE","/hansard/chamber.xscript/debate[12]/subdebate.1[5]/answer/talk.text/body/p[17]","N/A","N/A"
205,0,1,0,0,1,"Opposition members ","N/A","N/A","N/A","N/A","N/A","Opposition members interjecting—","Housing","QUESTIONS WITHOUT NOTICE","/hansard/chamber.xscript/debate[12]/subdebate.1[5]/answer/talk.text/body/p[18]","N/A","N/A"
206,0,1,0,0,1,"MemberInterjecting",53517,"N/A","N/A","N/A","N/A"," Order! Members on my left! The member for Hume is warned. Hes had a great go this week, so hes not going to be interjecting. Im not having any of it on the last day, okay?","Housing","QUESTIONS WITHOUT NOTICE","/hansard/chamber.xscript/debate[12]/subdebate.1[5]/answer/talk.text/body/p[19]","N/A","N/A"
207,0,0,1,0,1,"Dick, Milton MP ",53517,"Oxley","ALP","N/A",71,"71 Dick, Milton MP (The SPEAKER) 53517 Oxley ALP","Housing","QUESTIONS WITHOUT NOTICE","/hansard/chamber.xscript/debate[12]/subdebate.1[5]/answer/interjection[1]/talk.start","N/A","N/A"
208,0,0,1,0,1,"71 Mr Ramsey ","N/A","N/A","N/A","N/A",71,"71 Mr Ramsey interjecting—","Housing","QUESTIONS WITHOUT NOTICE","/hansard/chamber.xscript/debate[12]/subdebate.1[5]/answer/interjection[2]/talk.start","N/A","N/A"
209,0,0,1,0,1,"Dick, Milton MP ",53517,"Oxley","ALP","N/A",71,"71 Dick, Milton MP (The SPEAKER) 53517 Oxley ALP","Housing","QUESTIONS WITHOUT NOTICE","/hansard/chamber.xscript/debate[12]/subdebate.1[5]/answer/interjection[3]/talk.start","N/A","N/A"
210,0,0,1,0,1,"71 Mr Taylor ","N/A","N/A","N/A","N/A",71,"71 Mr Taylor interjecting—","Housing","QUESTIONS WITHOUT NOTICE","/hansard/chamber.xscript/debate[12]/subdebate.1[5]/answer/interjection[4]/talk.start","N/A","N/A"
211,0,0,1,0,1,"Dick, Milton MP ",53517,"Oxley","ALP","N/A",71,"71 Dick, Milton MP (The SPEAKER) 53517 Oxley ALP","Housing","QUESTIONS WITHOUT NOTICE","/hansard/chamber.xscript/debate[12]/subdebate.1[5]/answer/interjection[5]/talk.start","N/A","N/A"
212,0,0,1,0,1,"72 Mr Pasin ","N/A","N/A","N/A","N/A",72,"72 Mr Pasin interjecting—","Housing","QUESTIONS WITHOUT NOTICE","/hansard/chamber.xscript/debate[12]/subdebate.1[5]/answer/interjection[6]/talk.start","N/A","N/A"
213,0,0,1,0,1,"Dick, Milton MP ",53517,"Oxley","ALP","N/A",72,"72 Dick, Milton MP (The SPEAKER) 53517 Oxley ALP","Housing","QUESTIONS WITHOUT NOTICE","/hansard/chamber.xscript/debate[12]/subdebate.1[5]/answer/interjection[7]/talk.start","N/A","N/A"
214,0,0,1,0,1,"Dick, Milton MP ",53517,"Oxley","ALP","N/A",72,"72 Dick, Milton MP (The SPEAKER) 53517 Oxley ALP","Housing","QUESTIONS WITHOUT NOTICE","/hansard/chamber.xscript/debate[12]/subdebate.1[5]/answer/interjection[8]/talk.start","N/A","N/A"
215,0,0,1,0,1,"Dick, Milton MP ",53517,"Oxley","ALP","N/A",72,"72 Dick, Milton MP (The SPEAKER) 53517 Oxley ALP","Housing","QUESTIONS WITHOUT NOTICE","/hansard/chamber.xscript/debate[12]/subdebate.1[5]/answer/interjection[9]/talk.start","N/A","N/A"
216,0,0,1,0,1,"Dutton, Peter Craig MP","00AKI","Dickson","LNP","N/A",72,"72 Dutton, Peter Craig MP 00AKI Dickson LNP","Housing","QUESTIONS WITHOUT NOTICE","/hansard/chamber.xscript/debate[12]/subdebate.1[5]/answer/interjection[10]/talk.start","N/A","N/A"
217,0,0,1,0,1,"Dick, Milton MP ",53517,"Oxley","ALP","N/A",72,"72 Dick, Milton MP (The SPEAKER) 53517 Oxley ALP","Housing","QUESTIONS WITHOUT NOTICE","/hansard/chamber.xscript/debate[12]/subdebate.1[5]/answer/interjection[11]/talk.start","N/A","N/A"
218,0,0,1,0,1,"72 Mr Dutton ","N/A","N/A","N/A","N/A",72,"72 Mr Dutton interjecting—","Housing","QUESTIONS WITHOUT NOTICE","/hansard/chamber.xscript/debate[12]/subdebate.1[5]/answer/interjection[12]/talk.start","N/A","N/A"
219,0,0,1,0,1,"Dick, Milton MP ",53517,"Oxley","ALP","N/A",72,"72 Dick, Milton MP (The SPEAKER) 53517 Oxley ALP","Housing","QUESTIONS WITHOUT NOTICE","/hansard/chamber.xscript/debate[12]/subdebate.1[5]/answer/interjection[13]/talk.start","N/A","N/A"
220,0,0,1,0,1,"Dutton, Peter Craig MP","00AKI","Dickson","LNP","N/A",72,"72 Dutton, Peter Craig MP 00AKI Dickson LNP","Housing","QUESTIONS WITHOUT NOTICE","/hansard/chamber.xscript/debate[12]/subdebate.1[5]/answer/interjection[14]/talk.start","N/A","N/A"
221,0,0,1,0,1,"Dick, Milton MP ",53517,"Oxley","ALP","N/A",72,"72 Dick, Milton MP (The SPEAKER) 53517 Oxley ALP","Housing","QUESTIONS WITHOUT NOTICE","/hansard/chamber.xscript/debate[12]/subdebate.1[5]/answer/interjection[15]/talk.start","N/A","N/A"
222,0,0,1,0,1,"Dick, Milton MP ",53517,"Oxley","ALP","N/A",72,"72 Dick, Milton MP (The SPEAKER) 53517 Oxley ALP","Housing","QUESTIONS WITHOUT NOTICE","/hansard/chamber.xscript/debate[12]/subdebate.1[5]/answer/interjection[16]/talk.start","N/A","N/A"
223,0,0,1,0,1,"Dick, Milton MP ",53517,"Oxley","ALP","N/A",72,"72 Dick, Milton MP (The SPEAKER) 53517 Oxley ALP","Housing","QUESTIONS WITHOUT NOTICE","/hansard/chamber.xscript/debate[12]/subdebate.1[5]/answer/interjection[17]/talk.start","N/A","N/A"
