"question_flag","answer_flag","interjection_flag","speech_flag","petition_flag","quote_flag","motionnospeech_flag","chamber_flag","name","name.id","electorate","party","role","page.no","content","subdebateinfo","debateinfo","path","Speaker","Time"
"0","0","0","1","0","0","0","1","BRUCE, Stanley","F4B","N/A","N/A","N/A","289","Obviously the price should be that which will give a man in any particular district a living. If we adopted as a basis for fixing the price either the return to a man using the most efficient methods or that to the man employing inefficient methods, we should arrive at an impossible position, and many farmers would be driven out of the industry. All these matters have to be taken into consideration. A fundamental difficulty is that, at the present moment, the states primarily concerned are not prepared to accept a scheme such as has been outlined by the honorable member for Wannon. The Commonwealth has control of exportation, but we could not give effect to the proposal within Australia. If the honorable member has put forward his scheme for discussion, it may serve a useful purpose, but as a definite proposal, by which the farmers may create a new world for themselves, it is misleading to them, and cannot lead us anywhere because of its obvious difficulties. I entirely subscribe to the view that it is vital that we should get rid of unnecessary middlemen, and prevent inordinate charges for services rendered, because these appreciably increase .the cost of production and retard progress. The fundamental difficulty in the way of the honorable members proposal is, I submit, that if we are to have legislation under which control of the whole of the produce of the people of this country and particularly the control of vital commodities is to be taken by the Government, we cannot stop there. We must take a second step. In such circumstances, it would be necessary to have price fixing, and we know the difficulties which such action would involve. We have, further, to recognize that if we accept that principle in relation to one industry we must accept it in respect of others. We could not have privileged industries receiving special treatment. There is another phase of the question with which I should like to deal. In Australia we have two classes of trade our overseas trade and the trade which we do in our own home market. We have to consider new and very difficult problems that are arising in Australia today because of local conditions which, prevail as a result of the policy deliberately adopted by the people. Under a policy of protection applied to both primary and secondary industries, we have gradually built up a number of our industries to a point at which the production exceeds local requirements, and we now have an expanding surplus that has to be disposed of in the markets of the world. When we had only to dispose of our products in our own market, or to place only a small surplus on the overseas markets, we were not confronted with grave difficulties, .because, with our standard of living and the comparatively high wages paid, the purchasing power of the community allowed our productions to be absorbed here at remunerative rates to those producing them. But, as soon as we have, in consequence of an increasing and everexpanding production, to seek a market overseas, and dispose of our surplus in competition with, all other countries, we are faced with new and very difficult problems. Recently, when speaking on this subject on behalf of the Government, I frankly admitted that we recognized this to be a problem with which we had to grapple. I indicated that if we were prepared to render a measure of assistance to our producers who had to seek their market within Australia, we must be prepared also to render an equivalent measure of assistance to those who had to seek their market outside, in competition with the producers of other countries. I said that we must give them an opportunity to compete on just and equitable terms, since part of the burden which had increased the cost of production was unquestionably due to the national policy of Australia the policy of Protection, plus the high standard of living to which we all subscribe, and which we are determined to maintain. We have to face that position. But that does not mean that any industry which finds itself faced with little difficulties in marketing its products overseas shall immediately be entitled to come to the Government and ask for a bonus, or assistance in some other form. We cannot proceed to deal in that way with every industry that can show that it is in trouble. We must have consideration for the whole of the people. If an industry is inefficiently conducted, or is marketing its produce overseas in a way which prevents it from obtaining the full return that it would otherwise secure,, it is not the duty of the country to make good the difference. It is for those engaged in the industry to put their own house in order. They are entitled to assistance only when these factors have been: eliminated, and the industry has been so organized that it can obtain the fullest, possible price for its produce in the overseas market. When in Great Britain last year, I went very closely into our marketing methods. I discovered that, without doubt, certain factors in connexion with the handling of our produce were handicapping our producers and preventing them from obtaining the fullest return for the commodities they were sending; overseas. Chief among these was the loss, of identity of Australian production ; so> that we did not get the advantage of the* sentiment towards the Dominions which, is increasingly evident in Great Britain,, nor did we get the advantage of an established continuous market where the excellence of our produce would5, be its own recommendation. Next to loss of identity was the irregularity of supplies. We were sending into the British market, at certain periods in the year, a tremendous quantity of produce. Then followed an interval of some months, during which supplies from Australia were either not? forthcoming, or not sufficiently large to> satisfy the market. In these circumstances, we were not obtaining the full advantages of the market we had created? for ourselves. We established a market, and just as we had created a demand, supplies ceased, and there was nothing with which to carry on. By the time that fresh supplies were forthcoming, the Australian article had been practically forgotten. Another disadvantage was that our produce went through too many hands. Australian, producers were competing: against themselves, with most unfavorable results. Where, for example, produce had been consigned and advances made against it, whenever the market looked at all uncertain, those who had made the advances hastened to get out. So long as they could see the possibility of getting their own. money back, they had no regard for the disadvantages that accrued to the Australian producer as the result of such action. Then there is difficulty associated with the financing of the small producer, which leads me to the point stressed by the honorable member for Wannon (Mr. McNeill), namely, the necessity for cooperation. Finance and cooperation are necessary for our producers if they are to obtain better returns for produce marketed overseas, because it is only .by these means that they can keep control over it for a longer period. The overseas market is one in regard to which the Commonwealth Government has a responsibility, and it has some authority, whereas it has none in the home market. With these facts in mind Ministers have faced the situation, and have done a great deal to improve the position of the Australian producer in the market, which is our direct responsibility. Last session we brought down measures dealing primarily with the dried fruit industry and the dairy produce industry. Had we not done this the dried fruit industry would have fallen on evil days, a large number of men who had been assisted to go on the land would have been compelled to surrender their holdings, production would have seriously diminished, and a very serious problem would have been created. Under the Dried Fruits Advances Bill the Government took over the financing of that industry for six months in order >that the financial crisis which seemed imminent might be overcome, and so that there might be a prospect of the industry meeting its difficulties. I remind the House of this because honorable members opposite seem to think that the Government has done nothing for the solution of this problem. The Government is always prepared to take action, but only when such action will benefit an industry and will not undermine initiative and enterprise on the part of the people. The Dried Fruits Control Bill and the Dairy Produce Export Bill were very much alike, but the boards appointed under them differed somewhat in constitution. These measures were framed to enable the industries, as far as the overseas market was concerned, to be in a better position, and to organize to bring about the better handling and marketing of their products. They, together with a guarantee bill which was passed, gave each industry control of its export trade. I have referred to the duplication in handling arrangements on the other side, and the competition between Australian sellers on the London market. The measures also provided for necessary advances, so that the smaller growers would not be forced to accept low prices to meet the demands of those who had been carrying them since the previous harvest. As a result of these measures I am confident we shall have a complete reversal of the position which previously existed in . Great Britain indeed, an improvement in the methods of marketing Australian dried fruit and butter can already be seen. In the past New Zealand butter . has always brought 10s. a cwt. more than Australian butter on the British market, but during the last few months Australian butter has been realizing more than the New Zealand product. There has also been a tremendous advance in the methods of marketing dried fruits. The way in which the present season is opening is largely due to the better basis upon which the marketing has been placed. The Government has taken very definite steps in the sphere in which the Commonwealth has authority and responsibility, and is achieving the objective which we all desire. The other phase of the question relating to efficiency falls more directly within the province of the states. The Commonwealth Government has made it clear to all the states that it regards efficiency in industry as of vital importance, and that it is prepared to cooperate with them in any proposal which it believes will tend to improve efficiency and generally to improve production. But we are prepared to give assistance only where it is necessary ; it is not our function to give assistance to industries that do not require it. We are inclined sometimes to lay too much stress on the difficulties with which we are faced. We speak of the disadvantage of being at a great distance from the markets of the world. I agree that it is a great disadvantage; but we must remember certain compensating advantages. In Australia we have a climate which is infinitely better than that of other countries with which we have to compete. The fertility of our soil as a whole is as great as that of any other country, and in certain parts incomparably better. We have also great advantages in the suitability of our country for certain products. Many other advantages are enjoyed by our different industries, and we should not forget that they assist us in bearing what is unquestionably a burden upon our export industry the standard of living that we insist upon iri Australia, and the protection we afford to our secondary industries. Keeping these facts in mind, the Government is prepared to extend to industries which have their overseas markets properly organized, and are efficient in their methods of production, a measure of assistance commensurate with that given to industries which supply markets in Australia. I have tried to show what the Government has done in the sphere where it has direct authority, and I suggest that it would be advisable for the State Governments to concentrate upon this problem in the spheres in which they have direct responsibility. The Commonwealth Government has approached the problem of organizing oversea markets with a view to eliminating unnecessary channels of distribution, and so organizing the marketing of our produce that the largest possible return will be received by the producer.","Second Reading","SUPPLY BILL (No. 1)","/hansard/chamber.xscript/debate[8]/subdebate.1/speech[5]/continue[5]/talk.start/para","N/A","N/A"
"0","0","1","0","0","0","0","1","STEWART, Percy","KV8","N/A","N/A","N/A","292","The trouble is that the State Governments are endeavouring to shuffle their responsibilities on to the Commonwealth.","Second Reading","SUPPLY BILL (No. 1)","/hansard/chamber.xscript/debate[8]/subdebate.1/speech[5]/interjection[6]/talk.start/para","N/A","N/A"
"0","0","1","0","0","0","0","1","MCGRATH, David","KRD","N/A","N/A","N/A","292","And the Commonwealth refuses to take any responsibility.","Second Reading","SUPPLY BILL (No. 1)","/hansard/chamber.xscript/debate[8]/subdebate.1/speech[5]/interjection[7]/talk.start/para","N/A","N/A"
"0","0","0","1","0","0","0","1","BRUCE, Stanley","F4B","N/A","N/A","N/A","292","When discussing a problem that is probably one of the most important with which this country is faced today, it ill becomes any of us to say that the Commonwealth or the states are shuffling their obligations on to one another. It is time that we all recognized that we must grapple with these problems and set ourselves determinedly to solve them. In the sphere in which the Commonwealth has direct control and responsibility, it has consistently followed the policy of trying to remove difficulties, improve methods, and get rid of the waste that is unquestionably occurring in the distribution of our products. The problem of our home market should be approached from the same angle, and all the states should set themselves determinedly to do something to lessen the cost of distribution, to the advantage both of the purchaser and the consumer. I want to make the policy of the Government perfectly clear to the House, so that there will be no possibility of misunderstanding. The Commonwealth Government is. not prepared to take over the control of industries, and to interfere with those whose legitimate function it is to control them. But it is prepared to render a measure of assistance to those who are willing to put their own house in order, by organizing their industries, and trying reintroduce the best possible methods of production and marketing. The Ministry, also, does not believe that any government should attempt to take complete control of industries, and to substitute new methods of handling and distribution for the machinery which has been, built up over a long period of years and has unquestionably, as the result of experience during that period, acquired qualities that we could not replace, if we attempted to displace it. We have to make the existing channels of distribution the servants of the community as a whole. We have to take advantage of the experience that has been gained, and of the machinery that has been built up. I agree that we have to obliterate unnecessary channels, and we have to make sure that the useful channels that must exist take only a fair return for the services rendered.. But I do not wish to leave any impression, on the minds of honorable members that I subscribe to the view, which apparently is held by honorable members opposite, that we should demolish the whole of our existing machinery, and that the Government should take over the control of industries and endeavour to distribute the whole of our produce. That could not be done, and any attempt to do it would increase the cost of distribution and bring disaster upon every section of the community. I also wish to make it clear that the Government stands for the principle of leaving to the individual the fullest possible measure of freedom. It does not wish to take any action that might undermine the initiative, the selfrespect, or the enterprise of the individual, for to do so would be fatal to the progress of Australia. That is where the Government parts company with honorable members opposite. We all recognize that in these times we must make progress in all our methods; that we must not stagnate, and that we must get rid of any lingering conservative idea that what is must remain. We have to improve our methods, hut I refuse to be a party to the proposal of the Opposition that we should take control of industry, interfere with the individual and undermine his initiative and enterprise. All we can do with advantage is to help those who are prepared to help themselves. A useful discussion can take place on the question that has been raised by the honorable member for Wannon. I regret that he did not deal with the subject in greater detail, and show the difficulties associated with carrying out his proposals. Had he done so, he would have given honorable members an opportunity to express opinions on the questions involved.","Second Reading","SUPPLY BILL (No. 1)","/hansard/chamber.xscript/debate[8]/subdebate.1/speech[5]/continue[6]/talk.start/para","N/A","N/A"
"0","0","0","1","0","0","0","1","MOLONEY, Parker","L4X","Hume","ALP","N/A","293",". I have listened to the Prime Minister very attentively. He accused the honorable member for Wannon (Mr. McNeill) of leaving many things unsaid. The same charge could, with full truth, bo levelled against the Prime Minister. He spoke of many things, and talked all round the subject without actually coming to the amendment moved by the honorable member. I remind him that the amendment asks the Government to take immediate steps to establish a compulsory wheat pool, and to enter into negotiations with the respective State Governments for that purpose. The Prime Minister doubts whether the Commonwealth Government has the legal power. I have heard quite a lot about that lately, and we know that certain people have come into office who refuse to stand up to the principles on which they were elected. In Victoria there is a Premier who, before he was Premier, had as the principal plank in his platform the creation of a compulsory wheat pool. He even caused a dissolution on the subject, and the people of this state, especially the farming section of the community, returned him on the understanding that he would work to bring about a compulsory pool. Yet when this gentleman got on to the Treasury bench he saw legal obstacles, and has failed to give effect to the principles on which he was elected.","Second Reading","SUPPLY BILL (No. 1)","/hansard/chamber.xscript/debate[8]/subdebate.1/speech[6]/talk.start/para","N/A","N/A"
"0","0","1","0","0","0","0","1","MANNING, Arthur","KMS","N/A","N/A","N/A","293","That is another example of the irresponsibility of men in Opposition.","Second Reading","SUPPLY BILL (No. 1)","/hansard/chamber.xscript/debate[8]/subdebate.1/speech[6]/interjection[1]/talk.start/para","N/A","N/A"
"0","0","0","1","0","0","0","1","MOLONEY, Parker","L4X","N/A","ALP","N/A","293","It is another example of a man running away from the principles on which he was elected. We have had many similar examples in this House. It is interesting to know what the Premier of Victoria thinks the Prime Minister of Australia should do. The Prime Minister says he has no responsibility, and that it is a state matter, but the State Government says that it is a federal matter. The two Governments shift on this question as they shift on the unemployment question. The Prime Minister says that unemployment has nothing to do with the Commonwealth, and the State Government says that it is a federal matter, with the result that people are walking the streets looking for work. I should like the Prime Minister to know what Mr. Allan, the Premier of Victoria and Leader of the Country party in this state, thinks about this matter. He obtained the advice of two legal luminaries, and they provided him with a letter, in which it was stated that the State Government had not the power to establish a compulsory pool, notwithstanding that another eminent legal authority declared that there was ample power. The Countryman, the official organ of the Country party in Victoria, in an article based upon the advice of these two lawyers, said","Second Reading","SUPPLY BILL (No. 1)","/hansard/chamber.xscript/debate[8]/subdebate.1/speech[6]/continue[1]/talk.start/para","N/A","N/A"
"0","0","0","0","0","1","0","1","MOLONEY, Parker","L4X","Hume","ALP","N/A","293","Mr. Allan has, however, a duty to perform there is no reason why he should not exercise it immediately and that is to refer the request of the wheatgrowers of Victoria to the Prime Minister (Mr. Bruce) for action to he taken by the Commonwealth Government.","Second Reading","SUPPLY BILL (No. 1)","/hansard/chamber.xscript/debate[8]/subdebate.1/speech[6]/quote/para","N/A","N/A"
"0","0","0","1","0","0","0","1","FREE NODE","N/A","N/A","N/A","N/A","N/A","It is well for those honorable members who sit in the Ministerial corner, and who accept this journal as the official organ of their . party, to know what it expects of them in connexion with the amendment now before the Committee. The Prime Minister has said that the Government cannot give effect to the amendment because it has not the power to do something that involves a number of states, and that after travelling through Australia he has grave doubts whether the wheatgrowers desire a compulsory pool. Let us consider the opinion of the wheatgrowers as far as we know it. In Victoria not long ago a vote was taken of the wheatgrowers, and by nearly 13,000 to 1,000 votes they declared in favour of a compulsory wheat pool.","Second Reading","SUPPLY BILL (No. 1)","/hansard/chamber.xscript/debate[8]/subdebate.1/speech[6]/para","N/A","N/A"
"0","0","1","0","0","0","0","1","FOSTER, Richard","KFP","N/A","ANTISOC; LP from 1910; NAT from 1917; LP from 1922; NAT from 1925","N/A","294","How many did not vote?","Second Reading","SUPPLY BILL (No. 1)","/hansard/chamber.xscript/debate[8]/subdebate.1/speech[6]/interjection[2]/talk.start/para","N/A","N/A"
"0","0","0","1","0","0","0","1","MOLONEY, Parker","L4X","N/A","ALP","N/A","294","The honorable member is never caught without an excuse. He wishes to know the opinions of those who did not vote. Those who voted were those who were most interested. I suppose many people in my honorable friends electorate did not vote at the last election. But does he say that they were opposed to him? If they were he should walk out of this House, since it is clear, then, that he represents a minority. He claims to reflect the views of .the people of his electorate, but I suppose he does not take into account those who remained away and did not take the trouble to vote. Those who voted on the question of a compulsory wheat pool voted twelve to one in favour of it.","Second Reading","SUPPLY BILL (No. 1)","/hansard/chamber.xscript/debate[8]/subdebate.1/speech[6]/continue[2]/talk.start/para","N/A","N/A"
"0","0","1","0","0","0","0","1","FOSTER, Richard","KFP","N/A","N/A","N/A","294","Let the honorable member try his little dodges on some one else.","Second Reading","SUPPLY BILL (No. 1)","/hansard/chamber.xscript/debate[8]/subdebate.1/speech[6]/interjection[3]/talk.start/para","N/A","N/A"
"0","0","0","1","0","0","0","1","MOLONEY, Parker","L4X","N/A","ALP","N/A","294","Evidently the honorable member has not come off very well as the result of his interjection. The Prime Minister said that during the war the wheat pool served its purpose, and that, although we were then able to assume certain powers, now the war was over there were difficulties in the way. I would point out to him that after the war the New South Wales Labour Government established a compulsory pool, which did effective and splendid work in the interests of the wheatgrowers. There would be no difficulty in establishing a pool in New South Wales or Victoria, and if those states the two .great wheatproducing states of the Commonwealth asked for a compulsory pool, the other states .could not afford to remain outside.","Second Reading","SUPPLY BILL (No. 1)","/hansard/chamber.xscript/debate[8]/subdebate.1/speech[6]/continue[3]/talk.start/para","N/A","N/A"
"0","0","1","0","0","0","0","1","GREGORY, Henry","KFE","N/A","N/A","N/A","294","Was there not a difficulty in New South Wales in receiving payment for wheat?","Second Reading","SUPPLY BILL (No. 1)","/hansard/chamber.xscript/debate[8]/subdebate.1/speech[6]/interjection[4]/talk.start/para","N/A","N/A"
"0","0","0","1","0","0","0","1","MOLONEY, Parker","L4X","N/A","ALP","N/A","294","No.","Second Reading","SUPPLY BILL (No. 1)","/hansard/chamber.xscript/debate[8]/subdebate.1/speech[6]/continue[4]/talk.start/para","N/A","N/A"
"0","0","1","0","0","0","0","1","GREEN, Albert","KF9","N/A","ALP; FLP from 1931; ALP from 1936","N/A","294","There was a compulsory pool in Western Australia.","Second Reading","SUPPLY BILL (No. 1)","/hansard/chamber.xscript/debate[8]/subdebate.1/speech[6]/interjection[5]/talk.start/para","N/A","N/A"
