"question_flag","answer_flag","interjection_flag","speech_flag","chamber_flag","stage_direction_flag","speaker_no","name","name.id","electorate","party","role","page.no","content","subdebateinfo","debateinfo","path","Speaker","Time"
"0","0","1","0","1","0","80","Claydon, Sharon MP ","248181","Newcastle","ALP","N/A","1203","N/A","Referendum (Machinery Provisions) Amendment Bill 2022","BILLS","/hansard/chamber.xscript/debate[9]/subdebate.1/subdebate.2/speech[7]/interjection/talk.start","N/A","N/A"
"0","0","0","1","1","0","82","N/A","N/A","N/A","N/A","N/A","N/A","I'm sad to inform the House of the passing of a veritable giant of the shooting industry, Mr David Auger. David was a larger-than-life character. A person to always speak his mind, David was brutally honest. We often joked that he was a great salesman but would make a terrible politician.  Born in the UK, David emigrated to Australia when he was 19. He brought his spirit and energy with him, as well as his lovely wife, Julie. When David was 24 and Julie was 20, they bought their first business together: Gladstone Guns. Due to their hard work, dedication and David's incredible knack for selling, they grew their business and moved to Brisbane, opening a business in Fortitude Valley. When David acquired the rights to sell Rigby rifles in Australia, the previous distributor said to him, 'You won't sell one in this country.' Unfazed and—knowing David—taking the statement as a challenge, he went on to sell more Rigby rifles than the rest of the distributors worldwide combined, outside of the UK. However, David's greatest pride and joy were his children and grandchildren. I know he was very proud of his son, Tom, for all that he'd achieved in his life, including taking over the business that David and his wife had created. Thank you, David, for your friendship over many years. May you rest in peace.","Auger, Mr David","STATEMENTS BY MEMBERS","/hansard/chamber.xscript/debate[10]/subdebate.1[1]/speech/talk.text/body/p[1]","Mr VASTA (Bonner) ","(13:30):"
"0","0","0","1","1","0","84","N/A","N/A","N/A","N/A","N/A","N/A","It's been great to meet with local sporting clubs over the last two weeks to see the upgrades to their facilities. Southern Districts play out of Cirillo Reserve, which is a unique facility to support women and girls to reach their full potential. It was wonderful to meet with former Matildas player Catherine Cannuli, who is the coach and manager of the Southern Districts competition, to discuss the Albanese government's election commitment for upgrades to this ground.  I also caught up with Kemps Creek United Soccer Club's Ross and Michael, who showed me the difference the Stronger Communities grant had made. They've put in special synthetic turf, which this season will make the goal mouth more playable. I'd also like to thank Darcy Lound, president of the Macarthur Rams Football Club, for the invitation to attend this year's competition launch. On the night, it was a delight to hear the clubs' positive stories from last year and their goals for the 2023 season. The competition has over 10,000 players aged from five to over 55, with girls, boys, women and men playing this year. Most clubs report significant increases in players, especially in the women's competition. It's lovely to see all of our communities come together to support our local teams, and I hope that this year they'll see an even greater turnout. I look forward to following the success of all our soccer teams this year.","Werriwa Electorate: Soccer Facilities","STATEMENTS BY MEMBERS","/hansard/chamber.xscript/debate[10]/subdebate.1[2]/speech/talk.text/body/p[1]","Ms STANLEY (Werriwa—Government Whip) ","(13:31):"
"0","0","0","1","1","0","86","N/A","N/A","N/A","N/A","N/A","N/A","Before the election, this government made a rush of promises, only to see so many of them broken. Remember the promise to cut your power bill by $275, a promise made over 90 times? Broken! Remember the promise of cheaper mortgages? Broken! Remember the promise of lower inflation? Broken! Now, in the chaos of the last two weeks, we've heard from the Prime Minister, the Deputy Prime Minister, the Treasurer and our favourite incompetent minister, the Assistant Treasurer, about the promise of no changes to super: broken, broken and broken! This government simply can't be trusted.  Frankly, Labor are making it up as they go—as in the Assistant Treasurer making out it's all about 'the hive' and about honey for everyone in the hive. Within the last two weeks, the Prime Minister has not ruled out further cuts to superannuation. The Treasurer refuses to rule out changes to negative gearing. The Treasurer, staggeringly, also refused to rule out changes to the capital gains tax exemption on the family home—only for the Prime Minister to run out on Patricia Karvelas's show and say, 'No, no; we're not going to do anything,' and for the Treasurer to then say: 'Oh, okay. I guess you're right, Prime Minister.' Labor can't be trusted when it comes to money. When they run out of money, they come after everyone's.","Superannuation: Taxation","STATEMENTS BY MEMBERS","/hansard/chamber.xscript/debate[10]/subdebate.1[3]/speech/talk.text/body/p[1]","Mr ROBERT (Fadden) ","(13:33):"
"0","0","0","1","1","0","88","N/A","N/A","N/A","N/A","N/A","N/A","I rise today to acknowledge the voices of young people in Jagajaga and to reassure them that their voices are being heard in this parliament and by our government. I'm very conscious that, for many young people, federal parliament can feel like it's a long, long way away from their concerns. That's why I thought it was important to host a youth forum in my community last week to bridge some of that divide. It was so good to have our youth minister, Anne Aly, attend the forum and explain how our government is making sure the views of our young people are part of our policy making. It was important for the minister and I to hear about what is important to young people in Jagajaga at the moment, and that includes cost of living, rising rents, access to and affordability of higher education, access to mental health care, and the Voice to Parliament.  Separately, I want to acknowledge the advocacy of young people from the Somali community in Jagajaga, who previously told me there was a huge need for mental health support but it wasn't being met. Thank you to Assistant Minister for Mental Health Emma McBride for coming to meet directly with these young people and hear their suggestions for culturally appropriate, locally accessible mental health services. The young people of Jagajaga are wonderful advocates for their futures and for the future of our community. I want them to know that I am listening, our government is listening, our ministers are listening and we will continue to work with them to deliver a better future for them and for our entire community.","Jagajaga Electorate: Youth","STATEMENTS BY MEMBERS","/hansard/chamber.xscript/debate[10]/subdebate.1[4]/speech/talk.text/body/p[1]","Ms THWAITES (Jagajaga) ","(13:34):"
"0","0","0","1","1","0","90","N/A","N/A","N/A","N/A","N/A","N/A","Today I want to share my deepest sympathies to everyone impacted by the horrific earthquake that took place in Turkiye and Syria in the early hours of 6 February. I can't even imagine the absolute terror endured by the men, women and children trapped in the middle of this catastrophe. My heart goes out to the first responders and aid workers who had the insurmountable task of digging through the mounds of rubble. No doubt the communities impacted are grateful for their presence, and I can only hope that they find the light at the end of this very dark tunnel soon.  This tragedy has impacted people from all over the world, and in my area of Fowler our Turkish and Syrian community are feeling the pain and loss. Mrs Melissa Michael of Edensor Park recently told me about her family who live in Adana, Turkiye, and the fear she experienced in the moments of the quake. It's hard to imagine the trauma of not knowing if your loved one survived. This is a difficult and tragic time for families in Fowler who have lost loved ones. To the families and everyone affected by the Turkiye and Syria earthquake, I offer my sincere sympathies, and we pray for your resilience through this very difficult time.","Turkiye and Syria: Earthquake","STATEMENTS BY MEMBERS","/hansard/chamber.xscript/debate[10]/subdebate.1[5]/speech/talk.text/body/p[1]","Ms LE (Fowler) ","(13:36):"
"0","0","0","1","1","0","92","N/A","N/A","N/A","N/A","N/A","N/A","Yesterday I was pleased to attend two of the local mosques in the electorate of Lalor for Open Mosque Day. I attended in the company of: Dylan Wight, member for Tarneit; Sarah Connolly, member for Laverton; deputy mayor, Councillor Jennie Barrera; and Vivienne Nguyen from the Victorian Multicultural Commission. I attended the Virgin Mary Mosque, where the Imam Sheikh Abdullah Hawari welcomed us to the mosque and took us through some interesting information about Islam and the value of the mosque in the community. I'd like to thank President Sheikh Hanif and the team there. I also saw representatives of Victoria Police and the Wyndham Interfaith Network represented by our good friend Lawrence.  I then attended the Melbourne Grand Mosque in Tarneit, where Sheikh Nawas gave us a presentation on, again, growing understanding around the mosque and how it is a cultural place as well as a religious place. I want to thank President Rifai Abdul Raheem and the other directors. There was also the President of the Islamic Council of Victoria, Adel Salman. It is my pleasure to represent the growing Islamic community in my electorate of Lalor. It brings home to us just how important that connectivity is between our communities, and I am so proud to represent a multilingual, multifaith community.","Lalor Electorate: Victorian Mosque Open Day","STATEMENTS BY MEMBERS","/hansard/chamber.xscript/debate[10]/subdebate.1[6]/speech/talk.text/body/p[1]","Ms RYAN (Lalor—Chief Government Whip) ","(13:37):"
"0","0","0","1","1","0","94","N/A","N/A","N/A","N/A","N/A","N/A","In Curtin, hospitals and higher education are two of our largest employers, creating a hotbed of health and medical research, innovation and commercialisation in the suburb of Nedlands. We have so much potential to lead the world in creating and commercialising lifesaving medical solutions. Nedlands has three current and two proposed hospitals, six medical research institutes and a centre for early-phase clinical trials and is the home of the University of Western Australia.  In recent weeks I've had the opportunity to meet some of the incredible organisations in Nedlands doing this work. For example, the Harry Perkins Institute of Medical Research is building a comprehensive atlas of the cell types that make up cancer tumours, and the Parent Institute is undertaking cutting-edge research on a broad range of neurological conditions. And it's not just research: UWA has partnered with the Harry Perkins institute to support pathways into burgeoning local med-tech start-ups. Last week the Minister for Industry and Science, Ed Husic, and I visited OncoRes Medical to hear how they're manufacturing equipment to help surgeons remove all of the cancer the first time. But WA is seriously under-represented in NHMRC funding, with applicants three times as likely to be successful in Victoria as in WA. The innovation happening in the suburbs of Perth deserves national recognition. This is also the perfect opportunity for support under the medical science priority area of the National Reconstruction Fund to build on this strength and support this innovation ecosystem.","Curtin Electorate: Medical Research","STATEMENTS BY MEMBERS","/hansard/chamber.xscript/debate[10]/subdebate.1[7]/speech/talk.text/body/p[1]","Ms CHANEY (Curtin) ","(13:39):"
"0","0","0","1","1","0","96","N/A","N/A","N/A","N/A","N/A","N/A","It's March into Yellow—Endometriosis Awareness Month. It's a chance for all of us to don yellow to raise awareness of this debilitating and chronic disease. One in nine women and girls in Australia are affected by endometriosis, and quite often they have been told throughout their lives to 'just put up with it and get over it', 'it's just something that women go through'. We now know a lot more about endometriosis, and March is the chance to raise awareness.  This government is acting. There is $80 million in funding towards the National Action Plan for Endometriosis. It involves, apart from education and awareness-raising, funding that is going towards pelvic pain clinics and key organisations. I congratulate and thank the many organisations and partners that are involved in Endometriosis Australia, endometriosis patients and their families for their continued advocacy and campaigning on this issue. Standing here today, I don't feel that I've done my former colleague Gai Brodtmann justice. She was a true endo warrior and would get all of us in yellow and up on our feet not just in March but every month to remind us that we have a role to play in this place to keep endometriosis on the agenda so that fewer women and girls suffer into the future. This month: wear yellow, and let's raise awareness around endometriosis.","Endometriosis Awareness Month","STATEMENTS BY MEMBERS","/hansard/chamber.xscript/debate[10]/subdebate.1[8]/speech/talk.text/body/p[1]","Ms CHESTERS (Bendigo) ","(13:40):"
"0","0","0","1","1","0","98","N/A","N/A","N/A","N/A","N/A","N/A","I congratulate Taree's Kody Garland for his career best and first ever podium finish at AWC Race Tasmania's opening season race at Symmons Plains Raceway. He was driving a Peugeot 308. Kody kicked off the weekend with a strong seventh in the qualifying round, got fifth place on the poll to start and ended up on the podium.  Also doing great stuff in the Lyne electorate is OzFish Unlimited's Manning chapter, who held a Clean Up Australia Day event at John Oxley Reserve in Harrington. It was a great opportunity for the community to get involved and raise awareness about marine litter and how to manage everyday plastics issues, something that our recreation fishing community is absolutely passionate about. Well done to OzFish's Manning team and the community volunteers, including MidCoast Council workers, Manning Landcare and Manning Valley Kayaking. Another great event in my electorate of Lyne was Bush Poetry at the Saleyards, organised by Brian Beesley and Gloucester Rotary Club. This event serves as a fundraiser for a range of community projects. Congratulations to Brian and Gloucester Rotary for their outstanding efforts on behalf of our community. I'll also give a shout-out to Ron Green and the Hawks Nest Tea Gardens Probus Club members, who recently celebrated 35 years of friendship, fellowship and fun with a luncheon to mark the occasion—a great achievement for past and present Probus members.","Lyne Electorate: Community Events","STATEMENTS BY MEMBERS","/hansard/chamber.xscript/debate[10]/subdebate.1[9]/speech/talk.text/body/p[1]","Dr GILLESPIE (Lyne) ","(13:42):"
"0","0","0","1","1","0","100","N/A","N/A","N/A","N/A","N/A","N/A","Trove is our nation's finest resource for national history, records and events, and as a result is envied around the world for its unparalleled access and unparalleled capabilities. Among journalists, historians, researchers and keen members of the public, Trove is considered much more than a national treasure that must be protected; it's a core element in their ability to do their jobs. I recently spoke with renowned local historian Jeff McGill about this matter, and he told me how Trove has greatly aided him in his historical research of the Macarthur region. His most recent book, Rachel, which is about his forebear Rachel Kennedy, was completed through extensive and much-appreciated research through Trove. I know too that the Campbelltown and Airds Historical Society also relies on Trove to assist them in compiling information about our region and is greatly appreciated by their members and the wider community.  On a personal note, I've found Trove to be incredibly useful, as has my wife, Sharon, who's a librarian. On a light-hearted note, I found through Trove that my grandfather was arrested for speeding in one of his tourist buses for the third time in one day in the 1920s! I believe Trove should be preserved at all costs, and that requires ongoing funding to ensure it remains free of charge and available to all Australians. I implore the Leader of the House and the minister for the arts to make sure the government funds Trove so that it remains available to everyone who needs it.","Trove","STATEMENTS BY MEMBERS","/hansard/chamber.xscript/debate[10]/subdebate.1[10]/speech/talk.text/body/p[1]","Dr FREELANDER (Macarthur) ","(13:43):"
"0","0","0","1","1","0","102","N/A","N/A","N/A","N/A","N/A","N/A","I inform the House of two recent electorate visits by shadow ministers and thank them for meeting with my constituents. The Deputy Leader of the Opposition, the member for Farrer, visited Moore in her capacity as the shadow minister for small and family business and the shadow minister for industry, skills and training. She addressed the Joondalup Business Association and participated in a Q&A forum on local issues. From there, we visited Carpet Choices, where we heard from proprietor Steve Blackwood about the challenges in training apprentices required to install floor coverings. The next stop was the College of Electrical Training in Joondalup for a briefing on the development of an innovation centre to deliver courses of study relevant to apprentices of the future, including in advanced battery technology, hydrogen fuel cells, robotics and innovation.  Last week, the member for Moncrieff, the shadow minister for early childhood education and shadow minister for youth, visited the Joondalup campus of Alta-1 college, where she witnessed firsthand the great work being done to support youth with unique learning needs to complete their secondary education, enabling them to progress onto vocational education and the workforce. This was followed by a forum in my office where leading early childhood educators raised their concerns about the challenge of recruiting qualified staff to work in their centres and the need to address this issue. (Time expired)","Moore Electorate: Vocational Education and Training","STATEMENTS BY MEMBERS","/hansard/chamber.xscript/debate[10]/subdebate.1[11]/speech/talk.text/body/p[1]","Mr GOODENOUGH (Moore—Second Deputy Speaker) ","(13:45):"
"0","0","0","1","1","0","104","N/A","N/A","N/A","N/A","N/A","N/A","In late January, the community of Eastwood was advised that their local post office would close on 3 March. Their landlord, the City of Ryde council, was set to demolish the building the post office sits in. This became the catalyst for the closure. Whilst the council offered an extension on their current site, they did not offer any alternative premises for lease, and, ultimately, Australia Post made the regrettable decision to close.  Eastwood is a thriving multicultural CBD. It's the home of countless small businesses, and many residents have relied on access to a post office. This closure will hit our community hard. Many members of the community reached out to me to express their concerns about how this closure would impact on them. Through a consultation process my office set up, we figured out the areas of highest use by businesses and locals. Through close work alongside Australia Post, we've been able to start the process to implement permanent solutions to ensure our area continues to receive the essential postal services it relies upon. We've been able to get a commitment to install 24/7 parcel lockers—we're just waiting on the council to secure a site—and to ensure more accessibility to passport applications and services across our region. Importantly, we've also been able to implement a permanent solution for all those small businesses and residents who have a PO box. I'd encourage all Eastwood PO box customers to contact Grace and her magnificent team at the Denistone East LPO. And I'd like to thank all those who responded to our Have Your Say.","Bennelong Electorate: Eastwood Post Office","STATEMENTS BY MEMBERS","/hansard/chamber.xscript/debate[10]/subdebate.1[12]/speech/talk.text/body/p[1]","Mr LAXALE (Bennelong) ","(13:47):"
"0","0","0","1","1","0","106","N/A","N/A","N/A","N/A","N/A","N/A","I'm sure every member of parliament will be only too keen to attest to the value of a great staff member. It's not the service they provide to us but, rather, the service they provide to our communities that fills us with gratitude and respect. In this vein, I'd like to take the opportunity to thank former staff member and very good friend Mr Michael Duff for having set up my office in the midst of a pandemic and who's now returned to his work with the Toowoomba Regional Council.  Michael is very well known in our community. His service to our community deserves recognition, be it for setting up kids' sports clubs, Tough Guy book clubs, or, most importantly, for being chief cattle steward at the Proston Show. Communities are built upon the actions of people who put service to others above themselves. I'm very grateful to have had Michael's spirit of service in my office. Michael always forced me to ask two questions of myself before taking any decision as the member for Groom: firstly, 'Do I believe it?' and, secondly, 'Is it good for the people of Groom?' It's a very good basis for any decision to be made. I've endeavoured ever since to keep this framework about me. I think it speaks to Michael's character that it was on these solid foundations that he sought to make Groom a better place. I give my personal thanks to Michael. I remember during the Wellcamp quarantine fiasco I often found myself feeling a little bit like Horatio on the bridge, wondering who would come out and stand beside me as I fought against this folly. I'm forever grateful and proud that you, Michael, were always there, right by my side. I thank you for your service and I thank you for your friendship.","Duff, Mr Michael","STATEMENTS BY MEMBERS","/hansard/chamber.xscript/debate[10]/subdebate.1[13]/speech/talk.text/body/p[1]","Mr HAMILTON (Groom) ","(13:48):"
"0","0","0","1","1","0","108","N/A","N/A","N/A","N/A","N/A","N/A","Today is Lymphedema Awareness Day. Last week, I met with lymphedema advocate Monique Bareham, who has been leading the charge for better recognition and better care for this condition. Lymphedema is an accumulation of fluid, lymph, in the tissues of the body, usually concentrated in a specific area. It is fundamentally a failure of the lymphatic system to collect fluid and eliminate it. Many people develop lymphedema as a result of cancer treatment or through major trauma such as surgery or injury, but this is not the only cause. One in 6,000 people are born with conditions that result in primary lymphedema.  Excessive swelling caused by fluid accumulation is painful and disfiguring. Untreated, it can lead to skin oozing liquid or splitting and infection. This leads to hospitalisations, which are expensive, time-consuming and disruptive to people's lives. Often people suffer for years with no idea of what is happening to them and no idea that there actually is treatment, and it's underrecognised in general practice. While lymphedema is not curable, it can be managed through exercise, massage and specially made compression garments. These garments need to be fitted, however, so they're quite expensive. Monique's vision is to have a standard model of care across Australia and standard levels of financial support for the garments. On Lymphedema Awareness Day, I'd like to bring this condition to the attention of my colleagues in this place, and thank Monique for her tireless advocacy.","Lymphedema Awareness Day","STATEMENTS BY MEMBERS","/hansard/chamber.xscript/debate[10]/subdebate.1[14]/speech/talk.text/body/p[1]","Ms MILLER-FROST (Boothby) ","(13:50):"
"0","0","0","1","1","0","110","N/A","N/A","N/A","N/A","N/A","N/A","We've got a lot of young sporting talent in Canning. One of our best took centre stage at the weekend, and that was local Indigenous man Alex Winwood, who took out the WBC international boxing title, earning his first international belt in Perth. Winwood was up against a former IBO champion in just his second main event and knocked him out in just four rounds. Alex has been building to this moment for some time, taking up the sport of boxing 10 years ago while still in high school. Since then, Alex has been hard at work training under his coach, Brian Sartori, at Mandurah's Eureka Boxing Club.  His success hasn't come easily. A good boxer must be able to take a punch, and he's had his setbacks. In 2016, Alex narrowly missed out on qualifying for the Rio Olympic Games. But he didn't let that stop him. Alex spent the next four years in training, eventually qualifying for the Tokyo 2020 Olympic Games and, later, the 2022 Commonwealth Games. He made headlines as the first Indigenous Australian announced to represent our country at the Tokyo Olympics and became a fan favourite when he performed a traditional Indigenous dance during the opening ceremony. His win at the weekend is yet another impressive achievement. On behalf of all of my electorate, we look forward to seeing him become the world champion.","Winwood, Mr Alex","STATEMENTS BY MEMBERS","/hansard/chamber.xscript/debate[10]/subdebate.1[15]/speech/talk.text/body/p[1]","Mr HASTIE (Canning) ","(13:51):"
